url,posttime,text,crawled_time,attachment_link,attachment_img,attachment_img_alt,attachment_title,attachment_brief
"https://www.facebook.com/permalink.php?story_fbid=1985009908282199&id=269000969883110","1542422692","原本都收看每晚8點的財經節目 後來沒了 後來都收看盤前8點25分的分析節目 自從選舉開跑 在等候看8點25分的節目時都看到播出的內容盡是說綠營有多好
藍營有多不好(我非是台灣人 所以沒有黨派觀念 純粹以看到的就事論事) 此時收看新聞報導 不知要收看那台 這幾天又看到一個唱台語的女歌者 哭得好悽慘
其因是不同黨的黨粉叫囂 就因為這樣哭成那個樣子 還說:我那裡錯了 妳沒錯 (只是余天站台時 不斷的問候對方候選人的祖宗 爸媽
那對方有錯嗎?對方也沒哭也沒一再的質問余天啊) 我來到台灣後 看到台灣的選舉 給我的感覺是真可怕 希望選舉趕快落幕 耳根子不再有噪音",1579230122,undefined,undefined,undefined,undefined,undefined
"https://www.facebook.com/permalink.php?story_fbid=1675131829270010&id=269000969883110","1521977394","","1571492452","https://www.facebook.com/photo.php?fbid=932134376964049&set=pcb.932134603630693&type=3&__tn__=HH-R&eid=ARBYyThcEuRIAN3BI-teFsP6317M9lE9aaxK1PyKzpG-TngUb7Fn_IyLg1Qt4S-J86EJS7tVQdwcPfyo&__xts__%5B0%5D=68.ARBNjyU0oJQLz_6jRuYxTgikRmR7j2G_4W0fc6lFIAelTzKYF82o6hBQ1v_TI5dYimONjFQy-_WaZTlhtlaG3OcoToLerEOibjXP9tf5waf7lvaZT4vFANWOPRtq_h0V0Ji7ojf0bhYsJElqYxgdtEHC7_3oJB7qFG82bH18ptTGKRvwzy8K2WiEyFNDXKAmonhB8pfAJfNI9MZJxcOtv3Iw8taProFniB1Pqf12GrOcFwWSm7GEUAR-cegaZV-byGVUBgTBIq8M7OX0ZpTFqhie_oiGugeO0Srv2zufLd22_9AgvbC_ZZa8ueTBCEJikXOo5nyIMwsOM7OK9pDilvYKuA","https://scontent-nrt1-1.xx.fbcdn.net/v/t1.0-0/p261x260/29511697_932134376964049_6084421452353863998_n.jpg?_nc_cat=105&_nc_oc=AQn8Idk1Kb0Hlwui8kaSZf9KYYn-SLvF2iKIRboUL-dCl8hYgR75uYv35ZXaWlcVRmI&_nc_ht=scontent-nrt1-1.xx&oh=0c1a3517846c0b08ddf476e40ce7879b&oe=5E300DE1","undefined","4",""
"https://www.facebook.com/permalink.php?story_fbid=2441926349257217&id=269000969883110&__tn__=-R","[Error]: TypeError: Cannot read property 'attribs' of undefined","",1579230116,undefined,undefined,undefined,undefined,undefined
