url,posttime,text,crawled_time,attachment_link,attachment_img,attachment_img_alt,attachment_title,attachment_brief
"https://www.facebook.com/permalink.php?story_fbid=880144128986258&id=506960246304650&__tn__=-R","1562030939","看完，一起來連署。","1571765306","/watch/?ref=external&v=1361234237364250&__xts__%5B0%5D=68.ARBq8ZvN5kolbMbWiJbOI7Y5f5b4Sf2A52bQ7aadkeO6GiS3kpwC07nI-hPAyhZDEzHexsW6uXSpfp9tb_hFZT_UBVqCLD-GSJa46zNCOq2bdRqkVQKyyKkh6R-zg1695iKx05mZwluWnuA9cGoFT3QOZpiylXtt4wg8hVwM7lBoYhGw2lM7mp4B1wEvy5faTyGtkJpxC3MecUxwPGZkyYvKlgJDt3nGCo69AcekefW_9GyVhPLOjx78tz4DVGrWTfNDpCV3Dknc7Clk0byx4RWO_17QKua5QQhhpCDgn5QM20pwU6s2oEfbZlWyquBoYYAXh-OFd4TmYwqz3EDOdRCrbvB3DXn132kP2p_lmeYEi4If9mMibMqwOzam2UeETSFYmj2LRqHqckTQsMkNUGHPRYfq0We2U0L2zmX2lqLHlb2Xv084t-CJnVZsk0SHeOltcX_Gv1mG8GTjSlMwAl4z25ZfnZKtosbkE0Iun-fMt539rufEQP_oq8Fh_nc45Q&__tn__=kFFHHH-R","https://scontent.fsub8-1.fna.fbcdn.net/v/t15.5256-10/65563566_1361239404030400_2944704173129596928_n.jpg?_nc_cat=101&_nc_oc=AQmM6X76cr0ytzNmltN0HUSEgKFx2W50Jbes3mUHVwKvmLHh1t-8pOI-jprHebVsFHI&_nc_ht=scontent.fsub8-1.fna&oh=c909110a673ead1a3abad77aeb3e7973&oe=5E5C798C","undefined","《徐董發大財 居民活受難》","Diposting oleh 地球公民基金會"
"https://www.facebook.com/permalink.php?story_fbid=820914824909189&id=506960246304650&__tn__=K-R","1553871633","[信仰是否有利於同志議題的發展] #佛教與基督教的性別對談 ＃釋昭慧 ＃陳文珊

 >>>>佛教代表：玄奘大學宗教學系暨研究所專任教授釋昭慧

 
我們先來看泰國的，泰國社會接納同志的程度比泰國僧團來得低，泰國僧團對同志的開明程度走在社會的前面。我去年跟一位泰國的比丘，他是一位同志比丘，跟他對談後，也從那裡暸解情形。他是一個比丘，又是一個同志，可見得泰國僧團並沒有排斥同志成為一個比丘。他也是在同志議題非常努力的，希望泰國也能夠同志婚姻合法化。他在我們的對談中還特別舉到一個例子，他們泰國有一位長得非常美麗的人妖，後來出家成為比丘，這位人妖在泰國很有名，跟我對談的比丘就把這個人妖在出家之前，跟出家之後的照片po在他的power
point上給我們看。當時也引起了社會的輿論，認為怎麼可以讓這種人出家，但僧團的角度是說，這位人妖他並沒有毀壞自己的性生殖器，他不是所謂的黃門，他們認為這樣並沒有違反戒律。

 
那從這個個案來看台灣，是的有幾個法師出來敲敲邊鼓（針對婚姻平權），事實上其實是因為護家盟，護家盟平以統一教為主體，護家盟平時廣結善緣到處去拜碼頭，所以法師們既然有了交情，有人要他們出來，他們就出來。那出來的時候還找不出一套佛教的論述，所以我記得現在的中國佛教會的理事長（當時他還不是），他幫忙站台反對婚姻平權的時候說：「哎呀！這個一陰一陽之謂道。」所以我就在臉書上寫說：「ㄟ！法師什麼時候改行做道士啦？」也就是說他論述都沒有準備好，他就準備要上戰場去湊一腳。在最激烈婚姻平權的論戰上，即便網路上有一些佛教徒的聲音，但不見得那麼準確，反而比較可怕的是，法師認同了以後，靠邊一站，就要拼命地為自己拼到底，所以在去年的婚姻平權的公投上，我也知道一些法師是投入的，甚至去要求他的信徒共同連署，這做法是非常的不應該，因為當他沒有一套論述走在前面，就在背後推動別人，要別人做一件在他自由意志下的公投決定，那所謂的自由意志也變得非常虛假。

 
到後來他們面找了一套說詞，說你看xxxx經跟xxxx經（49:28）有提到男根跟男根的接觸，也就是同志的性行為，是邪淫。那這裡面有涉及文獻學的問題了，因為佛典我們明確地說，沒有像聖經認為那是天啓的，即便聖經學者也不會認為所有語句都是天啓的，它其實可以看到以色列民族的民族史，跟他們許多民族宗教概念跟文化。那佛教本身就很明確地說是佛陀滅度以後，第二年夏天才結集，是靠弟子們，背誦出來的，而且這個背誦也不是一次完成，第一次結集完了大家背誦，主席主持會議，找記憶力最堅強的阿難，背誦經典。每背誦完，在座的五百阿羅漢證實確實如此，沒有誤差就pass過去，所以第一次的五百人集會，一般叫五百結集，這個五百結集不是結集的的終點，是結集的起點，然後一直陸續在結集。為什麼一直這樣做？因為不可能一次就講完的。在第一次結集的時候，大家為了把它記起來，但是用腦袋記起來而不是紙本把記起來，當然是要求比較精簡的修羅體，就是體裁是比較精簡化的，而這麼精簡的文句，不容易讓人全面理解佛陀當時是怎麼去表述的，所以在師徒傳授過程中，師長也會告訴徒弟當時佛陀怎麼說，弟子怎麼回答，就會講得比較詳細。這些詳細的陸陸續續地又結集出來，所以從這裡來看呢，這些結集是一直在進行當中，那麼我們如何能證明這兩部經典，是在最接近佛陀滅度以後，大家記憶尤新的時候結集呢？事實兩部經典他們的結集都是很晚的，在文獻學的考據上是比較晚的。

 
為什麼這兩個經典說同志是邪淫呢？我的看法是，當然這個文獻本身是比較後期的。第二個就是，有關於情慾的對待之道，佛家有分出家跟在家，兩者要求不同，兩者鎖定的人生目標不同，出家者希望修道成道，既然這樣的話情慾會障道，障礙修道。那麼在家者呢，他過得是一般世俗的生活，他不是過修道的生活，所以情慾對他來講沒有所謂障道不障道的問題，他的生活重點本來就不是修道，由於他們沒有經過一些修道的方法，來改變他們的體質，他們的生理需求也是需要的，因此對在家者是比較寬容的。既然這樣對於在家者，有沒有情慾上的限制呢？有的，那個限制呢，就是所謂的不邪淫，不邪淫對在家者的脈絡就是要護念相關人等的心情，包括配偶、下一代、無辜的第三者，以及無辜的受害者，都要考量進去，比如說受到性侵、性騷擾的，我們都要考量他的心情，他們的感受，避免他們的傷害，所以不邪淫是主要的規範，就是對相關利害人的規範，其精神就是護念眾生的心，不要因自己的慾念而傷害到眾生的心，不邪淫的規範主要是在護念眾生的脈絡上來看。

 
那麼假設這樣的話我們就會發現到說，這種法利賽主義是無所不在的，同樣在佛教裡面也有一些律法主義的人，他們非常的嚴苛。我認為他把出家眾的僧人的規定直接搬到在家眾，於是他們擴大解釋，包括非婚姻的同居就被當作邪淫，包括所謂的非道行淫，這個非道行淫包括同性的性器官的接觸，他認為那個不是正常管道，於是就被納為邪淫。

 
但是這裡面有一個問題出現，就是說非道行淫這件事，他到底是不是對在家眾的原始規範，他原來在僧團中是非常明確的，僧人不能夠異性戀者產生情慾的關係，但是不能夠投機取巧說：「好吧那我跟女性不可以，那我可不可以跟男性啊？」如果一個男的僧人這樣說的話，那律典裡面佛陀說不可以，這也是違背戒律的，那不能跟同性，那我可不可以跟動物？這個律典裡面說得很清楚，佛陀說不可以，這也是犯戒的，戀屍癖也不可以，對物品也不可以，所以他是列了許多。

 
但是這些直接拿去套到在家眾，我們就要問說這以上所說的非道行淫，有傷害到誰了嗎？因為我們前面講不邪淫主要是要護念眾生，同志跟同志如果彼此之間都沒有既定的配偶，到底有傷害到誰了嗎？你們可以說因為我看不順眼啊！那看不順眼的事情可多了！總不能你看不順眼我們就把它當成禁忌，事實上某種程度來講我對異性戀太親密其實也看不順眼啊！因此我們也總不能說連異性戀也不准嘛！所以看不順眼真的不是理由，那麼更何況，假設我們一直聚焦在這個地方，來談到非道行淫就是錯誤，我比較覺得比較好奇的就是說，世到與非道有這麼大的差別嗎？難道說他所認為的世道就比較高尚，男女的性器官接觸比較高尚，非這種標準規格的男女性器官接觸就是不高尚嗎？那高尚不高尚的理由不能講給我們聽呢？

 
事實上從佛法的觀點來看，所有的慾，都是本能啦！本能就沒有所謂的罪也沒有所謂的神聖，所有的慾都是動物本能，所以它是所謂的無忌，就是不忌別它的善與惡，所以無忌。從這裡來看，哪裡用某一種性器官的接觸就比較高尚。我們又何必把注意力去聚焦在人家的褲襠裡的性器官是怎麼接觸的，然後來判定他到底是高尚還不高尚，這個是一個非常奇特的一件事，其實當然還包括我們說的同居等等，同居彼此都沒有原先的配偶，到底是不是構成邪淫，其實也是可以再探討的，事實上所有對於慾念的過度縱容，都可以說是邪淫的，對於慾念過度的氾濫，那個是無分異性跟同性的，因為異性戀者也有很多劈腿，同性戀者也有很多是非常堅貞，在裡面都有他的個別差異，無論從嚴或從寬，我都看不出來必須要畫一條線在同性跟異性之間，來判別他的邪淫與否。這個是我針對關於這個信仰對於同志婚姻的開展的好處，特別提到最多最多是在邪淫大做文章，可是我覺得那沒有太大的殺傷力。要從嚴論述的話通通都很受限，要從寬論述的話我們談到的同志案例其實通通都是可以過關的。

 >>>>基督教代表：玉山神學院助理教授陳文珊

 
宗教右派在美國的興起，基本教義派傾向字面裡解聖經，在特定的道德議題採取非常保守的立場。在美國這樣非常激烈的運動，開始透過國際政治的關係向外擴散，而台灣在這樣的國際浪潮裡受到影響。台灣開始有一些社會學的研究開始說，台灣的宗教右派從2015-2016，信心希望聯盟開始說要以基督徒的方式來組一個標榜自己是基督徒的政黨，從當中可以看到台灣的宗教右派在當眾茁壯了起來，主要傳入的管道有韓國、香港、還有直接從美國，護家盟有直接從美國的愛家協會邀請他們進來，教導台灣基督教反同極右的基督教團體，如何來做議會的遊說、怎麼樣去政策方面的施壓，所以會發現基督教從來沒有積極參與很多社會議題，甚至用公投要罷免，某個立法委員，突然之間基督教變得非常積極參政，這個原因除了聖經之外，我想還有一些事情是要去釐清的就是「宗教傳統」。

 
基督教這個傳統就是相當看重家庭價值，看重家庭價值讓美國一些學者認為，這件事情導致，會比以前判別異端的議題，更嚴重地撕裂基督教，美國的學者（01:03:38）說，美國經歷在家庭議題的衝擊及立場上的衝突，甚至撕裂兩個基督教甚至變成兩個美國基督教，有一派強調保守的價值認為只能夠在婚姻裡面有性行為，最重要的目的是要生養眾多，而且只有在一男一女的家庭裡，小孩才能夠得到比較好的成長，婚姻、性、家庭就被綁在一起，我經常在私底下談話時，戲稱這是基督教的新三位一體，基督教的信仰傳統會說聖父、聖子、聖靈是三位一體，到了現今的基督教，婚姻、性、家庭當成是新的三位一體，他們認為你好像不認同這樣的價值，你就不配稱為真基督徒，這些論述的根源是來自基督教的根源——看重家庭價值。

 
雖然基督教裡有人守獨身的，可是基督教的信仰一直看待家庭除了是有社會組織的最小單位、社會政治的最小單位或是經濟的最小單位之外，家庭還是宗教的最小單位，所以信仰價值如何傳承？除了參與教會生活之外，家庭它把家庭看為一個祭壇，家庭是傳承宗教信仰的一個最小單位。所以早期基督教發展的歷史裡面，有人守獨身，守獨身非常好，不能守獨身的人，保羅就會建議他進入家庭，保羅就會建議他在家庭裡面要活出信仰價值出來，那這件事很好，沒有不好，到了十六世紀宗教改革的時候，新教就比天主教更去肯定家庭價值，所以以前讀西方文明史的時候，那段時間馬丁路德說上帝造男造女是要讓人成為夫妻，不是用來讓他們守獨身的。新教比天主教更進一步在意婚姻在信仰歷程裡面的重要性。但是雖然如此，在基督教歷史裡面從來沒有過，對於家庭價值的一個信念可以作為，你是真基督徒假基督徒的重要的判準。

 
很不幸的是美國的宗教右派崛起，大概1960年代70年代崛起之後，這個議題就變成是一個重要的判準，如果你把家庭價值提升到，這樣子的一個程度，你又支持保守的家庭價值，一男一女，妻子要順服丈夫，丈夫是妻子的頭，然後這樣的父權的價值，這樣子的教會傳統，就會不利於同志議題在教會的展開，所以你可以發現這波同性婚姻的在立法的攻防戰裡頭，其實有很多的基督徒的年輕人，就是不認同這樣的價值，就是不管是同性戀或異性戀，就紛紛離開教會，這是令人遺憾的，所以基督教教會內部需要進行對話，讓這樣的議題，你可以有不同的立場，不管認同哪一種的家庭價值，但也要認同別人也是基督信仰裡的一個合法可以被接受的立場，認為按立同志做牧師沒有什麼不可以，甚至鼓勵同志進去神學院獻身做研究，可以結婚生子，這些東西也應該在信仰裡面有一個空間。

 
只有基督教信仰經過轉型變得比較開放的時候，它才能夠同意接納，在一般的民法或者是社會層面對於同志婚姻的保障，那只是很可惜基督教到目前為止在這方面做得不夠好，這方面做得不夠好，也反映了基督教在很多方面都做得不好，譬如說：他對人權意識沒人麼強調，對法治的概念不是那麼樣的理解，那所以在基督教傳統裡面因為固守某一個計有家庭價值，以至於反對人權，反對民主，這也是一個非常重要的潮流，曾經教宗批評人權或良心自由是一個魔鬼，在教會歷史裡面也發生過這樣的事情，台灣透過同志議題，我們發現其實我們再信仰進步的空間很大。

 圖：慈濟大學多元性別同心社

 直播連結：https://www.facebook.com/hlLGBT/videos/2050263218605849?sfns=mo

 如何從宗教經典及傳統來解讀同志現象：
https://www.facebook.com/506960246304650/posts/815511248782880?sfns=mo","1571765306","/506960246304650/photos/a.545069025827105/820921524908519/?type=3&eid=ARDcXka2qKXAPmP-GjGvZxq5VOqcq-RFHcbIlC-e0jW5pLv1T2-2sZCbM5GB4lOCjoZWnFtNGb3ilHR6&__xts__%5B0%5D=68.ARCg9AXdoLIxO8FwHwuBkCmk0mKxkBasMv1HHj76NbC3KuEw66DpMTayfuATgFYdHgD_mC2UiNrxMKxUkLQOy1wzmEYcVQOkEaUkycwr--_7oiho5FnQKqNjkUcDCSYYvJIrnBUcdv8EeGrceqeCjs8law5XLgMoiBiGMADrdOmu4LBWBxs62jO3jnqG8tvOI27fJwpmwFqqE1lRXS-TCGju4yLTzRQ8HnqpEbntsBTdrxaeLNcImvzZN-SxIKySe72FPQHDxNKH-oNUUstHG2Dy4yfrilUHkXbrdTJFp74UoxMVdKf2fxDlHGVkIHOqpoOa952hMPb7xxSlT8a-CzQ&__tn__=EHH-R","https://scontent.fcgk13-1.fna.fbcdn.net/v/t1.0-0/p261x260/55847284_820921531575185_1147539085951238144_n.jpg?_nc_cat=102&_nc_oc=AQn2uiGdUs65_VNU6I0RfDRxLwWvG3knb0uYD7J8qQS3NF_qM_zmVW9KCIre2ymlQ9g&_nc_ht=scontent.fcgk13-1.fna&oh=ff4084c8cf46cc58ca92d0bd5a9d2d66&oe=5E1C78C0","undefined","",""
"https://www.facebook.com/permalink.php?story_fbid=872078783126126&id=506960246304650","1561038379","上帝是全知、全能、又全善的嗎？

 英國哲學家John Harwood Hick說，不可能，因為這三點加起來是自相矛盾。

 
舉例來說：大地震奪走無數的人命，如果上帝是全知、全能、又全善的神。祂會知道大地震到來日子，又因祂是全善的關係不願任何人受苦受難，所以祂會用全能的力量抵擋任何一切災害的發生。總之，全知、全能、又全善的上帝必然造就一個無苦無難的世界。

 但，我們的所處的世界不是這樣的，因為我們隨處可見苦難、悲傷。那為什麼我們會認知上帝是全知、全能、又全善呢？

 又或者？

 1.上帝是有能力卻沒有好心腸：全知、全能，但不全善。

 2.上帝是有好心腸卻能力有限：全善、全知，但不全能。

 
先讓我們回想舊約記載的上帝，我們會發現上帝其實是有情緒的，有喜怒哀樂的人格，有時會發烈怒、會降災、嫉妒、有喜有惡，還喜歡烤肉味。完全跟全知、全能、全善的感覺有些微差距。那是誰塑造這樣的形象給上帝的呢？

 是受希臘哲學的影響。

 
因為在基督教初期被認為是一個沒有知識的宗教，也為了要讓希臘文化的人瞭解基督教並將福音傳給他們，所以教父或是教會領袖開始接觸希臘的哲學思想，又因柏拉圖的哲學思想最為主要，柏拉圖認為，比起希臘神話裡的多神論觀點，人們應該相信一個完美至上的上帝；這是一種傾向於一神論的觀點，與基督教義較為親近。所以產生了上帝是全知全能全善的形象。

 但上帝是這樣的嗎？

 上帝曾叫摩西去拯救以色列人出埃及，於是摩西問了上帝一個很特別的問題：「你叫什麼名字？」上帝則回答：「I am who I am。」也可翻作「I will be
what I will be。 」意即，我要成為什麼就是什麼。

 名字代表一個人本質，當摩西這樣問，除了想暸解上帝的名字所代表的能力及意義以外，也像想要掌握上帝的本質。但其實名字也有將人框住的意思。

 所以上帝用「 I am who I am 」來回答，意思是上帝是無法掌握的，「我要成為什麼就是什麼」不受任何限制。

 
所以從舊約的概念去想上帝的話，根本沒有全知、全能、全善，三者特質同時存在的上帝，是因為希臘的哲學思想在限制上帝，變成了全知、全能、全善比上帝還大還要重要，忘記了神其實不受任何限制。

 我們是不是用哲學，以及內心所構想的上帝，將上帝限制住了？以致於我們總是在「全知、全能、全善的上帝，怎麼還會有這麼多苦難？」的死胡同裡走不出來。

 那祂是什麼樣的上帝？值得我們一同來細細品味。

 #神學導論 #林昌華教授 #課堂筆記 #舊文重貼","1571765306","/506960246304650/photos/a.507086002958741/872078619792809/?type=3&eid=ARAJJN_l_D00OTyR4Goh38h5XeBRI6VIayb27a5sOd_gD3Bv9-5XUuMB5ASxg1BTYhgYF1P5QJxgqPN_&__xts__%5B0%5D=68.ARDZvJcrQC3De8TOykhxMYsH5h7VSF_lBq6RFQ-Cpag4KKsJopeQJ6oJEUxQEeEekIpImmHPvjBmVkY3Q3dt45NOcNchdzuO_L19GRHD7Cam8P9oSEwOXUWXyavHoU6pl_9ju7TJu2MXTnvtflhJhCMd4cv3EJpgkw8kQSgq0Vh4SyU-4820KBgiaF3u2T5tqJVN7Z1bCXHdyUZcFtZUsOyv9f6B60cowWfPNZZsmhwRw1yXTmRD3asH7vhkLv_BLZIXYbXqilQEt_FPeOCc_DDN3QZgUeuOcp3mhn7HkvTCz3G-ylcF0_FuhNjarTmPvB8zoinbigs-dirQ4xJp3Lw&__tn__=EHH-R","https://scontent.fpnh10-1.fna.fbcdn.net/v/t1.0-0/p526x296/65294568_872078626459475_575693684029259776_n.jpg?_nc_cat=108&_nc_oc=AQmITbDlcngexKKwkzMR7N9-cs_TJDOqj27DpuL9z7L1-QhESzqb373syA5p3M0UH-o&_nc_ht=scontent.fpnh10-1.fna&oh=49f0f5ff4efd5edf9682696596d1ce49&oe=5E64F6FF","undefined","",""
"https://www.facebook.com/permalink.php?story_fbid=849113298756008&id=506960246304650","1558048826","基督徒，為什麼不能合一？

 
記得一年前，參加開學禮拜的退修會，講師以《基督裡的朋友》為題來呼籲基督徒，除了要追求跟上帝有如朋友般親密的關係外，還要對所有的肢體，基督徒、非基督徒，以及非本國的人，都應該關心有如朋友一般。

 
雖然受益良多，但特別令人疑惑的是基督徒這個群體，為什麼常常看見無法合一的現象呢？同個團契或同個教會應該是戰友不是敵人為什麼無法合一？到底怎麼了？畢竟聚在一起都有同個理想和信仰以及價值觀啊。（教派不同另當別論）

 講師只有鼓勵大家要合一。沒有說到為什麼不合一的原因。

 但我今天知道了。是個人主義。現在是個人主義的社會，我們基督教的愛，原住民的分享互助，都抵擋不了個人主義的摧殘。

 唯有把人家踩下去，把別人講得多爛，自己才會顯得高級一點。即使大家站在同一個陣線上，也是敵人，自己才是自己的盟友。

 #世界是一本小說 #還是要努力彼此相愛啦 #先生氣完再努力","1571765306","/506960246304650/photos/a.507086002958741/849129025421102/?type=3&eid=ARDolRU3zrTRV_JZm8tZjAEN3yRn-inmhrFfsZyfxSfZUJ8tVuxHkPI-2s8GQoQTZQJ-B7pcRTR7pU8Z&__xts__%5B0%5D=68.ARCFbSMc96jQxGn5LYo6bG20BVPjeD6Nv0MRsf-MKvu5QkUpIRk-tMOP01fyPv5fOl35dlr0Rd-Rfv3HCHF-FwB8m3DdUTxeU-8KYVeED0lwcm_PNkHEWcOLkJl7kLSjTXpq994TnHQAtzOXJ7_xMLcKyA9flKzJJRS_c8FfpFLbwJ8dWsp5jz_uIHmn6WLrQ3wCX-y5gzWFcSfQ3y72jpa2S0ITtS2fLxn8GoOOzyF2uyyom_rk44M6j7ifwpQhVNJmaYhoJnwV5g0zPTl4YfMDEs-knleCJtcBAKj8MyYjOYm7SyLBJmS581WRoUSkj-uF8Qc-JpEA8GWoWR_OW44&__tn__=EHH-R","https://scontent.fbkk6-2.fna.fbcdn.net/v/t1.0-0/p526x296/60294347_849129032087768_5438886974356193280_n.jpg?_nc_cat=104&_nc_oc=AQlixu1wElrYdcJQeZkZPdpkPhwMbaqL4kJL_Qzl8bX7bPTM0vlaTMG8CbExgAqYa80&_nc_ht=scontent.fbkk6-2.fna&oh=628d8a81cd6e068efcc00826dd6fe6b1&oe=5E57C550","undefined","",""
"https://www.facebook.com/permalink.php?story_fbid=953292335004770&id=506960246304650","1571139402","昨天學弟們在討論要合資買掃譯筆，被耳尖的我聽到，立馬阻止。

 由於不只聽見一次，所以在此很慎重地發文跟大家說，不要再買掃譯筆了！（噴乾冰）

 大家手機裡的play商城、app store裡都可以下載「照片掃描」之類的app，拍照完可以掃描轉為文字檔，既方便又便宜。

 本來要買，但看到我這則貼文決定不買的，可以給我500塊當作感謝金。ありがとう。

 ＃天使聞聲來救苦系列","1571765306","undefined","undefined","undefined","undefined","undefined"
