url,posttime,text,crawled_time,attachment_link,attachment_img,attachment_img_alt,attachment_title,attachment_brief
"https://www.facebook.com/permalink.php?story_fbid=872740666393271&id=506960246304650&__tn__=-R","1561112918","這個世界喜歡檢討被害者。

 
被性侵，誰叫你要穿那麼少？被霸凌，你為什麼不要轉學？被嘲笑，懂得笑就不會恨了啊！被騷擾，你為什麼不要封鎖他？被謾罵，你就不要理他啊！被污衊，人家對你這樣，但你可以選擇「很好」的回應啊。

 而且這種事，在基督教更常見。

 
因為我們常常被教導要和平、饒恕、溫柔、忍耐。導致教會喪失監督的系統，不只讓教會裡的加害者很猖狂，也使教會中的被害者無法發聲。只要事情爆發，永遠都可以叫被害者要以和平、饒恕、溫柔、忍耐的態度去解決。

 基督教都是這麼解決事情的。

 為什麼教會這麼容易傷害人？為什麼需要church too ?為什麼教會也有性侵？

 就是因為濫用和平、饒恕、溫柔、忍耐，而忘了公義而導致的。","1571765299","undefined","undefined","undefined","undefined","undefined"
"https://www.facebook.com/permalink.php?story_fbid=795085580825447&id=506960246304650","1549809455","別人都可以，但你不行。

 你是原住民，你不可以喝酒，不可以懶惰，不可以很笨，一次都不行。

 因為大家會說：「你們原住民都是這樣。」

 你是外籍移工，你不可以滑手機，不可以聚在一起聊天，一次都不行。

 因為大家會說：「你們這一國的都很懶惰。」

 若你是性少眾，你不可以裸露身子，也更不可以去夜店，一次都不行。

 因為大家會說：「你們性少眾都是很淫亂。」

 每一個人都可以做想做的事，與他的族群從來無關；但你不行，你是弱勢族群，你從來不是你，你是你的國家，你的族群。

 ＃偏見 ＃歧視 ＃標籤 #束縛 #我不是我","1571765299","/506960246304650/photos/a.545069025827105/795083564158982/?type=3&eid=ARDg_p-L7MsnlDvxswSqHXYgob5EJBLOC1CItdUSpiShSW0tGxAcyDX619-52IdNu2XSi4KUnNAqHTM8&__xts__%5B0%5D=68.ARBDR8ATw16uJ5xJbvxQuc60fih2bZ4uXnx7pslj1WAnCtuTO7aFec3KTD8IlzMoWDeVOsmRsOye0U4MRayi08hy-llHKtNQrFF9u6qCGSfqPk62dJeVXLjUFOC5GbbM3WMDiJMkbrSnNnWX46f6_W05TUL3KQbwOcXtsio5RpFjnL93FX8AOFClC0xsyXBzyHMdM5Cty-bmrxDtJudfIy-dkMMBUIwWgHH96dGYaRU_NuZ-vPJowzvyBh06rKmGlkGMkNPWCG7dL2tiZDKNBtmvWOPQWZwLy_V4My1Fl_3OZNftcN5cg_m69er1LkfzpIYhF9SgV2EDBYArCwrZP4I&__tn__=EHH-R","https://scontent-arn2-1.xx.fbcdn.net/v/t1.0-0/p526x296/51692381_795083570825648_1558879421127983104_n.jpg?_nc_cat=108&_nc_oc=AQkAmxqDkQYbseAVuPmU--ToyRwDqkXyZWLIkQpunLhHog7OaoKAbqR-AmfH9ReBHH0&_nc_ht=scontent-arn2-1.xx&oh=022bf5393496b494b32bb974a76546ab&oe=5E1DC85A","undefined","",""
"https://www.facebook.com/permalink.php?story_fbid=782845498716122&id=506960246304650","1547991113","你會不會覺得，有些講道者不用文字稿好厲害？你會不會覺得，講一篇好的證道為什麼那麼困難？你會不會日思夜想，那些講道者到底是如何成功的？

 不要擔心，天使聞聲來救苦。（從天而降）

 其實，講道很簡單，就算你不懂聖經也可以講一篇「看似」超級厲害的講道篇喔。

 首先，我們要知道，一篇好的講道所要具備的要素有：聖經知識的專業度，抓住人心的渴望，以及生活上的見證資料。

 說到這，或許你會卻步。

 但，不要怕，跟著我記住五口訣：「希、戳、成、捧、插。」

 這樣，就能幫助你寫完一篇講道篇。若你天分高，甚至不用寫，只要上台前依照步驟準備五分鐘就好了喔。

 那我們要開始囉！

 
希：在你的信息裡加入希臘文，希伯來文。增加可信度，當你的信息裡說出聖經原文時，你馬上可信度增加50%。不知道的還以為你是聖經研究學者。（若不會拼音也不想學沒關係，只要原文意思有說出來，一樣氣勢如虹）

 
戳：戳中人的渴望。人的渴望是什麼？很簡單，就是成功、健康、富有，關於幸福美滿的所有大小事。當你在你的信息裡面加入一些，「上帝要你健康」「上帝要你富有」「上帝要你成功時」，這個大家普遍都渴望的東西時，你的信息就有如一劑強心針，馬上讓人給充滿力量。當人家充滿力量時，自然而然也就會覺得你的講道很棒。

 
成：舉一些成功的例子來佐證，增加可信度。哪個成功人士是基督徒，就舉他的例子。哪個健康人士愛禱告，就舉他的例子。哪個幸福美滿的家庭愛上教會，就舉他的例子。當你舉越多身旁及電視媒體成功者的例子時，聽者也會覺得自己離成功越來越近，伸手可得。

 
捧：捧出每個人內心的小公主小王子。每個人都喜歡特別，喜歡被稱讚，所以當你稱呼他們是上帝眼中的小公主小王子時，他們會覺得自己好特別，置身在雲端，認為上帝會給我最好的，這種方法一定可以激起每個人心中的愉悅感，每週都一定來報到。

 
插：在信息中，不要忘了插入經文，來增加可信度，脈絡不用在乎。假如你的主題是智慧，就在google上面搜尋「智慧經文」，所有關於智慧的經文就唰唰唰地顯示出來，然後你就拿筆抄把所有的經文抄起來，從新約到舊約，從舊約到新約，串來串去，插入每一段信息裡，根本就是聖經權威。

 
好了！一篇「看似」超級厲害的講道篇就這樣完成啦。是不是很簡單呢？要專業感就有專業感，要可信度有可信度，要抓住人心就抓住人心。只要抓住以上五口訣，你的綽號從此改叫「講道小達人」。

 然後！我們下週見！（手拍鏡頭）

 #喔對了若你的信徒懷疑能力太強你可以說沒有成就是沒有信心 #或是整個釋義書節錄也很專業 #真的可以不用有脈絡 #信心也可以充滿在每一篇講道裡 #越大越好","1571765309","/506960246304650/photos/a.507086002958741/782845475382791/?type=3&eid=ARBt6l3HoGw3NXQjfSeIYiqmXAFP0a1N9VJgj43DrfjdAhfj00OvBEJ7XQ2VVLtt1aG1Qoc-Pz6iMBZ_&__xts__%5B0%5D=68.ARAjCEi9YcZ69R2NUwIIOfdRtlxtG9PPKXW5jT0LVMIjkTJcsAGyoS5gHP7eWI5n5UjQxxI7QhZVpXG-vVpztBuGIw-xKWCsv9XmqDOPIbVS7rl5x7OROYQU2strMxYujUkst5x9IscKh9TUBEZXW_L1zmRpRdKJTMrQ3-bUCbIVzwp_sLzk0sBV3RpOOe-NXwZ74pSyuoTIp6rBpdEiFSLLt2FujSAdLNdYBifBaDI_wibt2aNlXHeD1l7GgIyYDdgQqlfix_Bc-bdeXCe7SiWgz8gvKg4qopPlR5PMwzYXWoN5hCzCn2It5pq77NiBoZ8jgQzNYMnnHyleXSyzaog&__tn__=EHH-R","https://scontent.flim11-1.fna.fbcdn.net/v/t1.0-0/p235x350/50646876_782845482049457_8476991065377734656_n.jpg?_nc_cat=106&_nc_oc=AQnvK3FZTidwreUxylh5pIUOyXGZB9uA-0X8bDivHo1uNcLimlaWujDkDMHo7oQWq0o&_nc_ht=scontent.flim11-1.fna&oh=edde9e54c10448b3709478dd82954efe&oe=5E6089FB","undefined","",""
"https://www.facebook.com/permalink.php?story_fbid=867900920210579&id=506960246304650","1560504340","不可作假見證陷害人。

 #支持性平教育 #大家一起努力 #教育部長好棒棒","1571765299","/panwenzhong/photos/a.2332987630068082/2545218125511697/?type=3&eid=ARDH0IvVitN6lXeG1G1bsTV2hXp_XIgycHRCpSM6neAOM2-eBrZDOOpKNNN8fA6iJHuzwGzi-664qTbe&__xts__%5B0%5D=68.ARAcBd12yXUK5ETkplr-gyq4-eQr2HLlPZO94oJR4SxBt2JNhMGXCj-u-Au92fTQpLTghn9QVQ3dtlPNwKhpAkqfvqjbnsoUKDIhohjxPJqLsljAHIGJiDdQliSvOUlIewfxmi_9_PuQwQUIAirpwmmlXPoYvE9KUJ1SRJbaIYZyApkZvGbbbmcJzCQ1VM1f-bkZrGgp6boA79xk4wULSzE8mygetb1yR9fon2HQfoOGpCtosRPcaBTBsFXWIblmI3-snUjcfWd4NFOMl6pR1wGbJ2hst332eKp7d9db4DgMTe3QgGJcWfUyHLMKw4LCjTxKg60w4WLuQaDceA5UkxzlpVN-vpuX4pXOBBFcs6a692mnkrezMIKmUozB2RIMtZTM_CYrjhAaCQUWtN4mguit23dsx5sgBczh-cM5UMbN5XTudDCn0wkBjFUk6MYRtNZga_5j98cnpaKhNX4Lo30KDHY0NvwkTwvA0Cox2FZKUFVdlyRn-SU&__tn__=EHH-R","https://scontent-mrs2-1.xx.fbcdn.net/v/t1.0-0/p526x296/64328324_2545218132178363_900791926305849344_n.jpg?_nc_cat=104&_nc_oc=AQlWvJDPyqLve-l2MY4rVMNsLyZ_dFPAaUmO-s0KcqgW3ylypzBRi3XFdVQYzkJCgIQ&_nc_ht=scontent-mrs2-1.xx&oh=e49be9040df742a6744a6a755b52e582&oe=5E2952BC","undefined","潘文忠",""
"https://www.facebook.com/permalink.php?story_fbid=785643765102962&id=506960246304650&__tn__=-R","1548420015","成功神學，會讓人成功嗎？我想答案是，會的。

 
因為我認為，成功神學的概念就是成功學。而成功學顧名思義就是一門教人如何成功的學問，由於要讓人邁向成功的緣故，所以成功學有很強的應用性。（例：教人自我管理、正向思考）

 
這則影片裡，完全沒有神學元素，只是單純教人如何成功的小影片。但若你看過約爾奧斯丁出的《活出美好》，你可以輕易地發現，這則影片跟約爾奧斯丁所傳講的福音內容，幾乎如出一徹。而約爾奧斯丁，只是加了聖經經文的成功學罷了。

 所以，讓你成功的是成功學，不是上帝。當然，若你失敗的話，也不要怪上帝，要怪就怪自己，成功學沒有學得好。（噴乾冰）","1571765299","https://www.facebook.com/BrianChaOfficial/videos?__xts__%5B0%5D=68.ARBNNVCplwyIOGwvXzFoX9436eXDwXkCZzLyGR6jaTxMM_ElIA_XBFTMpkOqg_pgOQM93xADuMpL1XpZLMu-7QBsxJLwUANOmpApq4F1F5bVQwKfN4WLKQzrpDOhUzBfPE4Y19-sq03cABg2ZjGsclEUcS_k0qmea47Gb9xhFFSDFsQKJrTUphb9PiaEgILH6wa6pOfIDMqEGL106afBu9QU5dZLTagtHSrTiWaPKBWLozhdYVN7pFpkMWWWdr5nqEuf9jXMid7ZakV8CXZDFaF3rnSvtkkkZ0wgM2Ylyb1yelAPirANlfDziR8Y-SIDnXmLMUtgRoJR8X-SWRyj46ODColn4uMnZzN13wqdHl4qYGnd1hXab-5JiG6Xbq1bfA1ic2tuxcXwBKhMG1ouMvSfvOdBw3qDSxhYnUG3392ZcPsqET_j4UcNUA0YYbpbiShenI4Ch_MrdabY6xJ3A6R66o9DR8yTfrOSK5SyYSANbqPVxNskNgLx_nspGU2OlQ&__tn__=kFFHHH-R","https://scontent-ort2-1.xx.fbcdn.net/v/t15.13418-10/27857729_2116396505257490_5806836994403205120_n.jpg?_nc_cat=100&_nc_oc=AQkf50B3JizBQeYZcMFnQRO7fy76eCBlkFQWAPBXk8u8cSDV0FmIY-twLlvXwFMmWBI&_nc_ht=scontent-ort2-1.xx&oh=89650ef51b604d6c88ae4c932324c3f6&oe=5E1D0BD4","undefined","成功不會做的事","Posted by Brian Cha Motivation"
"https://www.facebook.com/permalink.php?story_fbid=845336295800375&id=506960246304650","1557539455","母親節唱這首歌給媽媽聽，媽媽會哭得像瓊瑤劇裡的女主角吧！#神學生Mowna #母親節自創曲
____________
版主題外話：我覺得最好的母親節禮物除了跟媽媽一起吃飯以外，還有「暸解母親在母職中受到的壓抑」並將母親從中解放是最好的禮物。那最不好的母親節禮物是什麼呢？以下開放留言。","1571765299","/watch/莫那-Mowna-1022770677908574/?__xts__%5B0%5D=68.ARB-5zsRYuzljToVSMsgMk9WnDzolzh6ubB1xR6QgMWmFfeiPVBUQ18eUEspvLjr-vClxkBfmyTvLb4j-kZqHCTCv_JSV2T25JzSf1zNfEJHujw35gP4v6-kGHo3c6BA88ynBmfvZayFjMCsJkDAAOy9v8T6ZQzhBPJcvTXzeDj_Un1Gs9PrTN2IGP1-yT4i7ZiLk0gmGdr0oYqNwxQZp0kdu7PUL47dUNob8aEf7Sqg-dVaxppoA2570emytup-2_ZeekxzevqJNbaQF_CCPt9OHOrjzHsrAa0RI7iHJiuV5Dti3fawlXGTYnCswQwX711tv4Fhs98P8gJHfBFwWdj8-Le4gtIkfgtim3RmIVv_qXov5q3Vi6nfxrfIeY9GtiP-_5PKUoy-rX7yj0AOs3sfKc1bZspSEdYfULY5kEFZAvPsFSMZPfCDCsRLDcM8Ag8e3ndgwpH8mOog3hapxC5PtmkL1kgfVhmI4aFBT8QxENjJ5j2K1Z_d-KHXkUHyung&__tn__=kFFHHH-R","https://scontent-bog1-1.xx.fbcdn.net/v/t15.5256-10/59530254_2611559648859537_5511123690005200896_n.jpg?_nc_cat=108&_nc_oc=AQl8hmiLGjsSxHcBXGM8N_9HGD8LIzgIsnQ2SvZ84znmbanKiZi3a8nBlQCSQtnU_bw&_nc_ht=scontent-bog1-1.xx&oh=26946e42b8782b93637e58c47593c051&oe=5E5D80A2","undefined","莫那 Mowna","796 Views"
"https://www.facebook.com/permalink.php?story_fbid=837961756537829&id=506960246304650","1556456721","「要不然你就寫，助人為快樂之本吧！」外婆指著我的國小聯絡簿的「每日一句」欄說著。這是我第一次知道這句話，是外婆教的。

 她總是樂於助人。

 
還記得小時候在我生日時，外婆竟然把我最愛的巧克力蛋糕送給村子裡那個有六個小孩的人家，我非常生氣地埋怨她說：「妳為什麼要把蛋糕送給人家？還有一半耶！」我氣得哭了。外婆將我擁入她的懷中說：「有吃到就好了，神會祝福我們的。」並拍拍我的背，安撫我的情緒。從那之後，只要是我的生日蛋糕，或其他東西要給人時，外婆一定都會先詢問我，並試圖說服我要將東西分享給別人。

 
有次陪外婆在醫院看病時，我們旁邊坐著一個男子。沒有人陪他看病，他的衣服有些舊。他們聊了好久，最後外婆看完病要走時，塞了五百元給他後，牽著我走出去。「為什麼要這樣？五百元很多耶！」從來沒拿過一百元零用錢的我，氣得跳腳。「要幫助人家啊！神會祝福我們的。」外婆一如往常地回應我。
 

 
一直到後來，我才感受到助人是多麼快樂的一件事。因為村子裡的一位女生，跑過來說她非常羨慕我有這個外婆，因為外婆幫她修補了國中的百摺裙，除了燙得又平又好看、一毛錢不收之外，外婆還給她一瓶特製的冬瓜茶，她喜悅得像小鳥一樣吱吱喳喳不停地誇讚我的外婆。

 
一般來說，聽到外婆「沒收錢」這個關鍵字，我一定會非常生氣，因為總覺得分享就是損失。但那時我看到那個女孩，那個被幫助的神情，我才知道原來被幫助的人是這麼喜悅，當下覺得有這個外婆讓我好驕傲，雖然這件美事不是我做的，但我也一樣非常喜悅。我想外婆就是喜歡這樣的感覺吧，助人的感覺。

 
外婆去世已經四年多，但她卻好像從未離開過。因為外婆在世時對人的友善和幫助，我們一家人總是會受到熱情的款待，我都會想起外婆，她雖然去世了，她的愛卻遺留在這世界上繼續滋長。外婆助人的美德像一本我最喜歡的書，深深烙印在我心裡，在我看見別人的需要時，告訴我「助人為快樂之本」。

 #母親節快到了 #想到幾年前寫的這篇文章","1571765316","undefined","undefined","undefined","undefined","undefined"
"https://www.facebook.com/permalink.php?story_fbid=843265186007486&id=506960246304650","1557239693","支持同婚的神學生好可憐，只是發表個聲明就得向大家交很多神學院沒教過的神學作業。但我很勇敢也很盡力地把作業交給大家。

 突然，好羨慕教會裡大多數的反同婚者，只要輕輕一句「因為聖經這麼說啊！」所有的問題就像被風吹過的雲霧一般，煙消雲散。

 簡單，瀟灑，又帥氣。","1571765300","undefined","undefined","undefined","undefined","undefined"
"https://www.facebook.com/permalink.php?story_fbid=872740666393271&id=506960246304650","1561112918","這個世界喜歡檢討被害者。

 
被性侵，誰叫你要穿那麼少？被霸凌，你為什麼不要轉學？被嘲笑，懂得笑就不會恨了啊！被騷擾，你為什麼不要封鎖他？被謾罵，你就不要理他啊！被污衊，人家對你這樣，但你可以選擇「很好」的回應啊。

 而且這種事，在基督教更常見。

 
因為我們常常被教導要和平、饒恕、溫柔、忍耐。導致教會喪失監督的系統，不只讓教會裡的加害者很猖狂，也使教會中的被害者無法發聲。只要事情爆發，永遠都可以叫被害者要以和平、饒恕、溫柔、忍耐的態度去解決。

 基督教都是這麼解決事情的。

 為什麼教會這麼容易傷害人？為什麼需要church too ?為什麼教會也有性侵？

 就是因為濫用和平、饒恕、溫柔、忍耐，而忘了公義而導致的。","1571765300","undefined","undefined","undefined","undefined","undefined"
"https://www.facebook.com/permalink.php?story_fbid=870837133250291&id=506960246304650&__tn__=-R","1560875683","你知道全世界最man的人是誰嗎？就是那些你口中指稱的「娘娘腔」。

 他們不顧別人的眼光，勇於做自己，就是一件非常了不起的事；那是要冒著被社會排擠、被社會嘲笑，甚至被毆打的風險。你有比他man才怪。

 #是要多man #比man文化","1571765300","undefined","undefined","undefined","undefined","undefined"
"https://www.facebook.com/permalink.php?story_fbid=910415892625748&id=506960246304650&__tn__=-UC-R","1566100330","「新酒澆灌帶下新鮮恩膏」？？？

 #新酒變成新鮮恩膏 #化學變化 #有理組的朋友嗎 #那麼在哪裡才能買得到呢 #新鮮恩膏","1571765300","/506960246304650/photos/a.910409885959682/910412759292728/?type=3&eid=ARAguu5g4CHmsxbMA8RwPy0Pq3Yq2FtH89bbqGLo-ml4ESdbmjgydBMYYMJ5jzjmn8VGwa1Lqmx2Tzoe&__xts__%5B0%5D=68.ARAtPijAo9GHGgJ8y3Qqiye082LY4MB2WzwqAVbNjDBcx5EvQRG1qPOyD_4lne3HrSIKPVCqIyb96ENqnjhjcH-TEXazDZgKPLWrllGJQY08o9_fEylM1V3q5fJuG9EUOqOGe_ccYpR8yi2fP1PKpNi4AICZwXaDzWJ_-yzb1aDDyp2PVRqBOHSzu1RlQaI7uiMW3Y2dda_rkcthGM3kyDnd0RH7B6MTMYXhe2YVmEiHbvhtEKO2oCZFDfqlO7sH_FNnaIHiIun1AA38Rf8-H91_g5MoTgbzJZW90SeeyDxwXdR2Qy0-79eU7ByQydBdDdF0Qv0ZbZN4fQZqeCRlXQ8&__tn__=EHH-R","https://scontent.fhex4-2.fna.fbcdn.net/v/t1.0-0/p526x296/69205065_910412765959394_5907151886951120896_n.jpg?_nc_cat=110&_nc_oc=AQlu37aJYpQqFvP55drYa-yRgBhcaT6Hqp7zQWOgJ6SNm1VCN1kLlDu23maUEB2G99g&_nc_ht=scontent.fhex4-2.fna&oh=23a224d22e78767d4d6f33c941e2731a&oe=5E64798E","undefined","",""
"https://www.facebook.com/permalink.php?story_fbid=2320716167950807&id=100000373404887&__tn__=C-R","1558970157","【排灣族人的社會價值觀】
排灣族的階級制度，漸漸的式微了。年輕的排灣族人沒有甚麼知覺，但是中年人無奈，老年人哭泣。
「在部落裏有人餓肚子，是部落頭目的恥辱！」——這是不懂排灣族的社會制度（階級制度）的人很難理解的話，但卻是排灣族人再熟悉不過的事。
印象中，部落頭目是部落居民所「供養」的；印象中，部落頭目除了賣弄自己頭目的權利和名份外，其他所展現的也不過是他的軟弱而已。——錯了。這是對排灣族的文化和社會制度極大的不認識與誤解。
七八十歲以上的排灣族人對於政府施以強勢的「同化政策」是恨惡的。因為，排灣族最特殊最有價值的排灣族社會制度首當其衝的受到破壞。

 
早期，排灣族人在小米收穫期，族人習慣將長得特別肥美的小米挑出來，全數的「貢獻」到部落頭目家中。但我必須強調族人這個動作是出於「甘心樂意」的，因為，他們都知道所奉獻的米糧代表的語言和意義就是：“Tisun
a nia vusam, uza namaljenguaq sa tja qinuman tusa cavilj, mavan aicu a uri nia
sikirasam a kiqepu tua tja Masalut tucu a cavilj.” (頭目，我們家今年豐收，我們要以此參與今年的收穫節。)
部落頭目可以清楚的透過所獻上的作物，瞭解部落居民今年收穫的情形，也留意部落中的鰥寡孤獨者的現況。
部落頭目當然可以決定這些所獻上的米糧留用與否，但多半來說，還是會用在人民的身上。這也是對排灣族的文化當中，深感驕傲的地方之一。這怎麼說呢？
排灣族一年當中最大的祭典就是「收穫節」(Masalut)，祭儀前後五天，最後一天屬於全部落大家的集會，大家一起競技、唱歌、跳舞、喝酒。小米酒完全由部落頭目提供，而所供應的酒是從大家所供的米糧中來釀造的。
Masalut
的最高潮，並非是公佈競技的優勝者，而是報知大家今年欠收的人家，然後，透過頭目來送「好種」(papuvusam)，並給予祝福，盼來年因有好種能得以豐收；接著就是送「好糧」(papulami)
給貧苦居民。最後，才公佈豐收的居民，並悉數公佈族人所貢獻的米糧。
這就是部落的居民在收穫的時候，為甚麼要挑出肥美的小米的原因，乃是為了成為「好種」給欠收的人家，也為了讓貧苦居民有「好糧」可以享受。你可以想像嗎？全部落「好的收穫」是用在「弱勢」的家庭中。
還記得，部落的頭目總在此刻叮嚀部落族人：“Aicu a marka kipaulaula i qinaljan tacavilj anga tiamadju a
kipaqelqelqel, tja cemkemkelj tiamadju a mapuljat, neka nu qaliqali, sedjaljep
angata a tja kivalisakedan; saka pai, nu tja cemkemkelj madaqai a tja pavayan
tua tjaljasanguaqan, nu pagaugaugaw aken tjaiyamadju tusa tja qinepuqepu a tja
piniliq a lami namiazuan aken aravac.”
(部落中的弱勢全年都生活在困苦中，他們是我們的家人，照顧他們是應該的，沒有人是局外人；他們既是我們的家人，當然要給上最好的，當我把這些我們精選的糧食親手交給他們的時候，讓我感到非常的驕傲。)
在把米糧交給這些弱勢居民的時候，頭目口裏還不斷的對他們說：「辛苦你們了」。
——這就是排灣族社會的價值觀。
如此這般的排灣族社會，哪有居民會餓肚子？——這是排灣族的部落頭目在排灣社會中存在的價值。

 在排灣族的社會，部落頭目是世襲的，這種價值觀也應該代代相傳，但不幸的，我們將她踐踏了，年輕的排灣族人沒有甚麼知覺，但是中年人無奈，老年人哭泣。

 (本文已於2008年3月3日在瓜樂の部落格公開發表。)","1571765300","https://www.facebook.com/photo.php?fbid=2321979967824427&set=a.250838888271889&type=3&eid=ARCdKwl34paE8Xh9dk2kMF4KmTU8bncyBw52mHEturKEOCgqd6iWuCjRHXDLt40o2AxiRWAETTKAYvhP&__xts__%5B0%5D=68.ARBPCHDF94vtaoWP5wEG3uy8V7krP0BoqjPJHh2nBUyBVvb9SS-kiW43_ObPM-O0iQyB9O4Peop56xCRRMlDztpUc_mdFBIup_DxBKxOqjq8s1QL2N-BGduo1ADpn_OaBUL8-1Oe-8_YzA77j5de5DBLnxggJHrvW4AcwEcU6yo7Sq_gPdgLZxzXgen-P27_P4f_elVWDhzUfksI1SHyG7vtZUTMYeTC5Q51XIuFFSF9W0e8xIyAsUanFFgA6V7QMA2rXg&__tn__=EHH-R","https://scontent.fath7-1.fna.fbcdn.net/v/t1.0-0/p235x350/61258857_2321979974491093_3916474630184894464_n.jpg?_nc_cat=105&_nc_oc=AQmXR-Sm6yxpteNGBygf5al0erDmyYJ6p11TWMGkaZ7yboO71vdh2torZ8DGsiRyr8I&_nc_ht=scontent.fath7-1.fna&oh=b59d899ee59e7dd963c2ba7e98114f4c&oe=5E2E4A59","undefined","",""
"https://www.facebook.com/permalink.php?story_fbid=854383584895646&id=506960246304650","1558764647","那個，把長老教會同性婚姻牧函舉超級高的人，也不要忘記牧函也有四、五點啊！具體策略還是要擬一下吧！這是同性婚姻牧函不是反同牧函餒？

 （4）教會與兄姐需接納同性性傾向者，建造尊重與安全的環境，與他們同行，在愛中扶持，陪伴成長而活出符合上帝心意的生活，經歷上帝更新的大能。

 （5）對於處在「同性性行為」生活模式中的信徒，教會有屬靈的權責關顧與牧養，以求在愛中挽回，使他們在恩典與真道中成長。

 #牧函自助餐","1571765300","undefined","undefined","undefined","undefined","undefined"
"https://www.facebook.com/permalink.php?story_fbid=842148806119124&id=506960246304650","1557069103","「基督教是最會斂財的宗教」「基督徒都是腦殘」
「基督教養出一堆強姦犯」「邪教什麼時候廢除」
「沒了基督教的國家才會美好」
「白癡才會信耶穌」

 這種論調，這種思維，跟你們最討厭的護家盟有什麼區別？說穿了，其實，你討厭的是你自己。","1571765300","/506960246304650/photos/a.507086002958741/842148769452461/?type=3&eid=ARA8lNb-cFPSdHX74b7paEBwGFpJWmQnMjkKsJYvR0dpwYTtFu3nRoxkfweenJa00s-01IBIXuGaqZVD&__xts__%5B0%5D=68.ARA5upLIGrURgNKy9BG8yQzdxhuXYMWKY4dpNxrG-02cO2EFwXFeFTSkxP56NUbN7kRC0aEwHQLLuNUfpX4Ba4n5KqYrkSYBTiP7Dn2684EHnyaiXr7kgPMQ4sFi4fy1oQDRLdag0Bhhtx4CJMFD1a58_Zzfka7PdWPPwwI0QINcdElVFzESoiLbTiCL4B3ZrZ5t8nd13sq3li1L5Is4AGZHwpK8xWeStK6lQcm9J3L7-HEPWv8mQlP4QDOL-v3Qm4puXh-b1DL07L2FNOHQssf9GXXSStScs-tnm-_wUQEpBPZaeiJHt8V8Oe63cb5swYHHvwXkenjum23vSbAyFxU&__tn__=EHH-R","https://scontent.fcgk12-1.fna.fbcdn.net/v/t1.0-0/p526x296/59410311_842148772785794_5176638470285688832_n.jpg?_nc_cat=108&_nc_oc=AQlGDFBn5GpzuoUg7jyiTABkJoPCJtAx0qyYo53CBLtGrklvDErlMVPCkeTk5zZ8q_E&_nc_ht=scontent.fcgk12-1.fna&oh=7939b5992bcde3d706e025848355f80c&oe=5E26BE1B","undefined","",""
