url,posttime,text,crawled_time,attachment_link,attachment_img,attachment_img_alt,attachment_title,attachment_brief
"https://www.facebook.com/angelinachen0815/posts/2725777350800564","1570436185","Love the life you live. Live the life you love. 

 只要能做開心的事 不管在哪裏裡 我都是個快樂的人❤️","1570647053","","","","",""
"https://www.facebook.com/angelinachen0815/posts/2717276678317298","1570079376","油性頭皮救星出現了！！！當然也是乾性頭皮的福音。
頭皮不健康原因有很多種，內在影響包含飲食作息不正常，過度疲勞等等
外在引響包含了髒污，過度此用造型品等等
很容易出現頭皮紅腫的的跡象，甚至是有落髮的現象
這些問題都來自於不健康的頭皮以及需要好的頭皮保養產品。
長期吹整造型(電棒，吹風機，離子夾）也會造成頭皮的損傷
一但頭皮受損了毛囊將會不再健康，頭髮也沒辦法烏黑強壯，更別說是茂密豐盈的頭髮了!
出席 HAIR RITUEL by Sisley的新品發表會！
頂級髮肌品牌Hair Rituel by Sisley
推出了在洗髮前專用的賦活重生深層潔淨髮精露
活動現場我也親身的體驗了由專業美髮師所謂我進行的髮肌檢測以及針對受損免感的頭髮選擇出適合自己的產品。
我的頭皮屬於比較乾燥，也有造型品賭塞毛囊發炎的現象，而老師推薦我使用賦活重生深層潔淨髮精露，就好像是在使用保養品前，先使用打底產品，再讓後續的保養加以吸收的概念。
可以徹底的清潔頭皮髒污在洗髮前先進行深層淨化，含有頂級植物精華可以提供活性營養，讓髮肌維持在健康狀態，髮絲也能夠更烏黑亮麗強韌唷！！
天天使用也不是問題，洗完後髮根也會非常的蓬鬆

 大家快上網填寫資料，可到櫃上搶先體驗！
聽說還有好禮可拿！👇👇
https://reurl.cc/VajkXy


#HairRituelbySisley #頂級髮肌抗老 #賦活重生深層潔淨髮精露 #頂級髮肌養護專家

 Sisley Paris

 
@sisleyparistaiwan","1570647054","","","","",""
"https://www.facebook.com/angelinachen0815/posts/2600829353295365","1564721280","最近情人節禮物多到要收不完了!
家裡的花多到可以開店了～!
今天又收到Farcent香水系列的告白香氛組，真的太漂亮了❤️
上次和大家分享完它們家的擴香後，自己已經成為忠實粉絲，味道非常持久，一進門就好像身處在高級飯店的感覺～
對於很多人來說香氛是生活中不能缺少的東西，對我來說也是這樣的～
我很喜歡周遭的空氣散發宜人的香味，讓我更能夠享受待在那樣的環境下。
像我長時間都待在家裏工作、拍攝，居家的環境對我來說就非常重要!
Farcent香水系列的高級香水味，在家也能感受高級SPA會館的氛圍，舒服又放鬆～高級的鑽石切割瓶身在家當擺設也非常有質感唷!

 運動或聚餐完衣服難免有些異味，空間織品噴霧讓人一秒恢復女神的樣貌，立馬消除異味全身散發精品香水香味～～

 這組情人節禮盒實在是太美了，如果想要這組香氛，8/3-4在信義南山微風旁也可以買到，還能現場刻字～是今年情人節最特別的告白神器！

 #LesParfumsdeFarcent
#Farcent香水
Farcent 香水系列 - Les Parfums de Farcent","1570647054","","","","",""
"https://www.facebook.com/angelinachen0815/posts/2537437029634598","1561686480","貪小便宜安豬麗娜跟大家分享1元面膜
你們沒看錯
29、30 在信義A11 2樓 Apivita 專櫃
限量100個 1元面膜 投到算你賺到
但現在可能剩93個
因為....有3個被安俺投走了

 然後我敷了兩天 皮膚嫩的跟嬰兒一樣

 #Apivita希臘面膜
#喝飽愛情海的光澤肌
Apivita","1570647054","","","","",""
"https://www.facebook.com/angelinachen0815/posts/2468850793159889","1558498392","我的家人
他們完整了我的人生
努力只想給他們最好的。","1570647054","","","","",""
"https://www.facebook.com/angelinachen0815/posts/2699941023384197","1569330101","來了來了 會大聲告訴我妳們喜歡哪一張!
穿了耳洞之後才知道耳環的美好
陳美麗是不是看起來更美麗了(可以不要打打嗎😂 )
飾品真的是穿搭中非常重要的點綴

 首先，耳環入門款我選擇了 Swarovski 冬季系列的 symbolic moon
系列，不要看他是垂吊式耳環戴起來非常的輕讓我完全不害怕(我真的很怕痛也很膽小)

 這次拍攝的winter symbolic moon ，星星和月亮本來就讓我有種迷幻、夢幻的聯想
戴上它給了我全新的樣貌，然而希望自己也能成為黑暗中最閃耀的光芒。

 #SparkDelight
#swarovskitw","1570647054","","","","",""
"https://www.facebook.com/angelinachen0815/posts/2698068203571479","1569245300","#高效5日BODY挑戰 !
每到了中秋節烤肉都是連續不間斷雖然很罪惡但還是無法抵擋美食的誘惑吧？
光是中秋我就過了將近一個禮拜...
每天烤肉醬，油膩膩的肥肉，再來就是喝酒了，連宿醉了三天後...
現在要回歸運動然後要來實行高效BODY五日挑戰！
很多人和我一樣都是外食族，常常有網友問我在外面要如何吃得快速又健康？
從今天起我會挑戰高效的方式運動5日，並分享五天省時超商健身餐，並分享在限時動態，

 大家有跟著我一起做挑戰的可以留言告訴我，還可以抽營養金1000元哦！

 以下是我的菜單
Day1 香蕉＋蛋＋雞肉沙拉＋BODYTALK高纖牛奶
Day2 雞胸肉＋茶葉蛋＋熱美式＋BODYTALK高纖牛奶
Day3 和風沙拉＋溫泉蛋＋中華豆花＋BODYTALK高纖牛奶
Day4 御飯糰（肉鬆）＋綜合水果＋香蕉＋BODYTALK高纖牛奶
Day5 地瓜＋白土司＋沙拉＋BODYTALK高纖牛奶

 有沒有發現每天的菜單都會結合一瓶BODYTALK高纖牛奶
運動後很適合喝纖奶補充高纖+優質蛋白質，動物性蛋白質更容易吸收! 外食不易攝取膳食纖維也能一次補充!

 便利商店飲食這樣搭配健康少負擔！
回歸正常生活，從運動飲食做起！

 #高效5日BODY挑戰 - 1000元營養金抽獎活動辦法
STEP 1 10/25 前，IG分享你的運動飲食貼文(照片含BODYTALK且為公開帳號) 
STEP 2 @girlstyle.tw 並 #運動喝纖奶 和 #纖奶 
就可抽 7-11禮卷1000元喔！

 #加碼抽奶
在此貼文下方 @你的兩位好朋友，我就會抽出20位幸運兒，有機會獲得纖奶五天份!

 *備註：禮卷一人最多五次抽獎機會 ，詳細辦法請參見 https://pse.is/LUABW

 #BODYTALK纖奶販售區域
目前限定於7-11大台北地區(北北基宜蘭)及大台中地區(竹科以南、苗栗、台中)販售(實際銷售情況請依7-ELEVEN各門市而定)。

 #高效body五日挑戰
#纖奶
#運動喝纖奶
#bodytalk
#BODYTALK
#BODYTALK營養邀約","1570647054","","","","",""
"https://www.facebook.com/angelinachen0815/posts/2715111215200511","1569983131","本來就一直有在練拳擊的我，今天來到@mixfitboxing 體驗覺得太開心了!
教練團隊是曾帶過我上課的職業級教練，師資真的一級棒!(而且教練還記得我真的太感動了)

 除了拳擊課程以外，這裡還有一對一體能教練搭配訓練，訓練效果更加乘！

 最近天氣一直下雨，除了工作之外那都沒去，身體也都緊緊的不舒服，揮拳流汗的感覺真的很爽,所有的壓力都釋放了!!
回到家我的手臂和腹肌都超酸的，想必我真的很認真運動吧!朝更好的體態前進😎

 #MIXFITboxing
#MIXFIT全方位健身中心
#拳擊x體能雙系統課程
Mixfitboxing 全方位拳擊體能健身中心","1570647055","","","","",""
"https://www.facebook.com/angelinachen0815/posts/2701819066529726","[Error]: TypeError: Cannot read property 'attribs' of undefined","Shopbop 大促又開始囉！
在網上已經搜刮超多衣服等著開箱!!
越買越多越買越買越無法克制😂
要不要在26號晚上9點開直播跟大家分享我的戰利品好不？
這也身上這件KENZO連身褲我穿是不是超好看❤️包包也好看❤️
ZAC Zac Posen包/http://bit.ly/2lrazBa
KENZO連身衣 / http://bit.ly/2mDIM0g

 當然 你們也趕快抓緊時間先逛，把喜歡的商品放進購物車裡輸入下面折扣碼超划算!

 #shopbop秋日風暴限時大促
結帳輸入折扣碼「STOCKUP19」
購物即享8折 滿500美金升級75折
（優惠結束時間至9/28 15:59 截止）

 #shopbop #shopbop時尚開箱","1570647055","","","","",""
"https://www.facebook.com/angelinachen0815/posts/2591870994191201","1564287414","我媽問你這樣拍在幹嘛
我：收到情人節禮物太開心了麻

 正在幫我按快門的媽媽
覺得自己女兒傻到快門都按不下去了
🤷🏾‍♀️ like mother like daughter 🤷🏾‍♀️

 @coach #嫣紅芙落麗淡香精 
#甜甜香香到心坎裡
#絕對是女孩們喜歡的味道","1570647055","","","","",""
"https://www.facebook.com/angelinachen0815/posts/2575608675817433","1563533444","選底妝就像是挑衣服一樣，如何選對和你最速配的底妝?
大家都不陌生的雅詩蘭黛粉持久底妝，除了持妝度破表外，
妳還知道它的另一個厲害秘密嗎?
透過全球7000位不同女性測試，設計出CNW iMatch專利選色科技，到櫃上透過試色卡，只要1分鐘，就能精準零色差，找對專屬自己的肌本色！
再也不用擔心找不到適合自己膚色的粉底了！！

 而粉持久之所以很持久就是她真的太持久了！！(抱歉好像讓你們看到廢話)
我現在人在希臘 ! 天氣也非常的熱，從早到晚帶妝完全不脫妝也不會有任何暗沉狀況！
但除了推薦他的持久度，很值得一提的是它的遮瑕度！
臉上的疤痕都輕鬆遮瑕～

 
身為小麥肌的我其實不是每種粉底都可以使用的，有些質地用起來會灰灰髒髒的，這次雅詩蘭黛特別幫我從暖色調裡選出適合我的粉底色，使用起來非常自然而且很貼妝，像我是屬於T字比較容易出油的類型
，到了下午晚上，臉上的光澤越來越漂亮，而且也不容易暗沉脫妝，這次去希臘出差，外國朋友們還問我底妝是哪一家的呢？！

 預約靠櫃試色可以獲得愛心氣墊粉撲，購買底妝還可以加贈小棕瓶7ml
http://bit.ly/2JOwMkL

 #DoubleWear #NO1超級粉底 #粉持久 #底妝專家 #打造肌本色 #雅詩蘭黛粉底","1570647055","","","","",""
"https://www.facebook.com/angelinachen0815/posts/2583316395046661","1563879914","還記得前陣子有和大家分享很厲害的新品-小棕縮時精萃嗎？還沒上市就引起討論熱潮，你那時也有被生火到去+1嗎？我實際體驗了七天的小棕縮時精萃產品試用包，終於拿到正貨啦!
小棕縮時精萃舒緩肌膚困擾的能力實在太強大了! 讓我超級擔心它用完~越用越滿意XD
我的肌膚因為長期上妝、熬夜趕稿，就算很仔細地清潔保養還是不能抵擋有時免疫力失調，肌膚敏感的狀況。
最近卸完妝後常常會有部分區塊敏感泛紅的現象，實際記錄了當下的膚況，雖然不是整臉，但這些泛紅讓我非常的刺癢不舒服，而且感到膚質摸起來乾乾粗糙。只使用原有的精華液無法有效的緩解這個肌膚困擾，甚至影響到後面保養吸收。
但自從用了小棕縮時精萃後，對於小棕縮時精萃強力改善肌膚問題，感到相當佩服！我每晚都會在精華液後面疊擦上小棕縮時精萃，夜晚好好的把每天遇到的肌膚問題歸零，穩定敏感膚況很有感，小棕縮時精萃不會和原有保養打架，好吸收而且會讓保養效果變得更好！隔天睡醒，肌膚都能回到最好的狀態。
這樣體驗下來也至少兩週了，對於每天早上起床，肌膚的平滑和滋潤度相當滿意!後續上底妝也超服貼細緻，而且每天晚上保養後一小時內就有效舒緩乾燥泛紅、敏感，肌膚超透亮!是一瓶任何膚質都可以使用的縮時保養!
這麼強的夜間保養神器，一滴全能，結合現有的保養加上小棕縮時精萃根本是為肌膚開了一層超強美肌功能!肌膚狀態好到素顏都以為上妝了!真的不能只有我知道!
大家快去領試用包就知道他的強大了 http://bit.ly/2JKBU9B
#小棕縮時精萃 #危肌歸零 #1小時奇肌有感 #危肌斬草除根 #PressResetTonight #年輕關鍵就在今晚 #TheNightIsYours 
#雅詩蘭黛保養","1570647055","","","","",""
"https://www.facebook.com/angelinachen0815/posts/2474318525946449","1558754646","運動到現在對於運動服飾就會以一定程度的挑剔
剛開始的時候會覺得青菜穿穿就好
穿過好的材質後才知道差別有多少
現在選擇運動服裝
我非常注重貼合度、包覆性，以及材質。
好的材質剪裁在運動過程中可以帶你上天堂
壞的品質只會毀了你的運動過程
VC STYLE 認識她們將近3年
一年比一年的更強大，材質剪裁也得到我的認可
今年的高腰款彈性非常好，運動過程中也不用擔心鬆脫跑位曝光，讓我在運動過程中非常有安全感，更能專注在運動的成效!

 @vcstyle.vc","1570647055","","","","",""
"https://www.facebook.com/angelinachen0815/posts/2641277195917247","1566652954","@forartssake 微風信義開幕
臉上這副墨鏡保證在室內看不清楚
都必須把眼鏡拿下來與朋友相認😂

 #fashionkilla #forartssake","1570647055","","","","",""
"https://www.facebook.com/angelinachen0815/posts/2568168149894819","1563185731","愛運動是癖好，愛鞋是嗜好。
大家一定不可能不知道我家有滿滿的鞋牆，擺得不是高跟鞋，而是休閒鞋和運動鞋！
沒錯，我是一個心裡住著小男孩的大女生。
這次亞瑟士 ASICS 終於不再是叫我介紹運動鞋啦！竟然是可以兩穿的鞋型！！！！
運動，休閒都可以做搭配！怎麼可能？
腳上這雙GEL-Kayano 5 og外型就像是老爹鞋，但同時是運動鞋。
當然好不好穿這可是要實際體驗過才知道。
上了健身房，這雙鞋的包覆度非常好，鞋底也非常的穩，對於做重訓的人來說穩定度是非常重要的！
離開了健身房後，和朋友們相約吃飯，這時候也不需要換鞋，換上輕鬆的便服也能搭出今年最流行的老爹鞋復古感。
我選了自己最喜歡的螢光配色，藍色配黃色，不管身上搭配什麼顏色，像這樣的白底搭配亮色系，都還是能夠看到穿搭的細節！
非常的實穿好看！
>>> https://reurl.cc/0r6pA","1570647055","","","","",""
"https://www.facebook.com/angelinachen0815/posts/2447881678590134","1557468448","今晚微風之夜
我會在 @allsaintstaiwan 看到你們嗎？","1570647056","","","","",""
"https://www.facebook.com/angelinachen0815/posts/2701382329906733","1569393412","講到球鞋怎麼會沒我的事🙃","1570647056","","","","",""
"https://www.facebook.com/angelinachen0815/posts/2691391407572492","1568954886","I love the confidence that makeup gives me.
Good makeup , good mood , good day🐕🎶

 這篇很犧牲
用大相機來拍攝素顏膚況
膚況再好瑕疵還是一一呈現給你們看
(那天很忙沒時間卸眼妝在這裡先抱歉一下)
但你們又不是沒看過我全素🤷‍♀️

 好膚質要搭配好底妝
每個月總是有那麼幾天肌膚會出意外
上妝總需要遮遮掩掩

 很久沒有體驗氣墊粉餅了
每次拿到它們家的新品
總是會讓我嚇到尖叫
然後開啟推銷模式
真的太好用(看照片就知道)

 使用順序是這樣的
先使用超顯白防護濾鏡乳SPF45 PA++++
為肌膚加強防曬也保護肌膚抵抗外在的髒污，這瓶我已經使用第三冠了吧，不管出門去哪，一定會擦上它，在上底妝前也能有玫瑰色澤的潤色效果，讓膚色更均勻底妝更服貼
接著萬眾矚目的超持妝全能氣墊粉餅!!!
出門在外我都會帶著一顆氣墊補妝，它很驚人的是使用的量不需要多遮瑕力超好!!!!
肌膚上的斑點細紋小瑕疵只要輕拍上他，後續的遮瑕步驟直接省去，節省了上妝大半的時間
再來我很喜歡它在臉上一開始的霧面妝感，到了下午後漸漸的轉成奶油光澤，超持妝，非常貼膚
小小撇步:使用141扇形刷頭，喜歡無妝感的女生，就能完全能夠體驗到什麼叫作細緻妝容了!
最後再使用超持妝無暇粉餅定妝，粉質非常細，結合氣墊粉餅讓霧面妝容發揮到最極值!!!!
超時髦的包裝帶出門也很好看!

 #超持妝全能氣墊 #殺手氣墊 #殺手顏質 #持妝無所不能 #超顯白防護濾鏡乳 #超持妝無暇粉餅 #141專業彩妝刷","1570647056","","","","",""
"https://www.facebook.com/angelinachen0815/posts/2446606542050981","1557406700","不誇張我真的刷卡了!!!
文章要繼續看下去阿!!!!!.
身為忠實恐龍迷，其實在Rexy系列開始推出的時候我就已經為之瘋狂了
從小就很喜歡恐龍化石
甚至還想刺恐龍骨在身上!!

 每一年Rexy的設計和變化都超可愛♥️
今年，跳脫男女框架，從服裝到手拿包以及帽子都是中性包款。
你們說說這系列不是都刻上了我的名子？
身上的Rexy T 我特別選則oversize 尺寸，男裝女穿的概念也是我最喜歡的，再配上超可愛手拿包!!!超完美的😍
瘋狂到把我身上的每一個單品都購入了，相信大家之後也會瘋狂的看到我的穿搭～
我很不想跟大家說，但因為我已經買了所以沒差🤷🏿‍♀
照片裡的恐龍鴨舌帽是限量喔的!
每個顏色限量五頂，已經有一頂被我買走了(好爽)
猜猜看我買了什麼顏色？

 5/6～5/19 101松智路出口有 Rexy pop up 快閃店!

 想獲得照片中可愛的立體貼紙嗎？
參加 Rexy pop up 限定小活動
5/11-12 5/18-19 週末 我一樣到台北101 和Rexy 燈光裝置拍照上傳到個人FB or IG 既可以獲得立體貼紙喔!

 記得信用卡也要帶著，你們一定會和我一樣受不了的啦!

 #CoachNY #RexyTheCoachDino
@coach @ TAIPEI 101 MALL 台北 101 購物中心","1570647056","","","","",""
"https://www.facebook.com/angelinachen0815/posts/2434156469962655","1556761571","#今日五點起床的安俺 @ 星巴克草山門市","1570647056","","","","",""
"https://www.facebook.com/angelinachen0815/posts/2648126365232330","1566962506","Jomalon罌粟花與大麥新品發表
除了美女看到飽😎
香水也是噴到飽呢

 這罐的味道真的很難以用言語形容

 合不如大家直接到櫃上聞聞 
相信你們也會跟我一樣立刻沈醉在這罐香水裡

 #poppyandbarely @jomalonelondon #罌粟花與大麥","1570647056","","","","",""
"https://www.facebook.com/angelinachen0815/posts/2644391272272506:0","1566789549","Wake up and make up 💄

 #chanelmakeup 
#createyourself 
#rougeallureinkfusion
#818","1570647056","","","","",""
"https://www.facebook.com/angelinachen0815/posts/2686054141439552","1568721735","看我重回60年代名媛的優雅日常！
#Sisley #Fashion #秋冬服裝","1570647056","","","","",""
"https://www.facebook.com/angelinachen0815/posts/2570354783009489","1563286839","Pool golden hour!!!!
@apivita 
@apivitataiwan","1570647056","","","","",""
"https://www.facebook.com/angelinachen0815/posts/2713302072048092","1569906350","特別去梳了顆山寨龍母的頭
風雨無阻坐捷運到了北投(那天下大雨計程車很很貴啦)
整個車廂都在端詳我的造型...
第一次趕場坐捷運獻給你們了😂

 剛好這次 @louisvuitton 高級珠寶展覽
包下來32行館展出了以中古世紀為發想的珠寶系列 真的美到不行😍
當然現場見到一堆好朋友也相當的開心
感謝LV邀請❤️
#LouisVuitton","1570647056","","","","",""
"https://www.facebook.com/angelinachen0815/posts/2691634130881553","1568967008","今晚要出席 Rather 秋冬時裝秀
想知道我穿什麼出席嗎？
我們晚上見嘍!!!","1570647057","","","","",""
"https://www.facebook.com/angelinachen0815/posts/2594074350637532","1564395939","回到台灣馬上為自己預約了海洋拉娜的頂級護膚體驗，消除一下轉機兩次的疲態～
海洋拉娜的品牌起源來自於海洋，以純粹和精進的技術，在最純淨的水域中摘取深海
裡的海藻並萃取出富有強大修護力的海洋拉娜核心成：Miracle Broth™ 濃縮精華，也
就是現在我們熱愛的海洋拉娜每一項產品裡的珍貴成分。
到了現場，海洋拉娜為每一位體驗的貴賓們打造豐富的視覺、聽覺體驗，引進最新科
技，特別打造專屬沉浸式體驗空間，可以聽見陣陣的海浪聲，就像穿越般來到美麗的海
底世界!給了我們不一樣的護膚體驗。
海洋拉娜更為賓客們規劃了頂級的護膚體驗，而且還是客製化的唷!
掃描QR Code 就能先在網上選取自己在意的肌膚問題，並在接下來的療程中就會為我
們量身打造適合自己的產品以及按摩手法。
不知道是我的年紀到了還是怎樣，看見緊實、拉提，完全自動忽略了其他療程😂
但其實海洋拉娜有分非常多種的按摩工序，會因應每人的肌膚需求達成想要的療程效
果。
從精華液到面膜及最後的乳霜選擇都是完全客製化，超貼心!另外我不得不稱讚一下老
師的按摩手法!超級無敵舒服!其實臉上有很多的穴位，老師的手技、力道都恰到好處，
超舒服的!很不想她的手離開我的臉，想把海洋拉娜的產品與老師一起打包帶回家。
按完回家後連我媽都覺得我臉變小了，水腫好像都退了一樣～
不論是產品、手技以及每位老師的專業服務，真的讓這場頂級的護膚體驗達到最奢寵
的極致!
療程後還提供精緻的餐點和梳妝台以及髮型師，讓護膚體驗後大家一樣美美的!
海洋拉娜不論是在場地的佈置，一路到體驗療程都能感受到她們滿滿的用心❤❤❤❤
La Mer 海洋拉娜
#海洋拉娜夏季護膚盛宴 #LaMerTaiwan #海洋拉娜 #乳霜就是海洋拉娜","1570647057","","","","",""
"https://www.facebook.com/angelinachen0815/posts/2659436667434633","1567511467","一起拍攝了一天，三個人的笑聲把整個攝影棚都掀開了!
這次挑戰浪漫甜美的風格，和以往大家看到的打扮不太一樣!
Tory Burch 給我的印象一直都非常的紐約，用色剪裁都非常大膽
在我身上的碎花印花也展現出美式復古的元素,穿在身上也多了成熟慵懶的感覺

 今年的復古潮流你們準備好跟上了嗎？
@ToryBurch
#ToryBurchFW19
#ToryBurchTaiwan","1570647057","","","","",""
"https://www.facebook.com/angelinachen0815/posts/2654179207960379","1567250607","穿上我的新愛靴走跳
靴子是不是超好看!!!!
朋友都說我像黑芭比❤️(我不要臉)
@ TAIPEI 101 MALL 台北 101 購物中心","1570647057","","","","",""
"https://www.facebook.com/angelinachen0815/posts/2670551246323175:0","1567997290","發現自己累積了好多照片沒放

 @narsissist 的新系列超滋潤好擦
根本是護唇膏質地
帶有珠光的顏色不論底色上什麼色疊上去都有不同的效果是我近期的最愛!

 #narstw
#nars熱帶秘境","1570647057","","","","",""
"https://www.facebook.com/angelinachen0815/posts/2661516223893344","1567596699","想見我？48小時後的9月6日，
我會擔任最潮籃球遊戲《NBA 2K20》的一日最美大使，
就在台北微風松高的NBA Store Taipei，
聽說現場還有全球唯一的 《NBA 2K20》行動Barber Shop，
一邊玩遊戲，一邊來讓安俺幫你搭配個最適合的強大髮型吧！
台北時間9月6日下午1點見～
#NBA2K20 #WELCOMETOTHENEXT #迎戰未來 #SponsoredBy2K","1570647057","","","","",""
"https://www.facebook.com/angelinachen0815/posts/2729380493773583","1570588729","太愛這套西裝了!
要不是助理在現場我一定腦衝把它買下來
(喔忘了告訴你們 助理現在是我媽的內線)

 後來想想也可能是金髮的關係
穿什麼感覺都和從前不一樣了
(於是呼籲大家去染金髮 喂～)

 @poloralphlauren
除了眾所皆知的POLOGP非常有名之外，對我而言反而真正讓我印象深刻的是他們的正裝，從剪裁，到材質，都是非常非常細膩版型也非常的漂亮
今年重新詮釋學院風，用柔和溫暖的色系搭配經典大LOGO字樣，我偷偷趁助理不注意時，入手了一件經典的LOGO毛衣，再分想給你們看!
今年第 Ralph Lauren 你們一定會很愛的相信我!

 我知道大家看我們工作花絮也看得很膩了吧
但能夠一直接觸時尚和各種我熱愛的事情
身處在這樣的圈圈裡覺得自己好幸福呀!

 #poloralphlaurentaiwan","1570647057","","","","",""
