url,posttime,text,crawled_time,attachment_link,attachment_img,attachment_img_alt,attachment_title,attachment_brief
"https://www.facebook.com/billypan102/posts/10153902358353639:0","1476930591","比起下個月洪秀柱的洪習會，已經到中國進行訪問的菲律賓總統杜特蒂和習近平之間的杜習會，更值得台灣人關注。

 
菲律賓長期親美，前總統佈局三年之久的南海仲裁案大勝，讓菲律賓狠狠將了中國一軍。在台灣，親中的國民黨敗選，日韓也和美國靠得更近。本來美帝從韓國，日本，台灣到菲律賓的島鏈大戰略看似固若金湯，但這一切卻因杜特蒂這『狂人』而突然出現破口。

 
中國才強占黃岩島沒幾年，國仇國恥，菲國人普遍不喜歡中國。在其它國家，杜特蒂向中國示好的言行大概會被當做秦檜，當做『菲奸』吧。但是這轉變來的太快，菲律賓人來不及反映，美國日本來不及反映，恐怕...

 台灣人也來不及反映。

 新南向政策?台灣現在恐怕連坐船開飛機到太平島都要提心吊膽了。

 
杜特蒂被人家叫『菲版川普』，但兩人還是有些不一樣。川普的性格主要是病態性自戀，而杜特蒂除了自戀，和川普一樣好色，還帶有很強的反社會性格，殺幾千人完全沒有同理心。幼年時被神父性侵的創傷經驗影響了他的人格。他突然變臉仇美親中，也可能是人格異常的表現。

 
『狂人』的異常性格，在精神病理學裏有脈絡可循，而『狂人』之所以能成為國家領導人，也一定有背後的社會心理因素。天上掉下來的禮物，習近平會使出洪荒之力把杜特蒂弄得服服貼貼的。一帶一路，狂人開路。

 杜特蒂，川普再加上一個金正恩，對政治狂人的心理素描和行為預測應該是在夾縫求生的小國如台灣的重要國安議題。","1571565892","/billypan102/photos/a.431566178638/10153902358353639/?type=3&eid=ARB20QBSt4JMn7hA6or7TDzQkFYp7xArEuRLHB-beEjanfQiGch_Ztu3giOJarzbTyy4TNzCoMI0_5Gu&__xts__%5B0%5D=68.ARCYvTy66yV90MHnpAJ6xXlLTTjEDZgnOifUaKbcdmf2hoPRZGVMC8A6GJPRKac3fWeCpH4E7ehD7msv5W7mVdPQmidn07_t7RwQvtI6SPRU05-mKt5GsJ1X2C8TYHbipl8h5EkZlceZoXLtPZCujQC2FOvgAk0Cjtb2tCdxn2Yr-F5mKuT00xD4EREzoQJ59VNYuh1EEjuiqjddYVUQyouIFLd1EC5FJ8bh66HJrfOCIvtsVOZig7RWcrlhYHXyHtzmSDBttQ_2Tg9hZOX0n_3PIJB75vMghURWjtpQQHMSnXeg6JNB5qZ3XEK47P8Ns2cCTAs97UEVO6H7Mfbe&__tn__=EHH-R","https://scontent.fsdu2-2.fna.fbcdn.net/v/t1.0-0/p235x350/14718707_10153902358353639_6889335699241889687_n.jpg?_nc_cat=111&_nc_oc=AQmvS33xZ7we7_0Y1vJzIA9zRa1T6oatnlGzGBZIGzBBs-x8xULMW-yZkX3Xk7Nmo60&_nc_ht=scontent.fsdu2-2.fna&oh=f6ef53d797f95b5bdc6b376d253df600&oe=5E3008FF","undefined","",""
"https://www.facebook.com/billypan102/posts/10153624686813639:0","1467516563","*〈台北都會〉柯市府去年開源57億 少花237億
http://news.ltn.com.tw/news/local/paper/1003132

 一年一來一回快300 億。光這件事，人民就該支持柯P連任。

 這幾個月有股『黑柯』暗流。網路和媒體混夠久的人，很容易看的出是那幾股勢力想要帶風向。

 
以台北市政府的資源，要心懷不軌操作媒體根本易如反掌，但柯P沒有。當年劉政鴻可以用買的買到五星縣長，8年留下幾百億爛攤子，之後仍是國民黨選上。只要花錢宣傳和討好，雨露均霑，操弄民意並不難。

 
舉債造成的財政赤字黑洞，把問題丟給下一代，不但是台灣，也是全世界九成政治人物無法解決或不願意解決的難題，這包括過去民進黨地方和中央政府首長。因為樽節必然帶來反彈，會傷害自已政治生命。當然啦，貪官污吏一堆被抓去關或逃亡中國的國民黨人就更不必提了。

 竟然有政治人物想法『奇怪』到真的在解決財政黑洞，但是人民理解嗎?

 社群媒體時代，每個人都是評論家，也應該為彼此負責。請當心那股『黑柯』逆流。","1571565892","/billypan102/photos/a.431566178638/10153624686813639/?type=3&eid=ARDWKxCp-1cHPnWSbEtbIWHtusd7ZNv4X7ZM2fMhF9xNQ2O55KXkBc-ya2KJp6UZGv_jF7kyl7jG82p3&__xts__%5B0%5D=68.ARD17MYgXwDOE44sFJYoCrVJGOyj9xaSr5mYnIFMFdJAMjusHYoY7UUcM8-EPRF9QzyEh9rNVEXM_zsvX3xVUpjsL3dYZuvbegOIm1vccvzBPs9tbP8aRSjeioVJ-z3lsFb_JvKq1KPk07feUfIkmRWEj757EVfuT_yeuj2f-VHgcW_OTNYqtVXGI7jy-P9dRI0-EVbYMAoJva-i3UD4N3CEz9vBggIY1SKF7bY9F0Ldbtz2yQ0hyGgBUH2WEBPtRBjDBpU9RX4kHWaAi1T3F0rZTxGrkVdfXaR07ptYMcl1rPK0SSXVeEezPIL-K56RXd8depP8bOeI-Otkf3io&__tn__=EEHH-R","https://scontent-waw1-1.xx.fbcdn.net/v/t1.0-9/13557754_10153624686813639_3108218184706595092_n.jpg?_nc_cat=109&_nc_oc=AQkvUDChAi1XqVuf6fatUeBXe-zTbwAg6OdGKqcW0Wi4PB-JEmCk3QwfzKiiUY7lPjY&_nc_ht=scontent-waw1-1.xx&oh=c7918be2831f36a97cda9252faaec00d&oe=5E2ABC62","undefined","",""
"https://www.facebook.com/billypan102/posts/10153666114758639:0","[Error]: TypeError: Cannot read property 'attribs' of undefined","","1571565892","undefined","undefined","undefined","undefined","undefined"
"https://www.facebook.com/billypan102/posts/10153958880833639:0","1478773983","說川普是瘋子，那選他的美國人頭殼都壞掉了嗎?

 
當然不是。川普愛講屁話活該被罵，但他當選，代表的美國民意必需認真解讀。在台灣，川普被主流媒體扭曲的過頭，沒有適當評價。我們覺得驚訝是因為不了解多數美國基層人民的想法。

 台灣政治經濟和媒體高層菁英，不分藍綠統獨，還是滿腦全球化思維。現在英國脫歐，川普當選，實實在在地辯論過投票過，顯示連英美資本大國都討厭太自由的貿易結構了。

 
說什川普當選TPP(跨太平洋夥伴關係)無望，廢話，連希拉蕊考慮再三都放話反對TPP了。美國人不喜歡玩這些了啦，不管誰當選，註定沒搞頭。行政院還說要推動台美FTA，是怕沒事情做嗎這些舊官僚?光是豬肉，小英要面對台灣豬農，川普就不必面對美國豬農嗎?川普最想讓美國工廠再開工，台灣要計劃買哪些武器才對啦。

 
318太陽花學運，台灣人更早拒絕服貿。各國人民起義反全球化已勢不可擋，交易自由帶來經濟成長，但卻惡化分配，過度化的自由主義，經濟成果沒有共享，底層失業低薪問題長期擺爛不解決。菁英?政治正確地溫良恭儉讓，刀叉吃人肉，越像菁英越會被魯蛇們黑(hate)啦。

 民主社會，選舉就是不流血的革命。

 川普不是瘋子，美國選民頭殼也沒壞。","1571565892","/billypan102/photos/a.431566178638/10153958880833639/?type=3&eid=ARBpVq5Kp591IiOmH61JzMa6Ud8nd4ktHBfp-p9AZrki5PT1iio25vle-pFyJLeESdMF4wT6E0p3igs1&__xts__%5B0%5D=68.ARAQybjpoBmxgr-Pu9jhs0JUIIikfieUDIOyQvwsbN73y1Q0Pk0SMcSVM9R92Xnotmf0CcFIyN6HE_9rCPy1Pd89BWyR9HzmLaRjMpVDpZLTr4vkbjkviPypl-whY87cUCQgVZc6TSLJAjfkI_BmaCHijgPTBT3WZA9EkkhT5KP51pXTud2kJmLFIHubHImLH3rK953P4qyVrKONriLA6N24rOdwAaTjhCcMwAIGCSOJ79cBBgGi9hlv5wYuF8UnrNYnEga_vxFLtoOPwAloW1OkjFMbEjfcXsbHMZiEqzFvJdCA1pIuN2c_UhVvEY7luRtksHxdHopcszNrnnIr&__tn__=EHH-R","https://scontent-ams4-1.xx.fbcdn.net/v/t1.0-0/s526x296/14938134_10153958880833639_1044914286245302151_n.jpg?_nc_cat=100&_nc_oc=AQnJL4laSIFEZh-Per3k3-zxXEc8_eLw5J6voaawBsppAaHv5oddGveqOht0XImaC3Q&_nc_ht=scontent-ams4-1.xx&oh=ba490343079cb4d0ffe522b5ca2729f5&oe=5E252B7D","undefined","",""
