url,posttime,text,crawled_time,attachment_link,attachment_img,attachment_img_alt,attachment_title,attachment_brief
"https://www.facebook.com/billypan102/posts/10154398478108639:0","1492322420","金小胖嫌局勢不夠緊張，過完太陽節，凌晨又發射導彈，昇空後馬上爆炸。

 川普對習近平的美言和期待看來落空，習大大要改名成習小小了。完全管不住身邊的北韓小弟，號稱強國根本虛有其表。

 也有可能習近平兩面手法應付川普，中國私下仍要求北韓繼續壞蛋角色，偷偷輸送資源給北韓發展核武和導彈。

 管不住北韓中國在國際間沒面子，打假球中國沒誠信。不管是沒面子或沒誠信，中國顯然不夠格當聯合國安理會常任理事國。

 美國早就看出習小小不可靠，所以川習會規格不高。川普已給足面子，美國自己真要動手前，不會通知中國。

 南韓總統大選在即，主張親美和佈署薩德的安哲秀要逆轉勝當選了，多虧金小胖這個瘋狂的助選員。","1571565889","/billypan102/photos/a.431566178638/10154398478108639/?type=3&eid=ARD4uwty8uqb3IWtLyW-YX22tJpFhEwdDIc9Gsv5vGHjZxblkpv4YdRenOxXG1sTzKjPcL6W6oai2x_p&__xts__%5B0%5D=68.ARCZcguiHyXrJUchK6z1g1MClX8pytAtkFRY84YcdPjzBse1rHR8NCe99cva94VEwE9BkZjQzqM8_anOTkz4OvlAwKAcAsGQyuz2T5KppZKSNBvN-sw5CdIf_ThkBTB-Ald30a1XKl0Ghr_v0T32JioDjd5I8BHRwPXvXjvzYTBm0D-lM4Hxyi6bOUc57X9crsQ5ltMQUtNMhgMTC8rik-n11elh_9YCQGB9-kldWgdF7tYpf-umXE7tjkPeGoFxgTKGdp2XNW4LjvEe1n87xJ2I_iQyoFB3mVlVXSuE9-EPzFqj4rjrd0grQrKFYFyb09X-Am2MsXNC_rtIKaqt&__tn__=EHH-R","https://scontent-cdt1-1.xx.fbcdn.net/v/t1.0-0/p235x350/17862595_10154398478108639_6259178834291466575_n.jpg?_nc_cat=111&_nc_oc=AQmtdrtStVfhupYrADtp6HdvpzCP_msBQXK-l15Qb2Ou-Hm6vf3WMqHkWI475b0ydAE&_nc_ht=scontent-cdt1-1.xx&oh=839c20104127bef9e37e7351dd9b2b97&oe=5E62381C","undefined","",""
"https://www.facebook.com/billypan102/posts/10154434695203639","[Error]: TypeError: Cannot read property 'attribs' of undefined","",1579360775,undefined,undefined,undefined,undefined,undefined
"https://www.facebook.com/billypan102/posts/10154336586203639:0","1490436561","同性婚姻是比手機科技還新的重大議題，世界上最早承認同性婚姻的荷蘭也不過是2001年。

 
憲法中沒有提到婚姻二字，同性婚姻釋憲案，我認為重點在憲法中的7＊平等和22*妨害社會秩序公共利益兩原則。同志是否應該和其它國民一樣在法律上平等，而同志行使婚姻這一自由權利，是否妨害社會秩序影響公共利益。

 
兩個原則都需要對同志議題有深入了解，拿出客觀証據來代替偏見。所謂的客觀証據，不是邱太三講的『易經』或是什麼『我國幾千年來』的胡言亂語，而宗教信仰的主觀更不可靠。同性戀是古今中外廣泛存在的事實，美國的同婚釋憲案，因此邀請美國人類學會專家來提出証詞。法務部作為行政機關，不該表達政治人物政黨特定立場，而應擔任起提供客觀証據的協助角色，在這一點上，邱太三明顯失職了。

 憲法第 7 條：中華民國人民，無分男女、宗教、種族、階級、黨派，在法律上一律平等。

 
憲法上的法律平等原則是否適用於同志甚至是跨性別族群?我認為答案是肯定的。無數的科學和心理學上的証據都告訴我們，性傾向並不是一種異常，不是疾病。同志一樣對人群有重大貢獻。邱太三應該提供科學証據給憲法法庭做為判斷參考。

 憲法第 22 條：凡人民之其他自由及權利，不妨害社會秩序公共利益者，均受憲法之保障。

 
同志婚姻是有很多人反對，但因為同婚而『妨害社會秩序公共利益者』的現象出現了嗎?台灣已經有很多同志伴侶組成家庭，也有公開儀式，只是法律上尚未承認。法務部應該了解這些同性伴侶家庭的現況，也有很多國外的研究可以參考。反同團體提出的『同婚毀滅世界』觀點，大部份是宗教情懷引發的恐慌，通過同性婚姻的20個國家並沒有出現什麼亂象。婚姻對人類的心理和健康有著正面幫助，這是國內外醫學研究一致肯定的，給同志們婚姻權利，反而能增進他們進而帶給整個社會更大好處。牌位上要寫什麼，妣考妣考，妣妣考考，民間自有解法，法務部的層次應該要更高，人民付薪水不是讓你來耍笨用的。

 憲法目的在保障少數人的平等和自由。而社會要能進步，也建立在對少數人的理解和同理。

 政權輪替，皮卡丘的進化型式是雷丘啦，不是妣考邱。","1571565889","/billypan102/photos/a.431566178638/10154336586203639/?type=3&eid=ARCsYrZ2bSMAUmpa4Kb0HBTR6FHaAz2IxRpyFuyZ4VfwVMU6AWHGhVRVyuqC2w1ubaiTELKwVXQ5gVo-&__xts__%5B0%5D=68.ARCEwwcWmndtu_mwGcU14RerKKKCx4ohB2kfDXLPi_bFRvqGKqQHZbpvll2a-muq329ovsC1WZHs6UgSIxJuTxquUfYbj4xOOUe4jlpM_inXjSSojPH86FH96cKpKOocxZOLh8GhZJrMRmx_oTDTBxm3jKZsNrFKCZVbfQEdp-MwCnJRWTeEn8oEJrsMAIz0gQxz-lv9Xjne9T1s8odR1ZzpJvO6NPB5UC5G5fPMS-xpDy90UM3nZDQKEMWkYi3dSNLfsNYG7-EwBP9BySBoSGSr0MzjSUbQMzjJ-vfyKiDcm2fyycQRFAfDUAXkhPFBCWwIwTbPLknc5ytxYxX1&__tn__=EHH-R","https://scontent-cdt1-1.xx.fbcdn.net/v/t1.0-9/17424717_10154336586203639_1261381578852479089_n.jpg?_nc_cat=104&_nc_oc=AQmewqA_o-oHvduUX--_vpQ8Y1CBqrQ2wvDfQh0zMpuTANhK3fBNPLpjrC4DR2zurX4&_nc_ht=scontent-cdt1-1.xx&oh=296b715d84583d2276996eefd8601235&oe=5E5C1E96","undefined","",""
"https://www.facebook.com/billypan102/posts/10154342847663639","1490663298","樓上的鄰居阿姨前幾天向我抗議：

 潘醫師啊，我十幾年來每天早晚在佛祖前唸心經：『心無罣礙，無罣礙故，無有恐怖，遠離顚倒夢想，究竟涅槃。』不是說無有恐怖嗎?為什麼我還會得到恐慌症跑急診?

 
一時之間不知道怎麼回答。琢磨了一下，我對她說：佛經不是常用『如是我聞』來開頭嗎?佛祖開示前，都要先化緣填飽肚子，門徒洗好腳坐下來才開始說法。因為要是血糖太低，佛祖講的話大家聽不下去的。妳會恐慌發作，是因為腦神經細胞的血清素太低，要先治療好唸心經才有感應啦。

 『原來是這麼回事啊!』阿姨好像還蠻能接受我的講法.....

 佛祖在上，我這樣講可以吧?","1571565889","undefined","undefined","undefined","undefined","undefined"
"https://www.facebook.com/billypan102/posts/10154216833073639:0","1486520100","我們家可愛的貓咪Miluku一條小命，是英勇的消防隊員救回來的。

 在國泰和杜克動物醫院住院8天，感謝獸醫的悉心治療，Miluku終於恢復健康回家了。

 
初二凌晨，家裏起了場無名火。當時家人都在睡夢中，最早示警讓大家能及時逃命的，竟然是我重度失智長年臥病在床的岳母，她的劇烈咳嗽驚醒了睡在旁邊的外籍看護，才發現書房起了大火。第一時間我們急著把老人家抱上輪椅推出火場，人都離開後，再想衝進去找Miluku，濃煙已經大到再也進不去。

 
消防隊員很快趕到，我太太和岳母都因濃煙嗆傷而被消防隊的救護車送到萬芳醫院急診室(很感恩同事們的悉心照顧，她們當天就出院了)。那時我們千拜託萬拜託消防隊員，一定要救救我們家毛小孩。

 
十分鐘後，消防小隊長抱出了Miluku，放在人行道上。牠側躺四肢伸直，口吐白沫，渾身濕透，動也不動。我衝過去那幾秒鐘感覺有一世紀那麼長，千萬不要啊，Miluku你可不能出事，當時我一陣恐慌發作，直到抱起牠。還好牠睜開了眼睛仍有呼吸，嚇死爸爸我了。

 之後被攝影機拍到，又被記者認出來，上了新聞。當然家裏電視看不了所以我沒看過報導。但好像全世界都知道了，第二天看門診時病患都反過來安慰我。

 
我太太看網路新聞，有網友在新聞下評論說為什麼自己不救貓而要消防人員搶救。我想網友沒有火災經驗，並不明暸火場的險惡和逃生時間的短暫。我們家在六樓失火，第一時間按鄰居電鈴通知避難。大家下到一樓後，前前後後有三位消防隊員，非常緊張地，幾乎可以說是抓狂式地一個人一個人點名，要確定火場中沒有人。家裏有兩台輪椅，推出來一台火場中還有一台，當消防隊員發現那台輪椅時，又衝下六樓緊張地逼問我們是否還有人在火場裏。

 台灣的消防隊員比我們想像中的，對生命更加重視，對工作有更有強烈的責任感。我終於能稍稍理解，那些在在救火時不幸犧牲的消防隊員們的想法了。

 
Miluku是重要的家人，陪伴我們渡過許多美好的時光，我們非常感謝消防隊救了牠的命。雖然我當面向消防小隊長致謝，但我始終不知道他的名字，難怪人們總稱他們是無名英雄。但我永遠會記得，帥哥小隊長在我道謝時，被煙燻黑的臉上掛著的爽朗笑容，那是種不求任何回報的滿足和成就感，是台灣最美的風景。

 謝謝你們。","1571565890","/billypan102/photos/a.431566178638/10154216833073639/?type=3&eid=ARDYqoD4dxf6jdrUIr1KC60OV8IYh3R4iMhV4Q3t75fVvnUK9ffXC2lIHyDDZNscJlDnXUErnA5oHCh-&__xts__%5B0%5D=68.ARD3kUyn0_T0Iz15nDq4YQzeV1LO8zHlE_lWWDGGZ4cecaOXDCJkCtv8Vz7V0ViI4hMb_BKobe5Rnbr5lxyDzvlcK-S1alDnzncN61VD5whLAPqlvWtaRLfHrHbaD1_Nqzgz7mo4DuH7YfoKjW2_qivdj6ovyayJ1L1dhVMAORBpFvEYWWZrd1mUcm8MvyTiZGK4pGEzmaAL7wgOvLJ9uOryksCnThYfPvFChnklgEmlEbV2xiq9Dzfqgw6c7q60L2B1lEG64QXD3_cK6fmLZ67PfDB2qNvcXfOeMt-4UpbuPYnKa-3eWstJuG1Zcb9EyMNma6T3p4yNl2QVUFTc&__tn__=EEHH-R","https://scontent-sin2-1.xx.fbcdn.net/v/t1.0-0/p526x296/16473497_10154216833073639_6500869616999675588_n.jpg?_nc_cat=107&_nc_oc=AQmwF7hWX4Ih4U6mCkDXDQYKcpd1bmkIrwdHjAkujnGCUs8gPaCH-NYeTPBMsHG0Gmg&_nc_ht=scontent-sin2-1.xx&oh=81cb6ee44478de5375328a405420e0b1&oe=5E60E8CC","undefined","",""
"https://www.facebook.com/billypan102/posts/10153876717373639","1476242242","Note7的奧妙之處，是它可以藏在衣服之中，隨手可得，還可以拿著它來隱藏殺機，就算被員警抓了也告不了你，真不愧為七種武器之首！

 https://youtu.be/_GhODn4FRoE

 因為爆炸事件持續頻頻出現，三星宣告請用戶關機，全面回收250萬支Note7，不再換新機，甚至不再生產販售了。這是科技發展史上最嚴重的產品出包。

 國外網友用GTA 5的MOD模組開發了Note7凶器，可以當手榴彈也可以當地雷 (見影片)，酸度破表...XD","1571565890","https://l.facebook.com/l.php?u=https%3A%2F%2Fyoutu.be%2F_GhODn4FRoE&h=AT3reh2jJ9FVY0bIns1By-oaryhIS9tafD1q6qfps9VtcU8lZ2Gqbm9np_Ya6yhWFncioZFPtPdkYzXxVN-qokf56gGdIRtQfCsVqwaWANQ5dbgWQdV_A0siek9ryzy1wocl9B3YdSDIu0-AV_BdSgekOnd5xPbHSDfIR3uJumaps7k-ZTeoVayzhssgpG5sThouV1MTW7JxnR0UBu_Z6qg2YtMoQbJClHWQb2qvJVa-YmZKzH7TAIobyYcChGnDkdplFpVKPNFpAhGcBmEEsRVQz0MLOy81CdZnKI5qiPChjetp_S_vPs8fco3qAn3nxjanxkCiit28jNRT9RBFmVqR04W9rrDzewkeB9PHv5UvjsTY2nt39a5snRBLxEOzv1NkawRUUa8mI5oBvLy4U3jRptqbhNS5LdQyxT8cVsy6923Kh2jdA9ooAXzuZKNGAYX4X8o2tBFM43yVNY8VKEHj75u5nXLA6DRSywTkMfls0YNjtwlStlsM4CJ7CEL7IvSuoDW5G22NDUyDC9McX8iQGdj4SgKxUTiRO05bzDkm84LdhX_d_91gh3YxhiWAcxnAz2CJorfLTp1TY3i61XV4SegAO4EkPMasb-USnrAwx3uZPFc0WLNlsfAf775ypl3NJipr","https://external-syd2-1.xx.fbcdn.net/safe_image.php?d=AQBAqZsJC0KPCAoD&w=540&h=282&url=https%3A%2F%2Fi.ytimg.com%2Fvi%2F_GhODn4FRoE%2Fmaxresdefault.jpg&cfs=1&upscale=1&fallback=news_d_placeholder_publisher&_nc_hash=AQDs_aGMQMjOyF4S","Gta 5 Mods Youtube","GTA 5 MOD - Samsung Galaxy Note 7 (Bomb)","Replace sticky bombs with a Samsung Galaxy Note 7. Mod by @HitmanNiko https://www.gta5-mods.com/weapons/samsung-galaxy-note-7-bomb"
"https://www.facebook.com/billypan102/posts/10154488912823639","1495106264","中時記者陳志東，在部落格上詳細踢爆了中國時報收錢做業配新聞的醜態，寫完這篇大概人也要離職了。中時不意外，往後還請網友儘量不要轉他們家的文章。

 廣告大家可以接受，但把廣告文偽裝成新聞報導就是出賣讀者。而給錢就吹捧，不給錢就修理的邏輯和流氓已經沒兩樣。

 
我之前臉書文討論『假新聞』時也提到這塊，關於各種新聞的業配化置入性行銷化。陳志東把最近中時的「編經版面」＝業配置入單貼出來了：政治人物，中央地方政府單位自已都在上面，你說政府要怎麼去管Fake
News?

 
做為一個閱聽人，就算只是滑臉書看Line，也不要輕易相信各種報導和新聞。多多善用Google，找一手資料。重大公共議題，相比不良媒體，NGO或網路意見領袖的看法還比較可靠。

 比方說，比利小五郎?(咦)",1579360782,"https://l.facebook.com/l.php?u=https%3A%2F%2Fcatdrawer.blog%2F2017%2F05%2F18%2F%25e4%25b8%25ad%25e5%259c%258b%25e6%2599%2582%25e5%25a0%25b1%25e3%2580%2580%25e8%25ab%258b%25e5%2581%259c%25e6%25ad%25a2%25e8%25b8%2590%25e8%25b8%258f%25e5%25aa%2592%25e9%25ab%2594%25e5%25b0%258a%25e5%259a%25b4%2F&h=AT1zhnpcllX4d4rcFJwkyqBQ9yf1esfGXpe9bC1D-GIXHFekPWv0iYWVCyMMKxNvfFgQXqEBxDJK-MMFQ6lTJh2WjKCddAUHykr209xIsFawJHA_AwonUef_cENT64OOV6KQYd7hJ5TrOVo-GkDZHZ1GAyVWDPiRp56Tx6qgrMIOtFK-8EQbxlplCljESRPmFUOC_q8bKFOcGmVKJCIXXIKsqatHvojVvReVH3TOYRRdA0mVWsS3KCufoav3Gjh8b1RQiQvZYLYy8zBIMcQduW9LHJmS_Bt-NUZXrpdcn1lZZzbEPOPx6Qn7KlWMn8ydwdZxnu3yQpXv5i5VEnDpFZ9tFJTBQmSXAfn212jZvZGtWMODqqbIBZ7GKWsXWnp5CaH1MfEV52F0LD_peDvKkL9Rca4JUHUHH_crKf8_rXk-xv9l6ggyOkJz5utMfOJJHds3FFSW7Utg6akN1M5WjU5IjO2i-78AssDEY4klXdXA6SmEBvminbj0t-vg415wvlaSnsNDgDPTsp1LAKci2iQp_ysMF18tnW0bjap3SnBY6K8DF3r9Zr6xStH4D-kLT4AQtTcHrOMNLcw9NJcsCyAfxw7i5TTQGpUNjY1GLrQtXniNToUgMqhCBL1BURKpJAO2bkgp","https://external.fosm4-1.fna.fbcdn.net/safe_image.php?d=AQD6AT9mKvOAuU7r&w=540&h=282&url=http%3A%2F%2Fcatdrawer.files.wordpress.com%2F2017%2F05%2Fct0045.png%3Fw%3D1200&cfs=1&upscale=1&fallback=news_d_placeholder_publisher&_nc_hash=AQBLr4jB8csXKz38","圖像裡可能有一或多人","中國時報　請停止踐踏媒體尊嚴","catdrawer.blog中國時報　請停止踐踏媒體尊嚴中國時報　請停止踐踏媒體尊嚴中國時報　請停止踐踏媒體尊嚴"
"https://www.facebook.com/billypan102/posts/10154118593703639:0","1483430669","*同性戀不是病 將修法禁止治療
http://news.ltn.com.tw/news/focus/paper/1067885

 
衛福部預告醫師法修法草案，明定未來醫療院所不得再執行性傾向扭轉治療，這是相當正確的決定。但我擔心的是，仍然有醫師和醫院體系之外的心理輔導師，諮商師，或是宗教人士等等，仍在法律管轄外接受家長的委託下進行這項業務。

 
要扭轉同性戀的性傾向變成異性戀，根本是種心理上的折磨和虐待。不需要舉証醫學裏上百年來的研究文獻，人人都可以有同理心來感覺，那就像要強加把異性戀者扭轉成同性戀一樣的糟糕。

 圖片是John Fryer，在1972年，他是第一位在美國精神醫學會年會上出櫃的男同志精神科醫師。","1571565890","/billypan102/photos/a.431566178638/10154118593703639/?type=3&eid=ARCkd-XacUHyb1fqWQk8kQcfpsWwk7vTQRAcFuiurwX21Al55GoJixBXCnaxlMhQWZOeKXFo-HAh72sh&__xts__%5B0%5D=68.ARDwxnMlnjfUm2aDVOm5MSf3x9aJht2wUYvFVySvH2mIeLt_tyoiHxu-8-c8KplJXXjm5ufsV9ELf6w-XljtZOuuCzQVTUROcICoOjLNgEzg_6CMgACqWWQDa-NoNtAHdW-qhyVpz20voixAPYNPJwBJh79SFwUDEprmvtUyU2r2pe29Gc2VWDVsBzDPau2t5_VXWq5_o-mkoogYj_m-krCNC2txyz6EHbFArtIRFfOS88kMLhmPrG7IyX3lEo4JPjYYeHiw2I6oH2b5cbMC6J9mtdxQt-lJugMRluWhYdONwk6XpGl-gDEN4RemYy0ldwUu0ZocBhsRbHAJVAlB&__tn__=EHH-R","https://scontent-gru1-1.xx.fbcdn.net/v/t1.0-9/s851x315/15780954_10154118593703639_4336149893593319419_n.jpg?_nc_cat=105&_nc_oc=AQnWLu6H0OB2TzCmn4rLL_XtpR5VcrevazDEWd2V7r4nB7Rjae8g6mLCjlyTVTn4oLs&_nc_ht=scontent-gru1-1.xx&oh=ab9310fe2e38e5f40665d779368f7785&oe=5E60D0D0","undefined","",""
"https://www.facebook.com/billypan102/posts/10153847041878639:0","1475220169","難得今天門診51個預約病患，最後只有2人未到診，其中一個阿伯人在醫院的，但因肺炎正在急診留觀，家屬還跑來門診告訴我。

 這麼高的到診率很不尋常。我思索了一下，可能和最近涉入某新聞風暴有關吧，病人老是聽到或看到醫生的名字跑出來，就記得要來看診了。

 
新聞風暴中的輔大江漢聲校長，是我在北醫唸書時的泌尿科教授，他的父親江萬煊當年還是我們醫學院院長。江院長也是泌尿科醫師，四十年前台灣社會還很保守時，他就開始努力在各處做性教育推廣，後來很多人都叫他性學大師。

 
江院長為了讓年輕人有正確的健康觀念，在演講時坦誠他到37歲前每天都至少會自慰一次。嗯.....拐彎抹角地講『情慾流動』還是保守了，算什麼進步思想啊，醫生都嘛直接講『精液流動』!觀念上的開放，和謹守專業倫理，完全不衝突。","1571565890","/billypan102/photos/a.431566178638/10153847041878639/?type=3&eid=ARAslLOuHlJPgNkKQ7r8xdWrNrSPljay3am8lNhQC-3daNlahoGiIrSlkRcrXCZWj9MkEhQ539G0wS32&__xts__%5B0%5D=68.ARCVOjo_BjUfIsf_nzRdg-9ogDUiYwQJ_eo2fo9Zm4miA8pM3YcVmgK2ukTlV1qyJyyyRSzZBpFVtUCiDg7v-PsZ9fL5WMdf9Gwo4AKijh7PQFyiqosYCvcHYrhU14Ps2rPx0uIQa5WnhwALmE4DmoJlIXdUwkZ5o9PjfOi_mJsv38cNf3xwAq1t--2c6ZPY4OpuXPzi90eUfXxBXBo8SyWPEsi5vfH6VkBRw-N8za8L-O1Tu_1JjgVZVNTxxoeNgIcZAGSpTENfhBWWbOEO_x0VG1Pvtq0w2xhPt37kPfKRXpTnxaa4Esj5flp-7tkHOZOnkAS_quET4qRt1bgr&__tn__=EHH-R","https://scontent-lht6-1.xx.fbcdn.net/v/t1.0-0/s526x296/14494886_10153847041878639_5750923075604398376_n.jpg?_nc_cat=108&_nc_oc=AQl1iF3zPiSgQ8MotOFoKGbHmS40jN5RqGXJJQD3UybGSDyYo-P-MXBUv8M1Qo7yhfg&_nc_ht=scontent-lht6-1.xx&oh=46f002ea8437e71d762d145ac33f3370&oe=5E1AC115","undefined","",""
"https://www.facebook.com/billypan102/posts/10153635757763639:0","1467982847","松山車站爆炸案，查出主嫌是林英昌。越南移工証人現場看到他引爆，DNA和指紋也留在炸彈碎片上。爆炸後他傷勢最嚴重，被拍到坐在椅子上，胸前留下長條血痕，型狀類似炸彈。應該是他拿著炸彈當場引爆，這是「謀殺式自殺」（murdercide）：蓄意殺人是自殺的手段。

 
林英昌的臉書完全沒有人按讚，他貼出的親人照片只有女兒Lady-->他的狗，作案前被他遺棄在南投賴以為家的車上。臉書上透露了十年慢性疼痛和飲酒的訊息。新聞描述他得了癌症，離婚，久未和家人來往，居無定所，也沒有工作。

 
憂鬱的社會邊緣人Loser，和之前的無差別殺人者背景相同，而他的年紀（55)是最大的。台灣根本沒有發生過ISIS這一類的恐怖攻擊，我們的問題出在社會安全網的破洞，『國土安全辦公室』應該要改成『國人安全辦公室』才對。

 
這次事件的媒體運作很怪。警方公佈炸彈証物請大眾協助提供資訊，但卻沒有在第一時間公佈最重要的監視攝影機。林英昌揹著快50公分長的炸彈在影片上應該很明顯吧，而且車站中不知道有多少台攝影機拍到。他不想活了不會去遮掩，何況還有越南移工的証詞。凶嫌受傷在現場跑不掉，看監視攝影機應該幾個小時就破案的，奇怪奇怪。

 而侯友宜神探成就Get，哈哈哈，看看就好。新北市政府和媒體關係果然還是挺好的。柯P先去聯醫還被小小黑一下....看懂了嗎？","1571565890","/billypan102/photos/a.431566178638/10153635757763639/?type=3&eid=ARCFR2iPHGLfsy_kRxNrrEMw7rf_q2Qf0e7I4H4Hooo9u5P2-XhaPBxMF77y_iM4bedYyGfMVlN2G_V-&__xts__%5B0%5D=68.ARBHE-UVyD9f2kPs1_RN3rA9Zv_jBUO08MKMfR5-PVUlSMM_vQJVHTrSTsF8dkhPxGhvpsvUrHUelluqs_PN_37GGBHCaIZAwhX-bKut9WxAWBz3gpniwNYJ-iS3yTth1lD1Lp22rWnZf-B1ZCTDDRHGgucSNcKK0Eyar4RUQQrANIqXxfAk45qs3qQQbpfktUj1h44D-k7e5fBQDmleDX8fLKB-D3J5A7sJJN7Q_pgmVUFy-TTBuNurNhKnE2ZtB41oNVIY1cYo_UoD7I_1ba3oe9hFg5EDx5iDn3m077d6asKuALKL7WJzIjponBXxIAeK2dLvD1kmTisAKuF3&__tn__=EEHH-R","https://scontent-lga3-1.xx.fbcdn.net/v/t1.0-0/p526x296/13620800_10153635757763639_6127024218861020410_n.jpg?_nc_cat=106&_nc_oc=AQkoVwqZMVX7p-meqJaizplPTQm61vOfRc2ZN6vc7CDnt6VInJZ-oyjiWgJSLdtOAVQ&_nc_ht=scontent-lga3-1.xx&oh=1d866d8b3db4c0046826ed41ef126cd9&oe=5E5DAFDD","undefined","",""
"https://www.facebook.com/billypan102/posts/10153916336468639","1477377475","我贊成給中國學生和其它國籍的僑外學生同等待遇。居留滿六個月，全額負擔保費加入健保，在台期間基本權利和義務都一致，不多也不少。

 
中國在外交上對台灣不友善，飛彈對著台灣，又常常封殺台灣藝人，但這些事情不必遷怒到中生身上。就像2013年菲律賓海巡人員槍殺臺灣漁民時，難道便當店就可以拒絕賣飯給菲律賓移工嗎?

 但也沒有必給中生額外補助，這對其它國家想來台的優秀學生不公平。

 http://bit.ly/2eA6QvE

 
我的門診裏，有好幾位台大政大的中國學生長期看診，還有位常來往兩岸的福建商人以自費就診超過一年。對醫生而言，病人就是病人，不會有差別待遇。只是我忍不住好奇問這位福建病患怎麼不在老家附近就醫呢?

 『因為治療效果不錯，醫生不會推銷保健食品，而且費用也不貴啊。』福建病人回答。

 簡單講就是便宜又大碗。台灣醫生，應該為此感到驕傲還是難過?","1571565890","https://l.facebook.com/l.php?u=https%3A%2F%2Fbit.ly%2F2eA6QvE&h=AT1jidP_2FdL1Ur7rMdHtR_KKXu1c-VIkvS2IO4MaLbBpPirA5Ala8cta-B0iCexzn9WRrg1o5o5qki7qIV1ADoV9fFewo1o1b-GhTarY9xzLgiCG4IhHLeu2OYNOSuM39ZJMJDmXScnKK2qn4JQ0HpfEGDt81R80TRE0Tmv0X4bdecs6IAjGNOZH2suPlUpY0WB2kln9dQ8Hsj8NVIGhRh7zryT2RNEQFuiAcDIYSKQlFFx2p17x-p-6Xqgh3rDYa71b4dz66LcyuRh2uecxnfcRI29v0EDlBnkyaZQj-qq7svtW7eM4UItXEcKm6zlYvhiv9icNx8f0sNjluUMUf02WSumS2jgEw5Z8fYb8VmnSmfZ4YvD6PobkhVF71Co3WaCcXyRYFUmWisHKZWl7b5rfwCAScqZIJVMnatN2dBFLwJc0jS9wPYoQB6d3zzl9qDYUGwofayd5MUhU_Dqdrgi_7qAsJ0Y7v1gF8lo1gXPHwBstTac_qcy87CBFBeQOwNJtP-dhVtL0gHNe-e-l3UC0-Af4UAHaDqwqHMt_vtYFrtJeW29ZvefwwcnguvWVwFLM97CcSNV6GpD7xyB41gkDG_Rl78cNQOL_CKD5Zlp8SIjsZgTm4ZG90TTgIcxSEBNAGhIMQHIl6c0v_CuXkUq","https://external-dus1-1.xx.fbcdn.net/safe_image.php?d=AQAyZxX_9iQ-phkA&w=540&h=282&url=http%3A%2F%2Fattach.azureedge.net%2Fnewsimages%2F2016%2F10%2F17%2F678935-PH.jpg&cfs=1&upscale=1&fallback=news_d_placeholder_publisher&_nc_hash=AQDjP-hIY_67yz_N","圖像裡可能有一或多人","蔡英文拍板　陸生比照僑外生納入健保 | 政治 | 三立新聞網 SETN.COM","總統蔡英文今（24）日親自主持「執政決策協調會議」，針對陸生納保議題，蔡英文今晚在會中拍板，基於人道考量與人權價值，陸生將比照僑生與外籍學生，納入健保體系。"
"https://www.facebook.com/billypan102/posts/10154324212878639","1490012741","客委會主委李永得被攔查，就算有律師也告不贏警察的。

 雖然大法官第 535 號解釋，但我認為『警察職權行使法』給了警察任意攔查路人的絕對權力。因為關鍵1。『合理懷疑犯罪』是由＊警察個人認定
2。『指定之公共場所』是由＊警察主管指定，而３。『不服臨檢，依法條29可以提起訴願及行政訴訟』，但我查了一下，根本＊沒有人成功過，因為臨檢行為在訴願時已經消失了，駁回.....XD

 台灣在法律上有潛力成為警察國家。

 任意攔查路人這麼方便，成了破案捷徑。如果查100個人，讓97個良民不爽，可是抓到2個毒癮犯，１個通緝犯，對警察而言很值得，對無辜被懷疑的民眾卻很冤。

 李永得比一般良民更冤，因為他是部會首長，太太邱議瑩又是立委，他是官不是民。他指控的制度若有錯，他還是要承受，完全執政已經１０個月了。

 
要減少攔查騷擾到善良民眾，但又要保障社會治安，我建議警察應該記錄每一次盤查，定期公佈統計數字。這在醫學上叫做敏感度（Sensitivity），看看現行攔查方式的效率如何。不要只公佈因攔查破了多少案子，也讓大眾知道因為攔查看走眼騷擾了多少善良民眾。定期檢討敏感度，警察執法水準一定會提昇，民怨也會下降。(大法官講的比例原則，實務上應該如此推行)

 https://youtu.be/prrkZrmTprM","1571565890","https://l.facebook.com/l.php?u=https%3A%2F%2Fyoutu.be%2FprrkZrmTprM&h=AT3-Ky95r-4tra3b181vu1i8CpLwmtzW7eJGRiLj5AXNhXmGV-H9YNP5-F-jevkGJ2fPzWUbZginZTp87TxZWm7X1K5_ih_uFfcREP52kqK5ezPZc8gCJ71QT4D4_goJzzXoxAVkP7j362vU7g30vUwdbMHhdvZWfCI2DF8mJlU4qIVDsNhB-hbNO3Q2HuqQH6nVHh0lmbMP43Qjla_49b__nkyD1H2hG3ZD9fphPTQ7oekAxvB6vcscGsCAGrfLF6SVrDQVvNABvLxPxDdOpXTWTtK3SV5GJIHxpLVHze0nPf7zyUbg4bm9mzweNT4dEe0eZ5hW5EX3-mFimyObtHPOtvw2r0gap_znZP8zxbta5Ow58sv7owO1n7IRyKD7x5Tp9JYXXEws_Wl4FwrgW0Udq-B292gbmnEHS5QXX1ud5vTU6-H7wYXy8s3uslSemJWcpPvK_d9wxb9ilIkh6iV4KO4SyNF-e1EqK8XxZnL3v03syMY9ax2yRdXOrMyanF6N8aX-1EFztNUkWvUV0pXjtCWF1A5MZOp9Z-enMNx-DrQGblYNSLXBJBdWgcjUsCzzTw2nrllKhBWOdHylqMBneAb2DBY66pV7ohuX3mNhdrG6LzBRCeiLn9eJNpfXf9AL-C-1","https://external.fbkk7-3.fna.fbcdn.net/safe_image.php?d=AQDQeoVYpngTg0Af&w=540&h=282&url=https%3A%2F%2Fi.ytimg.com%2Fvi%2FprrkZrmTprM%2Fmaxresdefault.jpg&cfs=1&upscale=1&fallback=news_d_placeholder_publisher&_nc_hash=AQBqPnMT0CrAWZON","ในภาพอาจจะมี หนึ่งคนขึ้นไป, ผู้คนกำลังยืน และข้อความ","李永得遭警方攔查 現場狀況影片曝光 （警方提供）","新聞連結 ：http://news.ltn.com.tw/news/politics/breakingnews/2009800 客委會主委李永得，昨日下午在台北轉運站一樓大廳的便利超商前，遭到4名保安警察大隊第五中隊員警攔查；李永得事後在臉書上痛斥：「只不過去超商買東西，居然被警察叫住要查證件，台北已經成為警察國..."
