url,posttime,text,crawled_time,attachment_link,attachment_img,attachment_img_alt,attachment_title,attachment_brief
"https://www.facebook.com/bingzhong.wang/posts/2323920347831842","1565509040","板橋玉旨代天堂 己亥年慶讚中元普渡直播
#支持台灣手搖飲 #反對台灣人打壓抵制台灣人

 （點入看直播 炳忠介紹普渡風俗 另有進步師 “幹” 新聞隨機開講😄）","1571659336","https://l.facebook.com/l.php?u=https%3A%2F%2Fyoutu.be%2FJN8h1IYvZ4k&h=AT36GWenwNl98xuyb0GcdqioTP0lwpxoV_BJGNQR5EzMzLIJjpG-SWxvygmjVT89lDvmWs4ZaR1IY6AmQspVW4cX5sD2BonNNiAQNZLUg4tbdT9FEKYN-WYXR9dU6iUnOSU9t4p4VlGphorQLaDfnaSx9IVKipPWhlAd9SlrHPtSmre24qkH8G_pm3k0jWdedXejRx_6imUU3Jy4mq64V6yTu2UXoVx8XyznGBReOQ0RtDGsUBdo6S29LriIMhnEENbDtYFxLyxoB6z1bStmPbx2zmY_zG4Cs4RLuP6faRgZayEPH_4E9ZcwslGdA87Y8_eVsv2Qw0t77UplePDRMVWb-KnvngsujJlJW28PNpjvuVXekOt-vBXrInp0ruan9ihTlSGXKjQMcnpAWAbnP6wJRT0vT87tFGt6Ph0l6j0RgOX3e0yet77VYY17_KZlcmgVPjRVomelm7cxTrq5gAL17IuVL2BjhShgUQrCikxv2o564ERmb2bAHCVgIeg2jwzCaT88ppfGZ74A2Zth0oe20OAaSUyTe2yHVNBdHPbL6rW6rBh31XsXLUjH5cKRjuuNxRLZazL0Lp1rhq-rnPGPpSpQ7zI1BXPr81KvKH6AumJwI0HBmm13UdWWEOVY2tOhTUS_21m2fYQd8QY","https://external-amt2-1.xx.fbcdn.net/safe_image.php?d=AQDzxiIcJI2jJjTp&w=540&h=282&url=https%3A%2F%2Fi.ytimg.com%2Fvi%2FJN8h1IYvZ4k%2Fmaxresdefault_live.jpg&cfs=1&upscale=1&fallback=news_d_placeholder_publisher&_nc_hash=AQBDKpdzSzcugTvS","Image may contain: one or more people and indoor","中元普渡 來杯手搖飲 功德無量",""
"https://www.facebook.com/bingzhong.wang/posts/2321477781409432","1565184477","【#忠言near：壞蛋民進黨炒作反中！笨蛋國民黨拿香跟拜！】

 蔡英文說，水果茶加政治味就不太好，到底是誰帶頭炒政治？
朱立倫說，一芳水果茶必須要講清楚，台灣「民主」竟沒有不表態的自由！

 
我們整天要大陸人來台遵守台灣法律，那在香港營業的台灣品牌要不要遵守香港法律？一芳香港總代理不支持罷工，聲明遵循香港法治，竟然就被港版太陽花潑漆惡搞，塗上「支那」字眼，這叫作民主？

 台灣總公司為此要「道歉」，部分分店加碼聲明挺香港罷工，說要捍衛「身為人的權利」，如同「我是人我反核」，不挺反送中就不是人，好可怕的民主啊！
別忘了，還有蔡英文、陳其邁影射一芳茶被「中國勢力」入侵、失去「台灣樸實的味道」，朱立倫要一芳講清楚說明白，藍綠政治大咖帶頭發動「思想檢查」，恐怖啊！

 
蔡政府還好意思說，大陸不來金馬獎很可憐，可憐大陸人透向光的窗被關閉...我說，好險！要真讓大陸同胞看到台灣的真相，又是「支那人玻璃心」，又是「中國客太多製造髒亂」，大陸同胞從小對台灣的美好印象，恐怕都要破滅了吧！

 ♦♦♦
#忠言不逆耳 #忠言要near
🔥即日起每周一至五，【忠言near】在王炳忠臉書粉專及YouTube頻道每日上線，敬請鎖定！
🔥王炳忠臉書粉專：王炳忠
🔥王炳忠YouTube頻道：www.youtube.com/channel/UC9YBuMtnRBi_vnyiOhF86uw","1571659336","/watch/?ref=external&v=2147600738700555&__xts__%5B0%5D=68.ARCbyIvoGIK6OeKSA2zSzKJ61k9ZB6xdqgbfa-m7M_YObnef1-IekoiEddT05yk4OO53t15kBYCwIqjiOtEzWiIag8gljiBP1Tvyp9ypY8SYrreTduPFauL31jGTMNAdn-WEXI0DPhO72wLena6VW-XG8F3oLY1jgtzFu6eeTMZGm3G4xF98QnPP9nBKF01yGtwydo7JRsObj072vL-G34cDeuflkrZRj-gbtglXb93-IxD4lABCtT2m2YpiBTJ3zXbm-cVRw5Njo9pe04GLdEy1awZCziKhSrfysebHrLenMUWQbkHJaJx6qPu8xL_kD4WhkdWWyzBbfUaKFWlSuj7vz6LWL_5Fa-ZFtb1M&__tn__=kFFHHH-R","https://scontent.fpnh4-1.fna.fbcdn.net/v/t15.5256-10/66127267_2147645388696090_2217848754340364288_n.jpg?_nc_cat=104&_nc_oc=AQn3RkGRV9IIb93yoYvF53ESd6zLvNirr8cyGhoGMxzz2vBwHca09nb2GM5grvCsT_4&_nc_ht=scontent.fpnh4-1.fna&oh=f2c34ba15756088d5745815fcf0d6f68&oe=5E243C22","undefined","忠言near：壞蛋民進黨炒作反中！笨蛋國民黨拿香跟拜！","Posted by 王炳忠"
"https://www.facebook.com/bingzhong.wang/posts/2345433695680507","1568199534","#忠言near》秋後算總帳！算算蔡英文五大「豐功偉業」

 
時近中秋，望月思鄉，也讓人想到一句北方俗諺，那就是「秋後的螞蚱，沒幾天蹦頭了」。正所謂秋後算帳，今天中秋前夕的《忠言near》，就讓我們好好來算算蔡英文的五大「豐功偉業」
🛑

 ▶創舉一：外交部變斷交部
▶創舉二：陸委會變不通會
▶創舉三：觀光局變補貼局
▶創舉四：國安局變私菸局
▶創舉五：促轉會變東廠會

 🙏 感謝大陸深圳網友趙繼蘭大姐，寄來大陸各種口味月餅

 🙏 懇請支持新黨總統候選人楊世光的新視野參選連署，9/19中選會登記後正式開跑

 🙏 預祝海內外中華兒女中秋節快樂","1571659336","/bingzhong.wang/videos/392746828090225/?__xts__%5B0%5D=68.ARDyQgWcJossx2QavTl9WAizAhzH8KRMLR_k1vNiuLbPCbgTANA_2557WH6tAB6TyXLT3-8YTGpsxhr4vfwnSXDrzmFFG0qSFilQN4ke9_dPZvka-lU1fADB_p3bLTVpLhx9wqoVmpqdB-HxbgL5py-xX-YyzHVzP2bTB2zYrCmsKVsu3n9JwUG8D18xK8oThrlN4C6MIXQ_rQnos5tEhlY6npw1OYw4eSD4cRAf2CuCMmSTlwg0aCq1h3I5r8rWe273tkecjypOcASL3vf4xcodRM0LLkeKQXWPSzGTXiM9uxSGtIB2HQQcb3Alxxnc__K5jBpbUDOaFyd9aIPuyDqUl8zjzz25cPiOzJ7FsBPfIioY1M3Ngk8&__tn__=HH-R","https://scontent-sin6-2.xx.fbcdn.net/v/t1.0-0/s600x600/52144330_2216812035209341_2090937375596216320_n.jpg?_nc_cat=110&_nc_oc=AQnZjB5eT-7KSYJzH8AYmgwhwt5XPAyd6jVoswdNh187HGOuqG9SBg_QPR6PDlsdSK0&_nc_ht=scontent-sin6-2.xx&oh=5e177532af740ae176a1827859243170&oe=5E644249","undefined","Watch Now",""
"https://www.facebook.com/bingzhong.wang/posts/2325354097688467","1565701656","繼林昶佐離開後，洪慈庸也宣布，退出時代力量。

 比起問政犀利也確實認真的黃國昌，洪慈庸這些年在立院的表現，說實在乏善可陳。她今天哽咽說，因為黨的路線之爭無解，所以選擇放手。

 
但到底是什麼路線？說了半天，還是沒有說明。按理講，創立或離開一個黨，總應該是有明確的理念，才稱得上是「路線」，比如1993年新黨離開國民黨，就是因為李登輝走上台獨之路，而新黨堅守國家統一的路線。

 
如果說，事情真如媒體或王浩宇所言，就是為了「黃國昌打民進黨過兇」、「要做民進黨側翼」，那這不應該上升到路線之爭，只是策略問題。洪慈庸用「路線」二字，掩蓋了她與林昶佐同樣的利益，那就是連署支持蔡英文連任後，還須要「退黨」明志，才能得到民進黨的「禮讓」。

 
比起林昶佐連理由都沒交代，洪慈庸說了個「路線之爭」，表演得是比較漂亮。但我忍不住想，如果你們真的懷抱對抗「中國」、台灣獨立的高大理想，連個黨才剛進國會一屆就可以弄到分崩離析，搞到像家家酒似的，還怎麼寄望你們完成「建國大業」？

 
我也更加體會郁主席這麼多年苦撐新黨的不易。很多人苛責新黨大不了，但想想這些獨派團體，不僅有島內「天然獨」的養分滋養，還有外國勢力的支援，新黨這麼多年保留火種，上次選舉還差點過五趴，成為唯一沒進國會但可以領政黨補助款的政黨，真的難能可貴。

 更重要的是，我們一直堅持不變的理念向前行。我對那些理念清晰、不躲躲藏藏的獨派人士，心中也同樣有一份尊敬。

 只是可惜了，之前才來新黨樓下發雞排的王奕凱，加入時代力量才約一年，曾和我聊天談到「有了政黨就不再是單打獨鬥」，如今會不會面臨這個黨即將散夥？","1571659336","/bingzhong.wang/photos/a.1557579191132632/2325354077688469/?type=3&eid=ARBuhsGFUAuZKa7Va2mLEs272W0UWD8OphaPD5QunRmxcpKehdykkimZClGu16YKRyE5FOHCM2DPPDFc&__xts__%5B0%5D=68.ARB8s0frf8Za4-laMpCrWH7GWJ9lGZtxMWa0k9mZcv2k9zCmvwTqX7NC7Yu-lbANj9bgrCivpsZAeu1CdzNP2XsrGEY2MwXrEe8LPiPMaxYFE8fS97tR-jMA9ggrp2e6z6Wby9sYG5NIsnZS9pjTB7UyaatMnzdo_s-J9ezpR4eWi6Ew1TRL732TK8sb1XwSkoKmhNOueQl55vS6PPFLzUqVFU56xmRcwxUexcZVK3BuVPCm7IDI73QOJp9oOWzzWjyUPj7iR3K_-sYkqfcGBy4LdTGCY1Fbu3KkE48GXXD6972zOK8a-ctYyGvvpRg7KKpCSThX0QDtniTLT0oGNvUfj6le&__tn__=EHH-R","https://scontent-ams4-1.xx.fbcdn.net/v/t1.0-9/68806874_2325354081021802_3770959153921523712_n.jpg?_nc_cat=105&_nc_oc=AQkRnbxpPzGFIVHXirkHI4-b_Vd3qDUpHm9if1xqqG7eqhRhXOSH_L9s7v8LHq9Scyw&_nc_ht=scontent-ams4-1.xx&oh=466a4884c1873029fb87c03446abc2ca&oe=5E6347C2","undefined","",""
"https://www.facebook.com/bingzhong.wang/posts/2367531770137366","1570703735","今天絕不罵蔡英文，因為我們偉大領袖蔡英文（不可再稱「辣台妹」，那是對領袖的不敬），上午的演說暴露了不少真相：

 ➡️「中華民國台灣」就是整個社會的共識：所以「台灣」就是無法脫離「中華民國」獨立，繞了大半天，又回來抱「中華民國」。

 ➡️
「中國」威脅「中華民國」：所以蔡英文的「中華民國」不是1912年孫中山先生領導中華兒女建立的中華民國，不是1945年代表中國創始聯合國的中華民國，也不是憲法規範主權涵蓋大陸的中華民國。蔡英文的「中華民國」就是「台獨」借殼的工具，就是「台獨」想獨又不敢獨的遮羞布。

 ➡️「中華民國台灣」六個字，既不是藍色，也不是綠色：「中華民國台灣」簡稱就是「中國台灣」，各位覺得算什麼色？","1571659336","https://www.facebook.com/bingzhong.wang/videos?__xts__%5B0%5D=68.ARADrVlgXU1son14v2litRjE9o8_m1vISWJib9iecZE8gOxDtxjb-QtmiJXuf1f9Sy-upIVW3SkgetYzBEtIX4dG2rjktQThAN9J28JuG0efq7R6KnJ8H773KTn6xBCkDwVD4BvsFvz8hvP0WJpopYHj0jR31r4Rc2z7GgVUeLfYW4pPis7vQBYlTYY4EcqCSWTgUHnD233y3f39TEQKS4WSot6GqFFOkvWwNSpZ1IJ_5fyuV6Dvgm-LdSPoHHhQqDjA3TWKt6-LI8Ptl6VcmImpgN1IpFSFX5mjLdiFe5gu5YCoRZ3nDR2gcJXOmBeWXNP7aZ0nBtsvWiLQJfr7e8xIJm9zDICAd9xwDw&__tn__=kFFHHH-R","https://scontent-lga3-1.xx.fbcdn.net/v/t15.5256-10/72235270_396124124400935_6893884803179872256_n.jpg?_nc_cat=104&_nc_oc=AQmxIa5nNrSAV3_8cVBK2HCRwTkmoneCdCNpsb57qrPG7mddw4nNt-6rHKvgi_XyPeo&_nc_ht=scontent-lga3-1.xx&oh=26d2f13f743fa392fb2ce95fa6a11114&oe=5E22EBD2","undefined","蔡英文雙十演說暴露的真相","Posted by 王炳忠"
"https://www.facebook.com/bingzhong.wang/posts/2301455010078376","1562466249","新黨推楊世光參選總統，他在記者會上說「我是男人，我是統派」，並質疑其他參選人遮掩自己立場，就跟是男是女一樣，難道說清楚是統是獨那麼難嗎？

 蔡英文為此特別發文，說有參選人批評她「不是男人」，說這是對女性的歧視，難道她認為自己是男人，不准別人說她「不是男人」？

 
「台獨」若能大方「出櫃」，說清楚自己主張，統獨來個直球對決，倒也爽快！但今天台灣的參選人，不分民進黨或國民黨，個個的「主張」都是「不」、「反」、「非」...，那到底自己「是」什麼？「要」什麼？什麼「不統不獨」、「反對一國兩制」，那到底是要統？要獨？要一國一制？還是就要實現李登輝、陳水扁未竟的一邊一國？

 
民進黨「做婊子又立牌坊」，搞戒嚴卻說自己「轉型正義」，搞台獨還要包裝成「維持現狀」。國民黨則是一群大老爺們，明明不是從小被「塑化劑」毒害的「天然獨」，卻也要「揮刀自宮」，自己把自己搞成「不統不獨」，「不男不女」？

 
回想多次上綠媒節目隻身應戰，不少自稱「藍營」人士不但不支援、鼓勵，反而嫌我「太凶」、形象不好、不夠「斯文有禮」、缺乏「溫良恭儉讓」，正如當年管中閔一句「做爺們有什麼好怕」，也被台灣媒體罵成倨傲、狂妄。選民號稱不愛政客「作秀」，可大家卻又虛偽得很，是統是獨、是男是女都不可以說？！像我們這些不願夾LP說話的統派男人，不討喜也是可想而知了！

 楊世光的新視野
#是光亮起來","1571659336","/bingzhong.wang/photos/pcb.2301455010078376/2301454516745092/?type=3&__tn__=HH-R&eid=ARDTPGKJN036JWRz7ojAmBdkJHK55eYoV2R-9Ps6mCwjjRE26MhnzmDeMcCcPoG4F46u4ao2hLybH5Zl&__xts__%5B0%5D=68.ARA7yVN38z7UHxbUYiC4TYpqOSMSPx-iRgIJqWTdcJkQG_UZaCCvuRF5-cz7O8EF_PRt8g4-RensKN8sX06MjZ9EguOXGIW4Ie0b1hEg-9PPWTmV3uUelDx7-xilSgnQsQBw-gVVD7--cLATOq9VRFs2feC80swLuNRYoGHJSE3HehBYGe5Uh3upkSMripbEuuXd8liHPkNRTPZcgA97n8ymg_D6V4H6h9p19RLKgdSri_SM9B1CcK6rXElSlLXCzgdSA_Gm5k-idHCWv3gWMPISgHvfkoljKAtOc90zufT5gt5VVbQRmM3s7RgwP1G79ImJZA4aOSy5VYygJbAw9ttM-nfl","https://scontent.fbkk7-2.fna.fbcdn.net/v/t1.0-0/p296x100/66294234_2301454520078425_5890707732780023808_n.jpg?_nc_cat=102&_nc_oc=AQmEYPkR5VNEYOE85NX_XtyNxnvIGMRm-rnYMymrpq6U28itoOiYguvB3ILZWSotuow&_nc_ht=scontent.fbkk7-2.fna&oh=b5dc79ff27bf1ea3866395f03616f88b&oe=5E5F3903","undefined","",""
"https://www.facebook.com/bingzhong.wang/posts/2332441640313046","1566608430","聽說電視播了陳柏惟節目中抓狂爆氣的畫面，
許多人看到後向我詢問當天的情況，
以下就是Yahoo!奇摩新聞上傳的全程！
我不喜歡自我喊爽誰電爆誰，
就請大家自己點進去看，
應該能分辨「自我爆氣」與「電爆對手」的差別！

 有人提醒我，也許是當天直播時有網友留言說陳柏惟「賺紅錢」搞台獨，
造成他當天情緒比較不穩。
我後來也看到網上質疑，有說他在大陸工作多年，
也有說他向中共官員檢舉台獨。
我不了解真實情況，所以不隨便評論。
我當天也公開說了，到大陸賺錢不等於就是「賺紅錢」，
既然我反對別人貼我標籤，我也不會這樣貼他標籤（即便他一直貼我標籤）。

 我只是可惜，過去和獨派交手也不少，
當我和那些理性思考的獨派辯論，
也有助於我重整自己的思路，
對雙方都是一場知性的饗宴。
但陳柏惟當天的論述，
講到後來竟只剩「統派沒有在台灣政治舞台表演的資格」的蒼白主張，
詞窮到只能給所有統派貼上「中國奶水餵養」的標籤，
台獨如由他代表，是壓低台獨的論述，
更凸顯台獨的不自信。

 看到網友說，這樣的人到立法院去，
會不會三天兩頭都爆氣，接著就大打出手？
但我仍支持他勇敢去選立委，
就像當初我很早就支持陳為廷選立委一樣。
支持他選立委，現在就把台獨方案講明白，
既然按他所言，百分之七十的人都認同台獨，
何時獨？怎麼獨？需要動用哪些資源獨？
通通說清楚，別再像民進黨、時代力量閃躲騙！
至於選不選得上？選民自會做決定！","1571659337","https://l.facebook.com/l.php?u=https%3A%2F%2Fyoutu.be%2FWltO9h5Hsh4&h=AT3TVVgJeuCWZD15cx2lASLSCHiGQDcF3YAg8xPw00YsBnd1gRZ4U8K6v_CF8noEo5vxzPgJLhIr3Zpk4AJmQqfyK-m9hrax_GlPnFohlshFlv8rD9ksZRyp4B4EnyN3-9nKLKA5bn7v-xVPeS2M6GiHbhFfiuNEac0rM4QGiy7eY1Qo8vv9JZJKfZtALLTdY38L2paBfQJgP6YWCNpgviL-ORGooXDcLORgjYPHXGvbwMfcL0oDrmUA3LLZngc1PLjY3zBFMQ5tBLfqt-4dJ2nXNzgrpvyv2hi_9uXTiTFsHUhmiYMPHZKh3Dpt3YrWr19KVwMreBLqV5yf96ps8y8hd2F5p0e458U5hxOMz7mZH5JyjQ6178ZncMsrL6ruYRBRryNfRgsefWagOYc6t7nQ9pU3Taz4B1SqDQfyqx5EowtDYyorBG1MaqPFrMXxKqV7oMdKoiZqtIs14K02tlUT3FPNSVoO_n2De8IxkWZWo8SYhnstA0sA1wRIqDgzMMw4tcF2N5_IzJVaDgV_hwV9Unnyfwdxn1WHmW8QNyl2ghJyWU6PRmB58nR8aKYWT1yyLcq3JdyfaWBQjSccoGQQ_AY6Hy9ZKEd7L67DzgH_s8mMo0W3DLnJIT5t_97e3K8Q9P-55jH7LHJKYjA","https://external.fcgk6-1.fna.fbcdn.net/safe_image.php?d=AQCCJhWN3jXb7cX9&w=540&h=282&url=https%3A%2F%2Fi.ytimg.com%2Fvi%2FWltO9h5Hsh4%2Fmaxresdefault.jpg&cfs=1&upscale=1&fallback=news_d_placeholder_publisher&_nc_hash=AQDgTlVolEB9E1T4","Gambar mungkin berisi: satu orang atau lebih dan teks","節目中直接抓狂？陳柏惟爆氣王炳忠！反送中延燒 統獨問題黃暐瀚被電爆？完整版【Yahoo TV #鄉民大會】","41:50 陳柏惟對王炳忠大爆氣！ 看更多【鄉民大會】：http://bit.ly/2NU1Ujh 訂閱我們：http://bit.ly/2qloeGG #YahooTV 上千支影片精彩不漏接：http://bit.ly/2qcZpx4 - 來賓：#王炳忠、#陳柏惟、#唐湘龍、#黃暐瀚、#范雲 香港反送中運動時至..."
"https://www.facebook.com/bingzhong.wang/posts/2312449838978893","1563951425","啊！怎麼辦？剛上節目錄完影，我說的還是9800條，等下了節目看新聞，才知道變成10000條了（800條放上蔡英文專機，200條在國外處理，還有600條回國，加上前面已搞定在機場的9200條，共10000條），來不及更正了！

 
從去年到現在，先是見證「促轉會」自比東廠製造不義，如今又是號稱要「保密防諜」的「國安局」大搞偷渡香菸！民進黨說要查「中共代理人」，用的就是這種「國安」特務，你不害怕嗎？

 我怕，所以還是少說話了！不然指出這萬條菸走私的「國安」內情，會不會又被冠上「刺探機密」，說我危害「國安」？","1571659337","/bingzhong.wang/photos/pcb.2312449838978893/2312449425645601/?type=3&__tn__=HH-R&eid=ARAcSbImlAa0_1bszIkWff2fEuMmMEqoFiOjKOmapLbaU7BmIck_OTAoF4kYcG0yAtxv7l0cR-mXAYw7&__xts__%5B0%5D=68.ARAZv6FDwKLFFf46m8hJX5xV-66ylozymxhjIpOBiddZiIjJqp_Up59yIH5G8g5mby1OqTtC_cuonP0cPV5c7uRWymRnqNAeSd8vbsS3tpQj-hZ7GIIgfX8mQ4O9WPo54CiFdE_0zE_mmLYrPH0sQ5ufTeHhn_WDbf7DiwZ39MmxMO9s2du-6Fuo62ujPNktzTmjtWN2AksRoJDOtiI-G9FtBguzNqxHFhY-FNRzgl3Ss5JNvO6HENwnnsJBin_F8--D5YAHo4b5vtzl0u2aajA2_rU_ZvpG8b8JWSL8MrfMcK2JnxX9tKPd3C3Os6_yFE5IyBoW8180D-CBQNgp_q6lJHfp","https://scontent.fmad3-7.fna.fbcdn.net/v/t1.0-0/s526x296/67417863_2312449428978934_4177960064595787776_n.jpg?_nc_cat=100&_nc_oc=AQlXOa1HlnvAJd96ToadCAjf9deqjDm50UY4RbcS_xGKmHH5lqcIEoIIfHQLLz3350Y&_nc_ht=scontent.fmad3-7.fna&oh=d4fad43a1a28f891940194c600c207b9&oe=5E619632","undefined","",""
"https://www.facebook.com/bingzhong.wang/posts/2307798856110658","1563334643","稍後12點鐘，我在Yahoo!奇摩新聞「鄉民大會」節目直播。

 大家可以在直播開始後，點進去Yahoo粉專的直播加入討論！","1571659337","/YahooTWNews/videos/493749288027393/?__xts__%5B0%5D=68.ARACwQde43hTWnyH3FN2mmnLzE6v5UaQtrf6hS73tuSK-A3VNGv3sFVXuTsAbTSXEYDHEpuuMBkWFIWKeaLlBDVrVQr1i7lwGI84C_Sb8enq-cjI5DxMyNoBB-lj0fT4txUAt_XZNkRn0C7FZZrW6Mdr5ZIqKRJNM1BtBAYwW69_wTDdOmvkVHOoCQt7Rvz_p73JkNito6-9n5J-Rfv7EEz2dl6J6iDBIv6_YQoMX-Zhv-DExkqdY2Ulj42v0wtsnuKjTbWmVptNspQZdRNqLQqUBLNm8V5EU_pOBL4cKxnvWx322khoRPXBBYzl8SKFI4Wd6oNwLHI783umx5hzcfTY0HxN-zkFlPVIut1wPlLyJKpL3rnY4thUb22pASwUsbkc-jIAC2Z7tRXq56mHuQdxaou4vvsHAPblmzwB74dQm_rlNy2rrslIdZylwnUa1j8KsmOcyy2MBp_1H9Tl3VbiLCX4_Sw0sziFiiqmYbF8LIF2M0WUAOYxXW3h0P2ZPSQFYWtTUH3--EIp7iDnung&__tn__=HH-R","https://scontent.fbkk5-5.fna.fbcdn.net/v/t1.0-0/s600x600/61517758_2496591997056418_7190805822316740608_n.jpg?_nc_cat=104&_nc_oc=AQnzDzBcgv_1DpP_TR18SBtxP-T-FNyvGBYFu7h8VEnbGapcLXg32NyhcfMzTUedvCo&_nc_ht=scontent.fbkk5-5.fna&oh=4a9ace57596ec5534f27039bd10734fa&oe=5E1F7F24","undefined","Watch Now",""
"https://www.facebook.com/bingzhong.wang/posts/2349912405232636","1568726526","#忠言near》蔡政府應付「斷交」三大絕招：友邦被買、阿共陰謀、邦交無用論！

 正如我昨天所料，除了表面斥責「友邦」被買及「阿共陰謀」外，就是讓綠委、綠嘴開始散播「邦交無用」論，告訴大家沒有「邦交」也無所謂，還可以省一大筆錢......
💰

 
諷刺的是，這話本該由統派說，如今卻變成號稱要維護台灣「主權」獨立的綠委說。如果這話是對的，那你們又吵著要進聯合國幹嘛？又動不動怨「國際打壓」幹嘛？反正管國際社會怎看我們，台灣就是「遺世而獨立」，不是嗎？

 
更錯亂的是，蔡英文還指控索羅門改和大陸交好是「破壞國際秩序」，平常沒少拿台灣好處的美國政客也鼓譟起「要讓與台灣斷交的國家嚐到苦果」。那美國怎不和台灣建交？承認台灣是一個國家？怎麼國際秩序都說台灣是中國一部分呢？
🤔️

 
如果要說省錢，認為買「邦交國」是浪費，那買美國的政客、軍火商就不浪費嗎？買政客嘴炮幾句，台灣就獨立？花比別人貴的錢買二流武器，當作「保護費」，結果美國連「保護」也不承諾！更別說當初和中華民國還是正式邦交的軍事同盟，說拋棄就拋棄，而且還是偷偷摸摸就拋棄！（索羅門還有內閣會議投票咧...）

 
國際政治，就是講實力。美國有實力，她說了就是「國際秩序」。朝鮮有實力，核武擺著川普只有親自談。中國大陸有實力，民不民主大家都和她建交做生意。台灣沒實力，課本再改、軍購再買，不能獨立就是不能獨立！","1571659337","/bingzhong.wang/videos/897077834009826/?__xts__%5B0%5D=68.ARCZabFwTzfr8ISM9yUCGQPv4VzBfHfHAHw6zgKVfnuiBgEAEGgNhiJRPOZo5RjT_cvjhA59vsvvadwe1oup8v7iJXxv31jmM3m9vW3dO89xDgwUAzv9kfTKJRk4WLLHy8cHaVu1vY-L8_X8tc_7UVcfBPXXHY0GR8zsU17_aW874hHh8wfO6EJjDASKH4Y35h5EdDn729H6VVnkQxh2MQYQw_okGcSiBVviuudBYjnuFunmYIoSqVdH6XLPVR_W_LidW5BQXh8I_Wzw-QK44yC2kv2FnnoUY7OIU0UQ02ycd7BoLKIBuNsVwtdwu4VJ4HWly5jRdphoKkfk2o3NyzOr9mvOHX5T6ToUynnRcUJ3gnMv4vp-BGE&__tn__=HH-R","https://z-p3-scontent.fpnh5-2.fna.fbcdn.net/v/t39.10505-6/71127597_441379356587471_8263472379779350528_n.jpg?_nc_cat=101&_nc_oc=AQlp8NTwTOyROY1ilhmTRvBpOV8JD_5vj5J7fB0b_gqZo-pvOrSt4lQTisnAz8AWBxw&_nc_ht=z-p3-scontent.fpnh5-2.fna&oh=b097344a580ddeb9fe25232d76e1f65a&oe=5E2F9F28","undefined","Watch Now",""
"https://www.facebook.com/bingzhong.wang/posts/2306775229546354","1563190755","2016年4月15日，林飛帆到立法院，抗議民進黨版兩岸監督條例草案背棄承諾，未納入兩岸「兩國論」定位，我與新黨同志也到現場，聲援林飛帆，譴責民進黨！

 
當時林飛帆更揚言，不排除重啟太陽花，逼迫民進黨面對。新黨青年軍也聲明，我更致信林飛帆本人，表達雖與太陽花立場不同，但認同民主不能交易，政治不能詐騙，民進黨靠太陽花奪權上位，就應履行對太陽花的承諾，不容政客詐騙人民！

 但之後，兩岸監督條例就這樣擱置，「兩國論」更未入法。再之後，勞基法兩次修法，林飛帆批民進黨「已無民主」；前瞻債留子孫，林飛帆罵民進黨「繼續墮落」。

 然而，昔日五十萬太陽花已不見，林飛帆也到海外深造，不見人影。

 
終於，九合一民進黨大敗後，帆神重返螢幕，為民進黨余天站台。終於，就在我們「聲援林飛帆，譴責民進黨」的三年又三個月後，林飛帆走馬上任，晉升他口中「已無民主」的民進黨高層。

 
原來，「民主」真的能夠交易，交易靠的就是詐騙！2019年7月15日，就在這個紀念解嚴的日子，綠色法西斯黨迎來了新高幹，而我對林飛帆這位對手的最後一絲尊敬，也就此消亡！","1571659337","/bingzhong.wang/photos/pcb.2306775229546354/2306774749546402/?type=3&__tn__=HH-R&eid=ARDeEU4EanCo6SHn9KvdokrFmUYA2V2OB2J5QuaIjO1O3mAiRotu3A8Fn7ILXCcMDVqcRP7n4aVIItWj&__xts__%5B0%5D=68.ARD1Ebe3mqgklEhTciasxX3i5Mh1t_XFUedIfLaoKwFEiSgdnJtdlAn_NMaTD9WiPBgMwYzRVnkTfXlvKZsKV6oOw6ZcTGUhPq-1Qu-boBxvlxf9HG7ZhVLpuETPOQP0wacd8yrEAywzahKc-_mSrNqf5Hdi2ehUXXK2uPUKNf-qV2FAztT1XX2EREPCxQSqj76xa7gH7IQ5nE--CDFNCzxtHrPFnLJnk_7FyNePet8SHsojwVxxTW6p7wG8TAXxPmkJQH48PEpLlkd4JWfe8sfxlAPV3TsmcnlvJkPxEmK0MLYUU6Da5drHkQzG498h7Jy-q3t14pWo9be0Gi0eC8h1UKBL","https://scontent-sin2-2.xx.fbcdn.net/v/t1.0-0/s526x296/67201427_2306774752879735_5259003728135979008_n.jpg?_nc_cat=103&_nc_oc=AQnyaD1SrF6JHugYmEHNnAE1Mn4GLSP7WaVRrUVtIh_3He3kkXncNBXrIBqupiGdDtk&_nc_ht=scontent-sin2-2.xx&oh=f9f2e1026c3ac20cfb2dce6081ef71f6&oe=5E5A3A26","undefined","",""
