url,posttime,text,crawled_time,attachment_link,attachment_img,attachment_img_alt,attachment_title,attachment_brief
"https://www.facebook.com/bingzhong.wang/posts/2333391810218029","1566720141","國民黨透過發言系統，要郁主席勿對他黨指指點點。
我們要嚴正地說，郁主席的質疑，並非國民黨的家務事，
而是長期以藍營老大哥自居，名為中國國民黨的當今最大在野黨的路線問題！
更是有志重返執政的政黨，將來要帶台灣往何處去，
人人得而檢視的重大問題！

 回顧歷史，即便在金門炮戰的年代，美國建議割裂兩岸、放棄金門，
但中國國民黨總裁蔣中正仍主張「台灣和大陸本屬一體，骨肉相關，休戚與共」，
堅持中國國民黨「一個中國」的立場，拒絕偏安。
當時，台灣要「反攻大陸」，大陸要「解放台灣」；
如今，吳主席說，那些已成歷史，還是和平最好。
但，不面對統一的問題，兩岸豈有和平？

 吳主席也許會說，國民黨沒放棄「一中」，
只是主張「一中是中華民國」。
然而，這個所謂的「一中」，是否包括台灣和大陸？
吳主席堅持只能「各表」，結果表成「一中是中華民國」、「中華人民共和國是另一個國家」...
但中華人民共和國是中國，舉世公認，
國民黨如認為中國是中華民國，
豈能不爭取與大陸談判「同表」，
商議兩岸對「一中」的共同詮釋？

 現在已不是漢賊不兩立年代，
國民黨委員們扛著「中國國民黨」百年招牌，
早就經常與中共各級官員會晤，
次數、規模都遠超新黨，
當然更不能迴避對兩岸定位的立場。
如今吳主席把「一中」各表成「兩國」，
與蔡英文用「中華民國台灣」對「中國」的說法，
相差只在一線間。
這不免讓我們想起，從1999李登輝提「兩國論」，
到2002陳水扁說出「一邊一國」，
也不過三年的光陰。
更何況，中國國民黨的立委們，
用「中國」直稱對岸，已不是一天兩天，
哪裡有所謂「一中是中華民國」的立場？

 吳主席可以缺乏雄心，不敢跨到「一中同表」，
但不能阻擋別人深化「一中」的內涵，
追求中國國民黨黨綱明訂國家統一的目標。
這就和那些任中華民國領導人的台獨工作者，
自己違逆中華民國憲法的定位，
反過來要打壓依據憲法追求統一的我們一樣。
吳主席用「邪惡」二字，
汙衊、恐嚇追求與大陸協商「一中」表述權的黨員，
卻從未用堪比「邪惡」的字眼，
批判毀憲叛國的台獨當權者！
國民黨將來執政，難道要與台獨工作者聯手，
打壓吳主席眼中的「邪惡」言論？

 以上種種，
🔥牽涉名為「中國」的中國國民黨在台灣存在的正當性！
🔥牽涉以藍營老大自居的中國國民黨要帶台灣往何處去！
🔥更牽涉兩岸因國共內戰產生的政治對立能否和平解決！
這絕非國民黨的家務事，
而是擁有百年歷史的中國國民黨必須被檢驗的路線問題！","1571659340","https://l.facebook.com/l.php?u=https%3A%2F%2Fwww.chinatimes.com%2Fnewspapers%2F20190825000431-260102%3Fchdtv&h=AT0tbAj910N_lYwYpv0LIWJdSDtb5F9oAQfTIjRlyupj9MB0wMNorHXrQAAF06l2GweC6zzW9zY3Cgppy_3DCA_a46llUCppeR1vMXkoWWNUF9XSjH7zzmda0mcC7bO5HYtP-mYW5XO_qw9bv8Pxxjf4fGf6VKNvkEap7zbQbkhBhg3vbFyYgZb_lytu5qgoSttTJr2lf_raIMk5CcQN5JCiezod3vA-2nalfmKqJSSC_9oo7bHxXdYDK9Oft2ewc7Gzy8OHdFRh031wbzMy4GJuXZCgfrRhSGdpFx2B_HwUGxAkvNc7OzlDmwlTrC5ul583PoQKS8N-NcdgPR4TbKLjzp_kl_V5lnjTwWFshjMb3jZEItcMH4RUJmW2lcK8maVwB9pbb81uonghePsoioZrM_QU1EOH7LBz6oo2BeZQ_-XUtj-VdsOUUkgE_nT3qcR3grHu8zDUVBycCdWCUegaSKQwHZMn7jj4jLPDaVvDpFs_AqdD9fmY5IyTMqj2625nxdBFtWLsmVumuSusQbpKYODb5AgZmtsH-7ZvPF1dFMY_veyGU_zWBnwA__P25CPY99ky2A_AE8dHeB3vkO-OckFXw8TKTOM2Lqtlz8fANyBhgSTxwQ6L90wHWXIPl0GJKEjp4EM7qCliM7k","https://external-lax3-2.xx.fbcdn.net/safe_image.php?d=AQA-2hLjOQq1ptmo&w=540&h=282&url=https%3A%2F%2Fimages.chinatimes.com%2Fnewsphoto%2F2019-08-25%2F900%2FB03A00_P_06_02.jpg&cfs=1&upscale=1&fallback=news_d_placeholder_publisher&_nc_hash=AQBwgCF4qzvKrdaK","新黨主席郁慕明（本報資料照片）","拒談一中同表 不配叫中國國民黨 - 政治要聞","國民黨前主席洪秀柱因主張「一中同表」，遭黨主席吳敦義要求不能隨便講「一中同表」，不然沒資格當黨員。對此，新黨主席郁慕明昨質疑，現在國民黨的兩岸立場把自己的「中國國民黨」都反對掉，是要怎麼拿回政權？如果..."
"https://www.facebook.com/bingzhong.wang/posts/2371745519715991","1571145883","【台北西門街講：和統保台真愛台灣 政黨票請另存新黨】

 ""一國兩制台灣方案""，為何不能談？當然應該談！
現狀就是""一國兩制""，大家別迴避，新黨大聲談！

 剛剛到台北西門六號出口，宣揚新黨【和平統一
保障台灣】的理念。這裡長久已被台獨大旗隊占據，把觀光勝地搞得烏煙瘴氣，現在大陸來台自由行斷，觀光客也愈來愈少，台灣再這樣下去怎麼辦？

 
感謝有大哥主動給我們打氣，尤其是他留給我們的一句話──「和統保台才是真愛台灣」，深深地給我啟發！現在蔡英文扮「辣台妹」，自稱她在愛台灣，但恐怖情人也說是愛，愛到足以殺死對方，這樣算是愛嗎？

 
兩岸關係不是自己喊爽就好，台灣前途也不是比誰嗆得更辣。一個每年讓台灣賺幾百億美元的大陸市場，我們可以不理會她嗎？蔡英文當初承諾「維持現狀」，現在「現狀」崩塌，從外交戰、經貿戰到軍事戰，吹捧「辣台妹」的綠覺青，都準備好迎戰了嗎？

 
蔡英文會御駕親征嗎？那些嗆大陸嗆得很勇的台獨咖，有多少私下賺人民幣？楊世光爭取通過連署，就是要站上總統辯論台，撕開他們的假面具，直球挑戰蔡英文，把兩岸路線講清楚說明白！

 #庶民公審蔡英文 #全民下架民進黨
#政黨票請另存新黨

 👍👍👍
【懇請幫助楊世光通過總統選舉連署門檻】
▶下載連署書：https://is.gd/aTcBft （請以A4紙列印）
▶如何連署攻略：https://reurl.cc/e59NaM","1571659340","/watch/?ref=external&v=502570473654452&__xts__%5B0%5D=68.ARC_4bAk6G2KQrDzmLpsZ_KgyyefJPoJYkAFN-Y_PY8ydtmTvQPz77GzpKKv3Nwa8JSZ8jF9PuRgcSqOpA1SjKSM6ZtdC6WNOQLYGhRwP7OcweJumxZx1gyO80slJf4UhXdWpyVVuTT9Tw4wn7--AlsmbbrgdcAAPTfplPMvMJWiWmq0gNBbbyNBXvULBjQ6JxrC_aW7inhTvi5B1l7vqfP_z3x0kMg3kNzkrcbyoPgYpvOwaT3ZgIfHL5veUSrhxDWUlPDYArnR_gFp-lRTf38KmgTtlGy07U3a-s8pdet7-DkebdtqjbnITlRDVe4yungWNhCEwIRSRI3JL3SDk2gOzzUaUk5EILyQYg&__tn__=kFFHHH-R","https://scontent-icn1-1.xx.fbcdn.net/v/t15.13418-10/71332357_481093166082369_3022346925459374080_n.jpeg?_nc_cat=105&_nc_oc=AQnG47d3y2punZuYnYK7TJCzyvOM8KT8KKE9KjZbD13WRMYEwU6CQ1cFSrrW_as8ZiE&_nc_ht=scontent-icn1-1.xx&oh=b5703584e52fa04eb06aa73c95057e7e&oe=5E178C82","undefined","台北西門街講：和統保台真愛台灣 政黨票請另存新黨","게시: 王炳忠"
"https://www.facebook.com/bingzhong.wang/posts/2306074782949732","1563093171","黃國昌的回應，陰狠、歹毒！所有到大陸發展的台灣人，都變成不是自己人，甚至是敵人！

 是怎樣的暗黑心態，會讓他對自己台灣人，沒有半點關心，只丟下「救什麼救」？

 你們視新黨為敵，理解。但這些被調查的台灣分析師，他們不是新黨，不是楊世光！他們是比楊世光更早在台灣分析股票的前輩，也比楊更早去大陸。

 其中，還有民進黨高層從小稱兄道弟的朋友。

 你們說自己愛台灣、護人權。那麼，這些台灣人如果真的涉犯詐欺，在犯罪地被調查，你們應該關心他們在調查中人權是否受損，關心他們訴訟可能的需要。

 
如果，按楊世光求證得知，他們被調查的案由不是詐騙，而是「非法經營」，那麼，就涉及大陸認定台灣分析師從事的「金融教育」行業，與「證券分析」允許的合法執業範圍不同，如同各國核可的醫藥分科不同，不同經濟體之間必須磋商，否則就會有觸法風險。

 這當然就要執政者與大陸協商，從根解決。可是，兩岸卻因為黃國昌主導的太陽花，以及務實台獨的蔡英文，談判機制全面中斷！

 要知道，ECFA只是框架，服貿才是談各行各業的認定細則。黃國昌當初聚眾占領，用暴力把服貿擋下，造成各國與香港都與大陸談的行業認定，台灣缺席！

 
政客搞鬥爭，把台灣經濟搞垮，各領域的專業者只好自謀出路，赴陸發展。現在，黃國昌竟丟下一句「救什麼救」，把這些人打成敵人！陸委會的聲明更自我打臉，引述馬政府簽的ECFA及台版「送中」的兩岸司法互助協議，還說服貿只是擱置不是廢止！

 所以，你們又變成挺服貿，挺「送中」？

 再說一次，黃國昌的回應，陰狠、歹毒！這無關立場，是你暴露自己標榜的信仰，誇誇其談的「愛台灣」、「護人權」，原來都只是臣服於你鬥爭需要的工具。

 
真正信仰人權的人，如貴黨（黃國昌應還沒退黨？）時代力量發起人劉繼蔚律師，為周泓旭在台遭受的不公發聲，擔任其辯護人；或如走過國民黨戒嚴時代的政治犯，站出來抗議「國安五法」戒嚴復辟！

 他們真正信仰人權，超越立場。至於黃國昌，就是赤裸裸的假人權，為了政治鬥爭，不僅攻擊對手，還要仇視到大陸發展的台灣人。

 政治玩到這樣，也真的太可悲！","1571659340","/bingzhong.wang/photos/a.1557579191132632/2306074759616401/?type=3&eid=ARD1vZ5Zd_Lw-XQwAw2XbXxwEgsCUqIKVfUWKhEB1-kINlUfGu13aalIFGVEHPAc-CpEtRPNMRTdIBDt&__xts__%5B0%5D=68.ARBnpOa4i-IuJ6BTbYztNwvf77775GMITlNdli81Vr2n5go6ocLHgJ90IzrQKpf3fMyKgUn5ShvwK9GWT1K35W4LbWdONYnGdfa-z3g4frxb3jaMdQWgLDJtl7W7jjIPTZu7LvgcXRD7amu0dNvLALNRU-X2Qwj0XsniT6WPOw7Y3JO0dlKQJN99ueQFM-gXjIJ0e6eQBC99ydxh7zwj7CgODYP3RckCo-VkpDxpLLEatCF1JihWJALfzFCFFyVzgt_8oDiDuQEEJviJr5DtoejunT5edvLEKPa2HrKJgfkL3fiu0mjZnCxiunRecUPQuTzEfkPr2ppHR2_G70vU9vLKYQ2-&__tn__=EEHH-R","https://scontent.fnat7-1.fna.fbcdn.net/v/t1.0-0/p526x296/66882036_2306074762949734_3838077234921340928_n.jpg?_nc_cat=110&_nc_oc=AQkaJIj6DU0ZSpLsQ0T7Ch-cROM4hfvmo2Cv4J30C8ZiUcp7HT8vqRb83aoXxK5hNGA&_nc_ht=scontent.fnat7-1.fna&oh=146aace1a2331d2f29ac8944f288b114&oe=5E2E5AE6","undefined","",""
"https://www.facebook.com/bingzhong.wang/posts/2338940576329819","1567419489","🙏
奉勸基進黨：不必不滿，要領補助，就好好努力衝政黨票，大家一起過五趴，進立法院把台灣前途論清楚！更不必動不動爆氣失控，從政就要以理服人，新黨提出台灣方案，你們大可也提出台獨方案，說清楚台獨的步驟、方式、規劃，把預期的成本、所需資源通通講清楚，讓社會大眾來思考！

 ❤️
良心建議：小黨要過五趴不易，當初我們還要三點五趴才有補助款，現已修法降為三趴，要突破就得有自己「獨立性」！這「獨立性」不是台獨，而是對大黨要敢於批判，非關統獨，仍有很多公共議題該監督！如喜樂島拿出證據追查蔡英文神秘論文、時力黃國昌委員揭發國安私菸弊案！貴黨如只因接受民進黨禮讓艱困的區域立委選區，而變成不敢批判民進黨，甚�","1571659340","undefined","undefined","undefined","undefined","undefined"
"https://www.facebook.com/bingzhong.wang/posts/2332163640340846","1566560736","＃忠言near》自己爆氣當成是「電爆」對手？還原台獨陳柏惟如何在節目中失控抓狂！

 
今天忠言near，播出前天炳忠上雅虎鄉民大會直播節目的字幕精華版，帶大家看看唐湘龍一針見血的點評，范雲兩次搞錯事實被炳忠打臉，以及陳柏惟為何因炳忠一句新聞事實的話而情緒失控，獨青把自己爆氣當成是「電爆」對手？

 ♦♦♦
#忠言不逆耳 #忠言要near
🔥即日起每周一至五，【王炳忠 忠言】在王炳忠臉書粉專及YouTube頻道每晚上線，敬請鎖定！
🔥王炳忠YouTube頻道：https://www.youtube.com/c/王炳忠wbz","1571659340","/bingzhong.wang/videos/940877206274104/?__xts__%5B0%5D=68.ARCD1PHwcFjnm58JM2f_09blJjpajsEFJooppX-pVNtzadXge6Ci1CE5N4jOG7eKn4MsVPsFyUWGw5G_UVdRFaE01uWfRtWzKfQdEiLoWwPb6aNb5QeX-HX0wDgL2lpuhCp9TT2PErqAgvd03NfU9IIaiYL6KS8feWcFdhJUqsfg-3B_PXThqyckGseMojg_rw6h_55sH0R-8KqaE8lFqFUVYY0igmfrabKNFmEyRb_-WQ-UzHZGR-Jlzk7SrcCCgPknwi-mwOznHLga8d-iT8i_eUAxiEAwALBxSEKad6H_Q_fJoJU2x2qFKbqPzZCH1Rk-ZlgSqgsmWFuoSjeb0Kofh4Syhml9Iu6eXmiexe4zPQyBSc_k9wI&__tn__=HH-R","https://scontent.fplu9-1.fna.fbcdn.net/v/t39.10505-6/69752417_2568185163258413_6801642086916423680_n.jpg?_nc_cat=102&_nc_oc=AQl-0yPLBkqyLTIJcLWlAKSzyvRAunAXIvEFrTOWyVrPpBI5mnI2YxBRCXoXMJ4SUko&_nc_ht=scontent.fplu9-1.fna&oh=5136e2e9b28ebe8b9d5eb160d663f422&oe=5E5F7C30","undefined","Watch Now",""
"https://www.facebook.com/bingzhong.wang/posts/2330510090506201","[Error]: TypeError: Cannot read property 'attribs' of undefined","","1571659340","undefined","undefined","undefined","undefined","undefined"
"https://www.facebook.com/bingzhong.wang/posts/2328020510755159","[Error]: TypeError: Cannot read property 'attribs' of undefined","","1571659341","undefined","undefined","undefined","undefined","undefined"
"https://www.facebook.com/bingzhong.wang/posts/2321132318110645","1565151350","穿越藍綠統獨，回到台灣現代政治的起點，便是1920年代蔣渭水、林獻堂等人領導的「台灣文化協會」及「台灣民眾黨」。1927年7月，台灣民眾黨成立，4月國民黨才剛在上海殺左派及共產黨，8月中共南昌起事，國共從合作走向分裂。

 
當時台灣的知識菁英，開始形成濃厚的「台灣意識」，那已非傳統中國的地域觀念，而是在台灣被迫淪為日本殖民地之後，台灣人對自己命運的追求。在前二十年激烈的武裝抗日後，轉為體制內向日本的請願，同時支持孫中山的革命，寄望祖國復興，終將解放台灣。

 
這些先賢希望用文化的力量，柔性對抗日本的殖民。所以，「台灣文化協會」強調台灣人的中華本色，用漢文化喚起台灣人的民族意識，這和如今「台灣意識」被窄化為「去中國化」，是完全不同的概念。

 🔥
台灣光復前，祖國山河破敗，台灣菁英只能先求台灣在日本殖民統治下的自治，乃至更激進的台共追求脫離日本而「獨立」。台灣民眾黨後因左右之爭分裂，蔣渭水思想左傾，受孫中山「聯俄容共，扶助工農」主張影響甚大，1931年8月去世，享年僅40歲，留下「無產階級革命」的遺言。同年9月，日軍發動「九一八事變」，軍國主義抬頭。

 🔥
台灣光復後，祖國國共內戰隨即再起。蔣渭水養女（蔣渭水胞妹之女）蔣碧玉與夫婿鍾浩東曾回祖國大陸投身抗戰，戰後鍾浩東加入中國共產黨，在台發展台灣省工委基隆支部，被國民黨政府槍斃於馬場町。李友邦、林正亨、吳思漢等參與祖國抗戰的台籍菁英也都蒙受同樣命運。蔣碧玉後來走過白色恐怖，解嚴後與余登發同為中國統一聯盟發起人。

 🔥
1971年中華民國政府失去聯合國中國代表權，知識分子對台灣命運的追尋分成三條路線：第一，反共到底，堅守中華民國是中國唯一正統。第二，與中共和談統一，台灣高度自治。第三，推翻中華民國體制，台灣宣布獨立。應該說，這三者都在為台灣前途尋求出路，都是「台灣意識」的展現。

 🔥
四十餘年後的今天，祖國不再破敗，舉世關注中國崛起。兩岸交流頻密，台灣每年從大陸賺進大筆順差。然而，台灣與大陸的心靈距離卻愈來愈遠，整個島嶼經濟「靠中」，政治「反中」，文化「去中」。如此現實與認同的劇烈差距，將把台灣帶向何方呢？

 （附圖：歷史上台灣民眾黨前後版本黨旗、蔣渭水棺木覆蓋台灣民眾黨第一版黨旗）","1571659341","/bingzhong.wang/photos/pcb.2321132318110645/2321131121444098/?type=3&__tn__=HH-R&eid=ARBGfdc1cyvQene1USyPKK4szkSI9fZ-mIDY94j4Q7zOKeJGTFCQs056iz7_QfKJIwUXdtDbD_45q-hi&__xts__%5B0%5D=68.ARC22f2Lep0OxEfLBfwEQajT3HZVtNY6D4XsH5B92fNN6sFR4uunIa7btvnq6Cnju0CgSV5AA9e6RuqXftBrVIFqV7znf1UHNPQyBza1NgU4x-Vz0wATy_cqotJk6moQabIsQpgXXZZmXhnhup2coiAGHp_y7YZg0OMfSv-TvtRSEJtNFkpGTZMAud3hVSQnlRlygJB7KZBv6v59JAUKijPzbKbWGRcE9gDscGEkjSubGOvEotWi77l6jOjI9wsWehA5J16WXwvuE_ZZPRkzGabfYTw4OBB0vMhn3yh32Pxrs3qLEh1DLaaGMmE6E5-iu1vu3UpKsgO_bXRuNPX3HaG2z9a9","https://scontent.fbkk5-7.fna.fbcdn.net/v/t1.0-9/67959607_2321131124777431_4239325895896072192_n.jpg?_nc_cat=107&_nc_oc=AQmh-aMAWxRBhros_NCf2wbqjQNFCtpmzgF1Qs244c7CO6Kev4UVxb3oQrVFxa5h5Wg&_nc_ht=scontent.fbkk5-7.fna&oh=ff5202c2fca870ed269ac76a3f571c1e&oe=5E1D9542","undefined","",""
"https://www.facebook.com/bingzhong.wang/posts/2284918501732027","1560427556","反服貿X反送中 超級比一比！

 🌻【共同點之1：參加者普遍不了解法案內容】
反服貿：媒體問參加太陽花場外靜坐的學生，知道服貿協議的內容嗎？
參加者茫然，更別說一堆跟風轉貼的年輕人。

 反送中：媒體問上街遊行的人，看過逃犯條例修訂草案嗎？
受訪者回沒看過，對內容也一知半解。

 🌻【共同點之2：宣傳者都透過想像的謠言煽惑恐懼】
反服貿：服貿過了就會低薪資高失業、醫療資源都搬到大陸、網路及金融個資被駭、出版自由喪失、理髮店洗頭兼洗腦......

 反送中：逃犯條例修訂通過，打工仔將失業、教會被打壓、小市民動不動坐七年牢、在網上罵過習維尼就會被送去大陸受審......

 🌻【共同點之3：抗爭者都預謀要占領公署】
反服貿：成功占領立法院後，又預謀要攻占行政院，三立新聞當時稱學生已備好油壓剪、地墊、樓梯......，就是要闖入公署。

 反送中：遊行結束後當晚，即升高衝突要攻入立法會。昨日又再發動群眾進攻立法會，直接拿出削尖鐵支作為武器，顯有組織、有計劃要拉高攻勢。

 🌻【共同點之4：抗爭者都攻擊警察】
反服貿：有抗爭者用童軍繩勒警察脖子、糾眾圍攻警察，美其名公民抗命，再來反控警察執法是國家暴力。

 
反送中：遊行結束後當晚就攻擊警察，打得警察滿臉是傷，昨日強攻立法會不散，削尖鐵支、鐵馬、磚塊都出動攻擊警方，港府因此定調已失控成暴動，下令警方強制驅散，警方以橡皮彈、催淚彈、辣椒水鎮壓，再被批評警察暴力。

 ＃挺香港法治 ＃反民粹暴力 #港版太陽花","1571659341","/watch/?ref=external&v=2264524490465990&__xts__%5B0%5D=68.ARCYxpO6WBOybUvfVtLw5NeeA4yTlurKQELBpFH0mP2Y-Z4nLAr2Q_EItCIOdCyLypC-aFIhYwdaKLiRD1pZ8UsLpLVtiF5iokKGraqBKtfg87_VIMEURtbmVVMYNiiQEt8IaGA5DffrwtcQ_h46JlJIIsBdj39pS2CZKWS6zzYYagwqLOnlVOE886GjEArvkITMigvQlt-ghElxZ0t-GqQMXfskZ53UKHWSPaIxFWsebCs2H47vXB3NRN5TLYYaHRuorrDRDjtYb-sAWM6ZPmKzUDJHP9Wc0eNOCGb1i-yOZwON-I_JMuKp11-t7kfV8ojj-cgRnYjX7aLbkwGH8EZLV6Qos09ZWsDbyQwD&__tn__=kFFHHH-R","https://scontent.fcgk16-1.fna.fbcdn.net/v/t15.5256-10/61546861_2264537157131390_7336521203537936384_n.jpg?_nc_cat=107&_nc_oc=AQl7GpL-1enIOVzwks0W3GfoFVnWP2GSxpDDJLCjMEtlXVss_T7OInjWC27MzyOJm40&_nc_ht=scontent.fcgk16-1.fna&oh=6b1c2c3e513ae03a58813e223c4e9705&oe=5E1E18B8","undefined","【太陽花香港復辟】反服貿X反送中 超級比一比！","Diposting oleh 王炳忠"
"https://www.facebook.com/bingzhong.wang/posts/2335727166651160","1567000100","#忠言near》政客只問選票市場 我們要問人民發展的空間在哪裡

 大陸暫停來台自由行，觀光業者叫苦連天，觀光局淪為補貼局，還沒賺到錢，先要補貼日本、東南亞遊客各種來台經費，只差沒包吃包住！

 試想：大陸不過是不來消費，台灣受傷已經有感。如果大陸也學美國，經濟制裁每年賺走大陸幾百億美元的台灣，台灣承受得了嗎？

 
兩岸迴避不了政治談判，堅持兩岸是兩國，那就對抗，包括戰爭。與其說台灣人真為了台獨做好犧牲的準備，不如說是台灣人的務實性格，講更白叫投機，能混就先混，等到混不過去了，打不過再投降……

 這種自以為是的「務實」，其實一點也不務實。

 
現在批評新黨提「一中同表」、「一國兩制」的人，都說這套沒市場，沒選票。那麼，如中國國民黨拿香跟拜，屈從民進黨的兩國論，難道就有市場？這完全是長期以來國民黨放棄撥亂反正、倒果為因的說法！

 
很簡單的道理：如果民進黨兩國論正確，那為何還要中國國民黨？國民黨再怎樣說「一中各表」，不還掛著「一中」嗎？如果中國國民黨落得跟民進黨比「反中抗統」，難道不是先反自己存在的正當性？如果中國國民黨認為不要「一中」也可以，那何不把「中國國民黨」的名字讓給新黨？

 
政客迴避台灣前途的重大問題，最廉價的理由就叫「民意」。民意如流水，所有總統哪個不是高民意選出，最後又支持度跌到谷底？與其講「民意」，不如說台灣人務實的「民心」，可以一邊拿台胞證賺大陸錢、走中國公民通關，一邊繼續說台灣是主權國家、兩岸是一國。就像國民黨一直自豪所謂「一中各表」的九二共識，可以一邊給北京交代，一邊又在台灣拿來和民進黨區隔，真是妙哉！

 
然而，一旦北京不買單了呢？一旦台灣在民進黨「去中國化」操弄下，愈來愈多人也不要九二共識了呢？政客只問選票市場，但我們要問人民發展的空間在哪裡！新黨相信，這個社會依然存在有識之士，我們就要那些不願再混的人民「市場」！

 敬請立委選舉政黨票投給新黨，保住和平統一的聲音，為台灣的和平繁榮留下希望。","1571659341","/bingzhong.wang/videos/547380142735777/?__xts__%5B0%5D=68.ARDNviidV9zdpzGyL7SNtH0kTwfxaGelb9deqsQ9skmbKXCVxWgD0wbEfehInkPGXRhvoWGgIWnrmjcuZ_njYNTXG01viMTY1YAgUtFyc8alXx2d7EHRr8yFuUGzwl_AdgZqoNotpxrOSTlUwTSuFU4bwkx6tazY2ztlvKSHZibgwFZGpuN6z-sP6CuPhmB9tN9267XGnbeAno0RoICXpQnWj7gnayUnDEmp7UHemjPHPTT9Ehjv32TF5WFUDtkD7LpZD69w89KlDb6I07C0BIEPM5UNSNV4zut3verNe9S3XBM58HKZ9oPO5S_KHdkDvuUkEYtQCtEcdDq-h_zDDgKIaAtFUWkb1WU_EUKggRr84L3lXon4hyo&__tn__=HH-R","https://scontent-nrt1-1.xx.fbcdn.net/v/t1.0-0/s600x600/52144330_2216812035209341_2090937375596216320_n.jpg?_nc_cat=110&_nc_oc=AQnylJt_CWzoUjlqz1PkSFlMtXQoQ8b4mX7BmYYXZdnvrzwFqFYEo1mWUExqTNzGeDw&_nc_ht=scontent-nrt1-1.xx&oh=719199279dac71f13f9a9531e4679af1&oe=5E644249","undefined","Watch Now",""
"https://www.facebook.com/bingzhong.wang/posts/2308580932699117","1563440011","昨上Yahoo!奇摩新聞鄉民大會
英系代言人徐佳青
花了一大段時間論述蔡英文三年政績
包括年輕人「加薪」有感
以及「轉型正義」已完成一大半

 但我當下只想到兩則新聞
剛好都在七月十五解嚴紀念日那天：

 一、林飛帆走馬上任他所謂「已無民主」的民進黨副秘書長，月薪九萬，網上熱議「民主真是好生意」；

 二、昔日國民黨戒嚴時代的老政治犯，走上街頭抗議民進黨搞新戒嚴，怒吼：「我坐過牢，我即將再坐牢！」

 （林飛帆正好就是徐佳青的繼任，如今看來兩人都是英系「大將」，徐可望轉進接下來蔡英文的競選辦......）","1571659342","/bingzhong.wang/photos/pcb.2308580932699117/2308580386032505/?type=3&__tn__=HH-R&eid=ARB7uIcmJ9fTZgJt4u35xZh3TuPTzGEGCP_UEuj_d2S563drdCJX8HFnSK2JixppwZxpFG0frayga3-p&__xts__%5B0%5D=68.ARDQ0CnKrwYW6xHYLaNkxU6TGlmPPxtJeA5kjQcG34a0KIlscPqCugUg-5dMpNzEetb7X6DJxXzjCNc0cfHrZIsygF9z_fN5aDw5ofcFpSpisRnSVx5OaZBf1FvLZr19BqmPeAFptuzZcSfFMfK2dQn7-fpuMBaFhRrgG-B37L6kqKaiVkWO6j5U4TzH-Eb881BCHHucNz5yM34jtCMaFf4x8Z0KwB1ECoRaBFElXEvm2Y-GVW-8a6Y5R8QK4QcoiwpHRCCh59IFftuedLVIarDqj7-svsQfQwYbO6usw1PbFJuZDT-YC5FXq_N2iCnENg4abhZyDQXQiaEpDv-bwNJGUT_T","https://scontent-jnb1-1.xx.fbcdn.net/v/t1.0-0/s526x296/67138200_2308580389365838_9031349250256011264_n.jpg?_nc_cat=109&_nc_oc=AQleQMrUu04UAXTyktTxU-OGlfhvbtHG3jm56w28f2SdNuVRgiZAaCDmBYBDZLRisoY&_nc_ht=scontent-jnb1-1.xx&oh=fd06bf494a08f68481a457c67e8f5803&oe=5E221617","undefined","",""
