url,posttime,text,crawled_time,attachment_link,attachment_img,attachment_img_alt,attachment_title,attachment_brief
"https://www.facebook.com/DeutschesInstTaipei/posts/1698398946957636","1567560896","昨日9月3日本會王子陶處長頒發德台友誼獎章予台灣高等法院前庭長溫耀源法官。溫法官對雙方司法合作做出非常重要的貢獻，其中包括90年代初協助建立德台法律人員協會(Deutsch-Taiwanische
Juristenvereinigung)，同時協助加深台北地方法院與漢堡邦法院密切的合作關係。近30年來，溫耀源先生多次率領台灣法律人員團體訪問德國以及在台灣接待來自德國的相關團體。台灣高等法院與德國法蘭克福、科隆高等邦法院維繫這麽密切的夥伴關係，都得感謝溫法官的大力支持。
即使退休後，溫先生仍持續致力促進雙方法律合作。

 Am Dienstag, dem 03.09.2019, zeichnete der Generaldirektor des Deutschen
Instituts, Dr. Thomas Prinz, den langjährigen vorsitzenden Richter des
Taiwanischen Obergerichts, Herrn Wen Yau-yuan, mit der Deutsch-Taiwanischen
Freundschaftsmedaille aus. Damit wird der wichtige Beitrag, den Herr Wen über
lange Jahre für die bilaterale juristische Zusammenarbeit geleistet hat,
gewürdigt.
Bereits seit Anfang der 1990-Jahre war Wen Yau-yuan maßgeblich beteiligt sowohl
an der Gründung der deutsch-taiwanischen Juristenvereinigung als auch am Aufbau
der engen Partnerschaft zwischen den Landgerichten Taipei und Hamburg. In den
darauffolgenden fast 30 Jahren hat Herr Wen vielfach Delegationen taiwanischer
Richter zum Erfahrungsaustausch nach Taiwan geführt und in Taiwan Besuch
juristischer Fachleute empfangen. Die Partnerschaften zwischen dem Taiwanischen
Obergericht mit den OLG Frankfurt und dem OLG Köln sind ebenfalls gekennzeichnet
von der starken persönlichen Beteiligung Richter Wens.
Auch nach seiner Pensionierung ist Richter Wen weiterhin aktiver Förderer der
bilateralen juristischen Zusammenarbeit.

 Die vom Deutschen Institut 2013 ins Leben gerufene Deutsch-Taiwanische
Freundschaftsmedaille wurde in den letzten sechs Jahren bereits an 35
Einzelpersonen/Unternehmen/Verbände verliehen, die sich in hohem Maße für die
Vertiefung der bilateralen Beziehungen verdient gemacht haben.","1571347910","/DeutschesInstTaipei/photos/pcb.1698398946957636/1698397320291132/?type=3&__tn__=HH-R&eid=ARB9PXyuHs850pBFRhPCOHti1oOV5qF2qZHkObH-6sDRosn5WpkfR-nZVcZneTdu9a1A4xBfTx-y5GnJ&__xts__%5B0%5D=68.ARDRwKKMiBQUFzCqv3_OgO9FaJGHmOc3MeJJGzyO_88wmjS4alzo8I0tebKPdw9mWe5vX3WmnJoMWdHjMCUYTkgfkyZ2SKFlokpozI3RFZd-VuC2eL0d0rq83yct3jJIWGkGxXcjNNTZcvEaeSowHD1qw1HDpk75-QfScydLZ1rvUyhstdf3cV9vKb8BHnJ-xFQPccJkoUF36XAiDnCVyfo6QdFAl9vdePoKOxEEt27PwNyPOH2RLVr_ZCarKF6Rx3Bi7GyxgoSE7QFsi3nqJKheI7PcUJOnjEZJ3zTRSSlRbSxahEvJvMNekD0euBp3iz2w3J-qzoHnBPdPuYRtUXuxOw","https://scontent-bru2-1.xx.fbcdn.net/v/t1.0-0/p526x296/69405210_1698397323624465_3827430058239197184_n.jpg?_nc_cat=110&_nc_oc=AQkqjv-ve_-5A09IhZNgX6PHEijgEIy_EudtPoGV-Ofl0Dn5bAEhleKlncCvvYmUa3M&_nc_ht=scontent-bru2-1.xx&oh=a423b5ac8fdfaf4a7fa596203fdcfcc6&oe=5E63252E","undefined","2",""
"https://www.facebook.com/DeutschesInstTaipei/posts/1674997002631164","1565051452","歷史課：不服從是義務 德國向暗殺希特勒的軍官致敬","1571347910","https://l.facebook.com/l.php?u=https%3A%2F%2Fwww.cna.com.tw%2Fnews%2Ffirstnews%2F201908050280.aspx%3Futm_source%3Dsite.facebook%26utm_medium%3Dshare%26utm_campaign%3Dfbuser%26fbclid%3DIwAR1jIYT_o7gkYWSkPECtGz-zq2J0nRMNd_h0XNor2Oa5_hgsCN3X3O75kK4&h=AT2pqGa6TrnxyhUWl8bYXMnq1Fg67F2Ag2IMhLzA04q9wk2Qeuhlo6oqxZs_WN5k8YvOCFzakAnIYbNE9oFP7GPL8XyREgxUuI_zMYJvlSPrFNuXe5unhjQmd0jFH_QGvc9QSbon4wWeIMh1jgV40vRgughpTNoVByj6yKO2w8bGrMwPFI_JUQOyDp58PL-kWVcFyAnDYsTC0OPxQaoZVxjFphuMyLrYGzbegu8CgTjVOT1F_DBtBX6XMt87uQhzUzA6_RsanI-bBaxD_rP79RmV2Cc3hyLIn2GXQrQr1mQEVsW9ZnWIUUE8ReJPmXFwRYkeqJ6Lm2276iXU6G7UycL7H9BbyCehm7Od-LqHBN4U6_yW9DXfC8nygqELIaZvPNfGs5xpLIkQNL6B8WX-YsqUW-w0PotRdj7ll0yRIqLDp5Lr1j0NroMVtGwpu04ycvNlIO7qlnFzj8vJ9dNeVhrrF9Vv4L20h2fvxIB9KM0WofRIe8Ept-M3Y738oMOXH3rW6IxAKzvf_sPphN29YTXJNKm-4Qqyr8lzhIP-ezJXskTugxNzkMRXGuAN-n7ysyrvGMAp9OCJ0VsvMtXrpXmBdSfw_yQRb4w9DDNI8DeFofx-MpfCPPWqspH6idpFNoQ-xHFjUQlZ22TrADJxD0aMIhaGb36D","https://external.fymy1-2.fna.fbcdn.net/safe_image.php?d=AQC1397sl0ZRns-Y&w=540&h=282&url=https%3A%2F%2Fimg5.cna.com.tw%2Fwww%2Fwebphotos%2FWebOg%2F600%2F20190805%2F994x522_897912777030.jpg&cfs=1&upscale=1&fallback=news_d_placeholder_publisher&_nc_hash=AQCvXmXAmg8mQkSq","Image may contain: one or more people and people standing","中央社新聞粉絲團",""
"https://www.facebook.com/DeutschesInstTaipei/posts/1687116068085924","1567225382","跟隨歌德的步伐... 去遠足吧!
德國孕育了不少著名的詩人、文學家和哲學家，其中一位最有名的就是歌德 (Johann Wolfgang von Goethe) 了！
今日，你可到「Goethe-Wanderweg」追隨歌德的腳步，這條通往哈爾茨地區最高山峰的小徑從Torfhaus開始，沿路有近9公里路況良好的山徑～
歌德在居於威瑪期間，多次到訪哈爾茨山區，並在林蔭之間尋求到不少創作靈感🌳✨

#圖林根州 #Thuringia
#德國 #Germany #GermanySimplyInspiring","1571347910","/germanytourism.zh/photos/a.135485483697332/467321973847013/?type=3&eid=ARAbVMrwh9HDF8z0juNaSiLC9nbuPwR0Tr3m9UxRkfANlLs4Yc6R0ifGZqZb8rz0pdmqrJJ1XkHStMLg&__xts__%5B0%5D=68.ARBVH28gG23dgdj9Fq5YdGF0zoBuZNkoy28iUNdjwIR1FRdOvk-U81ZnwRHaXraXfbx9A8N_zIyQz8JCJu9JPvgwJpR5TPLDz_quJif-HB8_tq3qTX_q8V0_smgvlG0kgEWqw4-i9ZTLC_Ep1RUdgzzKbN1Utjdrn4iKVKTh8vibI2WOf9HizRrOoa5qVT4EFBAhsANxIQhKJpNW7c1vT1dugS2s1dsyEIUZU-mfkLosj-GbMrrmzRekBOG5HZcbHLvsKkJovk-snL68E823D3gKsEW0TEWcfKKpqYt53abaKSEW4Xd-tiwbTva5sQcqGVEi0Rfsy2sJ-c6YMZD7YbRRX4PQ-axmYGvdbS0s9AMv0rASAH_fMzxE0sW_6HuIo-vWoCs8CXDVIS5zyYSwhA5nnjoRbnCay1Yy-u5k9b1wTgej0zi50jHSVm-QTYQrpVQEHdUjO9yYgUSwK-MIlVFO4x-HAylik0sENqkNb0sxvGV_E36nJw&__tn__=EEHH-R","https://scontent-cdt1-1.xx.fbcdn.net/v/t1.0-0/s600x600/68488411_467321980513679_1181532218795753472_n.jpg?_nc_cat=104&_nc_oc=AQkmzML-D7uM2A3sUkSUdL03du5tptVbIssM0T-wO4EnyyqGqpPVfpxQ5hws5XcmwaM&_nc_ht=scontent-cdt1-1.xx&oh=f0d7a06d296849ea5ec2bdcea53c8aac&oe=5E25B407","undefined","Germany Tourism",""
"https://www.facebook.com/DeutschesInstTaipei/posts/1631102333687298","1564801200","世界遺產系列：
34 - 喀爾巴阡山脈原始山毛櫸森林與德國古山毛櫸森林 
德國古山毛櫸森林擴大了位於斯洛伐克與烏克蘭的世界自然遺產「喀爾巴阡山脈原始山毛櫸森林」。它於2007年列入世界遺產名錄。在德國境內的
山毛櫸森林，分別位在Hainich國家公園、Kellerwald-Edersee國家公園、
Jasmund與Müritz國家公園，以及布蘭登堡邦裡Schorfheide-Chorin生物圈保護區的Grumsin森林區。納入德國這片低地與中等高度山脈的山毛櫸森林，使得位於喀爾巴阡山脈的高山山毛櫸森林更加完整。現今天然的低地山毛櫸森林僅存在於德國境內。德國的山毛櫸森林與喀爾巴阡山脈山毛櫸森林共同
反映出歐洲山毛櫸森林物種的多樣性。","1571347910","/DeutschesInstTaipei/photos/pcb.1631102333687298/1631102080353990/?type=3&__tn__=HH-R&eid=ARAPjuwxpVjsYFhOv01g1TK0_Q7pbisGaPrx5L1xIVSJxm_fKsrDBN0xQ6N0rAidaXIrnJzRJ160qgRc&__xts__%5B0%5D=68.ARDaitA78mSTtbOASkv_WS71C4VCj09KHtfnoh1IBm_9HPytTqft9O54Ld09Lw0X8-yVuj1OZhlfGeQlV0ZR9ZQri0MO5B2C60HQbHciIKJ7E_suh-Lk25_u2i1VZAUeBoq1YkD-zRQSTLg91PmbodoFIhaD-VRyKYb1DKrmAF_KuR_InV_uZr4xUzZzITgG0XTff769uaGlYjhHa3oGedP8o-MfbXDOWL8GgBCe-iNgQU9-92x8h4hpABf1dUG1KO8XwSvvvF6X0JqgEixNXxh6sUUovyqIYyf6WtSy-6a8zt7Zh6o4VdnLd-oa2I8r4Ciza27J6en8u0IX8drSJxuSAQ","https://scontent-lht6-1.xx.fbcdn.net/v/t1.0-0/p526x296/64347689_1631102083687323_8692159585353465856_n.jpg?_nc_cat=101&_nc_oc=AQkOZkzqVsxvZisYBFsRCVlWIrMmesBvVbuD5AaXug1o-39L94o6n_g2_xVRmhtK8ts&_nc_ht=scontent-lht6-1.xx&oh=1a9d762df12acc272bc1afe41698490c&oe=5E1CA86E","undefined","",""
"https://www.facebook.com/DeutschesInstTaipei/posts/1685485448248986","1566608580","德國王室後代都跑哪兒去了？","1571347911","https://l.facebook.com/l.php?u=https%3A%2F%2Fwww.dw.com%2Fzh%2F%25E5%25BE%25B7%25E5%259B%25BD%25E7%258E%258B%25E5%25AE%25A4%25E5%2590%258E%25E4%25BB%25A3%25E9%2583%25BD%25E8%25B7%2591%25E5%2593%25AA%25E5%2584%25BF%25E5%258E%25BB%25E4%25BA%2586%2Fa-50023334&h=AT0qywM-oyPDYK3PW22vGp-xpuACAzhQr6XL5gacwdUHG_xbj9gUoq3sWahprt_m3_7kjeJxd1K-W9hJIcnvBds-BibnGbYVBRlkCNVe9lOVhBc51Ullp4hk2ETQ6N6uu_FG71cehEQbvzGY8knYE1M-5LpRnDfTGCT0w32VGq_84LgO0DejCsa4e0tA6UedJycj4nQLQq1H3ovLKfDQRc37NXub68CTQFSHZyPEHpEfWBaeyMozBAOrUQSEUMZPCJAg1FLJwURZrq5Yyeb7ljy2B2KH9CfHsWE5wQeSayN_ouLxjfs4-tGTx3uBGc2gOWjjOoE3MwbTKFJaN-VUICa3MO1dI4DQAFxbz_16nKpQfaH73Cy2tIKw5THUNDip6_GAgzoUEe-QzWjDGgXnd_FonXJET7pCpA1pTT0B0lNqgphV30cYmfF2S7JgndLy7qSWsbHgg6mpdCpQlq4QOBSOLj52DvTfc3hE6XlFJBZgM6bD_FQ-7_XJtnpK6J6sc0cZYIKT8uU2_p1a5038wCP_s9vyZ7FmNQIdUzQ5jz0X2_IrDHGqL_ZvqHkbn80LArA69zcLuYgtzA_6V9iGrood3Tm1DHslfZSz7eAVdu2gk8VFnA0elgv8GX9xfFLZ3Yq9Xy4H_3CZij8PrP1FGccXmC_ilOs-","https://external.fifo2-1.fna.fbcdn.net/safe_image.php?d=AQChcHffJerDVk0f&w=529&h=529&url=https%3A%2F%2Fwww.dw.com%2Fimage%2F40839919_304.jpg&cfs=1&sx=48&sy=0&sw=529&sh=529&_nc_hash=AQAGkRf9QcjuwrDi","undefined","德国王室后代都跑哪儿去了？ | DW | 18.08.2019",""
"https://www.facebook.com/DeutschesInstTaipei/posts/1724920057638858","1570160898","2019 年德國統一紀念日之際德國在台協會處長王子陶博士撰文(工商時報副刊):","1571347911","https://l.facebook.com/l.php?u=https%3A%2F%2Fwww.chinatimes.com%2Fnewspapers%2F20191003000535-260210%3Fchdtv&h=AT1CGFoGuf4o12-e4R8bWNe5Oh_tDkVvphNUj7tr9-nP4VnBjqHDcV_MPIwPNDDPtSY0t8WB9DIiqIUCBhQf4dNofLf09jA2ehvt3zdpchWmNOxpY63nG80IvkCxsLM7OOOFWkP7WRCTGXHPIffa8ojuu-jJBBEkkUoSJzNojAICr1B1U6wlPgpYotSm-oP93Q21gQFjLZ-qx2BPlHmRZMMFfkC8Sa3HohUPc32zzNUqlBlPNgAwVC5KGT8GS3y8WJqLOzjKl51laVuk-0I2jeboiAt9SNpEeoMULd3BmNuLFgUpwnHniVk50zIk0RgteVd9i2ybTHAvD8H1Bksc9ZD8bDe0we_hpj3FV5GF9mejtpe6ZXK0nA85cyNLaaz0iMSM5BhlO8uroTfHkSOq4FjxQ50JBr4R1rjT-lOoJ3jPKNTey50I5IUqF0AFvUj8na1ojJ8IRPerZz4pIuVuiUVwvv-nxhKUBbe_CNl4SS0THj0eCl44gi3JCrdt4lXz5uH3uy1jYY190BNMcguQLsY6wLyurf-F6_FrV57J985gmnhMBjXiMTLBI2YQiVACaFKY_1T8z8mzZF-Utx5_Xqle0A91KV6UOc-k4aO5Eiz0dOg3lflBziIaHbocB1AO-XcLentuHSHbJda6","https://external.fmnl18-1.fna.fbcdn.net/safe_image.php?d=AQBEyb66b3-KPhp3&w=540&h=282&url=https%3A%2F%2Fimages.chinatimes.com%2Fnewsphoto%2F2019-10-03%2F900%2FA71A00_P_03_01.jpg&cfs=1&upscale=1&fallback=news_d_placeholder_publisher&_nc_hash=AQAlXB2Vi9kVCYPu","德国在台协会处长王子陶博士。图／孙仲达提供","德國在台協會處長王子陶：再生能源合作搶先機 - 產業特刊","10月3日德國歡度國慶日，這天是為了紀念1990年和平地再度統一而名為「德國統一紀念日」。今年國慶的主題為「民主」。隨著威瑪共和國百周年紀念、德國基本法頒布70周年以及柏林圍牆倒塌30周年，今年的國慶晚會共同慶祝德...."
"https://www.facebook.com/DeutschesInstTaipei/posts/1709615289169335","1568698250","2019 台灣永續峰會-以產業人工智慧共構數位台灣，已於2019年9月12日圓滿落幕，相關報導如下：","1571347911","https://l.facebook.com/l.php?u=https%3A%2F%2Fwww.rti.org.tw%2Fnews%2Fview%2Fid%2F2034205&h=AT1d7y1Td3qnr0AINfZXVODwZeO8sEJfU4Oei1v5ea0naUa-JjafOQ28tOGR1QApi9jI3aDDrtdp8Twid23Blr5CDuZ94MiLSVqH4o_TWNXVFsAa6bVKBfjjbr5PKWElAlWY-8orkk2V9yiTsngHDPos1NhksBatzxoqIKt0Xh4spBCFeso5TiBEAwjqwU7P0BPp5fpnFFJuJwe82AwAtVoN23NgnJjL2bnKYcjN_Oy2D51PM4ML3I2YkGI2EYe7CHuYSI5n0tNrtABz6IZ_U3knisqOkjgg2bqj1jGAg9zuMstMnjv1TqeXt7W9x-ckWrib8R_KI7DqENQyMa-C21NLgo1ZY-vXJsJJO1MtD2QpDC5v17SSYa8Y_yQYhPyLt8517uvjA3u_MejaXw7wHS4qUkNCsGEpcX0fzgN0nMnakYFxBlk7x9a5jmC66kJr2depr1lg2izkYp69TijDpfeaIros3GcZp3GFw787nboer8zt8721zidkd_kEwnLyNP2PcbYYQLc-sCLrFFm2XtsVuASNsKBQ3qaOvYYV-Rp_ynxkQCNbRwhe8GLTPO1sfw0VrloQ9a5T76VD37e3BMV3T-9-76XHzEA7IKFE_9cKMDZ4L8hRtY4efi3EAjx2AEcor5YeC6jr5Avk","https://external.fccu4-2.fna.fbcdn.net/safe_image.php?d=AQD7u5XDQnYTSbtf&w=540&h=282&url=https%3A%2F%2Fstatic.rti.org.tw%2Fassets%2Fthumbnails%2F2019%2F09%2F12%2F2647b762d59d3a5dece0f7a1d915ca1c.jpg&cfs=1&upscale=1&fallback=news_d_placeholder_publisher&_nc_hash=AQCHlsa6C7cbUHpy","Image may contain: one or more people and suit","台德合作 總統看好在人工智慧、離岸風電共同引領新趨勢","蔡總統今天(12日)出席一場台灣永續峰會時指出，台灣與德國多年來在科技、經濟領域密切合作，相信在人工智慧、離岸風電等面向，台德雙方可成為最好的夥伴，共同引領新的產業趨勢。#央廣記者謝佳興採訪報導#平面媒體12日...."
"https://www.facebook.com/DeutschesInstTaipei/posts/1691329124331285","1566808960","德國聯邦交通部政務次長Steffen
Bilger率該部資深官員共4人，今（26）日起至28日訪台，將有助於增進德台雙邊交流，並拓展雙方在交通等領域的多年合作關係。
今天上午B次長與台灣交通部王次長國財先生及外交部謝次長武樵先生會晤。在三位次長的見證下，德國在台協會代理處長Sabrina Schmidt-Koschella
及台北駐德國代表處謝志偉代表分別簽署有關交通安全以及陸上交通的兩項合作意向書。
在台期間B次長將分別參訪工業技術研究院、Gogoro公司等與交通安全及自駕車相關的單位。訪團此行旨在實地瞭解台灣政經現況及交通建設發展，以利深化德台各領域的交流與合作。
Der Parlamentarische Staatssekretär im Bundesministerium für Verkehr und
Digitale Infrastruktur, Steffen Bilger (CDU), besucht derzeit mit einer
BMVI-Delegation Taiwan.
Heute traf Bilger mit dem stellv. taiwanischen Verkehrsminister Wang Kwo-Tsai
und dem stellv. Außenminister Kelly Hsieh zusammen. Außerdem wohnte Bilger
gemeinsam mit den beiden taiwanischen Vizeministern der Unterzeichnung von zwei
Absichtserklärungen zur deutsch-taiwanischen Zusammenarbeit im Bereich
Straßenverkehr und Verkehrssicherheit bei.
Die Absichtserklärungen wurden unterzeichnet durch die stellv. Generaldirektorin
des Deutschen Instituts, Sabrina Schmidt-Koschella, und den taiwanischen
Repräsentanten in Deutschland, Dr. Shieh Jhy-wei.","1571347911","/DeutschesInstTaipei/photos/pcb.1691329124331285/1691328957664635/?type=3&__tn__=HH-R&eid=ARAYMkT793kZVCfalLdjxn_3A08nLjUCMqaZ1U2wGZfSEoRCIa-hr4nWquEOg-Rvxw-eqwyYAm_Sf_oT&__xts__%5B0%5D=68.ARCYpJqj7s6zZOuh4WrZVf8YhnNw4Gu3Kmg_OX20_UuYvOKGFK6nCw1sIAa8sJ5vYF1LR2Om8dBrUOlGlBMLx3dNcz2iy7_pFTqWYSnHGxnFrw-lnYey9o-WLCOmwgBUs4vYNZiqWoh1M2Wo31E-Rpc_ujtxvF9x2oE-kTOJ6ABwMd4J6ZwS4EVq3SxX4lKfmEcaMbNircU3Huxvq4GbszZxSeUES3T6NWnmN3IL5Z-W6k9CqoAknmfR04PIDq5Ba8gAmQcvEJn6qWcMUqr5mshZvJ8VJ1J50yPW1x9Doq269u-Bl6Dx4xk2nBOn8N81j6XDwJ-IB4TJntOGQgwEFMc9OQ","https://scontent.fbkk5-1.fna.fbcdn.net/v/t1.0-0/p526x296/69211150_1691328960997968_2079718581716647936_n.jpg?_nc_cat=109&_nc_oc=AQm6N-4ffiDSIlqNHaYYNEAG1KIf1vjgP87Xomq5Y0Bt6HDPzvaQRDjmR711eOhWjnE&_nc_ht=scontent.fbkk5-1.fna&oh=0d75a27d7806ac942c4f026c364d34de&oe=5E248D5A","undefined","",""
"https://www.facebook.com/DeutschesInstTaipei/posts/1682928141838050","1565918328","","1571347911","/Alumniportal/photos/a.438487501606/10156142776621607/?type=3&eid=ARAtL0hblWTMrWZNF4Mh9VcudzI2xhLRGLvXiUA_eGW9B1nXv-P37mTSgbPyYZHjhbUTnE3_bOCkxzlS&__xts__%5B0%5D=68.ARD86CVQMEo1rCKTh4IIUYPl_RT9rWuft7tiaSYadFPR-N18pUXbj_nlT_U7MX6KJaJNYbruV-9FTGufw4loI0X_X-iVpiZ2NWXYpzTpvK2_bfMN7TIHJv4v6PWRtsR0LPA7KKBg-YdeocOHwoa7a9DDb1N2HxaM5-ONzZoz0KEZWHRyGl2eHN06P-231PfLTpjuKT98EhIs1gfxduikAaa6AsAmrCcIGLSnQmt2SsN7C53vX5_bEt62nFxK7QFpEsRgdJwpejPVaDa6DFF1paIrhSrT5mqLFzZVHllokVnRBkdmXlvWgISt0QZzkJ77Q0DDoc_GuJosXfm6nsF-2vKEdxf3d5VsbRKuGlDc1SSzD6hkwJbLWcKvtTgmx_fx9n73iz4oziR2a6josWbkezbM-2v83MAyW4i0ecZ13f4NlRwh13QhDgsTv-ayMiABlfJUN4rtdXHj8xjviOBFzQARgin1yFUxZOpZNXWkFRxr73bPZ7mV0PQ&__tn__=EHH-R","https://scontent.fsdu6-1.fna.fbcdn.net/v/t1.0-0/p526x296/67970614_10156142776626607_1235722096047292416_n.jpg?_nc_cat=111&_nc_oc=AQnrtKHOFd0HHdYSvb3fl9Pu8OhVRFkZz0SaaY2m1fp0x56Qc3v2mNpqc2eyLfa-Emc&_nc_ht=scontent.fsdu6-1.fna&oh=87794918d764dd3dd4ad4a529c959195&oe=5E310784","undefined","Alumniportal Deutschland",""
"https://www.facebook.com/DeutschesInstTaipei/posts/1711321172332080","1568877130","德國支持台灣有意義參與有實際需要的國際組織，台灣的缺席有損全球利益。
Germany supports Taiwan’s meaningful participation in international
organizations where there is a practical imperative and where Taiwan’s absence
is detrimental to global interests.","1571347911","/watch/?ref=external&v=1973866176047429&__xts__%5B0%5D=68.ARDFe9kPyRHSQgZIeArKeOqrY0PzVzl-hKoiId4VqQwDqC9nMDTfZcmZn6Zc53nYCJU26n90GcoE4YrokEDMVXX37Ths4SA1fKK1JL96uuhkDJYTOXgKKimQhdrGRDz3WiYNLlcJ7RnlasvXlY06ZqQJCGDq11u1X8EuC4iO-0hE0Ilr_PLhxmmk7TTRtOSTSBhplFwnIHuVyrojXYAQK1Q55o8BN8jZMBMAqhotHOuXbd-C2J6h9MBm2lp_qgaTssIBiIvRLrMMKa7W8lMX5dAWY8q0ysBqKn9PwVuOEEOpm_rzslef-UV7xJWKJWIBz1FtdVgDhQLnN_-edWzOvgyCAfpOypyJMdB-7mRthUil_jBpDc1ZSQxwu7cctaI9osCBAt82Xe6G9PR_lqYMQ9b24Wrm53TxHM3gL-uUGn5Ee_76SuxYHMd1kRoMWC7G77-JtQN0eFEoBQxpYqIrXQc_Rej2OMQ9NhrD_FYQB77ozP3l-QB9nbNVt0No0ZMZbKZ4xSqG4Z5OQMKb0tHAhzY&__tn__=kFFHHH-R","https://scontent-gru2-2.xx.fbcdn.net/v/t15.5256-10/70143242_1974321596001887_899203707529330688_n.jpg?_nc_cat=111&_nc_oc=AQkkeEt5lKc36ewMHmVwV5JgAyKHgjDTc8UXBrqU3AKkIixRCT0_Y2DbPlBqu7H1AdA&_nc_ht=scontent-gru2-2.xx&oh=ddc994e1f4c602079f5e62744aaa6641&oe=5E28E8B2","undefined","真誠的朋友","Posted by 外交部 Ministry of Foreign Affairs, ROC（Taiwan）"
"https://www.facebook.com/DeutschesInstTaipei/posts/1618285654968966","1563324420","世界遺產系列： 
17 - 科隆大教堂 
科隆大教堂（Kölner Dom，全名Hohe Domkirche St. Peter und Maria），
是位於德國科隆的一座天主教教堂，也是科隆市毫無爭議的指標性建築物。
它始建於1248年，工程時斷時續，至1880年才由德皇威廉一世宣告完工，當時是世界上最高的建築物。科隆大教堂的建造者們使主教座堂成為完美無缺的建築典範。西側立面的設計突破了一切慣例，是世界上最大的教堂立面，它的面積達到7000平方公尺，兩側各自聳立著一座高達156公尺的巨塔。藝術史專家認為它完美地結合了所有中世紀哥德式建築和裝飾元素，是
哥德式建築的代表作品之一，因此聯合國教科文組織於1996年將其列為世界文化遺產。","1571347911","/DeutschesInstTaipei/photos/pcb.1618285654968966/1618285324968999/?type=3&__tn__=HH-R&eid=ARDavJkYqkapMvx67oyCG_KobKVXbMMy4L8B2sAsZ2wuDTAvsGSq5vQLY_h7BPMusK7KVVPOrA9zxblc&__xts__%5B0%5D=68.ARD_fAC6fCHnVmibQ4cvOwkkWoxNePIzjnUSYbwoIMAlBztC01gOXkeFAaiqF8uHEufukBm4QpJfH2MGPtNnVNAaGj6g5_ot7C5kOK2p6ZNl65o0EG2fUJnWZjXfXFEbxspsoMpL-Lc_euLLirPUw2FqguANiAC0QtHjcqCTTVtlCkx5NLjaS5JyWlU7nZxu_pPhKQTIEeuBtaRoxUTcEOL23A4W_odINLOWOf0pwbaGcxz5o5Y-cg0XzlTUMWAiIgE13pTyZIyK1xtH7XyxQDz8QRToOcM6bbuqzhnxpA4XS5ATtTc_0e1Maxex7A5FxQg5wpy5CVTTotksDVvFqr-FPw","https://scontent.fiev23-1.fna.fbcdn.net/v/t1.0-0/p350x350/61886022_1618285331635665_8769663902297358336_n.jpg?_nc_cat=106&_nc_oc=AQk7szeSy2Na5eX5XMYRoDRGd5AI4xUWkD7YWxTqtSXVKsWNmHH2CdiuRP0tRdZpZzs&_nc_ht=scontent.fiev23-1.fna&oh=a24e4bdaa9777b6d1ea21e8e6c25d567&oe=5E18D567","undefined","",""
"https://www.facebook.com/DeutschesInstTaipei/posts/1631115597019305","1565327940","世界遺產系列
40 - 漢堡倉庫城與商辦大樓 
1883至1927年間歷經三階段修建而成的漢堡倉庫城，與商辦大樓一同在2015年7月成為德國第40處世界文化遺產。建築工程師法藍茲‧安德烈‧麥爾與建築師漢斯‧
齊默爾曼合力創建這雄偉的城市建築群，利用哥德復興式建築形式，在易北河的諸多島嶼上所完成的建築群。擁有紅磚外觀與狹窄水道的15座倉庫，與商辦大樓是漢
堡商人傳統的象徵。1888年漢堡加入德意志關稅同盟後，由於倉庫城是漢堡自由港口的一部分，是故在此進行儲存與加工的進口貨品皆免關稅。今日的倉庫城不只是倉庫，其中還藏著住家、商店、辦公室與餐廳。有名的景點如迷你鐵道模型博物館與漢堡地牢博物館皆座落於此，每年都吸引許多觀光客到訪。","1571347911","/DeutschesInstTaipei/photos/pcb.1631115597019305/1631115483685983/?type=3&__tn__=HH-R&eid=ARAMcoOLVXop1V6PWmY6O95qDTFtSsIXRuyik2fHR5-d_VA4owrUF3s1vMxGLA_bXCFyvcWkENlRptto&__xts__%5B0%5D=68.ARB_EXUx7Dgh6JUvUlIaf4YXQPYKTUV80iOWh6GEZWD_5gQv3_TxyH8FzWD_oKpymWXR04Uiokocc0E-htvKmYC_5cvSExii6o2PDWl0NirRiBdMMJJQpqzkONYteuVyFaofuXm46iF-UVY1sxiWOxXN0zkp9b1UsyXUdsHFj-G0lWQhVCvhLK5IB9ZPqKJ1Az5pXjSA8CD7-bJNghg90oSJxw-ulVtahW0_st2rVNwg4QnaBIB0V-qqkg7MZ559FYjBSeCaw_b4qUG6IBs_K0kkZZHq-oQS8Plvh-nLUrabWYv5fFoRuI8oTkUoJCq4YbzIF-wyhhxQfhK9wRwUdpBXfQ","https://scontent.fsdu19-1.fna.fbcdn.net/v/t1.0-0/p235x350/64446326_1631115487019316_1809285510657474560_n.jpg?_nc_cat=101&_nc_oc=AQmhQ2Q_NFdJjdcuKmAERcJsBV87Kx727m1YDHnHXc3N1N8nM7mixrkNyPmA35AfK4g&_nc_ht=scontent.fsdu19-1.fna&oh=a7144272255c213f8a007d7c9a73abed&oe=5E31327F","undefined","",""
"https://www.facebook.com/DeutschesInstTaipei/posts/1679889692141895","1565594728","2019 歐洲教育展徵求展務助理

 2019 歐洲教育展即將在10月26 -27日在台北世貿三館舉行, 今年來參展的德國學校比往年多,
歡迎具備德語能力、對國際會展活動有興趣的同學們加入我們的工作團隊! 😀💪💪💪!","1571347911","/eeft.fan/photos/pcb.3269881573029585/3269850216366054/?type=3&__tn__=HH-R&eid=ARCWEVzU-ReB4WY77_O-h6UHNPS7LeGcLvZWblE89mDSqqSX8nYdR3ycYPIUikLHWHRvf2JA9O0FK_pP&__xts__%5B0%5D=68.ARB0njFYVvhnhkou6kRRtYeH3FFiUPqO-9vSK5gOQ5oTuEP2B-BJpIWwpu_exOMNLBdnjyUt1kDJFPeILYPoBRoAAi5S8qBSvtQoQrGgmFt5wOIMpl2_Sa3mBYbt-iWh5pcLSUeLMEBpT4mpo_SP1GHSPTYm9yRoAaNVx2rPBHex0-6wBJhVpltD262H1izq0fVq0KF2bZBWFSnj2ToXZ1uVJ9pN1kLK-Wa2_3lRqKc5y0tmRBipVl86kVFF3qZsNFpe45WRmxxFCNfxfv_qXLUpCZ4lTztA79OF23BWITCxgVEnPyQ3e6BB4ew-_Y6emZkQwSfMEeP1WyjJiTcV77EwX-hqa0kNfnHnw6Ea1XC_x8mKJY-OB1GIg6LJIitBkJFyOFdXkOhXtkiN0qOluk6SGDCxWsW5d7gQF_v1wnPU5JJmeRFotuAkvPxq-AdtOy-2y22F1oscTxxyYqEy4pNqnzle6-8VC9Aya2EPEegr0w5hRFZ32qB6","https://scontent-lax3-1.xx.fbcdn.net/v/t1.0-0/p403x403/67366165_3269850219699387_852264104440627200_n.jpg?_nc_cat=104&_nc_oc=AQl3rKwUf91WGEKR05-x-EGAutd7Mta2CK9KQBjK8qk3W5R5Crwa3JEEpBoXAbiHGeM&_nc_ht=scontent-lax3-1.xx&oh=51663f5ce002e7fec01923fdae48513c&oe=5E5F33FD","undefined","2",""
"https://www.facebook.com/DeutschesInstTaipei/posts/1724957960968401","1570164423","昨日，10月3日德國在台協會於台北君悅飯店舉辦本年德國國慶日晚宴。今年國慶的主題為「民主 –
100/70/30」。隨著威瑪共和國100周年紀念、德國基本法頒佈70周年以及柏林圍牆倒塌30周年，今年的國慶晚會共同慶祝德國歷史上這三件重要的事件。有超過400位台灣、德國與國際嘉賓蒞臨晚宴。晚會由「蔡雯慧五種奏」帶來1920年代的搖擺及爵士音樂。外交部部長吳釗燮先生亦蒞臨致詞。","1571347911","/DeutschesInstTaipei/photos/pcb.1724957960968401/1724949884302542/?type=3&__tn__=HH-R&eid=ARDTGF_lXpny5a46eEJ4I_4MZMA9i-VT-zZFYKkSGRc7O6M_AVoAxRqNZS3Fjc7-u4jgoLEIwzGnLRpO&__xts__%5B0%5D=68.ARD-Y8PZ2f_4s4sJDutnfolpZc2KjzLG9Ngv8zOrCIrcv2sSLCMgWptZmGFkbiyq-MlZyE1xplRolvs0qrciVXKC4kmeH1BrUAe6w9bfi1BTQI5G_9CX3dwYlXfQdd6fKNYtYNxg23HAtLwFLPSsi2QJqBtEUdlC02vrR2F1ZreQ36YIvyeZUDVHOZshr19yfY5TZ5ofFg_QFcFVNstjU4MRrTVOK0kxDgJ93dGPtKuG22Oo0-Jr8Eb60DfPlyb_6-T2K_qWzfWJePyeTiatN7TnnuZKOJdFfIk_qbwCgRUrZqxWqhnXMe94qsa0VgrTdHoVIJUU-MEXSh-GewocdkHV7A","https://scontent-cdt1-1.xx.fbcdn.net/v/t1.0-0/p526x296/72142483_1724949890969208_3498229602503884800_n.jpg?_nc_cat=104&_nc_oc=AQnm-HO43apsXGKJSwONFxYRU5JytjlGtZvS5kOWcIs8PszojwZ7TUA9l6NW9YT1HrY&_nc_ht=scontent-cdt1-1.xx&oh=258698b6fdfcba5e5703c15f574076c0&oe=5E23FD6B","undefined","6",""
"https://www.facebook.com/DeutschesInstTaipei/posts/1687799958017535","1566696360","在2015年，德國大學有1004名計畫攻讀學位的台灣留學生，到了2018年激增到1797名，增幅高達79%，在全球排名第4，僅次於敘利亞、巴勒斯坦和突尼西亞。

 
研究者在普查後指出，學生選擇到德國唸書的主要考量是就業，超過8成的留學生期待畢業後能找到好工作；其次，教學品質、學校聲譽、生活品質和豐富的文化也是留學生選擇德國的主因。

 德國大學吸引外國學生的另一個原因是便宜，相較於美國和英國，德國大學一般來說不收學費，生活費又相對低廉。
https://money.udn.com/money/story/5599/4002440","1571347911","https://l.facebook.com/l.php?u=https%3A%2F%2Fmoney.udn.com%2Fmoney%2Fstory%2F5599%2F4002440&h=AT2b8WOb1wyV1Vscs8d9SWW2gL5d4FqTblxitqVCxD4lspYriGvc1fEM-bdOXVRtkSWVl5_t8ggLT3PYnuYRrP6bB69Ko_mjP-TtBgGDPhsd_JUgYCigBQcQE3JC7VCyvwA_zM7WyzKdvF3rb3VyZuRQt1IGy8d7K2y-2zc2RGEEeZgoFmZGMaicR_E0YDVOuJy__401QXVSuPXu5zumaP6a2B-hDax99Xa7X85mEy8m8TKqL7irCluBYVmN0ttiAr-Z5x0WLfq_brsvKrzBKm323GUHPiKLt5m_-D_xy73cHi5T8HkToPvrWQr9tLPEqoHsAGDcjY5ZVk3NAllQOD0Lqa_cZ2GrgOTuAeVbvVE5DTixA2K2km3pLwSbZvaTMwjcDgtx6mSgdkM6cKvPEV-AOsak6dXz08Ij1YsIQDMWPbzWu3q92lbycElfqPmUBDbd6I7W91b9cNBknY7BpS2sIlJwZ5mlvJ2BDgM3xWr6FsviAYQk-YCETeA5fO_vyClf4sBfYtNUcbzC50BL3X_AvFEK4-4K-Tv4RSqJuc8OOynQH-iPQ2vP9gqhn9F00AO4JnsTwlNjtz8l7pV_8I_3K2yOZBVW2boo7i33lHnbJjLzt7dhDdTpRED4Nq8y9yw1KVShrIaqbrnBHl5i8uLm-lF0pYif","https://external.fhel3-1.fna.fbcdn.net/safe_image.php?d=AQC5dR5eQaKmCzew&w=600&h=600&url=fbstaging%3A%2F%2Fgraph.facebook.com%2Fstaging_resources%2FMDE0NTE5NzQ0NDg5ODMzNTY6ODczMzk3OTQy&cfs=1&_nc_hash=AQC2SH2JBjrWDhhW","undefined","德國成非英語國家主要留學地 台生人數激增 | 國際焦點 | 國際 | 經濟日報",""
