url,posttime,text,crawled_time,attachment_link,attachment_img,attachment_img_alt,attachment_title,attachment_brief
"https://www.facebook.com/dpd88/posts/2292766397455959","1556625334","真有水準 超讚
https://youtu.be/feFV7tzigD4","1571646505","https://l.facebook.com/l.php?u=https%3A%2F%2Fyoutu.be%2FfeFV7tzigD4&h=AT0uzNwlLVzgKa-rrakyT96N8n-YprGQiMGH2vOl0-Mf1P5T5DZX0YhYJtOga0G7qRKajZqnZjWLvHYHvOLI0aA_6eqk0pbyOXCAu1HeVpFy1J6la1cbmSdxEpIHrsLjKH8hyGMse04mHwml-8my0DzoactFtziWMZg2MNijGYDbj_JejALN4xzB8c39RnNrKaq52yH0V_CARJG8Yi-9mIH7oBliUQih0kkxhV2Eb-t0l5j-nqU2dTrQeW2yHqkvAqW4IPEB6yMkIbNsihds9Jgn045tQ4PBuwuLRrQAgbkr5aSudWDxWGaRhXPUSgcVcb5z7tXJcRWw-ezB3NPoNhdVE9u7EGPlLpJFQ8HvzFH0zz3dtSkxlfIETJPpA6miU2mh3gbI9qSo7NqiP91B6z8EyXbxOFSFYgVQwYsAyulBnfA8H9juZFu-I7W8gLfcG8kDx6xtsmhtxaawwTaV7EuFy0vjXPkrOKrNCFGS79mTsczczbay0d8sSWMhKBemq8haetpWr7gvIJFed5-i_Z7tDhPO-dXeskoio5sEZ8vDPqM6bBiWtp3PTuURgT0gezPRUZ8EPo6TOgQs887VR_UcY31dTxhJQQFe3sfH5sLvPQLMwDtqjn_y2g27D6kbYVPtdzd2YGxOfz7N","https://external-lhr3-1.xx.fbcdn.net/safe_image.php?d=AQANSzIfaLsH8P5v&w=540&h=282&url=https%3A%2F%2Fi.ytimg.com%2Fvi%2FfeFV7tzigD4%2Fmaxresdefault.jpg&cfs=1&upscale=1&fallback=news_d_placeholder_publisher&_nc_hash=AQBpQKQ4n1DymBe6","Image may contain: one or more people","ZURCAROH - Final, Semifinal e Quartas de final - Americas Got Talent","O Grupo Zurcaroh comandado por um brasileiro brilhou no Americas Got Talent 2018. Após receber o gold buzzer (botão de ouro), o Zurcaroh continuou brilhando ..."
"https://www.facebook.com/dpd88/posts/2394597447272853","1561799488","自然界理的母鴨 都知道

 讓小鴨 自己做事情

 千萬別因為 牠小 而 讓牠失去 要自覺突破困境的勇氣

 https://www.youtube.com/watch?v=3SfwGiSovrQ","1571646505","https://l.facebook.com/l.php?u=https%3A%2F%2Fwww.youtube.com%2Fwatch%3Fv%3D3SfwGiSovrQ&h=AT16D2OyGtZmpTspAAMaomvsIHio4rCzMCVRTYxra5CwchK9dPJdoTB3LAfB8KhPFMUb-HtSesTCv3w5hucJ7eyi4eGhEBe0IYtdRkRdrNq1nRGLwj__0078J-WGpeEmU1arKZfpI8U1nq9J0gIvDyIrXosfKmFD_jzOZwQ6C1303Ck6T4U1Z5eugw6UIgR2BrYZx8LwL03pttMJfbWGYCdi2Ofy4dNu2mvgS65zynhN_1JcafX0w-l9fABE-vwAmeGVuccUvVTyZ3PBU-3sOhh4c85bfOcCUPBFM9933mst0xA2sgYBOwY82Fuw6ZhhcaylsS37vjphxeSUxhRxjnNULg4Rr4Tog0JrerS27K2mOmDU4ek6-w2WSKYP23WQMm90Wl2yMN0f0us6TdRC8IyySzMkjNqO0q3m6eZVxpSIy8XpDdAWctGyyq6keOniF5tMZWz0Mr5SWjhRm7B2eFSdfPEapLhmW90Cch-qBCPa5lmliJzuGJJP-PnDtdltTemRuDXmUvIzWzhIPGzY3h4IDN7Rn0q7AH8DSGGch3vNWv-IoQAQv1DLw59tNt_Lck0-TBjizKEuxaoRG7ZmouECg9BRDO11G5cvU0RWpD0JjRjw34FaEsH7FOD_fly_5mmR3oQ2_tv6KFGw","https://external.felp1-1.fna.fbcdn.net/safe_image.php?d=AQC3dKk_3OFghooT&w=540&h=282&url=https%3A%2F%2Fi.ytimg.com%2Fvi%2F3SfwGiSovrQ%2Fmaxresdefault.jpg&cfs=1&upscale=1&fallback=news_d_placeholder_publisher&_nc_hash=AQBh68GKRN-pGyt5","Image may contain: outdoor","カルガモ雛の滝登",""
"https://www.facebook.com/dpd88/posts/2261041143961818","1554855962","一張圖秒懂！火場關門的重要性

 http://news.ltn.com.tw/news/society/breakingnews/2753508…","1571646505","https://l.facebook.com/l.php?u=http%3A%2F%2Fnews.ltn.com.tw%2Fnews%2Fsociety%2Fbreakingnews%2F2753508%3Futm_source%3DLINE%26utm_medium%3DAPP%26utm_campaign%3DSHARE&h=AT1ujzTM6fnq4vG-G7r5m_avcAKapuHsj_VIrnKvbtu8t9L2L6icSa8c5SmarjPWzxfKgENAdUTN25zt43cF8cjwKGSwJs-0DYWDTmpS21a1THV4CSmKtB3PL0WSXRtELIMaE-_gf2C49j2WSGqkg7V5hsAc_X2QBm6-SX5x6DmZ-bMIYExrs8a0NiZ3scYZS60_dt_hhNWKY679hY9DGjTiBctcZpl02TUTN-OSx4cPv6EHpuW8O5Jmo532KedJ4OloWAnXg3wHWrsahVJ4gl72Hwqt8nB_2KrIXnQVlGs4v8fuX0_IAvkaM4tBO_QK8CD9JBpITPj02bcapubWUc--O8XHwM1S6pj-EU8qqUX7M7XXeP8TsucSzfVw0hN2iy9DXK2bPeR1UOBcARbE-rB2HotnFvW79aQMTgwMF_kHJwz7mW_gZG9lXBL5eod0aLI0pgnMUsceiypzBR_pJ_nsEbaN8qB0uLSlE5o5fpL07TiJ2NKNp2tJEbOJ3ee3v7MxmF3wD9EPfmYcpU93S0Q_-NWd8mRBIPp4OQtDPKJFkmyL8EGS8q1sL8uG9QYPpqJRAJRmgyE7rkmNwG93MnKrJ0XiO2p8HW7lEbibcAjCTr5_9IKyCqi-SoD3WMYd0tSg0KDeIUrqkfIZ","https://external-yyz1-1.xx.fbcdn.net/safe_image.php?d=AQDdErXibOooGZMU&w=540&h=282&url=https%3A%2F%2Fimg.ltn.com.tw%2FUpload%2FliveNews%2FBigPic%2F600_2753508_2.jpg&cfs=1&upscale=1&fallback=news_d_placeholder_publisher&_nc_hash=AQCgbnyXtUf3zZnY","彰化鹿港消防分隊以日前集合住宅火災為例，製成圖表，關門房間的天花板是白色的，門外濃煙燻得黑黑的。（記者劉曉欣翻攝）","一張圖秒懂！火場關門的重要性 - 社會 - 自由時報電子報","火場有沒有關門，命運大不同！彰化鹿港消防分隊以日前火場救災經驗，受困民眾成功獲救關鍵就是「關門」，先關門，再開窗與呼救；從火場災後照片就可以一眼看出，關門房間的天花板是白色的，沒有濃煙燻得黑黑的；門外..."
"https://www.facebook.com/dpd88/posts/2224314270967839","1552706847","","1571646505","https://www.facebook.com/photo.php?fbid=2528008057228751&set=pcb.2528008977228659&type=3&__tn__=HH-R&eid=ARBfMWbfOGh2gg4q5a3w5xCl4t9lTIHWz0_rGROyu5mmT-NtN_UThZgw0lqBDVPGQlrNOlOWkX7jlXA3&__xts__%5B0%5D=68.ARCFJ3hEatfmIW7GT6a8tQygYCJ8d6LV4ceye076g2aKfCuXahtHt3MnIClvuBmfmwuVLhwSXSZ-U-3p3GC7OffWPR2c00dBtWCVUBUv9smGsLy29uOmWJXjqYE7uALfPI0F_NSpjc0L2jnmVnbImJgNn7ABsItlcip7lhv8dPWAZ02Owt0S8g8HZzX6Sq1qM11UJfbf6g3BNJgtiumqvkqoCWQtIdVdMK-AoxZlvK36qbAVGRyNdNVsCiNhP_cGIlqDwPxQwKn8MATWU4ZjQOYloMQNHnRzlhVETrvVSR4ryS8gl4BX4Po99JTDNiKWqGSa4kv8zMOq-rhhUs8GDoTHQw","https://scontent.flim1-1.fna.fbcdn.net/v/t1.0-0/p261x260/53801510_2528008063895417_8009087733194555392_n.jpg?_nc_cat=106&_nc_oc=AQlwQOM5Is5Zc092Q1clFsObJr5a83B843wpGgUa9A8fKEvQ09DIp_ZGKZC2lZkBO5c&_nc_ht=scontent.flim1-1.fna&oh=a121d6b0e53e789052f3f194b2e9f878&oe=5E1D9067","undefined","3",""
"https://www.facebook.com/dpd88/posts/2503508316381765","1567122173","你知道一滴水怎樣才不會乾麼？
答案是：把它放到大海裡。

 其實，我們每個人都只是一滴水，僅靠自己的力量，總有一天會消失殆盡。
只有聚集起來，才能擁有更大的能量和作為。

 人生的道路上，只有互相幫助，才能讓我們的價值最大化。

 🌹美好的一天 互助合作 互利共生！💪🏻","1571646505","undefined","undefined","undefined","undefined","undefined"
"https://www.facebook.com/dpd88/posts/2268361016563164","1555284021","","1571646505","/watch/goodday1688/?__xts__%5B0%5D=68.ARD6hCAwxfnElmwQTTPRRZIQZ-A-jHx-9DWXKcxeDrYJlrhyCSCYoxnogCMMcqOS9pXTfkaYdKVlYcFQGYMpLi3DyhDsmNT--j_U0zB8fZkpOQ81uegFjSn-jr-qOJZWyajcTrkx1PHXLcFtAYyFa5GxjrI-Mcbr4QyufOYykAZU_RemeMhTDoaLFKEIsYBxHulSYlqjvy0aKGVG-F96Cq9S6_kO0ijNp9aCN1DfhRgD3kovUxhJdoOCfm7NNrwPH7DiP6zigTn7mBbSEVjxLUOF1_eL-XhKgVO6ntf_tBc9ALno0VV_SV_VI55Ikv6mkTQ2dX_LF4BeW5h2gshxsbICRNHlNYZpgfGQ6T1G9q73ar-eMQ7OxMYPUZfpc8uHmLIa1mlVsjcQeyWdl0d1GTJ_KqjIvk-odKocozYhM69goUYO1OYdicRatdytvzlZ1kwfuIXpIZLgxuDpl9HDzbTd1_Io4tYVw9GkTik3zPRdmki-1aiJ6EUDwhGC-SpxCvxpCA&__tn__=kFFHHH-R","https://scontent-mad1-1.xx.fbcdn.net/v/t15.13418-10/38979255_2214997888715554_7933114091055349760_n.jpg?_nc_cat=101&_nc_oc=AQld__duShxyHIXBSk4_iFGTCydWgZY1tvy4urCOW7GXipE-iXs8lyAI66R3_u4zQPQ&_nc_ht=scontent-mad1-1.xx&oh=b899c8f427eb6b802ef9d8b62b86e291&oe=5E22632D","undefined","正向看人生","1,860,497 Views"
"https://www.facebook.com/dpd88/posts/2254131717986094","1554462565","看完後將不會再購買的食品：https://youtu.be/h2xjDxx8SZs","1571646505","https://l.facebook.com/l.php?u=https%3A%2F%2Fyoutu.be%2Fh2xjDxx8SZs&h=AT2mn_QMY08dEQFfCLOHAqJ3K9cop1Xhl8QdcQWD_aYU-Qy9ZdhCJ9tpv_lPdGmrFiigUBKpmf7JKpBaCUReJA4hlbsKCqy_GLqFM6bkghvcwyaeKos8eFPdXC_JJCAk77G1eTULJWPHfL-xY7M6xJagEb-We77mTSe1G72xp8BGHe5U4CkLX8mBWI0JPyF72iFY9T4qPvbkVwdvL2NDlALL9qETHQdremIgYJPY1LRuUgH2RrO6ZsQHXSo2TiEYZbuBYmrwZZzDmIGP-qjfs99mm_77ZiXUdGGBLE0Ok0OKoMJ0AULJN4YR7cGtb_lxwKU6QDtk8lS1rdqPcUiTz0T9M88p0usi7C9Bk8FMBFxu05Y2qwT4_kK_PUFHJUaspTpcQcbohowVS3tC5sCOUHXxUgiLfeXid65Ayd97FfOvc41IUQI-VmUbflHIUlDtEwTsoiOye66DV3regUd7m5ZPx5nwkDARsFH5R_1xCso0yM3nS1MFSf-60cWGVau3i9VhG5Ec_kAj5D8wf4QAl5XrI4D2rAs1a-Vd9u4B5kL5-TT3TptFQ_hRT4lkt9xyWZoSK487M2c_W723D_2Mj-eaAh5EXj0xTOT6yHIYcWViSqcWhXB4SjdbFAxiW3zVKBQRfdQhRAawH6ut","https://external.faep9-1.fna.fbcdn.net/safe_image.php?d=AQAl4VqAJdf6OYKA&w=540&h=282&url=https%3A%2F%2Fi.ytimg.com%2Fvi%2Fh2xjDxx8SZs%2Fmaxresdefault.jpg&cfs=1&upscale=1&fallback=news_d_placeholder_publisher&_nc_hash=AQD8hh8dpeYPRqar","Image may contain: food","看完後將不會再購買的食品","★ 更多五件小事 →FACEBOOK : https://www.facebook.com/FiveKnow/ →INSTAGRAM : http://instagram.com/fiveknow →社交網址：https://FiveKnow.com 我們平常吃進去的食物，其實 背後隱藏著許多黑暗的祕密 商家為了..."
"https://www.facebook.com/dpd88/posts/2269911749741424","1555376208","沒有劉備，張飛就是個賣肉的，關羽是個編筐的。
所以，要有個朋友圈。

 孫悟空沒有唐僧就是隻猴子，唐僧沒了悟空也只是個和尚。

 所以，要有個團隊。

 馬鈴薯身價平凡，番茄也如此。但是自從薯條搭配番茄醬以後，你想到翻幾倍嗎？所以，合作很重要。

 王安石20歲時進京趕考，元宵節時路過一地，一大戶人家懸燈出題招親。聯曰：“走馬燈，燈走馬，燈熄馬停步。”王安石不會答， 卻記在心中。
到京後誰知主考官所出之聯竟是：“飛虎旗，旗飛虎，旗卷虎藏身。 ”王安石提筆就以招親聯作答，得中進士。
衣錦還鄉時發現那聯居然仍未有人會答，王安石便又以考題聯作答， 竟又得了個漂亮媳婦。
這個故事告訴我們：要多出來溜溜，不要老潛水。群聊也許能拓寬你的思路，增加你的人脈，艷遇也很有可能哦！

 專家經過研究認為，一個溫馨的群組，一個活躍的群組，理想的構成是這樣的：
1、要有一個傻不拉嘰的群主。
2、要有幾個比狗睡得晚，比公雞起得還早的失眠者。
3、要有時不時蹦出幾句冷幽默的疑似思想家。
4、最好還要有幾個文人騷客。
5、要有幾個有事沒事經常對掐的好友。
6、要有幾名不甘老去的世俗憤青。
7、要有掌握各種小道消息的“內部”人士。
8、要有一位甘願受虐經常挨罵被戲謔的好對象。
9、要有幾個風姿不減當年的萬人迷。
10、要有幾個存儲記憶能力超強的超級大腦。
11、要有幾個三天兩頭晒養生的專家。
12、要有一名正襟危坐經常維持群規的風紀股長。
13、要有一位經常身在海外，心係本群的時差先生或女士。
14、要有一個每天風雨無阻，準時放送早、晚安貼圖的老隊員。
15、要有幾個愛發各種搞笑段子、搞笑視頻的奇才。
16、要有幾個愛發情感雞湯的萬能人生大師。
17、還要有經常召集各種聚會的群眾飯聚領袖﹔
18、要有喜好照相，不時放送洗版相片的組員。
19、最後也要有眾多個一言不發，寧願潛水憋死也絕不退群的基礎群員。

 希望您也是其中之一。","1571646505","/dpd88/photos/a.657774774288471/2269911713074761/?type=3&eid=ARA3253AUV2vgevpEwzkL_pEC68XR9e9z4cXEDRcg9ufKZtLuaa5n9ygbD6L43ZMMI-z5hvb_sGkJAaJ&__xts__%5B0%5D=68.ARBvbcZwz8IKE70TEPkVwu3Whl1J0iOitqn8wWgg-kSFZXLlryRaYyYDnAyocpd-yElNTRrnngKB-ZetEtA-6uweZ4BBeyslMvax62FYdZ2VH9l6OIlfZPX0h-u8Jf42tKt2BhXvPx5MGqUCkk_aneREd-28_qaOLjrzyohr8QDcWm7ux6JiProkiYh4lZYROtSZT5W26N8P3bt6c_8s3jm9XrdCvtozsvBHzFogH9nvXYRX5sLsVFZooq1ZjTNxCFO5XbaOa2wFq1AU6ydtKAGXXHDVQflOSd30a75BpycqfY5fs4gEP2xbeiPD5C2mRvY1-kPwA8mNfCKmtLo6lhNA9Q&__tn__=EHH-R","https://scontent.fhel2-1.fna.fbcdn.net/v/t1.0-0/s526x296/57284349_2269911716408094_930793883481145344_n.jpg?_nc_cat=104&_nc_oc=AQmEQ9bRGu1FLFfKULMrMwQO_STc95Z3vZpbNLSDZwwClqm3ti6aoStpZD62zb2bcjY&_nc_ht=scontent.fhel2-1.fna&oh=919de9d8449f1d7d7a19d52cf8a5109f&oe=5E63B537","undefined","",""
"https://www.facebook.com/dpd88/posts/2285102881555644","1556205019","好文分享~《養心》

 文：星雲大師

 
一個人，不管如何做人、處事，養心是最重要的！平時我們心裡住了貪瞋愚痴、瞋恨嫉妒的盜賊魔鬼，擾亂我們的精神，致使身心不能平衡，因此並非一般補藥就可以為我們帶來健康。

 最好的補藥，諸如自信、利人、存好心、樂觀開朗，乃至石頭禪師的「心藥方」，都是最好的補藥。

 也如孟子說：「養心莫善於寡欲。」對於世間的功名富貴要能看輕，人我之間的是是非非要能恬淡；唯有清心寡欲，才不會被外物所迷惑，才能不被利欲所牽絆。","1571646507","/dpd88/photos/a.657774774288471/2285102838222315/?type=3&eid=ARD3X-Ecs81GpJ1dkqsIu2_nhKpY5uu6y8eGZvgHKW8dS4WMB3jnZ3ucMHQ2_mxswxoZ-KgzkZ5OEnnl&__xts__%5B0%5D=68.ARBYrjiY95B0-Szl65YCWry9q6_b-MvJj5AKnstCOSCt1n98t48xs5dDMe6rf4kiZZAbkzO4ISRVc6t7rCsX1tXU8nK4eKYuwQ79gw_xp4LpL5F2eEtbOZym6UwEn4KWIy97rfIf6os_fX079emKFA5X59iVtRhqAhBf6te8WpsEQ5jSTJ93L-9Kmzd4CiJYyZnWGviTToPWVrQlw_4ai0qXokBEXiAfLKp4K7W5n-t5HmBiyUOVSoMJaqSdhNt_Kax0kjLBJvnZIi2KZHqpX0whd9x_fGRCj84zZCFuGzCuI-syRkXkAkFVHBPMRcNQIdNwkSnGZugnZMWR110YliZgiw&__tn__=EEHH-R","https://scontent.fhhr1-2.fna.fbcdn.net/v/t1.0-0/p526x296/58380919_2285102844888981_7932683705267519488_o.jpg?_nc_cat=101&_nc_oc=AQlOrA97nmmMIDfxEm959WJIMXFGTFY7SgBscoPWXI6a8sXNng3mAauP3b4vRekd5_Y&_nc_ht=scontent.fhhr1-2.fna&oh=8117798fa9394443d392f2c608f492e2&oe=5E59BBE1","undefined","",""
"https://www.facebook.com/dpd88/posts/2401295046603093","1562127467","超感動的.......這部國外拍攝的廣告，極有教育意涵，教導孩子善良憐憫。

 『第一時間你會生氣嗎？』
https://youtu.be/2BCUd5mIBYQ","1571646507","https://l.facebook.com/l.php?u=https%3A%2F%2Fyoutu.be%2F2BCUd5mIBYQ&h=AT3bPdLkgITWcc7gQG8ms7dZfbLbMkHsoEF5ARYULzIn7Nj6TAYUAdr69UIkJMKdwi45F4Ecr_wMWXoyXYYkvk58abaSDD0uYS829lrh_gS2s1MP78h0IcnTotl64Jx69sNqzYXaxA4aY_Xqwikq-OY49Wmm2IjKpshRGuZFPkSnWX80DPWL4MDxdxiUg6FcZ9OslMwev0xZf_0-Ze9fSc_9bgHuKqiwaGPblKb86oSS6VA8FjviWDetgqMXvQoS2RhuBRiyhvu9-sXKWsDZ0ALkRheRNgoSiaQ7mOyJS-LQRi3AV_ELNGHVWO_uhk1dwjmWB4Xdkexdg92ItoUOqccwCM-SfRadkoPhAClxvCaX1mHd0exuyos6dVWEbr_2ENxGe-o8DCwC-e73Vo3ox-EUJzsHwATt3o9tKTFaujAKqnUrN-QKR-FNEz3dKeKfyVTFVXGsvXM8BoRzLrtUDAlI1XhnZHfJHt6vk9BAf8XBkk6Wazn6EBrTYM6wqpETWfRMkBb0NN6VOLXhTA1uDOqqf55CRLnToobs4getqISLbPlKFcobycR34tKDuDYN335XbhwMD68jK14vavKCIvfwD7f-gJ1WAzQid9WVJ497HoHTWjNNbVr3kZ94tb3aWhETl_eYz-0a6q-C","https://external-cdg2-1.xx.fbcdn.net/safe_image.php?d=AQAUrDEzKkz_Xfek&w=540&h=282&url=https%3A%2F%2Fi.ytimg.com%2Fvi%2F2BCUd5mIBYQ%2Fmaxresdefault.jpg&cfs=1&upscale=1&fallback=news_d_placeholder_publisher&_nc_hash=AQAUEXc-3KPrMLgp","Image may contain: one or more people, people sitting and outdoor","第一時間！你也會生氣嗎？","分享快樂希望愛創造正面影響力http://www.facebook.com/pkfans http://blog.xuite.net/erickhera.tw/nomore/"
"https://www.facebook.com/dpd88/posts/2236954336370499","1553470307","法庭上撼人的三鞠躬

 法庭裡座無虛席，開庭審判的是一樁綁架案。

 犯罪嫌疑人是一個30多歲的民工，綁架了一個六歲的男孩兒。讓人欣慰的是，孩子安然無恙。雖然沒有造成嚴重的後果，但他仍然要受到法律的制裁。

 民工綁架的是老闆的兒子。之前，他在老闆那裡幹了八個月，卻沒有拿到一分錢。

 他幾次求老闆先預支點兒錢，哪怕幾百元也行。他是家裡唯一的頂樑柱，他的母親患有嚴重的心臟病，一天也離不開藥。孩子上學也要用錢。

 還有他的妹妹，因為失戀患了精神病，他還要為妹妹治病，他不能看著妹妹天天披頭散髮滿街亂跑。

 他每次找老闆要錢，老闆都一臉的不耐煩。往往他還沒說上幾句話，就被老闆叫來的保安趕出了辦公室。

 
終於，他忍無可忍，綁架了老闆的兒子。後來，他後悔了，他完全可以跑掉，但他怕孩子一個人出什麼意外，也怕孩子害怕，便一直把孩子抱在懷裡。當員警出現的時候，孩子在他的懷裡睡得正香。

 他被判了五年。旁聽席上的人都為他惋惜，到底是不懂法，否則，也就不會付出這樣大的代價。他那個風雨飄搖的家該怎麼辦呢？

 
就在法官要宣佈退庭時，從旁聽席上傳來一個蒼老的聲音：「等等，我有話要說。」大家扭頭望去，是一個年過花甲的老婦人。有人認識她，她是男孩兒的奶奶，也就是老闆的媽媽。

 
孩子被綁架之後，老人一病不起，那是她最愛的孫子，也是孫輩中唯一的男孩兒。眾人的心裡都有些緊張，或許，老人還要提額外的條件，那個已經一無所有的民工還能承受得起嗎？

 老人慢慢地向被告席走過去。她站在民工面前，大家看到，她的嘴角在抖動。大廳裡鴉雀無聲，誰也不知道會發生什麼事。

 突然，老人彎下腰，向民工深深地鞠了三個躬。所有的人都愣住了，包括原告席上的老闆，他不明白母親想幹什麼。

 
老人抬起花白的頭，淚水流了一臉。良久，她緩緩地說：「孩子，這第一躬，是我代我的兒子向你賠罪。是我教子無方，讓他做出了對不起你的事。該受審判的不應該只是你，還有我的兒子，他才是罪魁禍首。這第二躬，是我向你的家人道歉。我的兒子不僅對不起你，也對不起你們一家人。作為母親，我有愧呀。這第三躬，我感謝你沒有傷害我的孫子，沒給他的心靈留下絲毫的陰影，你有一顆善良的心。孩子，你比我的兒子要強上一百倍。」

 老人的一番話，令在場的人都為之動容，這是一個深明大義的母親。而那個民工失聲痛哭，是感動，也是悔恨。

 事情的結果是，老人的兒子不僅向民工支付了工錢，還把那個民工的母親和妹妹接到城裡來治病。故事以喜劇結束。

 我想，是老人的寬容和大義救贖了兒子的靈魂。母親的三個躬不僅是鞠給民工的，也是鞠給兒子的。她是用這樣的方式規勸兒子，不能做昧良心的事。

 不管我們選擇了怎樣的人生道路，走得正是第一要義。不愧對良心，不違背道義。最起碼，不要做讓母親傷心的事，不要讓母親為我們低下她花白的頭。

 歡迎轉傳分享~祝每位每天幸福","1571646507","undefined","undefined","undefined","undefined","undefined"
"https://www.facebook.com/dpd88/posts/2346183525447579","1559433281","《人生是一個選擇》

 上等人，中等人，下等人
上等人談智慧
中等人談事情
下等人談是非

 上等人付出
中等人交換
下等人索取

 上等人有能力沒脾氣
中等人有脾氣有能力
下等人沒能力有脾氣

 上等人人讚美人
中等人人不理人
下等人人踩人

 上等人信念堅定
中等人相信自己
下等人恐懼懷疑

 上等人付出行動
中等人用腦算計
下等人用情緒處理","1571646507","/dpd88/photos/pcb.2346183525447579/2346183362114262/?type=3&__tn__=HH-R&eid=ARDyiPAD7_zicBXQf4AWWv9dg5rIArCYumZgknOORQZQPXQZzEreAD_X91Mi8ij0aovjszdWC-R6R_kp&__xts__%5B0%5D=68.ARAZWnbFPxbB-6xFzX89UDXRVezMQ_XP72krubsVtCYn9ArfziSwjjm4YlP0fsQm9IBwzgyYl5MLR3H5tPjewJldDsaDVTwxF0I-V0RsLFJarJXNunG6KB7L6ANzyuM7Q4G9mLERNe5bsZUrYoGsTLy-f2JKph-1qMorgcgRkJM_DExnHw03vOjgYLWXPkU3ihL0AWsP_5rrOlIUhZO1ylffZ260bb_vJrIe0Kqa4mnWzC08s-hXgDxg4Re-uUzUUVKoD2Cwn1ts1dj2_3Z3mLujE9ISeBIBhZ1dPF8auKdD7T7QjaKZ9eXphssaLubofQJJu6rJOowyRXUAO4xtaQtk7Q","https://scontent-lga3-1.xx.fbcdn.net/v/t1.0-0/p403x403/62058021_2346183365447595_7362026020716675072_n.jpg?_nc_cat=106&_nc_oc=AQneqAhgvDzbWIC1VQGNkkjHV4z5--13ewl1sLaSRlprgt1lBv1nSN82FHadzkO5j6w&_nc_ht=scontent-lga3-1.xx&oh=61d5653789bfd6d96b9b44fd37088062&oe=5E1A4D79","undefined","",""
"https://www.facebook.com/dpd88/posts/2250453388353927","1554248250","認真之外，
還要有老闆「心態」，
你才有機會成為下一個老闆！

 「大」人物 一生堅持的「小」事！秉持這些信念，才造就他們 現在非凡的地位…

 有些人沒有老闆的頭銜，

 卻是真正意義上的老闆，

 因為他具備了當老闆的，

 基本要求和素質。

 老闆心態，

 不是當老闆才有的心態，

 也不是老闆的專利！

 把老闆的錢，當成自己的錢；
把老闆的事，當成自己的事。
很多人和很多時候，

 總是把老闆的錢

 和老闆的事

 當成別人的錢

 和別人的事來對待，

 最終結果是：

 老闆把我們當成了外人。

 凡事講求節約，
凡事講求效率。
如果我們轉換思維和行動方式，

 把老闆的錢當成自己的錢，

 凡事講節約，

 把老闆的事當成自己的事，

 凡事講效率，

 最終結果將是：

 老闆會把我們當成自己人。

 假如我們確實堅持這樣做了，

 老闆仍無動於衷，

 最後再跳槽走人不遲。

 香港企業家，李嘉誠
因為一名門衛而動容
李嘉誠有一次

 在回辦公室的路途當中，

 發現一枚金屬硬幣從眼前閃過，

 滾到車子下面。

 李嘉誠下了車，

 要去揀那枚硬幣時，

 一個門衛提前

 把那枚港幣揀了起來，

 並交給了李嘉誠。

 李嘉誠拿過硬幣，

 從口袋裡拿出100元鈔票

 獎勵給這個門衛。

 別讓人們所創造的財富
隨意地流失掉！
李嘉誠說：這一塊港幣，

 如果不把它揀起來，

 它可能掉到水溝裡面，

 這個社會財富就會流失掉，

 所以我們不能讓人們

 已經創造出來的財富和價值，

 讓它流失掉。

 那個門衛不僅知道珍惜財富，

 還懂得幫助別人，應該獎勵。

 王永慶
最大的特點就是：節儉！
現年88歲，

 資產總額1.5 萬億新台幣，

 被譽為「經營之神」。

 王永慶最大的特點，

 就是節儉。

 不因富貴而揮霍，
勤儉、節約才是王道。
王永慶曾經告訴工人說：

 「你們所戴的工作手套，

 如果一個掌心磨穿了，

 不妨翻過來，

 換戴在另一隻手上再用，

 這便是節約能源。」

 王家所用的肥皂在剩一小片時，

 不會把它丟掉，

 而是把這塊小肥皂黏附在

 大塊的新肥皂上再使用。

 王永慶喝豆漿的故事

 更是廣為流傳：

 一般人喝豆漿：

 老闆，一碗豆漿，打個蛋。

 王永慶：老闆，一碗豆漿，

 然後先喝一口，

 再說「老闆，打個蛋」——他賺了一口！

 對未來有憧憬的女孩，
第１份工作，就幻滅！
有一位剛出社會的女孩，

 來到東京帝國酒店當服務員。

 這是她涉世之初的第一份工作。

 因此她很激動並告誡自己：

 一定要好好地做！

 因為她完全沒想到，
上司安排她洗廁所。
這份工作沒有人樂意做，

 更何況是一位對未來

 有美好憧憬的社會新鮮人。

 所以每次洗馬桶對她而言

 都是無比痛苦的事情。

 而上司的要求十分嚴格：
必須把馬桶 洗得亮麗如新！
她十分清楚自己不適應這一份工作，

 亮麗如新的要求實在難以達到，

 因為在她看來那是不可能的，

 於是她想換一份工作。

 後來，公司裡的一位前輩，
親自指導她。
這時，單位裡的一位前輩，

 及時出現幫她擺脫了困境，

 更重要的是幫她認清了

 人生之路的走法。

 那個人沒有任何空洞的說教，

 只是親自做給她看。

 並親自喝馬桶水
來檢查是否乾淨！
首先，他一遍又一遍地清洗著馬桶，

 直到擦得亮麗如新；

 然後，他從馬桶裡盛了一杯水，

 一飲而盡，毫不勉強。

 他不用隻言片語就告訴她

 一個極為簡單的道理，

 只有馬桶中的水可以

 達到「喝」的清潔程度，
才算是亮麗如新。
而這點已經被實踐證明

 是完全可以辦得到的！

 這就已經足夠了。

 因為她早已經激動得不能自己，

 從身體到靈魂都在顫抖。

 經過這次的震撼教育，
女孩成為一個全新、振奮的人！
於是，女孩痛下決心：

 就算一生洗廁所，

 也要做一名最出色的洗廁所工人！

 從此，她成為一個全新的、振奮的人，

 為了檢驗自己的自信心和工作質量，

 她也多次喝過馬桶裡的水。

 她的名字叫野田聖子，
成為了日本的郵政大臣！
幾十年光陰轉瞬即逝，

 那個女孩正像我們

 所希望的那樣，她成功了。

 她的名字叫野田聖子，

 是日本郵政大臣，

 一顆正在冉冉升起的政治新星。

 整頓心態，重新出發，
她後來成為日本的女性政治家。

 認真之外，還要有老闆「心態」，
你才有機會成為下一個老闆！
這種節約個人和社會財富的心態

 就是老闆心態。

 也就是有的人成為成功的老闆，

 而有的人則成不了老闆，

 或者成為了一個失敗的老闆。

 思想不同，決定不同；
決定不同，行動不同；
行動不同，結果不同。","1571646508","/dpd88/photos/a.657774774288471/2250453358353930/?type=3&eid=ARCJGPvOJqlZTFDmCdlZQ3NqoUEO5Hah2_Kmq5j45OM_CTWIAQ52_w41nL1nxKwxHqfl6erZu-SU3Yp3&__xts__%5B0%5D=68.ARAMUNWZJa8ZxdmB4TVH-ZvAvK0Ivws6R69XJ1j7kvk-JTU6OLwUszsSIiy9tpTKj7xTJANn6qJxj83bMPynF91YJmVWyTT9uWrgSHNIbbn7hAFqepX4SPfJTBD0FHJ1h4_Eh6zLqAEqox6a6L-KpFvcTzOQOMOToJjkRuOSLXtDVQj9YIzIu76XEgebIab6MNKx0nl5HFIyvmEM-Ptm6V3oD-OnU3L96BRO99M6XqRcNMICPgRNnzu4tL96ZllO3FJ2MjqH9AvMYMeWovANti7u5GiQwOjyNceOvP9SlceSfQbpgguh01oY7lCHZLahlKVv_1fNNSDB85ekqXWVf409nA&__tn__=EHH-R","https://scontent-amt2-1.xx.fbcdn.net/v/t1.0-0/p526x296/56270047_2250453365020596_5672569045350612992_n.jpg?_nc_cat=105&_nc_oc=AQl88wleRpP_xRdO7dUYrcaSPM-HJ--oDdcErgdEEdy-nAoKr1wZ_iDih0I4S1pxFO4&_nc_ht=scontent-amt2-1.xx&oh=791d33664185cab4dd271f3c1f0a9924&oe=5E17C962","undefined","",""
