url,posttime,text,crawled_time,attachment_link,attachment_img,attachment_img_alt,attachment_title,attachment_brief
"https://www.facebook.com/dpd88/posts/2253528621379737","1554424294","夫妻一次10分鐘就夠了， 千萬別貪心。

 https://youtu.be/CzwRd0jE24Q","1571646498","https://l.facebook.com/l.php?u=https%3A%2F%2Fyoutu.be%2FCzwRd0jE24Q&h=AT2T0IXq3Iicw8jdIP2Ui2efjlHziLdJnKasnG04ZMFDhHk01KguVKPZO10I2Y9vKCg_o4SurMDFeeXcPAsKfkRLEqF5USzHH8o8Hnqyr_zk_UGxub-2PiBjm5aHpEiGAehp8CIdpw3mXgwRPB-nknrxQ0K224RD1v3V5yDm6pQJu932HH5hI5BluVqJlv5JzewU4MmC0l4VHVb3woPTc0dOmSsPw8ClURoyuVMsnLR7ux1tqposM3UnPhAMV7bsFHaVSXI4ZtYR8H4bNspj8DTKKYRgAlgsLcHrVpRNMfupOE1ntmkOPtX8orw7xgNNmHrCsUA_AyqgqwxUgNgQhpa0OmQJlp8eXja-Vc6XE0tGgZiAmnhDTrF_R42ohaI9T6qlJCZMoah_69yoDRtMM-IYg7r4NylQ0Cqik42c97y2hWcuFgSZjWIl4XtpNUFeC5xqmVFlUb7Sl2kWHQ8dc8c_CihS4j6Uyg68sST_b42L64btXvWxh7vas02Pt05xo7x3x6AKwC-of4-8SKgkFN6x4m5ohrpLg3E7MWqRyjSx7Gv4_3QQJph_4Vjv-1lYQ8en8ddgGNGe6bV0eu2nohxww7XyyJcCndgT6_5MILDjgQb3ldeJcPF9cd5NFz4zSLBQY8GNNAdFbev1GEDWEiI","https://external.fblr2-1.fna.fbcdn.net/safe_image.php?d=AQDT4BG7ux12WK2Z&w=540&h=282&url=https%3A%2F%2Fi.ytimg.com%2Fvi%2FCzwRd0jE24Q%2Fhqdefault.jpg&cfs=1&upscale=1&fallback=news_d_placeholder_publisher&_nc_hash=AQBbo1XwgdXQpPSP","Image may contain: one or more people","夫妻一次十分钟就够了，千万别贪心！",""
"https://www.facebook.com/dpd88/posts/2357276127671652","1559985255","鹿港公會堂
慶端陽光雕秀！
https://youtu.be/m9QNQ3sf1jk","1571646498","https://l.facebook.com/l.php?u=https%3A%2F%2Fyoutu.be%2Fm9QNQ3sf1jk&h=AT11p1l7CPFHq9BxvyvsjWOgMyBpUczvbVN68S5dDoYehuDHEnRh4lvlMgShnDh-TwAUUdN9pZROqht_Myn8dtt71dk4jcbJReTtHdjnt8rErfX8AqXVHx7jsuE9wv9UhqgzXgtNs0jHPyCuza9cvPVCBWkSSE2liRmGpRVm7BqdoRhtqv7bZRVZD5mvDrminVxWJOzHIIMm9MRvmY6UDYexLno59l0HeOUGYYOYxDIM6zHuCQIJ1iq4a4xSxAK9lIQWE9QbYrlYkuy-eKU4Yux0evaLOSNeTn9Tr3zWuTVm-1fK5gFnt1LTcWCWqovLxyYkm51botj9gzDvcXPtLwE_2mSkXY-Z38GwcPGZy0NTqED6gy1WfQnI6H-wPBJZ9bIMW4y7eAILwQm0H18o5jdGLQsFu2wSV3A4Sxle45jYwUoW3TiQaLuILg97q2Llk_ZvONp9PdeodRqUhRN_-TQIfLn1yN3j2UjmK6S2RPBlMZbfA9BYsbPsHBVpOm2HuQRP65L_peuNZFqkXYK0fjgTXpHvPM4D3pfEIxa8YA4Tqv7tDIwN08vUgBgPQWqyG_2Jlwum6D7yUAIrWHdjQfs4NmJAl7w8kghL71UWqBHMtyN-4ZIr9XKKSEIO12Mf74KSVExtRVWiyow3","https://external.faep9-1.fna.fbcdn.net/safe_image.php?d=AQDtYtSI9zI_9u3R&w=540&h=282&url=https%3A%2F%2Fi.ytimg.com%2Fvi%2Fm9QNQ3sf1jk%2Fhqdefault.jpg&cfs=1&upscale=1&fallback=news_d_placeholder_publisher&_nc_hash=AQASfdnwL8-x16DX","No photo description available.","2019鹿港慶端陽公會堂光雕秀搶先看","20190606鹿港慶端陽，公會堂光雕首映試燈！"
"https://www.facebook.com/dpd88/posts/2298201656912433","1556923744","分享好文～
《既然抓不住，何不送一程 》
這一生，原來放下才是對自己最好的慈悲...

 日落黃昏，倦鳥歸巢，青山漸漸安靜了下來。

 這時，一輛車快速駛來並停靠在路旁，一個年輕人面容猙獰怒氣衝衝地衝到山邊，發洩似的狂喊著。

 年輕人的暴躁驚動了正在不遠處打坐的禪師，面目慈祥的老禪師緩緩走到年輕人面前，對他露出了善意的笑容，然後和年輕人攀談了起來。

 在談話的過程中，老禪師始終眯著眼睛微笑著在聽年輕人的傾訴。

 原來年輕人從鄉下到這個燈紅酒綠的大都市來闖蕩，經過多年的打拚吃了很多苦，才好不容易在企業裡爬到高階主管的位置，身邊也有了相識幾年的女朋友。

 可是，現在這一切都毀了，老闆因為種種原因要將他辭退，現在他正在為公司培訓替代他的新人，每天在公司裡的日子過的非常壓抑。

 而女友知道他很快將失去這份收入豐厚的工作之後，也提出了分手。女友的理由很簡單，她不能讓自己未來的孩子擁有一個沒能力給她們安穩富足生活的父親。

 
「我跟了老闆整整8年呀！他一句話就讓我走人！我女朋友當初剛來到這個城市的時候舉目無親，是我幫她找了工作，全力以赴地照顧著她，可現在她卻在我最艱難的時候選擇了離開！」

 年輕人幾乎是聲嘶力竭地說完了自己的經歷，憤怒的雙眼中燃燒著熊熊烈火。

 年邁的禪師輕輕地拍了拍年輕人的肩膀，然後拉起他的手在山上信步遊走起來。

 清涼的山風讓年輕人煩躁的內心漸漸平靜了下來，這時候，老禪師忽然停下了腳步，伸手去抓一片飄來的柳絮。柳絮輕盈而調皮，每次都從禪師的手掌之中溜掉。
年輕人默默地看著老禪師，眼中充滿了疑惑。

 
「呵呵，我老了，抓不住這些柳絮了。」老禪師說完之後，抬起頭和年輕人面對著面，說道：「這世上種種美好與精彩，我們並不一定都能抓到，既然抓不到，倒不如送它們一程，讓它們活得更加精彩飄逸，讓自己得到安寧與豁達。」

 說完，老禪師輕輕將抓柳絮的手向上微微一揚，柳絮被禪師的手這麼一送，在天空下飛的更加漂亮了。

 老禪師說完之後，年輕人呆立良久。忽然，他的臉上露出了淡然的微笑，向禪師深深鞠了一躬，轉身下山去了。

 此後，年輕人兢兢業業地將自己在工作中的經驗都教給了那個即將接替他的新人，老闆看在眼裡，沒想到受了委屈的他居然還會這麼為公司出力，心裡滿是愧疚。

 當他離開公司的時候，老闆動情地緊緊握住他的手對他說：「我對不起你，沒想到你還能這樣對我！要你離開，我也是有難言之隱，你這個朋友我記住了，以後有事就來找我。」

 他笑著和老闆告別，然後在辦公室同事們的留戀和注視中，大踏步地走出了公司的大門。

 和女朋友最後道別的時候，他送給她一份特別的禮物，那是女朋友一直想要的一條項鍊，女孩看到這份禮物之後，哭的差點抽搐過去，他安慰完她之後，瀟灑地轉身離開了。

 在隨後的日子裡，他始終奉行著一個原則。「能抓住的人和緣分，他都♡加倍珍惜♡；不能抓住的種種，他就笑著送他們一程。」

 這樣的心態讓他贏得了很多人的尊重，也得到了別人更多的回報和幫助，他的生活也漸漸走出了困境。

 後來，他經過多方尋訪找到了禪師所在的寺院，想當面感謝老禪師。可讓他萬萬沒想到的是，好不容易才找到了禪師的所在，老禪師的弟子卻告訴他，禪師已經圓寂。

 從時間上推算，恰好是他們見面的第二天。弟子還告訴他，老禪師當時身體狀況非常不好，每時每刻都在遭受著疾病的折磨，有時候疼的汗水直淌，卻始終面帶微笑的生活著。

 雖然，老禪師早就知道自己來日不多，但依然平靜樂觀的生活著。

 聽完這些之後，他努力讓自己的臉上綻放出微笑，用笑容將眼角的淚水擠走。

 這時候他才明白，相遇的時候，老禪師是忍受著多麼巨大的身體痛苦在為自己解脫煩惱。

 
老禪師那時候已經知道自己抓不住自己的生命了，卻還用盡了生命最後一份力量送了自己一程，讓自己的人生走上了正途。他向禪師圓寂的地方磕了幾個頭，然後微笑著向山下走去。

 人，永遠都要微笑堅強樂觀豁達的生活下去，這才是生命的意義。既然抓不住，何不送一程。

 2019、04、02

 《托斯里小夜曲
Toselli Serenade》
https://youtu.be/RUnj6LbRtZ0

 後記
#感恩國際獅子會300C3區助理總監翁張麗卿助理講師分享","1571646498","https://l.facebook.com/l.php?u=https%3A%2F%2Fyoutu.be%2FRUnj6LbRtZ0&h=AT3IS5fMzC2odzorD54tev2EtIomiUmJ0ZcOI86mcVcDbmQMZuMqieGMF-zvOtIcgeufng3SH9Pg3UBgeAwtwjPFmDqSBvxho-mWFvX6SHsqlcdV88AYU9GJdWgsTiRPxf3FVe0xyEuC6fVfqL4AGHoxahUMN65zB9OFB3P6n8zO-PmqGzYRDdNvt73_ABZ5R2LWOKXXjgKv6LnPuQ_JOZgWHMPqrWmjVFuEqPCvP5TqgZS10IP_MATn33wzHODQNYEuXDYySM7diq7BrARwvybFjKPJ3pvuQdYMdR_rtoNazUNP2dUwJQjXrLSoORkq7g822HRSA-GDKLRoAz9r8iLFMgoFz7t-GXWHIOEnmI1P0tygXzxPfjYaDreIpbraTtdJGXESvzIZX_LhRaaf1hZLBhpHZCnBYyMk8piERi1oSoOmLYqpC5V8TRN5AWOgHPUMRokwXo1tpECepCpgHE7zXWqVJnguQ9ytY1nA5fhRJGRG-4eX0jb_yJZV4w0TZngk_8K07mnltb7d4-5qRFaCmNP5FCuNTfA954H3NPtBkbSNcUpdQyHFijLgTwDxHumYGQS4mRWOTawufbg9LW6fbwltW04rmxLKJLFR2oDD6ed--FZpKkDt5WQ3_Ck_4XZq2f87gs3HbL5I","https://external.fkul14-1.fna.fbcdn.net/safe_image.php?d=AQDLA9yYXzdZAZgk&w=540&h=282&url=https%3A%2F%2Fi.ytimg.com%2Fvi%2FRUnj6LbRtZ0%2Fhqdefault.jpg&cfs=1&upscale=1&fallback=news_d_placeholder_publisher&_nc_hash=AQDfvTO1EXGc44Rf","Image may contain: one or more people","André Proulx - Toselli Serenade",""
"https://www.facebook.com/dpd88/posts/2343165619082703","1559283164","《為什麼人一定要充滿正能量?》
過物理學的人都知道，自然界是有磁場的。

 一個人，
信念變了，德行就變了；
德行變了，氣場就變了；
氣場變了，磁場就變了；
磁場變了，風水就變了；
風水變了，運氣就變了；
運氣變了，命運就變了。

 所以，改變命運真正靠的是自己的正能量，厚德載物。

 內心善良、柔和、寬厚，那是再昂貴的化妝品都裝扮不出來的。

 相由心生，境由心轉。學會調整心態，是人生中最大的價值。

 真正的危機，不是金融危機，而是道德與信仰的危機。與智者為伍，與良善者同行，心懷蒼生，大愛無疆。

 善心，善語，善行，美好的奇蹟便會發生！","1571646498","/dpd88/photos/a.657774774288471/2343165595749372/?type=3&eid=ARAydhAQEVxKZy2SUtzGAOmDNo9hWWpKHV6Z2aU0lQAvsU4a8vMiwNdLD2omiTy-k-N6nJe9KRp3Y14O&__xts__%5B0%5D=68.ARC55rBlWh_cw8NoK8SHwscboaCsbwQqp4mxh_0kKqKCeL-OlcKICtP2wmZHrP-hSmwIQY0QnWiDCKPmeYIzN3MxWq8J25mpSbg52K-HlyVBYzoMvRUjfwP1vPTguL98EIq1qkFj2OmPXlYt1foHvxkyoWF4HYIYNvO9LtrX9-1uVMiMd5pyohyP_9sWfBRfElZAJuQyCf14lYnV2bnz0eCGzM8isfK84TvQPvOfPyv1Km5ehXv-2JUUmPXW6y8m6nhuIvlkk3oH2wFTHOA7Saoc9mWnioY_1C0wW698QwB1wShq_S1Nzrt5Hv_DB-VQa4-qClAxIZtmer91H6P4YUrjEA&__tn__=EEHH-R","https://scontent.fgyn13-1.fna.fbcdn.net/v/t1.0-0/p526x296/61670353_2343165599082705_5888482085022203904_o.jpg?_nc_cat=105&_nc_oc=AQk2-g3MKGh6ggDINdih5IMSRr3QQeuwR-iSiQgxs-BpXK-g8KZEDNzJTFxLRetBqCQ&_nc_ht=scontent.fgyn13-1.fna&oh=087b9a44a7c611c69f5878465bdced9d&oe=5E2840F4","undefined","",""
"https://www.facebook.com/dpd88/posts/2496589000407030","1566778081","很棒的退休理念！

 *所附的影片值得看看

 有個小鎮上來了一個馬戲團。他們在當地招募臨時工，並提出以下幾種不同待遇：

 做三個小時工作送一張外場的票；
做六個小時就可以進到內場看表演；
做一整天，就可以得到最前排最中間最好位置的票。

 有一對窮人家的小兄弟願意幹一整天，換一張最前排的票。於是，他們開始了辛苦的工作。

 從太陽升起到落去，他們一刻不停地幹活，中間只分吃了一個饅頭。到下午的時候，兄弟倆都十分疲憊，但是看馬戲的信念支撐著他們，希望得到最前排最中間的位置。

 到了晚上，兄弟倆終於在艱辛的勞動後達成目標，拿到入場觀賞演出的票。

 他們筋疲力盡地坐在第一排最中間最好的位置，卻滿身塵土，還有滿手土豆子一樣大的水泡。

 主持人出場的時候，大家都熱烈地鼓掌，而這兩個可憐的孩子，卻在這掌聲裡，疲累沉沉地睡去……。

 故事蠻讓人心酸。可是，仔細想想，這不就是很多人的人生寫照嗎？

 這個世界很精彩，就像馬戲團的演出一樣。而我們每個人，都渴望能坐在最前排最中間的位置看這場演出。

 
我們其實也一直接受著這樣的鞭策；演出力求精彩，一定要努力努力再努力，爭取坐在第一排最好的位置看演出。然後我們就拼命幹，幹到身體疲憊、崩潰，終於得到那張美好的票了。

 可是，到了這一刻，你已經老了；
耳聾眼花、百病纏身。雖然努力拿到了入場券，又拼命取得了最好的位置，卻再沒有精力和心思去欣賞這場精彩的演出了！

 回頭看看，你是選擇付出適當的努力，然後高高興興地在內場看演出，還是選擇拼命也要坐在第一排最中間，沉沉睡去呢？

 要知道，人生的目的，不是只為坐在一個多麼好的位置而拼命，是只要盡了心力後，可怡然盡情地欣賞每一場精彩的演出。

 如果有一天你感覺累了，感覺不堪重負了，那麼就停下來好好衡量一下，給自己的人生一個更準確的定位吧！

 記住，來這個世界，我們是為了看一場精彩的演出，而不是為了坐在最好的位置上，沉沉睡去！

 遠見雜誌
https://www.youtube.com/watch?v=8TCU7jJhHX4
很棒的退休理念！","1571646498","https://l.facebook.com/l.php?u=https%3A%2F%2Fwww.youtube.com%2Fwatch%3Fv%3D8TCU7jJhHX4&h=AT08qiCtZm1o6r-MPA94q2FalxhWwcn3am2A05BHOi8kYnoHusCWD-qAc183TeHgxmDT-sxchA0-pTLFJ_VrbocuardVXsLNHNZq96lgtaQfGhz_ohsEUjKEeryPs1kIEwxcj_UdPPziKNA9vj2Zdi_98FnVVijWoY46ZfHx_734gMOpI_M7di4d_lJPoGJGnd5ZLeG0MwRmQzDFBTQRpqNDqzGJ1EL9dYoTamC6XBAk9B8pGBGCczAcf5iOfHj6kxAZnYULDnUSoQT_SCOOW0-BbVRmPyDZITSyfLH1VsYlj18kx2-1CtdKAkPfOuyB1d92ABp2Eb3sjSNcKL6tlIi3I2FGyhbFm6sH0AGahq_adwJHPyk2sFYJ8Eu-Vs8u5s5RoJ2soy24dAdXUFlmbOJI3gthla1Zi8_iVrFySDufMv9bT7Vgrnn-20oJWZRQt3RN6URZeLl7fHZxIWOCxGlaJ63MtJ7x6OpedbjFIsE3S7tfChgyf7AyxMnKye9QUnKj0cuAZAAuhdAlwZVNPOb3kJIHKYCyTXd4qNFxZqFxFp_-RI6B44OGdR1x_LFLF-VaCpdT4qYnoZpz0JrAanApjh7Xs7ykXRk578CcIdPp6tlWCt-oofTXyexzF3Dbi2al39EAA8HQNX6o","https://external.fsjo8-1.fna.fbcdn.net/safe_image.php?d=AQB4uCVeh3kQKrJe&w=540&h=282&url=https%3A%2F%2Fi.ytimg.com%2Fvi%2F8TCU7jJhHX4%2Fmaxresdefault.jpg&cfs=1&upscale=1&fallback=news_d_placeholder_publisher&_nc_hash=AQDBQo1D4NK2raGC","Image may contain: one or more people, people walking, people standing and outdoor","《遠見》2014年8月號 — 李偉文的退休進行式","一般人想到養老，多半會想到要存錢，才有安全感。然而，今年53歲的荒野保護協會創辦人、牙醫師李偉文卻認為，在人生的快樂存摺中，錢不需要太多，但「朋友」才是豐富老年生活的泉源。 因此，他從30幾歲起，就進入準備...."
"https://www.facebook.com/dpd88/posts/2403717513027513","1562257956","埔里宏仁國中校長的離校演講，太棒了！
https://www.youtube.com/watch?v=fjAG04toFIs
埔里宏仁國中阿桃校長一席話，我感動得落淚。","1571646498","https://l.facebook.com/l.php?u=https%3A%2F%2Fwww.youtube.com%2Fwatch%3Fv%3DfjAG04toFIs&h=AT3YH20p9VV63DBhnx3BELQ5YA2TIBbMNqClSkHVE6LGXA6BUQIfuG4S10LnyVlv_q9_oOMSo3AgllpRPZaqFbKTV8xGzlxJvIcI9DCL3o76MbsGvCgoEUREKq1tYc_YfNVkT2Fk3AVX0DtBQ0my_b7aKJdLyljHWBlYtHnjPd1dMp2dMJf0vr5ceXxotx8WsWflle78rTpc1U3PXaO8YDYGISGMqGT_mnTSvnv87ZzMTLsyRNZ7-ib16bRdjSG_Zrp7a1fVpMRCFMPKjH_yhje-UoQzy0eDQi_yugHgLgRGzCd9B7_Agst-DQ6elqZYiWCfFuwqAb61dqD3SahfN5my9_fn4QG2J3SL-G5ZO0hBYU14ExL9iN-qctC8DhqVg62RsrfX5aoVxFjtyz59-fssdn6c7mju7X_18wkQYGfSWMmYBQzq7hRoCmGuSjPXaq6rXahxCV3hfCIJo8ZDgG6tK6lSJSdbWomJxxSLVTCL8Yr-iSc5nrkiu0YDqUkRYdYnYi01AtaUAyvCiLImYzySDc2qTmVTCc4JmHQpn4qHtjpNkNrZFTAJJgu4ak5NwxPUzZkZf6IYoVNNpByyfrIOKy_xn62oAkjvVNMN3NJVv_f0PJiBhTnAUHC2bBA8154pggBeAdWM8VcV","https://external.fios1-1.fna.fbcdn.net/safe_image.php?w=540&h=282&url=https%3A%2F%2Fi.ytimg.com%2Fvi%2FfjAG04toFIs%2Fmaxresdefault.jpg&cfs=1&upscale=1&fallback=news_d_placeholder_publisher&_nc_hash=AQA5DFgU5gcnHDc-","Image may contain: one or more people and text","【人文講堂】20141106 - 讓學校成為引入愛的漩渦中心 - 李枝桃","李枝桃校長將南投縣埔里鎮一個升學率不高、學生常常打架鬧事的宏仁國中，用六年的時間，將「驅力」的種子種在孩子心中，也將學校打造成引入愛的漩渦中心。 《教育轉捩點系列》 用運動培養品格－潘瑞根(成淵高中田徑教..."
"https://www.facebook.com/dpd88/posts/2213718732027393","1552042888","毛澤東說世界上有兩件事最難：
一是把自己的思想裝進別人的腦袋裡
二是把別人的錢裝進自己的口袋裡。
前者成功了叫老師，後者成功了叫老闆，兩者都成功了叫老婆。

 溫馨提示：家和萬事興，跟老師鬥是不想學了；跟老闆鬥是不想混了；跟老婆鬥是不想活了。

 同時，請大家牢記女人不能隨便惹：
毛澤東招惹了江青，差點被奪權了；
薄熙來惹惱了谷開來，被整倒坐牢了；
秦始皇惹了孟姜女，剛修的長城被哭倒了；
曹操惹了小喬，赤壁木船被火燒光了；
李世民惹了武媚娘，江山被奪走了；
咸豐惹了慈禧，清朝滅亡了…

 所以要好好愛你身邊的女人哦。

 天乾物燥，小心她鬧。祝福所有女性朋友，三八婦女節快樂","1571646498","undefined","undefined","undefined","undefined","undefined"
"https://www.facebook.com/dpd88/posts/2228901683842431","1552991579","你很有錢，但你值錢嗎？

 功夫巨星李連杰在參加教練交流大會談論健康養生之道的一段精彩的養生暢談。

 你很有錢，但你值錢嗎？

 傅彪比你有錢，換了二次肝還是走了。

 梅艷芳比你有錢，請得起國內外的任何專家，子宮頸癌還是把她帶走了。

 陳曉旭比你有錢，從乳腺增生開始到乳腺癌，也沒能留下！

 王均瑤比你有錢，35億也沒有換到一寸健康的腸子，直腸癌把他帶走了！

 北京同仁堂股份有限公司的董事長張生瑜比你懂醫術，突發心臟病逝世！年僅39歲。

 上海中發電氣集團董事長南民，因患急性腦血栓搶救無效去世，年僅37歲。

 八句真實話:

 1、別將壓力看成動力，透支身體，累壞自己。——特傻！

 2、別忘身體乃是本錢，沒了健康，無法享用人生所有的樂趣。——特虧！

 3、別將名利看得太重，浮華過後最終都是過眼雲煙。——特真！

 4、別以為能救命的是醫生，其實是你自已，養生重於救命。——特對！

 5、別以為付出就有回報，凡事只有不計回報，方能踐行以德報怨。——特靈！

 6、別以為官比百姓強，都要退休，最終都是百姓。——特準！

 7、別忽視了和你有緣的人，等繁華過去，你才明白很多人會離你而去，知己難覓。——特悔！

 8、別以為問候會是打擾，常發微信給你的定是心裡有你的人。——特實！","1571646498","/dpd88/photos/pcb.2228901683842431/2228901630509103/?type=3&__tn__=HH-R&eid=ARAioL9l9Kmtj79veQzb9SUoxKoSVC74tB9K32UW9TygTUY3ABSwQLoXiOV_fubBNqXAfYBt8ckxgRY7&__xts__%5B0%5D=68.ARAoQbTCZ7muWF0NEuG3rFRlY0ZpB5eeSESlmvoFtwFeKHVFfCdv26R3GtwrBZKNwD4QVCiHNVfyupbStqSP0-MPGHZVHv9SspScS5NImExC8JtdAYUbJaHDvXKB9H3jXlKLwX5v-L7i1gRzWZiX_pUCWaQhL461Ld3hRbq-kSOvwD09jG63V4U27HoPtSzGJVR9lD4iaMRB53W-4FsrCVZ-ow0vW95hdm3KDe2qLuzFYTYzjxRzlGB_2ACYlQoe0Nd0MTjH0UB_s0EVDhykFlSbNFdAr4A_yFrjg_XfKTenJAI-ROX89QXtdm7dw7u5_saDdzonNwlRWHs12qq2-xQAbg","https://scontent.fktw1-1.fna.fbcdn.net/v/t1.0-0/p403x403/54516236_2228901637175769_1519570338541731840_n.jpg?_nc_cat=110&_nc_oc=AQnEd8RuANxCJ9gl1D6maBN_CVrNMdo4D_4ri5rViKC-jE3pXVp7wKLDz_En-6uID2I&_nc_ht=scontent.fktw1-1.fna&oh=c6e44efdaf8cfc3f9529fdda30da78c2&oe=5E580A39","undefined","",""
"https://www.facebook.com/dpd88/posts/2448640141868583","1564475208","這一罵 罵的好！
#轉傳網路好文章

 震驚衛生部部長，
醫學院院長，醫院院長！
所有人必須要覺醒！
《現在醫生幾乎都是 “飯桶”！》
老中醫朱醫師
應邀到北京某醫科大學講課。..
出席者，有衛生部長、
各大醫學院的院長、
教授
及各大醫院的高級醫生
好幾百人。
朱大師一上臺說:
謝謝您們請我來分享，
也謝謝您們出席聽我的課。
在座的都是醫學界的精英，
不是教授，就是博士。
但我看，
你們都是 “飯桶”！
臺下一片 “噓哄”
笑聲後
問大師: 爲什麼這麼說呢？
大師接又說:
你們西醫不過是讀了點書，
博士也不過是
多讀了那麼七八年的書，
考了個試，就拿了個博士，
也沒有啥本事的。
所以，
我看你們都是
靠證書吃飯的 “飯桶”！
臺下又 “哄” 的噓笑。
朱大師接着說: 
其實你們根本不會看病，
你們治病的本事，
頂多也是三分之一。
其它的
就是科學家、工程師的事。
如果，
今天醫院
沒有科學家發明的儀器、
檢測設備，
你們什麼都不行。
此刻臺下鴉雀無聲。
朱大師又繼續講:
醫生治病救人，
主要目的是治好病，
那是最終的目的，
而不是開口幾十萬，
閉口幾十萬。
更可怕的是
你們連看病都不會看，
更不要說治病！
一個病人進來，
他問你:
醫生，我得了什麼病？
自己是醫生都不知，
反問病人: 你哪裏不舒服？
病人說完，
醫生就開始
開各種化驗單 、檢查單。.....
“哄。..” 底下又噓聲一笑。
大師接着說: 
現在的病人去醫院看病，
你們這些專家
就拿起張紙，
寫上X光、CT、驗血、驗尿
心電圖，腦電圖、核磁…等等。
患者在醫院轉了大半天，
一大堆的檢驗單，
全部是儀器和操控員在忙，
忙完一輪，
結果
患者拿了一堆檢查廢紙
和片子回來了。
醫生拿起報告來看，
哦，你的肺如何如何了，
你的心臟怎麼怎麼地，
你的哪裏
又有甚麼甚麼問題啦… 等等，
然後按書上教的，
哦，你要吃甚麼，甚麼藥，
嗯，你一定要吃，
而且堅持吃… 等等。
或對
病人說:你要多注意…，
常到醫院來檢查哦“
患者就回去
天天吃藥，
3個月後就開始做手術，
做完手術又開始放化療。
..十幾萬、幾十萬的錢
進了醫院，
病人呢，
進了太平間。..
我說完了，
你們說，
你們是不是 “飯桶”？
此刻，
臺下鴉雀無聲。

 大師站起來，
舉起三隻手指: 
我們中醫看病，
唯一的目的就是治病救人，
而不是讓病人越來越嚴重。
是要讓病人有病進來，
花最少的錢治好病出去！

 我們中華醫學，
診斷、開方，
只是靠自己這三根手指。

 你們就沒有這個本事！
離開了
科學家發明的各種檢測儀器，
你們什麼本事都沒有，
你們都是 “飯桶”！
朱大師說: 不信，
現在就叫十個醫生上來，
不管是教授還是博士…
和我比試比試，
你們十個人一起來，
找十個病人來，到這臺上。
也給我也找十個病人來，
在這裏我能把十個人
用三隻手指診斷出病症，
而且
我一個人把他們十個人都治好。
你們行嗎?
如果不同意我的看法，
敢和我比試的，
就請舉手上來。
結果，沒有一個人敢舉手。
你們就知道嚇唬病人，
和病人打心理戰術，
給病人制造危機，
讓病人多使用醫院的醫療設備、
多開藥、多拿提成多賺錢，
醫德醫風何在？？？
臺下鴉雀無聲……

 太現實了！
講的太好了！","1571646498","undefined","undefined","undefined","undefined","undefined"
"https://www.facebook.com/dpd88/posts/2221428407923092","1552529637","《一個人的成就，是您一生中善待過多少人～》

 股神巴菲特在美國大學演講。學生問：你認為什麼樣的人生才算是真正的成功？

 巴菲特没有談到財富，而是說：其實，你們到了我這樣個年紀的時候就會發現，衡量自己成功的標準，就是有多少人在真正關心你、愛你。

 他還說出了人生的一個秘密：金錢不會讓我們幸福，幸福的關鍵是我們是否活在愛的關係裡。

 所以，一個人的成就，不是完全以物質來衡量，而是一生中，你善待過多少人，幫助多少人實現夢想，有多少人懷念你。

 生意人的帳簿，記錄收入與支出，兩數相减是盈利。

 人生的帳簿，記錄愛與被愛，兩數相加是成就。

 祝每位每天幸福","1571646498","/dpd88/photos/a.657774774288471/2221428384589761/?type=3&eid=ARCqjbNFTNf9-6PkzEu_92zqM3CTChtrJkEJomn3-fYWehJleYdV7eADEpJEpkqSll4LV6TquQF0FNy3&__xts__%5B0%5D=68.ARBat_aTfTVfyPbWwmrjvMtXGs-rRi3nZpN-3YOktp9xQFlTeM-m49z6UYPUT2pOdSb-ufLQ67C2ode7d5Z4ItJ_lWcNdocFXcqdMRtFg-_6vHKlgSRsR4wAePLkdBaXI2cUXop8udwjbdjIgYyrg4zLaUTPWWE2jNszRskSxGuvx595TAB2o5ihKyanMLAYGP8VcAzlyHlmdEbXbLI9ufDvDBIjn9dV_LrH85rhTWxAX0nDoDOZkBv2T7I6c8jLkrH2s_KZ3pLlL7QxgNIyaVwYKyS9TMvhlk8lh8THB7RncBLyEq-moUVJaedYpvPcikLVdti6PGPIpCDNVGdP5795Og&__tn__=EEHH-R","https://scontent.flim5-4.fna.fbcdn.net/v/t1.0-0/p526x296/54433794_2221428387923094_4101315763313311744_o.jpg?_nc_cat=102&_nc_oc=AQmOiRzLTaoeNQsvpFBaHLTRjSPEWTUG2BKLV1jOXImSA_1lgy783tvaVQGDCYr6iCM&_nc_ht=scontent.flim5-4.fna&oh=f17ff0de76927bb8180ba4c8684d6e71&oe=5E2868DE","undefined","",""
