url,posttime,text,crawled_time,attachment_link,attachment_img,attachment_img_alt,attachment_title,attachment_brief
"https://www.facebook.com/dpd88/posts/2406142909451640","1562376939","《原諒生活的不完美》

 （轉分享）

 有個叫廖智的女人，你可能聽說過。

 2008年，她23歲，是個舞蹈老師，
有一個11個月大的可愛女兒。

 然而，汶川地震中，
她和女兒被埋了26小時。

 她眼睜睜看著女兒在身邊不行了，
小小的身體變涼變硬。

 而她勉強撐到獲救，
也不幸截肢，失去了雙腿。

 雪上加霜的是，
那年除夕，老公跟她離了婚。

 她說：
“你們可以看著我這麼想：這人多慘，雙腿沒了，女兒沒了，老公也不要她了……”

 她消沉過一陣子。
整天吃，胖了14斤。

 但是慢慢的，她緩了過來。

 她裝了義肢，
練習走路，練習跳舞，參加演出。

 2013年雅安地震後，
廖智趕去災區幫忙，
戴著義肢送糧食、送衣服、搭帳篷。

 碰巧有人拍下了這張
酷似張柏芝的照片，
她隨即在網上紅了，
被稱為“最美志願者”。

 廖智從來不用“殘疾人”來定義自己。

 她化妝，跳舞，幹活，
穿高跟鞋，該乾嘛幹嘛。

 她也總是很樂觀，
自信熱情，充滿能量。

 如果她不說，
沒有人能看出她經歷了那麼多倒霉事。

 而生活就是這樣，
你對它笑，它就對你笑。

 2013年，
廖智認識了一個一米八六的台灣男孩，國外名校碩士。

 男孩愛上了這個生命力旺盛
的漂亮姑娘，視她如珍寶。

 倆人很快結婚，
現在已經有了兩個孩子。
一家四口，幸福滿滿。

 廖智說：
是的，這個人生不完美，
但我足夠感恩。

 我很喜歡這句話，
也很欣賞這種人生態度。

 有的人，可能跟老媽吵一架就跳樓了。

 而有的人，
腿沒了，女兒沒了，老公跑了，
卻還能活得幸福漂亮，精彩紛呈。

 也許人幸福與否，
真的都在於自己的選擇。

 一個人沒了腿，每天在家痛哭，
後悔，怨恨，是一輩子。

 而接受這一切不完美，重振旗鼓，
再打馬揚鞭殺進陽光裡，也是一輩子。

 後一種很難，但這是最美的路。","1571646493","undefined","undefined","undefined","undefined","undefined"
"https://www.facebook.com/dpd88/posts/2548745638524699","1569250064","https://youtu.be/_dUZzcoCcuk","1571646493","https://l.facebook.com/l.php?u=https%3A%2F%2Fyoutu.be%2F_dUZzcoCcuk&h=AT2zjDHtn9Suoyos9PXfhJAomW_ugYjM3tD0NJ12utleMdkuXl28GQ-U7VSUWL7zRizIFHPYX7Tkli-4Y9fZ7xRb1zI9WKqkOXoNcsg1BcDXmOLFomZtWkGxLxZpqbikTeJsCgrcjUOpAd08S6sq05U3W0monHew_qztyqVQDNiVaEyCu2tFya3Qh3t4oEeSA_eQYpt44sRqQsKxlMd24HN51s_n9fv0nmwlzmLePlnObua9k7ViNZMJaMN49LSw9HAaa2DOFU2kmKk1bhk1ppVplbtlkoZFGYfVuIvKfNpWwU30YvHs_lcoX0V7zx1d51si37Yv1xShm0rUXaYf7jPF-w8TC9o7u7nr1gy4jgJxGy0FriVjiUSFOsYU_d1-VMXlI1PrRY6HdZdfXURnE8iFtZOqRLMEUMXSrTRfuysWFI--zuMTwUtabl-kGZ9MVM2V99oJpUGhQfS9MTCOJhmOE4FsQlQdlnrN9rK61ohq8GhmBa59NYh5LJD_VHuTBWHVtwo2Xjhd9o_D79thHoip9ZrEDS-jH0rCl4lGbO5ny9d1F2nZ4g7NiW_QCoCnvaukomBQ7hVN2dfEkJNgBnASlGo3MrReYxaQXH9Gos2wpvD-UoRhJI505mK-tCk1ad5RACwTvrx4h3Y9","https://external.flim1-1.fna.fbcdn.net/safe_image.php?d=AQDiCV-9gx9HWlU7&w=540&h=282&url=https%3A%2F%2Fi.ytimg.com%2Fvi%2F_dUZzcoCcuk%2Fhqdefault.jpg&cfs=1&upscale=1&fallback=news_d_placeholder_publisher&_nc_hash=AQBcmubaWYc_s7jy","縮圖","《馬雲與台灣青年對話完整版》創業要左手溫暖右手 HD中文字幕","阿里巴巴集團創辦人馬雲昨來台灣演講，帶來百億元創業基金當「見面禮」；他說，阿里巴巴內部有很多優秀台灣員工，這筆錢可說表達一個心意。分享創業經驗，馬雲表示，最重要是保有樂觀態度，「做企業有如上戰場，活著..."
"https://www.facebook.com/dpd88/posts/2247726981959901","1554096732","各位朋友，
兩個選擇，你會怎麼做！？ 

 請作出你的選擇，這不是機智問答～ 

 請您耐心讀完這篇文章～ 

 
要問的問題是： 
你會作出同樣的選擇嗎？ 

 
在一個學習遲緩兒童學校的募款餐會上， 

 在場的所有人永遠忘不了其中一個學生的父親所說的話。 

 在推崇學校和教職員的付出和貢獻後， 

 這個家長問了一個問題： 

 照理說，神所創造的一切應該都是完美的。 

 但我的兒子，西恩， 

 他無法像別的孩子一樣的學習， 

 他無法像別的孩子一樣的理解事物。 

 所有聽眾都啞口無言。 

 

 這個父親繼續說，

 但我相信當像西恩這樣有身體及心智有殘缺的孩子來到這個世界，是一個讓人類展現真實本性的機會。 

 而這一次體現在別人如何對待這個孩子。 

 
接著，他說了下面這個故事： 

 

 西恩和我走過一個公園， 

 裡面有些西恩所認識的男孩們正在玩棒球。 

 西恩問我：”你想他們會讓我一起玩嗎？” 

 
我知道大部份的孩子不會想要有西恩這樣的孩子在自己的隊上， 

 但身為一個父親我同時也知道若他們能讓我兒子參加， 

 會讓他得到他所迫切需要的歸屬感並建立起自己雖然是殘障仍能被接受的信心。 

 我走近一個男童（不抱太大希望的）問他西恩是否可以參加？ 

 
他看看周圍的隊友然後說”我們現在輸了 6分，而目前正在第 8局上，我想他可以參加我們的隊， 

 我們會在第9局設法讓他上場打擊。” 

 

 西恩帶著滿臉的喜悅困難的走向他的球隊的休息區，穿上該隊的球衣， 

 我悄悄的滴下眼淚而心中有滿滿的溫暖。 

 而那些男孩也看出了我對於兒子被接納的喜悅。 

 

 在8局下，西恩的隊有追了上來， 

 但仍然還輸3分。 

 第9局上半場， 

 西恩戴上手套防守右外野， 

 雖然沒有球往他的位置飛來， 

 但能在場上他已經很高興了， 

 我從看臺上向他揮手， 

 他笑的合不攏嘴。 

 
在9局下，西恩的球隊又得分了。 

 而此時，二出局滿壘的狀況， 

 下一棒是球隊逆轉機會， 

 而西恩正是被排在這一棒。 

 在這個重要關頭， 

 他們會讓西恩上場打擊而放棄贏球的機會嗎？ 

 

 讓人驚奇的是他們真的把球棒交給了西恩， 

 大家都知道西恩根本不可能打到球， 

 因為他甚至不知道怎麼握球棒，更別談碰到球了。 

 
然而當西恩踏上打擊位置， 

 投手已經明白對手為了西恩生命中重要的這一刻放下贏球的機會， 

 所以他往前走了幾步投了一個緩慢的球給西恩， 

 讓他至少能碰一下。 

 

 第一球投出來， 

 西恩笨拙的揮棒落空。 

 投手又再往前走了幾步投出一個軟軟的球給西恩。 

 當球飛過來西恩揮棒打出一個慢速的滾地球， 

 直直的滾向投手。 

 球賽眼看就要結束。 

 投手撿起這軟軟的滾地球， 

 他可以輕易的把球傳給一壘手讓西恩出局而結束這場球賽。 

 然而投手把球高高的傳往一壘手的頭頂上方通過， 

 讓他在一壘手的隊友接不到。 

 
每個站在看臺上的人，不管是那一隊的家長都開始喊著：”西恩，跑到一壘！跑到一壘！跑到一壘！ 

 ”西恩這輩子從來沒有跑這麼遠過， 

 但他還是努力跑到了一壘。 

 

 他踩上壘包眼睛張的很大而且很驚喜。 

 每個人都喊著說：”西恩，跑向二壘，跑向二壘！ 

 ”剛喘過氣，西恩蹣跚的跑向二壘， 

 很辛苦的往壘包跑。 

 

 這時，就在西恩往二壘跑時， 

 右外野手拿到了球，這個全隊最矮的小子第一次有了成為隊上英雄的機會了。 

 他大可把球傳向二壘， 

 但這個全隊最矮的小子了解投手的心意，所以他也把球故意高高傳過三壘手的頭頂過去。 

 
當前面的跑者往本壘跑時， 

 西恩跌跌撞撞的往三壘跑。 

 大家都大喊著，” 西恩，跑下去，跑下去!” 

 西恩能到達三壘還是因為對方的遊擊手跑來幫忙，將他帶往三壘的! 而且喊著， 

 ”跑到三壘，西恩，跑到三壘。” 

 當西恩抵達三壘， 

 雙方的選手和所有的觀眾都站起來， 

 高喊著，”西恩，全壘打！全壘打！” 

 西恩跑回本壘踩上壘包時， 

 大家為西恩大聲喝采就如他打了一個大滿貫並為全隊贏的比賽的英雄般。 

 
“那一天”，那個父親兩頰淚流滿面輕柔的說， 

 ”兩隊的男孩子把真愛和人性的光輝帶進了這個世界。” 

 

 西恩沒能活到另一個夏天， 

 他在那年的冬天過世了， 

 但他從沒忘記他曾經是個英雄而且讓我們高興， 

 以及他回家時看著媽媽流著淚擁著她的小英雄的那一天！ 

 
現在，是關於這個故事的一點附註： 

 

 我們不假思索的用line把數以千計的笑話傳來傳去， 

 但當我們遇到要傳送有關生命的選擇的信件時， 

 我們反而感到猶豫了。 

 
粗俗、野蠻的東西每天在網路上無限制的傳播著， 

 反而高尚事情的討論卻在學校裡及辦公室裡被壓抑著。 

 

 如果你在思考著把這封line轉寄出去， 

 可能你會在你的連絡人上挑選出那些不適合收到這封信的人，然而把這封line寄給你的人，相信我們可以讓世界變的不一樣。 

 很多人與人之間不足道的互動都是一個選擇的機會。 

 到底我們是把愛和人性的光輝傳遞下去， 

 或者放棄這些機會，使得這世界一點點的更加冷漠。 

 曾經有一個智者說過；要評價一個社會，就要看這個社會如何去對待他們之中最不幸的人。 

 
所以現在你有兩個選擇； 

 1. 刪除 2. 轉寄","1571646494","undefined","undefined","undefined","undefined","undefined"
"https://www.facebook.com/dpd88/posts/2255572281175371","1554541119","#薰衣草婚禮樂團
為您服務~#婚禮主持小鄭

 恭喜 勝煥♡伊吟
幸福小倆口幸福喜宴 大成功
幸福指數超High喔！","1571646494","/dpd88/photos/pcb.2255572281175371/2255571201175479/?type=3&__tn__=HH-R&eid=ARAJDxJwBUgaU3aqqpWETlkh9x083U3DLyyfpLI3zuXmUrhZxUc_cuBOszqAEQR6XoaCTZciOU4-6K2R&__xts__%5B0%5D=68.ARCL_w2_Q_RkVjjnc8pu4JY33f4ivSev6LsZOA1EnOc03CS77yq4vElXSmqQILJaQsSnsDJG9HyfshpLaBFMeal1X39Wtz1qCq2kH21x7bBjuVF3kCF0gKwqayQ9-qmqR8ueiPXIK6Xy6YeHdHZhM1Y6sfjMruYMCp8a-V5bywJo2lcufl58p-pvHYGEYii0DLRMNWekpQCwIq6qesoHqjw_Af31pwGKSykZsQjoAPxbwmYZC_jNL1GbnWeh60gfJsn_O3lg9OILzbtUNCVQmULIBe9UYypFYxs6sjLa8xCRKFY8OjzJPSD2hFXvrGDYSe1yoMv3I-J-qFoZbxUFVlEYNw","https://scontent-lht6-1.xx.fbcdn.net/v/t1.0-0/p403x403/56945074_2255571207842145_6020557822637375488_n.jpg?_nc_cat=102&_nc_oc=AQnzNaIBQxvEfl36U2tsALgg5rBCwAkKq8piNKf-jVJrrSjKYTXIwJhfBqGC0kmRZcI&_nc_ht=scontent-lht6-1.xx&oh=13286a24d04bc16c48e5424ff6b1ddf7&oe=5E5E8E9E","undefined","5",""
"https://www.facebook.com/dpd88/posts/2306142502785015","1557365118","https://m.parenting.com.tw/…/5077783-%E7%8E%8B%E6%99%BA%E5…/","1571646494","https://l.facebook.com/l.php?u=https%3A%2F%2Fm.parenting.com.tw%2Farticle%2F5077783-%25E7%258E%258B%25E6%2599%25BA%25E5%25BC%2598%25EF%25BC%259A%25E7%25B6%25B2%25E8%25B7%25AF%25E6%2588%2590%25E7%2599%25AE%25E4%25B8%258D%25E6%2598%25AF%25E7%25BD%25AA%25EF%25BC%258C%25E6%2598%25AF%25E5%25AD%25A9%25E5%25AD%2590%25E6%25B1%2582%25E5%258A%25A9%25E7%259A%2584%25E8%25AD%25A6%25E8%25A8%258A%2F&h=AT2msEQHwQ8PnyFn8ZbXaEvoXB9mXLjnyp25pykXb5Kh0d1BtqWRLEbBUY63LsbGuN9VoQM0dgHNpC6Ba8zVsSrrFVEh8R4LjDZTTtI43f_tNMUoFW3ocMlKSCBg3UeWUUdkrgq1cMBQGwizGeSJpHSHHggMWk4UZ1OInFCx4fiTI3k2DbdxzliIHWlOO4kEB0QQq9EGbZZ1wZJOb3zq2yOqru0_OX7XWLZ9jxT-0cwXjAasSLlpp6oOwnIaC_QwOUm0SkakfZHn_AdsPIyIs_BrDmyhrN4ykoB0rFWgBnaV-NcuXe_Kg12nsEhJoILybUsfewBzdsalx7rMlx4tift_NmSD3qlOCecBuKLMlSGbn9jcsbTlF_53RX5A3bMu244eZqOPzmIfIbmmghfvNKH8IsdRe4T2TI2tQ9mjAB4b68ZhBqsIU3iqiPSuTtJFw2UTupvTX-M1xwhdP5rS0HJ08ugNHB4zOsKXKgjctBDhgnLv5GHOzE_vWA4U2wv7lDodJHr-cQsiNsRw5B7buP8W92eyEK27_43dx9UBGZCfx-LmXFO-r1e6rByU77xAbPNJZoFo-ZrGDUaIHszrz-sHstG2twOBpfgIRMJn7Qb9v0GrvJpP7fpJEdhCuzPs94D3lciGJsz8lqtr","https://external-arn2-1.xx.fbcdn.net/safe_image.php?d=AQBO_v0w-8RF0Dyi&w=540&h=282&url=https%3A%2F%2Fcp.cw1.tw%2Ffiles%2Fmd5%2Fbb%2F7f%2Fbb7fd5313de9c51fb5c0db288ca7c7de-169167.jpg&cfs=1&upscale=1&fallback=news_d_placeholder_publisher&_nc_hash=AQAu4AnbbNg-kvKr","王智弘：網路成癮不是罪，是孩子求助的警訊","王智弘：網路成癮不是罪，是孩子求助的警訊/親子天下網站","擔心孩子上網時間太長，恐怕「成癮」嗎？長期研究網路成癮的彰化師範大學輔導與諮商系教授王智弘指出，使用時間長並不代表成癮。網路成癮症狀有積極的警訊意義，背後代表的危險因子更值得重視。"
"https://www.facebook.com/dpd88/posts/2489427101123220","1566434424","立秋了，
不知哪位高手寫的
真是一絕

 秋
似酒
味醇厚
歲月悠悠
轉身又回首
再無喜樂哀愁
往事如煙花依舊
唯友誼綿長如水流
緣牽一路有你陪著走
晨曦襯彩霞雨中漫遊
待到紅葉濃時再聚首
品茶論酒賞石敘舊
落英滿地雲舒袖
歡聲笑語不休
夕陽掛枝頭
紅塵看透
別無求
靜候
秋
注意：
工作忙的由上而下讀，
已退休的由下向上念，
感受不同啊！","1571646494","undefined","undefined","undefined","undefined","undefined"
"https://www.facebook.com/dpd88/posts/2538235146242415","1568765982","貪心惹禍，
十分仍不滿足，
乃人生大病！

 捨利招財，
一味就學吃虧，
乃處事良方！","1571646494","undefined","undefined","undefined","undefined","undefined"
"https://www.facebook.com/dpd88/posts/2216816075050992","1552217627","台灣加油 台灣優秀人才
在國際發光發熱 為台灣發聲
https://youtu.be/NGUBUG1C2ZY","1571646494","https://l.facebook.com/l.php?u=https%3A%2F%2Fyoutu.be%2FNGUBUG1C2ZY&h=AT1pHTOh9B63FGmZHe7HyKWiGyd3MTOuTjQ0NihbZIwCvhaJEkgQSASHhQxH3K8MTIeEVe_jHBor11n0R_XXujgwAzJGWwungNz-Qb63gvrckzB7TZWlyKWHW5siXNz9R_rJ6yfdN01T5f3bVBDUBEi14yJYMtN4cDuquoargqgVuafBqbws4G28f76zhDeYLuk2x5FVFk0z5Q1lv-kfLrkl-6GXNFOLDXiby-v-Nf-SXYsvDZ9FQ5sQNv0FFkAshupFGo45QnJ7Fkl-6OMAUnr49ZLsy07_GYP6WnTek5WD_977LXPBWSKWT9dzpkr6IujIvZET87rE97_UgQP_ZfEHBXvvEggHqVijZOMYgSIeyWvAiH-WENHk7uUYujqK265ZxaBIEPfH9RQ1fEzaIupJmIWpVFGTsvA-mpLPO8NYBLva6Krg089SK2tdsDn5GxV-Zef-nTqSX3zG1IzrCDrAODebvCOiC3lcMjxpF-IJ5s4J7BDMlZZJcdpMtD-TvfoHl47R2lRSoGp1tlIjJPtULze-3A1o32f-c5rQJUnRI67KdFCLwphqxWXs5coFQTpDep03mzlxSSCAGHEfbX9z7sosk6oAPxLglzsovVNPzemEsbznYQZb-DkWZauoLVvC2gDryu8IS0qV","https://external-sin6-2.xx.fbcdn.net/safe_image.php?d=AQAcr_mjoWAtTzYO&w=540&h=282&url=https%3A%2F%2Fi.ytimg.com%2Fvi%2FNGUBUG1C2ZY%2Fmaxresdefault.jpg&cfs=1&upscale=1&fallback=news_d_placeholder_publisher&_nc_hash=AQDii7gxK-iXmnP1","Gambar mungkin berisi: satu orang atau lebih, orang duduk, keramaian, pernikahan dan dalam ruangan","Taiwan - Medical Underdog Facing Political Oppression from WHO","世衛臺灣，臺灣衛世 Health for All, Taiwan can Help Remember to turn on captions 右下角可設定開啟中文字幕 SheffWHO為英國雪菲爾大學於2018年4月27到29日舉辦的模擬世界衛生大會，影片為臺灣成員國代表在閉幕式發表的演說，呼籲各界認清臺...."
"https://www.facebook.com/dpd88/posts/2393444857388112","1561736898","","1571646494","https://www.facebook.com/photo.php?fbid=2710003495695872&set=a.297131500316429&type=3&eid=ARBHkyzsYUSyF8Qp_2csOT_6MH9YTm6X93jv44_5HeqU1EBZCdg9gfDDfJO0_P3TT-xUDNwmJSZ6uqHF&__xts__%5B0%5D=68.ARBqJd2JEumJXYwcH4-vQM8DFzerh5l44DFweGdLBNEdiqLEgqXkSTluJUQcMibJ0UmBtupxwJipxMDv8EL1OjlFhsN63VKdYB_ZcXf9XHYE33nSwZeolitPtM893QesscU04CZJGK5TQ7P82rywGU4lpYdfxuhU-QjRkz6xlA_fJdwxupyhsU1ewKwd-f7z9veLA7sEMkReT-EIS0S-6V8woseJxJnqw97u3gSC8BjrQJwG3gYKt4C8H2vIi2HmOiMGpr_3kkuLJfVVHUc2UoVHOzZBa8rVna4KFqkTlAsILt-nQbbqExOPsZQygTqdEIuVufgipxJ78j6msz3lgH6Ut59g5i08P9Vc00xz0s1BueiXNh2JWxMYBxXp99HSXWcWUxfmaVzpZ7BcJNEVYrh7eLsjb7azi2Fu0sQGtcLrh1E&__tn__=EEHH-R","https://scontent.fbom5-1.fna.fbcdn.net/v/t1.0-0/p526x296/65627501_2710003502362538_6919094332767076352_o.jpg?_nc_cat=111&_nc_oc=AQmStDGWEVadx_J2KnTuT2W7_4xdd36YAA90n8x6JHtw7HujUy6VTnJqVG92YtlmJFk&_nc_ht=scontent.fbom5-1.fna&oh=9ed7e1dd9c678f18d95da83d008595e7&oe=5E63A1DA","undefined","鄭敬議","許綾綾"
"https://www.facebook.com/dpd88/posts/2329750973757501","1558594781","你接近什麼樣的人
就會走什麼樣的路

 窮人會教你儉衣擇食
小人只會教你坑蒙拐騙

 古語說得好
近朱者赤 近墨者黑

 鳥隨鸞鳳飛騰遠
人伴賢良品自高

 你是誰不重要
重要的是
你和誰在一起","1571646494","/dpd88/photos/a.657774774288471/2329750937090838/?type=3&eid=ARD4ZP8VGLzdxjHxR_A6pngM8ayM1AvX3xtRfAA7ilKx7y4AyNAHx28ipt2IlvP12g0hiXnI_iwjQrvu&__xts__%5B0%5D=68.ARA6H_kYQFQNupRpEc5uK07lqpq-sAiupfHyLAdBq5ohcnKDRRugP9h89fS02DmsUJCuIf_TEo6l5Da_cvRDaBbwOWdj7y_ZN9r3LInmRWI2TD7hyGZ-EgTSOnnINJHzTYc_URARlSLhjICs9uE4nkLnJcciLon5yMq3d6rH-XhX-s1rR3GVxZwCKs7A3DnqGTjPmKQrHHRvognhuIibdYncBFHVmuqte2Z1INwOUtLahA3QnGgh0SboaDH_ab8r7xeeR-Mg-ENrfnFCETYC7J_XD4rZPuWHwGsoZAhh1Sckvu7max8Xqu7zTY-idrrd1gC7tDqZhfjigjA7cRonKIFoAA&__tn__=EHH-R","https://scontent.fbkk5-7.fna.fbcdn.net/v/t1.0-0/s526x296/60747615_2329750943757504_3567365583693414400_n.jpg?_nc_cat=108&_nc_oc=AQmctHD5OJNitQaryOwBccFq6lr8xoQEph7FVlliYPXy3D71nxmxg-ANkJpkZT4YL2U&_nc_ht=scontent.fbkk5-7.fna&oh=07cc97f74a8f5d7a9a4743acbf66d91f&oe=5E18768E","undefined","",""
"https://www.facebook.com/dpd88/posts/2584267004972562","1570765762","虛偽的人交不到真心朋友，自大的人得不到人心。
做個真實的自己，以一顆誠心真心對待緣分；做個行為端正的人，以一顆自重心來愛護自己。
懂得尊重，贏來尊敬；懂得自重，贏來尊嚴。虛偽的人交不到真心朋友，自大的人得不到人心。
做個真實的自己，以一顆誠心真心對待緣分；做個行為端正的人，以一顆自重心來愛護自己。
懂得尊重，贏來尊敬；懂得自重，贏來尊嚴。","1571646494","undefined","undefined","undefined","undefined","undefined"
"https://www.facebook.com/dpd88/posts/2514189725313624","1567644667","【2019「樂活彩繪」保戶子女寫生比賽報名開始囉！】

 為提倡創意樂活的新生活運動，三商美邦人壽以「樂活彩繪」為主題，將於10/19（六）在全台六地舉辦保戶子女寫生比賽，即日起至
9/12（四）開始線上報名囉(moon
grin)！凡是保戶本人（要保人、被保險人）或其子女、孫子女皆可報名參加，除了畫作獎勵外，當日參加闖關活動或響應公益活動的朋友，還可獲得精美好禮唷！詳情請參閱活動網站
 ➡ http://bit.ly/335yXJe","1571646494","https://l.facebook.com/l.php?u=https%3A%2F%2Fbit.ly%2F335yXJe&h=AT1MoP3oye7rQZqlJ-phOslAtQy7oMMv2ofKAr2IDl1SMssi2YlqGUWrFxKge3WJFmmI8M9SDYDt4ePGVEXJDoyB_zeJBRkCHwertwdxJWzFmauCFF-FW7xzwXpVV0zXKZMbMx9nsVutiKQW2SNpvRcHdVkTsba3sqbWAJoiU6at-YfrUkoZ_tJ4RjqF3mu_WQpdcyrG19LpbH9Qn0zAXrrdhVXRZ5hIvFFDDkkcN-6Wa2B0NFOy3gCZn1lUGb3jtmAYLi0nZ_9ywyh5QsDK7Yil2rEJOGBkEAt1KqaUyhBU9k_sN0cr9ymtVZG5OJHpmzBMtfMFGJ_xXJKUosjUZ0-yP0QEW0q0_VTc4R6IptNhPGXpIykblCWMcOOU9dijMtNePP4kdn528ajSWWkqevQcSaOeWOJwoffIFs5Jg5Srj8E-KhahccwKsJ3whXkWC_YU_9SokSAAlJK304-X6Ix4s-p7ntOAEGFlYlJxN-xfR-12yo_czAkevyGdkKXR_918O6KGOnexzckcluTPN0jwzgljRENvvKq2JN3ueIcVW-IOfojKrClajvsZJSxoYtGMV_s-jEfESGv52EQFS32fBXKhgy1ohjR5UaIz7yolm49Ohz5EzoMsjeOkh5289aJ5onqj6z5Tvdfs","https://external-sin6-1.xx.fbcdn.net/safe_image.php?d=AQAvZXmhkBGAt09N&w=160&h=160&url=https%3A%2F%2Fwww.mli.com.tw%2Faiad%2Faction%2Fdraw-2019%2Fassets%2Fimg%2Fdraw%2Fcheer-reg.png&cfs=1&upscale=1&fallback=news_d_placeholder_publisher_square&_nc_hash=AQDgaacqq_hwzxDx","Keterangan foto tidak tersedia.","三商美邦人壽2019「樂活彩繪」保戶子女寫生比賽",""
"https://www.facebook.com/dpd88/posts/2381699841895947","1561168723","做好十件事，福報自然來

 第一件：知足常樂
平安是幸，知足是福，清心是祿，寡慾是壽。人之心胸，多欲則窄，寡慾則寬。寧可清貧自樂，不可濁富多憂。受思深處宜先退，得意濃時便可休。勢不可使盡，福不可享盡，便宜不可占盡，聰明不可用盡。滴水穿石，不是力量大，而是功夫深。快樂就是看淡塵世的物慾、煩惱，知足常樂。精神富足才是真正的富有。

 第二件：捐印經書善書
經書善書是諸佛菩薩濟世渡人、救苦消災的苦海慈航。推動經書善書的傳播流行，是宣揚諸佛菩薩的慈悲心腸，其功德是無量無邊的。因此，捐印經書善書是廣種福田的最佳方法之一。
經書善書宣揚因果報應，能抑制人類的作噁心理和行動，能使惡人循規蹈矩，使社會減少罪惡。又能鼓勵人們增加友善的信念，互相讓步和忍耐，增進社會祥和的氣氛。
所以，有心行善積德之士，是不會輕易疏忽這個最佳機會的。
捐印的數量又要視各人的經濟環境，但是，一切善行的深淺絕不是用金錢來衡量的，而是以「出心」的深淺作為準繩。「出心」即是「發心」，發什麼心？慈悲心，菩薩心是也。
愛心、信心、感恩的心，其實不必追求形式，做而不言，滲透在點點滴滴的小事中，融化在時時刻刻的念想里，不為來世，不為結果，只為一顆求善的心，這才有福了，呵呵……

 第三件：不要斤斤計較
人生不必斤斤計較，讓自己怒火攻心。語雲「生年不過百，常懷千歲憂。百事從心起，一笑解千愁」。如果想到我們都是來去匆匆的過客，只不過是到世間走一遭，還有什麼雞毛蒜皮的小事值得計較呢？

 第四件：常懷感恩之心謙虛之心
看相中遇到過一些青年人，家庭富足，自身學業有成，工作優越，便自視勝人一籌，而生出驕慢之心，以為自己可以憑自己的能力享受榮華富貴，而這些往往成為日後的障礙。一旦失敗，方才醒悟自身的渺小。也有一些英才，自身能力過人，卻時常存感恩心態和謙虛心態，待人平等愛，願意回饋社會，這樣，反而更能家庭和睦，事業發達。其實，上天賜人智慧，財富，不是讓人去自顧享樂，驕奢淫溢，乃是借這些人之手，去幫助哪些窮困之人。越能與人分享福氣，福氣會越綿長悠久，生生不息。
古人云，惟謙方能受福。常懷謙虛，感恩之心，命運也會隨之改善。

 第五件：善待自己
多一分快樂，少一分憂傷；多一分真實，少一分虛偽；多一分悠閒，少一分忙亂。這四多四少很重要，有了它們就活得心情舒暢。老年人完全可以自主地安排好生活，善待自己，這樣便會內心富饒。

 第六件：少氣多閒，身忙心閒
少氣多閒，身忙心閒。真正做到這八個字不容易，關鍵是個「閒」字。老年人安度晚年一定要有閒心，當然干點家務事也好，如果什麼事都不做也無聊，但是不要身忙心亂，要身忙心閒。

 第七件：不要跟自己過不去
改變一下自己的態度去適應不同的情況，心情輕鬆舒暢，不要心鬱氣結，跟自己過不去。人到老年，什麼事都看透了，無論如何自己不要跟自己過不去，一定要善待自己莫煩惱。

 第八件：懂得自得其樂
人生一場，別人追屋逐堡，我只要風花雪月，花棚石凳，小坐微醺，歌一曲，茗一杯，自得其樂。住宅舒適方便就行了，何必非要樓上樓下。一首歌，一杯茶，養養花，種種菜，享受自然之美不是很好嗎？

 第九件：面帶微笑
在生活中常常面帶微笑，把好意和善意傳遞給身邊的人，就會與周圍的人結下善緣。「未修佛道，先結人緣」。熟悉的人，陌生人都能感受到你的善意，如此，你生活中自然少了許多矛盾衝突，變得更加順暢通達，這就已經開始改善命運了。

 第十件：保持簡單心境
心境簡單了，就有心思經營生活； 生活簡單了，就有時間享受人生。我們要學會經營自己的生活，不是天天混日子，也不是天天熬日子，而是天天享受日子，這就需要經營日子。

 塵世中有太多的喜怒，太多的悲歡，太多的煩惱和痛苦。惟其如此，要活得簡單才快樂。","1571646495","/dpd88/photos/a.657774774288471/2381699768562621/?type=3&eid=ARBx2SG25BDVBQvb8KSmULienoCE5OyjEJNUkuu6tRaWsQgDWZLdBywEprlsV4WMKB3KFAAUN7C21Vuw&__xts__%5B0%5D=68.ARDVz7r2GnAj3h3bdPy5yYxH-mE8aW7Iu8HeWpRfU2Kga-bVRG7w6nSCt2qHjczPkIvFLnWk7roK3A4dLVAa3o0qwVKbATmfvHBz4SrvILm2_wSIAdZYCS448h1U549rnmQuxTSTFRC78BGFoE3b9ZJlPqvv34f-__J3JJvuMy2dZRYop5wej9gXzqQF9enChIY785E-UXvXnnYmqHxrjlK9t1l6sQQKnfWkrksfrM_h0t8uzMlJuBDW8uchVGl8o4hEXhNzPgRIvkv2vvrYQJVTvtNYo0iz-QbeMQ48p5-WJbBzudQR7p5m7DSJoz0X2zpxO7K-NYSnI_mvmbQS_qP26g&__tn__=EEHH-R","https://scontent.fhhr1-2.fna.fbcdn.net/v/t1.0-0/p526x296/65369424_2381699775229287_6958827225546227712_o.jpg?_nc_cat=104&_nc_oc=AQn-K2xnobhzlmT1s_38mOvZhe9RMrik4alPzg7JUFospL9LAemyqQwI0BPipNKPtZU&_nc_ht=scontent.fhhr1-2.fna&oh=9349124f2a42c77f987af6910ffe46af&oe=5E640252","undefined","",""
