url,posttime,text,crawled_time,attachment_link,attachment_img,attachment_img_alt,attachment_title,attachment_brief
"https://www.facebook.com/ErikaShiraishi168/posts/651575272037262","1569606963","昨天還蠻幸運的...朋友10月要來日本找我玩，跟他一起看機票的同時，意外發現因為樂桃跟香草合併優惠，
日本比台灣提早一天放票，於是可以優雅的選擇超優惠的票還不用怕ＬＡＧ搶不到...
後來我就用5000出頭的台幣買了台灣沖繩來回機票一張 + 首爾沖繩來回機票一張 共兩張拉XD
這是我第一次去韓國，我聽說那邊有很多很漂亮很乾淨的咖啡廳，有好吃的辣辣的火鍋，有炸雞跟好吃的泡菜等...
老實說還蠻期待的！（笑）
而也火速訂了飯店，五天的住宿大概也是2500台幣左右吧(笑)
稍微比較辛苦一點點的大概就是要用英文跟老闆溝通...
英文很容易就變成日文的語感，像是問一個問句最後就覺得沒有問完很想加上「ですか」之類的...
---------------------------------------------
另外不免俗要推廣一下 10/25跨性別遊行
https://hotline.org.tw/civicrm/event/info?reset=1&id=73
雖然我確定沒辦法回去了...不過還是希望大家去現場支持一下讓更多人看到喔><
---------------------------------------------
最後是一點小小的心情抒發...
最近看到LGBT尤其是跨圈的朋友越來越勇敢做自己，
比起2017年的時候更多的跨願意站出來，甚至就大膽的說自己是跨等...漸漸地這個社會真的有感受到變得越來越友善了呢！
很開心看到這些變化呢^^
因此如果你現在覺得很煩很悶，甚至覺得社會不友善，想要自殺想要改變的人...
請妳再等一等看一看，其實這社會也是真的慢慢越來越好呢！
照片是前陣子東京出差拍的⋯瀏海自己亂剪的嗚嗚嗚嗚",1579279268,"/ErikaShiraishi168/photos/a.236044996923627/651575232037266/?type=3&eid=ARDDE2sNKANCT34ijRqZoNeAspkjwYn_UIuSEYT4pzlHjtGZ3wVVo9wKNn8zgcAfj3Z5uAaNY4jKQM3O&__xts__%5B0%5D=68.ARCsZDjNTuLo_s6gTYlLDKEdI9LEM6ykypfjzHM24lwZh5mTBP2c0_8ArBA7QZijYTRbcfvMh0d04IFLv_qAi8QlrMyo0i5pC3Ntc2t0E9KmvpTaeNDzb3pFaiG0ROgmhFpBX5aA3336fhdVS1rzhyOZABq-txHuLsuGZLBh1j2verVdnD3EcKtiE32A0qs2galPe5S9fuAyQZlvEUNRH7frgi7nfGbKAGq4aAIgXMmHEkySaZSuTjVPmjDj2VYZyMQnVtiHyirbdMqSORE2a6Q_e86E437Ik7mEW-e5j7FFp0HJIwZNr2C9TJNMp7BHEta-W3DoBHD9AjRFLuoJwXk&__tn__=EEHH-R","https://scontent.fpnh10-1.fna.fbcdn.net/v/t1.0-0/p526x296/71932766_651575238703932_3022690153475866624_o.jpg?_nc_cat=104&_nc_ohc=gF7Cp1TQ4-MAX_FzgEp&_nc_ht=scontent.fpnh10-1.fna&_nc_tp=1002&oh=a548d625f4ec262512448e535bfd21b5&oe=5E983C15",undefined,"",""
"https://www.facebook.com/ErikaShiraishi168/posts/536450476883076","1553349395","【牙醫小日記】
今天跟兩位日文老師一起去吃飯聊天吃火鍋，肉多多一如往常的就算派在多勇者去吃還是吃不完Orz不過我覺得很厲害的是加價的牛奶起司鍋，我以為湯煮完就沒了，結果加湯都是加牛奶XDDDD
但今天想要去看牙醫，重點是有開的牙醫又太少...上網看GOOGLE資訊都是錯的，嗚嗚害我白跑四家...最終想到在健保署的網站查找才總算找到！
https://www.nhi.gov.tw/QueryN/query14.aspx…
唯一有開的一間，評價是2.8分，有一點抖，看著老舊的大門，裡面只有坐著正在看民視的老醫生XD 牆壁上是泛黃的民國55年的醫生證書用壓克力板裱框起來。
醫生年紀大歸大，但是卻很親切，而且整體而言非常乾淨，幾乎都是用紙本去紀錄，卻給人一種樸實感。
躺了下來以後，醫生看了我的牙齒皺了一下眉頭...
醫生：還有蠻多肉渣的，多久沒有洗牙了？
我
：（心理OS剛吃完肉多多..）嗯..超過半年(其實是三年以上XD，因為回台灣地當時我媽怕我的樣子被認識的牙醫看到會覺得很丟臉，因此延宕著也就拖著沒有刻意去弄了。)
醫生：（再度皺了一下眉頭）後面牙齒有一點長歪了，牙菌很多要好好刷牙，半年記得洗牙一次。
然後就開始很努力的幫我洗牙..........
醫生只收我掛號費100元，真是有夠拍謝的XD 感謝醫生
最後醫生也推薦我買專門的牙刷(20元台幣)跟專門的牙膏(210元台幣)並且親切的教我要怎麼刷才比較乾淨等...
真是辛苦又難為醫生的XD謝謝！","1571336281","/ErikaShiraishi168/photos/pcb.536450476883076/536443610217096/?type=3&__tn__=HH-R&eid=ARAIqYcZmlJL3BboMltkDfwRlMg0qZGUal-5O6tYGw3lWkYluL6CeCphEfXQVyzF79ogxGLVpt-mGCy0&__xts__%5B0%5D=68.ARCzgcyRSLtVwU9CMb4jI9dDrwGgkOWmnlrUahBSH8aHZogeJqt8wU821xM-v_Ky4kHHPhdD_0_7Hl7_uzEce-NquF-6_IJMvWfpwT2HgsPUtKsZhNf0-G3PH8idJUI0Mto6G2FA1KD9c_zzs6MVlPDxGqZB5XP-P4iBz5eCzje92duP40iBkLSy3qYtVGz5kRgcRsg9w7_R47dRXL9i9ENpKl4LJT-YNpszqdX5655JD63GM2IY9AMWUIYeCsRWuolD0KFJYVGVbPw1oZge-mV2rGn0yuaknGslp-j_cWmSgWK_0c0EOLvels8fMuTh03FSuDGUHjKhg1nSLiHtxM4","https://scontent-nrt1-1.xx.fbcdn.net/v/t1.0-0/p403x403/54515677_536443613550429_4791960965664997376_n.jpg?_nc_cat=111&_nc_oc=AQmqOXOXfS_LMd1t0YdbAZ-5JJ7t5jPkBmhUku0bUsbknpcksZF9P3Eytpv316LEWOU&_nc_ht=scontent-nrt1-1.xx&oh=3dbf4e31e9a36f0a65af96ed795f8a4c&oe=5E1A2160","undefined","",""
"https://www.facebook.com/ErikaShiraishi168/posts/620791815115608","undefined","undefined","undefined","undefined","undefined","undefined","undefined","undefined"
"https://www.facebook.com/ErikaShiraishi168/posts/664693667392089","[Error]: TypeError: Cannot read property 'attribs' of undefined","",1579279275,undefined,undefined,undefined,undefined,undefined
"https://www.facebook.com/ErikaShiraishi168/posts/663904704137652","1571068328","三連休最後一天！
今天終於交到台灣朋友啦！第一個朋友（感動 嗚嗚）好放鬆跟開心的吃雞魯飯還有鹽酥雞、逛街也好開心^ - ^
另外吃芒果冰的時候也跟阿伯聊很多XDD沖繩的台灣茶屋的日本阿伯根本是超級同溫層、我們一直幹譙韓國瑜XDD
另外鋼鐵人的手超大的啦！總之今天超級開心 哈哈哈😄",1579279279,"/ErikaShiraishi168/photos/pcb.663904704137652/663902357471220/?type=3&__tn__=HH-R&eid=ARDAg6gZjvlT2i5c_hzojK2C7WfNcYeiL-aWyfhJPC-4iu_iBDSHZ1fzVh5fQz2KuhRlz-kzydUfVOty&__xts__%5B0%5D=68.ARDWlwnFLJRx1OW_PwBvUaNw3ynmDfjUmUvw7FShtM-NK5yo8P_hwPpdHuLjfM_wuO_-Y5A78204wrA_cNdI6dv-4unjCyZGSe7fuI8uEg8-yqOodVO6Vg4iagViy6BEJ0lGqcTbxLbUhQvflq1wPBRCABq1oSy51DPdnR_Ae8ueh6gJTMpGuxGFflxrK8xIpA9jJWlw2pEYVMyUAFIh1jGRPw_p75iqQXOAZGkSKi9R92wD8KY5SgE95Z0n2TZW4SXjptn5Fm6tE5FPAXG6cx248jxQPmpMssZ1vIZz4_CPuuikTMk8_29ebqXOtIkVerbAWP86XC7-XAUlnpVarAs","https://scontent-lga3-1.xx.fbcdn.net/v/t1.0-0/p403x403/72951294_663902364137886_7194570365446651904_o.jpg?_nc_cat=102&_nc_ohc=IKnDPJU4kg0AX9KoevL&_nc_ht=scontent-lga3-1.xx&_nc_tp=1002&oh=3f0609228cd0d4b77062371c53674318&oe=5EDA2F95",undefined,"+2",""
"https://www.facebook.com/ErikaShiraishi168/posts/590641471463976","1561299531","意外看到的可愛愛麗絲只好買下來了啊啊啊啊啊
愛麗絲真的好可愛唷！！
快拿金木犀的劍捅我吧（咦？）
好想跟愛麗絲還有尤吉歐一起冒險啊啊啊啊XD","1571336286","/ErikaShiraishi168/photos/pcb.590641471463976/590639938130796/?type=3&__tn__=HH-R&eid=ARDTDh1YfqOHgcGnCUxMeDdqXn9Z0c9Od0chc-Efz2mQ7xMaqyS241Gwt-G73d2rQ4vZz0KLm9HLhwqG&__xts__%5B0%5D=68.ARANGnhGxvUHPrinDbJQKWsaV2Rl-AXNL5uwiKVa_hdBC_HxaMqn6HHcQVLfbAeHJUILFg0DIYST7ZZdSx3bU_zWL8ShuhO6SAMsQjGs0QC2G2gw1wKaOlSIJBuQscJVlne2VvQrCEDRVb2yWxTUXLVMuIPA7nlQ6k-VR-aCWdeFtwtFMaJhhkRiBVLSZ1ET58raEV2oO-QLlQh3GlGJ_lqMGkG4mOthqvqZwoUHXJQEdGtymPrvZBaMQnLOoa24tN_WTuA30XvCd7Jm52MOSufEhWpWvRdKDg9wC9rTjGNU5r1N0nz80A6YJhKFZdHUT4LBycDynFeOH8aZxoZaN90","https://scontent.fhan2-4.fna.fbcdn.net/v/t1.0-0/p403x403/64969583_590639941464129_6774329530887700480_n.jpg?_nc_cat=105&_nc_oc=AQkVIkfnGraLki5NlEJiE8tdGdCkYUbJcFPKGsRkZOo9_ckETtyAuDjA7kIietqp7No&_nc_ht=scontent.fhan2-4.fna&oh=143aecc0134ee23ee60aa5a387d1a2af&oe=5E61AAB3","undefined","",""
"https://www.facebook.com/ErikaShiraishi168/posts/615408388987284","1564820754","「其實大家都知道」
在台灣最後一天早上、跟姑姑還有叔叔有約、終於見面了、695個日子、不長也不短。
但無論是以誰的視角都不好受都很難熬。
從最早期開始追Erika的朋友們，可以看得到的是我的視角，但對於親戚而言，Erika就像消失了一樣。而去年年初表哥不斷的追尋下、鼓起勇氣跟表哥表姐們吃飯。儘管在他們支持下、卻也在眼神中透露了些許不安。而他們回去時任憑姑姑如何追問下依舊是無法告知姑姑狀況，畢竟要跟長輩們講實在是太恐怖了。
而在姑姑的轉述下才知道家親戚們不停的找我問我的狀況、父母無論如何也絕口不提、但爸爸在2018年的年初對於我十分不諒解、甚至遷怒的一直罵日本很變態等⋯導致姑姑以為我是在日本做了什麼事情被判刑了⋯
慢慢的，爸爸開始釋懷了、而原本以為我會慢慢變回兒子的媽媽卻在我越來越靠近終點站而心態變得更加艱辛。
或許是臉書的力量、新聞媒體等⋯其實親戚們都慢慢知道了，彼此也會不小心在電話中說溜嘴（？）長輩他們自然有一套能夠彼此釋懷的方法。
爸爸跟我重逢了、親戚們也明白支持並且接受我了、695日、我很難熬、親戚們得知的當下更上好幾晚無法入眠、日想夜想。
至少、現在的結果是好的、我很幸運即使我很辛苦很辛苦，但我是有結果的、一定會慢慢變好的👌
現在你在這路上會覺得很辛苦很痛苦😖但千萬不要放棄任何希望。因為任何可能性都有可能發生的。
無論性別、無論性向、職業、國籍、成就等⋯我們都是彼此共生共存於這地球上的生物們，互相尊重、理解會讓這世界變得更好、也許你現在不相信，
但改變一直在發生。
「愛」最大。","1571336287","/ErikaShiraishi168/photos/a.236044996923627/615406038987519/?type=3&eid=ARBJpdIDW5Ei2bvVVy4uXmNR8qmwT9sVSW6qs_SXr6dzn0ECQgK5K8NIxSbxSLHqoz42U_-_swkmMDhw&__xts__%5B0%5D=68.ARCIIXTiwq5dOyqMxnyKSgXbyVEqlArpsN30pnXa7SZr7oFXfM43UbaKnyzG7mNWhnoNSdoUqdJhSKPdLMOWE4MJwSvZhsbzyG_EbOxcRQlAGFrHBcuRYsBLOAangvPDICBlO5BU4lJkd24-mUFZhQHpI-iLXKpcb7CT25xZKVgXQ5eFXIpxM7t1fcuSlhFqac1UBh9oappbO7gKpYgygnDiehFmLoi0IG9hz7jZwtOhx1CpZUoo6uSwqvRIIyddWFTaFeAXJHqZyijI7SLTXXjSm1dRrJAVU24fFEQpsLj2F9FtNHBMqI0GLgGhNIgH9t24jj4C1cgBv9_8PMG6ejE&__tn__=EHH-R","https://scontent.fhkg4-2.fna.fbcdn.net/v/t1.0-0/p526x296/67662875_615406045654185_3964636993282899968_n.jpg?_nc_cat=105&_nc_oc=AQnY4fpqPHUytuC2vof8d5RhWaV8zCOyW0LFC22BKuc_PPnqndpbEj7cYqJfyVBO9EQ&_nc_ht=scontent.fhkg4-2.fna&oh=a3f50cee308ba211ab2f130ce8094d51&oe=5E233C05","undefined","",""
"https://www.facebook.com/ErikaShiraishi168/posts/572658946595562","[Error]: TypeError: Cannot read property 'attribs' of undefined","",1579279264,undefined,undefined,undefined,undefined,undefined
"https://www.facebook.com/ErikaShiraishi168/posts/499785317216259","undefined","undefined","undefined","undefined","undefined","undefined","undefined","undefined"
"https://www.facebook.com/ErikaShiraishi168/posts/657193878142068","1570284788","【Erika的紀錄片將會在11/17上映】
兩年來真的花了很多時間拍攝，
記得一開始是 Toko Hung 跟我說有一位想要來東京尋找LGBT題材的朋友 蔡佳璇
，因此介紹我跟佳璇認識，之後在線上聊一下之後，從取景東京變成專門拍我了XDD
經過了非常多非常多的事情，
【2017年】
有經過幫我看診的日本針間醫生，日本的跨性別酒吧，
並且因為 Sprin Hwang 的關係成立了這個粉絲團ww
2017年台灣LGBT遊行 非常感謝當時黃怡愷 吳筱芃兩位姊姊的幫助。行政院看見彩虹比賽 海蛙攝影 、感謝祭 Vic Fan Tomato 
跟許許多多可愛的朋友們
【2018年】
因為貪圖周年慶特價優惠，所以特別去 元和雅 Enherya
做了隆胸(原本是要割雙眼皮ＸＤ)結果我一次低胸之類的衣服都沒穿過XD，然後遇到兩個在台灣很好的心測的醫生很快地幫我過關了，公司職場也是一群非常友善的同事。並且在10月完成SRS，這其中也是非常的非常的感謝太太一路以來的支持跟一路上的照顧，2018年雖然我有一度自殺過，但是也是因此挺下來了，家人也慢慢可以接受了，甚至在2018年12月我跟爸爸重逢了。太多太多不知道該怎麼下筆的東西了XD
實在太多太多了。而2018年我做了一件非常想做的事情，就是拉了一群人下來開創跨性別社團XDDD
【2019年】
最大的變動就是跟家人互動變很好跟親戚朋友融冰，回到我最愛的日本吧！這邊的人非常對LGBT非常友善，同時在11/3的同志運動會中我們也會以贊助商出場唷^_________^

 跨越琦玉->東京->台灣->沖繩 一段平凡人的小故事

 謝謝佳璇，以及我最愛的粉粉們，跟這一路上許多幫助我的貴人，尤其是跟我越好的人就知道其實我是非常暴躁跟情緒化的人Orz，謝謝你們忍耐我這個無理又蠻橫的公主
每個人的過程都是艱辛又難熬，有苦有甜。
堅持，努力，總有一天是能夠開花結果的。
－－－－－－－－－－－－－－－－－－－－－－
🎬 放映資訊
片名：《游移之身》
時間：2019/11/17 19:00-21:00 （與《共生流浪》同場播映）
地點：府中15紀錄片放映院
（入場方式主辦方還沒公布，照去年看可能是免費排隊入場，確認後會再po上來喔～）

 P.S 我會去。",1579279275,"/ErikaShiraishi168/photos/a.237791133415680/657184938142962/?type=3&eid=ARBGTJOi-WkYn-UDjLs2jRlxCKQZU8fumbeM-NYFKDHJVvLue71FeskZvkuZSnOxlyz8G8ZWU9-g1F-n&__xts__%5B0%5D=68.ARC3436UYALJ1lLh_2YbVix9dRqWN-GN3aGunGr9ZEpNB_5nvHBODENcszMSaqSPmBf1pECNwF0cEMLMdP_AmdXrxHH8Yn9oOHSF-Ubgs8AcDA6q57htc4n4OzIvAsrMCuGoK-X4t6nHbFerqHh5w4hswOH5gGH8M2GuoHwW-sl6u5kLStNoKXGdeHnx4sbDMCxkMIFNf8DZCI6AL9s_xx5Z5nPnY8Lg49cwR3p0aiC8CiboU7m-lFMe0_k2Uk5gUxp6D68LJPBVNEKUtK5lmtAc44skqeEbVjuCjCViO2MkhV6HXacp7MjKuN_tod5-2rYTrw8CIc4l1kuN8GAFlQg&__tn__=EEHH-R","https://scontent-sin2-2.xx.fbcdn.net/v/t1.0-0/p526x296/72623830_657184944809628_6240642314935468032_o.jpg?_nc_cat=104&_nc_oc=AQmltPj-9zWdohCjwvVn4Oq-GZAFjjH_LhLRPuTHS5FklXV2oHt50CqN4QE6u1OpGHg&_nc_ht=scontent-sin2-2.xx&_nc_tp=1002&oh=4584bd0c2b7e642b9d4edd94df703a84&oe=5E96EEA5",undefined,"",""
"https://www.facebook.com/ErikaShiraishi168/posts/497092584152199","1547138308","謝謝今天有來的大家喲(*¯︶¯*)
好久沒回到母校附近了⋯要不是今天下午有教課就先去巧之味吃水餃了（笑）
另外今天也太多美女來了吧、然後跟我一起搭檔的酸六也好正>/////<","1571336288","/ErikaShiraishi168/photos/pcb.497092584152199/497092497485541/?type=3&__tn__=HH-R&eid=ARAfmh621ch5g3QHi9_245330j7WtT2CaxwXrrNXIZ-7yMRhUwbOQBktR5X7LGEw8bjl_93DuBN6WYy4&__xts__%5B0%5D=68.ARAnTUFCXCWfO5YxWFf5m5H6GfbR5cdQzEMAvyP8MUrx1Gzj8WbFrFlv9lwXWLK0XAdSGJ11wKF7BmDlbw-NYlsrX4iYGIaNXIHIAjqBInMpgc3GnXeAHaWpc1-WN7wWDGXpG7uXwOCSWGjw6s28L4zdEn-NG0z0hSsaC6ABYS730XEN8iWJE5RYWKdqcmRMotAGxT2TYLxXvdQNu30ZyoUVDaGcGOZC9bW0BgtMBw-podZKXrcV0RmAyCvtOE0wk07nfIL_YgntGazhMHrrrmmTt2Im2lLEFlOE6PrIqlYM0SdMBnsQoxYE5vIcXED_eLGrxugaeMYxXn4k4qmDp7w","https://scontent.fhan2-4.fna.fbcdn.net/v/t1.0-0/p403x403/49766458_497092500818874_8012665282038333440_n.jpg?_nc_cat=100&_nc_oc=AQk9BCYiXbPIwAvrE0Khzr91WdIWLNmlwpTKaos26a9bquGvX9rI_0sTAwLksrexmd0&_nc_ht=scontent.fhan2-4.fna&oh=0208b17f8bbbbabe3ef7109c20fce294&oe=5E28246A","undefined","",""
"https://www.facebook.com/ErikaShiraishi168/posts/502074003654057","1547922898","【健康很重要】
「銀行有打給妳喔～記得要去變更身分證」Line的另一端，媽媽如是說著，這是我一年多以前想像不到的事情，在被戶政事務所出櫃以後，聯徵中心更是以迅雷不及掩耳的速度通知各大金融機關要我盡速去修改身分證(當然我的信用卡也被沒收要重發
囧，感覺像做錯事的小孩被沒收卡片)
而爸爸最近也團購了砂鍋魚頭鍋(其實他是找個理由)然後找我還有姊姊弟弟全家人一起吃晚餐，但我現在因為工作關係，還抽不出時間陪他們>____<不過真的很開心，爸爸媽媽都願意接納我了，真是事情發展到我難以想像的局面了，感謝上帝。
過去我其實也是很負面，每天除了加班爆肝以外，當然會有的就是手搖飲料，甜食等...儘管家裡有遺傳糖尿病、癌症病史等...都想說算了，反正活在當下最重要，也因此我吃東西一定是大辣，燙的，吃完滷味在吃雞排，各種沒有節制，晚上一定也是熬夜熬到早上6~7點。
但現在我改觀了，目前的人生真的是太棒了！！！無論是法定性別、生理性別、心理性別都是我想要的，性向也是我想要的，甚至女友對她家人出櫃完，兩家人都知道彼此的女兒互相交往，感覺真的是超級讚的！工作也是我喜歡的工作，每天都碰觸著我喜歡的東西。
所以，我不能死，我不能糟蹋這個身體，我要很愛惜很愛惜他，我還想再活很久很久，我覺得活著享受這些我辛苦努力得來的真的是太開心了！我開始減鹽、少糖生活，戒掉飲料，真的很想喝就喝低卡果菜汁，睡眠時間慢慢往前推前早睡，除了日常的擴張以外，在家也會做一些簡單的無氧運動，當然就連喝水也不喝冰水，改喝常溫的水，沒想到只做這些微小的改變，我的體重就有下降了XD
保持樂觀健康的心情，如果再有點時間就去戶外運動(現在工作還是太滿...XD)，健康的飲食，積極的面對人生，這快樂真的是得來好不容易，卻也讓我好開心呢！
P.S 最近迷上自助餐，真是外食又可以兼顧營養的好幫手XD當然一定會有更多人比我更注重..我就很基本的隨意挑點蔬菜而已...地瓜葉超好吃！！","1571336289","/ErikaShiraishi168/photos/pcb.502074003654057/502066193654838/?type=3&__tn__=HH-R&eid=ARDaqqTyap9pJff_XIdaYyp8yHxOHLLdTBqzyHspTP0T4trVr-xzdHmWwodn68kCglYitcnyGF3DG-AK&__xts__%5B0%5D=68.ARD88ztD7DAXifHu80MaNnyMXkBLzYm9vIKcS3DiK_MxKb4814WxMmzGt9E-VUArTwO_Zszn-gOOYcFYwREnmBxdNY1v27DIcA4hDLdcMJmwJXdSOgHj7rGtUNLYkKqtsDJKXbrXbY_RxaYdnVM4LfopIh6i54azrz5KC8sEH_Cpl1iG1hWAk843LgJc7d19RImQ4mzTqAyd9XzXd5V47iLMxWyMXQM1-dFFZhzs7axWq8R_uKOpe6EIRRbSO0R6ZWS0q-046H53U_DI4tYzudyMWcBM9UQzxv_5InpSv8uO9sTiNRHYBs0xzPlAytRYotBZgXfrxky-97f6Uio2M70","https://scontent-lax3-1.xx.fbcdn.net/v/t1.0-0/s526x296/50711552_502066196988171_5440951358976950272_n.jpg?_nc_cat=103&_nc_oc=AQkK6EVi6ubYuU4dmqTBW2sNKYbs4GowK6H57RMQPBzyOBt_AzConlqD23BWmqvkAw0&_nc_ht=scontent-lax3-1.xx&oh=c55531c57dc0e622b50f64d01d093b14&oe=5E601ECA","undefined","",""
"https://www.facebook.com/ErikaShiraishi168/posts/508743926320398","1548952802","東京超級快閃！！
11:10一到東京車站立馬找佐川寄放行李，
12:00新宿南口跟阿姐見面火速幫她免稅買了一隻錶以後，跟女友大人還有姐去吃了很棒的壽司XD
15:00火速衝到原宿醫美用超級VIP身份超速現場預約雷射除毛XD
（醫美很讚，全國都有分店，但是男性專用的分店只有原宿一家，因此我SRS以後不僅可以選原宿店以外，其他店也開放給我XD）
16:00水瀨咖啡廳跟女友大人還有小動物們玩耍
17:00台場迅速購入衣物，並且跟老闆大人還有可愛的弟弟一起看東京灣夜景吃飯。
23:00回到埼玉火速把我的愛店們吃一輪，真是太感恩啦哈哈哈哈。
而今天晚上住的這間只能說超級棒！
不僅有溫泉大浴場，一堆漫畫可以看，大電視看，免費按摩，休息區等……而且還超便宜！
很讚很棒的一天，開心！","1571336290","/ErikaShiraishi168/photos/pcb.508743926320398/508743772987080/?type=3&__tn__=HH-R&eid=ARB00k80iaakMuqj1m4qa2sPojmmVWh6bA1iyvBQya91shIzOxfjZs0OkOhxkm3VI0bc5D36ZLxN6P2K&__xts__%5B0%5D=68.ARDNjuiV6Yccw6Fx2Qeb5Hsrktp8NhHO1SZJRyBzjLlqe4IYpn68osv0R2BRysqehp3R772E7g-axKXyvGwQdKZm4kbBKwDbn8PXsRnvCZ8AR9hplulXWZvTbsRSOky_IxFkSF53vuB76w1W1l5egkLuA3UPyLldKI1uwx_6mi9CBYZIRq32i07Wi8um4zvM8sF0Q1SLNw9wz6cEaEMz_rbjt5BeksjYxyb7BiX8xdhhwfY0Bh1aweP2SrOApyEZpYByghcg3IMF-24CLZlW3REX5slxIGIj6fOFDFblmOQNkDdQnTK8ytO3OjeuuT0DAeEWnOLdq-ERNMjwCac4CvQ","https://scontent-lhr3-1.xx.fbcdn.net/v/t1.0-0/p526x296/51349631_508743776320413_849155188068450304_n.jpg?_nc_cat=106&_nc_oc=AQlBoFPaptZR7RBxOMnbUqrJiVYICJkuwzXM3sShEyBDKmdk_u45uIPQGZVMLz9ELWo&_nc_ht=scontent-lhr3-1.xx&oh=0d4a01990cd67f9f2fede4aa96457e4e&oe=5E220175","undefined","3",""
"https://www.facebook.com/ErikaShiraishi168/posts/520198715174919","[Error]: TypeError: Cannot read property 'attribs' of undefined","","1571336290","undefined","undefined","undefined","undefined","undefined"
"https://www.facebook.com/ErikaShiraishi168/posts/506450953216362","1548601812","真的是太感動了，超級好看！
我從以前就非常非常喜歡乃木坂46，大概是從你就是希望（君の名は希望）開始喜歡的，最喜歡的就是白石麻衣跟生田絵梨花，真的是我的青春回憶XD看演唱會聽得很過癮也看得很過癮，果然整場大爆滿，感謝強者我朋友借我兩支螢光棒ＸＤ讓我很順利地看完！
乃木坂真的是充滿著正面能量，同時對我而言，她們真的是我的偶像，很想成為像她們這麼亮眼的存在！
嗯...從乃木坂身上真的改變了我很多，努力、微笑、感謝！
另外乃木坂的歌也超級好聽的啦！還沒入坑得趕快去聽一下，聽完就會入坑了！總之我超愛乃木坂就對了XD","1571336291","/ErikaShiraishi168/photos/pcb.506450953216362/506448166549974/?type=3&__tn__=HH-R&eid=ARATsnAQjWTw0Edvz7yVtqYwOATcYd4QCL2LYkAHTKvwmFcRBxv2CleWtfU7Svm3XJdtE87YdIMsCHsS&__xts__%5B0%5D=68.ARAm31v4YXryEcBpCgQgt1Wg9grtVCLqxzf0Q5zfflz-9gmrsRj9BsI6BNla-IZvF4M0WEN98lpZjEk5Mzqob3ciyJ45z8TzOGb11d88kBM3gWLw6RHNAeWKPNmNysIvNvh2dguJ_INlYgO7xu4HawGXoKPVWD0oQ8JEGxPh7_LVSTHB4E5HeMVdj506CZ129tspijpyxNMeKIf695T9gS_60aah0qSTw39nFrLobHG4P4n27nfAaihSExDG2H9VOyZCSqn0eOEGe-JS2-2CX-YGZlUQCqQfwsfrs9IF8E5kkaK328uMqh7LSw9PZ6dShAz_e-qYYrKJDrsuTu8UfH0","https://scontent-icn1-1.xx.fbcdn.net/v/t1.0-0/p526x296/50683976_506448169883307_4615813413279367168_n.jpg?_nc_cat=102&_nc_oc=AQksLh8cyKDoVS7KT__fKRaVbY2LHlD-4Dz_KmecFhicJTz4DuVDWNayD5kgCUwoyPQ&_nc_ht=scontent-icn1-1.xx&oh=1a5d5197266ea5f91b7bba5c7cfdd633&oe=5E29ECAF","undefined","",""
"https://www.facebook.com/ErikaShiraishi168/posts/503182150209909","1548089574","今天晚上連上了7位50音學生...
而且都是最初級班XD也就是從あ行開始的...然後教完以後立馬又在教一個，一模一樣的東西，一個晚上連教七次= =
當然我每次課堂中講的笑話學員都會覺得很好笑，可是老師已經講了一模一樣的笑話今晚講了7次了啊啊啊啊啊啊
現在可以明白為什麼
很多老師上課說笑話自己都不會笑了XDDD","1571336291","undefined","undefined","undefined","undefined","undefined"
"https://www.facebook.com/ErikaShiraishi168/posts/525037308024393","1551458693","【自宅卡拉OK】
感謝今天一同歡唱的朋友們，唱了七個小時多好累(喘)
Erika也隨便唱了個95分，呵呵
(其實是強者我朋友幫我唱的啦XDDD)
真是太厲害啦！！！今天來得都是唱將等級好像親臨演唱會一般超開心的啦！！明天又要迎接工作了～YOYOYO！！
大家在這連假都在做什麼呢？分享一下吧 哈哈！","1571336291","/ErikaShiraishi168/photos/a.237791133415680/525035994691191/?type=3&eid=ARD_zPRQBQMzmu3FbJyz7MCOlzBgJUEu-9U_w-h_Whj8LmQIDW9IuR1obTMjDWv9avdNFKKjjsUteB8H&__xts__%5B0%5D=68.ARCKDfWmsGJ_62aZ7vH1C_RmwnPEiY5zjh1OC2xsrPeWBmqzOcchUe7y2JQa57iIEibaebwhSX_fMxapgBotOuq2GmSNqNUkgTE6jb2srHdJgR7570DWhRWLk-xU0EJKVizuykwCbqCroXQAWT-Hu9tS68aZT1nR9pN84GAD6JfX0GiM69_LDO7UjLGWAEgRTh3_tVyZBprkAq-VAhVKMIia8dU9L1msOz-hGWSPS_EwSvBh8Vec9zGI-TMXo7pWx2lmYhOR8-ZRCjBkLr-RKZCE9dd4QgSxqH1GcETiPNhGBvSA_5Mk3rdVKdxQ8KIFcr6m1XGv5pc2YkgdjWV5b70&__tn__=EHH-R","https://scontent.fhan2-4.fna.fbcdn.net/v/t1.0-0/s526x296/52940754_525035998024524_4725935112028422144_n.jpg?_nc_cat=100&_nc_oc=AQlDyIEtKW8k55j4ek37A-Ab8qmJh4pJtk5WtSjonFRKiP7zJw-fcv7H9ZycY-i11Pw&_nc_ht=scontent.fhan2-4.fna&oh=98f6871794619c6bd4095412018937da&oe=5E197260","undefined","",""
