url,posttime,text,crawled_time,attachment_link,attachment_img,attachment_img_alt,attachment_title,attachment_brief
"https://www.facebook.com/fb.yuanshan/posts/10157758940107160","1567319459","[活動分享]小花小花蔓蔓來 全民出擊快快除

 
小花蔓澤蘭─有植物界綠癌之稱的強勢入侵種藤蔓植物，因具有強大的生長及繁殖能力，已嚴重蔓延並侵害本土樹種的生存空間，而夏天是小花蔓澤蘭生長旺期，並至10月底開始陸續開花及結實，因此現在正是阻絕小花蔓澤蘭持續擴張的最佳的防除時機。
今年9月7日為小花蔓澤蘭全國防治日，羅東林區管理處將於當日上午8時30分，在頭城YWCA聽濤營舉辦「蔓蔓來
快快除－小花蔓澤蘭全國防治日宣導活動」，集結政府機關、企業志工及社區民眾力量協力清除小花蔓澤蘭，歡迎有興趣的大朋友、小朋友攜手來除蔓，現場報名參加者可獲贈限量小禮。團結力量大!邀請大家一同為我們的家園盡一份心力。
如欲獲取進一步詳細資訊可以點選羅東林管處林業新聞：https://luodong.forest.gov.tw/all-news/0064502！",1579239247,undefined,undefined,undefined,undefined,undefined
"https://www.facebook.com/fb.yuanshan/posts/10157224084142160","[Error]: TypeError: Cannot read property 'attribs' of undefined","","1571250595","undefined","undefined","undefined","undefined","undefined"
"https://www.facebook.com/fb.yuanshan/posts/10157044299372160","1543032276","[資訊分享]
清水地熱公園試營運 即日起到11月底免收停車費

 宜蘭縣清水地熱公園即日起到本月30日試營運，目前賣店尚未營業，遊客想要炊食必須自帶食材，賣店預計下個月8日園區正式營運時同步開張。
宜蘭縣人氣景點清水地熱3月1日起封閉施工，封園8個多月後，昨天開始試營運免收停車費，12月1日到7日不開放，8日正式開園後收取停車費，自小客車每次50元。

 最後，請各位遊客注意囉！！！清水地熱公園賣店尚未營業，遊客炊食須自帶食材！！要記得自備食材才不會再浪費購買時間歐！","1571250595","undefined","undefined","undefined","undefined","undefined"
"https://www.facebook.com/fb.yuanshan/posts/10155772731902160","1503414907","感謝今天生態館的志工導覽老師，辛苦了！今天茁壯園安親班的小朋友對生態有更深的認識。我們一起愛護自然環境，愛護森林。感恩!",1579239251,undefined,undefined,undefined,undefined,undefined
"https://www.facebook.com/fb.yuanshan/posts/10157835069572160","1569726823","[資訊分享]教師節小優惠 教師暢遊阿里山享優惠

 
為感謝教師的辛苦，並弘揚尊師重道之精神，嘉義林區管理處自108年9月28日起至108年10月9日止，優惠教師暢遊阿里山活動，凡教師本人持「教師證」進入阿里山國家森林遊樂區入園門票只要10元！
教師節即將到來，為感謝全國教師平日致力於教育的辛勞，林管處以實際行動優惠老師暢遊阿里山，讓老師們暫時拋開教室的重任，輕鬆來到阿里山感受森林的寧靜與芬多精的魅力。阿里山國家森林遊樂區位於海拔2000至2700公尺的雲霧帶，除了森林、日出與小火車，秋天更是雲海登上高山舞台的季節，園區內小笠原山、對高岳、沼平公園及慈雲寺等位置常見白色山嵐繚繞於遠處的層層山峰間，儼然真實放大版的潑墨山水畫，壯麗景緻美不勝收，趁著這個季節享受漫步在雲端的優雅。
如欲獲取進一步詳細資訊可以點選林務局林業新聞：https://www.forest.gov.tw/forest-news/0064642！",1579239248,undefined,undefined,undefined,undefined,undefined
"https://www.facebook.com/fb.yuanshan/posts/10157815360627160","1569132746","[資訊分享] 員山周遭小景點 周末等你來探險！

 哈囉各位~今天過得好嗎？
最近有覺得天氣陰陰涼涼的，剛好適合出來走走逛逛！
小編推薦大家一個好景點！
位在宜蘭市郊、屬礁溪鄉的龍潭湖，芳草如茵、山水連天，自成一色，湖畔綠色大草坪，可以親子同樂、野餐嬉戲，還有俗稱「大碗公」的龍掌坡溜滑梯，保證大人小孩讚不絕口！
而且大家也可以去玩龍潭湖後順道來我們員山生態教育館參觀歇息歐！！！",1579239254,undefined,undefined,undefined,undefined,undefined
"https://www.facebook.com/fb.yuanshan/posts/10157853003247160","1570254680","[活動分享]員山生態教育館精選影展到校播映來囉！

 
林務局羅東林區管理處員山生態教育館為扎根自然保育，自今(108)年9月至隔(109)年1月推出宜蘭縣學校播放生態影片之服務，影片類別包含動物生態、保育紀實及資源保護。
羅東林管處表示，精選15部紀錄片如九九蜂鷹及台灣黑熊保育紀實皆具高水準內容，廣受好評及迴響。期望透過具優質配樂及畫質的記錄片到校播放活動，讓師生引發觀察自然生態及重視生態保育。
「九九蜂鷹」生態影片，曾勇奪第47屆電視金鐘獎攝影獎，該片歷經三年辛苦拍攝完成，詳實記錄東方蜂鷹求偶、築巢、孵育、育幼過程，更記錄到鷹群發揮團隊精神，利用俯衝的速度及反覆衝撞的力量合力破壞虎頭蜂巢結構，共同享用巢內蜂蛹的精采畫面，非常難得。
「魚線的盡頭」紀錄片，是一部剖析人類因過度捕撈對海洋造成衝擊及影響。近年來，人面對漁業資源的枯竭，常歸咎於氣候變遷、棲地破壞與環境污染等因素上，然則人類的「過漁」才是真正的罪魁禍首，海鮮產品需求增加、精進的捕魚設備、漁場擴張及不當管理方式與資源利用等因素，都是致使漁業資源加速耗損的幫兇。
本次精選影展免費到校服務！歡迎有興趣的老師與學校單位踴躍申請（表單網址https://reurl.cc/oNlb3）。若想進一步瞭解影片播放內容或相關疑問，歡迎於開館時間撥打（03）922-4307或利用服務信箱（ys.ecocenter@gmail.com）洽詢。",1579239256,"https://l.facebook.com/l.php?u=https%3A%2F%2Freurl.cc%2FoNlb3&h=AT3kXg8lqohZZC1ZhIkZqO4WWlkXjY-myQ7uRqVQX87LxgCAXlfZ3CAzSub6dkTnEPfWwTjb9uN9jVJLHuCBFxRaxZkCxFutoY4fCbYXCc9iKXKhKkk7maB4IfFJpLTC4GkK59vADiZmRiOpyHGfdEXOyI3JWCS4SKN4w-wfnLRAR3LxbgTOP4iQJVAqdB0H3NpL68BaO5QASd8XNjhlD5H_kbD67kigktHn9TOOdelQGSj6cCwEiRlGSLuaa_xCFFITVAT8_H84RnG0Xv1IQ0QqWYHcxPA8UxNle_iO1hz6pfSLBup51WbA7zF2ZPLvKFzYRxY37A9gt8uJqyRDYI2FjB1RkWo7kHVT6wTAGLHesTGjXJZd5D9Y-0fZhyExpc_faNrGq2lTimHuXiRxVyWC7IWtuOGeoGDzx_ni8Xh8HqK83vpoRt5CbmD3fvc-nvfVwaXA_lP2LU_8oy9qW2ZH7nrKCOtclw7dKK-2W_0AbMDDWGM7cTTC_aT6KsfHnpeIsjbKrbKw7kL18MNo4PMlKF7SRr2vV8TrVGW7XcZopDZp85NyyVDcc6foauUZUfiSoY6jn8ubAoCBVwWgpGOo4T15yOSrMFLZ7nU5rP-Wuhjd8g3JObbBHl-tUeaimB2TeGsj","https://external-sin6-1.xx.fbcdn.net/safe_image.php?d=AQAfigKr3X1MTqFo&w=540&h=282&url=https%3A%2F%2Flh3.googleusercontent.com%2FO5AdRBc03HT3XkeJ5t3p-8mEUQXmnuSioIYxEhlNymO_db_QFLvj0zFtt2uwS4nOR0c%3Dw1200-h630-p&cfs=1&upscale=1&fallback=news_d_placeholder_publisher&_nc_hash=AQAcSOriHH0LaWGY","Image may contain: text","活動說明 【活動對象】宜蘭縣縣內大學、各高級中學及國民中、小學校。 【活動時間】1-2小時，節次依學校安排（約1-2節課）。 【活動地點】到校播映活動將於學校有投影及音響設備之空間進行。 【活動費用...","reurl.cc生態影展精選在員山－108年度到校播映活動預約申請表單活動說明 【活動對象】宜蘭縣縣內大學、各高級中學及國民中、小學校。 【活動時間】1-2小時，節次依學校安排（約1-2節課）。 【活動地點】到校播映活動將於學校有投影及音響設備之空間進行。 【活動費用...活動說明 【活動對象】宜蘭縣縣內大學、各高級中學及國民中、小學校。 【活動時間】1-2小時，節次依學校安排（約1-2節課）。 【活動地點】到校播映活動將於學校有投影及音響設備之空間進行。 【活動費用..."
"https://www.facebook.com/fb.yuanshan/posts/10157871015057160","1570777530","[資訊分享]太平山國家森林遊樂區台灣山毛櫸步道，黃葉期資訊分享

 隨著秋天腳步將近，往年太平山國家森林遊樂區的台灣山毛櫸葉片於10月份將開始換新衣，整片山頭成為金色森林。
太平山台灣山毛櫸步道逐步進入黃葉期，小編跟大家分享太平山森林遊樂區的官方追蹤日記！
如果想要去欣賞山毛櫸的遊客要保握時間歐~~並且園區自10月19日~11月17日於「翠峰景觀道路」每周六、日期間實施動態總量交通管制措施，管制車輛總數為200輛，以維護翠峰景觀道路的交通安全與順暢，並提早公告讓遊客及早規劃安排行程歐！",1579239252,"/tps100.forest/photos/a.1443028955962232/2340407676224351/?type=3&eid=ARC02p2k__LSy4XYlIcMo9fFqg5-ap-xEHbzrcEUgH_cE5_15oJJKpycq5Rn9CHW3RMUFjR5ATRk_P0n&__xts__%5B0%5D=68.ARA-k50CGL4jRXAdpUNchmJLIDncheO2GpAdToc_Pk2N0HMjYJpU8VNAyq3nT0ZAYw3g-ak3QJNPAmXvElPO_vR4jAUIyTi29cg5F4Xj0gEpUw3hxMjVaEwiGIHn4rg-2nvfQ0bxHYskAmFSPynZTqMiX1zUdA0TkoE7mFe_wpKW2miVLUdPdIbf8J4Thq1r60KXPsA8v_NitUaNqqB6xqJ_l0Jx499YHlvCAkljc0rlV4nnUPr_v5yONnhtwkAylswB_n59zgZlgyIWx7icse38HHZ-03nkwMLtTDXPQvFfHOUW5zVrnB6YVn_GuSbHzYv-iHX_sRoLrUd7MTml-uRFHPAhxP5JIX5DQ6RdPfUw7i3mQSO9bQS1yjJAXcQMVuDG4xufr2j-9GrO0jPys9uhf2OMkcY-OnyYPqg7nF-iaC1xuv2EScejmgAI-0-joegv6eXw2meUZRyNDW1rBoaXKHhdZZOsCCTFwO_8esJRj43k&__tn__=EHH-R","https://scontent.faux1-1.fna.fbcdn.net/v/t1.0-0/p526x296/72604742_2340407679557684_5886509767320403968_o.jpg?_nc_cat=107&_nc_ohc=y87Q9y6Ou-YAX9_ykyc&_nc_ht=scontent.faux1-1.fna&_nc_tp=1002&oh=f6a89713b4109c57d48af056b6edaa72&oe=5E92AB7A",undefined,"太平山國家森林遊樂區",""
"https://www.facebook.com/fb.yuanshan/posts/10157046593062160","1543114200","[活動分享]
大農大富平地森林園區「楓紅季序曲」開始報名！
花蓮林管處精心策劃「林田山巡禮、風箏DIY、賞楓騎趣」

 
大農大富平地森林園區內建置了13公里自行車道，蜿蜒於南北環道的樹林之間，冬季是最適觀賞楓香紅葉的季節，花蓮林管處在12月15日星期六精心策劃「楓紅季序曲」活動，讓我們一同到林田山林業文化園區體驗近百年前的林業史蹟與近代木雕藝術創作。
現場有講解經驗豐富的國家森林志工為各位帶來一場精采的文化之旅，中午前往知名的大和擂茶舖體驗客家擂茶文化與在地家常美食，不只餐點美味還能自己動手做做看。接著，騎乘酷炫威力輪穿梭在平森楓紅森林自行車道，及在蟻窩裝置藝術中進行風箏DIY活動，製作屬於自己的可愛動物風箏帶回家。

 活動詳細內容可以點選以下網址：https://docs.google.com/…/1GWR6GCXcvWIThou6P7qVxw…/viewform…
或到林務局林業新聞：https://www.forest.gov.tw/forest-news/0063144","1571250596","undefined","undefined","undefined","undefined","undefined"
"https://www.facebook.com/fb.yuanshan/posts/10156492604987160","1524101904","[館舍故事]
從3月底開始，員山生態教育館戶外的木板從覆蓋著落葉，慢慢地轉換成佈滿了鮮紅色的花朵，這些花朵的主人是誰呢？
原來是中間種植著的雞冠刺桐。

 
雞冠刺桐是原本生長在南美洲巴西的刺桐屬植物，不過因為花朵鮮紅艷麗，所以廣泛引進種植成為台灣常見的景觀樹種，而在台灣也有自己的刺桐屬植物，名字就是刺桐，一樣會開著火紅的花朵，在台灣原本生長在南台灣及蘭嶼、綠島，因為開花季節固定又明顯，所以早年還沒有月曆前，原住民便會用刺桐開花來判斷飛魚季的到來。

 你們家周邊有雞冠刺桐嗎？也可以觀察看看它的花唷！","1571250596","/fb.yuanshan/photos/pcb.10156492604987160/10156492599857160/?type=3&__tn__=HH-R&eid=ARBs9C6-QFWoM0QXZCKcVNMQRC8ojZe8l5LzVcelHPc_g7eGaZu2MS82TqAedPzqnOb-5DnYvXjmQv9K&__xts__%5B0%5D=68.ARD7t_R0StPTrWBWMkY_iF2kTnq1THg1YymvKJ_YOzBnCioPUW6GYO5rR1ihg6Kwj3qu9lLtZj3VQ032-xuPr5nfLZXegxyDRaVnPhfVndUcSExrULFBglQMIqhR-4SNbcp2uTBlgQns4sOVUUTP6c2dZg8OfZGLhPsJAMJ9zc-Etm5o7W2sQXfuF0gEMgg3NVMoVFFx01UFZ0YXcqYA14Q7c4LcRsXAzbu9KsZmWx3l4dhcqo0l9uos1e3vi_-CjPte3WdiRF3VvlDlWqv3N_v1CYLh6eUyUj5LMawm3ALGpx5LcBiSMjOIOy9M2N_1o_zDs_Cn2M8BTL-n9k93","https://scontent-sin2-2.xx.fbcdn.net/v/t1.0-0/s526x296/30714017_10156492599862160_4933411538850545664_n.jpg?_nc_cat=101&_nc_oc=AQmS5KsJz0NyxZ7JtWbwDT4ZkLrWk6eL6-rpH8OfbCmjtIJFKDkn4Qo_G9QBjV3lgNw&_nc_ht=scontent-sin2-2.xx&oh=081dde4448904f12204a21c6caa0ca53&oe=5E326C3E","undefined","",""
"https://www.facebook.com/fb.yuanshan/posts/10156512454482160","1524801286","[活動分享]

 
近年來因為農藥和開花期的改變造成了蜂蜜的減產，其中農藥中毒的影響是較難以回復的，目前除了會造成蜜蜂急性中毒的農藥以外，類尼古丁農藥則會造成蜜蜂的慢性中毒，而這個狀況在世界各國也都有發生。

 
我們現在吃的許多蔬果都需要有蜜蜂的幫助才能結果生產，為了減少蜜蜂死亡乃至滅絕的風險，現在有一個國際的網路社群AVAAZ(全球啟動)正在發起相關的連署活動，希望藉由世界各國個人的連署，促進歐盟政府，甚至是世界各國領袖能禁用會讓蜜蜂中毒的類尼古丁農藥。

 如果支持AVAAZ對這個議題的主張及行動，歡迎大家從以下網址加入聯署的行列。
https://secure.avaaz.org/…/ct/save_the_bees_neonics_loc_ns/…","1571250596","https://l.facebook.com/l.php?u=https%3A%2F%2Fsecure.avaaz.org%2Fcampaign%2Fct%2Fsave_the_bees_neonics_loc_ns%2F%3FbUmDvmb%26signup%3D1%26cl%3D14350898522%26v%3D105608%26_checksum%3Df4d5008f1136eba55aaafa42a03106864d5007231cd23f643650bfe5707e7591&h=AT1fQzBo_kSwVGAwH5W_QvqGV6e17TOhKzZ3P15Iz6clWv7BTAq_1-mX3650t5RFxIDoEJkAjcg5CJXPPTX1RCl0BLjfAIr_ebllqeyVmnxOHg6YYIrnPDiqIk7Khmo3GAEqMQDjejsUUef5X9tFhjOJ_Y18BGxIkEOlcIcvmgRT3ZQSEBY3g_KTC7XRA-eAqqDZdl8WhESAYbEG7AffnCSyuBZ-Pws7qXsl2PbfP9FZOnw5KHchvNWTx6f0wxtjXOJjHybibmfsEcVTupx5vxzSU_SEq4l2NmnBdq0ZGjztKUt1k2mUMJ7TceloyBFXnIgY9W3_WThBBzIJx0YzomtSuTc3lt_APHChoNKN255aL1YgOPdgjebzargQq3-zkoG5CWdjPkJGygn3ypWrlBpRB_4GHUKRVdTTxveY0WIK_0dzl9u9BZFNs7yt6nTz0llfzI2oOb26qsgM9PS0I1O-YIYOJ28QDDgjO0IMXBh7RloqjUFP6GlqKnJI7PMFMe5b8lmGJC9jVuAtcXTZv0nOrdioAfiOFKha-pXMsl7YgYjWVByawJcCTe1zlSmLrdp5CR_yyue1TG68WA7rFV_A-VM3ioK1EbF87feQCOQ3PLS4T6ov6xe_9kSuOwU9x-bRsoHXfwx3Pl0Q75qKlAKT","https://scontent-sin2-2.xx.fbcdn.net/v/t45.1600-4/cp0/q75/spS444/c111.0.600.600a/p600x600/31402670_6085775508834_1736193456566435840_n.jpg?_nc_cat=106&_nc_oc=AQkos2BcUkXz05rUGkkZ27Wg5-1spOvPsZPkNIa07Hm5Qv1gbaUidUOx5OyDDwt84Qg&_nc_ht=scontent-sin2-2.xx&oh=5ffbbb7415e841fc3c9756534eb99f38&oe=5E5FA439","undefined","拯救蜜蜂：農藥禁令表決倒數中",""
"https://www.facebook.com/fb.yuanshan/posts/10157063777347160","1543722366","[資訊分享]
108年林務局「里山動物曆」 12月1日華山「山產店」首賣！

 
再一個月就要迎接新的一年，林務局配合國土生態綠網計畫，特別推出108年「里山動物曆」，以手繪、Ｑ版方式呈現。限量販售的「里山動物曆」將於12月1日(六)下午1時，在華山文創園區的「山產店」開賣！
108年「里山動物曆」主題多元，例如2月份是低調隱身於自然的森林鳥類、3月是與人類同樣被母乳哺育的哺乳類、7月是不讓蝴蝶專美於前的蛾類、8月是歌詠夏季的蟬，還有9月是穿著鎧甲閃著金屬光澤的甲蟲等等，讓民眾沉浸在田野間、森林裡、沼池中的生命世界，期望帶領大家認識並發現生活週遭的里山動物。此外，每月主題都有各物種的延伸閱讀，希望民眾能自行運用，深入瞭解各種動物的特徵與生態習性，激發愛護里山動物與維護里山環境之心。里山動物曆也特別採用環保油墨印刷，善盡環保用心。

 詳細內容可以點選林務局林業新聞：https://www.forest.gov.tw/forest-news/0063173","1571250596","undefined","undefined","undefined","undefined","undefined"
"https://www.facebook.com/fb.yuanshan/posts/10157211678767160","1548985262","[員山館活動資訊] 員山館豬事大吉新春活動來囉！

 
員山生態教育館為呼應政府提倡的全民防範非洲豬瘟意識，並讓大家欣賞野望影展精彩生態紀錄片，特別在今年春節初二至初六期間，隆重推出「圍爐守護滷肉飯」與「野望影展慶金豬」春節活動。

 
我們將在員山館內安排相關親子闖關活動，讓大家在回答問題時，瞭解非洲豬瘟增進防疫知識，一起保護台灣國民美食-滷肉飯！另外也將於每日早上十點及下午兩點整點時間，播映野望影展「金選」影片，大家可在完成闖關活動或在影片觀賞完後，換取限量版小禮物歐！

 「圍爐守護滷肉飯」與「野望影展慶金豬」活動全程免費！歡迎有興趣的朋友們，闔家來員山生態教育館走春兼拜年。","1571250596","undefined","undefined","undefined","undefined","undefined"
"https://www.facebook.com/fb.yuanshan/posts/10157739923617160","1566700593","[防治宣導]小花蔓澤蘭防治正當時 大家相揪來除蔓

 
「世界百大入侵種」小花蔓澤蘭，入侵臺灣生態環境危害甚鉅，由於繁殖能力強，必須經年持續防除，以避免擴大蔓延。趁小花蔓澤蘭每年開花結實前拔除，是最好防治時機，因此農委會訂定8月15日至9月15日為「小花蔓澤蘭防治月」，9月第1個星期六更訂為「小花蔓澤蘭全國防治日」。
小花蔓澤蘭生長速度快，政府宣導及防治已持續多年；依行政院農業委員會特有生物研究保育中心107年底調查資料顯示，國內小花蔓澤蘭分布面積已由90年51,852公頃減少至5,132公頃，分布面積已抑制減少90%，顯見防除成效良好。惟小花蔓澤蘭繁殖能力極強，仍須經年持續防治，以避免再次蔓延。林務局每年補助各地方政府進行各項防除工作，今年預計防除小花蔓澤蘭570公頃、收購195公噸，其中廢耕農園為防治重點區域，更希望透過政府與民間合作辦理各項防除活動和教育訓練，讓全國社區民眾一起動起來，保護樹木遠離遭小花蔓澤蘭纏身的「樹癌」陰霾。
如欲獲取進一步關於小花蔓澤蘭詳細資訊與防制方法可以點選林務局林業新聞：https://www.forest.gov.tw/forest-news/0064423
！",1579239253,undefined,undefined,undefined,undefined,undefined
"https://www.facebook.com/fb.yuanshan/posts/10157870513472160","1570758905","[資訊分享]員山館國慶連假四天都有開放 歡迎大家來玩歐~

 各位喜愛員山生態教育館的好朋友們，
我們雙十節連假照常開館～
四天假期都照常開放歐～

 在我們歡慶國家生日之餘，
就到員山生態教育館來逛逛吧！！

 好事不要多磨
趕快把這個消息分享給你所有~~的朋友吧！

 #趕快來親子同樂
#家庭旅遊就來員山生態教育館",1579239249,undefined,undefined,undefined,undefined,undefined
"https://www.facebook.com/fb.yuanshan/posts/10157625816702160","1562994856","重要轉貼與分享
帶大家認識蝙蝠的重要性^_^

蝙蝠🦇是唯一會飛行的哺乳動物。
世界上最小的蝙蝠，體長大約 3 厘米、2 克重；最大的蝙蝠展翼足足可以有 1.8 公尺，幾乎是可以把整個人包起來！！

感謝Home的小編帶來 6 個關於蝙蝠的小知識
原來蝙蝠與我們生活那麼密切 wow!!

 臺灣有個人蝠共居的生態農場
可以近距離觀察可愛蝙蝠唷❤
➡ https://reurl.cc/m1lq9

 ——
再次感謝Home Run Taiwan 關注運動、環境和公益的自媒體，讓我們看見屬於臺灣的故事！

 #愛護蝙蝠
#Bat
#員山生態教育館","1571250596","/2016homeruntaiwan/photos/pcb.1302295739939827/1302295416606526/?type=3&__tn__=HH-R&eid=ARDglC-HQ6Zwz3evhAzyE5SIpIfCTPfbQ-dQAx5Z9fUClafn2cQ5wPzq6cTYRDgrWT7VZt1SUuKDL_ag&__xts__%5B0%5D=68.ARBD0VwWM5TiP5lSYj-JF1iYTtRvFVclgiVbuJhlEpghGNkFl7F_ulErhiGzBnUDB2PLlm4-g1Xefy2frfP___yJ-kyd4vu0AYyNgfnk6UwVuSGKYE0FRZmhQnWnq24JyflN9D2H5dfLHhbtxDAuyp_kojoCciBEUi6CXXHkBOCOcSA2f3ck2Blf0v9EGrueHV-aGdOkHat1AGi8hNLA3NIa7ON2dGdUei7GS_0J7jUf5ta-5AqwKsmFWix_M_fi2B_--3GNFGX541UfcUyW5sTMd8l0F1nd3g7ZKyrFqdiW7ogcdQKwIfJswmeIfrbZc9PjdWma20EluMJe_xQ4OrP7STqR5OoZz2a2fOslpYWjIASNaiy3J6di1FYbNry4jKdcUByfPzRZrQP7n0gWv-37A47SmJMX_13Q6pJuXTrmo6PQ1esTbC-adRwy5laqrL_gmhAuI2xXOtLmC2Is9-H1XD0PaNo60Tf1WY17Zl1yhrM","https://scontent.fbkk6-2.fna.fbcdn.net/v/t1.0-0/s261x260/66761717_1302295423273192_3918961923055419392_n.jpg?_nc_cat=109&_nc_oc=AQnuGIaGFViMH8_BA25-r8lRH5Jo7IOAD17qmcliOljXim-5VRcTaGF3BvEIm5VFYTc&_nc_ht=scontent.fbkk6-2.fna&oh=fd853e8f04494cd1fe509d0a9da9a6b3&oe=5E1C8158","undefined","3",""
"https://www.facebook.com/fb.yuanshan/posts/10157832000097160","[Error]: TypeError: Cannot read property 'attribs' of undefined","",1579239261,undefined,undefined,undefined,undefined,undefined
"https://www.facebook.com/fb.yuanshan/posts/10157701841437160","[Error]: TypeError: Cannot read property 'attribs' of undefined","",1579239255,undefined,undefined,undefined,undefined,undefined
"https://www.facebook.com/fb.yuanshan/posts/10157012487842160","[Error]: TypeError: Cannot read property 'attribs' of undefined","","1571250597","undefined","undefined","undefined","undefined","undefined"
"https://www.facebook.com/fb.yuanshan/posts/10157535916547160","1560137226","[資訊分享] 暑期避暑首選太平山 2019太平山暑假攻略

 遊客避暑優遊熱門景點的太平山國家森林遊樂區，不僅有自然步道可供散心健行，還可搭乘蹦蹦車，呼吸芬多精、坐看雲海與日出等遊憩賣點。
為因應這波旅遊旺季，園方將於7月1日至8月31日暑假期間，每逢星期六提前至凌晨2時30分開園，其餘各日都提前在凌晨4時開園，以讓遊客提早入園遊gogo。
太平山暑假期間的日出約在5時至5時30分之間，可在太平山莊觀景台、翠峰景觀道路14k觀景台、翠峰湖環山步道里程3公里處、望洋山步道觀景台等迎接曙光。若天氣狀況良好，望洋山觀日出，還可以遠眺蘭陽平原及太平洋上的龜山島。
蹦蹦車於暑假期間，加開下午15時30分班次，每日共行駛9個班次，數量有限，請遊客及早規畫行程，詳細資訊及即時售票情形可上太平山官網查詢。位處海拔520公尺的鳩之澤溫泉，有諧音「我愛你」的浪漫聯想，多望吊橋更是情侶必訪打卡的景點。
暑假到太平山觀賞夏季銀河，是最佳時機，遊樂區在暑假期間安排4場次收費型觀星活動，供住宿遊客參與，分別有：7月19日及8月9日太平山莊夏季星空導覽、7月20日及8月10日翠峰山屋夏季星空導覽。
如欲獲取進一步詳細資訊可以點選林務局林業新聞：https://www.forest.gov.tw/forest-news/0064053！","1571250597","undefined","undefined","undefined","undefined","undefined"
"https://www.facebook.com/fb.yuanshan/posts/10157856303842160","1570345308","[好康分享]林務局13處國家森林遊樂區 國慶連假期間提供半票入園

 
為歡慶108年雙十國慶，10月10日至13日林務局太平山、內洞、滿月圓、東眼山、大雪山、八仙山、奧萬大、阿里山、墾丁、雙流、知本、富源、池南等13處國家森林遊樂區，提供入園門票半票優惠，烏來台車則提供優待票30元搭乘優惠，歡迎大家趁著連續假期到森林走走喔!
如欲獲取進一步詳細資訊可以點選林務局林業新聞：https://www.forest.gov.tw/forest-news/0064674！",1579239250,undefined,undefined,undefined,undefined,undefined
"https://www.facebook.com/fb.yuanshan/posts/10157112173102160","1545441624","[資訊分享]
鰲鼓濕地森林園區邀您一同歡度繽紛綠聖誕

 森林風手作花圈，共享親子好時光
今年想怎麼裝飾家中，為溫馨的居家營造耶誕氛圍，林務局嘉義林區管理處鰲鼓濕地森林園區特別於聖誕前夕12/22(六)、12/23(日)，舉辦「2018繽紛綠聖誕－親子DIY活動」，活動時間上午9:00至下午16:30，歡迎民眾揪親朋好友一同入館，體驗親手製作聖誕花圈的樂趣！
本次活動中運用免洗紙盤、美術紙、緞帶等及搭配講師在課程中帶入生態概念，結合在地植物素材銀葉樹果實、木麻黃果實當作花圈上的裝飾品，讓繽紛多彩的手作花圈，為聖誕節帶來一絲不同的想像，今年想為家中增添節慶的氣氛嗎？快來東石自然生態展示館一同親手DIY玩創意，迎接聖誕節的到來吧！
想了解更多上述活動資訊，請追蹤FB「鰲鼓濕地粉絲團」(https://www.facebook.com/aogupark)，或點選林務局林業新聞：
https://www.forest.gov.tw/forest-news/0063259。","1571250598","undefined","undefined","undefined","undefined","undefined"
