url,posttime,text,crawled_time,attachment_link,attachment_img,attachment_img_alt,attachment_title,attachment_brief
"https://www.facebook.com/feedmebooks19/posts/2406487762922368","1565782201","《書呆子的反抗：為什麼你以為對的都是錯的？》， Andrea Barha，PCuSER電腦人文化 ＃每天碎念一本書

 鴨子的呱呱聲沒有回音？
菠菜含有大量的鐵，可使人強壯？
「比基尼」因太平洋上的兩處環礁島而得名？

 每一個問題，我都好想知道答案啊！
逛實體書店的好處就在於，可以站著讀完一篇小說之外
還有偶然翻到一本沒有注意過的書，那種相遇的狂喜。

 千萬不要小看冷知識啊！
我深信一個人說話有不有趣，完全取決於雜學含量多寡
這種書的含金量就像是沙裡淘金，看似很少，但很確切知道自己過去從來不知道的事情！！！

 我完全沒有想過大力水手卜派被騙了，只是因為波菜的營養調查報告打錯一個小數點。也沒有想過 BIKINI
取名的由來，是希望取名字的人，追求象徵原子彈試爆的威力！一邊翻，一邊欣喜若狂

 完完全全就是我的菜啊
這種不為了任何其他目的閱讀
單純只是滿足自己的好奇心
十分適合等人的時光。","1571515814","/feedmebooks19/photos/a.2201166446787835/2406487536255724/?type=3&eid=ARA1wFjyvy7nAI0MUY-aV9fXs8PvlBg7We_Jc3E9mTNfYYT8XdWZbtmxA4pLDeeRZqDVSDsJWo4mX9kb&__xts__%5B0%5D=68.ARBFtfD4Ag8iqIE3sUXzi6TTD24SUYL2NpbWuHElgKP9qKPGosdL2R5ya3YoOBvwLWrMDhR_G0PLO3MX7kICKYdhfwsBc57pK5sHAzozCpZaRC7h8t04texMnpaqGZWqEGkGSvqs-zkwAhDYMzCb6JhLdO8oT2_LHcmBBfRCAS7w5ZkZE5zbM9fecZbvUWX_mzbx-E43mnkmgWWhfY24Lp9zkwoeqYFwWX2vL_KLhld5JirKNPh6eD3qhoZeCyxfVEr8nCRu-FzuTnMMnIN7oXv5X-E1lrKyXJZoHDXha_hkFZCQZylaAhF7_jdnnW5Q1cNU7QMAf1r4x8SA90Tm6wYrSbZ5&__tn__=EEHH-R","https://scontent-lax3-1.xx.fbcdn.net/v/t1.0-0/p180x540/68567524_2406487542922390_321003957327495168_n.jpg?_nc_cat=104&_nc_oc=AQl4bfC4uhSyer-QqDuxT82Bk955KBywlh1Sz8846KQjhdVEhdpxKwrjyaXZyBfUWiA&_nc_ht=scontent-lax3-1.xx&oh=08fdb723f28f10a98eb657b5f6b49ba9&oe=5E63348D","undefined","",""
"https://www.facebook.com/feedmebooks19/posts/2376261305945014","1562065290","《月亮與六便士》，William Somerset Maugham，麥田 ＃每天碎念一本書

 書名使用了兩個名詞並列，加上書籍文案很容易給讀者理想、現實生活，對立二分的錯覺。
但，讀完之後，我倒覺得自己第一印象如此二分，是過於輕率的判斷。

 上一次讀毛姆，感觉到很明顯的歐洲特色，每當新人物登場，一定會先帶三四行描述，勾勒外貌，之後接一連串對白進入性格設定。
但這樣寫人，也總是會覺得距離自己太過遙遠，像是讀到全書一半，我都還是非常討厭主角，史崔蘭。

 
完全無法接受他的動機，他背叛妻子、強佔自己摯友老婆、害摯友老婆自殺後不聞不問、張狂完全的自以為是，這些舉動呈現出的人物性格，都使溫良恭儉讓的我覺得這人也太靠北了吧！
偏偏，這樣的人他以自己生命為賭注去實踐、摸索心中的藝術。我總覺得他被藝術附魔，而那是旁人無法理解的狀態，小說中寫了另外兩個人去對照。
現實生活的困頓，反而是襯托他追求藝術必要的條件。為了藝術，最終，瞎眼、病貧病交錯，這樣的情景對讀者來說卻能感受得到幸福，因為史崔蘭已經完成了他心目中最重要的作品。
很奇特的經驗，讀完之後，對這本書人物的印象還繼續殘留了兩、三天。敘事者、史崔蘭夫人、大溪地的美好配角們。

 最後摘引書中一句：
「美，是世界上最珍貴的東西，你怎麼會覺得美會像沙灘上的石子一樣躺在那兒，等著偶然路過的人隨意拾起？」","1571515814","/feedmebooks19/photos/a.2201166446787835/2376261289278349/?type=3&eid=ARC4RNEM1uvJYV1renABtzu-HXn8B-SC4hTSvvgbCVs5rTvK6IWI5wLbabNo1J3BsznLJ5uBFOsObHyU&__xts__%5B0%5D=68.ARD1q5KsF_J7fd_3FVZ3DJnUMfFpCuGHXvhKiCZILxv97D5qWivQ_h5ImlUBbNASre4jHHL-okEDWFnKtKpxD9ltcXR1B5Nrbd13FFOX68xoQP2_bh7V-pYSteEe2jmIGhRZ_Zmu6N6qNGM8Qgi2QCrZMwrJs3d50eIPgY4KE-j7zdGybRFpHyRx-VtRlCsWc7Vl6QnJbve6rnTuLaumxqDQb1l4N1dfEiHOc-EQ1CuJyzP-M6cfbCDETNjQlWn00x7Yuwuq8toxPW35c8xvS2PLGbc_S_zrA3ygqtRZFUEsQttaW4vJNzcEpHZGzA6mYYzODdJellx_OxPAbqoNTdUmZHQt&__tn__=EEHH-R","https://scontent-amt2-1.xx.fbcdn.net/v/t1.0-9/65523914_2376261292611682_5491918644956889088_n.jpg?_nc_cat=109&_nc_oc=AQl0m4El3iSHAsCSe9bHtFNipee_n3flWyOM6Q6CJyJqdcxOZ5pv-TFzelW2EvDvvJ4&_nc_ht=scontent-amt2-1.xx&oh=16c1480fe877e2faaaedf40a5f7d8826&oe=5E2B5B51","undefined","",""
"https://www.facebook.com/feedmebooks19/posts/2376932292544582","1562151601","《小熊蛋糕店》，假面凸 カメントツ，木馬文化 ＃每天碎念一本書

 上市前，在譯者臉書看到這本書，就覺得好可愛
一直跟同業前輩嚷嚷著小熊好可愛，故事也好可愛
好想趕快看到這本！

 今天一上市，就立刻衝上即時榜
足以證明，眼睛圓滾滾，說話天然呆的小熊
在今日，可愛就是正義。

 疲累的時候，翻翻這種充滿療癒故事的書
整個人都覺得好放鬆！","1571515814","/feedmebooks19/photos/a.2201166446787835/2376932099211268/?type=3&eid=ARB0ft6HsF2wgi2rB06mLM6Bqr8m0Kfstw7tq0Ddqw-0iDO9KcKU4_4sN5-4mDyu1U1Dfdx0RNo6GmW_&__xts__%5B0%5D=68.ARCNx52JBnU89RvHyOFWasoSAFhQCQ1rh0X6ineoauG0vntQLT4RX8ePwaPlDK4FljpApFQTcNyCGB6cjSptudJeHw61I06R_GQoez45YCA5KFvMmXUF-P_tDhWvrUEpmw4RveRHevjDSk9ZEakzfSiuZE9Ov8vuVlGDD3rCsAc1QBXIuG0eDuWg-gjcLZUKTVwix4biiSX-QftNOUsgqYf2SqSYFf6Vn9lKY5iDQ7EODsYmYvTwT2037Dkqo9spt125FKOnq6BSR_hrxWVJ0snB5hn9Bebc-KrJn49CBE8qeRsCqq4_VZwW2tZ8Sz9n6WoPDKUGa_tmXY7U_AC68r6NAOt0&__tn__=EEHH-R","https://scontent-iad3-1.xx.fbcdn.net/v/t1.0-0/p526x296/65672027_2376932105877934_5695593007814803456_o.jpg?_nc_cat=102&_nc_oc=AQmeB0XF0XbobmEzXB5yPPPzIIBKLVLXG4yQzXwst0O15cF2zX1SsVtGjjXrpwZol0A&_nc_ht=scontent-iad3-1.xx&oh=e69ee710406f7ee658c906f65099cc10&oe=5E21AE6A","undefined","",""
"https://www.facebook.com/feedmebooks19/posts/2443792479191896","1569741081","【直播中】看到何韻詩被潑漆 
WTF！！！這裡是台灣耶","1571515814","https://l.facebook.com/l.php?u=https%3A%2F%2Fwww.youtube.com%2Fwatch%3Fv%3DqNs0jY083XA&h=AT2U244hHzK52s3xZAuG5HzI4aR-LljeJ2cIggETeT6gx4KCuGOaEkZBwyVl_8mp1nj3rcZFWiWuameva8JwsEaQcWcTX5whU57jNnK5qtw7Ov776EJ4fN6yLdMz1EgUkD-P_LZCn5xbubUnjpy9fym2E53C1_on9VxRyYHy85eS4boxFYlQBqLPhPECJ4eOqGGs5yqoxHIINhBnDSTp7343QntnvX7ZnnSgkERvD-dkSt_HdNtAI0QmRJkIOau1pgExOdCmWpv90DbiSV5GcuDeW7q7uXEK4RnxDQmomnorHu8ex3snlpojn41rHHMncNK9XwEsYvaffZD-a8B0bBKtAfLJTHOYVjOx6vHzt4zuEKHcoAVz7f2Oms5zWOzM9uFnG90BHyBl76lcO_Fvx4wwfzMas-nvR991ceOJPVcSrQ0TvoiNwy1F-kxrY14hH8hK67iPEVh0zcPUstejxZuioK0tPV9AuTycTQZt69vGG3bQAHs5Ph8NKaYW5Tz3EyVrxjyqLONJzlGqAjm_3TtnbaIx6xy5TwIJKx-Me_7Ko5nFU-1xrr6aprN9jHc7khK_Ckj658pXBxUAsNjnnDO47DNygCpwJJj46rR32ClhfdpplVC0LuZOObG_Iw5jfve6g6P8Q3PV2ei85aQ","https://external-arn2-1.xx.fbcdn.net/safe_image.php?d=AQDWQKuD54Fmp0ul&w=540&h=282&url=https%3A%2F%2Fi.ytimg.com%2Fvi%2FqNs0jY083XA%2Fmaxresdefault_live.jpg&cfs=1&upscale=1&fallback=news_d_placeholder_publisher&_nc_hash=AQBPPdHrSyO-Vhfb","Image may contain: outdoor","【LIVE】929台港大遊行 撐港反極權","訂閱《蘋果新聞網》，隨時follow最新最快的新聞➔http://bit.ly/2J25cls 今日最夯動新聞看這邊➔http://bit.ly/2IExRJP 搶看新聞現場鎖定《Live蘋果日報》➔http://bit.ly/2MFsugk 經典熱門動新聞，不看你就落伍啦➔http://bit.ly/2KNzZ..."
"https://www.facebook.com/feedmebooks19/posts/2457257527845391","1571059526","《屍人莊殺人事件》，今村昌弘， 獨步文化 ＃每天碎念一本書

 
嗨，不知道大家是否有趁著連假四天，將累積的書債清償一些了嗎？連假期間，迫不及待地讀了好幾本已經擱在書桌上一段時間的小說。其中，最過癮，最充滿閱讀樂趣的，就屬今村昌弘的《屍人莊殺人事件》！

 不得不說，這本書對書評或推薦者來說都相當棘手。當初吸引我的一點就是在 READMOO
的專欄，看到各路推理小說大神，有人用運動比賽，棒球加鬥牛；有人則是用鹽酥雞、米血，種種混搭的比喻去形容這本妙不可言的推理（？）小說。

 
確實，本書最大的快樂之一，就是在十分古典的暴風雨山莊場景設定加上日本暑假社團集訓的熱血青春，突然超展開插入妙不可言的「特別」元素，混寫成一個全新的類型，正因為前所未見，所以新奇嗎？不，要做到一加一大於二的艱鉅程度可不亞於規規矩矩的遵守類型典範。

 
完全仰仗作者的超凡天才，看到小說情節中時而後設地吐槽各種本格推理的詭計設定，密室殺人或萬能鑰匙，或不可信任的敘事者。對於熟悉名偵探柯南或者金田一少年事件簿的台灣讀者而言，可以說巧妙地利用這種對推理小說的既定印象，創作出一種哈哈哈我知道你會這樣想，但並不是這樣唷的智力嘲諷。

 偏偏，作者非常誠實地把線索攤開在字裡行間，嚴格地遵守與讀者公平對決的條件。這種敘事技藝上的高難度表演，無怪乎可以一口氣征服日本諸多大獎！

 
最後，看到有些書評會嫌棄人物的性格不夠突出，難以辨別，確實是這本小說的些微瑕疵；但我大膽推測，從一開始作者的創作目的肯定就是朝向影劇改編為目標！可以仰賴演員演技的部分，有所取捨地放棄，將小說核心集中在情節的推進與推理線索的埋設。

 相當高超的娛樂小說！
（要不爆任何雷，也真的是充滿挑戰性呢）

 PS：這本書特別裝在銀箔密封袋裡，也是既奇葩但十分討喜的混種設計，還有我個人私心大愛桃紅色書名，非常反差，但又十分契合這本有點奔放亂來的小說。","1571515814","/feedmebooks19/photos/a.2201166446787835/2457253471179130/?type=3&eid=ARBASK5QO6KyoLMhU5zwHvGGESs3yg6ccoU2Y3oNZ1vbjG2V3UKHiOF-UidAMqOtx7ABmwEKrnLf-fJT&__xts__%5B0%5D=68.ARCDk7lV3rCfC6BtNq3MEZfSM441r3Qamf0angJLipUeLtlE241UU3DzV0yYi1XCvwwFoxf9SYpk4NP0JC28PQLZyiCvh0_Gev69r6uJfakCUVew9o89Ve90ufsDaRuOghcaJkIOivSoNUyXMr_dgQHcbpUU4Z4aZXI1Ok_00gOGjzlZonYruzEsy0emRJqiiwOhX3aIyEV6bzyIp4RJkVTO_p6wyHYn2ArgAMlbQRKn1dAu5bYmWh0StrWOPxsIPGh-aULDAmdPG3SyWXkRmuURyL_5udpZ1yipt7RdC4IB2pnaj0t0gEELPT4hspDf7nj-gVNshxD9kYnv7k4km47l0iX7&__tn__=EEHH-R","https://scontent-frx5-1.xx.fbcdn.net/v/t1.0-0/p526x296/72165263_2457253474512463_6172099296930824192_n.jpg?_nc_cat=103&_nc_oc=AQkVvLM3RRhyu6AyzRIia7EtNsPVSQT3XInPB7YiP0AX0f0HqtHvNPo4KBeQRi8YG7QL50QpfOEpXf7SnA2_cDlO&_nc_ht=scontent-frx5-1.xx&oh=1901e127ee5ea2d9464ec6f16f93e0d2&oe=5E16A01D","undefined","",""
"https://www.facebook.com/feedmebooks19/posts/2451877761716701","1570549457","《鯨吞億萬》，Tom Wright、Bradley Hope，早安財經 ＃每天碎念一本書

 去年的重磅報導巨著《惡血》，《鯨吞億萬》足以相提並論嗎？還無法論斷，可以肯定的是至少本書的出版，只是個逗號，現實生活中事件還未完全落幕！

 
最後一節的小標「發律師函警告書店，不能上架這本書！」聳動嗎？一點也不，在前面揮金如土，豪擲百萬美金的奢華派對情節，或是層層堆疊隱藏的金融詐欺醜聞，之後，對出版或報導的控制反而顯得太過微不足道。

 全書很適合對照著《華爾街之狼》這部電影一起看，戲裡戲外同樣精彩。
股權、基金、投資交易
豪車、遊艇、藝術品
世界規模的巨星、高級官員、銀行、選舉與政府發展特區，幾乎每頁隨手摘出的關鍵字，都可以嗅到富有與犯罪交雜特有的臭味。

 
若不論手段，純以「獲得財富」這件事情而論，本書描寫的主角，可說是個兼具野心、智慧與謀略的年輕人，善於等待佈局，懂得掌握人心，把人的鉅額財富從口袋掏出來放進自己口袋的特殊本領！

 
除了看那些高明的金融投資騙術之外，本書另一部份的閱讀享受來自不斷出現的豪奢派對場景，所謂貧窮限制了想像，沒有預算限制的億萬富豪，可以怎麼玩樂？所謂的富豪可以怎麼追求，討女朋友歡心？

 你知道的，這種故事的尾段，往往由一個很小很小的人，可能是一個無聊的瑕疵疑點，誘發好奇心，在逐步地追查之下。

 最後，泡泡破了。

 每次看這類的非虛構寫作最後我都心生疑問：假此此時此刻的台灣有同樣的事件正在發生？而我們有同樣勇氣的記者能堅持追查下去嗎？甚至，我們擁有台灣本土的 Tom
Wright 或 John Carreyrou ，能寫出震撼社會的調查報告著作出版嗎？","1571515814","/feedmebooks19/photos/a.2201166446787835/2451877645050046/?type=3&eid=ARBwzw1lGOVv9KUYzrywy1bd379auY8fXwYGsIhhYi27womeM0cdj6uAxYsybN1mhewx0jc0kVoCE7y1&__xts__%5B0%5D=68.ARAbdWvXpCiTh94lH15LtEUt4QLBpFTKNV0CoGmrKLo9GYTgM9B7bmLBws-P_eaOgbgt2RmmnHLvcNCp08nozKnOcGIhOu7BbDKyROM4LBognPxEA-WE3bRh84EuzzWkSg_9uaC-haDvFzJCf9xpD-fW37u9vmM4gvQ463VG_Z2d155GE_E0ReRDcrZ5LEDDxDzDW5uqF-IJRWaqGicy7mTIPLxVTi9bQEEzTS84kKoaildkS5Lrr12PW6d1al5LR8oibP4BHowVrxmApfTUdBPcA10bEoWWE-vqzS1xYYFBEbcz49Y44KCE_zSVISdDxEmx0pKhYhb56F_P9jm4JJYAhpLo&__tn__=EEHH-R","https://scontent-dus1-1.xx.fbcdn.net/v/t1.0-0/p526x296/71755934_2451877648383379_9012114776091787264_o.jpg?_nc_cat=101&_nc_oc=AQkki5CrzD7SYp43_KpTN6r0ngGPoSyIRHsYy3iEO6WZh3-zGSsm6tzJ6DhmE6l6q3a0pHWszSaZGx_sqk6MURgJ&_nc_ht=scontent-dus1-1.xx&oh=83a7a195a9bf7189ef8c1989e5c61372&oe=5E62A7AD","undefined","",""
"https://www.facebook.com/feedmebooks19/posts/2340868889484256","1557831600","《台北爸爸，紐約媽媽》，陳俊志，木馬文化 ＃每天碎念一本書

 刻意跳過一天，特地選在 5月 14 這天發文。
基於兩點蠻私人的理由，其一是因為今天立法院 748法，逐條審查，結果還是拖延到517表決才一切落定。

 其二是，我高中最好的朋友今天生日，希望祝福他生日快樂，同時也希望這個月過後，他可以順利結婚。

 
《台北爸爸，紐約媽媽》週末讀完，心中被強烈衝擊，怎麼會有作者那麼敢？什麼都寫，所有陰暗的、憂鬱的、痛苦的......傷疤、死亡、離散的家族史。特別是〈姐姐〉這篇，側面寫姐姐最好的朋友找尋自己二十多年那句，很難不哭。

 豪商家道中落，隔代教養的小孩，互相照養的兄弟姊妹......俗且常見，很台灣鄉土劇的情節，每一篇讀來文句都像把刀子，輕巧無事地滑過肌膚沁出鮮紅的血來。

 
作者怎麼承受的了呢？作者怎麼敢寫出來？難道不會害怕，不會恐懼這些家族裡的陰影？如此無所迴避的全數坦露，反而極端真誠使讀者以為看透了全部，卻在幾頁後又有更多苦難襲來，一層一層的，一如現實生活。","1571515814","/feedmebooks19/photos/a.2201166446787835/2340868756150936/?type=3&eid=ARByOTBZ59EyqVktT-WHjz--utPQjZZgdSdM9vgAkLrA7n3f6RMIR5lWryF92HN3_KmgWfBZyUW9EBw3&__xts__%5B0%5D=68.ARBOl9OZZHjJzqaVfhxYCV__AQ_tXmnMG_h1ImOSrkZIDZC2Et34RVRNUZBQ73u_BRCMNRgD_vMqbKfcWX8XEByqR0YgZBXdpXHPD7afXMn6xRUEYvVYAJMXHe0UiKXGNC78V6VX7fDKkTjivfkjUO0XZilmcwHa7vU3YQl3jtyNg4sb5-osQDllN9XPcIbmQkzSVrSC3IrcOOUoyUHc14YnM67fl86_oSW0esLF96BBMxPtMVaAz5hwEKtTK5Gxz1QCvyzlldqCNDDOvWjxl9cY4z7u7KbM2pSDR2vGAC3OwVeyUld3tAFZfw2B1BZo0HMZW1IBsKXe0AWkCZszw3EhPAiQ&__tn__=EHH-R","https://scontent-ams4-1.xx.fbcdn.net/v/t1.0-0/s526x296/60423531_2340868762817602_7162046729892659200_n.jpg?_nc_cat=102&_nc_oc=AQn6BMO3n6STDWolFT1sUBNcMhRj8FUtQR22IbTG3da8COl695wVYidZtSD-ERy_iME&_nc_ht=scontent-ams4-1.xx&oh=0547b5ecdd3c543aec6d8121fbab1d5d&oe=5E178D81","undefined","",""
"https://www.facebook.com/feedmebooks19/posts/2359812544256557","1560144918","【午間有感】
音樂給人的感動是永難抹滅的！

 #家駒生日快樂
＃香港加油","1571515814","https://l.facebook.com/l.php?u=https%3A%2F%2Fwww.youtube.com%2Fwatch%3Fv%3Dqu_FSptjRic&h=AT3iFsVTjiabWNwu0iJcJR8U0J6op_OvV6rlT2sFbjfak6ZFPvQvr6yCx3ONXGE05TzsNAWlSGYlJKWN0oTQ-LoiK5uHcta3zQGVh5TenYNNcjUgQPZbzgSk-1mvWslsbA13PvexC0HppLL-rzk9jYGPkeUJH7IhRljTWudjzrMGAapa3-c25gOKeZLz42vM1huT5D2osML9wuUB_vLMa_zhypwuUhBfb71IKlMdqDOWF75Mw2lN2hdXYMhsKgvQwrUUnaKlEHuLkswwSk8BiH4Vv-Xsxmu-gtlRtMkcS6IVfAs7qSXCuPGTphOt7RwCnEmS7kdfI13-GHoKvcQ7rGuVopjMzxEqHlDZ_em-bhlx_ieC4ifyAUMYtQSycn8b7jpXGerI_zXJcF-pYpxRBMOmJcjkWM8PSVaVKumR8AU3RQlM5TMSd5cLXMhglpgNJuFHH-DV0bEqHSkDl7gRpeDx14tioQ2XPEAW2CGYIzkSRmPKHgl3UgHGQtiTF-9ABLwIyuYxkNohGYdHTrLJCfvvr6ZhdlVYdfw3zRfeS9Li-a0HPLXFidWevfqiqI_sti4xDDlfaYjW0rsxErUmDDtJnMN4CtRxW4rvjZsVkC2auXmE4s9Y4RhodW1_X1g78uGtyMvZhHiLbAA-dO0","https://external-iad3-1.xx.fbcdn.net/safe_image.php?d=AQC4nnvjYcLwz164&w=540&h=282&url=https%3A%2F%2Fi.ytimg.com%2Fvi%2Fqu_FSptjRic%2Fhqdefault.jpg&cfs=1&upscale=1&fallback=news_d_placeholder_publisher&_nc_hash=AQDamwX6SWYuhJJf","BEYOND【海闊天空】Music Video - 心の點播","BEYOND【海闊天空】Official Music Video","【ROCK BEYOND】 不管世事變化多快，在音樂的世界裡 一切 海闊天空 珍惜BEYOND過去的十年 期待BEYOND未來的無數年 〈海闊天空〉是黃家駒為BEYOND成立十週年而作的， 刻劃著他們十年來的心路歷程。 記得與家駒談到此首歌的原創動....."
"https://www.facebook.com/feedmebooks19/posts/2457780734459737","1571106406","【晨間新聞】

 嗚嗚～西方文論界一代宗師 Rest in Peace.","1571515814","https://l.facebook.com/l.php?u=https%3A%2F%2Fwww.theguardian.com%2Fus-news%2F2019%2Foct%2F14%2Fharold-bloom-literary-critic-yale-professor-dies-89%3Ffbclid%3DIwAR0H1yUaUZJrrR1cju-pAv5QrUAmu9-BZSrj4n8kYR-H1cGjwNw64VQDNNs&h=AT31Ogs6JxX6MgFOm5-FiWI6eKfYb2OYcFqZwQbuYjeelWzoSTDzEL0XbrDhGezyXPV0BZraRwr7dAJRjWwSBSCu9mcB--SnyOUEt5khxwM1XVCpXhv3vr6C_ddLfvPsoL8ARhqlDA_7KE-u9KVWLsT2OJ15QL1eeiHrXfhsijBqCFUfPwR4_tAQAUp0ebnrXjRBKbs63Uejs96sB6MzKyiLiMcuH35gFCBzsWfo6RPols8c5tHKw5PBuJFtmXDz7vuGNMx3K0kbH1ILmc0SMYBwqPgvx7KUKqGhEtefNTAl71fg_nbnGYU8CmoFdO8FzV2N9HprE1Wy6YJq1RqhaioBi2W9mAjFrRRgT06uxWiKjZ0i7LfKH_gV5-VktsNG3tQeSGLR6-ieYHQc38q8IKL_X_y7VVUc4k6-fHD-gxEV4weJNBY2qPF6mdzyKlShuQb86HkzkdL0Tp_3NN29p4ki8wq1KrCRXPstatCtgWTsm-ylMcDZXSp5diWFb7T1QXKn1oskBcpr-9KnSEaBNFOexd84toyQPuY3tiluHUwjpSQ4f-X8PH-A-n1PoKa816SP9GorDY5bjRDIOemDT5Xfa3OkkQ2f51NVEuzRU0eScVnJzwfCoZbGljy68YavAaWtsYUCPHcABPbWvvD16PrLAC53cRdaSyM","https://external.fymy1-2.fna.fbcdn.net/safe_image.php?d=AQD3e7tqvvsHc4YG&w=540&h=282&url=https%3A%2F%2Fi.guim.co.uk%2Fimg%2Fmedia%2Fd0c565d307e8ab13a413185c7fc69f187aacd874%2F0_187_4896_2938%2Fmaster%2F4896.jpg%3Fwidth%3D1200%26height%3D630%26quality%3D85%26auto%3Dformat%26fit%3Dcrop%26overlay-align%3Dbottom%252Cleft%26overlay-width%3D100p%26overlay-base64%3DL2ltZy9zdGF0aWMvb3ZlcmxheXMvdGctZGVmYXVsdC5wbmc%26enable%3Dupscale%26s%3D374e144f9adf2b6977539ec11efabe8b&cfs=1&upscale=1&fallback=news_d_placeholder_publisher&_nc_hash=AQC4WaAY_qWatQcW","Image may contain: one or more people, close-up and text","Harold Bloom, author and literary critic, dies at age 89","He prided himself on making scholarly topics accessible to readers and wrote the bestsellers The Western Canon and The Book of J"
"https://www.facebook.com/feedmebooks19/posts/2416091921961952","1566826719","《一個青年小說家的自白：艾可的寫作講堂》，Umberto Eco，商周出版 ＃每天碎念一本書

 經過上週連續小說大爆發後，突然有些惶恐
畢竟書都還沒出版，單憑自己過去的閱讀經驗去想像一本未來之書。會不會自己下的比喻過於誇張了呢？或者自己過渡幻想了？

 一連串困惑的自問，都讓我想起睿智且迷人的艾可
雖然書名譯為一個青年小說家的自白
雖然是一本出版將近五六年久遠前的書
但是每一次重讀，都還是讓我感受到新鮮有趣
艾可實在是一位太討人喜歡的文學理論家
真的！有沒有幽默感差很多

 記得學生時代以及後來開始工作後，爭論到文本的詮釋時
總是很容易讓人爭執到面紅耳赤，有些不太愉快
通常這個時候，我總會想起艾可說過一句：
「我們無法確定哪個詮釋比較好
但我們通常知道哪個比較蠢XDD」
這句話記得相當久，一直到上週末重讀才注意到原來是出自這本書。

 在這句好笑的話後頭，艾可卻恢復教授的姿態，提出很古典正規的文本詮釋方法。我們必須反覆地將自己對文本的猜測對照整體並檢視。而我特別欣賞最後的結論句
「如此一來，文本內在的協調性，便得以掌控讀者失控的詮釋慾望」（用到失控的詮釋慾望，我覺得也好好笑）

 呼，安心許多！
只要，書出版後，買來讀
那麼我失控的慾望（詮釋或消費慾）
大概就可以獲得掌控了吧？","1571515814","/feedmebooks19/photos/a.2201166446787835/2416091858628625/?type=3&eid=ARBy00Jqwo0jIBcYcmhuBAct3pp0LWsKhA0Ig53S3cUcL_opymkv6ggQ4v_6pg2EUkv3UApMPrjCCEE_&__xts__%5B0%5D=68.ARDrkWQCbD-_PZTki6rycnIq8igwtrCy1wfRivX-9FZLYlxaIb-wDtXQpHCOiEMtE63KOLSw_FlOAxHf5MS5Mn-Dyr_vn20ul-ImHKmxUhyol_GeA5xo1UOXTmecoDX4rWzgFf5L4wezgeaK796YG0XMI6uFJqj6Sw6N4eeFjPAPk0FUfQI6fjjNLqUOvOu7E_cPmOThrnpiY04lgjLnXhUsA7eJV1nKP1yVfiQIW97lOs-dLlBSII_MyA_XZxUNHpAWLLw1LsVE0bfAp0Gz-_0Jl1wnhJ67tSv6YbZoxby0Th9BE7_FCo0MhznmLxym_r1VP8B4ArQovIRT2edgLTn0ELUd&__tn__=EEHH-R","https://scontent-lga3-1.xx.fbcdn.net/v/t1.0-9/s720x720/69752482_2416091865295291_78243927492132864_o.jpg?_nc_cat=109&_nc_oc=AQmhBlOuZa9ZAcAxcIqUoFrnTBsIhUF8NSf84mb2TKwpYBakXdZJhMDBMleQdiWUPHg&_nc_ht=scontent-lga3-1.xx&oh=cab0d7c3d4964449d3653e5cc49fe8b1&oe=5E2FC656","undefined","",""
"https://www.facebook.com/feedmebooks19/posts/2413864532184691","1566574790","《記憶的玩物》， Blake Crouch，寂寞，出版日期：2019/09/01 ＃每天碎念一本書

 
今天原本做了一個新書輪盤清單來解決自己的猶豫掙扎，九月的臺灣創作還有陳雪的《無父之城》、吳明益合著的科普《黑潮島航》、張大春《城邦暴力團20週年紀念版》。除此之外，還有李娟、路內、阿城、徐則臣都紛紛集中在這個超級大月！

 說真的，輪盤轉到哪一本，都很值得。所以我都不選XD

 想了想決定選擇碎有些期待的翻譯小說。前一本創作《人生複本》十分精彩好讀的作者，Blake
Crouch。這本新作主打記憶與時空穿越，光是題材本身就足夠吸引人，更何況《人生複本》珠玉在前，一本高品質的娛樂小說，所能獲得的閱讀樂趣絕對勝過看電影或者追劇！","1571515815","/feedmebooks19/photos/a.2201166446787835/2413864065518071/?type=3&eid=ARCi5Fk3CW3YKgr1n08NUOkmvFniHuPxEVn6Hwkj0O2KSp8DO7pP2gCLZvBy6bwN-pONzJFvdvlKjaf5&__xts__%5B0%5D=68.ARB9zgh7zDfh97z2m-YLGlTMKRTP3aOZnjh5TcDv6bj39QBM0DOGp0acjCwYiEylTXmKsnSxN4AJV7IHQkVz-29jvBVS12MWkrwEwWGSR_fhweMD5ff6WBdX_4gOX_zgHSi0iG3oaVR4wC-tTh_Eoa8Tc33MYhDxufQmYJLnPh54bg1ScTSLNVNPkUVSFQxGRBFEU6z0xuoC5J2QXBO6ZhornlAouKazPxo802Qn7TQkWST-46_9Jt3BVS76lQVnu3gMxdlpIeDnR_ysnEL2Yunyt6cJnSsO7ccDINw8sASW2LglqSOVNVxJZ39ljQGdf3DaQ5qIiUusM5eiFS53kA8zftCw&__tn__=EEHH-R","https://scontent.fhel4-1.fna.fbcdn.net/v/t1.0-0/p526x296/69302780_2413864068851404_1608318708067860480_o.jpg?_nc_cat=108&_nc_oc=AQkvxd5pbV4E9_AF4A3Evws0s5hjjAlQ4SgR6WxTchOjRAX28OKFQOQmv9Gk59RNVjY&_nc_ht=scontent.fhel4-1.fna&oh=bb1962a4e794e95075dc714cb713d6bd&oe=5E1B75D0","undefined","",""
