url,posttime,text,crawled_time,attachment_link,attachment_img,attachment_img_alt,attachment_title,attachment_brief
"https://www.facebook.com/feedmebooks19/posts/2427238504180627","1568036434","《高難度溝通》，JASON J.JAY、GABRIEL GRANT，楓書坊 ＃每天碎念一本書

 在推書這件事情上，有一個困難點勢必會被讀者或粉絲質疑，當出版社主動推薦邀請的書，或者所謂的業配邀請時，該用什麼標準判斷呢？會不會失之公允？

 
這個問題困擾了我一段時間，通常都抱持著一種做善事結緣的心態，與出版界的同業先進們一起互相努力，大概一部份也是基於自己的天真，相信大概一本書無論多寡，總是會有讀者需要，我相信這種書與人之間的緣分。

 
其實以上是應用了這本《高難度溝通》裡頭附錄的練習寫下的心聲。因為過去，這個心結自己一直很難克服，也難以啟齒！這種個人內在的僵局，有時候往往是沒有真正搞清楚自己的主張或真正想要關心的事情。

 
動手跟著寫下練習引導的問句，才發現就算會被質疑只會說書的優點或吸引自己的地方那又如何呢？我想要努力創造的是一個自己腦海中想像的畫面：下班回到家之後，有點累不知道做什麼，打開臉書看一下，最近碎念的這本書好像不錯是我的菜，找時間來去書店翻翻看。

 如果可以達到這樣的成果，那就太棒了！

 
雖然書名是《高難度溝通》，但我讀完後，覺得這本書試圖指引與教學一種更本質的，人與另外一個人之間的交流。在今日這個時代，或許是更艱難的一件事情，我們快速地踩定立場、敵我二分，大聲宣揚自己的主張與理念！那很好，但怎麼去跟不同立場的人對話？怎麼去突破那些尷尬、有些痛苦的對話情境呢？這本書使用陷阱的框架，分析闡述我們那些陷入僵局，動彈不得時可能可以替代的想法與管道。

 也許未來哪一天，所有人都可以依循著一個善意溫暖的本意出發，達成互相尊重，建立共同目標的溝通。或許聽起來很艱鉅，但無論做什麼事情，都可能尋找到機會！","1571515819","/feedmebooks19/photos/a.2201166446787835/2427238357513975/?type=3&eid=ARBIv7IjnhyZq8MgcWhMpWkl3QDoNO6APfX1i0YOQEof3oGD1_hk2k54UT5XdAiFiB88agvHwDt8mG6N&__xts__%5B0%5D=68.ARCaSI2EIuw-QvWy05t-ii_M6XKiOG9YGEsfVU1TTMYQnxfNuFMpJDcryBMEeKAfN4b7PPGh1-wj07wSjjPz9oXWoRbjIa2a8ew-UpJCX4sCRaTfR_-hQOQKgo0HyQv-ZjoDih0zVuoH3JoOU6oruc0b9LXN11I7za70bfVqpIlC1gK8oIAs0QO5fnKb8ob2lnMTu94caY--TZeMxeDn7EVv641_FqDflhiTxJgHXnTxfSVpuFe2NqMI2NdJt7HBKRI0GCCjmIME7gEzCu5AFk5L0uYvfONfIU2RolSB6DQsLqHz1szHlFG70iga57-YlM9B6SKGSgEt53U9IMMzKTHxS-fj&__tn__=EEHH-R","https://scontent-frt3-2.xx.fbcdn.net/v/t1.0-0/p526x296/69926159_2427238360847308_6688579168793264128_o.jpg?_nc_cat=107&_nc_oc=AQlzEfByBFPq1uCDyRFnYXT36ytwndjJE3An3PDuexC6QZVNLxNGmXKRETF56D3Cikk&_nc_ht=scontent-frt3-2.xx&oh=95c3eececb36d8ab8066c9608856708b&oe=5E1D4739","undefined","",""
"https://www.facebook.com/feedmebooks19/posts/2346569485580863","1558522801","《我們的青春，在台灣》，傅榆導演 ＃每天碎念一本書電影特別篇

 快要下檔了。對這部紀錄片的想法一直處於零散的狀態，大概是因為太陽花之後五年，終究有些看不見的後遺症留在身上。

 記得看完《我們的青春，在台灣》當夜我做了一段十分長的夢，醒來後還很難忘記。夢境中與一群人不斷地在
PTT上爭吵《霸王別姬》張國榮演技，接著提到紀錄片角色與演員的區別。

 主要是關於紀錄片的一個倫理問題：「人物（或角色」與「演員」身份的落差。真人不是演員，無法符合戲劇性要求。

 
而我覺得在這部電影中「演」得最好的人，是鏡頭中偶爾帶到那些旁觀的群眾。對我來說像是種反向的後設，這樣的鏡頭把所有銀幕外的所有人，全數拉進影片內，放進同樣的位置。

 一面觀看，一面召喚著當時在議場外的、整個太陽花運動之外的人，那些對此一切感到陌生茫然不解的群體。

 當陳為廷喃喃唸著「好啊！之後不要神。」
第一瞬間，我只覺得他太過自大。第二次回想這個片段時，當台灣民主選舉，選出民眾以為是神的政治代言人。一旦神不如我們心中預期，我們就像大家樂風行的時代，把木製神像扔進臭水溝裡，只因為這些神沒有保佑自己發大財。

 既使這麼說很殘酷，但所謂的青春期，電影給觀眾是青春期成長必經之痛，那種痛在說「我們只配得上這樣的政治代言人」，羞辱一般，啪啪啪地狠狠打響我的臉。

 
我們的青春，我們也是「他」，是台灣這個島嶼上的所有人集合體。無論引號內他的名字換成柯文哲、韓國瑜或是蔡英文、賴清德、郭台銘、王金平。那個名字無所謂、不重要，只是個符號學意義上的能指。內裡是人民意志的總和。當「象徵」性符號、與其「代表」精神的不完全重合，也無法抹除「這些人不能代表我」的責任撇清。

 這也難怪最後導演的情緒反應會那麼大！
當理想或信仰破滅時，多痛，也只有青春期前的中二，才會相信這世界有神可以完成所有願望。

 走出戲院才發現這紀錄片記下的「真實」，多可怕。","1571515819","/feedmebooks19/photos/a.2201166446787835/2346565992247879/?type=3&eid=ARB4OVPYf3h_SZ-o1CVbTsLrRhROmsno4yMhyr2teDMACZv3XUB8d05LfLkzJd88Z5PyA8rJM3_yb5kP&__xts__%5B0%5D=68.ARBcIsxTwU0uqF3oXIqE0-4FYS1YDa0RztjqWRPherPj5mijyMiVomLsHnw57tY_OyJOKh_mZZvbGZ-gpGiuteMl5W0x8ecJhapEd1Q6yVQRr1uuUKH0oNMempgltmP0RTqdfpw5MLfi7oX3xTtXVPrjDphSIj2Icfo3gHVSJXM0-LsxdPh_CNYrPwq_x7E_XzFNnjpGn1qNP_kPMDb2GJPOhsAEUqaXYyQ8c38K_Z1f7xvU6L03YLj5l5bfS_n8WB-zEjR8j5OtoZYlJ_-grv_HseUlU2fPzhaE5p1vki1YOHZzoI5RkrD2aZ3nVXArMKEF1s6PPsITpXpuIZyjOjBF5rU0&__tn__=EEHH-R","https://scontent.fgye8-1.fna.fbcdn.net/v/t1.0-0/p526x296/60796552_2346565998914545_3763620957483171840_o.jpg?_nc_cat=100&_nc_oc=AQlpQxX-HmCa93HaAq6zpt1fI1EkHl79WTtSe_rLPadqa3558j4mPpkxsnD-A4qhIbw&_nc_ht=scontent.fgye8-1.fna&oh=24b625a01038b276cf817db534b9bfa4&oe=5E5A5015","undefined","",""
"https://www.facebook.com/feedmebooks19/posts/2425247844379693","1567830467","沒想到在九月七日，見證臉書的讚數里程碑!
謝謝大家的支持沒想到在九月七日，見證臉書的讚數里程碑!
謝謝大家的支持","1571515819","undefined","undefined","undefined","undefined","undefined"
"https://www.facebook.com/feedmebooks19/posts/2435399953364482","1568892601","《蔡桑說怪：日本神話與靈界怪談，有時還有臺灣》，蔡亦竹，圓神 出版日期：2019/10/01 #每天碎念一本書

 蔡桑又出新書啦！今天開預購～


 想到大支兄弟 MV 有句對白：
「無論如何，都要做(面子)給少董事長」

 此刻我的心情也是如此，有些作者無論如何面子是一定要做給他，這是我心目中做出版的義氣。


 雖然蔡桑的形象看來中二，有點壞壞的江湖氣息
但熟識之後，會發現是個對身邊人斯文有禮，善意相待
幾乎各行各業都有他的朋友。

 此外還是個擅長許多事情的才子。除了學校的教授工作外，還跑去做
YOUTUBER，平時唱歌、畫圖、上課開直播，打人中之龍、幹剿時事議題，做這麼多事情有時候都很懷疑，蔡桑到底是用什麼時間寫書啊？
腦海中立刻浮現他會冒出一句「給貢欸」，在鏡頭以外別人看不見的時刻，不出聲低調的努力。


 總之呢，這本《蔡桑說怪》，光看試讀篇章的文字就知道保證是蔡桑本色上演（連封面內頁插圖都自己來），用最淺白好笑的語言，去講一個認真的民俗文化知識。

 不用多介紹，日本民俗本就是他的專業守備範圍，
再看到試閱內有一頁是「猜猜我是誰」，真的是笑到不行。在我心目中要讓人發笑，絕對是門超難的技藝，不然網路上也不會有那麼多尷尬冷場的表演。

 蔡亦竹的書，就是頂級的寓教於樂！
試試啊！會上癮","1571515819","/feedmebooks19/photos/a.2201166446787835/2435397390031405/?type=3&eid=ARDS3D-xVBxF2HY6TXGNd3MJHTN4WbzysnVn5sL3hXxFczi04hwVsG2pZER-F-AvwCvyb7J-JN-iTQzb&__xts__%5B0%5D=68.ARDK_KWlWKc2ZoyEauGWFZ_Q_Yl-f4mNcmo21EzfYr2jbsi8e5Ddgrnp--3hopPRgBp5NTPrkQR0joYNEVedKIV9HnFTXh1LNUEujOm6kcajDROlt8EBwWxClZosa5bzxZ_da0bU_ltEv8TuphUZ_RIQ1V6dT6SLH1Evn43gdcFmqStBTSzA0lSUaPDZlkswxBLElUfo7PwYg_swajPckBdsAiqiqZ3T0IeZNXUFD_TjOpe_EaM6l4h798yVOBQx4VX7T08fp1WRFLRzJsw68yvdWy8RMmOCV-9d5ecM1IwxWTnssBoDQ8xAT35k-MUyn0fO1pIY7Z4RczPMNXiYfUL4ANxp&__tn__=EEHH-R","https://scontent-cdt1-1.xx.fbcdn.net/v/t1.0-0/p526x296/70693383_2435397396698071_953966919965212672_o.jpg?_nc_cat=106&_nc_oc=AQnpZh7lp0zPoN89Rqg5hC6Pq4Ay_209siyQwA-PW-SrbMnwiyylZG4NihOkHLn6ixFE8thdO6SLLv9dmf2QZCEt&_nc_ht=scontent-cdt1-1.xx&oh=151ef296211ee42b666cb5eca167f196&oe=5E310360","undefined","",""
"https://www.facebook.com/feedmebooks19/posts/2432048753699602","1568536428","向蓋亞編輯鞠躬XD","1571515819","https://www.facebook.com/photo.php?fbid=698078810661402&set=pcb.698079383994678&type=3&__tn__=HH-R&eid=ARBSyBs4x6ptHUAhP3kLtXSertXvap-mbZSCv7-jfTshYCtrBCY8gKbdKYCusDkopSI1rxpqxePu0uiL&__xts__%5B0%5D=68.ARAeug6O0NSQvmRiQ9azCHUclnoYOT8CBHsh7NWjPNS3T0O6wN5XYuH2Rbtv-4PwUtDUq-Q5XUx0a5AutxSkzO78cbcYz7iEWEU79HoNK0knMlGnuZ5wUIvkeBGi8DmneLeHDAY5P2HUeSfgXtYVBRSWYb6uYehnjdb4DjFKCpGVPpID9k-44CaUE6Z6eKYh8GRqvdT0e_T3M4Vyj-lRkOicyu5Q4oJId_P-JD2kWqwesthamIG-Ge5rUyL-F3Yxn3Xs296IkZh0AK8M83_NCmlJBo91Ggv5MsmXT4re3jOloBBhBT7EuX2pSrMZZYhcyJ9PnZxMqeAFD4lBBLH9K8O14zmm","https://scontent-frt3-2.xx.fbcdn.net/v/t1.0-0/p261x260/70244514_698078817328068_5609607891397902336_n.jpg?_nc_cat=109&_nc_oc=AQneL2R9eYlOgq3xzwP8WlKPVLZJxZ9Ci8ZRfuTv-u2jNztlrQvP4kyT9DbdqCZ4tNI&_nc_ht=scontent-frt3-2.xx&oh=ee791c168c8f753bae8a6e2978267e4d&oe=5E637944","undefined","10",""
"https://www.facebook.com/feedmebooks19/posts/2341442156093596","1557899070","【午間有感】

 某書局粉絲頁推了一本簡體新書，可是台灣五年前就出過繁體中文版了。

 感覺微妙","1571515819","undefined","undefined","undefined","undefined","undefined"
"https://www.facebook.com/feedmebooks19/posts/2439573739613770","1569324682","《旋元佑文法》，旋元佑，眾文 
出版日期：2019/10/05 ＃每天碎念一本書

 天啊！乍看封面，我完全以為是自傳
沒想到是那本十多年前的夢幻之書重出江湖。


 《旋元佑文法》於1998年問世（原名《英文魔法師之文法俱樂部》）


 看著熟識的書名，召喚出許多夜間待在學校自習，伏桌拼讀的記憶。還記得高中時的學長臭屁說：「靠這本，學長我指考
90」，經歷過多少代？是那麼珍貴地一手接著一手，寶貝不私藏的心情，傳承下來。

 記得當我接手時，只剩下褪色橘白的內封，早已看不見書衣（那時候年紀小，口中還叫作書皮）紙頁邊緣已經磨損，選擇題旁還看可以看見擦過數次的鉛筆痕跡。

 
沒想到畢業後傳承給學弟，才發現露天、奇摩網拍上多少人，前仆後繼不斷地喊出兩倍、三倍999、1599的不可思議價格，只為了得到這一本傳說中可以一本打通英文任督二脈的絕世奇書。


 重出江湖，嘉惠學子，出版社實在用心良苦，功德來著
有新版，終於不必再苦苦尋覓啦！","1571515819","/feedmebooks19/photos/a.2201166446787835/2439571292947348/?type=3&eid=ARC99XhsCWVxhbB5GYXs_iPQKJONf0azwly3JojP-dUk1Pv47hYPDwq43DzJNVULjAcqqZjMi5RpZmvt&__xts__%5B0%5D=68.ARCyRSTQO9LMX4rSUewkyeGX-pLjrGCSpFebHVnVFkQf4W-XOyI9CdpfN_uzk9AHjHS2m_ibzqLZBw-Z4jzzz7_Kc_f7R6sbh4VDbnHuIjoiUKGcNCEnbB7ZdCULH3c2W9bnCM8OzhgFAgKpxkbh6nVrnSKRRnXF83njIrq7R018ul0g3-v1ZcpmAowzw-Wbav59mqflMMJiPAncs0jg-0n_E7zI-baby0kJpyNdOxo1R8tau7oaEUNsKaPZDPeEIDrI48hDiISGZJsbGASSL7qTZFuUmkq_VWp0xmj-Pj0CSruvM5xOpTDJCXZsQLKbh0cDXZQaqHzxQtkp_a4X5J6bo1Ub&__tn__=EEHH-R","https://scontent.fhan2-3.fna.fbcdn.net/v/t1.0-0/p526x296/70760814_2439571296280681_3185989869541261312_o.jpg?_nc_cat=108&_nc_oc=AQkHJEH1gcC_QgfglzK-RhmTYa4g2jS4j0a5oh5Vtn1mwYs6U1EXb6Omyn1xQIKpyBU&_nc_ht=scontent.fhan2-3.fna&oh=39526b5cf8e2196fd02e5f289dd54d03&oe=5E259090","undefined","",""
"https://www.facebook.com/feedmebooks19/posts/2429544473950030","1568279351","知道越多，越覺得噁心。知道越多，越覺得噁心。","1571515819","undefined","undefined","undefined","undefined","undefined"
"https://www.facebook.com/feedmebooks19/posts/2360630390841439","1560244334","【午後震驚有感】

 黃秀如，左岸文化總編輯，江湖人稱小威。
對小威的印象是說話聲音非常開朗豪爽，對後進（菜鳥如我）很親切和善。

 
直到看到這篇，心情很複雜，過去課本上寫的白色恐怖、監控，或是電影中東德史塔西的暗影，我從來沒有想過原來這一切距離自己那麼近，而且就確實地發生過，發生在自己認識的人身上！

 因此，讀到最後一段時，我特別感動，尤其是第一句：我決定要相信所有人！

 「我決定要相信所有的人，因為如果不相信我身邊的人，我自己可能會先崩潰。既然監控告密的手段損毀了信任機制，我就要讓它在我心裡重新長回來。」

 記得看過促轉會的短片〈反白〉，心中最深刻的感觸是，最可怕或者最值得恐懼的事在於，破壞了人與人之間的信任。

 而小威的結語，則是對台灣這一段歷史最好的見證與反駁，相信別人自己才得以不崩潰。","1571515819","/twtjc/photos/a.2090167454614212/2151065441857746/?type=3&eid=ARBHqM98CGwbuY8SMA3XS39NjVgUzf0gw9d-Rrn4lFqOGPX-HmSMmfmLrFIL9k1E0H3PixGXE8Exgn6w&__xts__%5B0%5D=68.ARAxBajdQBP5eNdnV5HVrYhrpid6beLyJ5vJuidCnA18AMsipmxYyHtu6iIO9VPt93GwmHwHwLu7mwSOYjXWqeYRFPh338U9_T83YWtosb6lkGH_O2lL8j3cl6QCQ7OqqO5nF6XVO7yuztYossDQUILpKJSbJjcRFyF80RhgIHpjcuj9ISpWFeyZV0krVFmlGWnLpD3J7B6V7BOnSag6kUaCNk635hiYH6DvNLwU1FLwFCjFGyRWL6qnF2s2lwl0xIoHi7urMEwc5Ww1lVSV7cwoqCLebtCxZSYW9yBM_pxNLo7IbdWk6P81BWfYaaHWJ4XS6guV0WXznnp6T5b_VCqymEv66UOTKsoZIhvymPgOV__0b4nDN1EFYWCe51OBWgrH6zyrK6Ljl6j5mMwR4pNObvIV_mcdO3sFstjtdsgVRKqcoQZ0dl7jajzej9HlnQ9_eSoFfLg1FDQrjlGPqG57c08hb3Xun9pJGp4ryo_r7ofStRmKS53qJUo9eQ&__tn__=EHH-R","https://scontent.fbkk23-1.fna.fbcdn.net/v/t1.0-0/s552x414/62197216_2151065448524412_1977164447839420416_n.png?_nc_cat=105&_nc_oc=AQm5n2hNFpG208OHAHSigztDS19xLqvFq_1whof8Q6RdiD3pmpn_OHB9Rp36cQq3vSs&_nc_ht=scontent.fbkk23-1.fna&oh=5e3d14a30d8f4d4da50f14dde7c161d3&oe=5E1806FB","undefined","促進轉型正義委員會",""
"https://www.facebook.com/feedmebooks19/posts/2345895138981631","1558436401","《美感的意識形態》，Terry Eagleton，商周出版 ＃每天碎念一本書

 上市前就看到書訊，當時還疑惑不敢置信
直到書拿到手上才確認，天啊！是真的
560 頁這麼厚耶，再看看原文書名：
The Ideology of the Aesthetic

 同時放進兩個理論界的超大詞彙：Ideology、Aesthetic，就大概曉得這本書內容有多哈扣了！

 會買的讀者群，大概只有哲學、台文、西洋藝術史的教授或博班學生？全台灣也許加一加不超過一千人吧（我自己隨便亂猜的）

 衷心敬佩，在這個時代還有出版社的編輯兼具眼光與滿懷勇氣肯出繁體中文版的美學理論書籍

 希望未來 Terry Eagleton 的書，還會持續不斷在台灣出版上市啊！例如，後現代幻象之類的XD。","1571515820","/feedmebooks19/photos/a.2201166446787835/2345895055648306/?type=3&eid=ARDpT4VpdbeJ6QZJcVwwCKGdrPTK8-Pbg0mbYNfj--PEOgIfcUbCJf9dZoni9fe1GbrLMZbZU6Uvc-ED&__xts__%5B0%5D=68.ARCwms3NPepP3L_4KjLhWOzYRQ-bPIE-CWbKgLa9ZilvIGfz9QjXoviy3nRavejJMKONC_kp-2Mv9gPKkXcLfeqFW9uObFqVJ3gOosaBfx73kBemggZ8h3iRkfS87Yc3z-nab4P0Bk2j5z99T4jXr48Sq7JFsxPcnkP2k90V86V6m5rT8bLK06vhjb2CCJQMn7V7xF6edsTgnRHb_GKgLB0DShzkK1PUj3WXnM0FS8NdhfiPOiAdJ1msclFigtob4ZEptnv5Iw64RYhYZEnW2g15rECXc_fHO9RRKd6puFltYRxc2C28pC7k65hSfoy7Dytee3LJUcC6SIjeGHWzDI77BrW0&__tn__=EEHH-R","https://scontent.fpnh11-1.fna.fbcdn.net/v/t1.0-0/p526x296/60925955_2345895062314972_6362533010054578176_n.jpg?_nc_cat=101&_nc_oc=AQketBn5qskzgCAzvO4d070BQLatthSD9JqELW6h3mlcQmfWd9qRY24rXnC5WRduv9M&_nc_ht=scontent.fpnh11-1.fna&oh=911f67447f9709bdaefa638f0c8009a1&oe=5E2F4411","undefined","",""
"https://www.facebook.com/feedmebooks19/posts/2372772429627235","1561633258","《初戀》，島本理生，楊明綺譯，采實文化 ＃每天碎念一本書

 一心想當主播的女大生，居然在接受完知名電視台的第二次面試後刺殺父親，行兇後還渾身是血地走在傍晚的多摩川岸邊......


 
接到試讀邀請時，記得十分開心地一下午的時間就把整篇全文初稿刷刷地讀完。整本小說圍繞著開頭的這個驚人的女大學生弒父事件開展，探究犯下這個罪行的根本動機，就連自己都不曉得為什麼。

 
同時另外加入了媒體與主要敘事者臨床心理師真壁由紀心中隱藏的秘密。而這一切，圍繞著所謂「初戀」的人生經驗。兩個人物情感軸線的交會，反而更加體現了小說金律，性格決定命運的重要性。相似的際遇，不同的選擇。

 
書籍簡介中用不正統的懸疑故事概括整本書的調性，我倒覺得所謂的黑暗、惡意或偏離社會常軌。對置身事外的旁觀者而言確實充滿懸疑與困惑，往往事件發生的第一時間其實媒體跟觀眾都想做的事情，是找出某種證明，去確認自己跟犯罪者不一樣，藉此閃躲或逃避任何人都有為惡的可能。一如《致命玩笑》中小丑那句：「只需要經歷過糟糕的一天」

 這本小說往人心深處挖，卻取了一個甜美的書名，用了鮮嫩顏色的封面，了不起。","1571515820","/feedmebooks19/photos/a.2201166446787835/2372768309627647/?type=3&eid=ARD02-mdUcxqx61hc-hU_l2iA2SZS31-75sxUep0bVmfV5faiZ-qyNV-8bUmZAUGop_1yfnh-lW3jP1a&__xts__%5B0%5D=68.ARA1OUMmc6VHUvyzIdk5joc33-P_W71PvUJv0wzpLaOmzUJvFWfio8lNU-eqCzGBRH7He1Fmye4WVjo0_z65DLjKozTM3zrn8nucyjwCb_9LbP6irC_yQ17vMdCiWOcQTIo32U0QmJ3my5AIpc1EcFfYoIfhuO3kgFzMNtXkJizPepKb_x9WieW5D9W6AOuf7ErQb7kdKPRlq0CvyGIe2ufmODZEXeMsHL4agcnmyJrKXNhVVqQ9LZgV7kapx2PZcLrcaCnFMNHQhp8y478H9rGmAzYZ9LotFKM8DFyid3rKldv8osSUsG0vDeVwZQwMGJ7dlpuA5uV0xNyp9qGZzj2vm2hJ&__tn__=EEHH-R","https://scontent-cdg2-1.xx.fbcdn.net/v/t1.0-0/p526x296/65561130_2372768316294313_713717002161618944_n.jpg?_nc_cat=111&_nc_oc=AQmfwY-sYfdqnpGdvC-86ruqDnyNRcDZYJwGbbY-Nl4nlXP98ZbBHZXzYs6p3U7uTX4&_nc_ht=scontent-cdg2-1.xx&oh=473fc5aead232b72fc32ee807aaa09bb&oe=5E2FF80F","undefined","",""
"https://www.facebook.com/feedmebooks19/posts/2397145920523219","1564646662","＃香港加油

 地點：羅斯福路地下道
時間：8/2-8/19","1571515820","/froggychiu/photos/a.846949602111073/1416366531836041/?type=3&eid=ARAjcRHll0R9XUQWCfraXM4qjv8hP2wXH3k6xubU0lngq1GtlYzcYcxlqYQg2-904gn6X_XFga3Wb1YI&__xts__%5B0%5D=68.ARDMbbjA6dGVNf0i3_tTw55lKoa8R4OYhKpTWsGkV-uXtX_HfcASXXsujpAQbHGbxbTysHPTfEDvWeE_VOk4Q-vMbGhs7PDHyHXahrp_dvSFNAMGQVFt9pvmSZ4QW2NuzobkxL6g6cHJwPDVyE4DzVZZY1hNwnki_WCRJwpEQneuXNZoHGBNS50fIA1xw3MwKBs5gwAv03zmWkfRTctxMC9wVOVZ2R8Hadvrg2dYgvcvB7ti7MCLLZk44IycYUNQKJPzTtnuVydKkbGNRDFX1vqfAmcgTDQ1VLb8FT6PyRAkKPYVMoWfnruNNmDobGijOtJk3E-JEaGetoB1bvFUKFCUkeirvIU8lqRXfiXFUVYvkpZrtyzh1ZhEisMIVSI4xUaPCngKFwEJLT-DDi2pbchufs4-5uM3-D004gMsV3vB0oNauyxUkXGqCJg4XH_QXAx6SAR2p_De5ZvgyfaZGHc1Zjh5cH8Vi55SKaTmy9DDbLtnLPAUxsO4nWnl&__tn__=EHH-R","https://scontent.fhdy3-1.fna.fbcdn.net/v/t1.0-0/p526x296/68428393_1416366541836040_286622396230664192_n.jpg?_nc_cat=109&_nc_oc=AQmF-tf6GzpfNRzszupzPOZu_5AgGpOoUsIeprAaTWhQDIWYeWDiWuQLpz8n45LePok&_nc_ht=scontent.fhdy3-1.fna&oh=18cd8c4740489983a81d187cc6a96f0b&oe=5E187AC9","undefined","呱吉",""
"https://www.facebook.com/feedmebooks19/posts/2342981805939631","1558076991","這是拍電影吧！真的雨過天晴出現彩虹了

 照片地點為立法院外，中山南路上空","1571515820","/equallovetw/photos/a.201735676949226/686035471852575/?type=3&eid=ARArrP2x36_4C_LBkh4YLNxHy-xbYc2DXRI_gF_SrN6Bs3m-aXHP6m04Nsyge3RrNJru1Q8jXBxD7HsA&__xts__%5B0%5D=68.ARBG_fa7WS-m6N7cTw6LEhff6Led-OVKMS4G1nBEEQbtO4k9LhLJg7LfPA4iLymVjA8Xnka_GT0ACb0Gjfmx6uj4zkEEFzcmpEnNoc7tairV7LeACk3BidZljHCJx98iWC3_-DbjP_TEzq8dlLAWP07IbYzCBVXhfYm-hfJX_dseFFyElyg3fT_2JQJG_ttJOjM8S0F_Arv6EYG_d92fRASuHscTn80hJSEdQ0O25m1yB6V1aoH7uMH-UNwOS1J7VhOWp0g0_Uy9iYrVTRZwsMDU9ID_BBbUcSnYmeqklpw7QoKDXkDKMcvpVo8C_ffhpzWtFVXcuz9wip6vfemEwIVdhr66XO8lU_oNkeYqiWr1Wd4GodggoumwuCK2XhLAjm7szFo4l5V2E3ol97NKFMZm7v5zMHEWw0tim-VX5P-cUdlFJxgDdTQEN5HwyXUxR0HVtR4o8wZHoXOpLJWy8SWMvzB1sVo9o6Gd4JkPHlbUcVjHJCMYq8nbNg&__tn__=EEHH-R","https://scontent.fbkk7-2.fna.fbcdn.net/v/t1.0-0/p526x296/60341725_686035475185908_6287117833922936832_o.jpg?_nc_cat=102&_nc_oc=AQmnogCTRtOZjbUpTRbZ82lKemq2dOBWoA5sZfVRrttUFcAafs_z7HXkzlWy-YkflQU&_nc_ht=scontent.fbkk7-2.fna&oh=7fb0e97a2b1f3dbe34e2aa8bbcec3e02&oe=5E2611BD","undefined","婚姻平權大平台",""
"https://www.facebook.com/feedmebooks19/posts/2423731047864706","1567683000","《群眾心理：為何進入群體後，人們的智商就大幅降低？》，Gustave Le Bon、Banmikas Team，遠足文化 ＃每天碎念一本書

 記得看到這本書的書訊時，立刻就私訊跟責編說
這本書好耶！漫畫版 X 粉心理學（X 可任意填入各大政治人物）換來責編一長串......

 說到《群眾心理》也許比較陌生，但之前碎念過的《烏合之眾》這個書名響亮許多！如果閱讀原著實在很累很睏的話，翻翻這本畫面激昂的漫畫版入門很剛好

 不得不說，法國大革命，是個時空都看似遙遠的歷史事件，但走入小吃店吃個午餐，看到電視上的造勢大會，不免會心一笑。

 
除了把羅伯斯比爾畫的過帥之外，有點皺眉之外。整個內容基本上圍繞著整個法國大革命前後發展。看看「自由、平等、博愛」怎麼美化血淋淋的從君權神授到天賦人權、攻打巴士底監獄搶奪彈藥，武裝革命，斷頭臺砍下路易十六的畫面，一段歷史的補完。

 值得一提的是漫畫的畫面，衝擊力道實在很強！
對於群眾人物表情的拿捏，某幾個空洞的眼神會讓我想起 MONSTER 中，待過511幼兒之家的角色。
沒有馬賽克、不模糊，直接讓你看到所有該看見的，特別是某兩格印象最深刻。一格是跨頁的蝗蟲過境，這個畫面實在太好，充分展現「烏合之眾」的特質，群體伴隨的殘虐與暴力、失去理性與自以為是的正義。還有一格是，毫無預兆一翻頁就，就是嚇人一跳的半頁大驚悚畫面（不爆雷，自己看）

 最感慨的還是歷史注定的結局
透過反覆、斷言、渲染煽動的主使者
最後注定無法掌握失控的群眾，被反噬
不得不說，在 2019 大選前夕讀格外有感
看著以金句獲得權利位置的人，又是如何被自己創造出的金句圍困。

 歷史啊歷史並沒有遠去，與現實簡直相似的可怕！","1571515820","/feedmebooks19/photos/a.2201166446787835/2423730887864722/?type=3&eid=ARARhAf8jROBo1pi6LrUemD3RSk3mTXQZAKBkcfEztj6WX-fsyzE2eZ3OCLFqdSGjgkKJAd4GOiC5O7X&__xts__%5B0%5D=68.ARBboNNkJ0CNOBxOdakDmY3rsiVCOsLIaVD2vmgAOl9cU-6bgK10-HDiSH833_cO-3jhpef2sVLZxruVHDOPlRgth8e_sGleRiaEemyhleyClt60iQZZ59sxO_QIo5eNx8_rrJLovEep7beaGPNUE3BGXIJFCbQov_0hPcsy-46I8FrJDCdcH0qRZbEvwYigiNAzl1ElOajShtKvTGGYkn_K5dN_72FUwSc0Eq_fKEI6GRgNHjljiMz39zva_5D_orgXM6MBdgWX4n2YknkcqcJHV-7bHhLY8i32rDQnC8aSEqjY_9oy95NfSydMsyOYcq7O8dWpnLcFM8mweyp4L4e9DNMF&__tn__=EEHH-R","https://scontent.fcla1-1.fna.fbcdn.net/v/t1.0-0/p526x296/69463487_2423730894531388_2298187436167004160_o.jpg?_nc_cat=109&_nc_oc=AQmjPGJpJkLXwBGuViLHzky-IO_7xYNBhcbwyDeFZFgdb4rKBmITAo5MX7syzME1BsE&_nc_ht=scontent.fcla1-1.fna&oh=76e03e54d12291d3c7f3366f1ca0934b&oe=5E2F7075","undefined","",""
