url,posttime,text,crawled_time,attachment_link,attachment_img,attachment_img_alt,attachment_title,attachment_brief
"https://www.facebook.com/goforTaiwan/posts/2436007149989083","1570246200","RCEP會員國占台灣對外貿易將近六成，可說是台灣最大的貿易夥伴，如果未來這些會員國之間可以享有貿易免稅優惠，台灣產品卻要繳稅，必然會大為削弱台灣產品在這16個國家的競爭力。屆時台灣的產品不但會被排擠在外，國內外資本也可能會轉向這些國家投資，加速台灣的邊緣化。

 
雖然RCEP的開放程度較低，但對台灣而言，RCEP占台灣貿易總量59%，CPTPP只占24%；在投資方面，RCEP占台灣對外投資的65%，CPTPP只占14%。因此，
RCEP對台灣的重要性遠遠超過CPTPP。當前兩岸關係降到冰點，台灣想要加入RCEP可能是難上加難。問題是，眼看著CPTPP已正式生效，RCEP也即將生效，政府卻一籌莫展","1571713015","https://l.facebook.com/l.php?u=https%3A%2F%2Fudn.com%2Fnews%2Fstory%2F7338%2F4086766%3Ffrom%3Dudn_ch2cate6643sub7338_pulldownmenu&h=AT0mGuDdRoImwYxYddyNE9U2ADyg9qrWPgEF-nRginedgxVa094sLxbsDChsNXb7LllJnhYSf3TVeDKFEuxl5OEhYBLW9ngeCrA_9YX_auLt-sQ74riZgo3vdGBNQBt407QrHgAUmBT9Wk_-RARRBQMeVwR58jatvPj7irxh0sVIsc0uVWMaeEmjSJyeBJMTYmfiet6BJ4X3MF7oQYP98CoptoU0aNnSeBc9yhs3a5pQz3whMGFHHYxIlaM3z7EummRYFvmq_dKpUmTzG9OXo0dcqu70PNvkkK-euT8h-DlljLKLs3mzZRXdQLE8u9UzB0g8yGTw0G_eVqzm9oatNx-SJS8oCz9rgMl2uSDtYPxUfb1QGFj9i98Uv9d3WBIf2i8kfpfDynbQQIo0_WKRKM4sBuf0u7tTaUke5n9XoXQK8Ac1EdWdpzHV6_h4FIo1jogJaM1ug_-a9iyxqlnPtWmSkdwKFUyiYRRZ2qE0lPgLJXpo3mD_BERTpeic-GTiQ0QiUm4Jw7M2nJwYL9Q7NMRXVgacxhAzv8hqy6bhckWNt-3ZsxJpTPM90TGQctZW7dQM-FD3LtGKEtSBshWuNU3EyVNNGEPVKCV1xoIijrNyISu8YwWFgKPvEbV4GE7amSgrj5bYN4uXmu3L6Wc","https://external-hkg3-1.xx.fbcdn.net/safe_image.php?d=AQDkAKqREqcUiZa6&w=540&h=282&url=https%3A%2F%2Fudn.com%2Fstatic%2Fimg%2FUDN_BABY.png&cfs=1&upscale=1&fallback=news_d_placeholder_publisher&_nc_hash=AQAGb6w9SA1YXJSK","No hay texto alternativo automático disponible.","經濟日報社論／RCEP將達陣 台灣企業何去何從 | 聯合新聞網","由東協十國和其他六國組成的「區域全面經濟夥伴協定（RCEP）」將於本月12日在泰國召開部長級會議，會中可能會宣布即將完成協商及公布主要內容，並在明年完成簽署。合理預期，RCEP將會在未來一、二年生效。"
"https://www.facebook.com/goforTaiwan/posts/2430013253921806","1569573000","律師陳麗玲提出宜蘭地院上月一件吳姓大副攜帶21條香菸人境被依菸酒管理法輸入私菸罪判4月徒刑、緩刑2年為例
宜蘭地方法院判吳姓大副帶20條菸入境，處有期徒刑4個月的法官應該要出來講講，為什麼蔡英文念的法律跟他不一樣？所有之前因為私帶菸入境被判刑的，都應該出來聲請非常上訴。

 
宜蘭一名吳姓男子平時在貨輪擔任大副職位，去年3月間他趁貨輪停靠高雄港時，將自己購入的21條香菸裝在紙箱內，沒想到下船出關時遭海關查獲，他一次攜帶21條香菸，已超出法定1條上限，宜蘭地院遂依菸酒管理法輸入私菸罪判吳男4月徒刑，緩刑2年。","1571713015","https://l.facebook.com/l.php?u=https%3A%2F%2Fudn.com%2Fnews%2Fstory%2F9637%2F4071784&h=AT10ZfGD2zaM2K-Rw7Gd4TBEjA_H4xCFb8FBPPbwRdtEHJx7p6f9fut4Uy_YICTZZYu4Fz-sBfVGqWQE7ve5w3CNksRGuYbHv3WnD3p2w46UJyT0ts1C30ibA3MKHknJmsLEULzr1pgxGvJrb5LgKbBZTN_2MIBSGVj8E-uOWbcaFThV8JNIHchHE_3dMu7Iw3Ca0kzwVOLj0uk4C3T1ZYBQwTXbFB6OAmr41EIHpk3YYo9NiZ39LF2MrMW0JOh0P37NwtZKdba0McCYDRMaHzo8kueNI3e4pstTlert10uOz4v6hNPsqY4_PnAJPgbb_oWEMZeXtW8WKTb9atYgUgsXFE6JzRBN-X-Yw7hyCtdM3u-epNhgjOsBVBkPvdx76OExbfEqjAs3eURxRyYJgnC45C6ezf7t0MV4uX67xVJ3LImZDKySGEx4e_sQr1oSBIO94GQfShPpsr0tbz3vkJYvN8VgYfgPQYCu_KBNmTZiXslXO4clmwGQn_m7Qwzis-mu9OvCisagDETkUjMkjReI7kdrRiDuHhClYdQoSzicRtumkBWxONQYYF3pj9M79lvcCRDspwMfIv5bdpqc0QUI5jE0VlKcWubGcCoYRbHl9UxJr__G5LHWA6KtVRBGK-PZfU7sCN_R-RApp_Q","https://external-sin6-2.xx.fbcdn.net/safe_image.php?d=AQAr5ydhUkY1onbF&w=540&h=282&url=https%3A%2F%2Fpgw.udn.com.tw%2Fgw%2Fphoto.php%3Fu%3Dhttps%3A%2F%2Fuc.udn.com.tw%2Fphoto%2F2019%2F09%2F27%2Frealtime%2F6871659.jpg%26s%3DY%26x%3D0%26y%3D9%26sw%3D959%26sh%3D638%26exp%3D3600&cfs=1&upscale=1&fallback=news_d_placeholder_publisher&_nc_hash=AQCj5d1MtsOcAif8","Image may contain: one or more people, people standing, mountain, outdoor and nature","小英女孩帶菸沒刑責？女律師拿這個案子打臉蔡總統 | 聯合新聞網","總統府諮議林家如以公務員身分隨總統專機出訪，帶入卅七條免稅菸、禮遇通關遭質疑，總統蔡英文總統表示這件事和司法調查的走私..."
"https://www.facebook.com/goforTaiwan/posts/2444470775809387","1571128200","蔡英文辯稱，兩岸關係「沒有好壞問題，只有國家利益問題」，又說亡國感是國民黨操作。這種說法，讓人啼笑皆非。今年一直暗示「選錯人就會一國兩制」，並用「今日香港、明日台灣」嚇唬選民的，都是綠營。其父母怎可能是國民黨？

 亡國感為何竟變得如此急切，不都是蔡政府芒果乾吃太多？綠營一年來炮製「芒果乾」進補，讓小英選情回春，現在竟不承認生了這個孩子？","1571713015","https://l.facebook.com/l.php?u=https%3A%2F%2Fudn.com%2Fnews%2Fstory%2F7338%2F4104344%3Ffrom%3Dudn_ch2cate6643sub7338_pulldownmenu&h=AT213KYci3PMooYTI19vt_Ht1D7CBZD1p8auCAAbrYD_FpmMgvL2kLSL6u8Ir1orzS1d9nqFuN7X-NlIic3R8_IgCaS91k4gTmOdUJo4tzbNI9EmHI8z_NBXADhLwB1i58_sHJAvihoPVx5addorzw0zGX0Ts-fkVM0yZU5QustaSFHgtMwZUccvft7G0FfRSi7SBbQmH-z0sqXqNUbayn9xKiRMpOE3GcLfmlmzjauIe4HsaKoVtc5fybtRRa8HZGm2hOBoUqQRSNBV2dCfoOe9YiM4iKPxm0zhcCCGl3LTYQHyqqhAF8laVc2w7od9-o9zJiOH5mp-hesWErzApa9Edy1-JYpqyHsUT0tctpKXog2faOHniUdytmpyS5ny9MLG8dorCklLEb9RANtfUo3BovtH4sbRGtNHPkwtggB4XWqxfkrMYLsslZI79KGEyz7QnoPyoWAKfZP-dQQnlMq9jawkB0jqig9DBr8MAsmR1aEAmTyKa96YIsg0uUhSvoRDHxFKVgSG17Nk4VI4dG69zEkLyapfBO_VJT8XUZ8ece9IAN0IWBodObrN9FTP6GUJlHKxbxW9HbO7qqaH6bfWUU3JlKJt792nsXM_Qf338BZj9hVcgZS7VTCKVXSreXtpk6FQJ0PEL8qn3MY","https://external-sin6-2.xx.fbcdn.net/safe_image.php?d=AQAURa_06eO_7Y0D&w=540&h=282&url=https%3A%2F%2Fpgw.udn.com.tw%2Fgw%2Fphoto.php%3Fu%3Dhttps%3A%2F%2Fuc.udn.com.tw%2Fphoto%2F2019%2F10%2F15%2F1%2F6940841.jpg%26s%3DY%26x%3D56%26y%3D76%26sw%3D1164%26sh%3D776%26exp%3D3600&cfs=1&upscale=1&fallback=news_d_placeholder_publisher&_nc_hash=AQDVPqWGUb-vnbUF","No photo description available.","聯合報黑白集／亡國感的父母是誰？ | 聯合新聞網","「亡國感」話題發酵。柯文哲說，台灣扣掉三趴，以外都是「台灣派」，不應簡化為「芒果乾」，還批目前兩岸關係是卅年來最差。亡國感是綠營利用香港「反送中」運動炮製的潮牌商品，但現在看情況不對想縮手，竟連蔡英文..."
"https://www.facebook.com/goforTaiwan/posts/2445975408992257","1571283000","政大為何將蔡英文的相關論文資料申請列為「密」，卻又以「絕對機密」的等級，保密卅年。要核定絕對機密依法是由總統、行政院院長或經其授權之部會級首長親自核定，所以顯然這是由教育部長核定的
政治人物的論文牽涉到學術的背景、立場、倫理與誠信等問題，理應公開接受檢視。過去幾年內，就有德國國防部長與教育部長、西班牙衛生部長、羅馬尼亞教育部長，甚至匈牙利總統等，因論文抄襲事件下台。","1571713016","https://l.facebook.com/l.php?u=https%3A%2F%2Fudn.com%2Fnews%2Fstory%2F7339%2F4108875%3Ffrom%3Dudn_ch2cate6643sub7339_pulldownmenu&h=AT3r2ZMQOxznEa9lGyLrlvWx4KrFD8XyZlK41kxhcEYdEr5vHBCENkzXnzJpQH5Qe6YQduR-jStJEuER6yUc0ESGULEJBxaQF4V_izMIPtNR7pR8bg5Brl9FU3-tGHZE1l3guGJ6ETqZ4RwywUGyqimq2zi3ZtRnNqKQHu5yuMnLlQPFdubOX2o5TG-IxKwjv_Vq4NAxOLCXiEADi_YVjEe1mEQmuodMjGAFX7oh06k23NH1-4g2AE14B4EPDxoKqj3XA0VkMUqaUcM8oQdMp2RO2EThbx6doRM_MJgmNFTVexddsGYb6wrRj1JqHCUmmxouWrcBM6SUusTOCdM9cCp-dSwwZd9qvaafkNRZPVr8dLrqJXt75WUOQeGThlOLNx8hxU9n4xpOpXNZrGI6AW7dVGBg02LUSnohQiRktuyKrcUXldtqj_YmV7hj5hGJYmvvhtucTBtADuNdGOt4dEuOmVpN6tYo2UO9OJNcmtEmCibUKOaj_o7vONUj6AQu847YnR0Ygrt1MI7yDA_IVbock27lowr36hE3g45dvsONpzCiz8B1l3Qtgii4mTbYO4RFi2cVuJqNZ_BtX5JRqcdTcfWeR34N1DL97TUp8j6Wv5BRr00YImYmeA2blI7l6ASEXtOZ5L2WR64iuGo","https://external-sin2-2.xx.fbcdn.net/safe_image.php?d=AQDCxLQTE2GGn8cS&w=540&h=282&url=https%3A%2F%2Fpgw.udn.com.tw%2Fgw%2Fphoto.php%3Fu%3Dhttps%3A%2F%2Fuc.udn.com.tw%2Fphoto%2F2019%2F10%2F17%2F1%2F6949993.jpg%26s%3DY%26x%3D28%26y%3D2%26sw%3D1083%26sh%3D722%26exp%3D3600&cfs=1&upscale=1&fallback=news_d_placeholder_publisher&_nc_hash=AQCjHOBv-d6x8kzL","No photo description available.","總統的誠信 絕對機密30年？ | 聯合新聞網","在立法院教育文化委員會審查預算時，立委陳學聖說想去政大看看蔡英文當年應聘到政大的證明文件，但「萬一這是一個陷阱，做了錯誤的背書該怎麼辦？」陳委員也詢問在場列席的四十八位國立大學校長，只有六位大學校長舉..."
"https://www.facebook.com/goforTaiwan/posts/2423618794561252","1568863800","儘管蔡政府近日動作頻頻，先邀索國外長來訪，又派出我外交次長赴索國搶救；甚至連美國、澳洲政府都介入遊說索國，但終究無法挽回。短短三年四個月連丟六個邦交國，蔡英文可謂創下了最高紀錄
陳水扁任內八年，因惡搞兩岸關係而斷交九國，但他至少還建交三國。然而，蔡英文首任三年，即平了陳水扁的紀錄。加總起來，民進黨執政的十一年多，計丟掉台灣十五個友邦。對比馬英九執政八年僅失一國

 
即使美、澳高層皆出手干預，也無法阻止索國決心轉向北京。三年多來，蔡英文的說詞一直不變：斷交都是因為「中共打壓」、「金錢誘惑」、以及斷交國「見利忘義」。卻從不反省自己的兩岸政策是否合理，以及外交戰略是否明智。蔡政府一度以為找到國際靠山
索國總理蘇嘉瓦瑞與台北斷交的主要理由，竟是：「台灣對索國毫無用處」。言下之意，中國可與澳洲抗衡，是更夠力的外交夥伴。美澳高層出手，都阻止不了索國斷交，蔡政府還能心存妄想嗎？","1571713016","https://l.facebook.com/l.php?u=https%3A%2F%2Fudn.com%2Fnews%2Fstory%2F7338%2F4055643%3Ffrom%3Dudn_ch2cate6643sub7338_pulldownmenu&h=AT1w48C-anUctfvbXWw_Z9hYdy88oWhP55IUu2VD4bJDAH0yNouNtzEwEIQH_PQCeUkSR8-fQXbYoYzENd7rV107MJCtHNXklPjEr3kJ-KVpbTmU_WEB9bGyy0jlw6Cen81-0_XPW1bYRPG0MBG63NHy6Ok2MnogZzqfBYB2I_XDiPEWKAoecnhAEJ7MUrWEh7XwBD1JDgzKw5MdLGHrcm9TgHxyS2guWNTV1eUjHoDfkJ0vIISJ6NGtsgTU0iry-tjxjSVloFr7_2b1vRlT8qKPbvqHoLGMdpO4HMd-NXE273UVdCugqZE2cOgljagAeaBEiaw9CzmKhwKmjg5YwRCQ_aIB0qZI--Rpy15u5WBUQdUV0po0HUd4LMBjIRFHBaoSb5YI01QEFzg4j74oTdKxKMmOCgawNPALVugeHQIzF8110GtP4_59_qCu-rjc205WydsZUe_Gih-mHFyTmz1_tyUCIG6fwYYhAJjrN6I5soyLbzk_5eotpXQuJhcojHnQHxbIAtsiE1spRxzzEivf7fJGMCqmnVcUAf5JeWwCNaIWgHFhzOGdS_sbXYFZJJcPHvcxY1_CpNbJ3qHODF39bX6YX8K20LajPoO4DD92mifQnyMwe_KXZESKBbLx18WWAUIPYKiTGHX3GpQ","https://external-sin6-1.xx.fbcdn.net/safe_image.php?d=AQDk5bSSHRRwWlr1&w=540&h=282&url=https%3A%2F%2Fpgw.udn.com.tw%2Fgw%2Fphoto.php%3Fu%3Dhttps%3A%2F%2Fuc.udn.com.tw%2Fphoto%2F2019%2F09%2F19%2F1%2F6836937.jpg%26s%3DY%26x%3D8%26y%3D18%26sw%3D994%26sh%3D663%26exp%3D3600&cfs=1&upscale=1&fallback=news_d_placeholder_publisher&_nc_hash=AQD0kB7cr4xiH2qs","Image may contain: one or more people and people standing","聯合報社論／連斷六國，蔡英文的兩岸政策是無底洞 | 聯合新聞網","索羅門群島內閣會議日前通過與我國斷交，這是我南太平洋最大友邦，也是蔡英文執政三年多來的第六個斷交國。儘管蔡政府近日動作頻頻，先邀索國外長來訪，又派出我外交次長赴索國搶救；甚至連美國、澳洲政府都介入遊說..."
"https://www.facebook.com/goforTaiwan/posts/2437817229808075","1570437000","馬英九種的是鳳梨，讓民眾收割「旺來」。蔡英文則播的是「芒果乾」，而大家都知道，種芒果乾是長不出芒果的。陸客不來，台灣觀光業變得好冷。機場國門計程車不再有候車長龍，旅行社收的陸客團從百團降為十團，許多員工被迫留職停薪

 馬英九的「和中」政策，為兩岸人民創造和平雙贏，這是「旺來」；但「芒果乾」只肥了蔡英文選情，卻瘦了許多台灣百姓。榨乾台灣庶民的生計養分，導致外交失衡和萎縮。","1571713016","https://l.facebook.com/l.php?u=https%3A%2F%2Fudn.com%2Fnews%2Fstory%2F7338%2F4089984%3Ffrom%3Dudn_ch2cate6643sub7338_pulldownmenu&h=AT3z0kW-asnWqN3v5CZwQHY6stx7x66l3zHVaYxlcSn6RBgU8PjvKbNCtUIoyzMVM8HGGdJR9ohVYlCtRDYXkpWqnxBYEHUzQLoD-Apb6bmBtQ0mKDw2AzaJJy3Z63O4MAdAjskB3jdL_TST-M9UNtxSM3soj_A00E113lfLvZnl9Av94pcpPmPFBYL6GxH9PkMcm9-eAwSAmsWR3RqBhuM4HgS17NG05jguWc7k5BSbaiBUV_LlVxQfejId9i6k2d0yCVtBhDRfwBDHoHR5A3V3IqvZCCQ3BRt1-YClQ4jRVvH5m10DORvlQNgut9sWwM5MqQ8oMHbXzGWb8SaCGt6Gtyv7hV1SEHJ4VDPas1TrynSj6EgHGK5u6X_g8AlNgrXQmsqOdksbMJvy5xljjtoCEBsy3qksq0TlTQPoUXfB4M_tThIz_JHJIavuEOmND_-ogASL49kR5BzKoiCEHbp8gXQhdxPC7HK4Zyc29kJlb_J7om8D-XjjOjBw5XyXVIDiH4C3Pfezha3aZrsmEggeo5Ch-etgrAQ2tRbLYOT37k9cilOqEFWO0o2Um-3FNRAVNODdgvXfkus8eGy7fvGs5lZMd3jE0CENx4niS7wlN0k5qBLalfJ89bjexwdBopEP-ymWElHMoBt61V0","https://external-sin6-2.xx.fbcdn.net/safe_image.php?d=AQCz7cFT0vUc2JEw&w=540&h=282&url=https%3A%2F%2Fpgw.udn.com.tw%2Fgw%2Fphoto.php%3Fu%3Dhttps%3A%2F%2Fuc.udn.com.tw%2Fphoto%2F2019%2F10%2F07%2F1%2F6910600.jpg%26s%3DY%26x%3D16%26y%3D20%26sw%3D996%26sh%3D664%26exp%3D3600&cfs=1&upscale=1&fallback=news_d_placeholder_publisher&_nc_hash=AQAQfKmkpgc0H3b8","Image may contain: one or more people, people standing and suit","聯合報黑白集／馬種鳳梨，蔡播芒果乾 | 聯合新聞網","馬英九批評蔡政府，用「芒果乾」（亡國感）操作人民恐懼；蔡英文則反批，「種芒果」的人就是馬英九。蔡英文的說法，把一般百姓唬得一愣一愣的，其實只是話術操弄。事實上，馬英九種的是鳳梨，讓民眾收割「旺來」。蔡..."
"https://www.facebook.com/goforTaiwan/posts/2443717309218067","1571041800","上周還吵得沸沸揚揚的真假安倍賀電，在雙十假期過後，便彷彿船過水無痕，沒有留下任何的痕跡，當時外交部發言人歐江安在記者會上還信誓旦旦要福岡辦事處以「最速件」回覆，給國人一個交代
返國述職的謝長廷今早在立法院一再重申安倍電文是真的，而日方否認的說法也是對的 這種猶如律師在法庭上虛虛實實的詭辯說法 更可以看出外交部對這封安倍賀電的極度心虛。

 從這個事件，可以看出民進黨的選戰操作手法，只要是證據對它不利，它不是以拖待變，就是拋出其他議題來轉移焦點
如果不是謝長廷的「多嘴」，今天又有誰還記得還有一封「被遲到」的福岡電文呢？","1571713016","https://l.facebook.com/l.php?u=https%3A%2F%2Fudn.com%2Fnews%2Fstory%2F11091%2F4103316%3Ffrom%3Dudn_ch2cate6643sub11091_pulldownmenu&h=AT1-WGgRqB3FtAIMm8lMdQd4JbV9MH2XL6TzR8gLOq9qm6wKndA8XQ7N0c6BZXDGjrIvJcmqMnRSQYugToQdh2NR5d0Kmr_ckU0QM2wYPkd6YbNfQBYIrHvWzdlPJX9VqmpAMwTUw29uryBicbWrffnI7HP5UsMbU0ppsv4-1xKVyhw9QW63iMraoUhU4XKW1mf6CjPfDfNUzqs3XH_XxaPYMFJzglsxBDgzryIu0HrIztG-N4_usScGlgltMuxuHm9ofMH92n7Vrnv-nOOdTGQIl9Z-o8Lsr9AoA4Mxn8ULiw9my9c7thjlywEDVKYDpR-dg2rApBncAMOVu0SRiPvfWAnFrESEEOjHjgaGDMRh4y-i-d6NCkDb_YsNNQnqnnXsbWaxLaQh6v0lKrux9UiyKhz7nk0gb-chAlwqeACpNpqiK7xRNWZa4Glm1UC_SIKSnyyHMK6cZB_UDn59yv9NZH-FpAyfhtiUPcjSJs3XHSMcypDsy46GzSTpumfeQzxJ-65NnWWZNw9kZjjuU4C4jRTB9xXHDcAAlvlRMZn7EDR52L9_lfUHZN9IlBSSCAFRwPT_UcZFqB48_XeOXRmgVS4GBtNI4Y0_KDNIP6Sx_SxOppePG5ERdbQspbunXrLnTqF303zK2mmfKnE","https://external-nrt1-1.xx.fbcdn.net/safe_image.php?d=AQA71zZ9KMdZfeq-&w=540&h=282&url=https%3A%2F%2Fpgw.udn.com.tw%2Fgw%2Fphoto.php%3Fu%3Dhttps%3A%2F%2Fuc.udn.com.tw%2Fphoto%2F2019%2F10%2F14%2Frealtime%2F6938995.jpg%26s%3DY%26x%3D0%26y%3D0%26sw%3D1279%26sh%3D854%26exp%3D3600&cfs=1&upscale=1&fallback=news_d_placeholder_publisher&_nc_hash=AQAu1IpIlHflb4pe","No photo description available.","【重磅快評】一封「被遲到」的外交部最速件電文 | 聯合新聞網","猶記得，上周還吵得沸沸揚揚的真假安倍賀電，在雙十假期過後，便彷彿船過水無痕，沒有留下任何的痕跡，當時外交部發言人歐江安在..."
"https://www.facebook.com/goforTaiwan/posts/2445517942371337","1571268600","墾丁觀光旅遊業去年紛紛創下近10多年來年營業額新低後，
今年上半年好不容易出現回溫，卻遇到大陸暫停陸客來台自由行，雖有國旅秋冬獎勵補助，但業者認為難補回陸客缺口；有民宿業者今天在韓國瑜的觀光座談會上大聲疾呼「還我們陸客」

 
墾丁國家公園在2014年創下最高紀錄的837萬遊客人次後，開始逐年下跌，前年降到幾乎腰斬的437萬，去年354萬，甚至比政府開放陸客來台旅遊時近400萬人次還低，但到今年到9月已累積逾300萬人次，出現觸底反彈訊號，卻遇到大陸暫停陸客來台自由行
全盛時期墾丁每天有逾2千名陸客，即使近幾年國旅市場衰退，仍讓墾丁淡季不淡，今年雙10連假陸客數掉到過去的6%，下月可能只剩2%，雖有國旅秋冬補助，但不適用國人習慣出遊的周6，消失的陸客缺口實在大，不僅旅宿業補不回來，連帶相關的夜市攤商、餐飲、水上活動、電動車出租業全都持續受影響","1571713016","https://l.facebook.com/l.php?u=https%3A%2F%2Fudn.com%2Fnews%2Fstory%2F7327%2F4108372&h=AT3NVsb5Xak64FrfoETiqO5Wod_73V-Y2CbOmZANMytfZe8mwBxmjlT3Qj4nEAdpYO23NWJWSMILfR2L4hF9cv_jMgqz7wXnu7bBuTaLPW_MWYYwkVmjGfw7K6AYV1rRWBZfBj91dxGXGGnp8JbhV_j24gI9kg8yuYMTDI8KSF7car_Hka7OR-J7gi8c_VFG0tYJPqtm1ZXYBR161zRuP0jza-yhDgGiUji3re3Sn61Wjakg8K9pRAmkoLP2Z-alaLpZotU01zjn4WMgJKaV2FRv-03dJ0El6GtqFF0W2QEJasXgyyOXvLQZONZAdFL_2KIY3i5t6WiCk-yGt3Mwqeubag-uDSZx3EgnmwL1niOBeRTuKdeXMkBkgJbPwQMe4H1-pOiGcXxmVRcSARd8xDKdPBna5DxUDTeYUMRJ5iqSVsXmDI1ZjwjoRdHbFdp0_ALpnoHEzBsLNt0IVyHX6-jqQoVyUJ7ZX8u2W4uhOU6tcnfLcEKn-HTtZz5pXvFKjVBDU8V-Jxw1WSgSqWOB73jlcKaMoKRLT9JEgEEmoM6lyXuZfS6nhVUH3ihSzMuDYwFIYUss-Fp7Z9sp6Blp7Fu3KRIglr0NbjOlVszhHl3SKvmqbQf3cdCsJYKYgdihB-_Pk8qTqW2gBuHq5NE","https://external-sin6-1.xx.fbcdn.net/safe_image.php?d=AQCWMXDYCE62L3Dk&w=540&h=282&url=https%3A%2F%2Fpgw.udn.com.tw%2Fgw%2Fphoto.php%3Fu%3Dhttps%3A%2F%2Fuc.udn.com.tw%2Fphoto%2F2019%2F10%2F16%2Frealtime%2F6949198.jpg%26s%3DY%26x%3D0%26y%3D50%26sw%3D1280%26sh%3D853%26exp%3D3600&cfs=1&upscale=1&fallback=news_d_placeholder_publisher&_nc_hash=AQAa9_dDLQUtDtKg","Image may contain: one or more people, beach, sky, ocean, child, outdoor, nature and water","陸客消失中的墾丁好冷清 民宿業心情鬱卒座談會大爆發 | 聯合新聞網","屏東墾丁觀光旅遊業去年紛紛創下近10多年來年營業額新低後， 今年上半年好不容易出現回溫，卻遇到大陸暫停陸客來台自由行，雖..."
"https://www.facebook.com/goforTaiwan/posts/2434441033479028","1570064402","東協十國與中國大陸、印度、日本、韓國、澳洲、紐西蘭等16國間的自貿協定「區域全面經濟合作夥伴關係協定」（RCEP），在歷經長達七年的馬拉松式談判後，終於在印度同意讓步後取得實質性進展，可望於明年簽署。日前於越南舉行的最後一輪磋商中，此前遲不肯讓步的印度同意對其他成員國減免關稅，其中80%的中國產品將得到優惠待遇。按計劃，印度將立即對28%的中國產品取消關稅

 
美國今年6月取消印度的最惠國待遇後，亞洲市場對印度而言就顯得更為重要。一些國家也在服務貿易上對印度開放或退讓，如澳洲和紐西蘭就在專業技術人員流動上照顧了印度的利益。印度對中國產品的減稅採分批分階段進行，寬限期最長達15年
泰國副總理兼商務部長拉卡薩納維西特（Jurin Laksanawisit）在9月第七次RCEP部長級會議上曾表示，談判結果將在今年11月東協峰會上宣布","1571713016","https://l.facebook.com/l.php?u=https%3A%2F%2Fudn.com%2Fnews%2Fstory%2F7333%2F4079630%3Ffrom%3Dudn-catelistnews_ch2&h=AT2aCChoJDufAHSxaSCcApIQW-z9gMGDydOcl1-X-FoD5xosI0RqvoX-lM744OVZsDksG5yqXRol0cArWEBk59FLXLRl1eg_lYQgt8ggrdjrVSmQEr2Fa-71BWdcwUBcj6cdEWX4EaWKWsE3_iQzK8jcgItqsrinjjUScSXMRTsbFp0WEp8fmldotwosuD5L3rothUEfqjT49bZ1EtZ5rcObKi3ou1DWjgu1F1LpvJmLszhtDsN6SVR_j-AbOFH7MNdR0M0DMNprsr9cM5LM9jT4QTHs3BErLfinqoPgEvUoYQjj-AhEVZs0-o6lg0xYTEoJIbL0p1JCWMhwx_UoB48zTFxlQlv40FCH_u5bYFTMqo1s_DBsqxFAgJrEIkitgYP-dgw6d8K0jYdypSvd8FrQBNSOP4AzN3gP3j8KxDnQIrqwZKY85TX2ZppbJxvCJkMaPg2vQNDmAddjthWTQS_Qlww9H5n5Y7MYXR_5ZrU5C0cY2DY6p5SIcoGPRW2C7fGAcszpVhugd2NpKJe37jXSu1feA3G_m_NYTtihimDJ619qswGgnwFhBW1ZxyGqJ2r_M800_RcNlBJ39GQRCJkmiP8oPccIt9LnulRMpoSEi_Zz-_TPJUd1INbwHmzWZEI-wub4JhujDq3BL5Q","https://external-sin6-1.xx.fbcdn.net/safe_image.php?d=AQDX3xZGZTORAe_U&w=540&h=282&url=https%3A%2F%2Fpgw.udn.com.tw%2Fgw%2Fphoto.php%3Fu%3Dhttps%3A%2F%2Fuc.udn.com.tw%2Fphoto%2F2019%2F10%2F01%2Frealtime%2F6888514.jpg%26s%3DY%26x%3D0%26y%3D0%26sw%3D550%26sh%3D366%26exp%3D3600&cfs=1&upscale=1&fallback=news_d_placeholder_publisher&_nc_hash=AQB7V_c81phhpPaW","Image may contain: one or more people","印度讓步 RCEP談判取得進長 可望於明年簽署 | 聯合新聞網","上海第一財經報導，東協十國與中國大陸、印度、日本、韓國、澳洲、紐西蘭等16國間的自貿協定「區域全面經濟合作夥伴關係協定..."
"https://www.facebook.com/goforTaiwan/posts/2436011273322004","1570264200","總統大選當前，高鐵南延案突又端上檯面，這回不僅由蘇貞昌直接拍板，連路線都欽定了，且還是早已被交通部審查會否定再否定的路線。為的只是跨過高屏溪象徵意義的「假南延」，難怪不只高雄市政府不滿，多數屏東人也不埋單。

 在執政者的政治與選票利益下，這些鐵道局官員必須一再做出違反專業評估的路線方案。更難堪的是，蘇貞昌大筆一揮畫定了當初早被否決的路線。","1571713016","https://l.facebook.com/l.php?u=https%3A%2F%2Fudn.com%2Fnews%2Fstory%2F7338%2F4086838%3Ffrom%3Dudn_ch2cate6643sub7338_pulldownmenu&h=AT18YxrBfNBzqdqWUsNEBO3GXUpROhlqpvbO_Wy5nSJxNde-JWeqE7-kFk2qnRS4WT0_0AQFxusMzjjHHQBA6HU1Z8g1rV5QLIY88kh57rDWCaX9niH5qtvR1NEXlFkb9aZdup7nkXh8PX6CsZFK5Y-46hDNfZx_BmCbsgRlElaTPq_maQFYel3NF_utdPfLtgs2OyaOAZ0b35cx_PFB5H1p5PUMwzsvoLKMJGE4-bQ_nn9rnF4Tf-TEBbAxPk3D6FOKk9R1Y8PV-F6SON5DO9TorBOC9L8UdFGtuI9Cu2_g3wjO27q5P7KFEwNgA2vLgccI-5u8VVor2r_MjoukqLDiY_X4BJ9E_Jf5hsiNG6bg4LIKTYHRzamPXi_wD8f13GhWAMo1qlGQfB8tWeFNF6DIIKa8EdfT0bd8jbFITm9s53idQmQmZfIylj7QxbqVvNN2LhQhPB5EQ7_GKjfp8oLpYFWpTg6QAuAVhwGw1x6d1xrEQuEZlUGT5Cb9X5ekkHNRNEUvzilu_wp8tmLdD6ZMPJdQJ0uneg2MxIyAEvwz3pindq2w7UHjca7fJT7OP21lZ0YI4TpPtXqfxIhaUhJCQ8cyH1P7TSw8uZzHQP-FkXdUpewubL5GbD41DF9eFMAmplo4YKmp_LvcHDI","https://external.fhan2-1.fna.fbcdn.net/safe_image.php?d=AQBApSWlUHFwOEYH&w=540&h=282&url=https%3A%2F%2Fpgw.udn.com.tw%2Fgw%2Fphoto.php%3Fu%3Dhttps%3A%2F%2Fuc.udn.com.tw%2Fphoto%2F2019%2F10%2F05%2F1%2F6903206.jpg%26s%3DY%26x%3D44%26y%3D12%26sw%3D980%26sh%3D653%26exp%3D3600&cfs=1&upscale=1&fallback=news_d_placeholder_publisher&_nc_hash=AQB1t2jxjh5pPdy-","Không có mô tả ảnh.","聯合報社論／高鐵南延，蘇貞昌輾碎專業制度與文官價值 | 聯合新聞網","在蔡政府選前大撒幣、大送利多下，高鐵南延案也被當成政績放送。行政院長蘇貞昌先是大張旗鼓跑到屏東開記者會，當場宣布高鐵南延，連路線都一併明示了。半個多月後，交通部開審查會背書，未表決即拍板通過蘇揆屬意的..."
