url,posttime,text,crawled_time,attachment_link,attachment_img,attachment_img_alt,attachment_title,attachment_brief
"https://www.facebook.com/goforTaiwan/posts/2295518940704572","1552897800","江宜樺在5年後的今天接受電台專訪，他表示，從未後悔下令驅趕群眾，並批評學生要他答應撤回服貿，否則免談，這種要脅占領的態度像土匪
他原本在當天下午要去跟學生談，但學生只問他要不要撤回服貿，完全不溝通跟討論，這種「除非答應，否則免談」的態度
江宜樺說，他不贊成要脅占領的方式，如果所有的公共政策都變成糾眾占領，那組幫派就好了

 
江宜樺說，太陽花學運用亢奮的情緒把台灣弄到難以翻身的深淵，不管是貿易經濟、兩岸關係或是社會發展，其實經過318之後，讓台灣本來要整合進經貿體系中斷了，兩岸協商停擺，兩岸關係到2016政黨輪替後更加僵化
現任政府有更多公共政策根本沒在委員會討論，直接逕付二讀，這些強行通過的過程，「抗議黑箱服貿的人有出來講過一句話嗎？」包含之前的年改跟勞基法等，都不知道黑暗多少倍。江宜樺還說，現在民進黨在立法院是多數，但「兩岸協議監督條例」卻沒動","1571713038","https://l.facebook.com/l.php?u=https%3A%2F%2Fudn.com%2Fnews%2Fstory%2F6656%2F3703749%3Ffrom%3Dudn_ch2cate6638sub6656_pulldownmenu&h=AT0MfzNjnZUXIQ2l6ggS49LO_aAJp7CVvcYfL3dnWEGmjA5hbTbYa2wstozplWjMZY2SXbphA9C05RapMbxf3TdcEjSvjkCtC-bj5tX8NSw6IK8mrLOEqUMe2ylYJ3VOQiweypRJ_D6bcldRYj4S7NHZUmjPFiv5V968c3sLebL7vqIvaBAT0apnmyASIp98NG-yPO5w0YfSDrJtkBFn309ZftaGtIpOf8d43aISxm2fzrR9RO3kwKd-sfqqsNRUxFBL5wv919WEohLIKWiZ_8rvvBbLOahe2m6VcnwQFaUEOtZBLXJ5qau7SyiIL_Iqi7AwRwS1fM8ExFVMLkBGSM57GReMNgay304_B0Mad1O-3r547PIr9yOpQ3oJM7eyu56nMZ_twbC22jJ5LVlSJ5CON03Ojp9W42X_4iMgYjMfT1AfS8mCLMcOFhivbr3KiWJGtKCS9aEJRv7EuDAUzqMmdBS1LjvI6Mlh-usF4DxRZtHf0p4AGVKFjUbIsDtloed_29gKhZVavh-pD7vMI4zoaCWsYI3xjDsfwz_YJ-Y4TYbJaeax7w18fyX1NwKP0sO0WLZZBzKDZwf1fPPE6b5G9ClTqtUxAq7AePAgg00PH-4yBi6ah7Lazpc52WmvGypqRzirhXjSSjumosQ","https://external-waw1-1.xx.fbcdn.net/safe_image.php?d=AQC-i_xEgtydyF3t&w=540&h=282&url=https%3A%2F%2Fpgw.udn.com.tw%2Fgw%2Fphoto.php%3Fu%3Dhttps%3A%2F%2Fuc.udn.com.tw%2Fphoto%2F2019%2F03%2F18%2Frealtime%2F6061574.jpg%26s%3DY%26x%3D0%26y%3D0%26sw%3D1280%26sh%3D853%26exp%3D3600&cfs=1&upscale=1&fallback=news_d_placeholder_publisher&_nc_hash=AQDppZb8aBFdyuUz","Image may contain: one or more people, suit and indoor","不後悔驅離 江宜樺批學生要脅占領的態度像土匪 | 聯合新聞網","318學運「反黑箱服貿」行動影響國民黨至深，更導致兩次選舉大敗。時任行政院長江宜樺在5年後的今天接受電台專訪，他表示，..."
"https://www.facebook.com/goforTaiwan/posts/2327283517528114","1557126071","請問蔡總統 FB 是美國🇺🇸貨還是台灣貨？平台是美國的，server 是台灣廣達的。","1571713039","/waynechen2018/photos/pcb.2370873356535749/2370873123202439/?type=3&__tn__=HH-R&eid=ARC5JZ52lvWmSfKZ-VtFJXCMUe9aT-ENkGcFu1EjITP-Gw1E54w1AOmDjXN1MWDTzNKwk3m52UqyJQ0I&__xts__%5B0%5D=68.ARB_3SCh72lcZ_X8OmkbQKQg5Y9ivRNdVRfF9rHKgNC8e-aiiNWtAsG2k65_-V8Aa5issWgRt0sslewQBNtCU0lYvuDq9hzSgPWqzyVEt0UZUkRxX4mOXVM5bYdlxBF_gd4VjKWdy4k1mcD3NKo_YxIacOcgi-fLSPeHk08Z_r0_TVthda33tSd0BFoxJGWw8xtgH_aO97KsIoLwGzponfiA36WcldrTBFzTYGfaJT50d6h8gbmujakWHCP2gfpBIVzFJUBltJQrR8PpU87CLm1HmTkZR-NHBgDVP4_9wT0viiPBBqBuZ1zpZxjkZ5VoZ4LC_eIowkKRBBq0k2OuTpW441x4QOypVsSXRQECWjnu_w1RWTodC3Bd34WM9xcl5OztuAQ5rAY2sEpQ7Qs9ff58YkUCBIn8BxHjldMKIc1aJrrLb2y2NrFQnJehwRGyDkzoWutufMZsQFqt6sqYlJEh02eCLWO038-NcC0FlZi2sQRJ_OES0RVacrsEoQ","https://scontent.faep9-1.fna.fbcdn.net/v/t1.0-0/p526x296/60004314_2370873126535772_6325594749415718912_n.jpg?_nc_cat=100&_nc_oc=AQntxoXq6cR_ECOAr_7DMbt4i65SgmHJcM9_LNvKNnWAYuchCElLP_JUhas6Ece4FEg&_nc_ht=scontent.faep9-1.fna&oh=77efa63c9f3d19806fce5c18e5133e35&oe=5E2A7FA5","undefined","陳孝威 - 威你而走",""
"https://www.facebook.com/goforTaiwan/posts/2388528068070325","1564543800","「綠油油」的何止華航？放眼事業單位，小到子公司、孫公司無不一片綠，誰能為這些莫名其妙的人事負責？最諷刺的是，貪汙在案保外就醫的前總統陳水扁，也能評點這是「國際醜聞」、「變本加厲最駭人聽聞的重大弊案」，總額六百多萬的萬條私菸，比諸扁案連百分之一都不到
但不以人廢言，陳水扁的「警示」，還是有值得參考之處：「蔡總統如果對自己人輕輕放下，就準備在111（總統大選投票日）重重摔下」

 
私菸案爆發後，媒體報導華航資深副總羅雅美因為蔡英文出訪看到她時親切叫一句「小美」，職位立馬三級跳、薪資暴增到近年薪三百萬，這些對民進黨不會是加分。執政當然有權力安排人事，但不能只要「自己人，什麼都好」，還是該有點專業、能力的考量，最重要的，不出事則已，一旦出事，到底誰該為這些被塞進事業單位的「黨中人」負責？呂秀蓮批評華航綠油油，兼駡九合一敗選後，落選人全部升官
呂秀蓮驚呆事小，丟江山事大，民意反撲的力道永遠超過權力者的想像
https://www.storm.mg/article/1534437…","1571713039","undefined","undefined","undefined","undefined","undefined"
"https://www.facebook.com/goforTaiwan/posts/2525465577709906","[Error]: TypeError: Cannot read property 'attribs' of undefined","",1579438510,undefined,undefined,undefined,undefined,undefined
"https://www.facebook.com/goforTaiwan/posts/2506593939597070","[Error]: TypeError: Cannot read property 'attribs' of undefined","",1579438510,undefined,undefined,undefined,undefined,undefined
"https://www.facebook.com/goforTaiwan/posts/2524865997769864","1578353430","王鴻薇今則是臉書上爆料，指最近政府查水表滿天飛，一向強力監督蔡英文能源政策的陳立誠，其「台灣能源」部落格出現了一篇新文章，指出Google提醒他有「接受政府支援的入侵者可能正試圖竊取您的密碼」。GOOGLE在製造假訊息嗎，亦或是政府網軍已經如此狂妄大膽到要竊取反對其政策者的密碼？
https://udn.com/news/story/120905/4271498",1579438510,"https://l.facebook.com/l.php?u=https%3A%2F%2Fudn.com%2Fnews%2Fstory%2F120905%2F4271498&h=AT2arpRtCOpHR-mJ-V6vmSgkNDrc---W4UbSf5LWAXzaEgC8Xt2xqhVuDVVOlKh9jazqsdJ60UCwjNi9OHudpxkMiac2TkWw8NXnMY9pvCXpcNigbiYcnJnUTFHsXFdZzWIFCCgMXiB0Qsd7xHayOqkscD22LShYqJVGGuzKuCdnoEW1BaJ2ZYztglgAKEaIS45s9QogKrANR9Cn2AVVAIkpd8uO90medPAgm-MdVR730A0peY998xZb3X1HcrCizH7nHzrhll80c_X2dVKla6yEfExvZQQw1IhT44G6RJFCgrBVJ-TmGXx_UlE88ooqqYwkxmln8rjYaJC-df-ZMHU5eIsjt6GUmFjWyx1bTzOFbOybNuCmSdk5N2-afWSoNFrZ0S11nHPwccJt2e5ygScGfH7hsOA0nkQ1WGYaoXNFRX0aGyVeopDCu-BAFY2GoHVezpie7tD_e_v7rhpaL1_iRU5kpvVRUIywmVQUbhGhI6GHwBFq4kO27WZlpIzJWMIVB8IzxP6fVI42qfctNsy02LVXGcppiB6nsHewueeTMf3vUTmuNa5aPs0nETMkllyNwZ6uyTRORcJ2ktvPTcELMsl-1w0hJM2W_CKLV2EbE9ywDB4xuVNSJo2RCu-dyhebRHoUN2Lhy2TonGJw0_hXVw","https://external-hkg3-1.xx.fbcdn.net/safe_image.php?d=AQDUnnJbZ2sqyJ1F&w=540&h=282&url=https%3A%2F%2Fpgw.udn.com.tw%2Fgw%2Fphoto.php%3Fu%3Dhttps%3A%2F%2Fuc.udn.com.tw%2Fphoto%2F2020%2F01%2F06%2F1%2F7298154.jpg%26s%3DY%26x%3D14%26y%3D20%26sw%3D1038%26sh%3D692%26exp%3D3600&cfs=1&upscale=1&fallback=news_d_placeholder_publisher&_nc_hash=AQB6n9tCkHNtz-RO","「政府級入侵者」竊Gmail密碼？ 王鴻薇要蔡英文踹共 | 聯合新聞網","台大政治系教授蘇宏達，去年在臉書批評故宮政策，遭警方用「假消息」約談，依社會秩序維護法，函送士林地方法院，儘管士林地院認...","udn.com「政府級入侵者」竊Gmail密碼 王鴻薇要蔡英文踹共 | 聯合新聞網台大政治系教授蘇宏達，去年在臉書批評故宮政策，遭警方用「假消息」約談，依社會秩序維護法，函送士林地方法院，儘管士林地院認...台大政治系教授蘇宏達，去年在臉書批評故宮政策，遭警方用「假消息」約談，依社會秩序維護法，函送士林地方法院，儘管士林地院認..."
"https://www.facebook.com/goforTaiwan/posts/2527575610832236","1578540606","盧秀燕上午指出，從基層聲音發現，民進黨過去一年執政經濟不好、亂象叢生，民眾希望改變，韓國瑜的總統選情審慎樂觀，而台中市民殷切期盼解決空汙，但過去一年中央冷嘲熱諷，連口惠都沒有，台中市的民進黨立委也不替大家發聲
她說，台中市8席立委國民黨僅3席，這樣太少了，希望這次能過半

 盧秀燕說，最近一年來，台中市府全力在整治空汙，但卻是一個單打獨鬥的狀況
https://udn.com/news/story/6656/4276506",1579438511,"https://l.facebook.com/l.php?u=https%3A%2F%2Fudn.com%2Fnews%2Fstory%2F6656%2F4276506&h=AT3_8wPUOUqBxmgqmi9WgBIbmw5XTEFlsAj95ppsSXuQ-uCSWkVlsA0jqLdHFP89PWmhKqBbOdZUzM0MQw4HoYcskUsHHvoMDHfcaMMkVsvjILyH5WPCJx-IC7Az9U1XvWbyR9EhWdaDvMjwmRyUynxe2Ck_mWbDP6w_--i6f-JyLu1qggfisHC7V5BgXWU4g3HXZhdhf_h6cB-FZ7LrKib3bQuP6aUFSkA7NjK3s7jLm86AXqWIfbLJbcHl5p_EUw-NkcYUCZbyFDr9yKOKzMVFqaH0o1Ko9nyeQyarQYOqP8onq-vqiAI1SLt2GHgwUnsjbda_cqKBw-ITRpWU8OuKsYTiSWKgG0kwzUMDzCIKwwa3KN2gl8gUrjfd38vMocQ8xkEsVAl9i87wY_kY6VUIDca_356bmb7IOV6WrwYwx5TWtzX6Nh3_14QNJn8CiTyowFB_yPVCZ_fVhFoJ0nJUgd_VoKsE_YlJ7y4iiyI-zrDN6Rxgg_lyFiQ6dOjJLCKPfi55FAoKZbknLsG9dDtqk1tu1I4lADYzCSqsCVg4oL5D1RrQGc6NRo4V34VG1slGr8di46KczRX4WVDyHuvnzCq9aO8neSm9RzFnl2KPkz_VqxUMdd3-W32X1e37g390ps7GLChWor1W_U4","https://external-sin2-2.xx.fbcdn.net/safe_image.php?d=AQBfikw2mk0d13vy&w=540&h=282&url=https%3A%2F%2Fpgw.udn.com.tw%2Fgw%2Fphoto.php%3Fu%3Dhttps%3A%2F%2Fuc.udn.com.tw%2Fphoto%2F2020%2F01%2F09%2Frealtime%2F7309845.jpg%26s%3DY%26x%3D0%26y%3D9%26sw%3D1280%26sh%3D852%26exp%3D3600&cfs=1&upscale=1&fallback=news_d_placeholder_publisher&_nc_hash=AQCkDPL79jcwk8jx","No photo description available.","台中市長盧秀燕上午指出，從基層聲音發現，民進黨過去一年執政經濟不好、亂象叢生，民眾希望改變，韓國瑜的總統選情審慎樂觀，而...","udn.com看總統選情 盧秀燕：人民希望改變、審慎樂觀 | 聯合新聞網台中市長盧秀燕上午指出，從基層聲音發現，民進黨過去一年執政經濟不好、亂象叢生，民眾希望改變，韓國瑜的總統選情審慎樂觀，而...台中市長盧秀燕上午指出，從基層聲音發現，民進黨過去一年執政經濟不好、亂象叢生，民眾希望改變，韓國瑜的總統選情審慎樂觀，而..."
"https://www.facebook.com/goforTaiwan/posts/2528767390713058","1578652258","藝人徐佳瑩在臉書張貼文字，只說了「離家9天回來有2老迎接真好」，竟被解讀是對政治立場表態，網軍就出征了，對她進行羞辱與攻擊。如果有人說，我阿嬤今年９２歲了，但她還是要去投票。難道這也可以扯是在挺韓國瑜跟國民黨嗎？如果徐佳瑩真的挺韓，她不能光明正大說出來嗎？

 吳念真公開挺蔡英文，自己寫稿配音
反之，徐佳瑩連表態都不是，只是湊巧寫了個數字，竟然要遭到此種待遇，這些網軍是犯傻，還是有病？台、港的自由民主真是愈來愈像了，只要不合自己的意思，就可以去黑他、甚至打他，將人打個半死，都無罪。只要民進黨繼續執政，網軍就保有繼續暴力出征的權利，黑死人不償命。

 連９跟２都可以被出征，明天過後，難說「下架民進黨」不會變成敏感詞，被當作「被滲透」的證據！只能在月餅的餡裡藏著字條：「某月某日下架民進黨」！
https://udn.com/news/story/6656/4279431",1579438511,"https://l.facebook.com/l.php?u=https%3A%2F%2Fudn.com%2Fnews%2Fstory%2F6656%2F4279431&h=AT0HmYvygY_tV5hJJ_hDMl0yUnQSauX4UucKdbT9EDPWskEZyjP6TA4GgcX8ib6e78BpK_kA1GrcZ50qrv5WbyU9E3jP_ElNdH9UUgHkIB3t0aMTPJhk3ud6m7EwXUBhTtAxZ1k0MXWuaKxhMAjRas4qOmmDSM1xkGKdDewsh2wVDaHEZrrW7bXrH775ssUx2VML4airuQyWS8nDCmYCpy4kCv3w0V3G3VCBK6Xaq2tXVR3ucfz5xwQJBIfH0Pt_SuS9kw4k6BSP_bLZDe-DSPNNSMislkPtZNGGEN7r7V-CH2LVjA2_WhH7ob7yAPJsdW4ZNraR9oS3DgUB5UMRjY1Y3-riRKCSiKRYyMOIU3IjWXlGMdvwGuimOPUygfif2OrPEqNHxSARhjv0QxiD1DDcUNug-eI4fGQq7Jg39MdS_Y-sUM308TB0cGT2-CCgczwNKfru9aQGTNLP9jHlcQMLMrth2Ps7cW7sewWNDcMDj6hx5rjh5C64CTonDgJz5ttria3N8-YrA-ecE2saZkd63mQnQj_1z88JSdFU6aYIbv5FOCjSUVFWNdCFQCmEMO7T41X4_Vs-7u332_1ZUXSFur26Ul8IKRIbNgx_czrFW92jcpitJAhPWU-5MmpvJ4NxiUsUhcZ7OkyMyA0","https://external-sin2-2.xx.fbcdn.net/safe_image.php?d=AQBP0Rz3JHdz5_qv&w=540&h=282&url=https%3A%2F%2Fpgw.udn.com.tw%2Fgw%2Fphoto.php%3Fu%3Dhttps%3A%2F%2Fuc.udn.com.tw%2Fphoto%2F2020%2F01%2F10%2Frealtime%2F7316058.jpg%26s%3DY%26x%3D0%26y%3D9%26sw%3D1280%26sh%3D852%26exp%3D3600&cfs=1&upscale=1&fallback=news_d_placeholder_publisher&_nc_hash=AQDOCQ0bh7LUzxgk","No photo description available.","蔡英文執政下，出現了兩種新型文字獄，一種是警察查水表、調查局上門抓人，只因為你寫了或轉貼了一些無關痛癢的文字；另一種是由...","udn.com【重磅快評】92可被出征 「下架民進黨」也可被滲透 | 聯合新聞網蔡英文執政下，出現了兩種新型文字獄，一種是警察查水表、調查局上門抓人，只因為你寫了或轉貼了一些無關痛癢的文字；另一種是由...蔡英文執政下，出現了兩種新型文字獄，一種是警察查水表、調查局上門抓人，只因為你寫了或轉貼了一些無關痛癢的文字；另一種是由..."
"https://www.facebook.com/goforTaiwan/posts/2526441357612328","1578457573","韓國瑜陣營號召百萬庶民在明天晚上走上凱道，將支持韓國瑜的能量一口氣爆發出來。韓國瑜指出，20年前民進黨造勢人山人海，為什麼現在要靠遊覽車動員，發便當、發禮物，這就是因為失去民心。韓陣營明天晚上在北市凱道舉辦「凱道勝利晚會」，視為決勝關鍵
https://udn.com/news/story/6656/4274565",1579438511,"https://l.facebook.com/l.php?u=https%3A%2F%2Fudn.com%2Fnews%2Fstory%2F6656%2F4274565&h=AT2AyxIjGmRKylUeIskOkbYv2cWnr5IO_XNL1Kf2S3VBUdqsxywBKWaNuuAf058f2P0mCf1TZkxgi9wYST9s8ZDcE3uXXHDQY3AxM3f_1fMusLJk_mh8LWRllYohD5eMzJHNA8qip_DdCZOMxJUdSGyEmC_nf0hWLip_qiPJdyR9SrpzNIP29F3wKPuZsCyGfjp91Xm5INkpHMZlOd0gyPu4JJ1PKPXeMd4ZaxkV3ZBbiUdIKEmcbE9ligfXeoMqyYlFrwBRHZRyxJQU4M7x69xXOueV5606q-JOfirQGWJg5GybAH8NDpYhn8UWg2AZeWkViHYXZUL1aPoy1u3Y_JmX0qrghC0TeNrSe2swirJTLb4CP72LOqjYmZVcy4sQtK_i8cG2IIEjw3D8NooLMc5-H0auIUOF6n53zEroo2eTppzJIrZJbZbrjDEV81DGH_rS2WjmV8KtANMkeiEoL6O00CLur32tGqQwOW0oQQnpsGLg8VSlCG5kOv5SoDoFm-tVdom4Td5HKwVyoEA65iOrQ3gzpVRQ-Ex0P8meM559j9AwpSB1aCR1V_Qwx-pie3mtJyrZIfYJXhaAfJchwcNwgF4giogN4ZlGqThlpERsgVX7TOZ3jdR87NSwIj40uA6_pjv5DEyEF0tuLFw","https://external-cdt1-1.xx.fbcdn.net/safe_image.php?d=AQC4Or4JAcHJ3quV&w=540&h=282&url=https%3A%2F%2Fpgw.udn.com.tw%2Fgw%2Fphoto.php%3Fu%3Dhttps%3A%2F%2Fuc.udn.com.tw%2Fphoto%2F2020%2F01%2F08%2Frealtime%2F7305421.png%26s%3DY%26x%3D27%26y%3D0%26sw%3D1101%26sh%3D735%26exp%3D3600&cfs=1&upscale=1&fallback=news_d_placeholder_publisher&_nc_hash=AQBG5GR3aHCTHrdy","Image may contain: one or more people and child","選舉倒數第三日，國民黨總統候選人韓國瑜陣營號召百萬庶民在明天晚上走上凱道，將支持韓國瑜的能量一口氣爆發出來。韓國瑜上午受...","udn.com拚百萬庶民凱道見 韓國瑜:國家存亡關頭 自動會出來 | 聯合新聞網選舉倒數第三日，國民黨總統候選人韓國瑜陣營號召百萬庶民在明天晚上走上凱道，將支持韓國瑜的能量一口氣爆發出來。韓國瑜上午受...選舉倒數第三日，國民黨總統候選人韓國瑜陣營號召百萬庶民在明天晚上走上凱道，將支持韓國瑜的能量一口氣爆發出來。韓國瑜上午受..."
"https://www.facebook.com/goforTaiwan/posts/2526801400909657","1578526207","韓國瑜說，中南部人民最倒楣，支持民進黨30年，把民進黨當親生兒子養。30年前、20年前，民進黨的候選人站在台上，一開口，民眾就從口袋掏錢
但20、30年後，現在已經2020年，全台灣過得最窮、發展最差就是中南部。給了那麼多的機會，每一次選舉都投民進黨，結果自己日子過得這麼苦，這次南部人覺醒了。

 韓國瑜說，民進黨最怕的是失去政權，怕失去政權之後，他上台成立特偵組，針對所有可疑的政府的施政、預算、政策進行徹查，抓到這些貪官汙吏、會讓事情東窗事發。民進黨
在其中大貪特貪、大撈特撈，這種撈法就像「匈奴」，撈完以後，時間一到就走人。
https://udn.com/news/story/12702/4275694",1579438512,"https://l.facebook.com/l.php?u=https%3A%2F%2Fudn.com%2Fnews%2Fstory%2F12702%2F4275694&h=AT04d8biLSRAg-9aG08gs-aZWkXDOc5BfGPjB20A_qWznXUEfue_VvhhG7zLAgDtNPkAsRjKViozEbPdXj7BAJm6Q8mUOlQVcEb973d8tWCZJA6dMaXTPvhZOPAW7XYNdauJ9zF2HvjrT1B5QI0XcXoOg6r1cOBpfdhn4ubki56iQW5FMfaFUwiqh9lNl4Vg66HOX8cHGcBGsEth8tJB59Do_XywpyvPAWOpwbuk1JSRrYaCWvJSqxVE94UUR1kOAEDYDYB9IHD9-TQb5D8XDEeC2ArX3JQNjAzXevy4Xpcgx_9hDC6iA6TqK6N4fwulruS_a8UJWSWcZo3AWX1hYCC6p-Lg98PnlvoSBVTBgwtRfPpZsaLQtfwOPbcP4MUJYWQWgrdqp7vGl0J-Y111guTvNfoFmwMpnHEdaee5J9q2t_Zew1QdciKOGSYECgaza8KAWPYKNx9PPl3nfV56ZiF4dP3zT2La2mnAHvoVPOAEnrDM57PxdzdorKINe4l1wWEVq1Ebd75yiM752AtGM1tFjJorIsJ9LICccw4QzCYXbP8wAkpO1WIkWhQYwBhXQxno-DOgE3kXBrik-erdvhOdx6eq7nyvGLnCqiosLnqz0b2bMQOipslvOVaYtATNwzhZhieuHaR86D3BvSg","https://external-sin2-2.xx.fbcdn.net/safe_image.php?d=AQDvUJ1l-6LQtU2K&w=540&h=282&url=https%3A%2F%2Fpgw.udn.com.tw%2Fgw%2Fphoto.php%3Fu%3Dhttps%3A%2F%2Fuc.udn.com.tw%2Fphoto%2F2020%2F01%2F08%2Frealtime%2F7307904.png%26s%3DY%26x%3D27%26y%3D0%26sw%3D1101%26sh%3D735%26exp%3D3600&cfs=1&upscale=1&fallback=news_d_placeholder_publisher&_nc_hash=AQBgSDL5p30OEaN-","韓國瑜：這場選舉可見民進黨失去民心 中南部鄉親覺醒 | 聯合新聞網","韓國瑜說，從最近選前藍綠幾場造勢，可以看出，民進黨執政一、失去民心；二、中南部鄉親覺醒。如果民進黨是一個磊落的政黨，一心...","udn.com韓國瑜：這場選舉可見民進黨失去民心 中南部鄉親覺醒 | 聯合新聞網韓國瑜說，從最近選前藍綠幾場造勢，可以看出，民進黨執政一、失去民心；二、中南部鄉親覺醒。如果民進黨是一個磊落的政黨，一心...韓國瑜說，從最近選前藍綠幾場造勢，可以看出，民進黨執政一、失去民心；二、中南部鄉親覺醒。如果民進黨是一個磊落的政黨，一心..."
"https://www.facebook.com/goforTaiwan/posts/2525404444382686","1578384021","黃士修說，蔡英文總統不用把這些入侵行動又推給中共網軍紅色滲透，這一切的一切都不是巧合。芒果乾炒了一整年，中共網軍沒抓到，PTT倒是有上千個英派網軍帳號被起底，害死蘇啟誠處長的網軍頭子楊蕙如持續逍遙法外。批評政府的市井小民，一個接著一個被警調單位傳喚。
https://udn.com/news/story/6656/4271882…",1579438512,"https://l.facebook.com/l.php?u=https%3A%2F%2Fudn.com%2Fnews%2Fstory%2F6656%2F4271882%3Ffrom%3Dudn_ch2cate6638sub6656_pulldownmenu&h=AT0SE8lX76oee9F4mvSWCB1AGPHC5wne4Ek8PTu_rNUs19EJPoTDnFyDj3-w0LuaOxWNcggFDYqRDj4qtMDMqXnUtncJkRv5YoHcQ9gdnCOZrZTEN_3iOBsm-cTh4GVpfCRwxT0QE9oJTfyOMe7sopdPy4bO02LN53dRlt2DRVccULW3fKf7mR4XCD-fHJJVRTREAVG5s1cdvceTVgy4HcPfRu-p3wXyxWlTEA0yJ1EoFgOMvT4yJtHexfdFDEg6VRUF3qnCyiMVPp4w-hYP_IPGDxuNAS4Tau0OQt86EhyAHtVnwiKugEbP8O_W3bxU4oFZFNwTvEeA6Sht6uzooEqVwI3wgQr2x43n2nSlFG0uWARxqc18nX_XfNg6ZDW8yw0bXzHmNGM_HKgstkstSh_U0zCJCeW_catxhrH-eEaHEp-lGoLXpMyQM7fPPOWg2eaO-qfKgOLkKYqLIPb3UtaQifhpJ1KZgOwRMA56p-BWvIyHqTwZvGZC_xhBBbup2rZC9KEJe6lfD3tCO29N8LwUsX2fdhj-HUA81SdxcI3dF29ZeIaCvIlGIVWvES6U-FRm5PxnnhFjYCEQ8AtF093gqhUVJ9qm0qBjy9ywyFM5gFy0oOS5RfoPYXKVJtZJsf9vyfcnMgolWZVrIM0","https://external-cdt1-1.xx.fbcdn.net/safe_image.php?d=AQAV45LvmXYI4roJ&w=540&h=282&url=https%3A%2F%2Fpgw.udn.com.tw%2Fgw%2Fphoto.php%3Fu%3Dhttps%3A%2F%2Fuc.udn.com.tw%2Fphoto%2F2020%2F01%2F07%2Frealtime%2F7299372.jpg%26s%3DY%26x%3D0%26y%3D238%26sw%3D720%26sh%3D480%26exp%3D3600&cfs=1&upscale=1&fallback=news_d_placeholder_publisher&_nc_hash=AQATjtUWQqOe7aLl","No photo description available.","最近政府查水表滿天飛，一向強力監督蔡英文能源政策的陳立誠，也收到被政府支援之入侵者警告，以核養綠公投發起人黃士修說，這不...","udn.com能源專家也被查水表？ 黃士修：這不是個案也不是巧合 | 聯合新聞網最近政府查水表滿天飛，一向強力監督蔡英文能源政策的陳立誠，也收到被政府支援之入侵者警告，以核養綠公投發起人黃士修說，這不...最近政府查水表滿天飛，一向強力監督蔡英文能源政策的陳立誠，也收到被政府支援之入侵者警告，以核養綠公投發起人黃士修說，這不..."
"https://www.facebook.com/goforTaiwan/posts/2528513904071740","[Error]: TypeError: Cannot read property 'attribs' of undefined","",1579438512,undefined,undefined,undefined,undefined,undefined
"https://www.facebook.com/goforTaiwan/posts/2499856256937505","[Error]: TypeError: Cannot read property 'attribs' of undefined","",1579438512,undefined,undefined,undefined,undefined,undefined
"https://www.facebook.com/goforTaiwan/posts/2524329294490201","[Error]: TypeError: Cannot read property 'attribs' of undefined","",1579438512,undefined,undefined,undefined,undefined,undefined
"https://www.facebook.com/goforTaiwan/posts/2526447360945061","1578470456","一名司機開罵，蔡英文「假會」搞一例一休，讓他負債至今還不完。另一名運將則稱，馬政府時代一塊遊覽車車牌值五十萬到八十萬元之間，現在一塊車牌只剩五萬元。後者作出一個頗經典的總結說：今天的民進黨，就像廿年前的國民黨。這幾個運將的說法應很能反映基層的心聲。他們身在綠營造勢的場合，也正因為蔡英文來才有如此大規模的動員，他們才有這趟生意可做，但他們毫不掩飾地說出自己的不滿。他們也知道自己正面對網路直播，甚至有人從旁半打趣地提醒這些發言可能引起「特偵組來抓」

 
廿年前的選舉，國民黨才需要用遊覽車動員群眾，用歌舞表演來吸引民眾，但許多人領完便當就離開，不顧台上造勢活動未了。而今，需要用遊覽車載運民眾到場的造勢活動，卻變成了民進黨，因為已無法吸引支持者主動現身；反而是韓國瑜的造勢場子，群眾的表現更為熱情。身為遊覽車司機，這幾位運將敏銳察覺到政治氣候的翻轉
這幾個運將原本是民進黨的支持者，但過了三年苦日子後，這回有人改變心意，決定「不要被騙兩次」。

 
民進黨如今因集大權於一身，所以能一次動用一、二千台遊覽車運送群眾前往造勢會場；反觀黨產被凍結的國民黨，無力雇遊覽車動員，但韓國瑜卻能喚起動輒數十萬人主動集結，宛如早年民進黨「黨外」時代的群眾盛況。當年主張「黨政分離」，要求官員保持「中立」；如今卻到處安插派系肥貓
當年聲嘶力竭主張「黨政軍退出媒體」、「黨政軍退出校園」，現在卻把手伸進媒體和校園，甚至把學生會當成綠營側翼打手。當年追求「言論自由」如今卻任意告發人民的網路轉貼，不能容忍人們評論政策，動輒以《社會秩序維護法》伺候。遊覽車司機隨口一句「廿年前國民黨，今日民進黨」，不僅道出基層的民怨
https://udn.com/news/story/7338/4273933…",1579438512,"https://l.facebook.com/l.php?u=https%3A%2F%2Fudn.com%2Fnews%2Fstory%2F7338%2F4273933%3Ffrom%3Dudn_ch2cate6643sub7338_pulldownmenu&h=AT3TuTveq1eK5cBqzLRjQH1nILAf9iQh1THuKjwyeLMc2c0VgeLoUWOAokpm8HxXRMaRt-1JlYiiZjjTa0bLErtMBXJ5kcAWqS2569PhsaGxJDukNnGT9Ro7lW0ivnnuYPq2gfh3Oh9jPyaXvGcMYdl5Y2K10pDSl9kOVKIEzaaYzogQ3DZh9JXt9fgYZqEmCmYHjpse71rSs8cKQg6OgXzBObnea5AXeMIwQ6Ed40MOBAQnnkJTI-b5uwKZhhlILjT0fUoozSaauWukHOSJ28h9ZP_EpPrHlByMpfjQYhEn2zwRiaSzDkEyCe_5eW719tbnTFlv0VhMDCCzw9CegpgscsZ_ign-3CAGWAJdg6KkaO7DGM1uun7rAvg2oVyXf7gFPiAU6TLYwuAURDSrcoFMLN2xaA4Fs0EuHd4YKygDMueN38lQAaoCDUhfNPMqt4LK1LCMNl3jMZuHbZwG0gppR_5MUq679xJrO-XsnG8QXaTyu0ovfCa6FVDUlqnf4YJrueJqvGziuT3sSVzhUMoloN5yJ6HFtDcGupFo2T1NA9WaFP0Cnm31VzfP4zbSc4s6LbDiz2K-wiOFsb5yj6pTwAJ0Fnl5BPyy8XCCJbjj3_MI8TdCNSAFK3ys7PgH-I73KengFPZnqIv5gUs","https://external-cdt1-1.xx.fbcdn.net/safe_image.php?d=AQAalvlq2kiZQUJQ&w=540&h=282&url=https%3A%2F%2Fpgw.udn.com.tw%2Fgw%2Fphoto.php%3Fu%3Dhttps%3A%2F%2Fuc.udn.com.tw%2Fphoto%2F2020%2F01%2F08%2F1%2F7303424.jpeg%26s%3DY%26x%3D0%26y%3D10%26sw%3D1266%26sh%3D844%26exp%3D3600&cfs=1&upscale=1&fallback=news_d_placeholder_publisher&_nc_hash=AQCFHeJHcC-0Nx1H","No photo description available.","蔡英文到台南造勢，有民眾開直播，在現場訪問載著動員民眾而來的遊覽車司機。一名司機開罵，蔡英文「假會」搞一例一休，讓他負債至今還不完。另一名運將則稱，馬政府時代一塊遊覽車車牌值五十萬到八十萬元之間，現在...","udn.com聯合報社論／運將講評：廿年前國民黨，今日民進黨 | 聯合新聞網蔡英文到台南造勢，有民眾開直播，在現場訪問載著動員民眾而來的遊覽車司機。一名司機開罵，蔡英文「假會」搞一例一休，讓他負債至今還不完。另一名運將則稱，馬政府時代一塊遊覽車車牌值五十萬到八十萬元之間，現在...蔡英文到台南造勢，有民眾開直播，在現場訪問載著動員民眾而來的遊覽車司機。一名司機開罵，蔡英文「假會」搞一例一休，讓他負債至今還不完。另一名運將則稱，馬政府時代一塊遊覽車車牌值五十萬到八十萬元之間，現在..."
