url,posttime,text,crawled_time,attachment_link,attachment_img,attachment_img_alt,attachment_title,attachment_brief
"https://www.facebook.com/haulb/posts/2427957913906732","1570235416","#中廣論壇 #南方澳 #新生高 #還專業官員一個公道
南方澳大橋塌陷入海，一座橋樑竟然21年沒有檢驗，造成人民財產損失、生命危害，還有這麼多酬庸肥貓，實在讓人難以置信。尤其看到一批批政府高官，為了作秀往災難現場跑，其實他們又沒有專業，有必要嗎？不僅沒幫助還干擾了救災工作。

 
這幾天，大家都說要好好檢討橋樑安全，讓我回想起，九二一大地震發生後一段時間，民眾同樣關心橋樑安全問題，當時，新生高架橋耐震強度大約只有四級，因此大家希望大幅度提高橋樑耐震強度，最起碼到五級，甚至能強化到耐震六級。

 
我還記得，我就任市長後，當時市府祕書長楊錫安、已故的工務局長陳晉源都基於工程專業，主張新生高耐震不足，有必要加以補強。問題是，新生高架橋是士林北投進出台北最主要要道，想補強，起碼施工一年十個月，尤其最初十個月要全面封橋，周邊交管，連道路都要改道，因此許多人認為，從選舉、政治考量，應該延到我第二任任期再處理。

 
可是我覺得，民眾安全應該是民選首長最重要責任，雖然對交通會有影響，但耐震不足，萬一倒塌真的不堪設想。因此我們基於市民安全、公共安全考量，不但決定立刻補強，更透過工程大幅更新改建，同時對圓山周邊交通改善做了全新的完整規劃與調整。

 回頭來看，現在圓山交通順暢、橋梁安全也獲確保，走到新生高，不但安全、接縫整平，路面由顛波變平坦，耐震最強可達6.5級，真的是件很安慰的事。

 
可是大家知道嗎？包括楊錫安、陳晉源兩位堅持專業、犧牲奉獻的官員，當時因為市府正在舉辦花博，遭到民進黨全力汙衊，無所不用其極的打擊，都被檢調約談，陳局長甚至因積勞成疾而在任內過世。這些堅持專業的官員，不但沒有掌聲，還受到委屈，甚至面對被約談、起訴的巨大壓力，實在情何以堪。我們真的應該還他們一個公道。","1571436941","https://l.facebook.com/l.php?u=https%3A%2F%2Fyoutu.be%2Fr9_Wdn9wjc4&h=AT31d67ayQXtrUlpky6F3sGdqErL82bpbZN8WT4ZURNYvVxPu5-SilMyIfNl0aGmSHRkx-7DH_YwHMPkhr-sQhmHhSDnAxlx08ypdTvDO45Ilw_GRI8EPtWqM6DPZO2jJLF9NdtseUDNjDQVJ9XJKFZoExSVLHKwAlmS1Oad88yuaYeABzy9u2DAyYowLBXMgNy2JPg6kS2WBNf5LPaC3vJbEbLg4U4pcgso9JCdJkBqH5WHhdIqq25iBTaUUAG3jQNICSf9vaJ0oQQUfxsQVG-4J8_YSloOHCbibeQmKW9wAr82TEDWhYN6H7AGZgUaQRs8oArY7YvDfVpab3fufjWKwMGuLKVsVccOP7Ul1YvGZgMwmRVk2yUq_xvLhRm0CkAydi_LZ1GH88ZCEEjuJdiA7LTT4Ii7uczP3v95UBughXQwF2XMvpAL_OmxyPsfdXRljUKvytSKT92ryhvfrW8DHbFC4-Kcw9YlV83f0S0QjJV9Z6Z4Xph7IoQajYSNirjxD7w6NpgNoQKQ0vvuTNiUjKqjfkaNcx9W94Ko1Cf49sDsYa_uVAP2-VDjUs5xbEVa4zfx8gttcgEGEicEXFOI23_LbAjT7OrRSbyjkTPiBTnK4DLn7x_oOz3DXmCeYjZYZI7tNf-j5w_B","https://external-sin6-1.xx.fbcdn.net/safe_image.php?d=AQDzsTkzAwYN8j9w&w=540&h=282&url=https%3A%2F%2Fi.ytimg.com%2Fvi%2Fr9_Wdn9wjc4%2Fmaxresdefault.jpg&cfs=1&upscale=1&fallback=news_d_placeholder_publisher&_nc_hash=AQDXtq3arKaojIeP","Image may contain: one or more people and text","9/4/19【中廣論壇】郝龍斌：斷橋！火災！災變發生，政府為幫兇","1.官官相護不看專業，綠營打破65歲任職淺規則袒護自己人！ 2.公共事件！蔡政府重表面搞觀光，公共安全放後面？ 3.大哥哥～假親切，漁業、福島核災食品實際被日本吃豆腐！？ ＃宜蘭 ＃南方澳跨海大橋 ＃港務公司 ＃吳宗榮 ..."
"https://www.facebook.com/haulb/posts/2297132846989240","1564027833","＃中廣論壇預告 #週五上午十點 #中廣新聞網

 元首出得去、私菸進得來、國安單位發大財，自由民主永續之旅變香菸走私之旅，蔡英文身為三軍統帥是否需要向全民道歉？

 高雄豪雨，韓國瑜市長的挑戰才剛開始，高雄雨水下水道之設計保護標準每小時70.9毫米，719水災最大「 時雨量」126毫米，若沒事先清淤，後果不堪設想？

 團結不一定贏、分裂一定輸，媒體民調一對一韓國瑜與蔡英文拉近中，大家如何幫韓國瑜交朋友、拉選票？

 本週火線話題，我都會在明早十點中廣論壇跟大家分享我的看法，歡迎線上收聽、留言討論。也歡迎點選中廣論壇直播：
https://www.youtube.com/watch?v=kfaviChW4Cs","1571436942","undefined","undefined","undefined","undefined","undefined"
"https://www.facebook.com/haulb/posts/2453152631387260","1571314329","＃中廣論壇預告 #週五上午十點 #中廣新聞網
想聽聽郝龍斌如何剖析蔡英文與 #芒果乾?
為什麼大巨蛋從柯文哲口中的五大弊案
突然變成政治利多?柯P又在盤算些什麼?
精彩內容都在明早十點中廣論壇，歡迎線上收聽、留言。
也歡迎點選YOUTUBE中廣論壇直播收看：
https://www.youtube.com/channel/UCkqrvXuqW7dN3E2_4v8Ha5Q","1571436942","https://l.facebook.com/l.php?u=https%3A%2F%2Fwww.youtube.com%2Fchannel%2FUCkqrvXuqW7dN3E2_4v8Ha5Q&h=AT2HGPFmRgZ_bm1kEpFg3PYhXifmzzpM0JpnMM_tXXal-Y6CcEyx_7qA-hZUz3KXV7U0O05BaUxJw57Y7U88SPdjcdrzCOPHAIWS-SPEc3oXBRh-g0NekmrMSd9v0PnqtmH4wzSqv32MyVT5KXU3nKiRgNHrrc_mj_Xyq6kobYI1pkhtdVtuiRLftg7GLdqWQWy6mLBBTXY-64q1l-CclM_bivXquQ5IrG0dQNpEVVnvmBA_qYvw0_ijit35rZjbnSsn3zii75uwHCcXTeDwO_jcyeXc4QSzmfln5zTuilrHWzNEcRvEQANZmeW5M9g3A4luiKzk2rzhwVL2PDWedjFkP4wHLSSQw_8aocDDSjlp-Umt6IULasqqEf58IhiTdPdgwAnA8xlwT6iCFKEh9Vv-KO-OFt-7q3do1VPAemST-VLPREHlzdbKjYVbsPY-FMR9011kQ_-8xEQmnGfZJJdzca-YQFmb0Nul_Dpg5eSygugo4VOKXQRYl8IpSO0Iy4JA_ds21IDVa2StdgSGNp0D-NwmW-bTcZwWZ485HL8TgjkVmveL1NOPPKr_wKEgqNiz2Z5k0MuKT2OtkWZdqs-Xwo-9Ey-RwT_HEVoPNCquBWkBY3QdpSxaRFvhkbK-FrhP6uJFcNrguJs6","https://external-sin6-1.xx.fbcdn.net/safe_image.php?d=AQAMBetOirytRUT-&w=540&h=282&url=https%3A%2F%2Fyt3.ggpht.com%2Fa%2FAGF-l787WeTgvIbV2TdBwrwcs08xFMj7xZUgqX9mWQ%3Ds900-c-k-c0xffffffff-no-rj-mo&cfs=1&upscale=1&fallback=news_d_placeholder_publisher&_nc_hash=AQB4qwvDkxDl9Hvu","No photo description available.","中廣新聞網","中廣新聞網官方YOUTUBE 中國廣播公司網址 http://www.bcc.com.tw/"
"https://www.facebook.com/haulb/posts/2229640513738474","1560861564","蘇貞昌養蚊滅韓 草菅人命？

 南部登革熱疫情蔓延，行政院長蘇貞昌連番砲轟高雄市長韓國瑜，莫非蘇貞昌真的認為，防治登革熱中央沒有責任？這也太離譜了。

 
2002年間，南部也曾爆發登革熱大流行，當時我擔任環保署長，由當時的疾管局作為幕僚單位，透過中央各相關部會全力配合，才能在短期內抑止疫情蔓延，保障南部民眾健康與安全。

 
因為，想防堵登革熱，絕不是在辦公室裡吹吹冷氣、擬訂計畫就能辦到的事，勢必要出動大量人力、器材前進疫區，更需要足夠的預算，針對環境進行徹底清潔，才能有效清除病媒蚊，哪是一個地方政府可以獨力處理？

 
簡言之，就人力而言，唯有軍方才能承擔起清理環境的任務，並非任何地方政府力所能及，因此唯有中央主導，透過軍方以及其他有關部會協助，地方政府積極配合，才能達到防疫目標。要求高雄市或任何地方政府單獨搞好防治登革熱，根本是不可能的任務。

 
記得當時我南下高雄疫區，除了請求軍方協助，立刻將重點區域與當時老舊眷舍的內外環境徹底清潔一遍之外，最讓人頭痛的，反倒是市區許多無人居住的房舍，因為房門深鎖，明知已釀成病媒蚊聚集而無法清除，地方政府根本無從下手。

 
我因此特地拜託了法務部長陳定南，請檢察官幫忙，跟著軍警、工作人員一同破門而入，才破解了這個無解的僵局。但如果碰到的是蘇內閣這種見事推事，只知推卸責任的官員，只怕還是聽天由命，反正有責任就推，不更方便？

 
講到底，蚊子是不會分縣市、分藍綠的，只要北迴歸線以南區域，就有登革熱肆虐的風險。要做好全面防疫，勢必要由行政院下設跨部會小組，起碼由疾管署主政，針對北迴歸線以南包括高雄、台南、嘉義、屏東等縣市進行跨縣市聯合防治。尤其高雄、台南緊密相連，一損俱損，高雄拉警報，台南也就有風險，難不成登革熱在高雄流行、台南就不流行？","1571436942","https://l.facebook.com/l.php?u=https%3A%2F%2Fwww.ettoday.net%2Fnews%2F20190618%2F1469564.htm&h=AT2n1uRGrpCMBxW9fxg3RwZufJi4GmSRKgq-Ucy-7NGQQ-euIh9V1BkpDC5Nif5C-8lqilAaDE83zLdeJXchYYz10uWnTJRqxOIg2O3G52FZRs17PFaToB9nh2cElmVP6yQ0rq1JjZS5Isy4vaKfe3yT_qDcLMwXhtlHCegwA3NA7NfwvvOvMBqIx9VK6TOphquNWTCSP6Os84wG5wCV3QY0MeoN539c35PUTMH_5zT0AMs3A8HpZDsV5rP9a2CvJii6w88t5ZObaxHaPhiY8Or-IdwXDTochYKOS77DJl7s94r8_FmyilOiA3BlK8csyJYcblq7WulGkzYJjkI-9bdOTtdUbOdKeeHpJlZYeqaF3K65EukLsNit-apsMSoAENZzDKQtv_EKkHrQ8ekrU292e3HCPf4MM11zFSsDXq7dqeC6df_NR2emYRBUcquR86ewdw-RdFgmepQVjYgmWfcON6or-TWprzZV4JATlNDvEIZHbQzQskFV4w05nD6CcC4oOVfUlUj7shhbVk9UNL1UqF-FGeztHbp5QO_k00dTiH4U7_edjHSyfmZoRLd1l48tOEgZp4fsXIC_UbQjYesUzzg5pi9DffHCStdlnX_lZLJPQZOHqP-0dINKBUjXbCel9XkvKzZcw7ac","https://external-sin2-2.xx.fbcdn.net/safe_image.php?d=AQBvlOWSbfCa0JxJ&w=540&h=282&url=https%3A%2F%2Fcdn2.ettoday.net%2Fimages%2F4172%2Fd4172164.jpg&cfs=1&upscale=1&fallback=news_d_placeholder_publisher&_nc_hash=AQDoh3nm0F0SURqJ","韓國瑜嗆「再有登革熱就算你的」 蘇貞昌：蚊子都治不好還要治國","快訊／韓國瑜嗆「再有登革熱就算你的」 蘇貞昌：蚊子都治不好還要治國 | ETtoday新聞雲","高雄市長韓國瑜因為登革熱疫情和中央互槓，17日晚間更嗆行政院長蘇貞昌，如果高雄再有登革熱疫情，就算在蘇貞昌頭上。對此，蘇貞昌18日受訪時傻眼回應，「市長他在當，責任要我扛？」"
"https://www.facebook.com/haulb/posts/2373263906042800","1567684595","【POP RADIO】
#蔡詩萍 專訪郝龍斌
談《郝柏村回憶錄》
分享郝柏村先生出將入相的傳奇人生

 
郝柏村先生歷經八年抗戰與國共內戰砲火洗禮；一九四九年來臺後，更於八二三戰役出生入死；歷任蔣中正總統侍衛長、陸軍總司令、參謀總長、國防部長、行政院長等公職。他將個人奉獻給中華民國，秉持著只問是非，不問個人利益的原則，至今不懈，畢生職志就是守護中華民國。

 讓我們看看主持人蔡詩萍如何評價這本波瀾壯闊的《郝柏村回憶錄》。郝龍斌副主席又是怎麼分享他父親出將入相的傳奇人生。
＃POP大國民","1571436942","https://l.facebook.com/l.php?u=https%3A%2F%2Fwww.youtube.com%2Fwatch%3Fv%3Dg2TKoq5rvPM&h=AT1cDeQacZS_ibucriYKb250cKreUMWK3_q4qd_-0sfsH9PkYnnfUOPnSrQeOaBEtE_WVP0visDocqnnDUrrmzFOkFxM6Jvl_JKVApI_vNXgY8edISoE7HGBgA01rIVhaJM2fwLRBm1I3BkvAtQ-IK2GszEhJER7cMjvuoYGRbjCpJ8PJd65iYAtd8f0Nmm4NHBSKG3ZFu1mz0_qVr1OX01RnFxvs6Fi85jdjdVK9tI4Rk9lX6wdXxQWrDQyXVkrmzs1oGGaOTKFenypLm7nXREq0W652GVPdfy677yfOERh2d-0GGhoaYjpd8oVNRXa-_DU9YIlruZIwRLli8TxJ1OGdKvLCAoUE3GKT4BAJeF6Zza8pY6FACU5aBm_jy-3ror1nlrDHmDd_DqPnb0n3maF5iZPzHxPEtkINjC2b7svFzOxjKFFXEHD33V_w4V3WVJA6PMcA0bI_FFePC7YrC5Jn5oPkMBsJOwX5d3TIPDQhr7GFweqehVoqTPLRvM5nme4u5OwOGcNkcWqjVsSK_fMURm2tb_8LC0dInPmSNz-jTlIKXGi7aj8cVcKi-0iMuy-MApjhUvew3iQURAiMgbOQcJhW9dED8PxcIEWk7jY_K4n-80LM0CXXVjakV3ytj8iqmENGUQTTS0m","https://external.fhan2-1.fna.fbcdn.net/safe_image.php?d=AQDtsDFaNzHS-6JE&w=540&h=282&url=https%3A%2F%2Fi.ytimg.com%2Fvi%2Fg2TKoq5rvPM%2Fmaxresdefault_live.jpg&cfs=1&upscale=1&fallback=news_d_placeholder_publisher&_nc_hash=AQC2lEX33YE-VAkP","Trong hình ảnh có thể có: một hoặc nhiều người và mọi người đang đứng","2019-09-04《POP大國民》蔡詩萍 專訪 國民黨副主席 郝龍斌","來賓：國民黨副主席 郝龍斌 主題：《郝柏村回憶錄》紀錄百歲傳奇人生 【本公司所有版權，非經同意不得重製，違反必究】 --------------------- ●《POP Radio》Facebook專頁： https://www.facebook.com/FM917popradio/ ● 917 POP Rad..."
"https://www.facebook.com/haulb/posts/2454810317888158","1571386476","#中廣論壇 #芒果乾 #治本之道讓小英下架
這麼多人談芒果乾，當然是蔡英文炒作造成的。
亡國感其實導因自兩岸緊張，造成經濟衰退與民眾不安，加上香港爭議催化，所以撿到槍的蔡英文才會炒作芒果乾、炒作大陸對台灣的政治威脅，用一些錯誤訊息、模糊的說法嚇唬選民，讓大家有危機感，鞏固基本盤，以確保她連任。大家可以想想，2016小英上台之前，馬英九執政八年，當時民眾會有這麼強的不安感、亡國感嗎？有人在談一國兩制？擔憂中國大陸外交打壓？或擔憂台灣經濟衰退到今天這樣嗎？

 
蔡英文不認同九二共識，不接受一中各表，不認同中華民國，製造兩岸緊張，兩岸大部分交往大門關閉，把兩岸關係搞砸了，才是民眾濃厚亡國感的關鍵因素。現在再用國家要亡掉了，來做選舉動員，實在是非常不道德的事情。

 不要意識型態爭議，看怎麼對經濟好怎麼做，提振了經濟，兩岸和平穩定，民眾自然有信心，也就沒有芒果乾問題了。至於治本之道，當然就是讓小英下架。","1571436942","https://l.facebook.com/l.php?u=https%3A%2F%2Fwww.youtube.com%2Fwatch%3Fv%3DLgKRBR4M_mc&h=AT2T4BfzDbN2JmSNHwPBcwCw-tSAh1bV-vlr22_4cbuPfR1DKajnCqHBUzNEAeJpd6vnIB9ZeMJhY2Avq0dytu8mXc5JmnBEVEUK6lF9d4rYzuYLbZBAHB7YqS9k-lR1GtHA3SLPoQ_2RQ8gkROvm5FUNKuIS9QXInw3lRL7I2dx1aRlHBr_AQGApfMSONMWX2icu4zIVJ5pvgiORDXe7vKg7od-Lc8fdkr3XtDzUD0OlNLdBlVIB7A6kO_99Ypd4oO4e8K8KDqpyX8e5CzcfTffnuBZ0noTIRhQMxj6GkXTs3dglcZH8o5xd_VyMG73X-JgS7qefMgSp_SDbLKjB0v6xnbk0aK38yYfYmYOmbBeMlBZmuBwuctyorPf6WSisi2hyPOHyuED2rb1y0iP7SFdMgVk63YhIXFgKKr8fl8B6nCC4FVAjrD_G_KhmRirVLzy3i5d_s3vzhU0Ryve9DUrTwEPk-lZXw2y43Z0t1yXkmUGo-pHiuEdtfEgZ7PPuKjMiccnh4UgkrTXIX3uH9hy-yn01VgJg_mq2lXK-qYOoEqffuPohiKHEKDre0-tqfsFBhnpt8pLtWgsR68_eiFjkGG-zazbIcw7yMUESwPmiMrDDI_a7zjcuguZVXLDzGpQeBdjCiutEi8R","https://external-sin2-2.xx.fbcdn.net/safe_image.php?d=AQAZLUdr2ut_jh6P&w=540&h=282&url=https%3A%2F%2Fi.ytimg.com%2Fvi%2FLgKRBR4M_mc%2Fmaxresdefault.jpg&cfs=1&upscale=1&fallback=news_d_placeholder_publisher&_nc_hash=AQAEimfmn_Vrx2lQ","Image may contain: one or more people and text","10/18/19【中廣論壇】郝龍斌：大巨蛋延宕四年，柯P沒專業、無政績！","＃柯文哲 ＃大巨蛋 ＃社子島 ＃亞運 ＃台北藝術中心 ＃台北市 ＃公帑 ＃市長 ＃韓國瑜 ＃2020大選 ＃10點中廣論壇 ＃郝龍斌 ＃中廣新聞網"
"https://www.facebook.com/haulb/posts/2351177158251475","1566630111","＃中廣論壇 #週五上午十點 #中廣新聞網 #林郁方
823砲戰的真實歷史是甚麼？
美國售台F16V戰鬥機，背後意義是什麼？對台灣的重要性是什麼？
為什麼民進黨跟柯文哲的823活動被人說是真拉票、假感念?
歡迎我的好友、中正萬華區立委候選人林郁方博士一同參與本週的火線話題，提供最專業的分析。","1571436943","https://l.facebook.com/l.php?u=https%3A%2F%2Fyoutu.be%2Fb6QfhSw1cN8&h=AT2fk9ZDd40zp2lWhMOZqMGVutjUVz345pE0LbaVPRohnMlEYZlWU0jze1mocNtdiYVJARjJUwC9tzmIXQqniXRVKIYn8bOmU5YipsUtnFeUSOxzvoWfNGN__Ulyzly1CoZRRh1WLlbsDH2zjMtvt1sVvmzqaCYeQ3tUz3NBKmBkM94-NMBS6iJYrLnT9rqO93y_n7hgtpbqN6T9wDlgouDHQSIlthGPNpsWUuyoNpYsHOSVF9mkYta49O--btJ2IqkIQBwPFUmmueZ1dwqW64Z6pmpr_adL2UYBOxvbFMevW3EWWKTKh3ayJTvt6aewPwyagHGwo6H8yBYoJffMw19fmgziZp4JhNTh83frrrYE9hN4FutqUeUuFwWudDavlMI8gwBsFl0BRa7-AuNZIKIuK-Ur0gHJ3PilP_-f57I3hrulzTs4NmvePXF5Jwa7b1zqvjNTpH-l_uo7M2HqCm0XzXt-ZpCpLXH6_zBC3ZQW_VVBa6EBHbdwo-weHkVO_czQWVKTHxReXmhPT5D0ZyCJ05GQc9AK8NI0ckcdI9xag-sYMJMV7ML3MTVIpZ6D-MxL6dqmuXOLqjLFuFShEmfjJoDnbUJTa88zpiZA0AXuoRUUaK-EbL8pCRO9xtXrFfNywgTDYX4j7W86","https://external-sin6-2.xx.fbcdn.net/safe_image.php?d=AQClbPVV0rZ6MTGZ&w=540&h=282&url=https%3A%2F%2Fi.ytimg.com%2Fvi%2Fb6QfhSw1cN8%2Fmaxresdefault.jpg&cfs=1&upscale=1&fallback=news_d_placeholder_publisher&_nc_hash=AQCw7-2SWLwxoIaL","Image may contain: one or more people and text","8/23/19【中廣論壇】郝龍斌：823週年，真拉票假感念？","＃823 ＃郭柯王 ＃吳敦義 ＃蔡英文 ＃馬英九 ＃金門 ＃郝柏村 ＃2020大選 ＃10點中廣論壇 ＃郝龍斌 ＃林郁方"
"https://www.facebook.com/haulb/posts/2058381567531037","1551017082","「最後一夜」，剛剛永福樓的常客在最後感傷的唱起了這首歌。

 今晚是永福樓的熄燈夜，我也和一群好友一起來告別永福樓，酒量失禮的我，今天也勇敢的喝了幾杯。

 看到現場很多政壇老朋友都來了，但我想今晚最該來的其實是柯市長。

 柯市長可以沿著忠孝東路四段和五段沿路散步，看看兩旁大樓的「燈光」，而這些都是台北的景氣號誌燈。

 我知道此時的柯市長正在以色列考察小國的生存之道，而同時韓國瑜也正在星馬致力於開拓高雄的生存之道。

 誰說民眾的眼睛不是雪亮的？
看看最近的民意調查就知道。

 #只要有心萬物皆可賣_賣完水果再賣包子
#韓國瑜 #柯文哲 誰稱職？

 https://www.upmedia.mg/news_info.php?SerialNo=58193","1571436943","https://l.facebook.com/l.php?u=https%3A%2F%2Fwww.upmedia.mg%2Fnews_info.php%3FSerialNo%3D58193&h=AT3eovnDISJ45wp3EhaHWV3zByqiZeOR7hbT_JSTziTLySJWDX-5_l9CWhSeLyknhEkz7aQ9Yb1vAxmMIurjDIGZNG_w10NVeoIOH5yJ3e5YBxwtdU_EeAmGd1DT6s_WIxkBhQgQ7aomwXDs_5759GILerGS65wofY2KHawgiqkoV_sMYS1T6-a8Nz_tnMJKfva2sB4uboiO4CK4msmJACZnA9dj_BNap2401zU0caKH17kKvYaynPTA_D5V-wKPIov9tPe6-lSYYQUrTfXrxe3qrQkqUW1cRTqO9e69_K4NrNLPyoYAxD2gumHKm0-8qj0AZ4m-0-OChHhR72QIac4RkDcyKvBRRg8hf3MkW0PaYvoJn8niR-_5aU1G2uFWp4etEX-hqRng-1yhNKS736lOfa3hrFwUVopg0wNehlc2kHe11egRbmg_AEBGeGfQExpy7r_BAoXiHMLR_o__yTn8GI6noZTE2rZxH_7HC6hELPuqQHoMv6XizRlMa0RPA2DoWwwHMlJfA-Cl34YgKd0Q7J5DzO29PsLTvQZNjuK_LHXnKXLJws88IQBNKBDmiCPY03ZE54K28wP_XuadqCyKJwQcI45FN866pgMTpj5kc5nWKrq_qJf4zQbziwkhLLPOjBrBNtrLyb2u32Rv87FiPKmWOXR_jQcr73xpj7pLNi2zZAzJnSeMjK2NHkzv-CMDDjUzt-S2W55fTTwjMtXHcI7Ck0lHqGyyUisw1PHzyr5XciYkyZx5lK7Uk22V4O2pVvwa","https://external-sin2-2.xx.fbcdn.net/safe_image.php?d=AQDk-iXOvg8fOHdH&w=540&h=282&url=https%3A%2F%2Fwww.upmedia.mg%2Fupload%2Farticle%2F20190224213011224222.jpg&cfs=1&upscale=1&fallback=news_d_placeholder_publisher&_nc_hash=AQCOpgPe6KJnhNYB","（攝影：張哲偉）","【直播】40年江浙菜老店今熄燈　永福樓舉辦關門儀式--上報","台北市東區40年老牌浙江菜餐廳永福樓24日是最後一個營業日，。位於忠孝SOGO商圈附近的永福樓，有近40年歷史......"
"https://www.facebook.com/haulb/posts/2173805409321985","1557998460","#中廣論壇 #朱立倫 #總統大選
#內閣制 #有權無責的大總統很不健康
今天上午很高興能有機會與朱立倫前市長一起在廣播節目討論他的治國願景，其實不光朱市長，還有幾位國民黨重要參選人都已同意在接下來這段時間，上我主持的中廣論壇節目。只要大家願意就事論事，談政策、談理念，談國家願景，我都非常歡迎。台灣真的需要有更多理性討論，跟上時代趨勢與國際大勢，我們才有未來。

 
其實從前幾天郭台銘郭董拋出支持內閣制，到昨天韓國瑜韓市長提出總統兼任閣揆的憲政想像，我認為大家意見其實相當一致，就是現行的超級總統制、總統有權無責，對台灣民主的發展是不健康的，更讓台灣的發展受到重創，已經到了非改不可的時刻。

 
我個人的憲政立場比較傾向內閣制精神。所以我相當同意朱立倫市長所提，政治改革第一步應該把閣揆同意權修回去，恢復立法院對閣揆的人事同意權，讓行政院長權責相符。我也希望，朝野可以達成共識，建立總統依憲法到國會進行國情報告，並聽取立法委員建言的憲政慣例，這不但有助行政、立法兩權相互尊重，也才有助政局穩定。","1571436943","https://l.facebook.com/l.php?u=https%3A%2F%2Fyoutu.be%2FmMSnRmog5uw&h=AT2mX2B1FB_OvCe3wGN3FWBEQdZ3tEywWVt4J7Z6soGn8hxBNB2BuUloopuFBWtoq_Oa0_hYLxvbqU9Iqmz-Ij2feOG90k4IbFk8RC1XGHmOPcc5ZrXgTaLcyibHT3uDnoi5nhLgiAZJcdITBF5OQKG7IoQQnDiS91w0UzqX58VrsemZV9aZTraqXOiTQoaSP-Y2UPbKJVnkR4ksMMul-TYzObKN7G76j02XFx8GSPWf8LJCe5eJZhkpSdikFlxQbQyCHRkxqrXrRCobrsUgkCxJcURd4pxVceWjB5HgQVkCjndYDap7S4mwwWX_aNU3hpVaN_4eI1cncpqCy3eRK5fm6_011ssjSGcElQofmgt6IxrkJiSaiavLR7XOSSm5BD_NOgg6QfDijQ6D92-3ht79-lwJcAABXoLnyfGcQ3lX0kR3IEz-JMZQe_4NMZi0_JO4NR76NSnqbKbz2B40SZS551v3J9IAiLKif51vsyTMJAAVlOUG_RVMlIoVZpkuNACwFtgKKctbCWTnd--S79B_U32_Uk3rF2U8WwXESOfjn-PQRdLvePS628KgwfrTLHZw_QyQr1tkOoGcNQk52p7jVroZyI6SgGqh5wSkaEusLuEflNDvaJakb70Dyq_AqDa_jHfzc2yQEp7oYzxO1iOdDRfxq26o","https://external.fkhh1-1.fna.fbcdn.net/safe_image.php?d=AQBV4R7Ja97pqexZ&w=540&h=282&url=https%3A%2F%2Fi.ytimg.com%2Fvi%2FmMSnRmog5uw%2Fmaxresdefault.jpg&cfs=1&upscale=1&fallback=news_d_placeholder_publisher&_nc_hash=AQDZJ9H40OipW7Pt","圖像裡可能有一或多人、惡搞圖片和文字","5/16/19【中廣論壇】郝龍斌訪朱立倫:恢復內閣同意權！│自由貿易經濟特區│綠執政 人民辛苦了！","※支持內閣制 恢復內閣同意權 ※自由貿易經濟特區 ※朱立倫16年地方首長經驗談 ※民進黨執政，人民辛苦了！ ※對賴蔡柯的看法 #朱立倫#內閣制#郝龍斌#自由貿易經濟特區#中廣新聞網#中廣論壇 【以上評論不代表本台立場】 ....."
"https://www.facebook.com/haulb/posts/2231235393578986","1560937951","香港反送中 台灣公投被送終

 
曾經這麼愛公投的民進黨，自從去年底被直接民意狠狠教訓一次之後，狠下心修正《公民投票法》，藉著過半的國會席次，把公投徹底關回鐵籠裡，這種對民主政治與直接民權的羞辱與踐踏，已在台灣民主史上留下了恥辱的一頁。

 這次公投修法目的只有一個，就是不讓公投與2020總統大選綁在一起，以免影響民進黨的總統連任選舉。亦即蔡英文為一己之私，沒收公投法，埋葬了民主公投。

 甚至民進黨立委葉宜津還辯稱，修法是因為台灣在公投這一塊只有小學生程度。這種對民意最赤裸裸的藐視，出自執政黨國會議員之口，實在令人震驚，不知今夕是何夕。

 
去年因為公投、直接民意，人民才有機會讓政府知道我們不要吃核食、我們不願用肺發電，雖然民進黨選務辦得差，人民還是一票一票把直接民意做了最清楚表達。難道以後都要強迫大家先吃兩年核食、用肺發電兩年？

 尤其去年多項公投結果也遭到民進黨全面抵制與杯葛。難不成也如葉宜津所稱，因為我們公民只有小學生程度，跟不上民進黨，所以幾百萬人的公投結果也不算數？

 
講穿了，從過去陳水扁倡議「公投綁大選」開始，公投不過是民進黨奪權或政權保衛戰的工具罷了，如今揭開遮羞布，修法閹割人民行使直接民主的權力，不過因為民進黨心虛了，比起公投讓人民有理性抉擇的機會，倒不如傾盡黨國之力，影響媒體輿論、發動網軍攻訐政敵，護航蔡政府，還要來得方便多了。","1571436943","https://l.facebook.com/l.php?u=https%3A%2F%2Fwww.chinatimes.com%2Fopinion%2F20190618003907-262105&h=AT1t_U2UaafMWn9_Vv2-9qtUY46gp1HR-Ks5Is_ZPU04hXe_Yx4mEp8HlmQIuTCqIPAPF6JmsrHbxLuNT_RYycASK9QvBnOPgUbRazq90N5cRkEga0x3c7KIF0wNqweJPuVkEZW5sccpCsaFXeFVUmjF6oqhsn4rAPRawfemS12n06y6V-JuPx9U8vocCqX8NDmJfr3kCoQcWEvk8Keauoc2qxQbUvp-tCPa2uVDN-e-aaJkUJq_uNTkppSEoox2eTbklOFo2avL-9HdEJe3MAVKyFUBYPwwifv3d1bjb1n3BPnRv0w4PZ0etbQmaZUxnfdZb_jlC1rQlosGoQuNtt8Iwl4g7SwsABR_P7xyVAVWM2NlB5VkO7Nw2Xmkf3lKJJFAcLoesLGaUKQGZFCLh2bJNZJ_6YWpt_py6L6T9UqL8c2uHKpsFE1cmz7RXfAmLdmyX2_PXCSPG4SAWVvVCaxVr9ZAwRE1qJGZ2U31Knzd6Pv1kwdoIp2xosjA_pj5kRYTCEQrvvzPGAT_H5iKGfZFBVnpWGP9PEii8gewtP9OawZMetWfLFawBAWw5sqUQvqBp5TtMZYsmi0sVLojmc8CTvxKQx_37i3258NigaHoBKC9pUqGJOAcOGC1UadVsbqXex-idmcgw3s3","https://external-sin6-2.xx.fbcdn.net/safe_image.php?d=AQBK9pSjSHewpGls&w=540&h=282&url=https%3A%2F%2Fimages.chinatimes.com%2Fnewsphoto%2F2019-06-17%2F900%2F20190617003795.jpg&cfs=1&upscale=1&fallback=news_d_placeholder_publisher&_nc_hash=AQAG_cspJvIX3a0u","國民黨團17日抗議「鐵籠公投」修法，朝主席台丟水球表示不滿，民進黨團則是準備保麗龍板，替擔任主席的立法院副院長蔡其昌擋水球，隨後國民黨團退場抗議。（鄧博仁攝）","公投法回籠：曹俊漢》民主錯亂黨！ - 觀點","民進黨擁有多數席次的立法院，在2017年12月12日通過修正《公民投票法》部分條文，降低公投提案、連署門檻，當時民進黨興高采烈振臂高呼「人民作主，還權於民」。令人錯愕的是，不到2年，同批委員又在本月17日將他們自認...."
