url,posttime,text,crawled_time,attachment_link,attachment_img,attachment_img_alt,attachment_title,attachment_brief
"https://www.facebook.com/haulb/posts/1700268660008998","1528782125","＃兩岸自由貿易論壇
＃經濟日報

 常常有人問我：台灣經濟發展面臨的最大難題是什麼？

 我總回答：台灣經濟發展最大的難題是我們正面臨一道不只有經濟面向的經濟難題。

 我們一方面認為台灣市場的資金不足，但我們又過度恐陸，對於來自大陸的資金充滿疑慮 ;
我們常認為基礎建設應該翻新，但在做各項基礎建設的同時，又總面臨環評通過與否的掙扎 ;
我們常希望貿易能自由化，但我們自己國內卻保護主義盛行，擔心外國商品輸台會影響本國相關產業的生計。

 上述這些問題，涉及了「開放」與「保護」、「建設」與「環保」等價值的衝突。

 這些價值在議題倡議者的眼裡可能是大是大非的「是非題」；但在政策執行實務上往往是「選擇題」，每一個政策執行的過程常常會臨痛苦且必須的二選一 。

 但最麻煩的是，大多數的台灣人總認為這是「多選題」，覺得可以在擴大建設的同時保有青山綠水、在自由貿易的過程中不傷害本國產業。

 如何讓人民對國家發展的期待從「多選題」過渡到「單選題」，並且過渡的過程盡量圓滑、圓滿，這是政治問題，而且是非常艱難的政治問題。

 也因此，當我們為了解決台灣經濟困難，去找尋各種經濟專家提供意見時，就如同讓一個經濟學家去寫一張充滿政治問題的政治學考卷，這樣的結果會是符合預期的嗎？恐怕很難。

 其實以理工實驗的角度來說，台灣當前面臨的經濟問題簡單說就是「變因」太多。

 國父當年曾上李鴻章書，裡面提到救國四大綱領，亦即「人能盡其才，地能盡其利，物能盡其用，貨能暢其流」，這四句話放在一個世紀後要救台灣經濟困境，還是依然貼切。

 所以我始終認為在台灣設立自由經濟示範區，在示範區內把各項包含環保、法規、保護主義等因素盡可能的去除。

 透過小規模先試先行的階段性做法，循序漸進推動法規鬆綁與制度創新，讓台灣「人能盡其才，地能盡其利，物能盡其用，貨能暢其流」是解決當前台灣經濟困境最為可行的做法。

 事實上設立自由經濟示範區的思維並不是新思維，在2013年行政院就曾核定「自由經濟示範區第一階段推動計畫」。

 行政院版本的《自由經濟示範區特別條例》草案自
2013年12月公布以來，因為藍、綠意識形態的分歧，示範區內對陸開放項目範圍有別，自由經濟示範區特別條例成為民進黨長期在立院重點杯葛的法案，始終無法三讀通過。

 
而2016年政黨論替後，民進黨更是在接任政權的一個半月內，就正式宣佈不再推動《自由經濟示範區特別條例》，確定讓自由經濟示範區的政策走進歷史，也讓台灣花了5年時間原地踏步。

 台灣還有幾個5年可以浪費？如果我們不放下意識形態、放下政黨內耗，我們又如何能大步向前，追上過去落後的距離？","1571436955","/haulb/photos/a.666406166728591/1700268630009001/?type=3&eid=ARDoeHXLetYN0njlJd3I4DC7bV6Dfor7TWUCJQvxII3V36xk2PxKq_uk4PNZx0hPLS4U_RSHmh_TbuoL&__xts__%5B0%5D=68.ARBrL77sIsnWUAXdHgWrzlxFliebhMe6GhWyELheUspRP0SsWhHFaLSciQ3UfjIxJlE_B26XrkC7JI5nnVA1vmx_KvSqeb00BWxB1Um3BCavU70NcKathet-R8AJWRlLwMwDarzaRiRwuHh5p6amFi0P19jc0PFxmYfvdk_CBNOp9UbAsXufiJQDfHiZH3XfGfCDVcek9b6rx2BfXvKmSngv25b6M2Byku--ckex0p-2z5dr6fdtguZhohHEqWXfnOEYRXb2rdICHM7knuaMbhLvC5LsHRWFUruAqkxjFcNB-i_vf38L3-n1MvyE1jfu1UoxhtHx8omv4SuhEwjpmKLPXg&__tn__=EHH-R","https://scontent-frt3-2.xx.fbcdn.net/v/t1.0-9/s851x315/35238198_1700268633342334_1554453302710632448_n.jpg?_nc_cat=108&_nc_oc=AQmpblOQoHVcE75LbMNPkh0UUrbAuFz2mFiS443d65Zt6yT1cva6ymCzr_xWPzWJw8Q&_nc_ht=scontent-frt3-2.xx&oh=455592d3873c2142fbd32b2938ea5835&oe=5E324BE6","undefined","",""
"https://www.facebook.com/haulb/posts/1774341465935050","1533080340","台灣人有權利決定要吃什麼、要買什麼
日台交流協會台北事務所代表沼田幹夫日前透過新聞稿，公開表達對核食公投「失望」，並批評問題被政治化；而台灣日本關係協會秘書長張淑玲31日也表示，期待各界秉持審慎理性、實事求是態度來妥為處理，不應該淪為政治議題，以免影響我方正常對外經貿關係。

 對此，#郝龍斌辦公室發言人游淑慧則表示，公投並非針對性，是純粹食安問題，也盼沼田幹夫尊重台灣民意。

 「不知他們所謂政治是什麼」游淑慧表示，我方與日本沒有什麼政治對立、意識形態，過去國民黨執政時期，與日本也處於友好關係，因此核食公投並非針對性，純粹是食安問題。

 
她進一步說，食安可分為食品安全、食品安心，如今台灣民眾對於核災區食品有「不安心感」，台灣的能力也沒辦法做大量普查或抽查；而在我方沒有能力做品質把關的情況下，已從日本進口非常多農產品，對日貿易也處於逆差狀況，「
#難道這還不夠友好嗎？」

 游淑慧強調，我方願意繼續維持台日友好及貿易往來，甚至日本有好的農產品，台灣消費者也會願意採購，#令人不懂的是日本為何非要賣給台灣核災5縣市的農產品
。消費者有權利決定要吃什麼、不吃什麼，如今公投就是這樣，最重要的精神就是訴諸民意而非政治，「應該是日方不要泛政治化了！」

 
游淑慧還說，若台灣不買核災區食品，日本還是可以更努力將其他地方產品、品質更好的賣到台灣來，「這才是自由貿易行為啊！怎麼會用政治力干預？」且如同我方駐日代表謝長廷不會去干涉日本的貿易政策，也希望沼田幹夫尊重台灣民意，公投會不會過，屬於台灣人民自主，「會不會過我們也不知道，他何必這麼早就跳下來說這是政治呢？」

 http://www.chinatimes.com/newspapers/20180801000690-260119","1571436955","https://l.facebook.com/l.php?u=http%3A%2F%2Fwww.chinatimes.com%2Fnewspapers%2F20180801000690-260119&h=AT3KGacEn6efxZyd8-IMdmuGYTAkp-4eBZPYHohLFRnPOepgc_pCka9t3OMIsrQpnmAW2GyJLVFn_Z2JBInac-kLMMFtX5qoBmhMiSPVlHo7tmMjsHO-He9buv-yNH7fU9w2ShW5-xW7UwfexL_CxWexm2MnzSw99qsE9iczFVFIR2Z2DJ0JvTWC-tLwWYJyTSDLwwEjXHbWC2oi3fhjgb7KUffb7XlMmuTkBsdyE5eZNcLZ0u67682SZerDUfWQX3VCAJ8GfER2n3LBAoBFOxXrw8jVH3Fr_rcuapUh3FMMZ9G7MvlYNHnvpJPv-svv9ibS2VtkRadSEefLhWVL8R60CA6VhayUUKpV2o6SRgglkGpsAIk13D2oxaEKZgPsbfw8sZ8veNsCDSNj-PvnOvrDBLkkwi9Su_noEV-GoQ84kMkdgS583-kCvkPRulvtUCoxr2GTPEQT9qqUNOG63ZcLv0Lwo-m45GHYUuMqS9n2MH4MEBVU7DaJIgRerXWjpi8zLnDvdw5h04RZ_XapbiTkVb0cn8f_my9SzR8GHl0QIb3xokzTrkqjmCIlhPnDIOR0vHVDTVFPUyteGC4yS5hdO5AfdxVDfEWNtccToGoe01UNNRoUiI54Zv99ntuDEit4jtGy6JnTYst7","https://external.fbkk10-1.fna.fbcdn.net/safe_image.php?d=AQDSLpssNCnLgAf-&w=540&h=282&url=http%3A%2F%2Fimg.chinatimes.com%2Fnewsphoto%2F2018-08-01%2F656%2Fb08a00_p_02_02.jpg&cfs=1&upscale=1&fallback=news_d_placeholder_publisher&_nc_hash=AQCdY9-5V1VEfYE8","ในภาพอาจจะมี หนึ่งคนขึ้นไป","日批核食被政治化 外交部附和","日台交流協會台北事務所代表沼田幹夫日前直指，對核食公投深感失望，核災食品在台灣不應被政治化操作。台灣日本關係協會祕書長張淑玲昨也說，核食問題不應淪為政治議題，以免影響我正常對外經貿關係。但郝辦發言人游..."
"https://www.facebook.com/haulb/posts/1888132287889300","1540382401","【我認識的 盧秀燕-那個守在門口的記者】

 
我認識盧秀燕很多年了，盧秀燕跟我一樣，都是軍人子弟，很多人都知道，盧秀燕出身媒體，又曾擔任過主播，口條好、人又長得漂亮，但卻沒多少人知道，當我父親還是行政院長，而我剛回國擔任台大教授時，一時間媒體搶著想要訪問我，其中盧秀燕尤其非常積極，但我始終婉拒。

 
但沒想到有天，有個學生偷偷跑來研究室對我擠眉弄眼的告訴我，外面有個女記者在等你，想訪問你，我臉色一沉，直接將學生推出去說，「你去告訴她，說我不在研究室」，我一躲就是一個早上…

 
那時，中午的鈴聲響起，我心想總該走了吧，可以好好去吃午餐了，沒想到盧秀燕正微笑地站在門口！我整個傻在那裡，臉上露出驚呆了的表情，她就笑嘻嘻的走過來「終於等到你了，來來來，我們來約採訪吧！」

 我先是一陣苦笑，後來真的被她的執著、積極所感動，也是因為採訪，讓我對他認真負責的工作態度，更加印象深刻。

 之後，盧秀燕投身政壇，雖然我們只有短短當了一陣子的立法院同事，但我一直很清楚，她這樣嚴謹的工作態度，混水摸魚的官員在她手上絕對討不了好。

 
在我眼裡，盧秀燕永遠把民眾的事情放在第一位，談到民眾遇到任何不公義事情，她總為民眾抱不平，聽到民眾感謝她協助解決糾紛，她總是笑笑地揮揮手說沒什麼，但我知道她心中比誰都開心。

 
秀燕她想要的是帶領台中更好，解決台中人困擾的空汙問題，給下一代更加宜居的環境，只要台中的各位好朋友願意給秀燕一個機會，我相信你們一定能看到台中有所改變、蛻變成美麗又吸引人的台中。

 #郝龍斌
#盧秀燕","1571436955","/haulb/photos/a.148444615191418/1888131964555999/?type=3&eid=ARBBL84S_8fujcJa4NXR0d3iaLdu5fuij_nOoinGH0MiSTxlMSaiL_8vVnXX99hHuuhNistPsWMab1pf&__xts__%5B0%5D=68.ARBhy_1rdR1ptCt45tlAD9CTnu9GSAdpncLB47PhE2uPvD7xHjx4isMiOBdjuY7R3WFWdz0YyIowgHzUWo9ZjpA9ZwVDBzpmLR6WwuS7606Nujym0A6pEUEn3r84WauGk0NAO5JNAzXQteqsBAmF3j-lFecRVUqp8-h4kUGBTmmrgOa7UzDbuLbIAiIx5WTHF0_gXQKEz38dLBFXEHXGc67uKB3l7lkPsrXV_nf9SdLVw2zHWBGTDklzQ_V4Ru4gUfTuEcIZJHYL7bfTU8ECOH4VyeU07OKPeORgjU8DDbUhli4cw1zcDyAH71oSedpvQLRcfwnPdhok4eHJB5U2SvgkZw&__tn__=EHH-R","https://scontent-mxp1-1.xx.fbcdn.net/v/t1.0-0/p526x296/44807353_1888131971222665_2291620156293513216_n.jpg?_nc_cat=108&_nc_oc=AQmSbJ9lukb1D3eP7GVh3EhpaXFdGXdjVTHVysLWinwNTbgNeew_RD5sQhQSifzn7r0&_nc_ht=scontent-mxp1-1.xx&oh=9e45dfb7ab9f7d143fea10e70e23bd71&oe=5E2FC5FB","undefined","",""
"https://www.facebook.com/haulb/posts/2306160632753128","1564468920","「大綠騙選票、小綠撈鈔票」 台灣綠能發展最醜陋的一幕

 昨日，《2019工總白皮書》出爐，白皮書中最重要的關鍵就是全國工業總會再度提及「核能」的重要，希望民進黨政府不要貿然廢核。 

 
工總白皮書中指出，在中美貿易戰之下，大量台商回流，未來電力需求勢必增加，政府應依用電需求、綠電進度、供電穩定等因素調整能源結構配比，確保北部供電穩定，消除產業界對供電穩定的疑慮。

 看完《2019工總白皮書》後，我很憂慮，因為台灣正站在未來二十年的能源政策十字路口上。

 一邊是政府無止盡的補貼與能源黑暗期 ; 另一邊則是多數民意支持的「以核養綠」漸進轉型，我們究竟還要被民進黨政府綁架多久？

 更離譜的是，如今的綠能除了是大綠民進黨的政治提款機之外，昨日更被媒體踢爆如今的綠能已成為小綠時代力量的撈錢工具。

 
今年一月經濟部公布「民間團體於偏遠地區設置綠能發電設備」核定名單中，「台灣原住民族人文關懷協會」與「台灣創業育成產銷拓展中心協會」分別獲得經濟部核定最高200萬元的補助，而此二協會的負責人正是時代力量立委高潞以用的辦公室助理。

 「大綠騙選票、小綠撈鈔票」，這是如今台灣綠能發展最醜陋的一幕，我們還要再忍多久？我們還要再被騙多久？","1571436955","undefined","undefined","undefined","undefined","undefined"
"https://www.facebook.com/haulb/posts/1697358083633389","1528530569","#金門小組長授證

 金門地區是兩岸關係的最前線！

 兩岸關係緊張時，金門的鄉親用生命來捍衛台灣本島的安全；兩岸關係穩定時，金門鄉親第一線能受惠於小三通帶來的便利與經濟發展。

 民進黨執政後，一面砍退休軍人的退休金，一面讓兩岸關係越來越緊張。

 這等於是一邊的在抹滅過去金門鄉親保家衛國的功勞，一邊把金門的子弟送上戰場，這是所有金門鄉親朋友都不能接受的！

 也因此，在今天從台北飛往金門的飛機上，我遇到很多來參加金門大學畢業典禮的家長，都要國民黨加油，相信大家對於兩岸關係的緊張與焦慮都是一致的。

 只有國民黨執政，兩岸關係才能和緩，退休軍公教的福利才能保障、金門的繁榮和平才能有所保證！

 請大家年底支持躍動金門-楊鎮浯，讓國民黨在金門重新執政！","1571436955","/haulb/photos/a.666406166728591/1697358066966724/?type=3&eid=ARBaFyOoP2l5QFoAZbACAXFk6AGdXsVeWiSy0y2oFYJaQW_kvGPHMoejcNGrYy5agehalv6o0ZwDTkNe&__xts__%5B0%5D=68.ARBa84eoWjU5jK94Fvo2YFqrL3MUlXpVmF9L2kcb4P4HzHoJE3mimcwtbZLCf4WAJ9a3ibX8_doQpK9rk30rQ4LEB668hQG5xNE2rEW5XtFLg0jyCGe63xCk44ekTA6giZi_5XBB-jnf1j310FVnmIi5Th0t9Y55C1KJrUeI4VdCu_RhS9dTwlzD6dTAcvRY6SEnr-kjgaSWuJyQCWz-_Z7ugEiLzpYoEZEPWFzA-uoRB2F9wdDLXQb_AVtc5NbNGvajABAmqGL0_BcWFFQY8sH3tyOluoBwdzDAIVmka9qfDMmNmCdya5B7-MYJBlNAxapQWpy-Vc500-qUJrs9DH2OTA&__tn__=EHH-R","https://scontent-sin6-1.xx.fbcdn.net/v/t1.0-0/p526x296/34817677_1697358070300057_8800975631224406016_n.jpg?_nc_cat=108&_nc_oc=AQkWNVgNfiy6hF6b2gAn3vw4WjwTVw5HjNba1i5DYloVS1laOHU7MxGq6y-OHKK4-Bk&_nc_ht=scontent-sin6-1.xx&oh=ed5f8ab012f2baad35ff14ae6e055961&oe=5E1F68CE","undefined","",""
"https://www.facebook.com/haulb/posts/1909079022461293","1541586066","【都更前 l 都更後，VR看台北，原來未來這麼美】
四年來台北市劃定更新區域都更完成率不到1%
台北市的都更困境有三個：坪數變少少、回家路迢迢、釘子戶卡卡
都更很難？但其實解決也有三招
-
第一招是「提高容積率，一坪換一坪」
第二招是「成立都更局，一條龍服務」
第三招是「加速修法，拔掉釘子戶」
-
你可以看看這720度VR環景影像，就是「台北市的未來」
台北人值得更好的生活
四年來沒改變的，請交給他，丁守中。
台北的未來長這樣：https://bit.ly/2SRqPXR
#台北的未來在你手中 #丁守中三招救都更 #郝龍斌","1571436955","https://www.facebook.com/tingshouchung/?ref=nf&hc_ref=ARSKgRzjdIXjDmsxCU5vYv0PlsqucxOdTEJeaK0XjmcqWi3sDifIzG7hg0Rj-9mWKe0&__xts__%5B0%5D=68.ARAi-NXCcYDjPSCFxA_lDrYQQsag5OaKXwQ3thwtg46wSFUYhHuq8VzZ8XYVqju_Isa9AZFcJxV5dCR2Yuc8u2Lunb4h1axF4RsIrZn6oFw0FTLjeeMceYWc0wqoItVqRVdpUGF_UsrQX6Yak_B_62PAxnfo8sQtRfAHi3BUoGWenm_Wwzx1LW7wu1WBsXGFP8zgm3jX66ImNMIBse21RrJEhEgigZ_1Qk6-7Xf3a-3uPgJUCbFkecgPK59iKIm2pa8oGwEZC3u1XFE3_BKT3J0OPwsVPeyh1GQ4TIT7eRAjF9kzPilWU1-J4ikx-WVZ4WZM1RLKmjk0cvsWrDnUWSKn8FXzX3SBchkOKp92iyqB25KXCq0RDAyPSyBV4JXNfr44Zh83st3LKyrVUtw_Kjp0o0CFjrIQPw8W7GNn9oN03-WCVdOQIp-uNsnULaBT4LrmY735F3R0B1NVncBAK7cpdc7A_A10Q8qHTUwmEvReGqjIjZjDduSI&__tn__=%3CH-R","https://scontent-sin2-2.xx.fbcdn.net/v/t1.0-1/p32x32/43117156_1836978546338048_667974526717394944_n.jpg?_nc_cat=104&_nc_oc=AQkhIS-3FWJAuHfoAG8CZKbC4oXkuDAzmMQvyQq0EiU4bhrC4ajbYUj-a8r34VYUbC4&_nc_ht=scontent-sin2-2.xx&oh=823bfb3e5fbd2e7a488dd69b70af80b3&oe=5E3239DC","丁守中粉絲團","丁守中粉絲團",""
"https://www.facebook.com/haulb/posts/1872099599492569","1539338883","【文化讓城市及鄉村偉大】

 今天我來到彰化 大村鄉公所，應鄉長游盛之邀，特地來欣賞由大村鄉駐鄉藝術家聯誼會所舉辦的畫展。

 由曾淑慧老師一一為我介紹展出的作品，那些畫作的筆觸、意境深深觸動了我。

 透過展出這些美麗的畫作，讓藝術更加普及，更加提升在地民眾美學素養，讓美學文化帶動更多進步。

 歡迎有機會到大村鄉公所洽公的民眾，可以來欣賞這些充滿人文氣息的畫作。

 #郝龍斌","1571436955","/haulb/photos/pcb.1872099599492569/1872098819492647/?type=3&__tn__=HH-R&eid=ARB0sPrRmGP0VJ9U3JIV6vHlsarXD8YN-iuX_QtVlTscbZkE2TR7lRrXcD0jElKxp5JUPqtzRZ72Khk6&__xts__%5B0%5D=68.ARCbjmz_CVgPZft3Dp4XoRtmpwH4T8brso4PjDQvT4RfWPh_tMbu7gIYsu4pxE5Zr6n6zM29O92rWGgsw5aGyVJ8hEB5opqqwMnRgm1-UEuKNP1P0BBNSkNHGvKpqWLEl5rbufyzFFNeEgS_C0M--tKTz0MRribkmj7OiY4vHnb0dFB45RD3f38ExN2w9MD1j7LLJS1VIVu4EMX_uPQqert8DxQNUZ6SiA55qzbS5uOS6Qc_idyku8O3Jjh3CvDpFq93srkdEb_Lr1bolm9nS3LVr2ePLCxbtBVsnYQWLSw0rirNc9WCpH9SjbIf4dbZ1FsqGf-9VdfY85pw_YstyAYuMQ","https://scontent-nrt1-1.xx.fbcdn.net/v/t1.0-0/p526x296/43788750_1872098822825980_1584928668361162752_n.jpg?_nc_cat=106&_nc_oc=AQlAoUBPsEmkYW35XdjuAIm2Lr6piznUk6AoVwXRWyHfK6O0NE06UUifqA2msZSCJg4&_nc_ht=scontent-nrt1-1.xx&oh=d709172b276d467dcae37dad4b86e028&oe=5E173DAE","undefined","",""
"https://www.facebook.com/haulb/posts/2046116448757549","1550303882","看到昨天有位出庭作證選務亂象的胡先生與我是同一個投開票所的新聞，我也有一些當日的投票經驗與大家分享。

 我記得投票當天我總共排了兩次隊。

 
第一次是九點左右到士林的福林國小投票所，當時排隊人潮就已經非常多，但因為我後面還有行程，排隊排了十分鐘左右沒投到票我就先行離開；第二次是在上午十一點半左右，我行程結束後再次趕到福林國小，第二次從排隊到領票到投完票，總共花了將近兩個半小時的時間。

 當時我就覺得狀況不對，在排隊的過程中我親眼所見許多長輩因為不耐等候，沒堅持下去就離開投開票所的狀況。

 也因此，雖然我前往投票所的時間與新聞中證人胡先生的時間不一樣，但哪位胡先生，看到下午的亂象，我則是見證上午的。

 我相信不只我和證人，當天全北市百萬人都能見證選務亂象和瑕疵。

 
此次選務的瑕疵是史無前例的大，直接或間接的對丁守中委員的選情產生影響，透過訴訟爭取屬於自己的正義是丁守中委員的權利，我也完全支持，只希望透過一次又一次的修正與改進，台灣的民主能越來越成熟！

 #一起當證人","1571436955","https://l.facebook.com/l.php?u=https%3A%2F%2Fudn.com%2Fnews%2Fstory%2F7321%2F3646888&h=AT1L6eYgXsRGfoClvc94DEcX1suGLLPlm-PSqIHhb9JMugN5PZu1qzwVJGFrLFZNXVe1m4lCMblsrn3aKkvnq15XuF05-W8oeQ3hwO1vLNOuensKqsyzAXoUPfoB0fjAI3782EsFCOOWGAZkvZ_lOZXVu7aplHhlpxt_deWs8zmUmM9gJ6l3WP0IULbHkcJnOPL6ADv7gWzyGE59FcwcdkSCJgBfephQgoUDx_hTlC9r3D_sm0xF4VFRRK2qaq3XsngwOgG23cMhO9uEYWrNMMjeF3MceZqCHU7c5yQdb-NhmKtiMMVS1osLsxrTTxdO4YD1tHKepAx43yIOz9GJ4VaHzL3FBAIJ1fnPP0BSylKSDK8s9e0X5bhE3e3hfPo409ybZ6CRf7FiB6vjhWKxTio8k0SV7vAUlXU0U4haZwwVeu1_d2repwzCy4I7cFPOb6fFm-N59A330fuOfWmUhUMK5i6t_O2zEOJu1jJbopCV4I28FGxshJ7aMeLIEMvpDRbsa42CoyksjRSnvwqgA02EwrQBx70ePNPF0sek58ZNBGqe-sKx0yfNsOXISapQAO2TUaNrTYfFOBzVWmxcHTmWqgBXC71cZ5b4hWM3_b-bomI_MWDzCU9e2-y55nZ3yjm9L4G9ajvfxlnn","https://external.fbkk12-4.fna.fbcdn.net/safe_image.php?d=AQASVHdple5cvJdl&w=540&h=282&url=https%3A%2F%2Fpgw.udn.com.tw%2Fgw%2Fphoto.php%3Fu%3Dhttps%3A%2F%2Fuc.udn.com.tw%2Fphoto%2F2019%2F02%2F15%2Frealtime%2F5929463.jpg%26s%3DY%26x%3D0%26y%3D9%26sw%3D1280%26sh%3D852%26exp%3D3600&cfs=1&upscale=1&fallback=news_d_placeholder_publisher&_nc_hash=AQD7C5RizblJkRwz","Image may contain: one or more people and eyeglasses","丁守中選舉訴訟「對質戰」開打 連郝龍斌也被扯入 | 聯合新聞網","國民黨台北市長候選人丁守中提選舉無效訴訟，台北地方法院今天開庭，下午傳喚士林區153投開票所胡姓、郭姓選民、吳姓主任管..."
"https://www.facebook.com/haulb/posts/2062477343788126","1551254753","公平制度、團結勝選。

 很高興終於明確的把初選制度確認下來，維持我所主張的「七成民調、三成黨員投票」

 今天中常會的討論是無私而且理性的。

 大家會中唯一目標，就是希望找出勝算最高的總統候選人。

 黨內可以競爭，但我們不能再給民進黨見縫插針的機會。

 當然。這次討論的其他各種制度，我認為待2020成功重返執政後，主席也都能收集大家的建議，再進行檢討後修改。

 我相信國民黨的提名制度在無私、理性和團結的討論下，一定能越來越符合社會期待。","1571436956","https://l.facebook.com/l.php?u=https%3A%2F%2Fwww.ettoday.net%2Fnews%2F20190227%2F1387905.htm&h=AT16Afa7M6qD5hOqWKIk5NySDhtNFAifiPtIsmpSSGwVluVFCgrVkzdJ86MYbD-pTxPy98sKbtU0mx-uoOG-6Pf4Y18vMYjY5EOTCTaoLhMMC1Hs7s3VbSfVmy4pdwSyMr1wsKGq_uXE6nipNyUO6M3q5DpmQISv6OE2LQwwMuVMdIAmCuxavpLzOfXXw-c44KtxvR3Jy9v3Sq8cEkeKmnHquxNVPMzZxD4ccRPfEHUbo_l3SkhjE43momPlj7QvieFyPqQm2qy5pUOlg7aBg71NF6YtMBa9I7x-ErOFpw51knQxmB1bylNJTq2CNWAn0FYJult_NBW-rvPlTu4ijzqTTN98rEPtvh_7TYD_ABPwYCxxBZGO82AQNrZdbyUc9mixw-_GlWIt-7PY53McIYX4g-JVd92KX5sCAr6POucdQByiBorTnEPaAUYSpmOCQW8bvSvEZwtJb8vWzzAdcLHOd66tN5BjOXfmTb56dUmWZolNBImYoow4b1g-lhQ9DcCOQvgK80qd0fjx70bBPOyhDa-ZIvxEA_w7DH5Q-sd0LnGzK6Mzz_OevfYKIpM3UklpmeLxfab2y0m9oFrens9YeyLptyYfc3j1kMIwvchOaLG0L2SueG40Yj_94JBqCaMeklGZHnhSmIox","https://external.feoh3-1.fna.fbcdn.net/safe_image.php?d=AQBD-kWBdrcywXc-&w=540&h=282&url=https%3A%2F%2Fcdn2.ettoday.net%2Fimages%2F3757%2Fd3757352.jpg&cfs=1&upscale=1&fallback=news_d_placeholder_publisher&_nc_hash=AQAB5oEpmfD8CMTy","▲▼馬英九、王金平、朱立倫、吳敦義。（組合圖／記者李毓康、屠惠剛、湯興漢攝）","快訊／國民黨總統初選機制出爐　民調、黨員投票「7：3」 | ETtoday新聞雲","國民黨在九合一選舉大勝，黨內天王紛紛表態角逐2020總統大選，國民黨中央本週三（27日）中常會定調總統初選方案。根據中常會最新決議，依照原「中國國民黨黨員參加公職人員選舉提名辦法」，總統參選人維持現行由7成民....."
"https://www.facebook.com/haulb/posts/1929430977092764","1542987786","共同唾棄這種選舉奧步，還雲林乾淨的選舉！

 https://www.facebook.com/yunlin.lishan/videos/2259606707657327/","1571436956","/watch/yunlin.lishan/?__xts__%5B0%5D=68.ARC7FxBDYzHMMB4f_C1p1vchBQJ4EiHpErV8vVtZO_mOqV5X9m4r5QnRraHsEOydIIet9eJB3pVlrYx8qDlrqiEZOsRoVdMr7TDA7QrI76HOn7smkyLI5ttkPd4QEBo2l7QrvXVU_tqBdNDD05l_fKr_qElgWxhc_LlB0OL0hadeoitAu_1SXnCDZe2Y0IglC3hvFKlS30JniT4nCASjoxTbQNKdfvRMhvrbaM2V7oDjxNGv6jgGCRPR4nrTLbVAfNONYFLtwUB3DQBsdpsQd3bu48ewc_8VQpyTC9yfBOVc61OM6g4k0dy8SXmqaPb0X1U7EA8nMcEkhUArcvW_7LVgS81kw5iH0XHHuFljFo7d_IoB37Dsdxw6kuQjJHBg5mBInCDGae0XaHF-Evq1NU0ZI3AH7I4bEvkLehZNgb2lrMwPId-XzmZuwRvstMqdN11oAi9i71MyUjN2bJDx-mJlXw-FBAcaqVFfBwiK4_ND-ruNAXdNo1kuv1scRbggE662&__tn__=kFFHHH-R","https://scontent.fiev13-1.fna.fbcdn.net/v/t15.5256-10/44576170_2259615664323098_3868437293584875520_n.jpg?_nc_cat=110&_nc_oc=AQnvc6PyxEmhNicdfBXvsuqcZkivkizikyIpnKLQ9tBU7VDKsDYPo57yTogVOfqTBDk&_nc_ht=scontent.fiev13-1.fna&oh=141c4037f70613fe88dfe6555b8926b5&oe=5E5E2630","undefined","張麗善","162,108 Views"
