url,posttime,text,crawled_time,attachment_link,attachment_img,attachment_img_alt,attachment_title,attachment_brief
"https://www.facebook.com/IncredivilleTW/posts/2169908106658127","1549713601","那些被人叫做 #變態 的興趣
到底都是怎麼出現的呢？

為了研究這種「少數人」的癖好
加拿大科學家設計了一場實驗並且發現
如果先讓公老鼠在帶有杏仁味的空間持續交配
那未來這些公鼠再遇到散發 #杏仁味 的母鼠時
就會變得更興奮、有更高機會完成交配

但這樣還不夠，科學家接著進行另項實驗
他們讓公老鼠和穿著小夾克的母鼠不斷交配
結果發現這些公鼠在日後會對夾克特別有反應
要是母鼠有穿夾克，交配成功率便上升 
若是沒穿，公鼠就會表現得興趣缺缺
也就說，牠們因此養成了 #戀物癖
覺得穿上衣服比不穿衣服還要性感

這系列研究成果指出，所謂戀物癖
很可能和生物的 #制約反射 有點關係：
過去某段特殊經歷，也許讓人在無意識中
將性和特定物品建立起特殊連結
導致它能點起難以言喻的異樣慾望

奇怪的是，不只是科學家要拿公老鼠做實驗
人類的戀物癖，大多也是在男性身上找到
究竟是為什麼，目前也還沒有確定的答案
也許你們也可以自己實驗看看

#怪奇冷知識323","1570877101","/IncredivilleTW/photos/a.1780902738892001/2169907876658150/?type=3&eid=ARDA8xuSwdRNXSg2coN5tIpvZxqe1Hg2zOpbU3yI276H1UBR-_8ov1v-vUHozehokk4lHSb0KyFd04tm&__xts__%5B0%5D=68.ARBm536FWV08TBxtADbttGUFBU7QEXMZaJ2XNQkg2qGeQweZF4JrgNVynVa9jGsN3vpafsW2gjV_ibgBqjEKELaEfYpFzZ1yZ5jVEJ11hIcWlEvspPWXlpKnJrOfwn_JcrGADywh417z3jAVkkLP60-Gap8t4Bgq7pOqD9iNkpQHSCTm-ZeNCcxVbnM3WieqNsy2jjIiIZRRHtYgsOb_xBqRTPcEdTBebqVv_BPydqVUwqURByba1ikqKHovsAU4iJZbxybgUtP968-c42so_gYSEC_Hw_tpOUSdwWdWSIEyZtl9eSw2vSCcZAvL1MPBdLy3plBdJWDpopJIHTHF9nmcWAg6&__tn__=EHH-R","https://scontent.ffjr1-4.fna.fbcdn.net/v/t1.0-0/p526x296/51467529_2169907879991483_8508414214346375168_n.jpg?_nc_cat=106&_nc_oc=AQkV5fAqsMTC8QVONQ9G7hpiz67XYThxv6KKmrV94A3IHBBZ4ecKcN1WmDYbgl50GU8&_nc_ht=scontent.ffjr1-4.fna&oh=93025bc23e27344034e704a8d5704979&oe=5E19764C","undefined","",""
"https://www.facebook.com/IncredivilleTW/posts/2161253274190277","1548475201","劍橋大學研究發現，很會長跑的男性
在外表 / 生理上的確會顯得更有吸引力
但請注意，這並不是說多跑步能讓你變帥
而是擅於長跑的人，天生就內建較高的魅力值！

他們發現在長跑中表現優秀的跑者
於胎兒時期，曾接收到更多的 #睪固酮
這代表什麼呢？代表在競爭配偶時會更具優勢
像是肌肉、骨骼密度、心血管功能都會更好
甚至可能影響到膚質和毛髮濃密程度
更重要的是，會讓你的 #無名指比食指長

對，睪固酮含量確實和無名指 / 食指比例有關
所以小時候聽過的都市傳說，是真有科學根據

而研究人員也猜測，從演化角度看
#很會跑 的人類的確是有生存上的優勢
畢竟狩獵時代的原始人要是不會跑就得餓肚子
所以基因自然也會比較有利於繁衍

但這邊要順便提醒，要證明自己是個優秀伴侶
在跑步時除了練習加速、還要盡量設法 #減塑--

你知道一次路跑活動製造的塑膠垃圾量有多大嗎？
就算你真的有繁衍上的優勢，也請別忘了
留給後代一個能永續生存的環境
才是繁衍的最終目的

所以所長和Greenpeace 綠色和平 (台灣網站)
在此想邀請大家一起響應 #無拘無塑來跑步
自備環保水瓶、不拿紀念品
一起努力營造對環境更友善的路跑風氣！

#相安無塑
#怪奇事物所X綠色和平
#怪奇冷知識317","1570877101","/IncredivilleTW/photos/a.1780902738892001/2161252620857009/?type=3&eid=ARABP6A-JXkBckEGMQywUItMVS23fWddpYTv5HVvhbzRRwsoHMLedllyHijgRG7U6Cu6ER8kR2TAepVp&__xts__%5B0%5D=68.ARA7Rrp7XLyqztV511Gk07zsueFOqUjipXzQQYCYw4Jr_3pyHHZhXqd4XBHJkXUzbrZQ2XVBIDb477XpaX3adctXcITofKmtfXW4MC7DGAaVCVvClzjmvoO6AGMjsVRm35h_E_gY1IjXYCQ35SY1UstX3S1IrXIvHltMQFqTt4JzNlchb834JeflwjLuzpyV2EXkARGwmusuWYDFsXjjtuKAL83HVcMkzNHTVvTjMXHDN8yxW1p3Eqay7SxiRlxx9NrljE551wMamDeciue1t4g73zi-oWuJF9cPT3iC_lbiCnmV7w3-AIUjIyJIbzL2W9DwHfMnNds1dfb2U2Yw3hHODU0z&__tn__=EHH-R","https://scontent-arn2-1.xx.fbcdn.net/v/t1.0-0/p526x296/50635362_2161252627523675_8817004539367391232_n.jpg?_nc_cat=103&_nc_oc=AQkmSEVY7kBKEXGuzkwaLAkFr4ciRTOCHcJ7hYlWc_bXBe8GXZshso0h9UiZ2iSpLw8&_nc_ht=scontent-arn2-1.xx&oh=4093ba28dacd263f16b93c890470ae36&oe=5E1C306F","undefined","",""
"https://www.facebook.com/IncredivilleTW/posts/2078689882446617","1538049600","#鮪魚 不像一般魚類能自由控制腮蓋
牠們需要不停游泳，讓海水不斷流經魚鰓
才能持續呼吸到氧氣

因此，鮪魚就連睡覺時都不能停下來
否則就會缺氧而死
於是牠們透過讓左右腦輪班休息的方式
達成邊游泳還能邊睡覺的超神技巧

除此之外，有別於一般的冷血魚類
鮪魚具有特殊的 #逆流熱交換系統
能將肌肉產生的熱量保持在體內
所以牠們的體溫會比海水溫度還要高

體溫升高還能提升肌肉的收縮強度
這就直接強化了鮪魚的運動能力
讓牠們具備罕有敵手的超快泳速

又快又停不下來的鮪魚，怎麼看都很熱血
可見鮪魚身上最值得我們借鏡的
應該是一份不懈的態度
而不是你身上的 #鮪魚肚

就像GOGOVAN 全年無休熱血服務
馬上接單即刻送達，就像鮪魚一樣迅速
讓你在瞬息萬變中也能跟上世界的腳步

#態度決定速度
#也決定你有沒有鮪魚肚
#怪奇事物所XGOGOVAN
#怪奇冷知識215","1570877101","/IncredivilleTW/photos/a.1780902738892001/2086245821691023/?type=3&eid=ARAaK5SAD52CfhOhbrc23toiBlFNnxAcNJ8D-pS50gxOslI7NuIH2E9YRi4pYOZxuwrBzsVueIZKtllB&__xts__%5B0%5D=68.ARBo9ySWcKIbEGO-g1-Vmt_fskuLAqnWPz4kjxoJwtC8cKzNCg-FyBU562ANlSucfY4Ultj_JxzYXSEGchEJiv78tRJZza_BKoH77gHrrA62RX-n5TLLwgsKk9oETR__tZfm3lwf4SrY_1LoHKUId0JV6rZ41SWlELR7fO2R8GmWe78Y0DScE71XbV-GkbjGICcLesNOsKoiV5s6QrpNt4_nEBPjoXkGs-OH9wVMyxUfxkecv9BVmAtchcup8bH7z9dSPeNTaqioaRvA6GzMEr9yjQOEmT2vPijv36Hqjoi4ZL8v6A6wYPlKpY-ektnudaIGzeIa5A8sp_DidKI-ovvZtjhe&__tn__=EHH-R","https://scontent.fsdu20-1.fna.fbcdn.net/v/t1.0-0/p526x296/42672699_2086245828357689_4418818351631958016_n.jpg?_nc_cat=100&_nc_oc=AQkDSuOmq-Us_8sApO7zDwNck7WWjtgfPdgzl6Vn_zTg3k1MvgTs0zkIj9UZfF1g-vs&_nc_ht=scontent.fsdu20-1.fna&oh=e3519111dc137aa416ee31143b690445&oe=5E3AB736","undefined","",""
"https://www.facebook.com/IncredivilleTW/posts/2090058797976392","[Error]: TypeError: Cannot read property 'attribs' of undefined","","1570877101","undefined","undefined","undefined","undefined","undefined"
"https://www.facebook.com/IncredivilleTW/posts/2246608018988135","1559736000","你知道每天逛街買東西
是真的有助身體健康嗎？

有份關於台灣老年人健康狀況的研究*
特別把購物頻率納入比較 ( #從不 到 #每天)
結果發現，即便平時有在抽菸喝酒
只要能維持每天購物血拼的好習慣
那就會比不常購物的人更長壽

這可能是因為購物包含一連串身心活動
能讓人在過程中獲得各式各樣的增益效果
譬如身體上，走走停停會累積運動量
在心智上，精打細算能擴充腦容量
社交上，討價還價幫你磨練雅量

研究也指出，以前的保健小撇步
通常都只強調生理層面 (像運動或飲食)
但社會和經濟活動，其實也有助延年益壽
考慮到 #購物血拼 能多個願望一次滿足
也難怪會是有益健康的生活習慣了

所以為了你的健康好，我在此隆重介紹
--誠品生活+ #年中慶！！

誠品生活年中慶活動，6月5日起正式開跑！
各館皆享 #滿千送百、誠品人滿額專屬好禮
使用LINE Pay滿額還享3% 回饋

這麼好的優惠
不只對身體健康有好處
對你的荷包健康一定也有幫助
延年益壽最佳首選，快來誠品生活年中慶！

#誠品生活年中慶
#怪奇冷知識376

註：研究考慮的因素很周全
包括年齡、性別、教育、種族
財務和就業狀況、生活方式等都有
所以這結論可以排除是經濟差異導致","1570877102","/IncredivilleTW/photos/a.1780902738892001/2246778378971099/?type=3&eid=ARCogu6-E-lrGBiWOfPA1ZFFqrWK1WcydPiWZWT2IZx7N7X5G0wPD68gPUmNVQRZPP07fnoONEZ3w7_o&__xts__%5B0%5D=68.ARCnxEgG-YXfGcQwEYZOm7s-YwVxk6IF10DFv2Qn1qK2yXzJewKoxLLW-EPV1OdAkZ6JPrQPZNJZb4uWH55XdMcsMbuK7Tc4Kur6sIRBXfPMfIufgUi2EijLpFK3VWValxixcvGrq_-sFHnUSD9DyVyjUZ-X2EVasEQZlkLiZjXJ9nPC0JLO1lKm10W7m1lfW_XJKhmVt1eNIltY2Z26KA9IJWPWWNOZgQPWdIIq95qL1YlL_wRj83Exr9-cu4xS29pBESrG7KtWfv3aKE3ZNv9OxOhQfsrZAshcEBDJQDO6_kpS8afKb5fj3LvKuypWG6EAWls4Sea0Q72pTq5oc9DSb9B6&__tn__=EHH-R","https://scontent.fbud9-1.fna.fbcdn.net/v/t1.0-0/p526x296/62307227_2246778385637765_144510157563363328_n.jpg?_nc_cat=100&_nc_oc=AQnQcWAQaQiLIORE0WN8UO9C4T3x_uYrTcGa1mzVFaea2IMrKQ1JmMMScKGrxN7d4fA&_nc_ht=scontent.fbud9-1.fna&oh=fabfba22195d9d6d3ecaa15490364439&oe=5E2BB4E9","undefined","",""
"https://www.facebook.com/IncredivilleTW/posts/2091291984519740","1538911800","講到 #下輩子想當什麼動物
我們大多會先想到零生產力的貓
但今天，我要誠摯向大家推薦—
你還可以考慮當隻 #無尾熊

貓一天的睡眠時間大概是12小時 
但無尾熊每天卻能睡上20小時
為地球上最能睡的哺乳動物
(順帶一提豬大概只要睡7小時)

無尾熊之所以要睡這麼久
是因為牠們的主食-- #尤加利葉 熱量極低
除了水分和超粗纖維以外幾乎沒什麼營養
所以牠們得靠多睡少動來降低熱量消耗

此外，尤加利葉其實是有毒的
其成分甚至能被製成治療香港腳的藥品
動物界唯無尾熊的腸道有特殊菌種能處理

因為專撿沒人吃得下的東西吃
無尾熊從此免於和其他動物搶食
形同開創出一片沒有競爭者的藍海
就更有理由每天都睡得跟死無尾熊一樣了

像這樣的佛系動物，仿佛也在提醒我們：
要從殘酷的競爭螺旋中脫穎而出
未必只能遵從競爭邏輯、想方設法擊垮對手
專注經營自己最強大且獨一無二的特質
也是有機會創造出難以撼動的生存價值

順便提醒，你這輩子不可能比無尾熊還會睡
所以明天星期一拜託還是乖乖去上班上課
千萬不要妄想你能睡出什麼生存價值

#怪奇正能量
#怪奇冷知識219","1570877102","/IncredivilleTW/photos/a.1780902738892001/2091646304484308/?type=3&eid=ARALS-tYh3p0Ck8lb3HN4q4e3VEvODZsFTaU7kxLFkZUwFkXdlf6jNNna00wb9Kjltyja2krtuvQjHds&__xts__%5B0%5D=68.ARAr-yBSYQE_fvmWpQAvxEqLzo6C7dtVICtiXt_w_AuGVDa9fnwX01OsIGc8jq_l12aj_45xVLmegFDHaMnJgqn6MdGrCrVJfJbnyJ_B2-cAWxRQA7uXdDxRun-AU-16lOOHgwaSGntqp5mOfIz3S-XEUvlnFO6Zxu-Qgy-xubakfVT1q69UFpytmIaVVrtIN3gPL_rE6F00_a-ZDmEb8V1kQ-WGZqHOllTUe_Fd0aO7CUE1a6o4Ltn171Ozp5Ro-7G3mmb19yLvT5qAOOGRthYmIfYv0Eb_ualdKQXdB6HzpDM5QGaxUB3iVCNfnwf3O-oJczmHMBOF_7qA6YICmmCf6tn9&__tn__=EHH-R","https://scontent-arn2-1.xx.fbcdn.net/v/t1.0-0/p526x296/43340028_2091646307817641_3719462148150132736_n.jpg?_nc_cat=107&_nc_oc=AQnZrfa7V3gTKQOZZvGinecLGgt0dspKn5rQhidYwbycl1XsOCTd-vjs_pySCDTLr-M&_nc_ht=scontent-arn2-1.xx&oh=261d687c76d1dfcd51c7551866c39e5a&oe=5E16CA36","undefined","",""
"https://www.facebook.com/IncredivilleTW/posts/2149810088667929","1546862401","預算4億元的核能反應爐
預算1萬元的腳踏車遮雨棚
以及預算600元的午餐津貼

假設有個核電廠工程團隊正在開會
你覺得上面哪一個預算討論案
會讓他們花上最久時間？

這是50年前政治學家帕金森提出的理論
他指出，在討論專業且規模龐大的事項時
多數人會因缺乏相關知識及掌握全局的能力
而不肯輕率發言，寧可盲目地表示贊同

反觀那些不重要的瑣碎雜事
因為大家都懂、都有自己的意見
人人都會想插幾句話好刷個存在感
也就更難做出決定，導致開會開到浪費生命

這種學校職場隨處可見的現象
又被稱作 #帕金森瑣碎定律

為了避免被不重要的事情占用太多時間
該怎麼把心力專注在最關鍵的事物上
也因此成為管理學經典不敗的難題
所以下次再討論到 #午餐要吃什麼
我誠摯建議大家不要浪費時間，堅定回答：

「隨便都可以。」

#這才是真正的大智慧
#怪奇冷知識307","1570877102","/IncredivilleTW/photos/a.1780902738892001/2149807672001504/?type=3&eid=ARAM-phumE7_sw0AFAjh8bvdAf0G9Ls5ZAiaeOXK-jUQSC6RCAdw8a4ELk-KtLbL9PA-ohJSdhzU0lAs&__xts__%5B0%5D=68.ARBNEY9KBvcc5zt6k6Qx3ymMpekf9-EGsuCKR3LhHKuXBXuqvNRX2uxmo4MatyQ2T6KkYFzXudmo6ueHkoueaUzAlUB4OmP5K4NNhBSMuQY0mgs8h0oQVhlqI_dCUUtPAaqb4PeDZDJIqyE_LH6F8OSaHi_JHnBMUjhTKfRPVq8hVHEvqdbmzneupPUZbLoeaZCyuYgObQcEJcRMUJntbpsI7ShAcJOzXiKfgB4z1QkIwdi98x0xEcujhb4Y3-hs4-istC4zwY4YvqXLrHyYbN8MGHxWG3-TCCJLbSDZHyxMY8EWzlxI5ICTU_522gRpOCs6nwVF9z44OF7zAgtHv6FogSHF&__tn__=EHH-R","https://scontent.fcae1-1.fna.fbcdn.net/v/t1.0-0/p526x296/49693422_2149807675334837_2853703144796323840_n.jpg?_nc_cat=105&_nc_oc=AQnZb-s0aLqkIEM2uv6rAZ52BnTaE8LbokuBO1Z6sHu2zZtZdMoY4lOxzI-8Gs__noI&_nc_ht=scontent.fcae1-1.fna&oh=186d4586eef751e52dbfc1386bbb8c74&oe=5E295E11","undefined","",""
"https://www.facebook.com/IncredivilleTW/posts/2076517782663827:0","1536492601","在中世紀歐洲，司法審判這種嚴肅的事
不知為何，總瀰漫一股很荒謬的綜藝氣息

如果你在中世紀起了爭議被吉上法庭
在罪證不足的情況下，法官會採用 #神判法
讓犯人進行試煉，交由神來判斷有罪還無罪

這些試煉包括：
#火之試煉--要你走過火堆看會不會燒起來
#水之試煉--把你丟進水裡看會不會浮起來
#烙鐵試煉--逼你手握烙鐵看會不會起水泡
#屍體試煉--叫你去摸屍體看會不會屍變
若屍體開始流血那你就是兇手

而最歡樂的，還要屬 #蛋糕試煉：
被告要在不能動嘴咬的情況下
完整吞下一塊蛋糕或麵包
如果沒有噎死，那你就能無罪開釋
是通過率相當高的一種試煉(廢話)

身為一個活在法治社會的現代人
我實在很難理解這試煉的意義究竟是什麼
...是想說很會吃甜食的人，都是好人嗎？

#愛吃辣的都是壞人辣
#怪奇冷知識207","1570877102","/IncredivilleTW/photos/a.1780902738892001/2076517782663827/?type=3&eid=ARDYZxvTW-yDr0J6rhA3p9C5aPxiRPYRKiDQMVc9J5oUxspvSDnLqBm0QdmuZq2YF6HaEGc6L6kqwytt&__xts__%5B0%5D=68.ARC7RmL25Hq6LEDZNoWNKTxdp2-bKtEpohihzfrv0VV_klrmjbaG2-39M7Vdc3Ybht6zGVBiK-w77odBhfke4Dbrh_4F8Nvkkx7Dr0H6YAfF-p-DK71hbPGAtmy8sOnggCQCCUkhdoCGRxhaACW0SXBTAgyOgOrcjp9PW1QKicXbTVhhhFvKl09JmX5x8y8S9INNFNikIWgv30NuaWvALA-r7Kzd6OwqJ12ftoZ27unDmZChB7y27u0fePbOgBGIpzHV2jyqskL1-AJocXsM0MhVdHe8u0ULHuJqfZjO4bROV6jalLq4qtm5rCGiQ9QWSxjRBoVO1ADbNoS2i5q3hAYa3BMh&__tn__=EHH-R","https://scontent-frx5-1.xx.fbcdn.net/v/t1.0-0/p526x296/41332494_2076517789330493_6562801476731666432_n.jpg?_nc_cat=103&_nc_oc=AQnfVmbCfsYudSufCk1z95gjeZTVMWFu7e9qa6jay5AL70BRseV0g48HrN3JMJ4Qyq4&_nc_ht=scontent-frx5-1.xx&oh=383f72068bee71215ea2cf3fb931bb4e&oe=5E652F59","undefined","",""
"https://www.facebook.com/IncredivilleTW/posts/2081992578783014","1537358440","雖然大家都愛說不要把情緒帶進工作
但一項新研究卻發現，就算心情很糟
不少人的工作效率反而會因此提高：

這些人能把任務優先次序安排得更好
注意力及時間管理能力，也比平常更強
而且一旦心情變好，這些增益效果就會跑掉
讓人見識到原來負能量這麼有效

但研究還注意到，該現象並非所有人都適用
它只出現在「對情緒有高度反應的人」身上
所謂高度反應，是指情緒來得又快又猛又持久

所以簡單來說，其實就是 #情緒化 的人

這類人在心情很差時，工作表現會更好
反觀那些情緒反應低、沒那麼情緒化的人
會很單純地心情好表現好、心情壞表現就壞

目前還沒辦法解釋為什麼會出現這種差別
但研究人員猜測，比較情緒化的人
人生已經很習慣與負面情緒共處
所以壞心情並不會成為分心的理由

照這邏輯來看，人愈厭世就愈會做事
難怪臺灣勞工這麼有競爭力呢

#厭世冷知識
#怪奇冷知識212","1570877102","/IncredivilleTW/photos/a.1780902738892001/2081992312116374/?type=3&eid=ARAgcnEYXbIWciaVWZ1BG7B4FGoPuDYv-hExrzXytjLaQQJX9EgcCPhItG-l_254sy9lj5tgO8KLCxne&__xts__%5B0%5D=68.ARCwFk9xqdme5l19PJMuo2sevOKXOCGFIFacgDD5zPPgWRjuKFxqGR68FlEzH1IUNxaZh0NCDos6d6s9KfN8eMhUvLiOOz2p7Q-4yTD2OjPv6pEpBTjKKJMbFYguvA_QNuzgHEFV7d1NyGwI6dLvqat3ksG0jTH6Lz_bfKODR-U9QcUiU16aKTZkqjV6vVuy2wA8wJU3mdpFo0uwt1kpqgsbrGMYCoZCvlHLr4CMIyPMpRhwEtbUOWqqLVXzRs_xCGTLvUlaSwjMat57jLU7-y9SUQF4KH3CUS10_eZBXLnlsEk0tmWYdGlUmIUt2eFPQdcoByRa7FkcwumcneT9KOsJIsYN&__tn__=EHH-R","https://scontent-lga3-1.xx.fbcdn.net/v/t1.0-0/p526x296/42240191_2081992318783040_8234604985459933184_n.jpg?_nc_cat=100&_nc_oc=AQnOYFEwHKwkCdaS9DeYhg6z1Cz-_lGk4AIw8PORqqVJgP7yHRS5CcL7GWnwFy-74yY&_nc_ht=scontent-lga3-1.xx&oh=ff21377f0860427d0db4450cc545124f&oe=5E64BAF8","undefined","",""
"https://www.facebook.com/IncredivilleTW/posts/2105082936473978","1545480000","這世界上會吃辣的哺乳動物只有兩種
一種叫人類，一種叫 #樹鼩 (那字唸ㄑㄩˊ)
人類愛吃辣是因為心理有病
樹鼩敢吃辣則是因為天賦異稟

這要先講到，辣其實不是一種味覺
是需要特定受體才能感受到的 #痛覺
(這種受體本是用來感受40度以上高溫)
人腦在收到 #辣椒素 帶來的痛覺信號後
就會為了止痛而釋出能帶來愉悅感的 #腦內啡
所以吃辣才可以帶給你噴火般的快感

然而樹鼩因為基因突變的關係
口中缺少這種能和辣椒素結合的受體
吃辣時自然不會感覺到辣所造成的刺激感

這種天賦能讓樹鼩在自然環境中更有競爭力
不僅多一種選擇，而且沒有動物跟牠們搶食
......至少在愛吃辣的有病人類出現前是如此

雖然樹鼩是真的很能吃辣
不過我想還是先不要急著羨慕
因為我只是說牠們嘴巴裡沒有受體
卻不曉得身體其它地方是不是也沒有

畢竟吃得太辣
會噴火的可不是只有嘴巴

#冬至吃辣務必謹慎
#怪奇事物所關心您
#怪奇冷知識301","1570877102","/IncredivilleTW/photos/a.1780902738892001/2105080353140903/?type=3&eid=ARCg084GTnwr7Q4ftna_cWuQetlTjb0-d34BGsMSIuySOVyhYZcCmjZbEB7_FlYWjH-oIbokiSARNNlJ&__xts__%5B0%5D=68.ARDZS3LBpT9Bx2k7e-5SVg7Z1a1PJ2npb0_5grZKJmUCWHMb7BObqPP8jJoME1P92CaFQPbDMil65JPIesPAkke4OAZyhxawtqYjtyIze9aFqeWHMhpW3_520i9Ld2Ig5g5lc0_xRrbphVPg_jVCKCBzxxouq1ehrWIAD236x9AW07tb1EzzboYSw6p_IBWL39go3sVBZ3MPDyEKZwzVdu_E8hfbUmhU2g6lss3PZWscK-c6LX-hIB16ogYZ4LPZ23G9wbXA_tLTA10fMqSS3Fcq9Yo0t35sjHjv62oHmkuDWX6ClR6xcqImgSuVwIZl1Bd4F92xY9X2dSInjZ3PM70ZwuK_&__tn__=EHH-R","https://scontent-lga3-1.xx.fbcdn.net/v/t1.0-0/p526x296/45100767_2105080356474236_8938911203174907904_n.jpg?_nc_cat=102&_nc_oc=AQnEABT8jzp59NqBZnrglitO3R8adSokbmBaT-0EvAFv53vgiVHx3_UB8-swRN4-M4k&_nc_ht=scontent-lga3-1.xx&oh=d7f99e723bfa688905b96330f9b50361&oe=5E2C71A5","undefined","",""
"https://www.facebook.com/IncredivilleTW/posts/2189942757987995","1552305601","「#現在年輕人真是不上進」
其實有可能是被科學認證的事實
--至少從精子的表現來看還真是如此

在國內外都有研究指出
人類精子品質有劣化的趨勢：
除了越來越游不動 (活性降低)
成分也越來越偷工減料 (數量變少)
與80年前相比，整體表現竟下降了近50%

而且一直沒有人知道是為什麼。

所以科學家就紛紛猜測
這會不會和環境毒素或生活方式改變有關
像加工食品或是長期久坐而導致 (難道是可樂...？)
然而神奇的是，最近又有研究團隊發現
狗狗的精子也出現了一模一樣的傾向
或許能把兇手縮小到 #家庭環境 裡

例如過去就曾有學者猜測
某些塑膠製品中的雙酚或鄰苯二甲酸酯
因為分子結構長得很像動物的雌激素
在進到血液後，會排擠掉 #雄激素
害得精子品質下降數量減少
(但還不能完全證實)

嗯不過這也表示，有些人在還是精子時
就表現出一種懶懶散散隨隨便便
能不能游到終點都無所謂的態度
可最後竟然還是給他脫穎而出了
簡直像是在告訴我們：

不努力不但很輕鬆，而且還真的有可能成功呢...？

#你才不是游最快的那個
#你只是最幸運的那個
#怪奇冷知識335","1570877103","/IncredivilleTW/photos/a.1780902738892001/2189940201321584/?type=3&eid=ARAu9JR0ygHA4gyM0I5QpYq9eyZi5MDnlrHz8v_tpxicJhknOCKoupkvn5S6M8IK1r9Hf9815hF00p7u&__xts__%5B0%5D=68.ARDHpylNV2GdJBRT_ncXDpWyEX5pd1qLkOr2g08OncUU0F82RQmKZugZadohKioeGyDn5EZ-2Tev9f5MlXozJwZysXvc_4silLlqrGFxkwAUOdKXGbe4I6MfR6aYc9vG_LQi_9pKmcvoLF-Mg3Zp0n2WWkCKgr7C5s7gJl5LkN847Eksx6kbAkWnCDiCrLwGUhLa0eECEPBE7pCCZxIC76qHFpJrr_yXjhm-msnzOKDN9f5k9EBdJkLyqWm58wHfKsMfCBzf-sHU6aTnx98QUJyn_2G3-t0NY0rEnjPtccrXtRMdGI03CFN5CG_VczGXTUVnNekCRk54D-aZSxxxIZG6jb79&__tn__=EHH-R","https://scontent.faep9-1.fna.fbcdn.net/v/t1.0-0/p526x296/54430469_2189940204654917_1263853582080278528_n.jpg?_nc_cat=100&_nc_oc=AQltC_JjXCHHV8yDV-chyK2EGSO1TbxvLCBlwpg8CVy7mEyXav4SC9ik-efyOghlyro&_nc_ht=scontent.faep9-1.fna&oh=c1fd2d2d5070cf79681c2e4fdfad0a4e&oe=5E370791","undefined","",""
"https://www.facebook.com/IncredivilleTW/posts/2298953080420295","1566129600","因為好奇長相究竟會對人生造成多大影響
一群科學家決定拿200多位同行的臉做實驗
看看在科學這個似乎不太需要靠臉的圈子
#人帥真好 這一自然定律是否依然成立

沒想到這一次，長得帥反而是一種累贅

這個研究搜集了200多位科學家的照片
並請受測者為他們的長相打分數 (好殘忍)
評分項目包括吸引力、正義感、專業度等
最後再問：「你覺得他會是個好科學家嗎？」

結果顯示，對社會大眾 (無論男女老幼) 來說
一個好的科學家，外表看起來要夠正義夠專業
顏值太高、太帥太美、或是看起來太外向
都會讓大家不太相信他有能力主導一項
「很可信、很重要的科學研究」

研究進一步指出，顏值造成的偏見
甚至超越性別、年齡和種族等刻板印象
不過只是長得帥，竟然會不適合當科學家
難道說這就是經過科學認證的

帥到不科學嗎？


#怪奇冷知識403","1570877103","/IncredivilleTW/photos/a.1780902738892001/2298951873753749/?type=3&eid=ARBzdZOAIjgDdpFoWTg34q3vYnQeQQQ5CJZiw1XYqDYCzfWrfhTyhF0gWcZQfPSFscXaGmcpOZATY1XY&__xts__%5B0%5D=68.ARBBeBQptDhmfCkZ0O-zA_wDbEs4347yaqnVWpEWQpCWw1KUZ1Uipa8texdCaNvAAbEP2mpMyKqGNd4jhK_DiPOBXoKElATmb7qSzySMvTP1jw3ufxI_R0L4FGk4NnVF75WX1Bh-FCqZ5ehs0f1TKin6Hr0C5g6B7Mmw8FmnAwS6c68V0eXwpAWbs7pnMfx6s9cEHyGI8Aziq-ajuSPI9eLLm_bHOzwxIBBYbcEhD66W5VRI9pkDKs8qMMX2Y0jBOjR1VdZNb5jft7ntbtkLhRQhesyf1zZsY1AWKWrLzEKH0n2-EN0XiQuX_g1rYM73z4FBMnYpi9tIuckjwSIf7K2fyXfS&__tn__=EHH-R","https://scontent.fsgn3-1.fna.fbcdn.net/v/t1.0-0/p526x296/67884435_2298951880420415_6941991855689039872_n.jpg?_nc_cat=111&_nc_oc=AQlsGX8xKdPKdE40fzWWkpwZxHvdJtjAUvtEfkXQjJ3SLGtrMYivSc0zYqhlrLmWHvw&_nc_ht=scontent.fsgn3-1.fna&oh=b17c73d3fbc6d3b8ce0abba656243fb9&oe=5E2C5033","undefined","",""
"https://www.facebook.com/IncredivilleTW/posts/2123109514671320","1543579200","雨後萬物氤氳的氣息，總是清新的很有詩意
英文裡甚至有個單字叫 #petrichor
用「石頭」(petra) 加上「神血」(ichor) 
來專門表示 #雨天的味道

但你知道，這其實就是細菌*孢子的味道嗎？

廣泛存在於土壤和水中的 #放線菌
在雨天時會特別興奮，噴出很多很多 #孢子
而孢子表層帶有一種叫 #土臭素 的化學物質
會散發濃濃的土味，也就構成了雨天的滋味

然而，其他由細菌醞釀出的氣味
就不像雨味會讓人想多吸幾口了
--特別是 #汗臭味

汗水和宅宅一樣，本身其實沒什麼味道
但藏在衣物或身上的細菌
會在分解汗水裡的蛋白質和脂肪後
產生俗稱汗臭的臭酸味

千臭萬臭，其實都是細菌的臭
所以有效抗菌、除菌，就是抑制汗臭的重點了
想要擺脫臭宅之名，我在此推薦你們--

日本No.1 #Ariel史上最強抗菌洗衣精

除了洗淨髒污，也能深層抗菌、再抑制滋生
讓衣物不管晾後還是穿著中都不會有悶臭味

現在各大賣場通路都能買的到喔！
(包含全聯、家樂福、愛買、寶雅、屈臣氏 、
momo、PChome等)

#怪奇事物所X日本Ariel
#怪奇冷知識293

註：放線菌雖是細菌，卻像真菌一樣用孢子繁殖
所以過去曾被認為是介於兩者之間的物種
但現在已經證實是屬於細菌了","1570877103","/IncredivilleTW/photos/a.1780902738892001/2123171667998438/?type=3&eid=ARBnbJT-hGMq2mI9uSQ2xGEvyOvjOoLlrO4HraeZxMo3MGDc6jcLFtcD3XvV5oD-Ywk_OIPO3OctIlmE&__xts__%5B0%5D=68.ARC3KDl9ti51gcgD9RC3euQoHoiEWwcWXZZQRpjC6UfV_BuOhvcD7tcLMJwHVDep97KSOx0TpMPRQyj3ddhiGeMzllm-WcQfRKmak3NuGwH8DYKsmXW0uL7pnio8destYe--cVUJOHFETfEbqVICnnlClIIinRhGx9BWHvmxOF26o6HXjiaN8wg8yz-z4kGF39-jPDDzSPxKg9s3Pj7-fw30IYs850Agb0Fbmhxba7vKtDL2JkWyBvmG7lqzdqa3lPbHUCDWykXA9KSbL8rEXk6AKS0Q5-fo56zQkpu9LorLzE3meoNgrSJ_0FQ3IUcVzy2v4_JzdVNNHSRz7WdAgkIEi73R&__tn__=EHH-R","https://scontent.fbkk23-1.fna.fbcdn.net/v/t1.0-0/p526x296/46956277_2123171674665104_1345020780278185984_n.jpg?_nc_cat=110&_nc_oc=AQnv9dTegvC90xoHdPireZSK2lcMnz6HyFaqwVm3u-Rl1hpCL7a7EVM9-7YDEpxNbMY&_nc_ht=scontent.fbkk23-1.fna&oh=8c2bab769c374cf473564bf28af58925&oe=5E26B3E5","undefined","",""
