url,posttime,text,crawled_time,attachment_link,attachment_img,attachment_img_alt,attachment_title,attachment_brief
"https://www.facebook.com/IncredivilleTW/posts/2106209686361303","1541592001","#我為什麼這麼瞎？#我怎麼會愛上他？

遇到這類問題，比起卡到陰或者天生歹命
其實還有一個比較科學的解釋
--那就是女生的 #生理週期

過去研究發現，在排卵期前後三天
女生會比平常更在意所謂的 #優秀基因表現
例如身體健康、五官對稱(帥)、骨骼強壯(高) 等
等排卵期結束，這些優點又會變得沒那麼重要了

這就要講到，人腦的背外側前額葉皮質 (DLPFC)
是做決策時，負責調整各個選項加權比重的地方
有學者推測，排卵期間的內分泌變化
會讓女生忽略DLPFC (還有閨蜜) 給出的建議
更容易訴諸本能、單純依靠直覺去做出選擇

在這段時間裡，比起擅長養兒育女
適合共組家庭之類的加分條件
具有 #優秀基因 會更容易在女生心中拿到高分
那些外表看似強大、責任感卻低於常人的 #渣男 
也就因此或成最大贏家了

然而從這個角度看
著重內涵勝過外表的優質單身漢們
真的不用太悲觀，因為只要撐過這段時間
你們的內涵，一定都會被女生看見的阿！

#怪奇事物所X妞新聞
#怪奇冷知識223","1570877095","/IncredivilleTW/photos/a.1780902738892001/2110054465976825/?type=3&eid=ARCFkAGsb6ACGq8DZ9Fd8_UJbOwrEUlt98EtcJwZ5bFqMUn2kh6YiEBeBTgOUdKhxk7RAZwojZzPOJz2&__xts__%5B0%5D=68.ARB5btiH9NeUEVIONOa0A3J-xxlogKm6wr44kN48VquvWeFHaz6KXsOVqRRSXHP-WWVU3wkoaaHpwQyjVyOU9SwsXY_s8AEYgpnd2G0-rODpgbBpLO4QSVh0MV240xaSM9yJHX6f5y6Lmuc20W3z0wNYRBOFPMzt_UwHRfF0SLHMDpO64cZa3aNOqianu9POqEF5v7zeoY9EC5FXcQamVHnpG6N556irKZVo0Rais8ZKsuQ8fywmuV0GxfjCK65O-J5QHiSFrXIwrerpkRxIrg_B-hfp8_IeCTjoVewHXQ-HEEFywOoKtgNJ6EQo9bKMJ2iwESgBIlOS5ToDV4203uFbaMUa&__tn__=EHH-R","https://scontent-cdg2-1.xx.fbcdn.net/v/t1.0-0/p526x296/45585619_2110054469310158_6789429497734103040_n.jpg?_nc_cat=102&_nc_oc=AQl0aU7ndpfabT3TNB8b4AoAdqydSBCRJA1aXMzfrt6iLwCgqc43S8QjudhLTqh3Eeg&_nc_ht=scontent-cdg2-1.xx&oh=ccbe22101dd8cb7b5b2acadb77899f3f&oe=5E232774","undefined","",""
"https://www.facebook.com/IncredivilleTW/posts/2106209953027943","1541419201","所有哺乳動物都會放屁，只有 #樹懶 例外

樹懶的腸胃，和樹懶本人一樣慢...慢...慢...慢
...慢到沒有感覺，加上牠吃的樹葉飽含纖維
一餐往往要花上幾個禮拜才能消化完全
腸胃氣體不會快速累積，自然不需要 #放屁

此外，人類的屁之所以熱情奔放創意無限
是因為 #腸道菌種 及 #吃下的食物 都很複雜
能在腸道排列組合，再輸出成各種花式炫屁

反觀樹懶的腸道菌種單純、吃的東西也很純
所以在消化時，就只會產生些許的 #甲烷
這些甲烷會在腸胃中被吸收進入血液循環
最後再經過肺部，於呼吸時排放出去
硬要說的話，這就算是 #樹懶的屁 了

不過甲烷無色無味，放多了也不著痕跡
所以雖然樹懶不像別人從屁股放屁
只要不抽菸其實也沒什麼關係
(點菸時有可能會爆炸)

但人類就不是這樣了，請牢記--
愛用嘴巴放屁，你只會被人嫌棄

#不過據說樹懶不用放屁就很臭了
#怪奇冷知識222","1570877096","/IncredivilleTW/photos/a.1780902738892001/2108806032768335/?type=3&eid=ARAYj6SN7FebXhDetTuGdW5zDAoUCpqsl4mfHACFYTHM1MHVJWOZpBwkBekKSzqPxIJCtBeFxsRqGUqk&__xts__%5B0%5D=68.ARBUWr1sJ7eXUwV7IrqpfAtb664DzL34OulvUaFIJ-RwPUZ0qFDUEPtCJ39kQZY9LLR2y3C5QdwUgls-I7yhWNPo6_F9CPbEFlRY10yyfcvgq_oEfDYUtdVkGWqtUtOeQBY-H8jRYd78KngZwRVcRGrUL1lfG7ruLp8LixK2XQ7hUC2WGK8iqom1hplax6jRRvrovuHI4CXkTipdpCqhCz0CmQSje96YQIWhI_deulz-6HehmNYlPpbecKUfKONE7gQonQtGs4uCCKnYQsJiVbtEt2sGRiIoxIK7XQ2RlwHfx_eB6n_OW_Y5po-vEr0-FiVez2loEXiRWL6eLbaKvZgKI7eW&__tn__=EHH-R","https://scontent-lax3-1.xx.fbcdn.net/v/t1.0-0/p526x296/45487254_2108806039435001_3683655164717170688_n.jpg?_nc_cat=105&_nc_oc=AQmdF2DZC5um24vHpgvhouBsip63AzDvZEeXn6fqMiEYT6hzQ_hU6VIeLYkc7axLRWM&_nc_ht=scontent-lax3-1.xx&oh=6519daf8b8ce21fcba631dd7a2453828&oe=5E3AA9F6","undefined","",""
"https://www.facebook.com/IncredivilleTW/posts/2122067614775510","1543233601","為什麼人們總會做出不理性的選擇呢？
一起 #心理學實驗 就在探討這個問題：
醫生會先跟病患說：有款新藥成功率有90%
接著再講「有個阿北吃了新藥以後......」
最後詢問病患願不願意使用這款藥

結果發現，儘管亮出一模一樣的數據
阿北的個案仍會大幅影響人們對藥的接受度
講阿北吃了有效，有88%的人願意接受新藥
講阿北吃了沒效，就只有38%會接受

如果新藥成功率很低只有30%，結果也一樣
講阿北吃了有效，有78%的人願意接受新藥
講阿北吃了沒效，就只有7%會接受

這證明，人們很容易被具體的 #個案 說服：
強者我朋友的經驗、身邊活生生的例子
總是比 #統計數據 更加親切、更容易被接受

--或許 #不理性，但這就是人類的天性
也是我們每個人都容易犯的思考偏誤

科學、邏輯、數據這些東西
本來就違反本能、需要靠訓練習得
要做出完全理性的決定，其實並不容易

而我想這也是為什麼
比起選舉本身，持續的溝通與討論
才是 #民主社會 中最需要被重視的價值吧

#怪奇冷知識291","1570877096","/IncredivilleTW/photos/a.1780902738892001/2122066838108921/?type=3&eid=ARC9jM42t_9Ln1UxqBv5JEhrEdbocRnu19Ar7-ix_JgWC2NmnpGl391r5_BrWIiRe14nkM8KlC2qpQOS&__xts__%5B0%5D=68.ARD6DJLQAkSo29TUVASQv1cjDDhd8WG6A4T_HxSBjBxggt2t-HrbkXRBkSVjxxN-wYLmZ4VldbtYMpnWQKaBsIUybfp7mRmIln51VPyVqEfgYrTCTjyTXITYDknXjkXaC3GCnajJrcnpqKieahp-jubUGJeHSM4uenf_45is6m6G3ZR8VgDVwBpZVS5YNymyqaBjNPkQ4Z7-QBO3KEIexshKqmdwE8HkhUwfjpbnzdnzrxjs_5UxTJpgFMy8G_qx4kdDQ3mOpJXRXYF5INjmex7CDibFg_LygQBVWhBlB6Muon4tPiOKXfP70zsYDfdoj8qcAda2tuglhm0h7xnY0gnRPZ6O&__tn__=EHH-R","https://scontent-sin6-1.xx.fbcdn.net/v/t1.0-0/p526x296/46688961_2122066841442254_7456749686183952384_n.jpg?_nc_cat=110&_nc_oc=AQlYI9RMberXnJkVlXJRcvOzFWrJO97J971YUJleslJTXLiaTZ1DiIH85XfPRlYBhec&_nc_ht=scontent-sin6-1.xx&oh=2a446b07acfa5d238e9a5b9fc1e89168&oe=5E27C191","undefined","",""
"https://www.facebook.com/IncredivilleTW/posts/2078689215780017","1537012200","在全世界近200個國家中
幾乎沒有一面 #紫色 的國旗
原因其實很簡單--紫色在以前 #貴到靠北

在早期歐洲，只有一種毒海螺能粹製紫染料
而且大約要一萬隻海螺，才能壓出1克染料
紫色染料也因此跟等重黃金差不多值錢
不可能用來染製會被大量使用的國旗

如果拿 #哀鳳 換算，全新的iPhoneXs Max
在以前只能換45 cc紫染料 (染襪子都不夠)
所以說一件紫衣就能讓你金光閃閃尊爵不凡
穿出門基本就像把一間大安區廁所套在身上

直到19世紀中葉，人工合成的紫染料出現
紫色才終於平民化 (此前大多只有皇室能用)
但大部分的國旗樣式，這時候都已定下來了
因此只有1900年後成立的國家會有紫色國旗

在講結論前，我要先跟大家說一個老故事：
有男子向精靈許願說：「給我一隻獨角獸」
精靈說：「許個實際點的願望吧。」
男子說：「那給我一個女朋友。」
於是精靈就問他說：

「#你的獨角獸想要什麼顏色？」

聽完這冷知識後，你現在知道要選紫色了吧
這樣精靈應該就會幫你準備女朋友了呢

#紫色獨角獸比你女友還稀有
#怪奇事物所XBeginneros
#怪奇冷知識210","1570877096","/IncredivilleTW/photos/a.1780902738892001/2078689145780024/?type=3&eid=ARBmFjj0UV_ZYwxL1XtuB3ZdCism6rVaawDaZn_lfyXnJGipJJrWD_7ibGt06xjeOKOa9OmOc1qtCgTN&__xts__%5B0%5D=68.ARBEnyg7hg5O55JFvJibvMJg40ttwufkeUpaceChIGkLr37e4zoDjxvk1zMVft50--NtICqAzZnGveVjOTIsj5YmD0uiJpS3jyZcLO8NT63pgd2JX5HWe4Gk5Rp6ZjoWET86tYM7r4as7mRRQY_2nc8Scy6DGkvwp1R-HC-KtZF9zlryv-lRnM1hnRrFy3SOU_M6gsoa75Ywn49xydj1kNZiioLRnYO4jQvjRvnF_YVXqJzNe4Z0Ah4D05cdw2E4pkI3wC8HPtJHNFjEC6wKnXvVbJcu_Sfsc49HtK9WePXLdxrjIgPyVO_iSRgmf44aiQ17x-vkpiARXR_HFG_YUBJhVP_c&__tn__=EHH-R","https://scontent-ort2-2.xx.fbcdn.net/v/t1.0-0/p526x296/41669272_2078689149113357_717736004923949056_n.jpg?_nc_cat=109&_nc_oc=AQkVoYfYku53q-mvi6QI_MegNGzOyIz7BVZfD2kDQYi1pZ1tQDZJkvxSL04UClteSkw&_nc_ht=scontent-ort2-2.xx&oh=ec1716f6823bd0f6b12c169b5c3cdada&oe=5E3632E8","undefined","",""
"https://www.facebook.com/IncredivilleTW/posts/2024399721208967","1542196801","科學家發現，在天氣過於炎熱時
野外的花蜜會發酵成天然 #酒精
害蜜蜂在採蜜時不小心喝掛

酒醉的蜜蜂也像人類一樣
會在恍惚之間飛得跌跌撞撞
導致蜜蜂在夏季的肇事率和傷亡率飆升
(怪奇事物所提醒您喝酒後請勿開車)

接著科學家還注意到
就算有醉蜂能僥倖飛回蜂巢
也會被門外的守衛蜂攔下盤檢
顯然蜜蜂們也知道醉漢有多危險
(蜂巢裡可是有很多脆弱的蜜蜂寶寶)

被擋在門外的酒駕蜜蜂
通常只要等到酒醒後就可以進去了
但要是酒測值嚴重超標到難以應付
守衛們就會合力將牠的腳給咬斷
儘管能有效遏止再犯，但手段實在太過兇殘

雖然蜂生只有短短幾個秋
但蜜蜂真的不該學人類 #不醉不罷休
要是每隻蜜蜂都因為喝酒醉被咬斷腿

我們要怎麼喝到好喝的 #蜂蜜檸檬水？

#怪奇冷知識226","1570877096","/IncredivilleTW/photos/a.1780902738892001/2114207572228181/?type=3&eid=ARD6y4emvdz1hggqkvve9AG-3ZKPdEIrd09W17hsytZmsD_ZOxi35s1H8tDo8llkQkttaRt1aaTd1eDV&__xts__%5B0%5D=68.ARDBgfKTOxmZ-plEnRa7hwYDzvhRirAAJ59dFY7oNQs766OQR0TMBsjmzvMyGd3AUZnvV-jufhqluIpj80fqprwIlgpKW_zQ7sJXn3iU4AHZbss2rTl8-eiv_x8gOKxMxCL8pssgZHco9F6z_yACR7RDDcI_nT-q40i88sMTtCz6uvgvbAOV_2uNAF08pm4GKgUKopNIHaDo1ZLIoEK5qtoUKL98_xLwIBgbBhtk1jeCQCjO01DzbbYjcEy-G51oRpq9HV03kW6y9qZ-ywIyh98AmfYVxknXQ1PZD1n5gYM55GKVY6s8W9JFkEQaBwMXfyZfDVDqR8x8M4SkU-vmQWkg0bJN&__tn__=EHH-R","https://scontent-sin6-1.xx.fbcdn.net/v/t1.0-0/p526x296/46210866_2114207575561514_4923139665000660992_n.jpg?_nc_cat=108&_nc_oc=AQnZbn2-crphV-JJESX-one3g0b36_jGH-h74rSpjqibR9IAsBRiF4vkaHw77kA6uvY&_nc_ht=scontent-sin6-1.xx&oh=6f65ddd800691749b92779ff5554c883&oe=5E183016","undefined","",""
"https://www.facebook.com/IncredivilleTW/posts/2268467593468844","1562241601","過去十幾年間，許多古生物學的新發現
都一再推翻了人類對暴龍形象的傳統想像
例如牠們身上應該長有不少羽毛
與其說是蜥蜴，或許更像大鳥

而且從生理條件看
#暴龍 好像不算很優秀的掠食者
除了主動出擊，牠們可能也很愛撿屍
因為暴龍前肢短到什麼鳥都抓不到
眼睛又小到朋友都笑他李榮浩
運動能力甚至還沒有我們好

從前科學家估算，暴龍時速約達到50公里
別說用跑的，就連騎腳踏車都會被追到
可一份新的研究通過電腦模擬後推算
成年暴龍的時速，最多只有19公里
跑百米差不多要20秒 (#秒速五公尺)

這速度別說是志玲姊姊
就連你們班大隊接力最弱那棒都追不到

這主要是因為暴龍生得太大隻
以化石推斷牠的骨骼強度後會發現
如果牠們用超過19公里的速限來奔跑
那骨頭就會因為壓力太大而垮掉

雖然暴龍無法快速奔跑
但單憑牠的噸位和強而有力的後肢
不用跑多快，也可以輕易碾壓獵物
如果想體驗看看暴龍那種不靠速度
還能憑破壞力宰制獵物的快感，我推薦

--#Garena極速領域 #超能競速賽 #706盛夏狂歡季 

全新超能競速模式，共有五種超能力：
隱身、飛行、閃現、傳送門和 #大腳車
多種不科學玩法，讓你體驗當暴龍摧毀對手的快感！
7/6登入，還能領最高等級 A 車和多樣虛寶
進度直接超前暴龍，直逼火箭！

#怪奇事物所X極速領域
#怪奇冷知識386","1570877096","/IncredivilleTW/photos/a.1780902738892001/2268466780135592/?type=3&eid=ARD0xQRcG-4NUmMNz2zW_hJr3CUVk0CMQSt-G9Htxkuu_BJ-fLS4U8p3Qy927y6DP9Q0BMuwsbVgi0Bc&__xts__%5B0%5D=68.ARAJFmjqt3jrks4x3fJf2S27GV21Xo-qbcC_Rk3Yscnj7yoGNyNCzdc9WoTb3LCo7sn7-vlOZYM-KWXjMbXUEFYQHqpWYNmpb68l4FYyUDyLCCOpiii-tVtBQ8ZOO84lzD3FRXD2l5N6XnSykN05kFAi79EqT76FnvjWmwOTmiwzy1BoNeB-h1fmF7xUeqNZiAfWC01K4DQziCJ189urMBuTwg1zTYgoxIfCk-wj5Ws_7A3OCKQsUJQdJOKFBPz-8qONEBpQQoXE5y5y556iwfKKcjmskh8ICIKMhkh-u4q36MtqA26y8VlK2owoEmkhTJgcqKKCy3OIIS0Azo9OKZbfK-no&__tn__=EHH-R","https://scontent-yyz1-1.xx.fbcdn.net/v/t1.0-0/p526x296/65673743_2268466783468925_259900277946056704_n.jpg?_nc_cat=102&_nc_oc=AQkIE9X9YtPimcz8yg0Ul5r03Xn9piYKYvAVUB-fSupVDwypRcRuERv0fv0P7WOeyGA&_nc_ht=scontent-yyz1-1.xx&oh=58671b71a53d6323371020c77b8181f3&oe=5E3ADD77","undefined","",""
"https://www.facebook.com/IncredivilleTW/posts/2176883495960588","1550491201","在比對了85種狗狗的基因後
科學家發現，與狼差距最小的品種
不是狼犬也不是哈士奇，而是 #柴犬

基因差距最小，除了表示柴犬和狼很像
也說明牠們可能在很早很早以前
就已經從狼群中演化出來了*
(柴犬是非常古老的犬種)

這個發現一定程度呼應了
#家犬 最早可能源自東亞地區的說法：
有份研究指出，距今約三萬多年以前
東南亞就已經出現家犬這個物種
而狗狗開始在歐、非洲探出頭
則要等到約一萬五千年前

也不要忘了，雖然按體型只是小型犬
但柴柴攻擊性強，是貨真價實的狩獵犬
或許正是原始的狼性，就銘刻在牠的基因
所以柴犬才能和野狼、老虎和獵豹等猛獸齊名

這也就是成語 #柴狼虎豹 的由來

#最後是我亂講的
#但柴柴兇起來真的很可怕
#怪奇冷知識327

註：其實按照目前主流說法
狗是從某支已滅絕的未知狼種中演化出來
而現存的狼(灰狼)只是這些狼的近親","1570877096","/IncredivilleTW/photos/a.1780902738892001/2176882559294015/?type=3&eid=ARBL3twTgDl8KnFw2uNViIv_AMluvCPRsiSQ-hvphMhnhKO69qGfdIlUsV36dM6gBWNMmjrtOAi9lBLZ&__xts__%5B0%5D=68.ARDeL_upstLIOEZQsoLNTGbillmMzHtcB2O9JKzud1jKgy-iPE29r2YheDTyPyeA-NJ6vgGnP_G5bbKBi_a0K453Q0ZmIav6xsfYtzRS-8UHueJ_nb5u40hXoHoy2JFgzDHqNx5zGI2uuTDFzHBXYuGNl142E7AygDzeLFEmGXh_f9ElQdSNM6OkKIm4MTGDBynvhEPoaSOWbPIg1vzN_FSEoeQ1CkjKx2lPzv1lr8oSiEHyOmKM_SKhbKC-GTUWiQHXbgyS6n2SpUTnDURHav_gJt0Jfg-YmnO0KBBW_Kn4kLxjl0gB7psonLZ8paL37-B0eDqr7CU_fVZVZVdYg2zBhJoK&__tn__=EHH-R","https://scontent-yyz1-1.xx.fbcdn.net/v/t1.0-0/p526x296/52537780_2176882562627348_2686120470163488768_n.jpg?_nc_cat=101&_nc_oc=AQnSosdQ8ceB_y6tDxmnrpsnce1esPIyJZUHigdsB_VVyqFCi7i_ofV-CURZ59Rl32Q&_nc_ht=scontent-yyz1-1.xx&oh=88da7fdedb7500015bd38c9867b149d1&oe=5E23D34E","undefined","",""
"https://www.facebook.com/IncredivilleTW/posts/2208970396085231","1554897601","根據本所不負責任統計
將近90%的人丟骰子時
想丟大點數就會大力猛搖
想丟小點數就會小心輕放
但你冷靜想想，這樣做真的有用嗎？

有心理學實驗發現
儘管機率上根本沒有區別
但人們大多願意花更多的錢
購買「自己親自選號」的彩券
好像別人選的就比較不會中一樣
此外，有些專業桌遊玩家玩桌遊時
會自備個人專屬、別人不准碰的骰子
這種只信自家骰子的作法又叫 #養骰子

這類不理性到有點荒謬的舉動
在心理學上，又叫 #控制的錯覺：
因為人類天生就害怕不確定性
所以即使遭遇到完全隨機的事件
仍會試圖挖出一些規律或因果連結
而最常見的，就是相信自己某些行為
能夠控制機率、造成特定結果的發生

只要開電視看轉播，支持的球隊一定落後
機房乖乖少放一包，機台伺服器一定出包
考試前沒先拜一拜，到考試當天一定烙賽
所謂的 #迷信，其實多源自這層心理現象
都可歸咎於，我們在明明無能為力時
仍不願意輕言放棄的那份不甘心吧

抽獎也是，雖然人人有機會但各個沒把握
想被抽到真的沒有特殊技巧，只能建議你：
逮到機會就該卯起來抽，像是去 #誠品敦南
參加現正舉辦的 #敦南30天天抽！

即日起一直到12/31，不限金額消費
天天都抽超高質感夢幻逸品
抽好抽滿抽到你叫不敢！
聽說有位蔡小姐才消費40元
買了兩把滷味青菜就被她抽到了呢！
努力抽天天抽，早晚也會抽到你啦！

#怪奇事物所X誠品敦南
#怪奇冷知識349","1570877096","/IncredivilleTW/photos/a.1780902738892001/2209079009407703/?type=3&eid=ARAR2rlewYecZw2XWP_0qaq4SJIdvQjO_7klD78MUqGRjyiYy05XPsCNgXwQWleEFB5YnLzgWHAqe2xQ&__xts__%5B0%5D=68.ARA7jC89heiifSxZ2bSqvFRzI7pg_7WKtA0UtAH34lEUx-Z6j7yntXbrCFQnYtvKqDMgKXGiyvIT8GGqaSSaIqIAqrdxQP7Bel40mdZQJ1nemodbBmFXbPyF7y-zmz_MoAACAEUtgV_PQS4e8hNG3BppxO4mcQbZUs2wfWJvGTImtuEyMd_YLdq3DHTiq59jwErS6_wGRjy-ueRf1kK4n4Qezawh8LYsaK9ZsSZR6g4Blvo-AVyMoiJhSTvWKcCQpC1AJ1D5RaiSW386hUM4mn9eP0Une2wfuvqSt4vtEd-V8tLIfITj2dOchajgujur3sHgPwHZNR_hR1806Cno06zCm9bf&__tn__=EHH-R","https://scontent-hkg3-1.xx.fbcdn.net/v/t1.0-0/p526x296/56679326_2209079012741036_4696639165872209920_n.jpg?_nc_cat=110&_nc_oc=AQmNTLSyWN108PAl7ai46UMyCH3Py62-CH5eH2bUW-u2tWoS535FXY8MqW0-uIcNKjY&_nc_ht=scontent-hkg3-1.xx&oh=89af2fb7d12c72a04158c5a46927b086&oe=5E63E2AD","undefined","",""
"https://www.facebook.com/IncredivilleTW/posts/2237397356575868","1558612801","福爾摩斯超聰明，但 #他超機歪
拿破崙雄才大略，但 #身高太矮
裘德洛長得很帥，但 #頭也很禿
派大星非常可愛，但 #簡直智障
你有沒有覺得，在後面補上那一句
這個人物頓時就變得更有魅力了？

這種反差萌，心理學稱為 #出醜效應
意思是帶點小缺陷反而會使人更受歡迎
這是因為我們都相信 #人有五長必有一短
一個人盡顯長處，你往往會感到不真實不可信
但如果他的短處，就在你眼前直接暴露
那你反倒會覺得這人其實還挺真誠

為了證明帶點缺陷的人設最棒
有實驗要求受測者觀看不同人的演講影片
結果發現，比起零缺點、操作行雲流水的講者
那些講得雖好、卻會緊張到打翻咖啡的講者
反能獲得全場95%觀眾的壓倒性好感

嗯但你先別急著想修改自己的人設
因為這設定只適用在表現已臻完美的人身上：
實驗還另外安排了一位表現得很平庸
中間卻一樣把咖啡打翻的講者

--結果他被觀眾票選為最討厭的那個

所以說，只要先建立起一個完美的第一印象
稍微露點小破綻，的確會使你更受信賴
這在職場管理上，相當具有實用價值
可如果你給大家的印象已經很崩
那不管扮多醜都是徒勞無功

#怪奇冷知識371","1570877096","/IncredivilleTW/photos/a.1780902738892001/2237453486570255/?type=3&eid=ARDFmAtYUEaqLu1JQPY5Fgq9IQvjM1gZRrCdB5XsEASxnUM4zLItHdcS0365Uuodn6Q6ed-2bb20zAOD&__xts__%5B0%5D=68.ARBx1DKZGXaeAeEpJKi1AlfSXKpqZKS_kiwj8hFOGJDLJYasQYFLFlFU1ECfvIV9hXMOX1ESV1j8CvEJhw6rbuLskXDuQFNIsPT5_bUrokrmFYzsgFXWlx08e9d9rfc3Mtl-QL6Z3NJ6zmYboO0rHjfJupHG5hR6nY7mxNcvXez3Ox4CdZe_f_lld5L-KdSDweldEXwrxNjVfyObWF7BSpWDczKKGNbbkNrCfCZRjjo2L0BU4HonVNS9607Ds8bS9-jZd0XB25qTNJqEnhRITXCJ9mdWlWHF6jUtiZbfn-WSOJDYUEqvy7zYgkg6aymN49CbCpnGAYhWMtCu0W7cU5KR8d1y&__tn__=EHH-R","https://scontent.fbom3-1.fna.fbcdn.net/v/t1.0-0/p526x296/60788786_2237453489903588_2878051086764081152_n.jpg?_nc_cat=110&_nc_oc=AQmmXkAM6fh3RhGWff9eo4HdZB83KloXzcNsb2gu9C7iaxAwDxqlB7LUs3ihmHjUmvA&_nc_ht=scontent.fbom3-1.fna&oh=ce8f5948e7e6f89585f2a23478da0869&oe=5E1E9FDE","undefined","",""
"https://www.facebook.com/IncredivilleTW/posts/2158138637835074","1547985600","公翠鳥在告白時
會先用歌聲吸引母鳥的注意
接著獻上一條親手補到的魚展現誠意
要是對方湊嘴接過，那就代表配對成功了

而對翠鳥來說，禮重情意就重
因此那些身強體壯的U質公翠鳥
會盡可能送上逼近自己身長的大魚
用豪華禮物證明自己值得託付
這就是 #翠鳥的浪漫

有趣的是，因為翠鳥下水捕魚的習性
每逢凜冬降臨導致湖水結冰
翠鳥就得飛到更暖的地方去過冬
所以德文中的翠鳥，意思就是 #冰鳥

但不知道是不是為了送上厚禮而甘冒大險
德國屢屢傳出翠鳥搶在結凍前一刻腦衝下水
結果好死不死，活活被冰封在冰塊裡的紀錄
湖水都要結冰了，冰鳥卻還敢下來
我想這個故事告訴我們
送禮真的還是要量力而為吧

#留言有冰凍翠鳥圖
#有怪癖的動物最棒了
#怪奇冷知識312","1570877096","/IncredivilleTW/photos/a.1780902738892001/2158263887822549/?type=3&eid=ARC11hehV2h3VMYbtHQVoObm7BSqlVm018tmnUh89u0l56fmxNQCoK9-UEcconeBgsOJu3t_Q_KROuW_&__xts__%5B0%5D=68.ARAgL0JdDjb_Dcfghfp9oe-RZVYQSx6b9irCKQ3zd_kWldQwN5MyDCxWNQwUsncFnufEQr18GQa06M-_f1gtcWvle3PX2PsZDUIeS5i--zFVdZMk3VGqvtauijiaccK5_iwus14ojUiWM1GTUMk48XiTbwsBqxWJ2TYILYLpqQDyL_RdOeJ5NwHlh4eobFA8icM8YpfYCKoNYq7-DC0kx_VdD8bI7huwdJXw6zRclAcy1fbs_V17tWSf3NKmJrHkVMUL7JcAcgivERZcuNbdpXOUWRbXBuY8Q0H-qDV5pi8EZm5L44_2wtXrFKYopbfV0XMtnlD2V8KvJZ9Ctp9oVm-wIGim&__tn__=EHH-R","https://scontent.fbkk15-1.fna.fbcdn.net/v/t1.0-0/p526x296/50618266_2158263891155882_7257929396579729408_n.jpg?_nc_cat=106&_nc_oc=AQmNY4unsuIqVe5OBY10gvCWhTd6S_6kXy_5wGl1JYba8QmHh_LxwqHF2GfTS1f5gj0&_nc_ht=scontent.fbkk15-1.fna&oh=c5a3f2df54d960f93e9e9e969b838ee6&oe=5E205A09","undefined","",""
"https://www.facebook.com/IncredivilleTW/posts/2308492556133014","1567166401","所有植物在受傷以後
都會釋出一種 #綠葉揮發物 (GLVs)
GLVs含多種氣味獨特的醛類及醇類
混在一起後，就成了你熟悉的 #割草味

綠葉揮發物的作用有很多
像刺激傷口上的新細胞生成
或是抵抗細菌、防止傷口感染
還有就是向周圍發出 #求救信號：

有些揮發物散播到空氣以後
可以警告鄰近植物即時作出防禦
比如說當某株植物的花朵遭到動物破壞時
旁邊植物就能透過揮發物得知這個消息
再迅速將養分轉往根部以降低傷害

除此之外，有些植物在遭到小蟲啃咬時
會釋出能吸引其他肉食昆蟲的揮發物
藉此獲得免費的 #debug 服務

然而，對大多數的草食動物來說
這個嗅覺信號，其實就等同 #新鮮現採
這對早期靠採集維生的原始人來說也是如此
於是尋覓新鮮食物的本能，或許就隨著演化
逐漸在基因中刻下了對草味的獨特偏好
順便構成了你這麼喜歡 #香菜 的理由--

是的，綠葉揮發物中的 #醛類
正是香菜最重要也最迷人的氣味來源
喜歡香菜可說是我們與生俱來的古老本能
因此在最後，我們要鄭重呼籲：
#反香菜就是反自然
#反香菜就是反人類

#怪奇冷知識408","1570877096","/IncredivilleTW/photos/a.1780902738892001/2308488699466733/?type=3&eid=ARBkbSngYgU9g6pg1NEXu9R0f1gBBDcbGFTNc_SdOZlMMsqJWpsK40AkLCeyOIU-NOQJllgtkugj7MPn&__xts__%5B0%5D=68.ARBFBqszHYNueOW8Jdo3dzCiQAPAt9sQCa5pM4Ueu97cZM7MuqO2mLBhzutZ0yjHw9Ybt9SkQRgHs3Ce2UOptcHZTq4NImKenoTcralQYsRoOxPHrrapiE2-iAB-9jmugTe5Z6Z1QC8rmlUM851evc0EV7_bgnyJ9BKUgvwsdzmm-9fB7MLUaO-HnXnGv2HumVRYKNlh66jZ_42Zooxfq2nmNJjdmhK2vJMu0_7W2c2n16c9kyT3uGzqYNCVBPW6NzRjc3Xat05JFRZNTW2XYdh78FYk_qfnEs0UzaovCCP6bnZe_yCSSuPXj_bJpEor5vYWZbKU_Oh8MqNoig_JZhlnzKRU&__tn__=EHH-R","https://scontent.fbkk10-1.fna.fbcdn.net/v/t1.0-0/p526x296/69151326_2308488702800066_3389133696563937280_n.jpg?_nc_cat=109&_nc_oc=AQk0VbpOg-H9JWyUOyFsbBIl2WbouTPh9-cyLQed7aQLBeQQesF3mxSWQCVp9Bs6qGs&_nc_ht=scontent.fbkk10-1.fna&oh=e32f4f80eff4e746864525ab31cc4978&oe=5E642E88","undefined","",""
"https://www.facebook.com/IncredivilleTW/posts/2152278438421094","1547467200","新的一年，所長祝大家都能做個好夢！

#白日夢，在心理學上又被叫做 #思緒漫遊
而心理學家指出，思緒漫遊可以被分成三種：
分心型：因專注力太低而放空抽離
焦慮型：因緊張或罪惡感而想東想西
積極型：兼顧計畫與想像力的建設性夢境

為什麼白日夢值得分析呢？因為有研究指出
我們的思緒很容易飄向 #沒發生的事
頻率就和想著實際發生的事差不多
--每天大約占用了你三分之一的時間

舉例來說，因為工作太無聊
你是不是總會分神想著 #下班以後...？
因為生活壓力大，你是否每天焦躁不安
總要因為做錯決定，而糾結著 #早知道就...？

然而，白日夢並不僅只是這些
專家認為，只要能在一定程度上確立目標
做出 #積極型白日夢，就會對人生更有幫助

因為當我們在做白日夢時
大腦中負責處理複雜問題的區域
會比專心思考問題時還要來得活躍
所以只要有方向、有計畫地去胡思亂想
腦中的想法便容易激盪出嶄新的火花
更有機會找出意料之外的解決辦法
也就能讓我們更有 #創造力

所以在新的一年
怪奇事物所想和Adobe一起
勉勵創意工作者們 #勇於作夢：
以夢想啟發創意，用創意實現夢想！

#Happy2019withAdobe
#怪奇事物所XAdobe
#怪奇冷知識310","1570877097","/IncredivilleTW/photos/a.1780902738892001/2154278208221117/?type=3&eid=ARCUIejrzTZgxu-C2YfcqZt7LjdtJ7m4aOUUhC51xU_-ZwbNXqpwPeAXgxHOIkETd3Gbdr73zT081hfF&__xts__%5B0%5D=68.ARCQuK-VrD3OTSVPOVTfdJ5-9MqbvfVSc5m30VSVRLeXJPY63ZQfxREi158amfQdspQ8J8fmRjbKrzGHkclGHQPr7vOjTPxdKSw8HDEVljE2BYPgut-cvm258cmkPfRg_NCXBAJeedeR1H9_-Bv2L7EsnwfZdCKPvzTkRSOgaxZ46otACGkpwFCYUuzKevelVXGI8OQOQf418JdeARg_sKXnbvRbec29JLNR6n51HvcK984Q9ZeZj64K8VffFfBmDv6PznUYeemGabi8ODVwVTcaXMfltoLLu9JwgeILpZcKpithXsJKIua0JpOt-uqIq5B2jwA03pXTD0Gv5awlvlU_VJCm&__tn__=EHH-R","https://scontent.fcgk13-1.fna.fbcdn.net/v/t1.0-0/p526x296/50088525_2154278211554450_1826492189027336192_n.jpg?_nc_cat=107&_nc_oc=AQkLGdWQKN8EKP84CdQAzmm4pkZ4wJzTU0ndvArmke89VlUCuIpsDSzpccZhXavyfv8&_nc_ht=scontent.fcgk13-1.fna&oh=dc678f3677663afeb5a519a3e078be1d&oe=5E65646D","undefined","Kirim Pesan",""
