url,posttime,text,crawled_time,attachment_link,attachment_img,attachment_img_alt,attachment_title,attachment_brief
"https://www.facebook.com/IncredivilleTW/posts/2217405778575026","1556107201","肚子餓會想生氣，這背後其實很有深意
因為大腦非常依賴 #葡萄糖 作為燃料
所以當太久沒吃飯導致血糖降低時
大腦就得趕緊釋出多種激素
來提醒你 #這樣太危險

這些激素通常和危機有關(包括腎上腺素)
能暫時提升運動能力，幫助你克服險境
可雖然你能因此變得更強更有攻擊力
卻也會連帶變得更兇更有侵略性

有份美國研究叫「低血糖與夫妻侵略行為」
這研究共分成兩組實驗，其中一組
會先準備代表夫妻雙方的 #巫毒娃娃
接著再請他們把針插在對方的娃娃上

另組實驗則要夫妻玩遊戲
然後贏的一方可以懲罰輸家
在對方的耳機裡播放巨大噪音
兩組實驗進行時，還會隨時監測血糖指數

結果發現，如果實驗對象的血糖值越低
他們扎在對方巫毒娃娃上的針也越多
用噪音轟炸對方耳朵的時間也會越長
證明人一肚子餓，肯定不好惹

這也表示，為了保全性命、守護愛情
選餐廳千萬不要開玩笑，吃飽吃好很重要
所以我在此推薦你--#Chilis奇利斯美式餐廳！

擁有歡樂用餐氣氛的Chilis
已經在4月份推出全新菜單啦！
多道經典菜色強勢回歸、任君挑選
有漢堡、豬肋排、以及招牌瑪格麗特
約會聚餐選擇Chilis，包你吃得很有意思！

#怪奇事物所XChilis #Chilistw
#怪奇冷知識358","1570877089","/IncredivilleTW/photos/a.1780902738892001/2217930355189235/?type=3&eid=ARBURbUaPAsObVvfhYxgjvlrj8RZsXgxOWXOx8T-2IuiuptwpGS0x_ZXF9S8EDsl-4_-Fm4IoTvW8bTi&__xts__%5B0%5D=68.ARBxcSUTqh4syO-e8PJTyOn_PEupDW68t71uuhhJHPePljxOhoN1BixOKX9bjXUZ6-ThefCWWzR0CQ96lgbB8fV4gplp5QJfmmIz3VxVhP8yrotxg4JhgHFn7EgkPVNK52BH8x1FXJ6SzQDwIShJYczClnF7Y0aYg802URjt_8VOPn_wIaq63H4ffWIiEyMKvxZUHQ7Gf06WBQksChBOiirEaVyGIccYF0L7VB_zBJHHafOIYKSraNL1yEZ5OCONG4h-Qv8XTfz-dBwCkIz12BLN42Xtj1TWu1bWannvOg__IkPRLnrkbR5nLbfYQbiOv3MnGKSkBeOf68URNEh3DCA7GogmrFxGA02iKcj66BVin7ZDGNoTyc1D1xe-9QI2fcWBPdpy6rroeqiBaBx8jNbo2PkM6Gg3tyYHM8Esxx0syiYVlFk&__tn__=EHH-R","https://scontent-lga3-1.xx.fbcdn.net/v/t1.0-0/p526x296/58382373_2217930361855901_9073198574069612544_n.jpg?_nc_cat=103&_nc_oc=AQm2ucsKv0co5y0DxFD6P6uqQnim0meaSGWw8Gmt4pA19zoAlSn3pLpDw-rTyFntYVU&_nc_ht=scontent-lga3-1.xx&oh=6d9a1653b3358f2601f91531fb91c686&oe=5E1C6012","undefined","",""
"https://www.facebook.com/IncredivilleTW/posts/2204874123161525","1554379201","#東加泡蟾 的求偶蛙鳴有點特別
開頭先是一段高亢尖拔的 #主歌
接著點綴幾聲輕快短促的 #副歌
(完整唱起來大概像「呼~~嘎嘎」這樣)

起先科學家注意到
副歌的長短，能決定泡蟾性不性感：
越長的副歌通常越有機會得到母蛙認可
可尷尬的是，蝙蝠或蛇這些青蛙天敵
也很容易被加長版副歌給吸引過來
泡蟾這歌唱太好小命不保的處境
堪稱是色字頭上一把刀阿

緊接著科學家發現，由於在城市裡
蝙蝠會瞎蛇會被抓，小小青蛙不怕不怕*
讓泡蟾唱到副歌時可以放得更開
就算台下有人喊安可也沒問題
與住在鄉下(雨林)的親戚相比
自然能唱得更猖狂更奔放了

其實我覺得，人類社會好像也是這樣：
想讓好的創意甚至偉大的藝術得以萌芽
往往需要一個能確保 #言論自由 的環境

我相信，人類文明要是繼續立足在一個
人們不需要因為說錯話或唱錯歌
而擔心人身安危的自由社會
那麼憑著我們的智慧與人性的光輝
人類終將唱出足以響徹歷史的全新詩篇

#怪奇冷知識346

註：城市光害會害夜行性的蝙蝠不敢出門","1570877089","/IncredivilleTW/photos/a.1780902738892001/2205121009803503/?type=3&eid=ARCy3r5PDIN3O11OZiPgEn0b-n_BsNKp60f3RXXaOGhr4xSkp6yCneS-rLK8VMMyt2jjW743nbOTcqu3&__xts__%5B0%5D=68.ARDht-8fMacJJr1U04LUle8wGV8KDw8b1VPP9CBXJy5G2oVtCciztwIjz_hPK4Oyq-ZB_n6kfyUlMqA9QFBsBtg78GDup16sIeCE1fTx8x93FdxosJBT5ZWLzaZF6nxAmwt2yD1nDcf5Gz5rZlFRbevoTpN691YDvdJZwF4v6smOK9d2ePFkQzUcs6gCk7lR82gG-_lnilO7AB-qm_TBHWiD295SZJxG-qoSs90oZAHjWsdXBoeDwjWO7RjfjSlQ48ugVHfL_fZYF7CtqWSoFNnCw1McB4QkK3i_osk2n55YJBCZ4P6GTGsiAcGbCXhD7VNan1M29p1TgfmkceQGkAmwUgHK&__tn__=EHH-R","https://scontent-lga3-1.xx.fbcdn.net/v/t1.0-0/p526x296/56524199_2205121013136836_1266136778104897536_n.jpg?_nc_cat=101&_nc_oc=AQnnDrA4oHULAFQMKm9NkTrr4jnHfjl6EuiV6DoNdRRxWMEe4wfZTDc3lF2tzxJeDDD9nMxZoj2_SEX5zuE-uP0z&_nc_ht=scontent-lga3-1.xx&oh=66b058bad946cf5b6e44696926e1653b&oe=5E2971D9","undefined","",""
"https://www.facebook.com/IncredivilleTW/posts/2257245754591028","[Error]: TypeError: Cannot read property 'attribs' of undefined","",1579054261,undefined,undefined,undefined,undefined,undefined
"https://www.facebook.com/IncredivilleTW/posts/2291239657858304","1566388802","「到最後，黨可以宣布 #二加二等於五
你就不得不相信它。」

這段出自小說《1984》的句子
是在預言一個邪惡的極權政府：
他們會藉由 #洗腦 徹底控制人民思想
一旦無法自由思考，就不存在懷疑空間
沒有了懷疑與異議，那謊言也能成為真理
到最後你甚至不得不相信二加二真的等於五

--只要政府是這麼告訴你的。

根據北韓教育委員會發布的官方課綱
資深老司機金正恩才五歲就能開戰車
其父金正日更能用意念引爆富士山
這些被我們當作笑話看待的謊言
為何會被北韓人民視為真理呢？

腦神經研究就指出
機械式地重複餵食大腦相同資訊
會使腦中特定神經元活動更加頻繁
神經元中負責連結的 #突觸 也會被強化
未來再接收相同信號，大腦反應就會更快
人卻將更難意識到其中的謬誤或不合理之處

但所謂的 #真理 是什麼？
是受到任何懷疑或挑戰也無法撼動的事實
就像在地球上，太陽總會打東邊出來般
不會因為任何質疑而產生動搖

--所以真理從來就無懼於懷疑。

這也表示，要辨別出謊言與真理
就不能沒有言論自由：因為 #言論自由
正是人民能不帶恐懼地，表達自己的懷疑
或透過書本、電影、乃至音樂等 #創作自由
去質疑各種你不認同的社會現實
甚至去挑戰政府那看似理所當然的權威

也因此我認為，臺灣的言論從來沒有太自由
而是因為世界上還有太多的謊言等待我們辯駁

第十屆 金音創作獎，讓臺灣珍貴的創作自由
帶你穿越音樂中的多元議題，去思考看看
這世界上還有多少包裝成真理的謊言

#怪奇事物所X金音獎 #金音10
#自由就是 #GIMA10
#怪奇冷知識404","1570877089","/IncredivilleTW/photos/a.1780902738892001/2291294241186179/?type=3&eid=ARAkUW7lJzRjhMzzQtJcLEKeLReA3KdezhfRMbfiTjfrXtOeunpJSLKY2nMgRK4ie20gaiz864QyWRjO&__xts__%5B0%5D=68.ARB6LQgwRQNLPcu8elNH3C8KPOXUZz8KvGm0FEqmdRTOYAfCpL9WTJHDdFiagoRPhtHcnn6tZzeOBofqod5uzYp3BLFk2L-usKccb01IuypI2Er0kYmQvaJz1XRKV7_BtM_580M92C9jNOaEjs9bmm3TRqQu_AGKvdLxsOTWrBx9Wlnd8XsL3NgrHJSNWvzChCvIekH10TpDijbb0l1ZfD-RdunNDTuDnNPJaVSaI9KL7_V9ky71rNku0tdDSdO0EZ9DvMWatvDIJc-JHdGYSRC-JopSv82VHjpbSoyUStvFkcLHHITtQgARQ8O_5JwPSW7lYPpPfulOV2swKavd6NAnH2zy&__tn__=EHH-R","https://scontent-lht6-1.xx.fbcdn.net/v/t1.0-0/p526x296/67760050_2291294244519512_5678127068039086080_n.jpg?_nc_cat=101&_nc_oc=AQmOEJQLBxRfnUacPMnPLKXsT93DAd_v236U4Wco-PZEmaN-jkSNYAoC2rFccDSvW2w&_nc_ht=scontent-lht6-1.xx&oh=c67dad14758798f72e6c17445c72c084&oe=5E1F8914","undefined","",""
"https://www.facebook.com/IncredivilleTW/posts/2273626302952973","1562846401","過去有研究發現，在收容所裡的狗狗
如果越常抬起內眉毛、讓外眉毛垂下去
擺出一副´•ᴥ•`的表情，就越容易被人領養

科學家認為，因為這種 #可愛小狗眼
在人類看來，有點像是面露悲傷的神情
一旦確認過眼神，自然能喚起照養本能

但要做出挑眉這樣細微的表情變化
需要動用到眼睛內側的一小塊特殊肌肉
而科學家目前並沒有在狼臉上找到這組肌肉
此外和狼相比，當狗狗在盯著人類看時
眼部肌肉的活動頻率更高、強度更強
彷彿是想用眼睛對人訴說著什麼

這可能是因為人類溝通很仰賴眼神交流
所以想得到主人的芳心，也一定要靠 #眼神
擅長擠眉弄眼的狗狗，就因此有了演化優勢
而這層優勢，又透過代代繁衍持續強化
現在的狗狗才有這麼發達的眼部肌肉

狗狗為了拉近與人類的距離
花了上萬年才學會用眼神和人類溝通
反觀貓咪，幾千年來好像什麼都不用做
就能讓人類整天對著祂們喵喵叫了

...想想這世界真的是挺不公平的。

#怪奇冷知識389","1570877090","/IncredivilleTW/photos/a.1780902738892001/2273617679620502/?type=3&eid=ARC0eX6Udj-E-UjAu4HGSDT7jYmwpExMGhMU4LJ1UnkEp7LW8FB3gKaj24JpC9T4HlpINTuwLJnIWRv7&__xts__%5B0%5D=68.ARCwHM-UXjXsuCp72rGt09hfrSaT3UeWm8H6tP8OLmDjh6ahYu153Gl7RBrfX05cGYtfTD7PHhkVZMTZD0cldNHfMqQ73w6hh6zlQG0uIQqCKCxf8pN2gZloUauNTQNmsBJRMjOQI32CX_kmEic0qIhT687t5NyTPL6hTEyUIwb5RynHAeDeqgCWapEgT5w1f4RU5tZezpvoUY8rVDx6ZGdoXXgUhlq6z7Wst_6fjpnZXQSSclCm28-A7j6vk5gfa_JRqz-nigORFh76LBf0_vkGHxhWxmwBQG4KHz4XZC9nhW9Xc0_C_YWPNNZyFlBoE6ydvxxhTbE_sbQBd-_S7tNdpy4V&__tn__=EHH-R","https://scontent-yyz1-1.xx.fbcdn.net/v/t1.0-0/p526x296/66631663_2273617686287168_2336165276459991040_n.jpg?_nc_cat=103&_nc_oc=AQnbTzt6VlQrvOCWPT1aOpR58B3KPoKNpkX6fT9s4qCuSzkI1hjdswP4UwwwlbuEsng&_nc_ht=scontent-yyz1-1.xx&oh=a1e84c9e3f761c1d08bc8cf82755931c&oe=5E200CF9","undefined","",""
"https://www.facebook.com/IncredivilleTW/posts/2295423547439915","[Error]: TypeError: Cannot read property 'attribs' of undefined","格陵蘭鯊，又叫做 #睡鯊
是地球上現存最長壽的脊椎動物
目前發現的睡鯊中，最老已經活到400多歲了
--在牠小時候臺灣甚至還在喊 #反清復明

睡鯊不只活得老，老化速度之慢
用人類角度來看簡直就像凍齡一般--
牠們大概要長到150歲，才會達到 #性成熟

這意思是，沒活超過一個半世紀的睡鯊
都只能叫做睡鯊小美眉和睡鯊小底迪
反觀人類的性成熟約發生在14歲
而且大概25歲後就會步入老化*

睡鯊的青春保存期限為什麼能這麼長？
牠的秘訣有兩個：一個是慢；非常慢
睡鯊不管做什麼都...真的...有...夠...慢...
身為一條鯊魚，游得竟然比人類還慢
--時速只有2.6公里 (人類約是8公里)
而且長得也慢，每年大概只長1公分
(你的指甲一年都不只長1公分)

睡鯊另一個凍齡秘訣，是接近冰點的低溫
因為睡鯊活在海面下1300公尺處的深海
有科學家認為這有助減緩 #新陳代謝
間接導致牠們可以活得更久

不過身為人類的你，想讓臉部凍齡
真的不用活得那麼慢，住得那麼冷
只要使用我們的 #提提研肌能進化系列面膜
也能像睡鯊一樣，吃到百一還被叫美眉底迪！

提提研肌能進化系列面膜
精華液再升級，傳導效果加倍
是你步入25歲後抗老的最佳入門款面膜！

#怪奇事物所X提提研
#提提研 #肌能進化 #你的第一片高機能面膜
#怪奇冷知識401

註：人的肌膚約在25歲前後開始老化","1570877090","/IncredivilleTW/photos/a.1780902738892001/2295950717387198/?type=3&eid=ARBP7QMdEAY08WL8_f9p7rTLz3ZbQdbVaC2_MGkHHlSQB5wKal5OM0PjsQsCxyxq5p5oqwCmmlgn6CEq&__xts__%5B0%5D=68.ARDQO1Ui46i_T-N1jJxLr71TEP2UqQXOj_tpweUKTZFIPr23F2FbpGPkV51JNid783CFxyaVxGcdNFRIsOkfVPYfZ7idJBdNpVzY8IXCdN7zDZFnbfFHBaBgJHchZiBkNZHMza2A_L4_5uK0z7fWyDhqRG613sNcvzxwgtCTISnt5f6SW0ON7Wrpm9CrZ4QxqEY0HPxhCTZJj5pY_qlN55ejUT-BqUVYgrfbozrdpc-7SkXX26WqPQTYOiALpFZbnaF72q_zLCbbZKP87tuY3hlmverBJlPwehi9kZFSTMix1poqBISNs12O99-HYDhWQSSNvA9-uoMHcS7PkK2pQ0vkgfj2Oh3rB2riGtVYTJEmykZzS6eSXQcI4IPAVbnca3UvFHnPs1tNnGhXi8LJQEv1tRX2t-qHre7KlRrIR5sGi2xBXHA&__tn__=EHH-R","https://scontent.fsti4-1.fna.fbcdn.net/v/t1.0-0/p526x296/68687329_2295950720720531_8133227402038870016_n.jpg?_nc_cat=108&_nc_oc=AQlCqwlSbWG9iJFYyl-5wLGMUP_eFtnLRXKlCf7zo7Q2OK_dhZxUvW7IDeynvp2hZhY&_nc_ht=scontent.fsti4-1.fna&oh=24116e93a167d5567b7f60db6982d75b&oe=5E3525A5","undefined","",""
"https://www.facebook.com/IncredivilleTW/posts/2236098100039127","1558440001","狗狗的肢體語言其實非常花俏
他們會運用多個身體部位傳遞訊息
包括眼睛、耳朵、嘴巴，以及 #尾巴

而因為狗的眼睛對 #動作 的敏銳度很高
#搖尾巴 就很自然地成了重要的溝通方式
甚至出現了讓尾巴更毛、更明顯的演化趨勢

這也表示狗狗會甩尾，原因並不單純
像有實驗讓狗狗穿上能檢測心跳的背心後
就發現尾巴往右甩的狗狗，心情的確是很好
可往左甩的狗狗，卻往往處於焦慮或情緒低落
(這可能和左右腦職司不同有關)

除了尾巴的方向會反映出不同情緒
甩動的範圍、角度、速度甚至 #尾巴硬度
其實都是解讀狗狗意思時，需要考量的因素--
不同的排列組合可能會有全然不同的意義

還有科學家指出，狗狗搖尾巴
並不單純只是因情緒引起的神經反應
它其實就和人類微笑一樣，具有多重意涵
有時候是刻意想示好擺出的禮貌微笑
有時候可能是不經意地會心一笑
又或許只是想 #笑你是個白癡

所以說，狗尾巴語遠比我們想像的要複雜
專家甚至認為，＃柯基 老愛和同伴起衝突
就是因為沒有尾巴，容易產生溝通障礙

寫到這我也忍不住想，養貓果然輕鬆多了
反正不管你家貓表現得怎麼樣

你都當他在不爽就對了

#怪奇冷知識370","1570877090","/IncredivilleTW/photos/a.1780902738892001/2236096910039246/?type=3&eid=ARAf-OFcWa1FQWqUw5IrfaQEfRN8_2LS5Bwc4tkiX9OODmBych3xGEKUCgTyu4KZwDjRd9KEZfFiGXkb&__xts__%5B0%5D=68.ARCMRmnvytV7Mn6ri8uKhLYEFA1Dymo5RB7Xh4yd_pBf3C1vXjflPY-Rf84HkCwFnkqCWqcLuRJXQ279i5-wykCyqFJYFxVTk-4ou14fcJIZmxS2cOs_0viDVrir1eC3gtTcxJqOTn1M8-309WWsa_kltzxZ2oW5RgfZ5tIRQmKFf3h6ubFqoxfxNzGZWxwT9YbIcCaXmoDtBc8hfCPvWBexShqu-XSNTr-465w_1re0dWZRzARQG2jrIwa8wuLkkIrxBAzYiiO4yIz942Sz4GjDs0VwHyTHKSEwksA7H7wG_ro2h6Az3W6ljENS-REtRMppDPlPa8D6ZHqpoJOvxKM89zMp&__tn__=EHH-R","https://scontent.fjed4-2.fna.fbcdn.net/v/t1.0-0/p526x296/60987451_2236096916705912_5418956500741652480_n.jpg?_nc_cat=111&_nc_oc=AQkrVJTEHyyGYo7btOjFVp2E7fm0Ka0MH3d9SVnOXeuF8brSZZJ9ZeWBnsOFDll0p74&_nc_ht=scontent.fjed4-2.fna&oh=a4de3dd37261a05856e46098f55b397e&oe=5E224DC7","undefined","",""
"https://www.facebook.com/IncredivilleTW/posts/2205116466470624","1554382324","所長
我發現有個粉專抄你的文章耶
有好多篇很明顯抄來修改的
但是風格還是跟你很像
https://www.facebook.com/frogmurmur/?__tn__=%2CdK*F-R&eid=ARDdH8LEBLNuATtoQDxWhDzsS7N44PS3M2dA-U-lEs0xP9wKg2K41DHWSyobIToTbv1KXz_N2DQi67H_","1570877090","https://www.facebook.com/photo.php?fbid=2303702449690823&set=p.2303702449690823&type=3&eid=ARA8PwQAucbdefIz96gJUQaFPEb0zZxKr-BNFkdLSW5O8KN15kA3qanOXbBrvK-3h54DgO7hYoVCy6CS","https://scontent.ffjr1-4.fna.fbcdn.net/v/t1.0-9/56622523_2303702453024156_9213513265844322304_n.jpg?_nc_cat=106&_nc_oc=AQksNx-OX0uiJXOTXlLpIMiYDkDPEAPWyE556_T-yPJaJ3I-XTcucBq3s-vbsWoR-cA&_nc_ht=scontent.ffjr1-4.fna&oh=655b5447493b2fa7d514e76b2c99d46a&oe=5E2965D5","undefined","",""
"https://www.facebook.com/IncredivilleTW/posts/2199347720380832","1553688001","掠奪他人生命，叫殺人 (被關十年)
掠奪他人金錢，叫強盜 (被關五年)
掠奪他人時間，叫遲到 (不用被關)

為什麼有人總是 #慣性遲到
心理學其實一直想幫他們找藉口：
或許是自我中心、想裝大牌引人注意
又或許是比別人早到容易浪費時間
因此遲到才是講求效率的表現
(我沒騙你真的有這種說法)

美國心理學家設計過一項實驗
要受測者在規定時間內完成一組拼圖
時間一到，就必須馬上按下身旁的按鈕
同時現場會留一個時鐘讓他確認有沒有超時

結果實驗發現，沒辦法準時按下按鈕的人
注意力總放在拼圖上，很少會抬頭注意時鐘
相反地，目光會不時飄向時鐘的那些人
也是最後能一分不差按下按鈕的人

這種時間管理能力
又叫 #時間性前瞻記憶 (#TBPM)：
意思是未來某個時間點要去做某件事的記憶
需要依靠周遭環境的 #時間線索 來喚起
而因為有些人在過分專注眼前工作時
會依賴大腦那極度不可靠的時間感*
不去尋求專業時鐘的協助
也就容易遲到成性了

所以想用科學方式解決朋友的遲到問題
在他視野可及之處填滿時鐘，應該最有用
因此我誠摯建議，以後只要他每遲到一次
你就送他一次鐘，謝謝

#怪奇冷知識342

註：人類的時間知覺非常不精準
會因為無數的外部刺激而產生錯覺","1570877090","/IncredivilleTW/photos/a.1780902738892001/2200025850313019/?type=3&eid=ARByxZ5kLd8nd0ypmkLxHRR4XGzhanSFW-kKm8eeAg8vHox5jHOadI6VXVzSid6QB4tLSAQie01xQHFR&__xts__%5B0%5D=68.ARA8H09OyX1I91CmGddn3MNiDYAQaLoNRdiIEB2IG3sPcf41bIR1R3IYVbFXUhud0CrqM3mLkgDS71dVMCeqLS3WofdxrpGYMcO60f6sXWGStKprfEeE5FkotsbfSne7_hwCJFWUpepqcDGUAGXdag2DVEni8zEugAg9UkbqxDMB-M98oBIDPbMBQbiSpy2D--EsUWpsdCj-hDLvEzvt4nnRwC46mPKVcz-le44y-5PJEwX7xTeJSPklWYUZP7uj-qiYknNPHVeWR1cmgc96locGBa4jgDis7P-ztXHcByf4vFIRZ3gzaX4xkmaC2aePQLKfz7Uqm_NdzFWqyVbYEMIJq1fz&__tn__=EHH-R","https://scontent-lga3-1.xx.fbcdn.net/v/t1.0-0/p526x296/55467876_2200025853646352_5914300387568910336_n.jpg?_nc_cat=107&_nc_oc=AQlIRff7ev2VB_uH2AjjFDStqjdXF2ptHRSdIY4xcZpzCQek8c_PyDTpa14GiGydVEI&_nc_ht=scontent-lga3-1.xx&oh=efb231bb642925c57ec416e7b0b2d45d&oe=5E2C1046","undefined","",""
"https://www.facebook.com/IncredivilleTW/posts/2216579935324277","1555934401","「我一個人也能過得很好」
這話由母火雞來說，非常有說服力
因為她們光靠自己就能獨立繁衍後代

要知道，雖然一般母雞也能獨自下蛋
但只要沒受精，你孵一輩子也孵不出小雞
然而研究發現，有種野生火雞的火雞蛋
就算沒受精也能生出小火雞

野生火雞生存的環境通常很惡劣
或許是為了解決找不到伴導致的少子化問題
母火雞於是演化出能獨自繁衍後代的能力
這種單性繁殖現象，又被稱作 #孤雌生殖
高等動物中，就只有在母火雞身上發現*

更奇妙的是，和單純的無性生殖不同
這些小火雞百分之一百會是 #公火雞
所以你也不用擔心，會不會有一天
全世界的母火雞都受夠了公火雞
那地球最後就只剩下母火雞了

阿不過呢，要是哪天母火雞對你說
#全天下男人都死光了我也不會嫁給你

嗯，你要相信她說的是真的。

#她其實沒那麼需要你
#怪奇冷知識353
#怪奇事物所全新週邊即將上市
#詳情請見留言

附註：有些鳥類理論上也具有孤雌生殖基礎
但最多只能長到胚胎階段，以孵出幼體而言
目前只有在野生火雞身上能找到確認案例
除此之外，錘頭鯊和科摩多巨蜥也會喔","1570877090","/IncredivilleTW/photos/a.1780902738892001/2216576665324604/?type=3&eid=ARB3RCa-wFd5GEQfa65UiopZUfXMyXr4qpZpc-VHgxCWGuLq7ULc6NGjEPkdqAYL4sldqIypeZCSyw_f&__xts__%5B0%5D=68.ARCeWFsBA5pf3gdjcfPl48fvOqj45bBrHVHctGR0IIBu7yvCQyucg14FvWJc8VwG5Myh-cafU60_MEipauYAfCtc1QUZ1_M-14LBTVeQDswqD78stpkBogJPXpeClzZbOKqxZsB5CjSzvJW6c7lb4yHAKI4JxWtcW8F-wD-B1Ywovt89xXUbaQuwflBreo7MVZnLBrBP2PkVFqhZOYkOBxXkHXeEQwPyb0nUmKFA4qvT3uZI_yTyV1v52RydebJmVmac20wriJbQqvK-dt66htBFRuX3VPIRGMVORIzhgoU2f7b7l2T53o6IwSqQvYyY64IdtyfQDq5TMVeXAX55HDmGZxXn&__tn__=EHH-R","https://scontent-sin2-1.xx.fbcdn.net/v/t1.0-0/p526x296/57447292_2216576668657937_1169024505230655488_n.jpg?_nc_cat=104&_nc_oc=AQk3BVmg8-8HdskaEPSFKrfxiWmtikFn2mxCBzSjBqsxRaBXn_VUDE0l4pTIdzCQMtA&_nc_ht=scontent-sin2-1.xx&oh=d20df4bf58535d576546b174eda2c8c0&oe=5E23D34B","undefined","",""
"https://www.facebook.com/IncredivilleTW/posts/2118560118459593","1542801601","就像用敲西瓜的聲音來判斷西瓜肥不肥
不少車主也認為，從關車門的聲音
便可以聽出這台車究竟硬不硬

透過大數據分析後，車商也發現
只要車門聲聽起來稍微輕薄一點
(一般人甚至分不出差別的程度)
就可能形成 #薄皮嫩車 的不良印象
進一步影響車主的購買意願

然而會改變關車門聲的因素並不少
像是鎖扣、阻尼器、密封條或隔音層等等
這些車門部件的材質或狀態不同
都會使車門聲出現各種細微變化

也因此，有些車廠會聘請專業的 #聲學專家
將關車門的聲音調整至最飽滿扎實的感覺
甚至調出專屬於該車款的獨門關車門聲
讓你每次關車門都有如耳朵懷孕般欲罷不能

設計一部車竟然要動用到聲學專家來調音
想打造夢想好車，還有很多意想不到的講究
需要愛車懂車的你，一起來大開腦洞--

#2018台灣車客松 報名即將在明天截止啦
想要親身參與汽車開發過程的老司機們
還不趕快來報名 https://pse.is/CELMK 👈👈

#台灣車客松
#怪奇事物所X車客松
#怪奇冷知識229","1570877090","/watch/?ref=external&v=489436538230558&__xts__%5B0%5D=68.ARDwL0fXFMEMPqBGWr4yogW3UKzYZ5lpeaFn4Qbe5QXbpwywGDe5iCivYgaowaPxbphoqE_7j1BFG50Z7dfrB3p2-G9YhWuoJSwwOcriEIlGmCHoU2uNMOecJSiobCZHeDU8qzwbXzewVD_lxV2nGV3iq4VuP_TL6jGSqbGtpJK_yZLAhUF2knnm5JGx9xmju4AKaIyw-L-3MysAu2oHf7JmKd630xECTVmqj5LGw-hviQd5o6-MwnvZaRwIHb_AU30hmZsI77qI2zSZaXlGHwf7O98ak_FzJ8iYkxZcatfTbxh9yRldOaUnpzzyKA4jeGp4eKhzkECPYdROxud8Woy0sYedc6Ffnj0HZDhl&__tn__=kFFHHH-R","https://scontent-cdt1-1.xx.fbcdn.net/v/t15.5256-10/45607645_489439641563581_1348206138478297088_n.jpg?_nc_cat=110&_nc_oc=AQknhSMXWMaTyEOtKkoIksp8ow41tnRHEuSKwOc8M5XPt5EcndBWbrP0xaTjqwHr3mU&_nc_ht=scontent-cdt1-1.xx&oh=2ed5eed798f41ea07dcc23837f9c6018&oe=5E29AB54","undefined","你知道嗎？有些車廠會找調音師調出最棒的關車門聲喔","Posted by 怪奇事物所 Incrediville"
"https://www.facebook.com/IncredivilleTW/posts/2126410357674569","1543838401","「好人一定會有好報」
「撐下去這位子早晚會輪到你」
「好好唸書以後就會交到女朋友」
人生，總是充滿各種喪心病狂的謊言
但你知道，就連 #早睡早起精神才會好
其實也是場騙局嗎？

有實驗請來兩種不同睡眠習慣的人
一種是22:30~07:00的早睡早起型
一種是02:45~11:00的晚睡晚起型
接著比較他們在充分睡眠後的注意力表現

結果發現，這兩種類型的人在剛睡醒時
大腦反應速度不分軒輊
但等到清醒時間達到10小時後
早睡型的反應速度及持續性注意力
普遍會比晚睡型的人還要差

也可以說，夜貓們其實有更強的 #續航力

在這之後也有更多相關研究
證實每個人的理想睡眠時段並不一樣
只要能找到適合你的時段並且睡飽睡滿
早睡還是晚睡，其實沒有太大差別

所以說你以後真的不用再欺騙自己
「#我今天一定會早點睡」了唷

#這也是人生十大謊言之一
#怪奇事物所X妞新聞
#怪奇冷知識294","1570877090","/IncredivilleTW/photos/a.1780902738892001/2126409964341275/?type=3&eid=ARBVNQk0N6dZUK99JieOdkbO2lmteNAuWJs6Xb4v6rKklfeJM4_-Ia1nS23p0xa6XMGehFnwFtfJukLg&__xts__%5B0%5D=68.ARBONKC8p-zrHm6MZThPkPALHUroZsSwd5NWCMNzi6mKHYHlL07oI2w28E6N0kcg3d-t4wy8b-ASg_RTjWSDXr0VZwMtTKJPQpTuIMfYTkib3wAF-CuO6S_70pnHVNzfaIOK4V78xYKYKmOhlfUVINh0lRORRQIgSv6ygcVmBPzwjlynBK3jRzW5X126WZHlDUGFnx6P-VyP5qsu-rcZXkUospNMUV2Ian-9i3UNZKM_BBAX8Fd1azPxxlnKgModL9ydcElsxVujuihjtkbrYFRjm13kViSt-iJHF_zCm_8ERA3rO6mlV6ybrW5huBsfuvF6M3KxfKgenBUdKNnsBQ5AMLUf&__tn__=EHH-R","https://scontent-ams4-1.xx.fbcdn.net/v/t1.0-0/p526x296/47469040_2126409967674608_4309233927521828864_n.jpg?_nc_cat=111&_nc_oc=AQmkdx-CywKQaH00-_vESdhCa8fGPHESes1NRY1Gir5qPZbGBLzBbrDfyRdOo0TGL2I&_nc_ht=scontent-ams4-1.xx&oh=5aafc3f4103cd650dda77efa0d452c3c&oe=5E640F87","undefined","",""
