url,posttime,text,crawled_time,attachment_link,attachment_img,attachment_img_alt,attachment_title,attachment_brief
"https://www.facebook.com/kaidongwithkat/posts/1972620459497329","1544642563","這次貓兒跟貓小妹到德國南部貝希特斯加登Berchtesgaden的Ramsau藍紹小鎮散心，依山傍湖的風景實在清幽！離國王湖不遠(開車20分鐘左右，相距12公里)。本來我們計畫去滑雪＆玩雪橇，由於天氣太好所以之前下的雪融化了
🌲臨時改成去魔法森林散步The magic forest，一路走到辛特湖Hintersee，藍紹的教堂Parish Church of St.
Sebastian來了就不可錯過。

 
在網路找到一間質感很優價格合理的民宿，它座落於青山下。是樸實乾淨的農家路線，加上老闆＆老闆娘都好親切！網路訂房完畢，貓貓打電話再次確認房型，老闆娘知道我想開火煮食，還貼心地問我需不需要烤箱，可以幫我格外安排。親切純樸的農村性格讓貓貓感覺好溫暖啊。來去鄉下住一晚真開心
❤️！PS:🏠民宿詳細地址在照片裡說。

 In the beginning of December, my younger sister and I went to Ramsau,
Berchtesgaden for a short trip. We were living in a nice hotel which had a rural
village style, with a small petting zoo in the backyard. We did enjoy the time
staying here, and also visited the parish church of St. Sebastian, the Hintersee
lake, and the magic forest. #德國 #生活日記 #開動with貓 #巴伐利亞 #藍紹 #辛特湖 #Germany #Ramsau 
#KaidongWithKat #Bavaria #Hintersee","1571048601","/kaidongwithkat/photos/pcb.1972620459497329/1972618302830878/?type=3&__tn__=HH-R&eid=ARBNDho1rRyn68mh09ezac_Oc6v3ouQH1gM-CGOHFj3R-boEku4xNrSGF_0cZHwByzQRK5Pf6220Y0DH&__xts__%5B0%5D=68.ARBZ5YfXKQGcyi82mpsWWIsyfbBUgQ4t1nDb_tpta1nK9R7B1VQ5ygMSKNcKnaXCGP1MlMTAeyg7AeOHIfXyO3ZVD3vcF4hah_hP7EB9-OQvYYnE7OujNVm1f06GkphOywGHT-4it3uD1NbdbaDUJ899oM2Tar9nXdbdjcTQJKLATLWtMFG7inyXsfEqap7yEVQB5m7YVNHAqofaDqeM18pUwEAkniccqWHyfOJzKiJzgJ8mLEjoNcsxHr_95GtTlZ_AW8zh9cVsuCo-DcFq2TqFVP0K8ajgqu2daxzgFlHfSUIHJBEEB5kpyefgBzA_sLUoefwDTo-7H_n9Qp3xtsxU2w6UvCXQHuL_vDI1CNlzYaDE9K8eRNuGbvFSWOwCq3cleZX2l8_IfIAh7Y2j2mvGt9ACCGa4P7eNYpTcuRo","https://scontent.fgbb2-1.fna.fbcdn.net/v/t1.0-0/p403x403/48404716_1972618309497544_1593699451141095424_n.jpg?_nc_cat=105&_nc_oc=AQlUjR61I_FqBt_g8EBtEEtYTox-9pat6smc-gvN19MS_pPQgZoUBcCwh3cJBmcJsGU&_nc_ht=scontent.fgbb2-1.fna&oh=1ef4791b9f40dbfcae208bd7513e8c2b&oe=5E65097D","undefined","11",""
"https://www.facebook.com/kaidongwithkat/posts/1923067327785976","1541366270","奧地利的天氣越來越冷了，樹上的葉子陸陸續續飄落。這個時節最適合喝湯＆吃麵。Mr.櫻指定要吃“狐狸麵”(きつね
麺、油炸豆皮麵)這時剛好順便把冷凍庫清一清，小竹輪也一起上桌吧！簡直是做關東煮的概念：油豆腐皮、竹輪、杏鲍菇＆紅、白蘿蔔通通燉煮成鍋。開動囉～冷天裡熱熱的狐狸麵
🦊🐱

 It's getting colder. This weekend I made some hot soup with noodles and fried
tofu. It's called kitsune noodle (🦊fox noodle) in Japan, because Japanese
mythology documented that the fox god loves fried tofu. Therefore this kind of
dish gets such a cute name! #奧地利 #生活日記 #開動with貓 #餐桌日記 #薩爾斯堡 #Austria #Salzburg 
#KaidongWithKat #cooking","1571048602","/kaidongwithkat/photos/pcb.1923067327785976/1923064374452938/?type=3&__tn__=HH-R&eid=ARA-eeP3QH07RAOzkXRmom--w3cWYj6_szGtkpOmyxrUimiiDuBmFBzmzxbvB8MkYDuojxw0ElyhamAW&__xts__%5B0%5D=68.ARCNemL5qkbdem-1WMGfIxy6-Zyesc1eQahIrLrK85OH7BR_bmSjHGtZ6bQi2XRavJKiuJH00Ueswo5y5ltgOaqoDkHA4IJwIt2LtVLIab32cxcg5bQaU6X6V-D1pxfIOWEfKLenCPPWMHGiAom6VXLhrYG2EKgeE5Klb7ey-a82TnHB8od6x4AbxrXpmrJgNcoXiHyI1azQPEcSqvbd76LkjO6DHHXoAM7BREFwWcSg1V5qcuXgTFTovu_mVwKZQQsZ3jpeptMd26kGqJP0OVtpq08Vo1zb7LbrrWFYCntc8s-8psjND77_tFKvfSvkdUJrhkKI2cJ80cdCmF9pAcXxMg","https://scontent.fkhi11-1.fna.fbcdn.net/v/t1.0-0/p417x417/45351161_1923064377786271_1267197265659822080_n.jpg?_nc_cat=105&_nc_oc=AQmQo2bPdTCJcOjuPc50UscAE-RdrMmWQjXf3PFy6R9N79TM89g2hvLa5NcgwqOwbzo&_nc_ht=scontent.fkhi11-1.fna&oh=9dc8f47f7198c2883943ff55cfc0824e&oe=5E188C43","undefined","4",""
"https://www.facebook.com/kaidongwithkat/posts/2322196561206382","1564094899","這幾日又是熱浪來襲！每日上下班都汗流浹背，回家第一件事情就是想吃涼涼的食物。貓兒的抹茶魂在這時大爆發🍵❤️
連續幾日都要『宇治金時・うじきんとき』抹茶紅豆刨冰！外面買不到，只好動手自己來！開動囉いただきます😋

 The heatwave came back, already staying for more than one week. In the last few
days I felt tired from the heat. However, I also ate ice cream frequently! Uji
Kimim is one of my favorite styles! It's made by shaved ice with green tea and
sweet red beans. It's not only tasty but also very refreshing. Therefore, on a
hot summer day I like to have Uji Kimim very much! #奧地利 #薩爾斯堡 #餐桌日記 #生活日記 
#開動with貓 #Austria #Salzburg #KaidongWithKat #cooking","1571048602","/kaidongwithkat/photos/pcb.2322196561206382/2322194897873215/?type=3&__tn__=HH-R&eid=ARCTf3MUDQBOywSDkz90hmbz6E1rjiBCszq1wc4xGPrJkBAnEhbyve3d-v9yYtxNJroBNMeVZ4TfAp0x&__xts__%5B0%5D=68.ARAuGDeSZi__qN4HY60vV63WSKiDyMBeTovIX1DFmWR-3vSg1KiGJjfqiqJXxG0V6LvEQKd_j7SW0WvZ9my8gP66e4eo9JtTNssLKV7jVBmrUMjHEDVVkeM6dm0M0Ms-nI3kMl4myLew-BVNvS_YpAAqHeA-YygyKmAmJ0jyFqiz1vJ63bXHonoyFYGDrY5jXu-6Lmx47riU6Z9chWSRrUDhpgfbpNRDfNwKIVKsEuChPRoPTtref0O-yI7MRYF2an_I7IthPwC9vLjlueB5itrz4dE_gyEgNjcGbumTqrOILzu1Vzg-xMUYpAcnaQmOCsF6m3s4UCzE2v8Fy8PCUlbwdw","https://scontent.fymy1-2.fna.fbcdn.net/v/t1.0-0/p417x417/67097036_2322194904539881_5674483131885813760_n.jpg?_nc_cat=106&_nc_oc=AQlx-1c__vwGjD9ptgVnZk1hY_9aaGE8r5qo61XH7OJNT4V8coSZ8PhzaqPp-hQc9eOAs41nsLZJ9y1qWZgEkl7z&_nc_ht=scontent.fymy1-2.fna&oh=ca51242fb75f09c38a89eca0d2d95d20&oe=5E3842A5","undefined","",""
"https://www.facebook.com/kaidongwithkat/posts/2391488267610544","1567460096","一轉眼又到ドラえもん(哆啦A夢)&貓兒的生日了🍾🥂🎂故事裡，哆啦A夢自造於2112年的9月3號，貓兒恰巧也是9月3日出生的寶寶。
.
雖然他來自未來，卻帶給我在同年好多很棒的回憶！任意門(不用買機票)，竹蜻蜓(短程方便的交通工具)，記憶吐司(書背不起來的好幫手)、時光機(穿越想去的時空)、四度空間口袋(什麼都可以放得下)...這些故事中的發明物通通都是我從小嚮往的啊。
.
感謝小叮噹(哆啦A夢)多年的精神陪伴！在我們生日這天～貓兒用自己做的銅鑼燒來跟出生在未來的你，陪伴我這麼多年的你，一起慶祝❤️。銅鑼燒作法➡️
好久以前寫的銅鑼燒食譜，這幾年懶惰...下廚完沒有特別紀錄了😂 
https://kaidongwkat.pixnet.net/blog/post/436719838

 It's the third of September again! This day is the birthday of Doraemon (ドラえもん)
as well as myself. Doraemon is my favorite robot cat, its stories and cartoons
accompanied me through my whole childhood. 

 This cat comes from future and has lots of powerful equipment. Such as
arbitrary door, which can take you everywhere you want. He also has time
machine, that can lead you back to the past or go to the future.

 I like his adventure stories so much, and luckily we have the same birthday.
This time I made some dorayaki, it's Doraemon's favorite dessert! Wishing us a
happy birthday! #奧地利 #薩爾斯堡 #餐桌日記 #生活日記 #開動with貓 #Austria #Salzburg 
#KaidongWithKat #cooking","1571048602","/kaidongwithkat/photos/pcb.2391488267610544/2391481330944571/?type=3&__tn__=HH-R&eid=ARCqVOp1Mw6u1zDvJiS6sjScv-RHFNpYKBjyR0IasnpO6RyEIEfqYhEogr4sr2IdQGT4s5LL5bCGSr2W&__xts__%5B0%5D=68.ARDsE98ulBzk5UlqLn6CFgYFj0-b6GzdiF_DEQ-RjY02u4-N1-xW2cx54B4ZEKF5Ii00tDrQoGjVEpXLOzb2ewe6WhMnNi6OwodhSd9ivn9ZSkUKZ-Y4C9Yrfbfr95wkpMbZqnAKUYw_WdLr7-be0AP1MeAwEiC2PP0QdPwXNBwBW55VtxWypsnivqb6BreTX4Fvq_1YyBFbskd5w9pf2zxaZ-RuUuzTpdgP6Elody24LGKqUE_3Yv1xRficXWvAt8wWaW6O5JqYdD2djSvxtDNC4TQcQqLwTLxPuALSR_byxfbrrK5cOk5wOo1gR0PwJOENRzb5vyBuYHf33A6jaFbVyg","https://scontent-lga3-1.xx.fbcdn.net/v/t1.0-0/p417x417/69370819_2391481340944570_3843831752363606016_n.jpg?_nc_cat=107&_nc_oc=AQktc83U-IfBH2a7I2GqHP6HcPCqFANlju74i8hiBqGxVa64ditD9V-vTfzBREeyXO4&_nc_ht=scontent-lga3-1.xx&oh=8773890a171f376065ee48ee05969046&oe=5E36163C","undefined","",""
"https://www.facebook.com/kaidongwithkat/posts/1767971069962270","1531690616","[16. Jul. 2018 貓貓的微日記 Kat's mini diary]

 湛藍的湖水＆綠油油的森林，完全是夏天的氣息！這幾天薩爾斯堡的天氣很棒，趁著大晴天四處走走。氣象預報說接下來又有幾日要下雨了....

 The azure blue lake and the emerald green forest are full of summer atmosphere!
It's nice to have a walk in such a nice weather, because in a few days the rainy
weather will be back. #奧地利 #生活日記 #開動with貓 #餐桌日記 #薩爾斯堡 #Austria #Salzburg 
#KaidongWithKat #SchlossLeopoldskron","1571048602","/kaidongwithkat/photos/pcb.1767971069962270/1767970209962356/?type=3&__tn__=HH-R&eid=ARBloN3DIEJn6IlFfMsRm9Q50OPezDwoYEEt2vTDwsS52u3vg_b01QRdlz7b0fgx7NaqCtSADhjIRqGS&__xts__%5B0%5D=68.ARCr-smXRL-VmpmrI5RiL5y8uAML3SXmGpUTxTKzAzq_JyVNdDpt7cCgs5c1l6UC1J4Hfts43uxxMnUY5ZkiG_urFHcyHR1BWBUi5t4gL85ZRvt5snOnVvep_lV5J3K3nWBcPmtjzcMiZYerYSiZ3iPWZkjBDYYWfk2myha5Vw59gl8uUe-H4dMQfXdMDyGdLWGbkJdkd1DkAmuY4zcMpyax2SJMyX35IuRu-7X6w0w8f95dlG-OkoGE0TXUXRTOIwBVtRqEnvk95zLJc8o0iI4uclS7AGkN_TT-JjL5mFV_qjok_nX1LL9Ox5ErfE8vX-59OIagkbUhubi-JIztHSqWWg","https://scontent.fuln2-1.fna.fbcdn.net/v/t1.0-0/p526x296/37135324_1767970216629022_2186756382278025216_n.jpg?_nc_cat=107&_nc_oc=AQnOr9POSTXya_Bj14zKpIDGM-8u4dkFPoZsjoAFhHr3yzOPyYfkIGHjdaNrqG9V1K8&_nc_ht=scontent.fuln2-1.fna&oh=4998f10852e16fdb53be9f80066725c8&oe=5E288EFE","undefined","",""
"https://www.facebook.com/kaidongwithkat/posts/2470236193069084","1571004321","又是星期一了😂
馬上得轉換成上班心情！週末才東玩西玩，星期六跟Mr.櫻慶祝結婚紀念日，星期日與四位貓友們同遊翠綠色的伯倫陶湖Bluntauseen！現在得迅速轉換成研究模式乖乖待在實驗室上班(趕快把大腦調回來)。
.
藏在Golling小鎮的伯倫陶湖Bluntauseen好美好翠綠！這次從早晨太陽藏在山後等到太陽出來，湖面結了一層薄薄白色的水霧～好美好夢幻，每次去都有不同的驚喜
❤️樹葉也漸漸在轉色！
.
網路無國界，在世界各地處處都有行動力超強的貓友們，不遠千里來相見！貓兒窩在家裡用鍵盤與照片紀錄著吃喝玩樂日記而認識這麼多親切的朋友～好高興有這樣的緣分，感恩🙏
謝謝！
.
Oh... Monday is back! So we have to get ready for work again, which is
especially hard after a nice weekend. On Saturday Mr. Sakura and I visited
Mattsee, and on Sunday four friends and I went to beautiful Bluntausee, which is
famous for its emerald green coloured lake. 
.
This time we arrived early and there was a thin white fog over the lake surface.
Later, when the sun came out, the fog was gone and the water colour became even
shinier. I'm very happy to have such nice chance to meet this four friends! So
nice to see you in Salzburg! #奧地利 #薩爾斯堡 #伯倫陶湖 #生活日記 #開動with貓 #Austria #Salzburg 
#KaidongWithKat #Bluntauseen",1579153571,"/kaidongwithkat/photos/pcb.2470236193069084/2470234153069288/?type=3&__tn__=HH-R&eid=ARCT7ukByx-fIWMkEG0_wHVQqI8x5Jokq_EnLEWRdxtpUXy71O7EW_cSlhuYza0O9KLwyjjEnhx1jmf2&__xts__%5B0%5D=68.ARBiKUrqFIoB513a2KHc3Sdtk-i1KVgdOVIA4tpQMMNGBvYYcFWzlZ2CoHNZkG45chqeCn0u-9JTwRBDHZKSm9FFVSRcu-zHxsZGIbELy-3nXoC137Jeu7JbriWf97qv_cBo4BJy0IUQxbG3TTuhYlvCYHA8DlCYy6CeHefkDRO4WdPUX6crzxVLGcA5rYSgF6cNAL48S1QhrB54LytDm8rM9FRmFdWg1FXbrwY2rEWp6B0lHT9uxiPQabT5TU-9eoSRqZ3A6vzs0CT8YDJQxCtwOHPmC6bncxQLDae3JyLh_DPJpk_y3YCUzvtLP1j-RHHpxlW4Qp8z-_spQ53pIaCnGA","https://scontent-cdt1-1.xx.fbcdn.net/v/t1.0-0/p526x296/72729973_2470234163069287_770063592945876992_o.jpg?_nc_cat=109&_nc_oc=AQm2IbsAcTPg0p23U8zBNfpze2XELvPpqEXnOAQ033YuRKNWX6N57hKbzfE_dKRxczrpKLNVPwPkFURYfRudDKfc&_nc_ht=scontent-cdt1-1.xx&_nc_tp=1002&oh=424a2f70d49bcd3708b7622b475ea0c8&oe=5ED5B856",undefined,"+2",""
"https://www.facebook.com/kaidongwithkat/posts/1938176862941689","1542400319","氣溫越來越低，瓦勒湖Wallersee深秋的景色被遍地的落葉填滿！湖水冰冷，與夏季的熱鬧反差很大。夏天游泳釣魚的人到處都是，準備入冬了整個湖畔只有Mr.櫻跟貓貓在散步，偶爾才遇到迎面而來的行人。安安靜靜的享受這片淨土更是令一番意境！感謝薩爾斯堡附近許多美麗的湖
🙏只要天氣好抓著空閒就散步去，秋季之美總是稍縱即逝。

 It's getting colder, therefore less people are visiting the Wallersee lake. We
are very glad about this situation, because it is more quiet than in summer.
This time Mr. Sakura and I had a long walk around the lake. I'm very happy that
there are many beautiful lakes in Salzburg countryside, we are going to visit
them one after another when we have the time! #奧地利 #薩爾斯堡 #瓦勒湖 #生活日記 #開動with貓 
#Austria #Salzburg #Wallersee #KaidongWithKat","1571048602","/kaidongwithkat/photos/pcb.1938176862941689/1938184756274233/?type=3&__tn__=HH-R&eid=ARB5BvRbek2O_ppEdUFxbBD4ocWIDw214r1kB9YBghyKsR3pTP032LjCI93JFI-GJ5htB5kxQPsFOANV&__xts__%5B0%5D=68.ARALdCAuErAJ50I-lqM_zTvkT8TXGT51KzByf9a2GxMjNaDKZj_JYCRbjsuJ9BRubGKIkCXunD2RHJs0CJy3UyfFfL1WS8FlYz8yS_i2kipgt2Ymm7JGqCoTpIScDDQj0Cm66WwNi5qQ5geJGrgM10BrrkkRuELpAVdZKEWlEIQPm8UCvVb5EbG1XlRmesDkJJqNnedWWia7T-9iPTEC8lbLU0hVTyu0EYQt9vRLbuas39cHrSHkP5cwaNPcIOePkKATPorM_HA3kITBDi0QxuI2lFq-RitW5uFwKE5ddbQkCx0GBCESoS-X24PBtuaa5jlmVn36sdCPcHwl_nKnp73PxQ","https://scontent.fbkk7-2.fna.fbcdn.net/v/t1.0-0/p526x296/46380386_1938184762940899_8713372132475666432_n.jpg?_nc_cat=111&_nc_oc=AQnj0YrifMeXO1RviM4FWPoUAjxpE2e7hyOqBM-SWLIdy0w6fjwpESDcn7Ccm6MkK3U&_nc_ht=scontent.fbkk7-2.fna&oh=b4a207f1da97a47f2b8ae44670ad71b7&oe=5E1C0FDA","undefined","4",""
"https://www.facebook.com/kaidongwithkat/posts/1817375288355181","[Error]: TypeError: Cannot read property 'attribs' of undefined","","1571048602","undefined","undefined","undefined","undefined","undefined"
"https://www.facebook.com/kaidongwithkat/posts/2335811946511510","1564758550","下班了下班了！週五終於下班囉，開心迎接週末❤️❤️接下來兩日去哪裡好呢？山上還是湖邊？貓兒正在思考中...上次去茵斯布魯克的山上風景好美，下回肯定會再衝一次🚗
㊗️貓友們有個愉快的週末！

 Yay! Weekend is coming! What are your plans? We are still thinking, maybe visit
a lake or go mountain hiking? I miss Nordkette mountain so much. Next time I
have a few days off, I will visit it again! Wishing all of our friends a nice
and relaxing weekend! #奧地利 #茵斯布魯克 #旅遊日記 #生活日記 #開動with貓 #Austria #Innsbruck 
#KaidongWithKat #trip","1571048602","/kaidongwithkat/photos/pcb.2335811946511510/2335807903178581/?type=3&__tn__=HH-R&eid=ARA-h9BR4Ty9St2pMA91uwGLF9cGLd5neFs2kh3EHvHwX3j-7XKqWWFe9T0Mrml9CwJWjK7YT7nCJo9y&__xts__%5B0%5D=68.ARCcK_QbBv_581IX6qrDmyPe5KfDBd9s_9ehWkooOqne8bizklrzM_bpRRxnP-A8s8-bxmIzxBUkZvEY2tZOtJZu7NevBdXwslPS7DwUUYwcUhoU3oAIfGKg-PEpdDJP2KErJOyeUz9kk4woClax35KrdXeZDT-lIglB_7kOJn1I3ThzOK8gwXPfPgdqmVt32BygNeTjGpjVfu8_c6iIp5AbMY6ws1_iPfWZkre1xsqVBz8nIxbkrXJ2NBYjuU7zuA6Y9nB91q0cnub-Y_tV_Wxv3amwrubuyrAEyNIm-isOQ6C5xSyeCnuwthxKX2LSvfXf4YjrsxZbjucMHi2wu8prmg","https://scontent.fuio13-1.fna.fbcdn.net/v/t1.0-0/p526x296/67526540_2335807923178579_3827101342917197824_n.jpg?_nc_cat=107&_nc_oc=AQmigqUxcfWxxFayl7bBr_jf6_YsS81IK2fajkqLmflMwVDWIt091A0UwLIthVaGh0k&_nc_ht=scontent.fuio13-1.fna&oh=1952458609fcd3796eb457d798268363&oe=5E1F45FD","undefined","2",""
"https://www.facebook.com/kaidongwithkat/posts/1820827814676595","1534546122","[18. Aug. 2018 貓貓的微日記 Kat's mini diary] 😺啟動度假模式😺

 
親愛的貓友們，貓版暫時休息兩個禮拜！這期間由於貓媽皇太后來訪，我乖乖跟老闆請假數日，貓兒充當母后的司機開著小哺哺陪她自駕闖蕩德奧旅行。我們九月初再見，到時候再來FB仔細紀錄沿途的風景。祝大家暑期愉快，專心工作＆努力玩耍！天氣熱大家記得補充水份唷，九月見
😽😽😽 PS:照片攝於奧地利高薩湖Gosauseen(前幾日子與貓媽、貓舅在那邊野餐＆放空)。

 Dear Kat blog friends, this year we are going on a summer vacation! Therefore
there won't be any new updates until September begins. Thank you very much for
your understanding! We will come back soon and share our trip diary with you.
See you soon! #奧地利 #薩爾斯堡 #生活日記 #開動with貓 #高薩湖 #餐桌日記 #Austria #Salzburg 
#KaidongWithKat #Gosausee","1571048603","/kaidongwithkat/photos/pcb.1820827814676595/1820826081343435/?type=3&__tn__=HH-R&eid=ARBlohBf6mh3yg89ka1WAVK4BQJ013zXNnGRqEcJi062rUggB0kDshxbHgrQWz2SjN5cVR1XAKpw04T1&__xts__%5B0%5D=68.ARCb77HFCh1whrAIZW5oDrlcc57PSrTT6rajsm-W8Q4v09hpFxQuhYhghYn2XX-8Mr_SeWmE9e9Skz_2KlYfc292I4FkSYgThzqxr1AKDXS9TKUTFTLe9NjxuzCwbximNhzTQScL8U2fN4L_HiY58oQS0kDwbJ8DayfS8MA1lXpVoFPXRrngUwI6MkD0QQ_11kVnbv1DY14A-12j4NoW1MQu7mp4yMTumzrm7ikz7f1pQawrxR8zY3Z0fuiPK4Eu708okbiHzSc1X6nS-fT4WZHeGyBzA0QlblbzlejxY01J18Bh9oVCuApROufkhlQlnl91hXhHbn88WMHv3ttp5DFSvQ","https://scontent.fldb5-1.fna.fbcdn.net/v/t1.0-0/p526x296/39442913_1820826088010101_3554992968324612096_n.jpg?_nc_cat=105&_nc_oc=AQm6lL0OcjjWbtpePf-FVtLThusxDbU26UR5vL9AHHuQN1JM6kiWQApyM6974e6af0A&_nc_ht=scontent.fldb5-1.fna&oh=bf63f7c04cd8d6f29db258a84a5384e3&oe=5E17BD62","undefined","4",""
"https://www.facebook.com/kaidongwithkat/posts/1872222382870471","1538081195","唷~好香唷!!! 跟隨著嗅覺走入小巷子裡。原來慕尼黑當地朋友介紹好吃的德式烤豬腳就在這裡💖難怪從巷子頭馬上聞到讓人飢餓感快速上升的香噴噴🍖烤肉味！

 帶著貓媽去體驗大口吃肉的海派飲食！不過生菜沙拉也不能少，對貓貓而言如果生活裡少了蔬菜會很痛苦🤣
來、來、來～乾杯。敬：大口吃肉、大口喝酒的日子。祝大家健康快樂過每一天！

 Ah! It smells so good! I followed the aroma and found the Schweinshaxe
restaurant that my local friends suggested to me! It is Kat's mum first time
trying German-style Schweinshaxe. We not only ordered the meat, but also a big
bowl of salad. So let's enjoy the meal together and stay happy and healthy
everyday! #德國 #慕尼黑 #生活日記 #開動with貓 #餐桌日記 #遊記 #Germany #Munich #KaidongWithKat 
#trip #Schweinshaxe","1571048603","/kaidongwithkat/photos/pcb.1872222382870471/1872221292870580/?type=3&__tn__=HH-R&eid=ARCc7WUa2oKLdlsCOH9KaLSeoUtyyuXqCjoLYPakM3ZJ6W7f5ivzpkRsAPz2KF1AdpWlm2nGgNrrPvlz&__xts__%5B0%5D=68.ARDevAaVSNDjpmWg0QfyLy-KJz6wG-FH-NOG8X8dFO_7nVFy6O2xKD8zR_8AYDF9d9l7o70F0TW6Cfiru6WQvmLykpaU8FZ3BYNZHbsbCUS3kYKViuIIejzIqcxGRKyR06ABh9RNUSY0hDj8Aknppus8ifs_B9wmX5PLODBlxk5cyfYVqqU--Yd0HrY0scIbfNxnETTZNOqfsZCR0Hpx6bOA-4cbXb9tdmpyXrFmWQcJAesJYi0piMMZ_LAcZ97XFVm2WGTaJSwK0RdW3FJna_vjwbk41PzVIQil77gWttBFdATeaNQhDN1VimKdQB2bM7zvtOhW3v5AFGUh5I-OIV7uTD8PaDmQ1nFAw5_pEGf-DGyqXsR6bKktNc3OdUDoIOHtMtMhVVhLP3rlWuG4iAMx0SgKTj_e1bKtRxF-MXu8Tzo","https://scontent.fiev13-1.fna.fbcdn.net/v/t1.0-0/s552x414/42523239_1872221299537246_6832177573519163392_n.jpg?_nc_cat=107&_nc_oc=AQk9832KQGICHS4Pu2nxjfSLFR9euDBCmb4HhEc8LOFtBGcPPss8NSsX5KdmC3l4AfE&_nc_ht=scontent.fiev13-1.fna&oh=4153ef87513ec6960d750cc3a776bb0c&oe=5E1E90F6","undefined","4",""
"https://www.facebook.com/kaidongwithkat/posts/2015616151864426","1547323936","好美的西班牙建築啊😺從外觀很容易誤以為它是教堂，錯錯錯！它是14-19世紀的知名『聖十字 聖保羅醫院』 🏥 
鼎鼎大名的聖家堂建築師高第就是在這座醫院裡辭世的。

 現在這座經典的老醫院已經被聯合國編列為『世界文化遺產』如今它變成提供人們參觀的文化博物館。貓貓好開心有這個機會一覽它的古典風華！醫院的歷史故事寫在各張照片裡。

 『The Hospital de la Santa Creu i Sant Pau』was established in 1401 as „Hospital
of the Holy Cross“. In late nineteenth century the Catalan banker Pau Gil
donated his heritage to the hospital to rebuild parts of it and construct many
new buildings. Therefore, it was renamed to『Hospital de la Santa Creu i Sant
Pau』to commemorate Mr. Pau Gil. 

 In 1926 the famous architect Antoni Gaudí was sent to this hospital because of
a car accident, and later died after suffering severe injuries. This hospital is
full of historical stories and beautiful architectures. If you are planning a
trip to Barcelona, I would strongly recommend you to visit this place! #聖十字聖保羅醫院 
 #西班牙 #巴賽隆納 #加泰隆尼亞 #伊比利亞半島 #旅行日記 #開動with貓 #Spain #Barcelona #Catalonia 
#HospitaldelaSantaCreuiSantPau #SantPauHospital #KaidongWithKat","1571048603","/kaidongwithkat/photos/pcb.2015616151864426/2015613808531327/?type=3&__tn__=HH-R&eid=ARCr_u-dNh8Qjrj6zLthGu_URmaORM7mS40HBmbbRfkzvons8IJ5UN5Ve1St0Iw6NLz2FqwnSzqwIg3f&__xts__%5B0%5D=68.ARABIW-wHMtKt6YhhFPbUI4wkHpgjcZ67pyKUwt8HZ7ysojvdXZJBpnWhxNJPs_wnEeRR1_GarbyQjK2cdLFIHbfmkI_PwreEPsS6VI2s2qNTXg9kMyMYK0HbVNv4_wx0nq6b5ycYuNYRyuuErp3dln84fa2xiNCQfhgtZZnldeFEu8gcPyL8CAb1B7PX8aZ6jVpJJBaxX4FKjc_XmWI4kvFcEZsKJ50Z4sLzBoT5U9u9G67XszxiITT6SNHcjjrfdryxtyTLEYH5FeJOJ1_cJxNPWsE3D6Y0zAYA50SKf3I89Dodk3UKll4Sgfzs4r0zMke6Py9xxb3fHXT7bRIesTmdQ","https://scontent.fbom26-1.fna.fbcdn.net/v/t1.0-0/p526x296/50091195_2015613815197993_6469084942440595456_n.jpg?_nc_cat=109&_nc_oc=AQm6fzaDOWriqnYFTxEnukzMrGjpTxl8DKnNqfWChF-4aCV2OmmpsasBH1wwoI7w7MM&_nc_ht=scontent.fbom26-1.fna&oh=db4f416a09d9cfd692ede7b74a4a5d30&oe=5E376C4E","undefined","10",""
"https://www.facebook.com/kaidongwithkat/posts/1738563376236373","1529963651","[26. Jun. 2018 櫻貓家小苑日記 Sakura family's garden diary]

 仲夏以來百合開得非常好！沙拉、碗豆、香菜們陸續收成❤️新來的鄰居藏身在樹籬笆叢之間，小鳥寶寶剛長毛不久，常常看到勤勞的鳥兒爸媽在餵食呢！好溫馨的四寶家庭🐦
🐦🐦🐦

 Lilies are fully blooming in midsummer, and I like their orange colour.
Recently, our garden got some new neighbors, whom are lovely baby birds! Mama
bird is always busy with feeding her babies. We really enjoy observing them
growing up, and wish them a happy time in our garden! #奧地利 #薩爾斯堡 #生活日記 #開動with貓 
#餐桌日記 #Austria #Salzburg #KaidongWithKat","1571048603","/kaidongwithkat/photos/pcb.1738563376236373/1738569679569076/?type=3&__tn__=HH-R&eid=ARC9gEaaIlcmcxBfR9tuAUvZj3msEE-omUaphiirNR050nPz6HZYT8jEo3ieVTDnLGmqsUfTynt-dOx7&__xts__%5B0%5D=68.ARBeFc1Eam3bv_TE3m5MK7D2kPo7_FhVTI78wUg7SCq96MhYiKzYFRgwsCe0aGYvhVHrI4sYgrGh5euN3QuhqMuvwD4AgVtuPWPitqIxJZpUCB1zDSpooPDxuzBR2qyqsSQiHLia2WvA9vkCC5ko7hqTSC6naCbwinE_diGfNe-Nq9SZjw9e7PPEwitHM0KbmNKpop4DiBaRrYlyS_-RcW4KF7b3Op0i_fflTgJR94CfBTHw-NOFtWYvaKfT_rjtLk_YGCD_zyk7z8VV_niOvUYEhgeUybRSyli4xnl1hDp7JtVLxi76tS1JdheZ9MTaMKfNMzMtbNMjmh1yqmOCT7FFAA","https://scontent-gru2-1.xx.fbcdn.net/v/t1.0-0/p403x403/36188271_1738569682902409_1621305439335481344_n.jpg?_nc_cat=107&_nc_oc=AQnQyW57jOkGVBUqoyBVY7nCk5yiIA9EGM1-TZ2TEObBNC8A_qZZixCBrXVsMmaLASY&_nc_ht=scontent-gru2-1.xx&oh=0979b6b69918c0f0b064b90e15f22725&oe=5E638D35","undefined","4",""
"https://www.facebook.com/kaidongwithkat/posts/1925577094201666","1541540491","這是個陰天的日子，空氣裡的水份有些重！去郊外湖畔，本來只想順著小路隨意走走，一邊探險一邊聊天Mr.櫻跟貓兒不知不覺中就把不大也不小的湖畔小徑繞完(薩爾斯堡州、法斯特瑙小鎮Faistenau的辛特湖畔Hintersee)。真正回到家太陽已經下山了！湖畔的老木屋讓我駐足，想起格林童話裡小矮人們在森林中的房子
😉

 We went to a lake near Faistenau, which is called Hintersee. The lake is not
very big and a round trip takes 1 hour to complete.The most impressing thing is
that there are lots of beautiful driftwoods. We saw many people picking them up,
maybe for decoration. #奧地利 #薩爾斯堡 #法斯特瑙 #辛特湖 #生活日記 #開動with貓 #Austria #Salzburg 
#Faistenau #Hintersee #KaidongWithKat","1571048603","/kaidongwithkat/photos/pcb.1925577094201666/1925575517535157/?type=3&__tn__=HH-R&eid=ARDJY8p9MNB4pYqdXTtemWt2nbLf6E_kPD-cVMoT4gHb1c11c1uYyLTgNM-1F95ylL9Jz9XmP7kxw7U9&__xts__%5B0%5D=68.ARAKUeuWzJ--1SYLfD9hxJ5tYAr0IcjlfP33OS7y_GDDAa_5epGmzd1Si1AoHOrdiB6LPvBLDa6SlGOXQyBw4slWLiP-fVzoUeAMrnMU7Q1tU4tgcn86AYOXI2wLq0V-BVteCyIGNalo1sbNDsqOxoI-IihCAAE4UVJqxNj3e6yr9bgUMSn21jXJFi8uFJSXZi_iU1mGN5I5WHfrpZ9-W2SAHl2HZFIq-mAurFZz5J3Uffw9tYJyei8f0h6j0lvs_tSerOeKrQOvX47FhZER1kkIO4K6CxlpEi5qffImC5m-WtwtE-iPANxwEnQRy4lbHBKzdudAnm0n36LdjrKyq6DukA","https://scontent-sin6-1.xx.fbcdn.net/v/t1.0-0/p235x350/45520423_1925575524201823_4307521532650848256_n.jpg?_nc_cat=108&_nc_oc=AQl5VKHinoAUdTrgAYmIA0H5JTTlxXnZ-S0FBI9VdQUYiHUIlYtqikY7VvKkKdrF61k&_nc_ht=scontent-sin6-1.xx&oh=83e54ea3f010ac124355f82952c35d88&oe=5E382A13","undefined","6",""
