url,posttime,text,crawled_time,attachment_link,attachment_img,attachment_img_alt,attachment_title,attachment_brief
"https://www.facebook.com/kaidongwithkat/posts/1934520499973992","1542148783","薩爾斯堡市郊南方30公里處的溝嶺小鎮是貓貓很愛拜訪的地方，小鎮的街道老屋古樸，附近的天然環境更是清幽，讓人非常放鬆心情地漫步在森林中。溝嶺瀑布藏在隱密的森林裡，整個環境好適合健行
😺作為一日遊的郊外踏青輕旅行真是再適合不過了呢！

 Golling is a small town, which is located at the south part of Salzburg city
center. There is a beautiful waterfall in the forest. Mr. Sakura and I had a
relaxing walk in the beautiful autumn atmosphere. Not only Salzburg is good for
sightseeing, but the countryside has lots to see too. #奧地利 #薩爾斯堡 #溝嶺瀑布 #溝嶺小鎮 
#生活日記 #開動with貓 #Austria #Salzburg #Golling #GollingerWasserfall #KaidongWithKat","1571048611","/kaidongwithkat/photos/pcb.1934520499973992/1934518736640835/?type=3&__tn__=HH-R&eid=ARC8U67aa9NCtLEYcZIDS19E8fSOWA-MOkOjPZgzKy7nOt5S4BZDTLFIBdFztQGweqBUEJMLUFwM5zQ_&__xts__%5B0%5D=68.ARC_jcRBW77TxcCHXRByIYG6d98SYnJTPE-ZTIU9OE01AGnsac3L6wWsvIeqZqsGx9Ap0eAI-8ajG5tMgrApuIbcN_p-xu3dC4s2DLutGX8BsZPAhDM0uNS6ymjgOPqTJ8HRmm6i3mlEkgmheZ4UkXEak4RlPhShlHKcSKOcSEq6Dfdz2c9J6oStxwgZ6gxB3dymoop_WC-V2beF1m0X5R5YQROBCU8YtTA7MD8x8sgn7kK6pNdXuPIrvBh_BUu5a_rSAmJB-GFmLwyz4D_WD6cZ6Ei0p6OpZM8q0yQeH98Okv115lGHoUBI0U7W8x5I8zignHrVA-Gcu5FUuJLHL_D_OQ","https://scontent.fkhi11-1.fna.fbcdn.net/v/t1.0-0/p403x403/46258829_1934518749974167_837201362075779072_n.jpg?_nc_cat=103&_nc_oc=AQlxQuRpob3KdPqcZQ94Sx-oOs-w3PlaqrY1ly2I1dEI2CV0VqpmVKDUGopYbXYUsSM&_nc_ht=scontent.fkhi11-1.fna&oh=5dc51c81692e3c9f83baf87ef141af73&oe=5E1C0CD7","undefined","6",""
"https://www.facebook.com/kaidongwithkat/posts/1897715636987812","1539890936","茵斯布魯克Innsbruck老城區小而精緻，它知名的古蹟金色屋頂Goldenes
Dachl正是明顯的地標呢。沿著茵河Inn(多瑙河的支流)慢慢散步往市中心，很快就會“巧遇”金色屋頂！最簡單的方法就是跟著大批人群走，這是貓貓試了多次都很成功的景點方向判別法哩。趁著暖陽的中午，吃冰淇淋
😋敬，開心慢生活！

 Innsbruck city center isn't the biggest, but very beautiful with colourful old
houses! We walked along the Inn river to the famous Golden Roof and had some
delicious ice cream! It was nice to take some time and visit this lovely city. 
#奧地利 #生活日記 #開動with貓 #提洛爾省 #茵斯布魯克 #黃金屋頂 #Tirol #Austria #Innsbruck 
#KaidongWithKat #GoldenesDachl","1571048611","/kaidongwithkat/photos/pcb.1897715636987812/1897819563644086/?type=3&__tn__=HH-R&eid=ARAYoFEBSJwqJ5k6G1BB_mUQsi9P_P9Z2hkpvE3Phhgzmrk9AwoXbsJhaaYzWCtcKbzn6Ra470K273n7&__xts__%5B0%5D=68.ARCvJL3V_Qihb7Mu8QPMbiTaHhMUrEZ8i2vxsqqtid03Vb5iDPWCJG5uFSP0RygWSrE_fb7dpza2cKXBHzm9tTKmrkjCwC8ijqNpP-iYmxluicOTIrUNeJJSPyZAN55KRzVWnqDO4kZJ2S7PLCvzSmma74t1G47jqm8eK4AlwlPl6079-5XFVZbTdCHBziMW9AECMWXcSFOXxjp5SDETRfxIzh2GtBYa7bR0zsE59VMCNWDAsLJnyBWLN6zf3D-KJeQH7DTwtrc_I1N7WIGyzszdUqg93kIrAKnOZQk978nJT2AG2SURNvKSfG2RbxT5cjxX2Mlf-G-gT6fddTV2tMc3nw","https://scontent.fbeg10-1.fna.fbcdn.net/v/t1.0-0/s552x414/44273388_1897819566977419_3383901928181202944_n.jpg?_nc_cat=105&_nc_oc=AQmQc31kdkeUNLssUIfrRfR-dQ4blEqME4D9_hcbdYvZnwPG96LAEwC2MguKbR1ioMw&_nc_ht=scontent.fbeg10-1.fna&oh=47b2444a7e1a859f82e369c60f28fa64&oe=5E16E0F5","undefined","3",""
"https://www.facebook.com/kaidongwithkat/posts/1940906462668729","1542577506","短短的週末就這樣在“煮食＆做家事＆散步”中過完了🍁🍂
現在奧地利的氣溫已經低到10度以下，熱湯麵最適合這個氣候。貓貓趕緊燉一鍋濃濃的台式牛肉湯，只要煮好麵立刻熱騰騰上桌的就是美味的牛肉麵，當然炒酸菜是一定不可少囉！在冷秋的森林散步完後，回到家馬上有暖呼呼的台灣味牛肉麵吃～好開心
😽開動囉！新的禮拜努力💪上班加油。

 Time flies like an arrow! This weekend I was busy with housework, cooking and
having a short trip with Mr. Sakura. On Saturday evening I prepared a big pot of
Taiwanese beef soup. After the Sunday trip we then enjoyed this hot beef noodles
soup. I like this dish very much! #奧地利 #生活日記 #開動with貓 #餐桌日記 #薩爾斯堡 #Austria 
#Salzburg #KaidongWithKat #cooking","1571048611","/kaidongwithkat/photos/pcb.1940906462668729/1940904632668912/?type=3&__tn__=HH-R&eid=ARC1g9j6wwJEQe7WxO-W3j0jM_JI0hOvGmYQPefFyx8gGxSWMVp3qejokwFu23bBYXBbO4A_1rvbSGSl&__xts__%5B0%5D=68.ARCYn51MOTFQiFciSpp6uDaXmCj9BTo-2d0_woCDb8hzQL7faOi_3CdxrUyFpZZcUAAoQb0qi4vw8Kn0idFpY7d0DfqjdjfX-sfL8b_8EvfoEj3QdWHsVTXwJ6CE2OCec2ZL4Sm4aV_TrmcXYzMdJB3ClHGxt0PcMgLq9TinhYZS4z7IZx8xYdXqm-IINu_uDzfFiae-jdhns8k7AlIiPcNsYv42oKrF4YNG2iGrN-IJr3mi9MUntecTMmnLDNVKsO4oTj-1YnyViruOhUet6yoy661ywV5hyLi_hdPjQUZmSsaIJKQJbQXz6kvrnM3ypgdeIS5WWQbnf6FnPDbsTJlR1g","https://scontent.ftbs4-1.fna.fbcdn.net/v/t1.0-0/p403x403/46401721_1940904639335578_587254580643889152_n.jpg?_nc_cat=111&_nc_oc=AQlsYXjtT0XFHkHn3lO06MBmM6KddR7CICfaI_bOs8X6K0YegYNwP_LVOfsgHhEL2Lo&_nc_ht=scontent.ftbs4-1.fna&oh=597f545d4cc876d270414a3f749e07f9&oe=5E1AAE41","undefined","3",""
"https://www.facebook.com/kaidongwithkat/posts/1994405827318792","1546034179","隆冬裡的奧地利湖畔小鎮『Hallstatt 哈爾施塔特』靜謐又美麗！很幸運此回貓兒與貓小妹來訪時剛好鮮少遊人，散步來好舒服啊，不過得穿暖暖＆小心滑倒呢😸
特別是在樓梯＆斜坡處！

 White and snowy Hallstatt is so beautiful. In winter there are less tourists,
so my sister and I really enjoyed the trip to this small town. In such a cold
season, please keep yourself warm. #奧地利 #生活日記 #開動with貓 #哈爾施塔特 #薩爾斯堡 #Austria 
#Salzburg #KaidongWithKat #Hallstatt","1571048611","/kaidongwithkat/photos/pcb.1994405827318792/1994399880652720/?type=3&__tn__=HH-R&eid=ARAmEr2zcxbHHxR8OJLo8oDD1UAK17xzlP-0S_12saPrkRPNSMq7EVHu3nIZJOkB2puCaC0n0juofeO1&__xts__%5B0%5D=68.ARCPUIO4Htv27r1Ilaon51XfvARlLi58YL4_SeTAc9ZTkwfEELOGjwkx6Bg1PTaaZoI5_B3fzj5fFB_7a0s2BxkLLfhwllahMhro9WeUSO9_MTOZxOve32KeKAKpylD4CD3GT0uUr75yt2abBpQGMfo168tF8l--CvPZkaQkw9ECMMvAvhv9sFS2oVgYhW_JI_UF2Vw-VeoKbs8W9l55RR3uRMnHxWlYZwYOGr1hAFnfgKscG3AHBe-h3zO8g1FN_TTKskVHggyFgncPCa0A4W1CYvy8dqOpdY1nOMwY03l_5WSoO-1phfv5at5OU97dqtk50ZB6VliipzB56wIQ1Igq7Q","https://scontent-frt3-1.xx.fbcdn.net/v/t1.0-0/p235x350/49696703_1994399893986052_6115071631707602944_n.jpg?_nc_cat=104&_nc_oc=AQnjBzx6Dg6iUEOLf52qWUqbFcEt_36e86hoIGf_0RFlp3nQ1pZorXWYo3h96pfjDTM&_nc_ht=scontent-frt3-1.xx&oh=ff3d88b044d41d38787d6b1c73a7c7b4&oe=5E2D8577","undefined","15",""
"https://www.facebook.com/kaidongwithkat/posts/2249990401760332","1560632204","天氣越來越熱，最近沙拉🥗
變成了貓兒很愛的食物，清涼又消暑。抽空約朋友去薩爾斯堡Künstlerhaus現代美術館咖啡廳小聚！欣賞風景＆吃輕食＆聊聊最近的生活。下班後放鬆很重要，再忙也要記得愛自己唷！

 Recently, my friend and I went to Salzburg art museum's coffee house to have a
nice evening talk. Since we had such hot weather in the last few days, I ordered
a salad for dinner. The cafe is very cozy, built right behind the building of
the art museum. It has a long terrasse near big trees. Sitting there beside the
trees on a sunny day, and having a delicious meal is very enjoyable! #奧地利 #薩爾斯堡 
#生活日記 #開動with貓 #Austria #Salzburg #KaidongWithKat","1571048611","/kaidongwithkat/photos/pcb.2249990401760332/2249989035093802/?type=3&__tn__=HH-R&eid=ARCZQUj1ObAzl1wuU0AGH37pKtG7UgjaJnntjQ3TJxgBQzztN-bCjk0iNuRVFi9mR5bEVICMM54tcw4Z&__xts__%5B0%5D=68.ARCN1snWPSzZ3k23XRA8phQnUc7iPZx_x1F_Tfpst2xzva8p7_JLm0LEPZNcEMGRVQQpCmInBMMtdLvyTQC18-LWajxIMmy3WzV0vwXRMhD4lwLtZXYB1jWAVgEUvzlErooLv6F3w--e_L75C26xJyRGzA_yHzJcO6I4SKKqu5Hl_7OS35JCFjvqeBAWYnsLTWunFa8Ozs6o72aKC0HrnkeGheck21pZCGIrv9Wbvp77t0sYLzQPJjUnRsNBUXkEDaXg9exnIUBhSIre6Ft-Vmwi8OgSFfLW6NyWF8Vm9rS6C6xNz779bknDdgFsKgDeBueEkYK1rnRnZpSjaZK6aI6-Mw","https://scontent.fbfh3-3.fna.fbcdn.net/v/t1.0-0/s552x414/64725072_2249989045093801_8075101449253552128_n.jpg?_nc_cat=106&_nc_oc=AQlzsXDW8T5mGm6U462CA7tsnYCJg-Z4FpNhG5YYLPvPA8pxUozWrZcjBNS-PHUi1HQ&_nc_ht=scontent.fbfh3-3.fna&oh=b4b682f9934aac7a933d6955ad1fd901&oe=5E25AF30","undefined","6",""
"https://www.facebook.com/kaidongwithkat/posts/1979569695469072","1545087085","將臨期第三主日已經過了🔔再一個禮拜就是聖誕節！奧地利各個聖誕市集的氣氛好歡樂，特別是越夜越熱鬧。薩爾斯堡今年一如往常，該喝該吃的貓兒都沒有漏掉😽
每年必捧場的烤馬鈴薯攤也有去光顧吃飽飽唷！

 This year is almost at the end, only one week until Christmas! So far I visited
the Salzburg Christmas market several times to drink ""kids punch"" and eat baked
potatoes. It's a kind of ceremony for me to celebrate the end of the year! #奧地利 
#生活日記 #開動with貓 #老城 #薩爾斯堡 #Austria #Salzburg #KaidongWithKat #citylife","1571048611","/kaidongwithkat/photos/pcb.1979569695469072/1979569295469112/?type=3&__tn__=HH-R&eid=ARC63bZ746hn-75bGio41p8Xms2S93Vjwg4OGUfOhDQK7pwKhVzLILAVC3gmHRqtaQ4yuLbj3WNVErEu&__xts__%5B0%5D=68.ARDnyaLNdCS8JlXOgtQt6wQsSqckr8m1WTdumqGNLSX5cKIP1DQhngDsyLUiNsg8jtrfnDFsMaD3VJZTWNWObfTOKuG6fu9X1a3OoNrUWHAd2r5ansPQrPmeUCKX15gzmKS83erSHKiMROkPabHnqcSymuSy_zpdNUoIN9Ff16rDS7L93K8lKioc4xlcdK112u9ep2U-iwu685vionHeswf06Qu6EV5ZbRPWyS23TlMSGEOQ5xbV5a1-zo5DAATujfRGgY71U8Q_fHmdDAiG64fFAKqfHdZFPPrKpI9USHFmbNOGVpR6o3dt8oa1nfuzHSwWA_dvd_2QpfrPI7kyerctjQ","https://scontent-sof1-1.xx.fbcdn.net/v/t1.0-0/p526x296/48371635_1979569298802445_6511012254270357504_n.jpg?_nc_cat=100&_nc_oc=AQlSRE81bgyS5Fxiup7TRR5U_q5NmRxC6x_yLAJWXY0c-LSUKeEAKO8F857DZE9iDAY&_nc_ht=scontent-sof1-1.xx&oh=d4862b458859bf48216e250dc22778e7&oe=5E250292","undefined","5",""
"https://www.facebook.com/kaidongwithkat/posts/1710950658997645","1528142435","[04. Jun. 2018 貓貓的微日記 Kat's mini diary] 台灣之光🇹🇼幕後花絮

 
時間過得好快『法蘭茲-舒伯特國際合唱賽』已經是上這禮拜六的事，貓貓在整理照片時忍不住重頭回憶一次當時的場景。好榮幸能當觀眾臨場經歷珍貴的當下，精神支持這群可愛的泰雅族『新竹尖石嘉興合唱團』小朋友與老師們參賽順利！在他們站上舞台時貓貓心裡暗自覺得：不管有沒有得到獎項他們都努力的完成出國比賽的願望，能夠讓國際聽見台灣小朋友清澈的聲音，其實這已經是贏了，贏在擁有突破萬難堅韌的毅力！他們真的好棒
👍

 Time flies really quickly! I can't believe that the Franz-Schubert-choir
competition was already last weekend! During arranging of my photos, I
remembered that all the children and teachers were so brave! They made their
dream come true, and even won a prize! I'm so happy that I had the chance to
watch their performance! #奧地利 #維也納 #生活日記 #開動with貓 #餐桌日記 #Austria #Salzburg 
#KaidongWithKat #Wien #Vienna","1571048611","/kaidongwithkat/photos/pcb.1710950658997645/1710949988997712/?type=3&__tn__=HH-R&eid=ARA4o07b0xsBtiy3VLxy0B-LXECmq1PAM-4W6YLPCi2jbnqvMd0n_A1Bgj5FdEbUgB_1y49tMpKuaT1U&__xts__%5B0%5D=68.ARDg3QtZXHtWuGpU7UtrpxZ9uIBlhjQ_hXYB1W0NvgWKxmEsHObwlGkTPvIMC1v03V8xbAPnpkxlrVB0xbPdff9yCOPVGOw_5VmEIMK4jy4ZAkx8fkjMeZ7uv-h6mANHBjQPepZTh6htonRdfDgufy42_p-XxWBeQRsQiOFn7PrVD7H0YNI2ShsKGbEgTRJ8sIyojNZ9o5M4ii6ErrP8797U1s7ZNQUhVl9F47fd2F55Qdd47R3bimm-sNNu0lbNSdmOoy_KtQySho4ypWEInjc4mp4YSQzUXfchvbS8AtPZ2x3fedzmEshevAHpmdsOp1DbnC2eOSF-L0zXhtVOh0AypDf-xg0IZc4ReX08lnvwvyvO5eJ5gmJ56E08SpA6l8l6WpX9Pn_cpdnnZNXtAlKwEavd34X7Fv346zdghw","https://scontent-cdg2-1.xx.fbcdn.net/v/t1.0-0/p235x350/34408939_1710949995664378_253885313686962176_n.jpg?_nc_cat=106&_nc_oc=AQniSLFigJZm7b-ZQe6sVaYXm9BgUnvljJo_RYq-YiTFfTpEQtZOfXOl5DHyozwqDe0&_nc_ht=scontent-cdg2-1.xx&oh=36d32188e91268dadfc2a127f8e8bea4&oe=5E26DB58","undefined","8",""
"https://www.facebook.com/kaidongwithkat/posts/2159101730849200","1555919126","四月中輪到奧地利櫻花開。美麗的粉紅色花海，放眼四周好多社區都被她包圍🌸🌸🌸🌸🌸沈浸在浪漫的春天裡！

 The beautiful April season is full of cherry blossoms! It only comes once a
year! I missed it so much! #奧地利 #薩爾斯堡 #生活日記 #開動with貓 #Austria #Salzburg 
#KaidongWithKat","1571048611","/kaidongwithkat/photos/pcb.2159101730849200/2159098640849509/?type=3&__tn__=HH-R&eid=ARBBMMMkac8XDe0NsAG2CFA4nOn1mVU9RMnFstR6b8nqTbE_7JZjvosdNAqJEIDuVf8EhNWxoY9ZaEEP&__xts__%5B0%5D=68.ARD0IjTZCwJZ33PidRBlY1mmLFgQOdE7JGTHdTx7VzA8oXczSMkYGnHuktnzSmttkfrxDLgQJTRkqZVwVBvVgU1MDsgeAXixm2JMs0wuVeJMNsoacZSJlPIwgCrEK9VX4xiP5HMsIJyrq6_jCsXSsiGWasmnpY1s9MMGO2Tjtmu6sKG3XsD2OoKvB2v_eu1Aa4eHKwrc4G9QDqUjyqiiS1QL9qh7ehc-o0c1e25hI2zfoq6QWmr70BvhxVyGj16YTVkmb717sP_4CrkwfuFMh7-8xfy4AYv0yMfT3Y6rDRdDvr2ocNNohrKjo_ogGEtEH-xxJcVDE-FtuhiQ5UMCZKeLig","https://scontent.fhen1-1.fna.fbcdn.net/v/t1.0-0/p526x296/57384334_2159098647516175_4137442863543746560_n.jpg?_nc_cat=103&_nc_oc=AQm6GhRqSKLu9ln4rbnKdZIGZ8AYqvnWuAgoiNaJtrP03Ev3Z7II4CErkrg6tYLfWcI&_nc_ht=scontent.fhen1-1.fna&oh=559bc5f63a9f494fcf04f34ad3ddc357&oe=5E370E6F","undefined","2",""
"https://www.facebook.com/kaidongwithkat/posts/1789452441147466","1532903006","[30. Jul. 2018 貓兒小苑日記 Kat's garden diary]

 呦呼😺
撒花撒花～超開心！這幾天奧地利爆熱，就在汗流浹背的日子裡貓兒種下的『蝶荳花』冒出美麗的藍紫色“小精靈”了！期盼好久好久終於開花呢，去年沒有發芽，今年好不容易挑戰成功。要在溫帶把他種出來真不容易，好開心
✌先來泡杯蝶荳花茶呢！

 I'm so happy that this summer my butterfly pea is bloming! I tried to plant it
last year, but it wasn't very successful. This February I started to grow it
again, and finally in this hot summer we got beautiful blossoms! Let's make a
cup of butterfly pea tea, it has indigo and violet colors! #奧地利 #生活日記 #開動with貓 
#餐桌日記 #薩爾斯堡 #Austria #Salzburg #KaidongWithKat #gardening","1571048612","/kaidongwithkat/photos/pcb.1789452441147466/1789450097814367/?type=3&__tn__=HH-R&eid=ARAoLy1Uk5xoWbk8aGMR0T8xMHuEwju-OmUz1k85MgK0dC1O42CuWoPV7wCY3HiKPwooem9aZW7dFZWO&__xts__%5B0%5D=68.ARD_CiJ51YC6-K3JlRXRwnv_PLNyAPDqmMJO9HMf2-cKN_d1t1SLreS83F_iGQcaIOxEQEXYcfJD9LG8gI2iOxlkzVUrlPOKTS5KoXACcOBV0koyFcGDmxdt_iqXaiz6jg5EFiWXGw39EkQ43IZazdmWj68eh8c_QBU4WFo9Ita0T2qaAH8Eisz5d_Nt76BIT4xHEWNfKUc80_OYQZnKnLjVEn5skpi2Q6WcLNn9r5Zzt14JDpBNfOD6UADIqma2AeXOT4_O1SWuhbuMYGRMC9YBrHvvW5R5geau14mKGNh9tcU7JNySiyvjj7bOPtI4SARbBIi47SJQqkhXNPm_9FQpGQ","https://scontent.fymy1-2.fna.fbcdn.net/v/t1.0-0/p180x540/38011834_1789450107814366_6415366339065544704_n.jpg?_nc_cat=111&_nc_oc=AQkfGCCPySweTjeIYpc_idN95yDA2e8BrU1wTmzos_Q_QMn4bWEizZELo5NA3QXMUgxYsdnV6vhiD7zW6UcSB9Ky&_nc_ht=scontent.fymy1-2.fna&oh=1fc7bdff112fe98bf05ed63a0497148c&oe=5E292439","undefined","",""
"https://www.facebook.com/kaidongwithkat/posts/1971335999625775","1544561911","今年入冬的第一場家庭火鍋！貓小妹來找我玩，貓兒開車帶她一起去鄉下小住，感受與世無爭的環境。我們在民宿裡開迷你火鍋趴(附廚房)，能在德國南部貝希特斯加登Berchtesgaden藍紹小鎮Ramsau一起吃火鍋真難得！感覺就像在家裡
 ❤️PS:雖然有附廚房與共用餐居，但是貓兒堅持用自家的鍋具(搬的我好重啊)連電磁爐都自備了！開動😽😻

 Recently, my sister visited me. Together we went to the countryside overnight.
The hotel in Ramsau, Berchtesgaden was very nice, our room even had a small
kitchen. In there we cooked our first hot pot for this winter, it was very
delicious! #德國 #生活日記 #開動with貓 #巴伐利亞 #藍紹 #辛特湖 #Germany #Ramsau #KaidongWithKat 
#Bavaria #Hintersee","1571048612","/kaidongwithkat/photos/pcb.1971335999625775/1971334952959213/?type=3&__tn__=HH-R&eid=ARCNb2tFPMnykMHRN3NoqrliAGvdtwt5o5loDfsCrvyM2N0YC0Fd9nUCaffHHnqanL75sK30dmMm-DEV&__xts__%5B0%5D=68.ARCZKjlO_GG4lNDhGE8_a5eCOTtrkK6_12tgRXFOPpfdwufRHplsSLm3A5QdCwkHIA0HLP14dwDVCKC9qHwv96GXtaup4vKC8WOcv1rr_odSzIzZREuL_0oHv6H_XHQQm9u4jo_zRq4gOGXeLK_Qu1rh3jOikZv7KEGD_4L8JMO-Nppvpv7sE8Ge8lgTdC-wd0mjgpWGaTfg9-axli-Ynk6UoYWtMYhbPB7-qv-gjQKm8Uevofmc9JDvTd6kRZSu1ivXrZsk-sOEDiBS8D3Wlz1ld9XV4AI4WMW6rmjnc7e2w0BhbgzfZVKMlVNJwgNz-hESRQtp8bhSHJ4I8aTQlJV9p-u24XNnI4hz9yYKhmY-cdQ-D_pV58_YcNjILXOAX47Jg27L9nV-x-HnKyq4dcrgh7xGV8SZGOeU-WgYwzk","https://scontent.fiev2-1.fna.fbcdn.net/v/t1.0-0/p526x296/48106832_1971334959625879_2323983035516583936_n.jpg?_nc_cat=106&_nc_oc=AQkN6b5aXztSXyrBi4QECDJHOK96hfzgSah0eOCPTgc5xV7KYvxelx_vpvHFIhtX-Z4&_nc_ht=scontent.fiev2-1.fna&oh=d294b1e4570ec3be9bd47c108f629526&oe=5E20D09B","undefined","2",""
"https://www.facebook.com/kaidongwithkat/posts/2218127804946592","1559081944","莫札特住處旁的老咖啡店雖然貓兒常常經過，但是從來沒有好好停下來關注＆捧場它。這麼多年來這竟然是頭一次登門拜訪呢😉
結論是很滿意！本次喝咖啡＆吃蛋糕，下次來嚐嚐他們的輕食好了。哎啊...我真是隻宅貓，除了上班就是在家裡，平時應該多出門嘗試不同的餐廳才對！

 Just right near the Mozart residence (Mozarts Wohnhaus) is an old cafe. Usually
I walked past it without a glance! So it was my first time visiting this shop,
and I will definitely go there again on a sunny day to sit in the garden and
enjoy a meal! #奧地利 #薩爾斯堡 #生活日記 #開動with貓 #Austria #Salzburg #KaidongWithKat","1571048612","/kaidongwithkat/photos/pcb.2218127804946592/2218123344947038/?type=3&__tn__=HH-R&eid=ARCwKqQGO6fLIyl54IVWK9_FYExm9WOM7E1O4t6B4ihS34i_5BntgDP073FapEAs6ju8dUxh9koKsfGN&__xts__%5B0%5D=68.ARCFhCZWAw1HN42QL0SPfyu4G0v2vWxSxMsKm4pydo7k7XeWu3dZpcTuOYPLOu5AieQuqcORoBOXoTwizTAeOc4sz9x87MYucvvUrhKeWiKGSR3rFLrM2v9-eWQznmfJZ-VH6pPC1F_mcxQAec2nUo-zU9MqlL9n3gsdFNh0dO3F652KG09HNiy_TIW40bV8Jv2G1gzjSK2_8CiEhNca4kdJHhZ1FPXNCcIVB-I02Mub9JNJteFhlog3G7N7jhJhrlmFJo1svJZYZx17CjtsE1a72Y61DYeB76Nj8bwnjpspEU2wCN-4qWhA74QTjIeLy3Me8R6jRYLc6tbiaHcjF3747Q","https://scontent-lga3-1.xx.fbcdn.net/v/t1.0-0/p526x296/61194419_2218123351613704_1814228017287790592_n.jpg?_nc_cat=101&_nc_oc=AQliaa-wX4CSs3Uk17jcuGHzdWAYc9_DZYS3taFp6XfkLy3eBgC58bJPLMvNmsqpdH4&_nc_ht=scontent-lga3-1.xx&oh=e52d9ca44b736c726e56e1e2aaf6b3a2&oe=5E1EC6CA","undefined","2",""
"https://www.facebook.com/kaidongwithkat/posts/1753535261405851","1530826631","[06. Jul. 2018 貓貓的微日記 Kat's mini diary]

 這間在薩爾斯河畔的老咖啡店Café Bazar地點好棒😉
座落在市中心！夏季晴天時大家喜歡坐在室外，加上有樹蔭遮陽不怕曬又能看到河畔美景，許多當地人一坐就是整個下午。難得貓兒跟櫻媽媽(婆婆)＆外婆三代同堂來此喝下午茶
☕️這條路每天上下班都要經過，能夠在此處靜下心來閒話家常＆吃點心、好好享受音樂老城裡的風景～開心！

 Café Bazar is located nearby Salzach river in Salzburg city center! This old
coffee house is quite famous. In the summer many people like to sit outside and
enjoy their tea time together. Recently, I went with Sakura mama and grandmum
for our ladies afternoon meeting! We had a very nice time😊! #奧地利 #生活日記 #開動with貓 
 #餐桌日記 #薩爾斯堡 #Austria #Salzburg #KaidongWithKat #CaféBazar","1571048612","/kaidongwithkat/photos/pcb.1753535261405851/1753533718072672/?type=3&__tn__=HH-R&eid=ARC_mE2ITrj_12f9eg94akQi7RjowuPueGWPqgBT3bRtzLqjeINL6jRW3ifsVXFZNDoHCWs4KCxK_8ZB&__xts__%5B0%5D=68.ARB2jMOr4oxiXo5BaCG_Lj97ZvavS7UiO8XfTvOZsuekBZ8IeNzgz3VDEdJieI4145vehe8KOzVl3A4r2Cv7Xhv0xxGYqzI1v_Cd09mEV8GdXS85zHES5vNTc1r_ZVnwscgH9sO2NFiiFwVPDz3rCoqvnVk8uXfsXk9pujDcF1flCQ8PFLJvve6zAj72RxCZ_N0YraqHO_7HU1QXO7E4AxmSPWH1UTeu8eyI1Q4mDv3LFwACd8c0OB8Ac42gQVPvA6g7qsJ0L3F8Y8u3wJXODGqnk-f_VXGaKD6ytKYGRWvlAK86MBjt03cuM5wmbIrBu5nhBGoVRtmJfn8fcBrm37NXHh6ld3znY8jqAlO85KC86Nyur8YR-jn4FeF202I-TQgrs6iDju8Y8RcKmHaR8M-TWEv3dv4_b_rt1pvH01A","https://scontent-frx5-1.xx.fbcdn.net/v/t1.0-0/p235x350/36684073_1753533721406005_7438916384970506240_n.jpg?_nc_cat=104&_nc_oc=AQlgIvaddhtedKaTL7Zmd5UnSMHvWNRT4LkHKca2G38_NJusdDU04hLFe_YMy2FKFP9hbPsMJmQckdLKfJ_MpVo6&_nc_ht=scontent-frx5-1.xx&oh=fb6af7601c60dd9ff6b30be99fa3a50f&oe=5E1A5348","undefined","4",""
"https://www.facebook.com/kaidongwithkat/posts/1783074571785253","1532553467","[26. Jul. 2018 貓貓的微日記 Kat's mini diary]

 
今天下班後貓兒從奧地利“跨國”去德國拜訪好久不見得朋友，一轉眼認識14年了...真不可思議時間過的如此快速！初識時她正要念中學、我剛入大學，現在我們都出社會工作，能碰上一面好不容易啊！剛好她這趟從德國北部回到南部(就在奧地利附近)抓緊機會好好敘舊
❤️整個下午在德國郊外的鄉間小路散步聊天，能夠看到對方健康開心就是幸福！

 This evening after work, I visited my friends in Germany (Weildorf). We have
known each other since 2004, how fast time flies! Now we are living in different
cities which are far away! She is having a short holiday and came back to
Bayern, therefore we were able to meet. It was nice to see her again, and I wish
she will enjoy the time with family and old friends! #奧地利 #薩爾斯堡 #生活日記 #開動with貓 
#餐桌日記 #Austria #Salzburg #KaidongWithKat","1571048613","/kaidongwithkat/photos/pcb.1783074571785253/1783066228452754/?type=3&__tn__=HH-R&eid=ARDg_MFuLwhKHKx8RZwGSN46AdGvVnJrJLwbEIDsOKUPyB03uogbnbYh61yic6HgYYwhrJMb1jUvfxgE&__xts__%5B0%5D=68.ARBGFj0MUyOxR9GaFpanPRi9mLIU5KsF8qr-bAJ_ZNlIpEb-KwtBmLVb9huMxu1v4r1qW638XCek4Q8jqrRDNLDEU4_YFdfiFd5eHCo1YXkyoc5h4lYAWUcnlmJsQpNuPUdWJsseVy01qIyfcN_zt8DldVRuw4yUza3V0bTaSI0UbW04pvBTYMVcMet6mkb0aJ3rVWyIGxSl4gMo8bXQILREJLsFCvXqtf_-O_44TT05i2I-PCDrKOYUfeOrb6qLek4a6C2ZT63BFW-BXY52EckeyhXL_BlTNnvQNIjN1cjdKNmBtaELcdry2udK6_7aFkU6SiROKcxiEMZsIQKEDGmFBA","https://scontent-cdg2-1.xx.fbcdn.net/v/t1.0-0/p403x403/37808112_1783066235119420_8577356960662290432_n.jpg?_nc_cat=110&_nc_oc=AQmK-40J-3nisgaHBMAbg2wIVTxTkMk_MMDiOmPeIq3XUxazPTQpahV4HcmgQt7yYJw&_nc_ht=scontent-cdg2-1.xx&oh=1893f247a1bba4c42152003b902aa03b&oe=5E358716","undefined","4",""
"https://www.facebook.com/kaidongwithkat/posts/1930761557016553","1541892085","好想念台灣小吃唷！嘿嘿~這盤是什麼呢？豬血糕？不不不！它是貨真價實的『黑木耳糕』(偽豬血糕)健康素食路線，而且做法好簡單呢。只要把糯米泡1小時左右把多餘的水瀝掉，加入適量海鹽＆五香粉，接著與打碎的木耳和糯米粉跟一些水攪拌均勻讓他們“黏糊糊在一起”用電鍋蒸一蒸，就完成囉！開動啦
😽健康木耳糕，好吃咧。

 This dish was made with sticky rice and black jelly ear (Holunderpilz). It's a
kind of a salty rice cake. Although it looks not so common, it's very tasty!
This cake is healthy, let's try a piece! #奧地利 #生活日記 #開動with貓 #餐桌日記 #薩爾斯堡 
#Austria #Salzburg #KaidongWithKat #cooking","1571048613","/kaidongwithkat/photos/pcb.1930761557016553/1930760877016621/?type=3&__tn__=HH-R&eid=ARA-hPiyDIKNa2HgAlMWkdC5N5fPSoauC5k5WOlQOr_0Ho2xbEFaDWjJpNnkST6mrObPTWTb8z33rXSx&__xts__%5B0%5D=68.ARBAiv9Kzk5QVnFQXMCeXNUwzSba205QTarqn4VcQNI5PBj7ZY7Yq_-mPmntCOj8ZwHBt6mL2uYGbEj_ZcUme8PXnSrRllXSUyregDDiIP3F_qMKoaSgZDh7l5_pl0G9O0ABsGh8bolWzbWewh1ggFeOPLpEhMw0DrWfpS40XHq9rO7VUZVaOySCLxVpOdENQlNm7IeWCydAXwtg_-IE2jtqwWPg0tjJ6Dnp5hsjBPiwVl0FIC5jTTr-n5OBGLFpNTJMErWXQNDt6hYHM2nMj2QWmflkElmtonDZ-r9CkCvsWYJcf4wDTysXfb3-Qbtom_M7SwcSYrLUGez6rZDY3eLM5w","https://scontent-cdt1-1.xx.fbcdn.net/v/t1.0-0/p235x350/45860747_1930760883683287_6412686601595387904_n.jpg?_nc_cat=105&_nc_oc=AQmLyTQi6xPghjthEtra4VSyo_whnyfd67dBlwkm2FbyRCitpd1rv1j8FkgzDP_88i8&_nc_ht=scontent-cdt1-1.xx&oh=9fb5a915d8fa68285d857b3bf6ff4e10&oe=5E2588AE","undefined","2",""
"https://www.facebook.com/kaidongwithkat/posts/2038201076272600","1548717422","喜愛藝術與馬賽克拼貼的活潑圖案，貓兒超推薦到西班牙-巴賽隆納-高第建築師設計的『奎爾公園Park
Güell』逛一逛！裡面的建築物不僅像童話世界般的場景，就連每面牆都有自己的特殊的拼貼花樣！公園裡除了野餐散步、更能聽到街頭藝人的表演，觀賞特殊的高第建築風格。貓兒跟小妹逛的意猶未盡哪
❤️ 

 Park Güell is a famous sightseeing place in Barcelona, designed by Gaudí. All
the buildings there are decorated by mosaic art. We had a nice picnic in this
beautiful park. I really like those lovely fairy tale-style houses, and enjoyed
the time there. #奎爾公園 #西班牙 #巴賽隆納 #加泰隆尼亞 #伊比利亞半島 #旅行日記 #開動with貓 #Spain #Barcelona 
 #Catalonia #ParkGüell #KaidongWithKat","1571048613","/kaidongwithkat/photos/pcb.2038201076272600/2038199402939434/?type=3&__tn__=HH-R&eid=ARD94-orXkc2Dihk78spbaBQPjy6cSTkOx-WVZm_3gE_LNa9YrhWyJB-h1owXTOx9_MtuV9KtQBqGlRF&__xts__%5B0%5D=68.ARBc3MiI_PwvwFNCfV5-2rLfB-VItdePT1h62C-7oJM0O7WzhpU2fKHAgVJddd9UvS0tFadkVMMT9SivMklDxBAe-EC8TkV5RmYpx249rDdUkgNP5-UpW_IuQKTog-Gvh3fhsxjJ0fGpLQZKnACIEdOKipPCinubMZZOa3RaD4UkdDBCohnJFMAzJe9fdXa1dYMNW_h73rMPxQkE4-zHeYMMPV6uHoRonR4xWxN-SiVJo_5DaCAaIgyR1mkMIzFEsunKbcZPwMenlctC9639BCYGBkb7UekXJ60oJRrB-fBU_u4AC56BgiTGe-zsiiy9Zb2MKo8EG2V-0tyJU3JnE7yUbA","https://scontent.fsdu2-1.fna.fbcdn.net/v/t1.0-0/p526x296/51010831_2038199406272767_6489982062869610496_n.jpg?_nc_cat=101&_nc_oc=AQmTuWcD0VUalXTROqvCoX2nIvFY-pyBSRklbWvS3RoOoExpnkZZApg41P0hsUUn5dY&_nc_ht=scontent.fsdu2-1.fna&oh=115487af8b168ef168459c972a6b6c7c&oe=5E395031","undefined","8",""
