url,posttime,text,crawled_time,attachment_link,attachment_img,attachment_img_alt,attachment_title,attachment_brief
"https://www.facebook.com/kaidongwithkat/posts/2202990383127001","1558299120","薩爾斯堡下了好多天的雨，這個週末是個大晴天！貓兒和朋友＆工作夥伴們趁著天晴小聚，大家一人帶一道菜慶祝五月份的壽星生日快樂。

 This weekend the weather got better again, so some friends and I had a lovely
birthday party in the garden. Everyone brought a dish, which was a nice idea,
because this way we could taste various foods from different kitchens. #奧地利 
#薩爾斯堡 #生活日記 #開動with貓 #Austria #Salzburg #KaidongWithKat","1571048607","/kaidongwithkat/photos/pcb.2202990383127001/2202990083127031/?type=3&__tn__=HH-R&eid=ARB3Rwgt-dDdaLqCZZFz7FuLHAJ8r-Kz1Z0eJcofvq_bHCaXd5bGkWjYULMW_p2x1VeeRzMPTgncnRlz&__xts__%5B0%5D=68.ARCLFv3YRntj1MVkGUhb9HxdiQPtBW6hCJkwUOa1zipQsfwQAqg6KYPjljeRlpuhyGYToLJcJ1oEcET0vxzPTOu_K8i5dMGTjQ6K-csTxTrMcBp3Jt6e_Fy_38z89J_EKh9Z3JFLiPbYJkS1slZmXS09X-CbudMQewqBJrUPLizu87Pas5ynAXqMMXlrNV38eCD0in21IgfwMi5pbKG7JRK3YgwWRlUcv-vIr9REZZG5Bjrq_wYg6X6yUWwsQyq200wcuu24gLMY03kJwMWoa96Ju_zzhHC1qJ26CfegucQmYj8zXcFMbXZwNod2-AgvQknRadq8zL6s6BDfgKwelXSy6w","https://scontent-sjc3-1.xx.fbcdn.net/v/t1.0-0/p235x350/60640768_2202990093127030_466224231898677248_n.jpg?_nc_cat=111&_nc_oc=AQlkR1KDSdjJNYcmjtgEk2IPKn114RrizaZx5x-9VISmAI9XIvRTzUoveMUCIpLaZBs&_nc_ht=scontent-sjc3-1.xx&oh=4f6944c424bb64b225325e015034c991&oe=5E244CD8","undefined","",""
"https://www.facebook.com/kaidongwithkat/posts/2029719067120801","1548192009","冬季裡賞雪泡湯♨️是開心的小確幸！在德國南部-巴伐利亞境內，國王湖附近的{Rupertus Therme羅伯特溫泉會館} 是貓兒很愛的泡湯所在處。

 
它四周環阿爾卑斯山，室外的湯池有按摩水療、水流旋轉池。室內有兒童池、家庭池、冷熱湯、乾濕蒸氣浴(三溫暖)、健身房。餐廳＆休息區應有盡有！幽靜又美麗的泡湯處完全可以消磨一整日，夏秋室外還能野餐…每次來這心情是一整個放鬆！約三兩好友賞雪泡湯
❤️開心。

 In the cold winter, it is really nice to soak in a hot spring. There is a
famous thermal bath in the southern part of Germany - Bavaria, and near Salzburg
city (Austria), called Rupertus Therme. It is surrounded by the Alps and the
outdoor pool has a massage spa and a water flow rotating pool. My friends and I
enjoyed the relaxing time at this thermal spa. Swimming in the warm water is so
cozy, especially on a snowy winter day! ＃國王湖附近的溫泉會館 #德國南部 #巴伐利亞 #羅伯特溫泉 #開動with貓 
#Germany #RupertusTherme #BadReichenhall #KaidongWithKat","1571048607","/kaidongwithkat/photos/pcb.2029719067120801/2029714143787960/?type=3&__tn__=HH-R&eid=ARD5Kv5jNeSotW86-DsdnTBNrF_6zbhtgPdkawuqRRYCzoEboUrrNG_43ynVHufgul2e0UGXAbD_AYy1&__xts__%5B0%5D=68.ARBHWGpfrnjYNkhMNV-kNZSVtml-B5p1ct8AJtr83LNmZ411tq926eov9i1TC1AU2hNn_lA8laTWlks5pDoP5GTOPWVIfIB2m2ksyiCpOHYpM7eR75Cfwln0O9Kqxpif2CcCw1aGikd5bbKQ2qTJh4YuzwRSOV9LJN1H9Bhit_TYdvpPwZQNiwuid8a1Exz17vNahamc7PNrnU_RFMEgVlDSh2eFDsktZ0IHAvxWTDvAPfzCwlav-QtwjIwky8tGA5xrlIWhGDRGQzdHB1s9YnHDSNCXxXoE6ERQ_DMfw0-fFhe71Ce-ZCRQQnOphEZ_pVkwxQRoBDAPWaRXR-rPkc936JmYihGer1JKCyA7N7foXUWs--MxBtdZM6bmm5YQ2OTco37AvabXojp_R0FisRvAadE0Bb6J8dR5ALHmRyb07Mg","https://scontent.fpnh4-1.fna.fbcdn.net/v/t1.0-0/p526x296/50740914_2029714150454626_3167305000867069952_n.jpg?_nc_cat=110&_nc_oc=AQk0QkaT0QExr8NUlqY8Odwia4bmKtnfKEos4jSWzpYxlhKJRrUXUmeq9agd7goLKFw&_nc_ht=scontent.fpnh4-1.fna&oh=8e568d141e148e0856028acc9ab49ce6&oe=5E391F8D","undefined","7",""
"https://www.facebook.com/kaidongwithkat/posts/1858761687549874","1537046347","[16. Sep. 2018 貓兒小苑日記 Kat's garden diary]

 
秋天是收成的季節，今年蘋果的產量好棒！櫻貓家小苑裡除了普通品種，這次瑞士品種的紅心蘋果也長得很好哩，雖然成熟了但是他的果肉比一般蘋果酸許多，通常櫻媽媽都把它做成蘋果泥或蘋果醬，慢慢吃保存更久。
當然也可以拿它來烤蘋果蛋糕或其他點心囉！

 Autumn is the season for apple harvesting. This summer was very hot, so even
the rare red-fleshed apple (Redlove) had a big harvest! Redlove apple is more
sour than the normal apples, therefore Sakura mama used them to make lots of
delicious jam! #奧地利 #生活日記 #開動with貓 #餐桌日記 #薩爾斯堡 #Austria #Salzburg 
#KaidongWithKat #gardening","1571048607","/kaidongwithkat/photos/pcb.1858761687549874/1858761254216584/?type=3&__tn__=HH-R&eid=ARDFZQiKYHiQZXqVhoYmk3_el8peyvx_vso856wwxWDBuWR3yHcLR2qTZU2NLt5k77-KWjXYZ2-OT_S2&__xts__%5B0%5D=68.ARB39aauDmoX95sLDdw5YXSqK5LkLHSfmMUwd3icHQVTv4-7XkJzROMH3uC2h7-zofbHRTxKHra0Z26_XfKyrfMlQVFDfEPmZZJ6E_KFB_mSLUIeS0i0wYceU0kdzae-APib1jTKJY89MqIJeqU9Qg1bKIH5OQUoW3XjOvJ9PnAcpw0MfEVULSEXmS9RAFmMeNr5PC-on7h3lF9aFzdo5Vo5JhsPfW5feG1a7PHWhiodxV1M3Ag0pWpwW_FX1WCMy_d05HuQ6HaB9bKpcdrLZ-BMdTK3U0VQweccvA963uySckwppdo5iJ1bGrh6hVplavNI1Fr1q4S58agnNNRb0E31lg","https://scontent-dfw5-2.xx.fbcdn.net/v/t1.0-0/s552x414/41804979_1858761267549916_7778606770045321216_n.jpg?_nc_cat=108&_nc_oc=AQlPi86_a0L2iMe4Fa3N8u2FIBUKmpm3YZYxiLaQrWnzUUIELKgeNuEe6HARvZI8dVs&_nc_ht=scontent-dfw5-2.xx&oh=d7a8d1afb595ac8623562d1b36f7ca3e&oe=5E2F0577","undefined","3",""
"https://www.facebook.com/kaidongwithkat/posts/1720578194701558","1528926436","[14. Jun. 2018 貓貓的微日記 Kat's mini diary]

 輕旅行維也納的日子裡，貓兒下榻在維也納總火車站附近的商旅。驚豔它的乾淨度，加上房間附有五臟俱全的小廚房！連洗碗機、烤箱、微波爐，應有盡有好貼心唷❤️
真是太方便了！就在火車站旁邊(公車、地鐵、輕軌處)，交通超級方便。房價划算，非常非常滿意😊

 During my short stay in Vienna, I spent the night in a cozy hotel near the new
central railway station (Wien Hauptbahnhof). I booked a single business room
with an inner yard view. The room wasn't huge, but included a lovely
kitchenette! It was clean, comfortable and had a reasonable price! If you are
looking for a place in Vienna to stay overnight, I would recommend it! #奧地利 #維也納 
 #生活日記 #開動with貓 #餐桌日記 #旅宿 #Austria #Salzburg #KaidongWithKat #Wien #Vienna 
#hauptbahnhofwien #SmartmentsBusinessWien #Smartments","1571048607","/kaidongwithkat/photos/pcb.1720578194701558/1720580454701332/?type=3&__tn__=HH-R&eid=ARCd7dL5j2nh8TTbVLsZerGE3EgpVAiKzsH_ncp0samskOH3yKsfzrbzGxW0PRdph3BqOjPjHx6aGqaD&__xts__%5B0%5D=68.ARD0jYtvn4InW_fokLCYpS8kYzHWOxvKyi_I8-8aqObhbIJ3ogpsPg5KZEYGUuNDQtDa7K4hZ1uk9QyCCGANrBGGZ-zn2jnM_noYErTyt8jmycDx5cvHGTW-Vzdsqbv3Ddwj5nJ4mTcbgMBmfglcoDWXNzbTKkCjyX3O2RxQsVFMF8WJzQVffXto3H9rvJiXaT6ZpHWT6gnTqnySAbjoZBHt-FN16AdJG4VUufgSScHtXOMt8663wXkTcP9q6smHZoxdAD5bQ-ZEu122KxIrhrMgthXGHWf0R9vEARv6R5G8TfUjXxGHQNkR04BnRN2Q0a82jbMPLH7UKihI0gm07lG22JOoRZUQJqU0SmV-WHiZ_bRkJkZmXu15Q-uv9nHz06keJtQSPpD8L0ZbVTGG3IxFadAJl_cG4Co2V3gUI6EWQbs","https://scontent-frx5-1.xx.fbcdn.net/v/t1.0-0/p403x403/35244128_1720580458034665_5816500357286592512_n.jpg?_nc_cat=111&_nc_oc=AQm7NMet0GnR-x9iemJ1SollKkqJSv4KsTr8MIwhTJ2KD9k_JXJ6iClu9mViUHmz9Wk&_nc_ht=scontent-frx5-1.xx&oh=078dbce23bbf03ffacc661ea80f6324b&oe=5E1672A8","undefined","11",""
"https://www.facebook.com/kaidongwithkat/posts/1713839302042114","1528407477","[08. Jun. 2018 貓貓的微日記 Kat's mini diary]

 
其實...大城市裡貓兒最愛逛的是傳統市場，跟餐具＆家具店！感謝在維也納的當地私人伴遊“貓小妹”帶著貓貓到處闖蕩。納旭市場/中央市場(Naschmarkt)當然不能錯過，它最早起源於16世紀至今，既古老傳統又創新。鮮嫩的水果、蔬菜、肉類、起司，傳統奧地利食物＆異國料理應有盡有，此地是體驗人文生活的最好地方。逛得渾然忘我，走累了再去附近喝一杯日本人手製的抹茶冰沙，真是人生一大樂事也！

 I prefer shopping at the traditional markets to malls! Vienna Naschmarkt is the
central traditional market, which origins from 16th century. Here you can find
many food from different countries, lots of stalls and cozy restaurants. If you
want to know the living culture in Austria, you definitely shouldn't miss it! 
#奧地利 #維也納 #生活日記 #開動with貓 #餐桌日記 #Austria #Salzburg #KaidongWithKat #Wien #Vienna 
#Naschmarkt","1571048607","/kaidongwithkat/photos/pcb.1713839302042114/1713838752042169/?type=3&__tn__=HH-R&eid=ARDCulaZWgVYoB6j2OJ4Oabaz7rBC0DjYvt7yPBRX5kFRPBetEM_EgMxH_4Ze-LuODpZ-CIkLcFxOdBy&__xts__%5B0%5D=68.ARBVTERPe2jp-KFKvg_xjbJqH60hXD-CCuCGsJZOcatQ9DAJQ0MMg5g7s9mAkE3Ai1K5gEOG05ZfwchjTpFaPqZd81jWO3JhOV5HoeEp4_WYGFg-ZzluqNJ-DMA5_Ko91qBbcNZti9dCt25f1D3WbrM1o5_vcdS7sjg5M5PgzhPwH_D7rfKrWjuHZuEqQ49_R2oomTgvib0orI_3oZ513dY2-w7UZTM0VC-QuB6nGJu92JrxW09N073BHcLMeeEzMCFJwhKeidv59b8wan-e1AXd4jkrcvTJgd5QMFu6SqLIBl3Cas6LAeAgOsMdvJ_6E9pMIyuNBaTCeGfPw4HRqFRreA","https://scontent.fdac18-1.fna.fbcdn.net/v/t1.0-0/s526x395/34794208_1713838755375502_7805470141214359552_n.jpg?_nc_cat=110&_nc_oc=AQmacTIt13kEHPAb59jYgBdqI2DziihSSdMT1pTpZWsSJ91ON2WTJm1X5G4TOdj0EmQ&_nc_ht=scontent.fdac18-1.fna&oh=27ec7b5d2f5db33b7820f159d6c4feb7&oe=5E29BBF3","undefined","5",""
"https://www.facebook.com/kaidongwithkat/posts/2069184786507562","1550522739","我們家對『吃的決心』好執著啊，肯定是被貓爸遺傳到吃貨基因！很想念香草奶昔的味道(小時候的回憶)
可惜奧地利的M速食沒賣奶昔，放眼薩爾斯堡老城附近只有隔壁德國才賣。決定乾脆去國王湖買奶昔＆散步！

 
但人算不如天算...到了國王湖除了大群遊客，更多來滑雪的家庭，整個停車場大爆滿！繞了兩三圈找不到能夠落腳的地方，只好往反方向開到3公里以外的『國王湖小學』停車場。然後再走回湖畔的M速食店買朝思暮想的香草奶昔
➡️來回總共步行7公里路😱
就為一杯奶昔！整趟折騰下來走這麼多路，也把奶昔的熱量消耗光了。下次想喝自己做好了，忍不住想說：在歐洲生活很多時候只有雙手最可靠...想吃靠自己💪😂👊

 Last Sunday we went to Königssee to buy a milkshake. Haha! Austrian McDonald's
restaurants sell no milkshakes, but we can find them in Germany. It was a very
sunny day, not only tourists but also many skiers came to this area. Everywhere
it was full of people, and there was no parking place for us. I had to drive
back to the Königssee primary school for parking. So, just for a milkshake, we
walked more than 7 km in total. Next time I will make the milkshake by myself at
home! #德國 #國王湖 #生活日記 #開動with貓 #Germany #Königssee #KaidongWithKat","1571048607","/kaidongwithkat/photos/pcb.2069184786507562/2069180756507965/?type=3&__tn__=HH-R&eid=ARDN8FG48_NwwTVsvNPSXhBZH4KqI5iMN16er595pWFnijcWjiRYgxUy01T88gNqovGElrwULLa4Sb6c&__xts__%5B0%5D=68.ARDqLwT_zWN9PEsLA5bJoy_QYG4_1iUMSpOVBnCwS4ZUErP1n2VxXdcH9w49j-kr2GeLFX8AgfL3aZUp_Nrjj1hoNYskd8GULN69VcBKLHuWagQ0RFQVy4B02eOwvt21tgpO9IiT3qOZnNEIZkNf5Nj1ECC5UswZxKvBsShKbe7YZLAmcLVdZZj-eieoijdipeykfemQdblErks1xCLQsZnLcJsEx-qkXwKKFpWeVyq-QUM0oq8jrVBD8cPxo6d1WjTq4MrqRvZgRs6GVLprxScFmtW-UGCQl_U7PCttwzunQNSjtojwWuJaFUNC8Qh82dE7NWTnURSP3CyR3ZYmJrBW4Q","https://scontent-gig2-1.xx.fbcdn.net/v/t1.0-0/p526x296/53039189_2069180763174631_6069139258579353600_n.jpg?_nc_cat=101&_nc_oc=AQkifOaRWt9fFM91ug0fn_HKTxke8IedtS4_N7JytXrzVAPimEb4MmzcxAPHKTZDWnM&_nc_ht=scontent-gig2-1.xx&oh=144ff8ef9ad8f83d61308a03c83a08bf&oe=5E1FD97B","undefined","6",""
"https://www.facebook.com/kaidongwithkat/posts/1986252748134100","[Error]: TypeError: Cannot read property 'attribs' of undefined","","1571048607","undefined","undefined","undefined","undefined","undefined"
"https://www.facebook.com/kaidongwithkat/posts/2284436941649011","1562279677","進入七月囉...炎炎夏日天氣好熱，貓而最近很喜歡躲在樹蔭的地方乘涼。下班後約同事去附近的大公園Hellbrunn
Palace海布倫皇宮花園一起散步＆喝咖啡。最棒的位置就是在樹蔭下的咖啡廳。聽著鳥鳴、閒話家常，再來一杯咖啡冰淇淋❤️太完美哩！

 PS:海布倫皇宮後花園『惡作劇噴泉』是夏季玩水的好地方😉真善美電影裡的小玻璃屋在正殿停車場進園側門旁邊📷正是劇迷們拍照留念處。

 In July it's getting very hot, so I prefer to stay in a cool place such as in
the shadow of a tree. Hellbrunn palace has many old trees, therefore, after work
my friend and I went there to have an ice coffee, and to get rid of the heat on
a hot summer day! 

 Hellbrunn palace is popular because of its magical water fountains and the
Sound of Music pavilion. If you'd ask me to recommend a beautiful place in
Salzburg for a nice summer trip, I would recommend you this place! #奧地利 #薩爾斯堡 
#生活日記 #開動with貓 #Austria #Salzburg #KaidongWithKat","1571048607","/kaidongwithkat/photos/pcb.2284436941649011/2284433091649396/?type=3&__tn__=HH-R&eid=ARBs_i_D01hiyP-3L5cY9OSQ8Ej5R86JEklyfx2rYNL7IIECBLHBIuGIRX_7OdbjGKS5ML4FWbSPbFZv&__xts__%5B0%5D=68.ARCsByi6xTGULA1XXb7tT0Q6c3AxvmmCQjI78unxe0OrH8dVkGmgVBrXy23lRcSF8L2Y9_3ITCaGhOf-sCWdOioQhX1bja-a-dH6cx_v-RpDkatoPw0olp--3OD9uhtWD8u_lmB9guxhqeNbaXOEmbfObzfI8K5H4z13TeECGWJ9UigscgGCufmsIgNkq8U4yNq6ujKFaltee_iLSzgbmpB_9xM3wWKRmKpGM_P93vLfKYCvFWEWMbLbdDxqMov2Ev6aRVVnZAj6N5qA20A8sxi_wthq6VdyYlJ5SqQA1iAdAXXBivkSnWraPcsOL1EboEeC3crPnmAfAXEg2aDnush1Og","https://scontent.fpnh1-1.fna.fbcdn.net/v/t1.0-0/p526x296/65976418_2284433094982729_4770648719466954752_n.jpg?_nc_cat=108&_nc_oc=AQnDgnwiI-YU7bVj7IggPnlNiujSzKgLp7KKFD0_tMDRJ8WjOUeNH9Y1QIXutsONc54&_nc_ht=scontent.fpnh1-1.fna&oh=d0987a8fd51a94c576522efefd7dbc20&oe=5E202B23","undefined","",""
"https://www.facebook.com/kaidongwithkat/posts/2318570601568978","1563923141","山上風光好⛰️
貓媽＆貓兒兩人自駕去一趟Innsbruck茵斯布魯克，這個地方最有名的就是美麗的阿爾卑斯山脈。趁著夏天的好天氣搭乘纜車上“北山Nordkette”散步健行，俯瞰老城市
❤️呼吸新鮮空氣活動筋骨！

 We drove to Innsbruck and visited the beautiful Nordkette mountain. Summer is
hot in the city, but on mountains it was still a bit cold! We enjoyed the fresh
air and the coolish temperature there a lot. It was a very nice trip! #奧地利 
#茵斯布魯克 #旅遊日記 #生活日記 #開動with貓 #Austria #Innsbruck #KaidongWithKat #trip","1571048607","/kaidongwithkat/photos/pcb.2318570601568978/2318567328235972/?type=3&__tn__=HH-R&eid=ARADJe9BndZuGgV22CZpI22vUs0Wjx5d6QYrlIJ6vBMknRiGTgvoehfKGeM0XwKbhDbJqAuWFbhj9vpc&__xts__%5B0%5D=68.ARDWqY8QVODjHge-SM7Kd2wdDtHmkAycElu0blVg1ysAZdje-gWwPFHP1nYWvugETK7cYr4CiCVfpp5oZHFr2J-9vHbWoVCJ_Q3n3klgjdWIPuBntpwh6QwS8urPNJZp0pNQce1f6MT3dKL6IlUnqHKfnIkNiWtd7zxY16rs6t_Vc_aQJzqFLhpCx_iBU5P-vpMDnRSZUrQbiQCnU0lxYqg8xyQ8ulSWfGtwSUIVB3SY6RBlneQzBIlFzGV1kdkx-fzPx_feKK4970JtypDEERJoOdwgMzb8_vkSpJDFRC1Jb4GZiD54zSfki_SeUKxFYWzClPEGyoI2ogfiW7j9tPtccQ","https://scontent-yyz1-1.xx.fbcdn.net/v/t1.0-0/p526x296/67261724_2318567331569305_8640671358495227904_n.jpg?_nc_cat=108&_nc_oc=AQl9RpHxFp1rmoRoiE0-6tsj2W2Cs7OS3sV7exicee6gU1Brwzm2cRE0wR39mc4I2D0&_nc_ht=scontent-yyz1-1.xx&oh=f790e1250adca21dca464ba19d7d4692&oe=5E2590E2","undefined","7",""
"https://www.facebook.com/kaidongwithkat/posts/2008709869221721","1546894953","高第Antoni Gaudí把聖家堂 La Sagrada Família 設計成『加泰隆尼亞現代主義風格』聖經故事雕刻在教堂外觀上。而內殿樸實宛如一座白色森林
🌲柱子是樹幹，拱頂為樹葉，藉著開枝散葉的樹枝撐起整座空間，中間穿插著花朵的圖案。核心空間設計貫徹「大自然即是結構」的原理。
.
陽光穿透彩繪玻璃，將五彩的光影投映在乳白大理石牆上，光線讓整個巨大的建築富有生命力！完全符合聖經『神就是愛，神就是光』的理念。教堂的設計象徵『光線＆大自然＆生命』緊密結合
❤️如此壯觀的景象攘我覺得人類好渺小，教堂裡當時Ave Maria(聖母頌)悠揚響起，令人沈醉其中！樸實與華麗同時出現在這幢巨作裡～除了震撼仍是震撼啊！
.
The Sagrada Familia church was designed by Antoni Gaudí. He was inspired by
nature, light and colours. Outside of the building, the various architectural
sculptures are originally Christian symbols, taken from the Holy Bible. Each of
the 18 towers has a special meaning. The 12 towers on the 3 façades represent
the 12 Apostles, the middle tower is the symbol for Jesus Christ, and around it
are four towers representing the Gospels. Finally, the lower tower is dedicated
to the Virgin Mary.

 Inside the church, Gaudí planned a harmonious lighting for the visitors to
self-contemplate. All the columns are symbolising wood and forest. When daylight
comes through the colourful glasses into the church, it creates a wonderful
atmosphere for introspection. Gaudí was a genius - his church is such a
breathtaking architecture! #西班牙 #巴賽隆納 #加泰隆尼亞 #伊比利亞半島 #旅遊日記 #生活日記 #開動with貓 #Spain 
 #Barcelona #Catalonia #IberianPeninsula #trip #KaidongWithKat","1571048607","/kaidongwithkat/photos/pcb.2008709869221721/2008706985888676/?type=3&__tn__=HH-R&eid=ARBApcFV_dNvpzs8Kxj8yE8sQRixUvZyBl6cbLmwbJD1OehMKixH4H6rAXiuQLc85SP-hd7YvV6WIcot&__xts__%5B0%5D=68.ARDTD39s1w0jY1-ugX_ittfdLZV_x0qDqQsA7_0NqPJ8fYDeZkAB4l_u7jacUi-BU1bPIZ7Tnd2J_04XBpvovwI2-fsZgLUKBeJI9sfmLjlZrWlXzhgcH2a7qXKmlXSqjRrc3LgIdJUHZcAI_MRCGdV1CdI98lrnKEZRkgwRgFvubZgCuDMNboN329vCUOVo_KqTvStKvYs4s2Cjk0U6HJr7mBQq_67Y-6s0RGgqdxgARWOHZMmnXgLI0pgfCwlflCGx-5RJrKeo_EyTrwrEJsokqGRHWCZD3TyDO9eoaqCEQTz_wM_TYg3Y6U0HosoULJpYoEQ4bnz6k0bPiMvJCLINoOGGWG6qinG90cDYBD7T-cjmdKeekp_WkhZArw4fttO1EPrx8__zmWNGiTmNKmthBhLn80FwFEK1UV91CYOBbSM","https://scontent-frt3-1.xx.fbcdn.net/v/t1.0-0/p403x403/49509383_2008706992555342_1145253059543171072_n.jpg?_nc_cat=103&_nc_oc=AQkfN247p-Gb3mcVTob6o0ZxqKJAbiGSuf0YCjb5nrxT9Qb7D6LqH_dYlrbN7OgbaMM&_nc_ht=scontent-frt3-1.xx&oh=548fe66d4103cc3879cd3da9000d3a3c&oe=5E236DBB","undefined","11",""
"https://www.facebook.com/kaidongwithkat/posts/1867502800009096","1537713121","親愛的貓友『中秋快樂』❤️
最近好久沒有寫廚房日記！貓貓趁著空閒時間在廚房裡玩起“包月餅”的遊戲(在歐洲想找到好吃的月餅真困難...只好靠雙手)。這次做的是紅豆沙鹹蛋黃口味，Mr.櫻指定他的不要蛋黃。剛烤出來的月餅好香唷，整個廚房都是甜甜的味道，熱呼呼趕快咬一口
😽祝中秋快樂＆闔家團圓！

 Dear friends, I wish you a happy Mid-Autumn Festival (moon festival)! This
afternoon was my first time trying to bake moon cakes. I stuffed them with red
bean paste and salted eggs! The results made me very happy, as they turned out
better than I thought! Yummy! #奧地利 #生活日記 #開動with貓 #餐桌日記 #薩爾斯堡 #Austria #Salzburg 
 #KaidongWithKat #cooking","1571048607","/kaidongwithkat/photos/pcb.1867502800009096/1867502366675806/?type=3&__tn__=HH-R&eid=ARADlC-U_kOVzWWHDxM-phLjDnb6PvCCrkGaQcatyZCPh_MTs5WR9Zn1RliYSkqtkfs1vRdi4OnVvtJ_&__xts__%5B0%5D=68.ARC-j0TUSrK7aHVj3IJqDMHnaNJgRL5MJZEAx4hdS54mKanOJ72NlCF8yRdLTzNRjgWcy5qITyUb2pB0gEXGuaZ6EHEaDWLb60zbcVurNi3wjaGHl5VTfFHMyaaqYb8g9pnFzUpGGkf-cUPL_dheqTYyLumARw0JZcWqs2-T2uS0pnvaxs4V2qik7LV27kc4wPKyTnwlcHFVQJ-0Nw6457Px8dGgMj1K0FmcY0Eh3hg4sXD4S9bP1WTGt2u0ODSpQwOSrHxM9jEVd6DJ-7IiGnC3Lz26D5YnOjXrLGrC793cSFl12KuDiwYoR0K390Kyfkx98xkicjL1fON8qS5V84NDHQ","https://scontent.fdac24-1.fna.fbcdn.net/v/t1.0-0/p235x350/42431253_1867502373342472_8429985238188294144_n.jpg?_nc_cat=106&_nc_oc=AQkRaWM-8XsrFg7vA4XMysUQFd5js7tP-atlD1CcsCuqdoNo9WKU9FKm9PHdpLtJ-0A&_nc_ht=scontent.fdac24-1.fna&oh=5dd5c46380c43bdcb757001e353f098b&oe=5E62B86F","undefined","3",""
"https://www.facebook.com/kaidongwithkat/posts/1865518880207488","1537564857","[22. Sep. 2018 貓貓的微日記 Kat's mini diary] 

 楚格峰山腳下的Grainau格萊瑙小鎮民風純樸。它給貓貓的感覺是安靜而與世無爭💞
好喜歡這樣祥和的氣氛。黃昏太陽暖暖的照在阿爾卑斯山脈，讓人無法相信同一日的下午楚格峰山頂遭受強烈冰雹、大雨、颳風打雷的景象。我們在小鎮散步，已經能夠感受一絲絲初秋的氣息！太陽下山，溫度迅速降低許多，傍晚在旅館附近散步一大圈就回房休息了。

 We spent one night in Grainau, which is a lovely small town near Zugspitze! In
the evening we had a walk in the countryside. It was very peaceful and we really
enjoyed this calm atmosphere. #德國 #巴伐利亞州 #生活日記 #開動with貓 #楚格峰 #格萊瑙 #遊記 #Germany 
#Bavaria #KaidongWithKat #Zugspitze #Grainau","1571048607","/kaidongwithkat/photos/pcb.1865518880207488/1865515903541119/?type=3&__tn__=HH-R&eid=ARBicneGPHtEsXoMArgrjv9bWqeinIOMSo7ysDMlcJU8xa031B2seczJdQrR4yvYos9ZDaHlSOnkNxxX&__xts__%5B0%5D=68.ARB2FL8pBIO5hyUshwsTjkIxAemh8gN2lj0k77CNBBUINQoho01ib8lZxKgVpVMX6tmyz-YoiwS4rXDbUIbUXqp0TemQvDafzB580LWWNsml30kJBoZ80lGc8fPSvF_RC43ch-gBqslqopMSIj6uBii7C1z1Vy4TzhXepOEeXBFvmeNYRgl4hKf8C7RESyV_Sn05us8CJZQ266JNIect3kXeeF6nWaFpjatfjE2NQ6FTq1zJN18rV_oWhcSrtNZdJPeyJGVBxEuiYyhp02FtIa-tPROSMFIAX6wvgemXe5cHUhYNOhqeNUBaWPFIIQdn5P8mDbI-MOTJ-a7hMw68z8nAjg","https://scontent.fsof3-1.fna.fbcdn.net/v/t1.0-0/p526x296/42256904_1865515910207785_522691498379051008_n.jpg?_nc_cat=107&_nc_oc=AQn6VgMn5YtTQqNoNb1nMPIGPv2EuPEvTKrkt2MGnTx8iWsu6QNhSnyR6ioGduw2cLs&_nc_ht=scontent.fsof3-1.fna&oh=5659205ef65c105405b9bfa1a04af871&oe=5E1CC4D5","undefined","5",""
"https://www.facebook.com/kaidongwithkat/posts/2314718698620835","1563746401","歐洲熱浪來襲！天氣越熱，櫻家小苑的花兒開的越茂盛❤️
顏色豔麗，讓整個園子變得生氣蓬勃。溫帶夏天最美的時刻就是六、七、八月這100天左右了。貓兒每年定期努力用眼睛與相機把小苑的各個角落記錄起來。

 The hotter the weather is, the better the flowers are growing. In central
Europe, main blooming season is in June, July, and August. Every year during
this time I enjoy taking lots of photos in Sakura family garden! #奧地利 #薩爾斯堡 
#小苑日記 #生活日記 #開動with貓 #Austria #Salzburg #KaidongWithKat #gardening","1571048608","/kaidongwithkat/photos/pcb.2314718698620835/2314713071954731/?type=3&__tn__=HH-R&eid=ARBzszAwPmeOc01X5LR-4C37szB07SDavevETDhPWuQt3jQ7d6fQEqAi_i7wpWVs2mlVOhWlWRYH8m8y&__xts__%5B0%5D=68.ARDTYMplqb3iPRZns4jrDMiaLnCAp3sE2Cn1KHHrd4X3abpZMKaSM1asrUq_y5_YDF1rjwX6IRWzewNdkmJ-o6HJWehLbw4vzQLnx4_0gDaxM_C5XZthSsc5aXdgf9kDWwjPBFHP1jOFSe1kQyrt50GzBN0-fFMCWNsdPbC2LQzK4S2MX81wZkyK9UKceZFvmnatRpqUuH230564vUhOUZwVY1vyz2CfNaFZcXy_hWv69IKf0CQCQDOcLHa9CuxW9906zVUeKxlLugOtQlmLN0IEbH-L0UrSfj9B6dhwyReU9rK13BfUR1kHicXFw7JCUWelebD_tMLh5dogGNO0L605Tg","https://scontent.fiev24-1.fna.fbcdn.net/v/t1.0-0/p526x296/67143403_2314713078621397_3460435943293452288_n.jpg?_nc_cat=100&_nc_oc=AQm3drYDiuS9u9tnx-z1gGxkmh9EOdaMKk3QS9PFG5SiG4CtlEBWGPKqBxiu-VcioxE&_nc_ht=scontent.fiev24-1.fna&oh=c00e888540a4ed2402f835ec3e4b078c&oe=5E20AEC2","undefined","3",""
"https://www.facebook.com/kaidongwithkat/posts/1998255810267127","1546271603","轉眼邁入2019年，祝福各位貓友們新的一年幸福健康＆願望實現😽😽😽飛吻～諸🐷
事大吉！這次貓兒把餐桌佈置的紅通通，充滿過新年的氣氛，公公婆婆阿公阿嬤來我們家團聚，餐桌燒烤好吃又好玩呢！

 This time our dining table was decorated in red for celebrating grandfather's
birthday and new year! We had a very nice time cooking table BBQ together, it
was lots of fun! Happy birthday to Sakura Opa and happy new year to everyone! 
#奧地利 #薩爾斯堡 #餐桌日記 #生活日記 #開動with貓 #Austria #Salzburg #KaidongWithKat #cooking","1571048608","/kaidongwithkat/photos/pcb.1998255810267127/1998254903600551/?type=3&__tn__=HH-R&eid=ARBSTk-G9vw02e1yqy20_4kNvoP3Yhu3bLxKDNZR7RVGI024aF61CguTgHDuAxrd6SCSDXnWLNEur2dM&__xts__%5B0%5D=68.ARCvglxjYm7IhFhb7LRDrMyMUC8mnT1-ESUHCtV6frNPCO5ctuJEdaoWoGTL4898g6tqjAnwYNSjHz6rZZijEhp9IQVaXBeyjku5Vj50mWVDV2pK5UvnYKCAIkWtSxVOpuSOIMUMCkaO7ojjpI61VuTsvGtjuukaLirBeC26t01A0Yx2tbplUY-EaJnuCwt7zoxr_HQI0EV7D0LovTAzai2T_ql8TQOm8Q9MnD6q-KZHas-zDjH7ASzJVyqoiSYkJwfVC5T1nh0yMkZBdoRIiDfhLa_xniI0gAFMjn_uf0s1VDRS83mRjwa2JoIKjl1gJElFZJi4htlgUhMFALp541HWvw","https://scontent.fgyn6-1.fna.fbcdn.net/v/t1.0-0/p403x403/49540947_1998254906933884_8434067742042095616_n.jpg?_nc_cat=104&_nc_oc=AQnsnM4wMAe0ohWrTT8QrTYIleKpkyIx1rHWgLQfjBubnkcS7BtETiaMVdhxEXNrli0&_nc_ht=scontent.fgyn6-1.fna&oh=97d7d7e2ccc5557773954aefe252788e&oe=5E34FFB5","undefined","5",""
