url,posttime,text,crawled_time,attachment_link,attachment_img,attachment_img_alt,attachment_title,attachment_brief
"https://www.facebook.com/klgpolice/posts/3218196321553761","1567578350","失智老翁醫院迷途，警查詢比對身分助返家

 基隆市警察局第四分局安樂派出所巡佐楊智勝、警員林暘於108年9月2日21時許獲報，有位疑似失智老翁在轄內某醫療院所內遊蕩，請警方到場協助處理。
員警到場發現老翁一臉茫然地在醫院大廳遊蕩，遂上前關懷詢問，惟老翁身上無任何證件，且對於員警提問亦無法應答，一旁熱心民眾向員警表示，老翁係搭乘公車來到安樂路二段後，詢問路人醫院方向，再由熱心路人帶領其進入醫院，惟到達醫院後老翁卻說不出來意欲為何，接著一直在醫院大廳漫無目標地四處遊蕩。楊員、林員了解情形後，便將老翁帶返派出所，透過人臉辨識系統比對，終得知楊姓老翁(約72歲)身分，連繫家屬後即以巡邏車載送老翁安全返回住處。家屬見老翁平安返家，頻頻感謝員警熱心協助，並稱老翁患有智能障礙疾病，時常趁著家人不注意獨自外出，家人也困擾不已。
第四分局呼籲民眾應多關心家中長者，如有類似情形，可替家中長者申請防走失手鍊，手鍊上編號可快速查詢出走失者身份通知聯絡人，亦可透過電話110告知手鍊上編號，警方可立即聯絡家屬，後續協助安全護送返家。","1571403511","/klgpolice/photos/pcb.3218196321553761/3218196208220439/?type=3&__tn__=HH-R&eid=ARB3_CzuKsNklXzY2he-3odojfZUoqgvxTUQ6cZ8NCeNDsZz_v2RdJFW7hrNJEBFi6NfuBmbsG4cjnj8&__xts__%5B0%5D=68.ARCZ17IYOrazf3cR6ZvK-Frc0mMDwhdLthvrf3RIojX-9CaKSlzwaTfKNf9r5VDlac5VWwSS9DWEjUFnUF1aqYaY-f6IOohVGbmtCL3O9tNjWCecKTm3A0KtglW-vCU-qgd3M-ncXNpcKVSEnpOyn5xYJZd5luSjUnXG8GsNz0hXT9-m8M4QhHmiVIp9Ojha3PVV1Z_JddpTcYISyyX8eRCZqQhmqeKtNW6Hgcy1GqARpgmxXcsD3JUjvBbznebdtBLQaHVyLreLFiIIF4UUuRMQ2ElUtoVPqFTJANxnMuAT4VLgAyhQMslJfn3iOUNiLWFmmS-RB_trIvLZtoweYj3kYA","https://scontent.fcgk13-1.fna.fbcdn.net/v/t1.0-9/s851x315/69552582_3218196214887105_5144286311300988928_n.jpg?_nc_cat=104&_nc_oc=AQk_Ly0-HkpytSQvixutYVB8lHd3XG0PalrnzoiQZHD4a29X2WHSrQMKtSld5-P4xoc&_nc_ht=scontent.fcgk13-1.fna&oh=b5054f4e07006414e526f01ccf6c46d4&oe=5E5F86C8","undefined","",""
"https://www.facebook.com/klgpolice/posts/3316289615077764","1570608168","鸚鵡遭風吹離家 基警助與飼主相認

 
基隆市警察局第三分局七堵派出所於108年10月05日19時45分許，接獲民眾報案稱於七堵區河堤散步時拾獲一隻鸚鵡。員警立即查看鸚鵡身上特徵，並查詢轄內近期有無報稱鸚鵡不見之紀錄。
經了解發現該鸚鵡有配戴腳環，看似有人飼養，員警陳呂威細心查看該鸚鵡花色等特徵，發現該鸚鵡品種為鳳梨小太陽，經查本轄近期無人報稱鸚鵡遺失，故記錄鸚鵡腳環編號，無意間發現飼主聯絡電話，通知飼主前來確認。飼主到場表示該鸚鵡為一手養大，此品種之鸚鵡極為親人，感情相當深厚。該鸚鵡因颱風天遭狂風吹離家，幸警方熱心協助，才能讓鸚鵡儘速返回熟悉的家。
基隆市警察局第三分局呼籲：為防止寵物不見意外發生，希望飼主養成好習慣，飼養貓狗幫寵物植入晶片或其他小動物身上配掛腳環或掛牌等物，並標記聯繫方式，是保護自己也是愛護寵物的最好表現，飼主別為省小錢因小失大，可於寵物以便尋獲時能立即聯繫飼主前來確認。","1571403511","/klgpolice/photos/pcb.3316289615077764/3316289448411114/?type=3&__tn__=HH-R&eid=ARD3mVx88-GQd4mUkUjGq1x5uB0VEoItg_sHJUiJEa_mJplhXR7KaubJl8Ug5oKtYkSBDeloMfKkrQi7&__xts__%5B0%5D=68.ARAbavDFpfkNjzawg8g-62Z4Y_0O6LFSBDWSntY3-guTnUKuC4wKw_1-YdxVavUw31ZCrbYJYmyQKntQj3UfYYzwJmxleoFVSRbXgGLOTxTJhjhvjioA8UseKZ6emnTcNsN-u0oa6gwB1OJjVkw50NQx9UdXkivqv1m3ehUcueGvKOejayS3CzBpbRNpJazNMvHqBJdn1DRmVwtFcuAUUhmQZD4aFuwshCNebZqVR3ZRMTp93vj5M6EBMvM18PHWeM53oiXthl89DFn6VAt_owL-3M2CYj8zLjTEWlpg5AWCIrJ0-FFmUlCke0DgYfC27soIGJHMdFRpEmTgqMdhMUb6og","https://scontent-sin6-2.xx.fbcdn.net/v/t1.0-0/p350x350/73046865_3316289451744447_6528835754368434176_n.jpg?_nc_cat=105&_nc_oc=AQm_NosbRvJHBXbFkQdd0_I1CRSPiSJcbRiXIQ-Tr0-6FdUZD2SSM4eGVSr5ODT9d3E&_nc_ht=scontent-sin6-2.xx&oh=b70b8c950e700ca0adb62c87b1070faf&oe=5E63858F","undefined","",""
"https://www.facebook.com/klgpolice/posts/3218375068202553","1567585593","","1571403511","/kcpb110/photos/pcb.1415793055238590/1415792071905355/?type=3&__tn__=HH-R&eid=ARASVjRudRuQYYAR2w5QaJTQ6H0oeABojlAwI3swNUb2SuGLItnpoPJejh_3owUhvFsMveO8spKKZlwX&__xts__%5B0%5D=68.ARAN69zoJSJLYa7JmLvICRO2-HRfRklb6xCkF0iaAgb3Kcr-OKA15ytXkKX8PaAVoCsLtVgfn7e59FI83AlCuMsN0qapG03RyEQ2ZC55jMu8LQTx1d-obWOoCoNpaAMFeyuC0vQGvOAPCraRDFM1u9iBzGnK13WNrQJZsZOuTFelLhS2Q6v9VQ2MFf2c4Ma6zxR63PCFuhkQfBFLYVPZxjjlkVWmnmStTc9wftVbqdRANB7pog4GP0yQt7dMhgALGpbx2__8v25-z1x9K-_N8FfHNd3PDsG82LLHBlGXVuwzVBEr3QoPE1t24iv8H5m2oHD5U8ZrouSv4SvHNvrbxOFeC8WUaLlajQYfgvOKTPWbvSgr2C7tBahL4ZlJ2rgLdGjhAYemyFKyDqifxbbDVp--Do5GnLs0bDoC0SavBTbK0vNzAQobcEjRWUZFsH3xo307XzeWk9VaNSCzSCEVQoLO0flfQAprRI3gcA-AZ5PiztxyjmHzQagV","https://scontent.fcgk6-1.fna.fbcdn.net/v/t1.0-0/p235x350/69573062_1415792075238688_7933055048139931648_n.jpg?_nc_cat=101&_nc_oc=AQmmQtrnpddCQ8dVIZ1aaieSAW2-aOecgiGBT_8X0BjuDGBepBKsgzhFzIFVAg_cxuo&_nc_ht=scontent.fcgk6-1.fna&oh=33f7051f4486eddab20b0cf0575547d0&oe=5E5F2498","undefined","5",""
"https://www.facebook.com/klgpolice/posts/3193903093983084","1566804627","【基平隧道】限速50~飆速192km/h！嚴重超速~遭罰24000 

 
本（108）年8月13日，一輛白色自小客車於夜間19時許，行經基平隧道（基隆端）5K+120M處，遭基隆市警察局測速拍照，時速達192公里，該處限速50km/h，計超速142公里，嚴重影響行車安全，警方開出一張24000元的罰單。
基隆市警察局表示：依目前裝設之數位式測速儀器，夜間亦具有紅外線偵測功能，超速違規行為將無所遁形，切勿心存僥倖；如有超速之違規行為，依據「道路交通管理處罰條例」，超速60公里以上者，將依級距處以罰鍰，最高可處新臺幣24,000元，並吊扣汽車牌照3個月，若因而肇事者，將吊銷其駕駛執照；並再次呼籲民眾開車依速限規定行車，以免荷包失血，共同守護安全駕駛信念。","1571403512","/klgpolice/photos/pcb.3193903093983084/3193903027316424/?type=3&__tn__=HH-R&eid=ARAMvFd5NNhEClwp7g7_5XLXaDiOS2HnUDNsLZC8GEDUgkksMGO4dpbTE78zNldv_bQlP7c3S2L2rn_e&__xts__%5B0%5D=68.ARDiNTA8e6jm20wVJADDEKerl3Njj-ARRV4MOhvv0HJjKmFQMHnmv2hbnfSKtmlqoGZAsKfm9dy-drJc9dhz9OYzaZd-f8wYSO3sj_lXovpH3ei0u4R9dtj3Yz60lvCLeD1MNsaaCRpETP3xGibfOEmkxROvWwG_qa8joJ1QR0i9d8FFNKUrXhcGd4tecF3BnzpZQxRYlKoE5-1_2ITpDUXPlJvZDKr1Wu13y0j5llNMVtNTDai3Svl1_fzDjtgLkEvYuNiu1R4xSgtt5o5jLGqB4FeFYubz6ehYEN-WvaiDwwJOeG__gndutJn0ooKFrPHtsv1s8Wc6X9yjc5Em4rfAnQ","https://scontent-sin2-2.xx.fbcdn.net/v/t1.0-0/s526x296/69237358_3193903030649757_4668435232330874880_n.jpg?_nc_cat=109&_nc_oc=AQmePc0MycG4KTlqw7XKE2vGGB_PrQDkIPcw-fgB-cW59Qs02yoXRlUiDazKDxvF23U&_nc_ht=scontent-sin2-2.xx&oh=95fd1049249381335f321a159bfbfe16&oe=5E2CD24D","undefined","",""
"https://www.facebook.com/klgpolice/posts/3217600504946676","1567556746","基警刑大開講 校園宣導反毒、反詐騙
暑假結束各級學校已陸續開學，新的學年度開始，為灌輸高中新鮮人正確法治觀念及強化預防意識。基隆市警察局刑警大隊特受邀於9月3日前往國立基隆高中宣講，利用學生集會時間，向在場學生宣導，推廣新世代反毒及反詐騙策略，並與在場師生們共同宣誓反霸凌。

 
刑警大隊宣導團隊以活潑生動的口吻，向在場學生說明新興毒品的各種態樣，現場還拿出毒品咖啡包外包裝樣式，向同學們說明現今毒品最新的型態，並提醒同學們吸毒將帶來對身心的危害，提醒學生千萬不要受同儕引誘嘗試。另外指導同學如何破解詐騙，以關鍵詞分辨詐騙手法，尤其針對高中同學常接觸的遊戲點數、網(購)拍交易陷阱等詐騙案例進行破解說明，期透過實際案例直接與學生的互動，將正確預防毒品、防制詐騙觀念植入學生心中，最後在有獎徵答時，同學們熱烈回應問題，讓現場歡笑聲不斷。

 
刑事警察大隊呼籲，學生應專注於學業，摒棄不良嗜好，以健康的方式釋放壓力，從事正當休閒活動，勿讓毒品危害了一生；另外若遇有疑似詐騙手法，可撥165反詐騙諮詢專線查詢。","1571403512","/klgpolice/photos/pcb.3217600504946676/3217600264946700/?type=3&__tn__=HH-R&eid=ARDO-CeAsIZPxWMfYY08KJTekYFTBJ3Oz2i6KMhQfSohDb_L6MAZe4BviliGyklXzti_ShnpG1JF3xHm&__xts__%5B0%5D=68.ARB5M6rKGeo5W5DqP82hyR6pCFPYiHVr56CxGR6aQ8rOlygfGri9b1g2l2wmxCruoZqnML1iIc467Cn2nxAabbK_CuOFvVRmGN7x9CUWxz8rI9LEpUgLJKHZcI6gTCDAZghh0ykUIpDlZsEmOgDXpNTDZjLZPBuukw72usAJ0pcN03OaaggUYiss3VZrVO_2-2LOBVpzUFGo3ZIMFKOdlG2LgR6NFAs-oAV9-aKyAm3ce7pzMTxMeLSJa5K61NBWvKaVaOi6rQ3bOqHNsamU8LuCq5GwNbMims4d8wHMwrLeHCzwrPgTrJQLLuHj_JAm9Mx5kr-X41YZMBbfIornubD-vw","https://scontent-lga3-1.xx.fbcdn.net/v/t1.0-0/s600x600/70171819_3217600271613366_968855050434641920_n.jpg?_nc_cat=109&_nc_oc=AQnY3LxG6uRq1y8FQEaT9UzFnbpTUjg1e9KGaobGRZF2Jfa8gOIOe5_W7ln9KA7B3NXKJDOmRFqPNN1KfFxOhgdc&_nc_ht=scontent-lga3-1.xx&oh=53a59a61a74163f2d9c947dbe68d707a&oe=5E1AFB78","undefined","",""
"https://www.facebook.com/klgpolice/posts/3275454282494631","1569373095","「我迷路了想要回家」 基警協助失智老婦與家人團聚

 
基隆市警察局第三分局七堵派出所於108年9月24日18時許發現一名楊姓老婦人於明德一路上徘徊，巡邏員警發現老婦人手足無措、語意不清，立即請老婦人至所休息並核對身分。
警方發現老婦人於街道上徘徊，眼神流露出內心緊張情緒，立即請其至所休息，所長張畯盛耐心安撫其情緒，經詢問老婦人表示迷路了想要回家，幸其身上攜帶證件，警員李盈萱立刻核對身分以便聯繫家屬。
經查老婦人身分，發現兒子當天下午遍尋不著母親時，已至當地派出所通報失蹤，警方透過通報紀錄順利連絡上老婦人兒子，其至所表示母親患有輕微失智症，接獲員警告知母親於當天內尋獲的消息非常感激，也因為警方積極協助，讓老婦人能儘快與家人團聚。
基隆市警察局第三分局呼籲：為防止失智人員走失發生意外，以便協助走失老人或有走失之虞者協尋，基隆市政府社會處老人福利科有提供防走失防銹金屬手環之服務。家中如有失智長者，平常應多加注意其生活作息及出入場所，防止走失意外發生。","1571403512","/klgpolice/photos/pcb.3275454282494631/3275454135827979/?type=3&__tn__=HH-R&eid=ARAT76WdSdJf-dAv6tt-1B36p3sPXWJGjUAWZnfe7NUy8sKNuhI0Qpf6actb1DEeUthdv67XlJiC1t_C&__xts__%5B0%5D=68.ARCXHApWb9ubxxlzzHmTa5COEKULvJN49p9j_g8sUq2I8epf-uF0-quz4AqXeVfL6BhpwUGLk78lmCxL_YlZ5H2Oi5Mjjzm_o15lBFTQWm5xJI4aoUg6piVvCwllLlotrs64zkrP97p5aM8cJHfS2R1UZuKCUkgM0ny8SH5O2USRBaWdCV_cXYtiv5z9__RHyVqo7A7dtb9PceJXraEw0QZeTZ2Z0S0UWeX87q6mxymOEh7f_KVdJPRFHzaytxXgVNgMhn0aJ8Ar64P6sJOvq0K8I4ewn-lWs8hOHy-xz_n1gkmTCt2cDlqVRi-9tjVVF4AwA_eTR1Xa_OU64GMJho_dKQ","https://scontent.fdac70-1.fna.fbcdn.net/v/t1.0-0/s526x395/70751973_3275454142494645_768813697333198848_n.jpg?_nc_cat=108&_nc_oc=AQl6X5L20QDCf4xoOn9ro7lp3yvEdcQxR_8Ux7yd1XJYgI8dw9YQpCynKjx1jbeL438&_nc_ht=scontent.fdac70-1.fna&oh=aaebd79d255eb229f553860b6ed8ecbc&oe=5E28D673","undefined","",""
"https://www.facebook.com/klgpolice/posts/3243382045701855","1568373398","反毒進校園 家長看得見

 七堵長興國小於9月11日19時許舉辦家長會，基隆市警察局第三分局七堵派出所所長藉此機會與家長互動宣導犯罪預防。

 除了在各項校園活動中直接向青少年解釋常見毒品態樣與毒害外，所長也透過此次家長會，精心製作投影片向關心孩子成長的家長們宣導，讓家長對於毒品有更進一步的認識。

 青少年成長過程，除了學校老師的指導外，最重要的便是家庭教育，第三分局積極參與學校活動，重視青少年身心健康，讓不少家長直呼太用心了。","1571403512","/klgpolice/photos/pcb.3243382045701855/3243381762368550/?type=3&__tn__=HH-R&eid=ARD1T8mvoUYR_Yjs-m-s54fVFKMq3P6wd9BLfOGtnShcOJk1DBp1FhsPeef0p9p4l32X2sxW1Ra2Xx5n&__xts__%5B0%5D=68.ARCbxziClFwfccFGzduBJI-7dk6afUO95f5CwwAJXEEgP8ZK70kThSep_IuDtydVrbqe-5MQ6MTRnX9qfUhfod8kmjfbNvBFvqPCo86LLP7DYX2gS6MNSLv4UGP0jLprauSohCF3XOBLFVlWSVkdZMnIpbPjmhiZhUtGMO0f2RUbpoIZRkzxcrGjFthjTcXdX4vVGebgV34zqZTp4yWKNjqAdVOEkvRxRKqWdNmgG1_6HxizP92OFtO1wq6hH13SWM3wSRINhe08niq_qdXMTHlwSiZrdEE2iR3Wb4DAfuKGUnwqDL55aw812pofgek7NoousPStnAvUMyGR7rCFNqm96g","https://scontent-sin2-2.xx.fbcdn.net/v/t1.0-0/p526x296/70183948_3243381765701883_1785963816765358080_n.jpg?_nc_cat=107&_nc_oc=AQkgWgJ68eCNgh_EBmBs-BM9yS5urJ-PmWbJpKDGqWCWpGH6L-OmW53fYKQjl-7jEXk&_nc_ht=scontent-sin2-2.xx&oh=ca98827a59afe4e2b191c6e4c425c81b&oe=5E2598E2","undefined","Mais 3",""
"https://www.facebook.com/klgpolice/posts/3310476308992428","[Error]: TypeError: Cannot read property 'attribs' of undefined","","1571403512","undefined","undefined","undefined","undefined","undefined"
"https://www.facebook.com/klgpolice/posts/3309718639068195","1570405984","檢警聯合掃街宣導 反對賄選人人有責

 因應「第15任總統、副總統選舉」暨「第10屆立法委員選舉」即將來臨，全國參選概況熱烈，基隆市警察局第三分局與基隆地檢署聯合舉辦「i幸福--檢舉賄選
人人有責」反賄選掃街活動，走入轄內大街小巷掃街宣導。

 
反賄選掃街宣導團從第三分局集合出發，持宣導布條及標語沿明德一路、至七堵區「南興市場」及暖暖區「源遠市場」等處進行宣導掃街，並發放反賄選宣導品，向民眾解說檢舉賄選能有檢舉獎金、對於檢舉人身分一律保密，使民眾放心。

 
第三分局與基隆地檢署共同呼籲民眾勇於檢舉，杜絕賄選，除可獲得檢舉獎金，並可端正選風，還給社會一個乾淨的選舉環境。向候選人呼籲以服務換取選票，並加強反賄選宣導。查賄單靠檢察官及司法警察的力量，是艱難且不容易達成任務的，必須結合民眾的力量，如有相關賄選情資請隨時撥打「02-24558843」檢舉電話。","1571403512","/klgpolice/photos/pcb.3309718639068195/3309718562401536/?type=3&__tn__=HH-R&eid=ARAoiCHkQwrbY0yN72W1KZ7mfo6PxFzVvZjruFl84xgFIiL2_q9VApNqoqnk1_SMGXxXyXbZfg5n9toX&__xts__%5B0%5D=68.ARAVhA-J24PrrlddYAbws8TP9JtyBBZ1VQS1h8BjZP_nLfGGmysEWUiOwM9SuauEbdFLTzWMdhIkQKfrb0Odbrol8J5HkwN0foGa9dJnD_VNKg4IXx9ErmtnObUPeDFnnsKhinRNb8SBFs9Qb5xVLe3h5Np1stmDtG-2gFTMv7APOmoch7YkNIcizKu04ruig0yuHmevY7d_80M_FCyj6Kz42Bmx756A5EPCd_Y3mSGgnnS6VuA7ySUKTfAFGOyxL0jNIajwh3g1UBYczNGnxMiqFU8AXq8syO9MRikoVMsFoI5gNlMlfbHy-W1hxENi9QZuc4RZUe1T_0VFg9aU1axLYw","https://scontent.fcau11-1.fna.fbcdn.net/v/t1.0-0/p403x403/71477246_3309718565734869_6805668747605442560_n.jpg?_nc_cat=108&_nc_oc=AQlvc_aoI2PyJMguTvaxsk_3IaX2Z70RtzuL3LALdimARjqYj8AD-Un-YXzCDjz1Zmg&_nc_ht=scontent.fcau11-1.fna&oh=3cc4ec228b13d51fb0efa531721d7aca&oe=5E173C9B","undefined","",""
"https://www.facebook.com/klgpolice/posts/3301760703197322","1570179781","行員機警通報警民合作成功阻詐

 
基隆市警察局第二分局信義派出所警員盧政綱於108年10月1日接獲中國信託基隆分行通報：有一名劉姓男子向陳姓行員表示欲匯款美金321.74元至國外帳戶，行員驚覺有異，遂報案請警方到場協助。經盧員了解，劉男表示透過朋友介紹投資外幣，欲匯款美金321.74元至指定帳戶；陳姓行員擔心劉男遭受詐騙，立即通報警方前來協助，經盧員及陳姓行員苦口婆心勸導劉男，並告知此為近期詐騙手法，劉男才驚覺自己遭到詐騙；劉男十分感激警方及行員主動積極關心及阻詐行為，避免錢財損失。
第二分局呼籲：反詐騙為全民共識，警力有限、民力無窮，警方除了加強轄區居民反詐騙宣導外，亦需要各金融機構行員對於民眾之異常匯款多加關懷詢問，共同為民眾的荷包把關。","1571403512","/klgpolice/photos/pcb.3301760703197322/3301760566530669/?type=3&__tn__=HH-R&eid=ARAqwyIqgdyrQpzaV8JkGIjzXQvHAwEOavkP6ODtGdc1dNl9b1_vQAQHBTEpK0uTB2Zo7wOQCGuMwQhU&__xts__%5B0%5D=68.ARBGxxrUwnTIwd_AqE4V6z4ZSmVIDC8usYEDUGl6fzT9Wkwug-VfWvQpa_WueyntYeowJlsphF_3amdbwF_y-VkTJrkOOJA2rWJRRzcBOrxrQixwDMD-Rb3UIUkOSTqUpDwTk5JrbQAR61yjGjuc-A_2yXkW2Yr9z87QC53jiXnJHWage9aBMAX65TAJRoc3XdPyx4O26ZeD2G3V_y7M3NB0qI2gxkJF3gm4gffPu4Cc0kIb55q0DoOGWuJXECB5Gm3Ki_QKrczIcjQKb2D39j-0dV7QAhNaNSv0GpEk-yRUOaDwF0Yts2JA5bjLDMu8RqBHw8drrhIyVsvo7nZWNq_ySQ","https://scontent-cdt1-1.xx.fbcdn.net/v/t1.0-0/p235x350/71586068_3301760569864002_1564336305926569984_n.jpg?_nc_cat=111&_nc_oc=AQkROTidyz6ASBWu1q7Ec2GDoZuRE79yoFxx-4Vphgzz_zZ59wRlW9lLmfJ9tDNBFuA&_nc_ht=scontent-cdt1-1.xx&oh=2fa1aeeffcfbdee7ae1461ca26a0f375&oe=5E614633","undefined","",""
"https://www.facebook.com/klgpolice/posts/3275451589161567","1569373013","里民大會三分局同參與，社區治安有保障

 
基隆市七堵區瑪東里於108年9月24日15時30分舉辦瑪東里民大會，里長李文良邀集地方各級民代、市政府單位代表及基隆市警察局第三分局瑪陵派出所與會，會中與里民意見交流，共同討論社區治安、交通等問題。
所長張文得除逐一向里民回覆所提出的各項議題外，也透過此次里民大會向與會60多位里民作反詐騙及防竊盜宣導，讓里民清楚認識最新詐騙手法、預防詐騙應變方式、侵入住宅竊盜態樣與宣導守望相助的重要，內容活潑生動及結合案例解說。
會議結束後，許多里民讚揚警方一直以來對里內治安及交通工作的付出，警力有限、民力無窮，期盼大家發揮守望相助的精神，共同為社區治安、交通努力。","1571403513","/klgpolice/photos/pcb.3275451589161567/3275451449161581/?type=3&__tn__=HH-R&eid=ARCVvWjkyO3P4P211870kR7KqI-audmr4B6BNgnDZX9uI0P_ybFLT-VeQtkeVRhwwpK-WI5KlmVpdAIU&__xts__%5B0%5D=68.ARBEgOZNptJbycws9LT36oQYbktb6Ar4rGNciK9LLPm9QuzNGIqzwVaOJ395NIbZRcrOYTRUviTfQuE9sRraly-OXUbA7kS2rE7bR0OTu1v04VK7zAyz8zPo6nalb4CFpbXDQeRDRpu4-n9xZaTUE9ZEv-9lkMytwdGVmuIlkiiUss-CkSpjehEVqd8ruo5HXd3juFcHYZ3JEpwmLg0NwhcFVhMF973mKEIvxc3o0dpXw6rPtfKwwd17YEx_bP1FLCNK9Cn__ximOoKE-k0B_XKNJHf90D2ivma1n0fMYuCPqRZjEv57jyv1RoalIYNCJFd9W508YFwstJSq0EzSb0aOvQ","https://scontent-cdt1-1.xx.fbcdn.net/v/t1.0-0/p526x296/70866739_3275451455828247_8950814825294856192_n.jpg?_nc_cat=111&_nc_oc=AQm7ZE9HUdmC-O2wbYZtzmPQiYj0Sw6SppsZF-nbZwhtI81CCN-8xaHmpMMzEOTT3AE&_nc_ht=scontent-cdt1-1.xx&oh=cab34da783b143fbe495c6664f9a0cd8&oe=5E16FFA3","undefined","",""
"https://www.facebook.com/klgpolice/posts/3253317844708275","1568689900","不一樣的下午茶，警副局長撂English來開港！

 基隆是臺灣最知名的harbor（港都），郵輪搭載世界各國的觀光客絡繹不絕造訪，因為國際化，使得英文能力倍顯重要，因此，基隆市警察局的Deputy
Commissioner副局長黃勝智特別在108年9月16日在First Precinct(第一分局)舉辦English afternoon
tea(英語下午茶），與同仁一邊享用咖啡、蛋糕，一邊分享methods of learning
English(學習英語的方法)，度過了一個濃濃英文風的下午茶時光！

 黃副局長強調同仁可以試著自我安排short-term English
programs(短期英語課程）,根據自己所能負荷的難易度進行學習，例如聽西洋歌曲、閱讀或朗讀英語詩選、參加自己有興趣的英語研討會，或是找個夥伴一起大膽開口說英文，按部就班地操練語言，短時間內一定能獲得rewards
(回饋)。

 對English Learning(英語學習)也非常熱衷的第一分局分局長婁子才，也與同仁分享自己one of his dreams(夢想之一),
就是希望能把英語學好，雖屢屢遭受挫敗，但仍勇於分享自己過去學習英語的經驗，期許每個同仁在學習英語都能有所突破。

 這場不一樣的英文聊天下午茶會，勾起了同仁學習語言的興趣，談笑風生與學習經驗分享中，大家收穫滿滿，期待下次English下午茶會。","1571403513","/klgpolice/photos/pcb.3253317844708275/3253317474708312/?type=3&__tn__=HH-R&eid=ARCj1uqe2Y4I15vnQSQzcG-e4PlTq1K_Nj4-k5ISVisj3iL8NZVmu1Efb7fJKRE0ZF-3uEWbM19DZwpR&__xts__%5B0%5D=68.ARAvywq0sCPG-RbfkThLFtJQDEjVn-Rq6j9s4BJ1tf1c0ElzZEKgvCL6CG9-YNwWvA6_d4SSTHMgU8xv1Cib7ev7la2ki_kpNkYa0_tUEfXDsXYht3Jnv_3pu7MB4LlCboCmffO8r6G1O0Q2ffWj59FG1RQdZJD8DTj9AVKD3o-9oO4c8xemcrt-fg15KPeB7k-FzM_mujLcLI9sNnsnMBUlTHP1McQZpMYjNacX_gIInk8ai7J9RNfqGtyogKTvBMmyqAXa6FWFC-wNFJtjZ2k3YP4TqLLK4bk0vn9F919tA0Mt8ZAXOegiMOkhzP8r0OQEApzP-4uvHiDOdPh_lm26zg","https://scontent-sin6-1.xx.fbcdn.net/v/t1.0-0/p526x296/71306410_3253317481374978_7557884822996123648_n.jpg?_nc_cat=110&_nc_oc=AQlW7WzdiCFpi1LcwmP6QDZGRA6pM5qNq2D4uoUlNkLg5AxLNrUPWBQWsTWNic_5Ipo&_nc_ht=scontent-sin6-1.xx&oh=b6c08f4c34b480a64e5c0373dd59b724&oe=5E307C5B","undefined","3",""
"https://www.facebook.com/klgpolice/posts/3205147116192015","1567164150","刑警來宣講 網路安全及防詐騙不可不知道

 
近年來，社群網站與社交軟體的興起，即時、便利、多元互動的社群網站、社交軟體或即時通訊軟體，更是深受青少年喜愛。基隆市警察局刑警大隊今(30)日特別趁學校開學之際，前往基隆市立八斗高級中學，向全校同學宣導網路安全、反毒及防詐騙。
除了提醒學生面對網路資訊該有的停看聽外，也提醒學生設定社群網站或即時通訊軟體的「隱私設定」，使陌生人無法傳送訊息給你。此外，提高對網路資訊的警覺性，才能安全合宜地使用網路資訊。
演講過程中，講師以親切生動的口吻，提醒同學各類毒品的各種外貌，並提醒同學們吸毒將帶來對身心的危害，提醒學生千萬不要受同儕引誘嘗試。
本次防詐騙宣講有別於教條式的講座，結合有獎徵答，學生反應熱烈，踴躍回答。
基隆市警察局刑事警察大隊也向學生呼籲慎防詐騙陷阱，網路資訊也咬停看聽，學生應專注於學業，摒棄不良嗜好，從事正當休閒，遠離毒品危害。","1571403513","/klgpolice/photos/pcb.3205147116192015/3205146842858709/?type=3&__tn__=HH-R&eid=ARDB31VSBsp6gKW-dWM8G7yVF3j6_2eoQKEsY_zD2wMWsLoZnCOOOIvNlEFrnAo_VY1ntK0v6Ptwxh5V&__xts__%5B0%5D=68.ARCfYeb9Wcjs85EPB_7XPejdSB1JY_l_a67YmILs4oAG0CvruvfwYNjSJXXXTPzb0s1BOBQG2R1vAP6yKrDX-Ad3WFIuN5ICyssBwPuTCWUVg3VLlRYjtAX2qMm-8q3zM3O12WdN7_EhH-b8fE_zQXQynYJVKN3tQAIVEa6HYNKs2QONVKT7nAH6oydODHEHIriVERow-4qD5iKcMpEn-IjcMu7z7oPiMW7nUpM1N_84y4HcHnxoDFU05ptQbnFNOFMJBQmS_6Ue7KTTWYymtiuYjAu4UjG_j_0cW9ENbILWprK5u2jHX72acJKvbQQ4aHoPs-nvj2aGcq5PqyVf7R2GUA","https://scontent-hkg3-2.xx.fbcdn.net/v/t1.0-0/p526x296/69214231_3205146846192042_947723910122569728_n.jpg?_nc_cat=110&_nc_oc=AQmaoe5CWDiz5EnYdBVOCZfVms1eBANnKgzGmIwcEvtq21FaNQxaiR2WnMYncGEW0Mw&_nc_ht=scontent-hkg3-2.xx&oh=e22907cd7238768542200c5eb8fefe32&oe=5E20B876","undefined","3",""
"https://www.facebook.com/klgpolice/posts/3289871034386289","1569808761","連日降雨路樹倒塌
好緣警第一線維護民眾安全

 
近日受東北季風及米塔颱風外圍環流影響，基隆降雨不斷，基隆市警察局第二分局東光派出所警員巫宗威、黃暉霖於108年9月29日15時許巡邏行經本市信義區六合街時發現路樹倒塌，立即擺設交通錐、設置封鎖線，即時封閉受影響路段，防範用路人遭受危害，所幸現場無人員受傷、車輛受損。巫等2員隨後聯繫信義區公所前往清理現場倒塌之路樹，並通知附近車輛之車主儘速移置愛車，避免遭受波及。
第二分局呼籲：米塔颱風來襲期間注意防颱、避免外出，駕車民眾請注意行車安全，務必放慢車速，出門前亦可至警察廣播電台網站查詢最新即時路況，妥善規劃行程。","1571403513","/klgpolice/photos/pcb.3289871034386289/3289870837719642/?type=3&__tn__=HH-R&eid=ARD9kw8fodOnrWlxtuN8aI6zkSpxi6_HyWp5mH74Ow2ljBFRJHMLLGVrhdhrSKww9e59RkWj0aaFczT1&__xts__%5B0%5D=68.ARBnp336HAbJpswflnfBj7LcZtw7nZ_rrvvuwrWdNHPmyaUgCfOFXfV6eZ9Lw786bOWuO9NxWHGAD3Yy2sQOagJMAkt-gZMldznkIpQiPw087wfQHMG6rD9mfRZW7GRVa-uxDE2U7pBN4xDwaLAhINpwjvDRKWzjw-LYwMCuqe1578UIqftjs69-BzyaKmIVR2s4CdpP54UD5sEmvzA8U4CfVmxrhQ8OuZXv-mucEjT6qZrDS8c1n9mppA9ztMG_qaW_uwmfgv5N_vI6bsWaqiu_caJgmkspmG25gXeJyNTuV2JGzYtSuZXw6P92yJq8zNOSxcXdw-5VP8V6SkMtT7LkvA","https://scontent-sin6-2.xx.fbcdn.net/v/t1.0-0/s526x395/71524672_3289870841052975_4738807030230286336_n.jpg?_nc_cat=101&_nc_oc=AQmdL1XdK4MI1cc8xF2lFlZ1qKZpCw1uGB2_0Tp68LYELK73L66PFlsT5R103tgVgNs&_nc_ht=scontent-sin6-2.xx&oh=aab13a17a6fe49fcba078e4832e5bee4&oe=5E61BE13","undefined","2",""
