url,posttime,text,crawled_time,attachment_link,attachment_img,attachment_img_alt,attachment_title,attachment_brief
"https://www.facebook.com/klgpolice/posts/3205394606167266","1567171081","","1571403520","/watch/?ref=external&v=1309007779300872&__xts__%5B0%5D=68.ARBn0dSh1PpsqItzYjTzqaCAK8LxZy4bVLFf-KKXMZ5Vmx7_VaV6CYFEtccSqUDxBKJB8v7TdRezP7doOkd8HDKd3i7ltMCu_T75yMOdKYZj3CsVcRAFYkZLJSQu0w7fSqEvmmK_pbU2uC-NXqCfmI_qWDrqu-eDU2eFVZk8TLrk0y5eBWJBjpvZiYC7xKtVKodkvfYHt0qdcvUe17LMzO0NT6teqNxx8H4BYKra1Fcva0aMUglB2UEVdK8N_UijvkfKVt4oC6rpbU0vDAzmATH96RXAeQVbzsUZ2Tk7FNxH_VNnnpRzh0aMi3d0TAYurJAljuUY15JNc3yQqj-l3Rp4Utc8wC6Zu8W3p-Ep5ciAUPnIP9zBKI_r1-TgSvvnh6RGlIJoi1IFdGD9fmM8vO993bnNe3KEo8AfPYl9x8VthIUVV1RDb5E05hc9FMoFdkMI8qcXGqr6O7ATib8Cw6bxrl6KdjbHZR4K4L6CKEAH-giY0E235UA3tOmIT7FTcFgQ&__tn__=kFFHHH-R","https://scontent-sin6-2.xx.fbcdn.net/v/t15.5256-10/69297159_1309008849300765_7510355473653039104_n.jpg?_nc_cat=110&_nc_oc=AQmaJR0I2ss0SFfmdR28o3EkUJJg2r0yv_WJD5xWr8qdmwwkJJCIgspbxwSNBzRneZY&_nc_ht=scontent-sin6-2.xx&oh=e0a8609942ff146550b3e5216f818543&oe=5E1D86DD","undefined","【守法養成記】","Posted by KCPB局長室"
"https://www.facebook.com/klgpolice/posts/3220891697950890","1567665180","基副警長撂英文擔綱反人口販運宣導大使 海大外籍生：IMPRESSIVE

 
外籍學生因為對臺灣法令不熟稔，加上人生地不熟，極容易遭受剝削，成為人口販運被害人，或誤觸我國法令。而國立臺灣海洋大學每年均會招收來自世界各地的外籍生，有鑑於此，本局特別於108年9月3日，由副局長黃勝智親自帶隊，會同移民署基隆市服務站前往海洋大學，向新進外籍生進行法令宣導。

 
黃副局長一開始先以流利的英文，歡迎所有的外籍生加入基隆這個國際移民大家庭，並由外事員警介紹人口販運的三大類型：性剝削、勞力剝削、器官摘除，同時宣導外籍人士在臺打工須依法申請工作許可，並呼籲打工時應注意「工時或工作內容有無明顯不合理或違反契約」、「工資有無遭不當剋扣」、「是否遭強迫工作」，避免成為勞力剝削的被害人。

 
黃副局長並向在場外籍生表示，臺灣治安狀況良好，但若在臺人身安全遭受侵害，請撥打報案專線110，並將請轄區員警加強校園周邊巡邏，讓學生能安心在臺求學，活動中並進行有獎徵答活動，外籍學生踴躍舉手搶答，氣氛相當熱絡。

 外籍生們對於眼前親切的白髮長者竟然能用流利的英文與聽眾互動感到十分驚訝，紛紛表示「印象深刻（impressive）」，並對於臺灣警方的親民與熱忱表示讚許。

 
副局長黃勝智表示，自己38年前從學校畢業分發就是在基隆擔任外事巡官，此次懷抱著年輕時服務外國人的熱忱，前進校園與外籍生互動，自己也覺得很有感觸。並表示基隆市警察局未來會持續提供在臺外國人更優質的服務，讓他們能安心在臺生活。本次宣導就在海洋大學校長張清風致贈紀念品後，圓滿結束。","1571403520","/klgpolice/photos/pcb.3220891697950890/3220891551284238/?type=3&__tn__=HH-R&eid=ARCuehRQ7Z-5QRYpeNl2uS3Yx1ESFR-wSOxHpiyYNSPysw7qWptK5BBUnmDoAtuqpqgAUukLrguyOb2M&__xts__%5B0%5D=68.ARDsjt5itt-ymSPlbh0Oym0LtPiNy1CScVtaSzGU9h3ZiRTSN4wZr3-DXGQwdhx6G5y1P3XjVrRtJ_r-uv9GH-Gzr3UCsgLqSskz2s8oDCW6JGCjD9lSAGADPWd9FfiJvSML-RWK_P1MxK_Kx-PWBpoX-FVfTz1txO9yTkpaZiMIyPfPV4CU2li9FxWH2KcGGy-QKeRtNWMTJ7ZtsvM2MPXqk1ewRtBX3ghYd8CNqvXBiQ18sV0K2fo7Rtjqx0kKVxS6H4Pc2UG2CmcvTxomFTqPPdrvZ9DTnwOSSuyBukn4TCzMJnn1mBlvGYQQC1gYU70ALWMf2rToGN9zM1NHKHYOtg","https://scontent.fbom10-1.fna.fbcdn.net/v/t1.0-0/p526x296/69567558_3220891557950904_3859095026751504384_n.jpg?_nc_cat=103&_nc_oc=AQl_RcvbnlZL9ggib3iWyr16njPA-N2OekMUi4iwc33kA91TqsZAzFgKN1NfdrZJ8kk&_nc_ht=scontent.fbom10-1.fna&oh=8ae3a55e6fe7b92d5e1d562e36d986e9&oe=5E195B22","undefined","",""
"https://www.facebook.com/klgpolice/posts/3218193838220676","1567578262","網路購物陷阱多慎選平台保障多

 
近來網路購物十分盛行，詐騙集團也利用網路購物的特性來詐取民眾錢財，民眾往往在看見網購價格遠低於實體通路，加上又有明星代言的加持，便會立即匯款購買，但常常都是匯錢後收不到物品；甚至還有民眾在臉書不明賣場購物，下標後刷卡金額與頁面標示不符，金錢石沉大海，賠了金錢也拿不到商品；內政部警政署刑事局分析此類假網拍詐騙手法，歹徒通常利用時下最夯、標榜明星推薦的商品吸引民眾購買，然而當有民眾向其表示購買意願，歹徒都會誘導民眾透過FB或LINE等通訊軟體私下交易，等到買家將款項匯入指定戶頭後就已讀不回、封鎖帳號，消失無蹤了。

 
一名王姓被害人，在家中瀏覽臉書，看到一則吸睛的保養品廣告跳出，並標明為某知名藍姓女藝人公司研發及推薦之抗老護膚Au**la保養品，遂點入網頁查看，顯示該組產品特惠中，優惠價新臺幣(下同)1,200元，且提供新會員試用，於是王小姐立刻線上刷卡，卻收到銀行通知消費金額為5,520元，外加國外交易手續費83元，待其發覺異狀再度登入該網站時卻無法登錄，並在該知名藍姓女藝人臉書看到有人盜用渠名義販售商品訊息，才驚覺遇上詐騙。
基隆市警察局呼籲民眾於網路購物時，要慎選標示清楚、信譽良好的購物網站及賣家，因各大知名購物網站均有提供交易保障，切勿貪圖折扣而私下交易。選擇具有審核機制的拍賣網站購買較有保障，以免遭詐騙、求償無門。做好個人帳號保障，定期更新帳號密碼，啟用臉書雙重認證，以簡訊及電子郵件通知方式確認。
如有任何詐騙相關的問題，歡迎利用165反詐騙諮詢專線查證也希望大家多多加入165反詐騙宣導臉書粉絲團，讓大家都成為反詐騙的守門員。","1571403521","/klgpolice/photos/pcb.3218193838220676/3218193744887352/?type=3&__tn__=HH-R&eid=ARCw0PLIZvUO5xDrg6D2s-EGvb6c_6IjeF26iLEYGoIMMs29npHPRnVBtc2c2cxtjLutSNL_qHKJUbXi&__xts__%5B0%5D=68.ARCrXNJUwHBLdtAbBsHRdlTdItNorQ-yvVDOqejj4oWxbzZxTSdLDwsR-hBUhwrG-yokfnO_JDPKF0shhsXqhZSsS_fX8lgBZqC6E-j1eDMohanxxM4hG2_BfjoxzMSHHcclTWXLxA8KBZMHAvIaUQyJC7GznO87cCaPmdcAoYy9UE5GaqJwXc2b0BYQ6ONirtI7sE23dQ3Xt1CMFeAL4w47LhxWaitMLB92hLk3cmMP2o-q0Su-XgvdIpQhVpYOwCWrqxyJqL_jCMjWbJak3DfE6RJM6ZdwkSN56ZO_HIgOwBewPy6QnEmrEtyqL1YqFLaB_WYbj_Zsau2c8qGvY__zHg","https://scontent-lga3-1.xx.fbcdn.net/v/t1.0-0/s526x296/69623231_3218193758220684_6925785389303070720_n.jpg?_nc_cat=106&_nc_oc=AQkpTwyLijPrN9hE-_ceQPIIqVFIcMM6qgPzVp-WgXdgH4GwwUlUYKJ61LLIGlJwhyQ&_nc_ht=scontent-lga3-1.xx&oh=2d52b09572d3547c20f784797f1daf3f&oe=5E631B7C","undefined","",""
"https://www.facebook.com/klgpolice/posts/3206674279372632","1567209387","開學首日 友善校園宣誓活動暨加強預防犯罪宣導

 
8月30日為各級學校開學首日，本市配合友善校園政策，將所屬各級學校開學第1週定為「友善校園週」，營造安全、溫馨的學習環境，並透過多元的宣導活動，提升學生對於反毒、反霸凌的體認。為宣示本市營造友善校園之決心，於8月30日開學日13時假南榮國中，由林副市長主持「推動友善校園-反色情、反毒、反霸凌」宣誓活動。
少年警察隊與少年輔導委員會配合友善校園週巡迴於各校預防犯罪宣導，首站於8月30日下午應邀前往光隆家商實施「反毒、反霸凌」等宣導，介紹新興毒品常以咖啡包、糖果、梅片、果凍及郵票等型態偽裝，並提醒學子勿食用來路不明的食品，避免遭受毒害，結合教師、教育行政人員及警政單位的力量共同持續推動、落實防制毒品危害工作，營造快樂、健康、友善、重倫理、守法治的友善校園目標，讓孩子能在校園健康快樂的成長。","1571403521","/klgpolice/photos/pcb.3206674279372632/3206673856039341/?type=3&__tn__=HH-R&eid=ARAFHsSUfWGH3Jju6y2-Mnm5fx0U4wgRGF6uMnRtIbuWDNHRHJAmbTRiShxv0qcl5q-B51H3EyBUTpKZ&__xts__%5B0%5D=68.ARBrsoECoYDi4N1va--0UwbXsTdVxlsjqRQQgshpMu5MuPiYeTGI8sy6-yYhv9A91Q6OWi4wwBLDyJMkq8cxDWmgbwHU2b4v0Us38HMM-NZfWHHakD4-U2L6su5s8y6IDCK2JsY6YOoTMgEkcj6NXxk7-tJI82xrTlWkCvEJkf4UauUjukF8qDUFNl_cNc75t6ho4rPpCe5ECi36E5JxpnYgR9fM3IX34yAUDj9VeCXzU_4uwpihisDr541QzI2dutU4zPPZYImbryrK1PUXW7SCup0ZUF4ryXpY8Evul6XoDUeY9hVwB7XvrIzoMJ3CH_YlhbHPS9lzyU9dc6fgdIuVsg","https://scontent.flos5-1.fna.fbcdn.net/v/t1.0-0/p526x296/69481531_3206673859372674_3722619060781842432_n.jpg?_nc_cat=104&_nc_oc=AQnIvv9gCSrc4b68qZpHsapubZIuMLaiV73iB9nhT-Ama4NjhSEagOp85auzR7Pw2iw&_nc_ht=scontent.flos5-1.fna&oh=ecde4d0cb4e63ce843e4d67bd4166a9e&oe=5E1E9242","undefined","6",""
"https://www.facebook.com/klgpolice/posts/3204098159630244","1567126479","詐騙手法五花八門 警民成功阻詐

 基隆市警察局第三分局於8月28日9時許接獲周姓男子至派出所報案，疑似收到假帳單，七堵派出所警員李宗城獲報後立刻查證該帳單之真偽。

 
周男向警方告知此中華電信帳單有新臺幣18000元款項未繳款，惟其表示帳單均有準時繳納，詢問是否為詐騙手法。員警李宗城聽聞後立即向中華電信確認周民有無積欠之帳單，告知周男此為假帳單，切勿受騙。周男對於警方成功攔阻詐騙非常感激，也因為警方的積極協助，才未遭詐騙。

 第三分局呼籲，詐騙手法五花八門且日新月異，如接獲不明或可疑帳單請立即撥打110報案電話或165反詐騙電話，或就近前往派出所查證，切勿輕信繳款，以免財物損失。","1571403521","/klgpolice/photos/pcb.3204098159630244/3204098022963591/?type=3&__tn__=HH-R&eid=ARCzEKfh_bOmOZkCB5inzseuvEzCiPRnL3C6waotek0RV_f4rKsShnM5MC0WxWKyYS5_vj7G0kdtSBAW&__xts__%5B0%5D=68.ARAzCBbzfS0vckQ8gffH423wL6UiryjTyb741RoOyAZJO-9C09dk-WPJaSTVdIVyWG74O4oKfIusn3_jjgGpsaP_0GhLUOnum8fY8xwJCCbX6uI2gk92mSkugqaXZYuTvQH0CY8ezBssQJT3JSYtyPwObOaYTct_Clxq9bFz5kI1iEgOG2LDIzFfXMEZWfQvLz168t5j7KAyXeGdzB9Ni-4dmva45q2F5UUof__Mo1NApZa9hu5p3Qq4FLX1_0ureqKjMdsNnFL6pFr3cBWafsD2kIOZ0DsWb1r_N63iC52F9txP5lCYhzd_4WuismYoxg8fVei2Pb8Zk8XBV8PKjGh5lg","https://scontent-arn2-1.xx.fbcdn.net/v/t1.0-0/s261x260/69456251_3204098029630257_8423669536024166400_n.jpg?_nc_cat=110&_nc_oc=AQmfwGoMYb8d2i0citKD6D_dSrPHww0gIsWy0IuyNylb-W4fONDYgrHZS_Hncj-c2ps&_nc_ht=scontent-arn2-1.xx&oh=eccc24937e65c584f5da273c59db9d0b&oe=5E28834E","undefined","",""
"https://www.facebook.com/klgpolice/posts/3264947420211984","1569052533","「心手相廉」 公部門攜手打擊犯罪

 基隆市警局婦幼隊於108年9月21日配合財政部北區國稅局與財政部基隆關務署基隆關舉辦「拒絕私菸
心手相廉」預防犯罪宣導活動，女警同仁在現場設攤，親切溫暖的笑容，讓會場大小朋友們看了眼睛一亮，烙下深刻的印象。
本次活動於關務署的廣場舉辦，市警局婦幼隊卯足全力，希望喚起社會大眾對兒保之關懷、增進社會大眾對高風險家庭的認識(包括照顧者吸毒、酗酒、父母突然失業、隔代教養等高風險因素)及關懷意識，破除社會大眾對於別人家庭吵架、打罵，屬於家務事不用關心的消極觀念，鼓勵民眾多一份的警覺與關心，及時對高風險家庭伸出援手，避免這些家庭發生虐待孩子、殺子自殺等悲劇，建構居家安全的環境。
婦幼隊呼籲：若發現孩童未受妥適照顧(食衣住行育醫)或遭受到不法之侵害，請電話撥打113婦幼保護專線、110由社工及警方處理，即時通報即時救援，一起協助弱勢兒少渡過危機。","1571403521","/klgpolice/photos/pcb.3264947420211984/3264947093545350/?type=3&__tn__=HH-R&eid=ARCPG3AcM2fCPWkke6J4R7KsXm-dRbJGugBMuxV4sTttnmYtOkQ4DPtqx1qW48PB-ixwoDpjfv9yXzNJ&__xts__%5B0%5D=68.ARBKDgO55_ZgBOD7whK44F6JIB2rEf-hgP4NeCMV5-9KYqXapro9HmHuzrmJ0WZ007pGdCxsJtvQQSmeMzgGw4L2yZVJSkWaB1uCRwmXLB9duNfbroM5FKDIYtsue7wIX-dw0_bbAj0N-JPd77iTcEPXEdkfrqEwmj0kgB8dJocRryFwTg3BGwl1hcTX2KszOtz6UYah8nk-9Tb_z3wbws9rNGo5wIc1-Oct0250cdtFOiX8T_4dbuBx8kcBnUOlUeH5ENbK2114q3cQkQr2a1pkUHtLp3ZS6ItdV09irYh0FcCzi2kPovbWyjBMlk0K0CXJmvDjdDAGCv9NNleyNynNOw","https://scontent.frec31-1.fna.fbcdn.net/v/t1.0-0/p526x296/71674045_3264947096878683_5245185924991549440_n.jpg?_nc_cat=111&_nc_oc=AQmSv9aNWJ6K1Ny_Nz49iNlAFDZApCgtCCSXLWBWR1Mwtvite5oBLadptXUV5gpMDoA&_nc_ht=scontent.frec31-1.fna&oh=bec331dcb2936a2f5b1770d67a1b8769&oe=5E33AD89","undefined","2",""
"https://www.facebook.com/klgpolice/posts/3202023263171067","1567063307","警察後盾 警友會第三辦事處頒獎表揚績優員警

 
基隆市警察之友會第三辦事處為感謝基隆市警察局第三分局員警為地方治安平穩默默付出，藉由第三分局舉辦聯合勤前教育之機會，第三辦事處主任楊秀玉率領副主任邱國祥、曾憲章與顧問蘇益正特地到場與警參加聯合勤教，並頒發108年度5至7月績優員警獎勵金，分為刑案毒品個人績效、破獲重大或特殊案件與工作辛勞慰問3大類別，共計6個外勤單位、1個內勤單位，主管代表授獎。
第三分局分局長表示：警察工作十分辛勞，常日夜顛倒犧牲家庭與健康，全心投入在治安工作上，但這也是警察的工作、責任、使命，在投入工作之餘，幸好有警友會鼓勵與關懷，作同仁最有力之後盾，警察在工作上需要民眾的協助及支援，才能充分發揮維護社會治安的力量。
第三警友辦事處主任楊秀玉表示：感謝第三分局對於轄內治安工作之卓越表現，警友會長期支持警政工作不遺餘力，做為分局強而有力的後盾，也時常關心同仁勤務辛勞，第三辦事處將永遠支持第三分局，為警政工作共同努力！","1571403521","/klgpolice/photos/pcb.3202023263171067/3202023093171084/?type=3&__tn__=HH-R&eid=ARB822bXLM7TepHdliDcUFf74Y_kvf-_xPZYJ06ueYI5vashu-s5V_eU_J6Eo38MoI95OgyGrValv6nv&__xts__%5B0%5D=68.ARB-mFeNXIQeG4lA-nPQidsNxNh_vID_Aew6usC2cnUjj9UiFCDwKHT3pE60jxpDvdyo1X2uqOsIc_v2Fi2YVMiC5TgDzqRl8E6tmvLl7VbPZshm7xtjpdls5CemBP2y9Twcrsw4eXX3H6tUMjE3lHKOMFIMZHX8jJFyZ0HehlLD_Z_rPBTcFgkd0LXOELGB7kMnDkB9mjnf63LBiKDG8ZErebnGZ_2XyJBmh8wUqyu-f8YFmgpysjyU_iGEoUn4L2lx7V7j2u7KIdCr7mP-p2foCyi_fY5QNkdNb_AZ3FrDjqotCcYmwaATLPfWadam2mewLkFKdKjb_AUtGwPmYCWWQQ","https://scontent.flim5-1.fna.fbcdn.net/v/t1.0-0/p526x296/69321371_3202023103171083_5320968471150854144_n.jpg?_nc_cat=110&_nc_oc=AQlHp6DM_QOY5oC4K8x6eeRdHaq9YSX8oLcZT1PG3hC1Hk50mrHxyVweYmKh7Dj1qFc&_nc_ht=scontent.flim5-1.fna&oh=fae23122f4b806ee065b9021a898214b&oe=5E5D67C9","undefined","",""
"https://www.facebook.com/klgpolice/posts/3243378562368870","1568373302","基警三分局提前中秋慶團圓

 基隆市警察局第三分局（11）下午舉行戶外（動態）主管會報，結合提前慶中秋以烤肉方式舉辦。
中秋假期，許多警察人員仍需堅守崗位，維護社會治安及交通，基隆市第三分局特地於中秋節前夕，舉辦烤肉活動連繫同仁間彼此情感，過程中同仁熱烈高歌，抒解平日工作壓力，也讓無法返鄉堅守工作崗位同仁，有個溫暖的中秋節氣氛。
分局長也感謝各位同仁平日默默付出與辛勞，使分局各項警察工作推行順遂，期望在第三分局這大家庭有個美好中秋回憶，而舉辦這次活動，更期望在中秋佳節連續假期中，能提供廣大市民更好的服務。","1571403521","/klgpolice/photos/pcb.3243378562368870/3243378312368895/?type=3&__tn__=HH-R&eid=ARBIwhvDmTaBqquZnsKIOJ6rRGfnNyBfYt_Q_rL0tCBfu46QdiK7Dax1HnEIP0xsPFPcDPtRfwoZaa9T&__xts__%5B0%5D=68.ARAY7dAG1wIsuXrzt3YcqW2MhvaNoTFA2nX2ip6kiDznYcZitV1C1iJNOQujCrHm-9NrvClYTpKb6h2QxA2UU9s-NshYec42jGK1LOHjnsjxaUlpHIM_QDmubsjdIz5d7suTUazxVUQuOh7AXwM5yXd5KNqlsNtFMAUWMDojUZiTn4l5T0gAmPO6n9gK2dOGnMcPF-mRoV8gjPCOGAlZ4lJywaF8OarZqx9nJSPbV_SdvCQTErrrScRsKGgBGHQqi1pVmndcizbOfQmY7Wtpx354F9bjU_RBNeF3afk5y-vHTXMOtX_O1s98qY3Bc9dd-pVFzU-Uzl_rUQKSYdBr7foLYA","https://scontent-frx5-1.xx.fbcdn.net/v/t1.0-0/s600x600/70710992_3243378315702228_4428890174495129600_n.jpg?_nc_cat=109&_nc_oc=AQkfNPHWZ2gB7tXZ3r7ghu0v2ZzZ3F4Mfmeo8CsuCaVEio4J_CCoAl2erj4cfpjUsZ4&_nc_ht=scontent-frx5-1.xx&oh=62cbe727af33c1f0edc4ee5abc9fd047&oe=5E315AEA","undefined","+‏٣‏",""
"https://www.facebook.com/klgpolice/posts/3316439871729405","1570613056","歡慶國假連假 網路交友請小心
近年來民眾利用網路交友軟體已成為趨勢。國慶連假即將來臨，許多民眾在家喜歡滑滑手機交友軟體、認識新朋友。因為網路交友具有匿名性，拍攝、散布兒少隱私照片的兒少性剝削案件，及詐騙的案件也因此層出不窮。究竟網路交友該如何自我保護呢？警方提供以下幾點建議：
一、不洩露個資：切勿向網友透露個人資料，例如姓名、居住及工作地點、手機號碼或個人隱私資料，更勿透過視訊裸露身體或傳送裸體照片，避免對方持照威脅恐嚇，以及不必要之騷擾。
二、不以貌取人：不要只看網友照片，就投以過多的幻想與期待，沉迷網路而影響生活作息。
三、不單獨前往：見面最好能邀約熟識的朋友一同前往，應約在人多的公共場所，儘可能約在白天，並將行程告知父母或他人。
四、不金錢往來：為避免網路詐騙，應避免金錢往來。
基隆市警察局婦幼警察隊呼籲：利用手機交友軟體交友固然方便又快速，但其中所暗藏的陷阱亦不可不注意，希望民眾建立正確使用網路及交友觀念。","1571403522","/klgpolice/photos/pcb.3316439871729405/3316439688396090/?type=3&__tn__=HH-R&eid=ARD8pjw3_hF989MTosRK-m2OgLUnPGWRB71VTCfPxKi25-1_Jp_44UOiv55PeYMVPLkd4DUoKPnMJIrs&__xts__%5B0%5D=68.ARBUUXSwQHEU8IW5X0ME5MFTSyR56WS-DpZBtFnvyeKLb7m_2oeGx_pYyo6Te_TvA8IXyCFQ5eQ-zKrKo_xWXDPbiqqiiQSfVDPpEzh5t7Fy7mGnUcHnHY3v4fuIHDPaGiVQaqlCMmwGcq2Kg4E53Tt8xwL8eWkoke8NyUH4ooNkhlKh1x-8af90uyEu1-v8_R1zDsl2UpB6mqnBvUUCswpzQkFqIB_gElZAaprhPP42MfAPLR7MB_6WMd_ZI5mB1yNMG-fntES89k6VXYg_pXAVefQrfE4v0aTu97RIyNLJzhehbi_l16cCQhP5VQkoWWDMiKp-aank7qjgWArSmtODqw","https://scontent-sjc3-1.xx.fbcdn.net/v/t1.0-0/p526x296/71706326_3316439691729423_6414446034948194304_n.jpg?_nc_cat=104&_nc_oc=AQn07omHoWkTrJ0jksg0l_pCqi4p1JzR9MW8-oYHJbt81rCSCqnOGTaBaPZGSISohzRB_WHXcaDRdZwE671Z_njR&_nc_ht=scontent-sjc3-1.xx&oh=33fe99b740e55027379f6aed92c70ce1&oe=5E2DE591","undefined","",""
"https://www.facebook.com/klgpolice/posts/3194050267301700","1566810132","警唱越南思鄉歌 帶「新南向專班」學生認識人口販運

 
經國健康暨管理學院開辦「新南向產學合作國際專班」以來，招收越南籍學生人數已近200人，且每年招收人數持續攀升。這些外籍學生常因不諳中文及我國法律，容易觸法或淪為被害人。為了防範這些情形，本局外事科、基隆市政府社會處勞工行政科與移民署基隆市服務站於108年8月26日與校方攜手宣導我國法律觀念。

 
宣導議題包括外籍學生在臺工讀法令、人口販運、外國人在臺居留法規等，本局外事科表示，臺灣的人口販運案件以勞力剝削、性剝削居多，尤其東南亞國籍人士最容易成為受害者。

 
開場時，外事科宣導人員現場演唱越南知名思鄉歌曲「我的故鄉」成功炒熱氣氛，引起在座學生共鳴，並發放警局特別設計「防制境外生遭受人口販運宣導單」，列出16種疑似遭受剝削的處境，供在場學生檢視自身狀況：「只要不是自願的、薪水非常少，你就很有可能是被勞力剝削了！」，現場還設計有獎徵答活動，氣氛相當熱絡，除了提醒學生自我保護外，還可以注意身邊的同鄉是否遭到人口販運，邀請學生們共同加入打擊人口販運的行列。

 
在場學生問到：「如果發現自己或朋友被人口販運，該怎麼辦？」外事科呼籲謹記三字口訣：「記」、「留」、「打」，記下加害人及周遭環境、保留相關證據、打電話求救，求救專線警察局110、勞動部1955，移民署（02）2388-3095或是教育部境外學生諮詢專線：0800-789-007。","1571403522","/klgpolice/photos/pcb.3194050267301700/3194050150635045/?type=3&__tn__=HH-R&eid=ARCMKCaG0-gG0fFzo-ArrKB3ogwB1Hw0sx3XzPqdWpsIV0IzAOpSsD-r26-GdZzsQK6u4gapB2NRf9tZ&__xts__%5B0%5D=68.ARCoSujTI6LLlejOBlv2roIrKLUcYCMO7TAuDbpECPB_MpTgJopNW0-Kn0HlddVQtqudedfRotCRaxsKFtnN3vfduTcY_FEHsMKvdzTw3NuRpXS4MfXc7wWORC0HBRkTPXUHTLzcrnU-LZIw1IRQsR55ZyyRjGr7BkDGffMG-mM5i2zAMR9yiwtNE1TszpZtzH5UBVgrha2DM-ZJenGEm9oojCXJfmSZ4iKo5qMfD06oyzmPssohVF_3VLbak3ZNFfgjJSMUWAF51wiWmejUO_jrTgcXAfMOK0CcrJmWYiipTSIkyc2TqcWqZHuviVF0ReV3Ek4cibULP3lSE5vqaoQ2sw","https://scontent-ams4-1.xx.fbcdn.net/v/t1.0-0/p526x296/69042679_3194050157301711_4363374945225408512_n.jpg?_nc_cat=108&_nc_oc=AQlfKX08LukiumsuTKI5ZpQ3NtMxVxBnU3Bn3Vzo37k9ukl2x1SX_ZgTaQZyejjCm34&_nc_ht=scontent-ams4-1.xx&oh=0a0edb4595a4bf4f26e29d2063822825&oe=5E26F7F9","undefined","",""
"https://www.facebook.com/klgpolice/posts/3330609433645782","[Error]: TypeError: Cannot read property 'attribs' of undefined","","1571403522","undefined","undefined","undefined","undefined","undefined"
"https://www.facebook.com/klgpolice/posts/3289854144387978","[Error]: TypeError: Cannot read property 'attribs' of undefined","","1571403522","undefined","undefined","undefined","undefined","undefined"
"https://www.facebook.com/klgpolice/posts/3234964003210326","[Error]: TypeError: Cannot read property 'attribs' of undefined","","1571403522","undefined","undefined","undefined","undefined","undefined"
"https://www.facebook.com/klgpolice/posts/3186007918105935","1566557883","9旬老翁尋家迷路
警民合作協助返家

 
基隆市警察局第二分局信六路派出所於108年8月22日23時許接獲民眾報案稱：信二路田寮河畔有一名老人獨自坐在石椅上數小時未離去，請警方到場協助；警員簡慈侯獲報立即趕赴現場了解。
經簡員到場了解，該名高齡90歲之劉姓老翁當（22）日12時欲從臺北市大安森林公園騎乘電動代步車返回新北市金山區住家，不料行經臺北市南港區時電動代步車突然沒電，老翁遂將電動車置於路旁，改搭計程車返家，惟渠因年事已高記憶力不好，路途中忘記住家地址，計程車司機只好就近將老翁載至本市信二路田寮河畔。老翁未攜帶手機且行動不便、體力透支，只好坐在石椅上休息，熱心民眾見狀急忙報案請警方到場協助。經通知劉姓老翁之家屬，家屬向警方表示老翁遲遲未返家，又無法與其聯繫，非常擔心其安危，所幸熱心的民眾與警方幫忙，才終於能放下心來，對於警方積極協助老翁返家不斷地表示感謝。","1571403523","/klgpolice/photos/pcb.3186007918105935/3186006978106029/?type=3&__tn__=HH-R&eid=ARDTZB4QPrl7VqnUMU7hE_d2wB6INWPIJEZfOziQKMOoahy_Gl_RmcIz8KJO6-nh_nGAb6uIa-s8pUFC&__xts__%5B0%5D=68.ARDX1itSXXDQCRPTrdEBwytkAQ6BQrk2NJ0-JR78wq7v5LoZHqjGBErYa_GkmitOsA1hrkzcVvFmBwbxo2ZzAB6bECuNwFSILdtg7Wig6Z1eyoMT81uPmwIi1hXCPEaMNX-xnK7q4ZKigfrQIKc8YiJ4opdMVymqLE_5P3oZbSNHZrHxo1JO84wmyzgg2lP2LWDcvg4Or47M2_GLCA1H5vAHcBaxVU4vjOZsM-tzu-iff-03CTOUAjMrern_aNzoJ-b9b7CGWaWeJ22WhAkhcXgcyOPhWSZhMDJppAy_y71AkDvWz4l3EVYxkmIkg7DfaWg5QkiW8Av8uJlHAgJdI1l1pw","https://scontent.fpnh4-1.fna.fbcdn.net/v/t1.0-0/p526x296/69401008_3186006981439362_1113147569120215040_n.jpg?_nc_cat=107&_nc_oc=AQnn-6LBvXSYgzXvBqf2Y1SQ_5SYN_XqdtBMEYQ4REkcE-EUfNNYGYNRyj1XN1RkTJI&_nc_ht=scontent.fpnh4-1.fna&oh=99d67923d878e15aa7efb9db4b57ac1d&oe=5E2177EE","undefined","2",""
"https://www.facebook.com/klgpolice/posts/3202562653117128","1567081070","借錢未成，先欠債！

 
近期165專線發現，有歹徒利用取名與國內金融機構名稱極其相似公司(如板○立銀及玉○國際等)，透過手機簡訊、社群網站或傳單等媒介，吸引急需申辦貸款之民眾進行洽詢，並以「保證申辦」及「無薪資證明亦可申辦」等作為號召，最後不僅未取得貸款款項，甚至房屋遭抵押或背負高額利息，請務必提高警覺。

 
隨著網際網路的發達，釣魚網站的運用可謂無處不在，通常當你點開網站看到""門檻低、利率低、放款快""，等多種優勢集於一體時，可要當心了，因為這一切都是為了要引你上鉤的把戲，而詐騙集團也會想盡辦法讓你以為貸款資金已經成功發放，並引導進入釣魚網站，讓借款人不假思索的輸入銀行帳號及密碼，接著就是將借款人的帳戶內的資金洗劫一空了!

 
基隆市警察局提醒，許多非法業者的貸款廣告會寫「保證過件、不必經過審核」等各種話術引人掉進陷阱裡，建議大家還是要按照程序辦理，選擇專業合法的貸款公司，才能依據你的條件選擇適合你的貸款方案(參考資料165全民防騙網)。","1571403523","/klgpolice/photos/a.991750000865082/3202562519783808/?type=3&eid=ARAVGcscZrMvGgkBDZ8dizPOe_1JXgh-2ZkKQMuwGZqIX-GBi7XbovdDAdjpNdEhB_wo-yBh2mUocecb&__xts__%5B0%5D=68.ARB4M9jK4NOSrHAMIZrByG4s8S159_V3gjSj5EZKX79491A23aWEv5_8eYntrJBwzLxVcrx3GiTPSuBKIgcI1AWJvLob6Tp-itWqlVh1qX23gVxzEv3ceL-sMTswXTj2VPXuyY66Ps6zyVZb_PwntVclbpUAhRtLsDflUAn6zXlH7AZJW4_yHkFB9m-gQ9EshgvZg251Eap4r1HWcVYVmhioiI6leFFFhpmnxVLF1guHtxNDBnn5knvUokCP4qkv93IHFZikuXZQmks0HV0LWxY3vrY0Jthpe5wEnIagNaF8l_h23UCeJfRvzr9Gzvg5Et1zdEXNvTLLQIJC_KiF6vxfiA&__tn__=EHH-R","https://scontent-lga3-1.xx.fbcdn.net/v/t1.0-0/s552x414/69500108_3202562523117141_6320476346694762496_n.jpg?_nc_cat=102&_nc_oc=AQmCFvoOKy9xpK_SIrH5rk63a6305zvcV7Km-HxmsOdYJvEBwKzRtE0AnEHsltgpIYI&_nc_ht=scontent-lga3-1.xx&oh=12838b1424dd2cbdd38b04f126377f5d&oe=5E1EAAE0","undefined","",""
