url,posttime,text,crawled_time,attachment_link,attachment_img,attachment_img_alt,attachment_title,attachment_brief
"https://www.facebook.com/klgpolice/posts/3243369242369802","1568373048","分局長領軍 數十位警挽袖捐熱血

 9月11日基隆市警局第三分局八堵分駐所及八堵警友站，為響應公益，在車水馬龍的八堵火車站前，舉辦捐血活動，邀請地方議員、里長共襄盛舉。
本次捐血活動由八堵警友站站長洪淑惠號召，與第三分局攜手響應，特意選在交通樞紐八堵火車站前，希望人來人往之中，能夠吸引路過民眾駐足挽袖；第三分局員警的愛心當然不落人後，由分局長領軍率組長、所長等數十位員警一同響應「捐血有愛、我愛捐血」，現場吸引上百人熱烈回響，包括七堵及暖暖區等議員及里長等，ㄧ共募集逾25,000c.c.為大台北血庫帶來及時雨的溫暖。
 
第三分局分局長表示「生命有限，愛心無限」，此次捐血活動，希望警察同仁在勤務繁忙之餘，注意身體保健，保持「定期捐血」，讓愛充滿社會每一個角落。","1571403516","/klgpolice/photos/pcb.3243369242369802/3243368499036543/?type=3&__tn__=HH-R&eid=ARCu8EbG-FaPMMIVs-BA6PQFLtFfoViGQFCzt3GXugt-c34c8Dbh2ZOsWZC4l7g1UuCXyNFubYZF7QMl&__xts__%5B0%5D=68.ARCUHUifJYq4t9KDK0ShkZ8hSdxvJ9WplfrSf9h0RmxFVey6bzMQqrL0dw-oDolQZT2aGh7FeDGRCOD1LHs25N8wDxHJw_up4xRAhdE9nmi2_878PFI34EPv_bFvxtd7H98cW9mK2xvz7bb9skBJF7smS5HWVUGDV_IRaYPRiVR07pPsQcochXfaK98M04OIhwPt9J9HgBs0jIyFu-rIK6YMZrrciDfOfQJuegrslO4fIpBUGTLjZle9xqJPaS90HAE4IGlTpn9OboJWEpbjUIG-rWR79b8zg8FDfOLhvG0PcgU_rlMzuc1iB9sR-X42HHiiGlpMeYxCO_Orx7iBrniPsQ","https://scontent-frx5-1.xx.fbcdn.net/v/t1.0-0/p403x403/70849715_3243368502369876_7694322679720968192_n.jpg?_nc_cat=101&_nc_oc=AQml0hJ9_7m2rd8rmyUPnAxB6mNvrK2gKTeOEiU2QWS6F5Vb-nGt58U9JNfSq2FS8Yk&_nc_ht=scontent-frx5-1.xx&oh=4d38eca90fe8f0bc27ca44506fc80901&oe=5E60C659","undefined","+‏٣‏",""
"https://www.facebook.com/klgpolice/posts/3327648973941828","1570942621","異國風華歌唱大賽 警與新住民共譜樂章

 
基隆市警局婦幼隊於108年10月13日於台灣頭文化交流協會所舉辦的「異國風華2019全住民歌唱大賽」，由新住民朋友與基隆市民同樂，這次活動不僅可以聽到參賽者黃鶯出谷般的歌聲，也能更了解如何保護自己、學習婦幼安全的知識，可以說是一舉兩得。
據內政部統計顯示，截至目前為止，新住民已佔臺灣人口的3%以上，已超越臺灣原住民的人口2.4%。跨國婚姻普及化已將近三十年，回顧過去，新住民被稱作「外籍新娘」，常遭受歧視、或被貼上污名化標籤。隨著社會變遷及權利爭取，新移民逐漸活出自己的色彩，可以說是台灣多元文化不可或缺的重要關鍵。
婦幼隊呼籲：對於新住民朋友，我們應有多一分理解，若新住民朋友遭受到不法之侵害時，請務必協助她們撥打113婦幼保護專線、110由社工及警方處理，即時通報即時救援，一起協助新住民朋友們度過危機。","1571403516","/klgpolice/photos/pcb.3327648973941828/3327648717275187/?type=3&__tn__=HH-R&eid=ARCbKjo47n0Dnd9traPv-yg_GWEviIrz20mXujM8TsNKkuKGrkHR3mOKXOc8ztKTTZQh9OXR9y3iCbWw&__xts__%5B0%5D=68.ARCPbuJzjYevfHz3YrQC4_yfsV6eOnAf9JkpgLP9YPT8FccJct9T42tN7_uE-SvcCqcYiQ8lRIS8MmQrya2g_oqOFsHeFPcnSiGQeZvMmnwt_kY9H9sMvrmhpBJYMTrD817xhmHe-NhtGhbXeKFnqd655kXIyC3a5OG5q02YaE47QF_eDFUecIy4iiYoIgaP995BsDTw5Z_lQLNDL9e_eCBnDNqKR4ab0bgquCmCSCIfv40_iv4yGDd8Xt0zu7RMQ4DnFyeDZkZeBBY5oD3HFbht49BG9m2g-rKoKJa5QzMZWZ2YVqMUXmm5gAkSS6vH2C6PKrmge8pQ-UbcXlu22ssRvw","https://scontent.fiev15-1.fna.fbcdn.net/v/t1.0-0/p526x296/72259954_3327648723941853_5003676525208272896_n.jpg?_nc_cat=100&_nc_oc=AQl2j4S3xQQFFI2iHmDYGEJgzRsdnzfOwbbBDkpjnujmkPIoDDlPurBsHtmwlcpx3ac&_nc_ht=scontent.fiev15-1.fna&oh=a7d7e76663762c90068757eb998caa70&oe=5E1C5BEB","undefined","3",""
"https://www.facebook.com/klgpolice/posts/3198875316819195","[Error]: TypeError: Cannot read property 'attribs' of undefined","","1571403516","undefined","undefined","undefined","undefined","undefined"
"https://www.facebook.com/klgpolice/posts/3272867422753317","1569293616","少資金高回收 網路投資留心遭詐騙

 
分析網路「假投資」案件詐騙手法，詐騙集團大多透過架設網站或臉書社團、私人LINE群組進行招募，標榜以「買空賣空」或「穩賺不賠」等口號，誆騙民眾投入少少資金，就能回收高額獲利，以時下熱門之虛擬貨幣(或未上市股票、期貨等)作為投資的標的，然是類詐騙手法均以保證投資者可以固定獲利，只需依指示匯款或繳交費用成為會員後，即可每週提領獲利，但是民眾一旦將大筆金錢投入後，才發現招募投資的人已逃之夭夭，不知去向！

 
基隆市警察局刑警大隊，提醒民眾，通常高報酬率投資標的大多具高風險，此種少資金高回收的投資，實際就是詐騙，請提高警覺，詳加思考並慎選投資理財方案，以免成為詐騙集團口中的肥羊。","1571403516","/klgpolice/photos/pcb.3272867422753317/3272867356086657/?type=3&__tn__=HH-R&eid=ARDza9tzbI5cviVwsod4VwQrh8uflCEqUz9mUOXo8icaWYawSuAfpkyChrilt0my4jkTU9nwSno-8TIx&__xts__%5B0%5D=68.ARBV23fnOJOBmRUMlBvINJBWbtAZ3E9YvIMRzqDN-jCtQgMwaXUaGPb-JsXB41tf6pOEVoqPA49VLNzWZX6dBwzyKYs8uikd_U-u7jSi6rJwm2_CAENgojU8Bhw8rqeDubo9X86Io3u5UsoL5baF6YQE8hcd0hmryoJ9qXIc6_DflShfXx83MjKUvR4Y_sR4cd-1fbTbbDqAFDQeIeWsD6w7VCNWbdmG1w1AkN5uk7TzLEHf7kO1x-loHd9oiV5JnAEl_8JBqvKluXDA6fr4CaI4ioYJcS3o74mjFQHnnL2Kw4i-JBG-do2U5IZUsqmMj16Iza_8iBhzm12bYAogZZBhIQ","https://scontent-cdg2-1.xx.fbcdn.net/v/t1.0-9/71762811_3272867359419990_1731243536822566912_n.jpg?_nc_cat=110&_nc_oc=AQlaxLVfW-cRANvd_Z6aztw2RRByMFUeTbvDyWQ01_VmjS9Fk589uzAHnlyiD5bY4zo&_nc_ht=scontent-cdg2-1.xx&oh=e29788036170aa3fac7ab95bf351f93d&oe=5E22E127","undefined","",""
"https://www.facebook.com/klgpolice/posts/3255796687793724","[Error]: TypeError: Cannot read property 'attribs' of undefined","","1571403516","undefined","undefined","undefined","undefined","undefined"
"https://www.facebook.com/klgpolice/posts/3293264687380257","[Error]: TypeError: Cannot read property 'attribs' of undefined","","1571403516","undefined","undefined","undefined","undefined","undefined"
"https://www.facebook.com/klgpolice/posts/3226054214101305","1567820961","老夫婦尋兒6年無著落，北上尋警協助，終盼到兒致電報平安！

 
我兒子失蹤6年多了，我怎麼找都找不到，請你幫幫我！108年8月29日一對老父婦手拿1份報紙步履蹣跚的走進本分局1樓值班台告訴值班員警：「我看到報紙寫你們三組組長許耀彬找到很多失蹤人口，我兒子失蹤6年多了，我們二老特地從高雄大寮花了6個多小時搭火車來基隆，請你幫我連絡許組長，我要請他幫我找兒子！」，後值班員警帶同老夫婦至第三組找許組長，老夫婦對著許組長娓娓道來說兒子葉○○(31歲)自從102年4月離家後，6年來音訊全無，這6年來他們四處尋找並求神問卜都沒有消息，每次看到不幸的社會新聞報導，就聯想到自己的孩子會不會也出事了，驚恐萬分，尤其是每年的逢年過節，更是老淚縱橫的癡癡盼望奇蹟出現兒子能夠回來，6年來尋子受盡折磨，許組長耐心聽完老夫婦陳述孩子失蹤的情形，先用電腦過濾失蹤人相關動態資料，發現107年還有一筆動態訊息，遂告訴老夫婦：「放心啦，你的小孩應該平安，你們先回高雄，我會用心幫你找，請放心！」，老夫婦一聽兒子平安，語帶哽咽，頻頻道謝，後帶著希望返回高雄。

 
案經許組長查詢分析相關資料及網路搜尋，於108年9月4日與失蹤人葉○○聯繫到，葉民告知人平安，目前在台中工作，惟6年來都沒有與家人聯絡，後許組長告知渠父母為了尋找他，特地從高雄北上到基隆請求協尋，請葉民一定要打電話與母親聊聊及報平安，葉民終於當晚撥打電話回家報平安，並告訴母親今年過年會返家，老母親一接獲兒子來電，激動得熱淚盈眶，馬上將這好消息傳訊息告知許組長，並感謝許組長讓他接聽到6年來最想接到的一通電話，為本案留下完美的結局。

 
後於108年9月6日，許組長接獲一封信，拆開一看，是老婦人親筆寫並寄送給許組長表達感謝的感謝卡，看完內容，許組長直言，一張感謝卡完勝警察的獎懲令，這是最好的禮物也是最好的鼓勵。","1571403516","/klgpolice/photos/pcb.3226054214101305/3226054094101317/?type=3&__tn__=HH-R&eid=ARAjkMq39f-a0BG4NYSfMmVc9IrZ3JY7l2RhP55l9GEn01tz-9t6lDPbjC1laCQmWQ5DSc71b-Eh-oZV&__xts__%5B0%5D=68.ARAo6RFMsPo4EnI7_Z1poqo2OPoj1bExhRGPVr5ah39VgN1xdiAOI-ly4Tr0Vla1Uxf2bh4wAAzhBguXWEAgTFIC_y9wB1RKiA4hmWbkcLKf511Mqee52dSjjDM4RFo50q7lto3q9h7HVuDSEZNPlrns1t_4dXIQ0G5ldqA2bCYEAB3mOeV0DqdzsLEZxMKvPxqkDUwtIMXmbMn_sNbQhISw8nc5SOj1uFdhjspM1i6sBnzu3CeObrpV4lAfkQJoaunCJ-qxdIbwihYyQMAO0uRI9b8Yz8W6RzrSu9xsLHGB7euRibS5DYRsi9sgVSbm1eRpW8Y2HDmPjAggBe9Jus69mg","https://scontent-lga3-1.xx.fbcdn.net/v/t1.0-0/p526x296/69681266_3226054097434650_3417310275458564096_n.jpg?_nc_cat=110&_nc_oc=AQkZP0AVsf5UTFy_xhrJ3YoV_7s0KXBouPPjx-tQYybO256wSgqxc4fAlxV4APO9-bo&_nc_ht=scontent-lga3-1.xx&oh=8ecddd18baf8391eb6659e39f1ab0067&oe=5E288CD4","undefined","",""
"https://www.facebook.com/klgpolice/posts/3282504561789603","[Error]: TypeError: Cannot read property 'attribs' of undefined","","1571403516","undefined","undefined","undefined","undefined","undefined"
"https://www.facebook.com/klgpolice/posts/3259182544121805","[Error]: TypeError: Cannot read property 'attribs' of undefined","","1571403516","undefined","undefined","undefined","undefined","undefined"
"https://www.facebook.com/klgpolice/posts/3259177360788990","[Error]: TypeError: Cannot read property 'attribs' of undefined","","1571403516","undefined","undefined","undefined","undefined","undefined"
"https://www.facebook.com/klgpolice/posts/3240596245980435","[Error]: TypeError: Cannot read property 'attribs' of undefined","","1571403516","undefined","undefined","undefined","undefined","undefined"
"https://www.facebook.com/klgpolice/posts/3290528907653835","1569832605","「米塔」來襲路基淘空 幸基警即時封鎖

 
「米塔」颱風逼近台灣，間歇性豪雨帶來豐沛的雨量，造成多處災情頻傳，108年9月30日10時52分勤務中心通報基隆市七堵區華新一路147巷8號附近有路基淘空下陷現象，基隆市警察局第三分局復興所所長施文通及警員張禮運獲悉後立即馳援，現場路基塌陷情況嚴重，立即放置交通錐並封鎖道路管制交通，防範用路人遭受危害。施等2員隨後通知區公所、里長及相關單位搶修中。
基隆市警察局第三分局呼籲，颱風期間應作好居家防颱準備，請勿至河溪流域溯溪、釣魚及海邊觀浪，如非必要應避免出門，預防危害發生。","1571403516","/klgpolice/photos/pcb.3290528907653835/3290528790987180/?type=3&__tn__=HH-R&eid=ARCKneWKZJ8VBIyV3TGH90wtLDnuHJjfl7H7zpzH9-DFpL2-hApE4eBqDPdzkhJP16jF9SRVqEdhRmK-&__xts__%5B0%5D=68.ARC-j_EGcYGFt-7bT90OnvjwllTXEjBsAiNKV_OhpTIDlMj3sLt7sLhsPev8pZYawVFXU4zMgoyNX7ngKQgeViNkzgjGZVuS1ERw5IbOKgy9SunYLCcJiHzir-oUmoEQKJUTb0AHuMNbZJsQD62ST4jXoa40ZfHGnFVmPGGzl3MhsBnjEFB1_lNNK4-KijT-TAHP70toREm1bws--mq2vm-wVu8oKUFNEoaQhCgJ1BwqlyJFaQLlD0MA58XriF-xTIyHlP4cMuJQXLN4Y_0tI5XhyYup-sJ49i0moFXlJ3hlOreR2HG6nx2j6azc6cljrILRSZHPN48E854XaFBgPB0wzA","https://scontent-lhr3-1.xx.fbcdn.net/v/t1.0-0/p526x296/72419933_3290528794320513_180801724976463872_n.jpg?_nc_cat=109&_nc_oc=AQlu7wg29xYnhHlgmF3OaAhhvm2r587ep3bUS2JaXH5RvZC96AyVHYuWkb54QArU9Fw&_nc_ht=scontent-lhr3-1.xx&oh=f97f4d67ecedbe788c3760ff684fab7e&oe=5E189EE1","undefined","",""
"https://www.facebook.com/klgpolice/posts/3220900737949986","1567665547","警派出所所長出席里民大會，民眾紛讚賞

 
基隆市安樂區五福里於108年9月4日晚間19時30分，舉行108年度五福里民大會，里長舒瑞利除邀請地方各級民代及市政府單位代表與會外，也邀請基隆市警察局第四分局安樂派出所所長羅軒偉參與，在會中與里民交流意見，共同討論各項治安、交通問題。
所長羅軒偉於會中除回答里民所提出的各項問題與建議，也藉此機會向與會的100多名里民，針對生活中最容易被害的詐騙、毒品犯罪進行說明，不僅提示現行常見的詐騙模式避免民眾受騙，也特別說明吸食毒品可能導致的個人、家庭與社會問題，同時就即將到來的總統、立法委員選舉期間各項查賄制暴重點進行提示，期望與里民間建立良好的互動網絡，一同維護社區良好的治安。
會議結束後，所長羅軒偉與在場與會人員集體合照時，也獲得許多里民讚揚，肯定警方一直以來對里內治安及交通工作的付出與用心。","1571403516","/klgpolice/photos/pcb.3220900737949986/3220900544616672/?type=3&__tn__=HH-R&eid=ARBPVDWGwgFTYsLHTS6p88_5KaPAqRHuv8fAVVNolQ3jrKdz1b-4DPLDMJmY6OHiDOMuFqUSRSgmr13E&__xts__%5B0%5D=68.ARBsapJGBl83ma8t8d0bwVChyGNn-8Z-y5yvr5yduO2Kmpnx_wJgB5X5UMpvpTXMdC6baoa0kxpCRcCMuqZ7ick_5ZHBD62IFD7SUVt6WXiwkipi_c3aGUBarLW5VEWSw8z-MqHJbKcW08mrmTvS4BFWirTPDXIqucSGly-BYYV4oB51geTPAJEmHx7up7gEU5kfv3Vlb_yKdAmLEdazIz5WtPuREUi4C33CmqjHEwYPGJjGkjnFC8ktCOGvo1RFcgojsgsd3oHwDuKmjYk0-K6Bm0c11eO2nMN-K7h6hM41nF__2doB95YUvVIvC9VaTAyjMsaaPoYmEpQQaoU8I-FBOQ","https://scontent.faep9-2.fna.fbcdn.net/v/t1.0-0/p526x296/69649553_3220900547950005_2041503706473562112_n.jpg?_nc_cat=110&_nc_oc=AQkLOr9odRTTrX7gBLHXwEVjVnOctTqN73U51ILiW2xYJaFDbLTYGh9XCyWpGOmPRT4&_nc_ht=scontent.faep9-2.fna&oh=8c7c606f0d00f0a628f2fdc7297f31ae&oe=5E314F42","undefined","2",""
"https://www.facebook.com/klgpolice/posts/3310540962319296","1570434551","暖警走入社區 主動關懷弱勢

 
第一分局南榮路派出所警員鍾育致於10月4日擔服勤區查察勤務時，發現一戶貧困隔代教養家庭，由祖父母養育孫子，由於兩名老人都年事已高，僅能依靠拾荒維持生計，收入既微薄又不穩定，鍾員見狀十分心疼，遂自掏腰包購買零食給男童食用並協助申請「馬上關懷」、「急難救助」等急難救助金，盼能給予經濟上的補貼。
二老對於警方的主動關懷與協助深表感謝，表示警方能推己及人並以實際行動協助，讓民眾深深感受到警方的用心，實為警察身為「人民保母」的最佳體現，也彰顯助人最樂之精神！","1571403517","/klgpolice/photos/pcb.3310540962319296/3310540872319305/?type=3&__tn__=HH-R&eid=ARC9nzn7vgbcXoCu1fIspjXx7cFoYSEdUnt1S7X7S7Y3M7qp0PYZwMdbgIIsFdLYsyjWBIkvuJS2qG0C&__xts__%5B0%5D=68.ARCDv8q5ojGVLSSp37VYQeyaRMfr-6cu14dOfjRO-hoz-mQgNJU1C0bHEJcJAo4KeEeDDvhzqyb0-MvvOIFsYq39NryLisjVGlS7J7JyAc7OIy5kKFMYzgeJvRMFtHTCp7f3fN4wnNnFiN25ezrOrh2lBuuPe-aUb7pQn1-sZCtwkqCstV0QpDN7f4UwFVF4fz4v2Pn-Wr62_3PoOuLOo_yBftVX2mpe7q1gftZqMY-YevpYgmD3PEMMNux09We33Ms3yOly-pdsl-PFVhwCTzA2NFYLgjli5z02yJFys9qruyDBEd1WtQ1lTahF9MW2BPZs6PCW4Te2SiQDQBR7OZj-Kw","https://scontent-arn2-1.xx.fbcdn.net/v/t1.0-0/p403x403/72281693_3310540875652638_8398336788120207360_n.jpg?_nc_cat=108&_nc_oc=AQkeZH0cji1FBWSpKi_Zp0Pe0DJUQxmTPx2EPmY2QlWwTr073ta69MxGOZYVdY8xg2U&_nc_ht=scontent-arn2-1.xx&oh=4553fdbad172f4dde0fd4b3f18d8d0e3&oe=5E64E356","undefined","",""
"https://www.facebook.com/klgpolice/posts/3331175910255801","1571039505","男子路倒受傷 警即時戒護送醫

 
基隆市警察局第四分局安樂派出所警員劉育靜於108年10月11日20時30分許，執行巡查取締違規停車勤務，行經安和一街建德國中校門口時，發現一名男子倒臥道路，時值夜間天色昏暗、視線不佳，劉員為避免男子遭來往車輛追撞發生意外，立即將其攙扶至路旁安全處，並檢視其傷勢後通報消防局救護人員到場協助送醫診治。
經瞭解吳姓男子(56歲)
於晚間參加公司聚餐後，搭乘計程車至該處下車欲徒步返家，卻因不勝酒力跌倒在地，致頭部及雙手擦挫傷，無法自行起身，所幸警方及時發現後，立即通報消防局派遣救護車到場協助進行初步包紮並送往長庚醫院診治無大礙，家屬獲報到醫院後頻頻感謝員警的熱心協助及幫忙。
第四分局呼籲，飲酒請勿過量，如為酒後搭乘計程車返家者，可先連絡家屬接應並請計程車司機載送至家門口，避免發生意外。","1571403517","/klgpolice/photos/pcb.3331175910255801/3331175790255813/?type=3&__tn__=HH-R&eid=ARAb9Ky_P6TLGvGoovB1claKVLmIKm_dE0b_FlkCd-pT3gdhtUf-WkTp83SGW7L6H4IF4FiBhNaeC6eG&__xts__%5B0%5D=68.ARD_CtKEVcj5ytVfUlEh_k-eVllj0ZumkZcKot554x6-CrpF4ZZfmZwhm-K3Eqodb5u993VMaHpdl_16ZfN0ARi4f6DzYAHUZ2q7befSflXcFX3nyMu720GLbg8Qe_OKXHewoTStV4vNsUxqSDzKtsSTrShpIv77ne1cFUrnt5JaXwK8WLpu2W7ZCCDqNCNAVXANHp1898rWCe-YfWP1OwiHSS0IREp1jJkeYLUpQ6FAqWWuJdcEcjeZM0QzZvPeAHIvCxOW9JtOJe1fDCodM4GcqVyg9eKZI6JPZjQSZqbQ887jbtyTiE57B16IteBSX1dO9r-uwzLZ120C-c7_quedfA","https://scontent-lga3-1.xx.fbcdn.net/v/t1.0-0/p526x296/72275112_3331175800255812_3820857972297302016_n.jpg?_nc_cat=109&_nc_oc=AQmRM8L43tjGIBxvyNHKRTwNbCCR4-AafJp3mXBF4YqIWFih2v8qNXGeYC8U1Ya3lQs&_nc_ht=scontent-lga3-1.xx&oh=a864292625831b41c1ad4b6499421a54&oe=5E652CE3","undefined","",""
"https://www.facebook.com/klgpolice/posts/3303905769649482","[Error]: TypeError: Cannot read property 'attribs' of undefined","","1571403517","undefined","undefined","undefined","undefined","undefined"
"https://www.facebook.com/klgpolice/posts/3310557118984347","1570435090","「檢舉賄選、人人有責」科技查賄，填問卷抽大獎

 
為因應第15任總統、副總統及第10屆立法委員選舉，第二分局特與臺灣基隆地方檢察署於10月7日上午10時，在本市仁義里民會堂舉辦「反賄選」宣導座談會，藉以科技查賄宣導方式動員全民共同反賄選，使反賄選觀念深入社區、鄰里傳遞「乾淨選風、幸福家園」，並由主任檢察官陳彥章向與會民眾鼓勵拒絕賄選，更要勇敢檢舉賄選。
陳主任檢察官呼籲大家抵擋候選人幾百、幾千的小額金錢誘惑，若檢舉正副總統候選人賄選，最高檢舉獎金高達新臺幣(下同)1,500萬元、檢舉立委候選人賄選最高獎金1,000萬元，希望民眾能直言不賄，如有賄選情形立即撥打24小時檢舉專線：0800-024-099按4；另陳主任檢察官藉以發送反賄扇，邀請與會民眾以手機掃描反賄扇上QRcode加入臺灣基隆地方檢察署line並追蹤臉書粉絲專頁後，參與本(10)月份填問卷抽大獎(幸運得主將可抽中麗星郵輪-寶瓶星號4天3夜及3天2夜限定旅遊航程)。
分局長高德昌表示，「選舉」是台灣民主化的過程與根本，過去許多摻雜惡質的選舉歪風，嚴重腐蝕我們善良、純樸的心靈，透過與臺灣基隆地方檢察署
選舉法治教育的宣導，不分你、我、他，深化「不買票、不賣票、要檢舉」的觀念，以維護選舉公正性及民主政治的核心價值。","1571403517","/klgpolice/photos/pcb.3310557118984347/3310556862317706/?type=3&__tn__=HH-R&eid=ARAawip-xtJhfUPz-u4uTrGSeTajJbz0dH09h89Uyx5cdnrX4dZO8Uj2SCHxiPYywph1KqkW7qfX7rR9&__xts__%5B0%5D=68.ARA9vGEBVn0Y8TQW7TzvyUVawd6eZm2eTszKEoj1l7PM0Jj8BJnzG9EhCJxVMkQ6KMk6ik79OioQxkqE4hj5y5enbvutXlmf7ZmRq_3hZTxMGNkFYlOTSQzhg3dycRVZNRp2swXSdVWyfSOvPrGrk-farFtIelh5EdsHtY1lMefGppwAdcnHMGAVct6UZeYhbk44xVb3Qjqausl_MSoFLGqhYnFUUnujAaL4OTKBeE8k3BTwsbhfpTzz0OgxAvIMwfZBSM-sxkLUou5K8ZL48oPC5tDg53-WSVi5xEQecDVgLPbgutEcdBQ77eA3rfvCYlItehOptDtp1JV3Wvjukr8ufg","https://scontent.fbkk6-2.fna.fbcdn.net/v/t1.0-0/s261x260/71774564_3310556865651039_7124462278539214848_n.jpg?_nc_cat=107&_nc_oc=AQnKgCR_ZXsQs8snsLA1Brj9GwT_Tx4Xq0xgXgateJS-B_oSmF39fFwEwx8vqYc2mgQ&_nc_ht=scontent.fbkk6-2.fna&oh=a46b5f0cb77ace9b9cf0e616a88d3dbd&oe=5E265FF4","undefined","3",""
"https://www.facebook.com/klgpolice/posts/3240598789313514","1568285554","中秋節前夕警民聯合慰問關懷弱勢

 
為使弱勢家庭也能體會到中秋團圓的氣氛，基隆市警察局第四分局安樂派出所特結合安樂警友站及大武崙聖母宮，於108年9月12日捐贈30份民生物資慰問品予轄內弱勢居民，發揮社會責任關懷弱勢。
安樂派出所所長羅軒偉、安樂警友站長計豫民及聖母宮主委黃忠賢與副主委許春萬等人，一同前往轄內慰問獨居、貧困或需要幫助的民眾，關懷其生活起居狀況及身體健康，並協助其必要的急難救助通報。其中一位高齡80餘歲獨居老婦見到慰問團的到來相當激動，想不到還有人前來關懷慰問，她感動不已，也感受到了中秋團圓的氣氛。
第四分局分局長李俊德表示，維護秩序、為民服務固然是警察天職，而關懷弱勢族群亦是警察日常工作之一，平時透過基層員警執行家戶訪查工作，了解、關懷轄內需要幫助的居民，再通報行政救助及社會善心團體資源來幫助需要的人，本次非常感謝安樂警友站及大武崙聖母宮慷慨解囊，協助捐贈民生物資關懷慰問，使更多需要幫助的人也能有一個溫馨的中秋節。","1571403517","/klgpolice/photos/pcb.3240598789313514/3240598572646869/?type=3&__tn__=HH-R&eid=ARC6VeVZ_5B4RgzqmvFTDFHx3Pk9CuSxr2venOXwSOYBRKIYPc_8WWrw9u8hwgz96yigtii5ZpCCjyIh&__xts__%5B0%5D=68.ARDWpF7r_uB4XixsnJS7b9EcN4gvTFH5TGyW9mYuUpyBGuqeruRtZu4heckWFpdOjqWfWl_20EBGYX9HFCppKggflAK02p6IUeqDuz6mkaBQdkvl7saP0JLnQgXZlVTx4IFWhD4Ix1_PaBev7nl1mTyR6VgCv8X7LxdqldxGUg-pnDokef6hLjDV5VopNm1PSYvmColnQPow5Tuy5aVpHfizv-9oBUa3EpclrkZeQZYEH3iciukbqgHOJCnWIqxEbatRfbLdf9DPqvDFsRrm3viFusORG-0ccQPeHWvsJ7lacufx4HBrWCwXKKBVF31f_eq-_5SDDtCurwnUl59UZu-BHw","https://scontent-lax3-2.xx.fbcdn.net/v/t1.0-0/p526x296/70320677_3240598579313535_3842199175164854272_n.jpg?_nc_cat=107&_nc_oc=AQkJSO-jz7e76EpqaFP-nlxgcpzUhY0y3dbXj-xsBxW3qfhsoGkc2biCFugu6V9-Y_Y&_nc_ht=scontent-lax3-2.xx&oh=bc154b4c67ffa29377d7afb693776857&oe=5E2EF80D","undefined","2",""
"https://www.facebook.com/klgpolice/posts/3218001628239897","1567570919","三十多年的空白!暖警幫老嫗找到回家的路

 
09月01日早上08時許基隆市第三分局八堵分駐所內，來了兩個靦腆的高中生，後方緊跟著ㄧ位老婦，員警詢問之下，才知道是失智老婦在路口不停徘徊，學生擔心老婦之虞，便將她帶到派出所求助。
員警林政佑與蘇嘉韻，先是詢問該名老婦姓名，老婦表示姓陳，員警接著問生日、住家地址、交通方式等，老婦說自己快50歲、沒有結婚，平時與哥哥同住，再三請求不要跟哥哥說她迷路了，哥哥會罵她並趕出門；只是該名老婦目測約七、八十歲，與事實有落差。就在言談中，眼尖的看見老婦手提包裡，露出一本「聯絡簿」，才知該名老嫗平日上午都由新北市汐止區的安養中心照護，員警火速撥了電話；無奈接聽的是ㄧ位外籍移工，語言成了障礙，情急下改採戶籍查詢系統，順利連絡上該老婦人的兒子廖男。
廖男表示，老婦人確實患有失智症，今年滿82歲，平時兩人同住汐止，而老婦記憶僅停留在50歲；因自身工作關係，早上都由安養中心派車接送照護。在警方來電前，安養中心的司機甫來電說接不到他母親，所幸員警及時來電，得放下心中的大石。
基隆市警察局第三分局呼籲: 「如家中有患失智症長者，建議在其衣物繡上姓名及家屬的聯絡電話，或至市政府社會處申請防走失手環」，以免危險發生。","1571403517","/klgpolice/photos/pcb.3218001628239897/3218001444906582/?type=3&__tn__=HH-R&eid=ARD9dpcO_rELtmxFiG8vKX3hTv7SCrHLJ_ku6bDHdK6qTJq4SYWIWZ1uvims_mtP0tkOHyE6ipMVSOBQ&__xts__%5B0%5D=68.ARAGbwm4bdUJ_JYDOaElWngKOPYNHsz8exUbyyrIY0ouMQ9YJskDb40VPQs_sYfAm-a8Xykn8WwA0afoGr47GvYQYKIX-6FHlDYz7m3-r_SwwCJ0xLVr1hIHxyHC-rp-4rLgCHPoSUwWPkZZ0HjaWsEuNMGHnVFiIrgr_XDqSwdfQrTMrBO9dzd2YRaFEbw-RN5_dyZAKlgbtRxALrIbW1VxZ-K2ntqOVyTlg-MObJ06Za7xtAVShviflBifWRdrgXr7u8O5DOAWylV_Ak0MU1Bn435KZ9wt1twlhKiIk6C_7-fWTyP2yolbT5bKAURbYIqqtiUsXXJfOk6Wn-ZNd6Cd9w","https://scontent-yyz1-1.xx.fbcdn.net/v/t1.0-0/s526x296/69983622_3218001448239915_839074680781406208_n.jpg?_nc_cat=110&_nc_oc=AQl3hFPtQN-kl__nNBslyzM3u5twbGh1VrCqd2cMSmyPdRC0vKNxaTi49MXsCPOv-C8&_nc_ht=scontent-yyz1-1.xx&oh=d312a825d9eca7f696d5f3128ddab83d&oe=5E2CBC53","undefined","",""
"https://www.facebook.com/klgpolice/posts/3220897977950262","[Error]: TypeError: Cannot read property 'attribs' of undefined","","1571403517","undefined","undefined","undefined","undefined","undefined"
