url,posttime,text,crawled_time,attachment_link,attachment_img,attachment_img_alt,attachment_title,attachment_brief
"https://www.facebook.com/klgpolice/posts/3343175865722472","[Error]: TypeError: Cannot read property 'attribs' of undefined","","1571403502","undefined","undefined","undefined","undefined","undefined"
"https://www.facebook.com/klgpolice/posts/3293261487380577","1569920230","「米塔」吹倒交通標誌，巡邏員警即時排除

 
108年9月30日中度颱風「米塔」挾帶豪雨及12-14級強陣風來襲，基隆市警察局第四分局中山派出所巡佐簡靖騰、警員李翊煜，於9月30日16時許執行防災巡守勤務，巡經中山一路217巷口時，發現巷口交通標誌遭強風吹襲連根拔起，倒塌在道路中央。
 
時值豪雨視線不佳，簡員、李員為避免危及用路人安全，遂合力先將倒塌的交通標誌牌移置安全處所加以固定，再請值班同仁通報相關單位到場進行後續處理。
第四分局呼籲，颱風來襲期間駕駛交通工具，應多加留意路況並減速慢行以維護自身安全，如有發現掉落物或障礙物，可撥打110報案專線或1999市民熱線通報災害應變中心派員前往處理。","1571403503","/klgpolice/photos/pcb.3293261487380577/3293260210714038/?type=3&__tn__=HH-R&eid=ARB74pVAIzeDO5MUlsfuIlbnZ_y7cxaOCNYlihmu1DcETF9hYKx8LPp7MygbVSjylJiRKVaEvLb1ukXB&__xts__%5B0%5D=68.ARDDObHPGkhDSYBYJZITtk330SWHjIZi-reSnqaC329-KRS_DG3q5P729_Js3uFJqdP3wOBd4oAM9S7F01_2GlUdiAJtbO3OllV45DMpXvBI2-GdiVNRLT6us-6KaEKaCRK_QhcNY9D-bN1rbh-30gWt7kCsG5yyotWIyEpgxDVgBrEVQQ2wXhE9Y0n1NQzAbY_c2vfUE9qCQBN1TOFh0x3Dn1YMsRxS6EybMJ0GGauUxJ40TohOPPrs7JNXqwHAo76XIVONC7oxBKZbghVa4Or8HfPCjJzXVdHY50sbSOHxRUi1MucSLfRpoen_e8v_ik4vdJHqxZA3K8rl1EKMtAW8Ng","https://scontent-sin2-2.xx.fbcdn.net/v/t1.0-0/p526x296/72402646_3293260217380704_5974322499695935488_n.jpg?_nc_cat=104&_nc_oc=AQko0CvyGkbRTgc5ikNIrFa1kbFq19YVpPO6LpUtpSmKIzPRix_vQR7q9PVx1N7pnhw&_nc_ht=scontent-sin2-2.xx&oh=a0993eb660cdbb300c8473eb36f8be64&oe=5E30CBC3","undefined","",""
"https://www.facebook.com/klgpolice/posts/3270200263020033","1569210449","夜來豪雨淹路面 警擺三角錐警示護用路人

 
受塔巴颱風外圍環流影響，本月21日凌晨基隆地區降起豪大雨，加上地形多山，許多地勢較低之路面有積水情形，影響來車通行。基隆市警察局第三分局八堵分駐所警員陳宥愷及何晉儒於本月21日2時巡邏行經本市興隆街時，發現路面積水，且擔心夜間視線不佳，用路人恐生危險。
警方發現大片落石路面積水後，隨即開啟警示燈，冒著大雨，急忙擺放三角錐，進行交通管制，提醒用路人放慢車速以免打滑發生事故，並待雨勢稍緩，路面積水消退後，才安心離去。
基隆市警察局第三分局呼籲:「因應塔巴颱風外圍環流影響，氣象局對台北市、新北市及基隆市等縣市發布大雨特報，用路人行駛道路時，務必放慢車速，看清路面狀況，以免打滑失控，甚至是受困水中」。","1571403503","/klgpolice/photos/pcb.3270200263020033/3270200023020057/?type=3&__tn__=HH-R&eid=ARAslLuDbzq9Hbcu43CjX7SdFu7M0YnFHjz3Tc4CwxYu9JDfDo9l1v1cd_YhM0wSXKr_TuA_Ye_BQRAb&__xts__%5B0%5D=68.ARDymXmlX-uE3SXTRfHAjiQxcfcud7-VbdNdz3ekOAGt1XBhflTW6fnVrQYtwHb-ZRRD85L3zbPa0d5Pa6k7zKU36xPfCdgnh0QmR20f86h9wUlIFLCYtIEMBGg8-rLaFZHe2UdwYExDQk449mNVg1ABkQ1YHOU9guDFiPUoQ9NThhCs38SMn3QajA_Eoy1geuj3b6RPBcIl5I_OifCeAOVAutc8E9sf67kV1XrQ2b1SbXLNui_nf5irdnt9os0yUVqFWT88CoHEMgSoYKI6rM_-0QuMwgarbWcwwzk4NfLynaRRl7jwtgWMicvlS8m0HCTKdJaIHZuaXzrfSGGsJj4Y_g","https://scontent-sin6-2.xx.fbcdn.net/v/t1.0-0/p526x296/70180018_3270200026353390_58533231649095680_n.jpg?_nc_cat=110&_nc_oc=AQnnDWnwob5-L1XMAdibobnHRADWzfFjvFgADfQE_83O2aNcAEsDkWaR7wQWI4-ezXw&_nc_ht=scontent-sin6-2.xx&oh=87acb8ae08e066a078c5687bfaf0901b&oe=5E26F540","undefined","",""
"https://www.facebook.com/klgpolice/posts/3316337571739635","1570609775","","1571403503","/kcpb110/photos/a.492290780922160/1445996538884908/?type=3&eid=ARCREqxAXYvZu7QgK54tJxPgmDWPcIwshuDv7TiHWoH-dNgE5Cn32fBI0cZUKzKTTPq9qylLwMRaUh4u&__xts__%5B0%5D=68.ARDKc_-CQse51EL_NzVjejuqHyXwV3aLEFwgDna3gQVXXreEM-VdBaENkrRaYoFGNAC4rAL44cNu-HqXhNZrd0YQUO6u3tG6Y2x5zWBX25Qq8K2HILJZNqxkYvP5sfhoix32Gwuk6deEgpXY5cAyTAdg7kTwdEK9yn2YyVJNEeSC3b0seZhL813K-GDhyzTN2zcUFQ-vqnsDreNXvhtVEOXW9hkNTNGsVfG28EYxuQP1uspgvB69PUBx6zZFEUN_N_UP57Hzd4MBpqUIyxJ-tNPsI-0ZmXFkeErdGHN7VIZMtgVgGexgQk6KXWIxygRMOuiZrNRTSY9Yh_F1sXytdwij70ScVm5mwnn1LPzPywA6Tj7pxI6_Rd8ExWs2gcEA8Mj3kcKS6z9q0whNR3skwB4gl0xXIEEqNGHO-UcXhLCfBswbmojqqe5b_Uk2OhkMUwfIT7TYSkXMwHwbs0TUAhj4xKIqzoRwYzQTLnDXRlGycEG6gDFv2EZ3&__tn__=EEHH-R","https://scontent-sin2-1.xx.fbcdn.net/v/t1.0-0/s640x640/72258695_1445996545551574_2481797958085902336_n.jpg?_nc_cat=100&_nc_oc=AQkD3a0c8FTMzYn-VIIJ3-zuKFvPLdLxIL_WgLVsubYZ7FdQtkRSZjVCHllAi2NaI2s&_nc_ht=scontent-sin2-1.xx&oh=f0667cf4bb1deb5ecb3e6886b8c9790f&oe=5E2C7B9C","undefined","KCPB局長室",""
"https://www.facebook.com/klgpolice/posts/3303842559655803","[Error]: TypeError: Cannot read property 'attribs' of undefined","","1571403503","undefined","undefined","undefined","undefined","undefined"
"https://www.facebook.com/klgpolice/posts/3301263043247088","[Error]: TypeError: Cannot read property 'attribs' of undefined","","1571403503","undefined","undefined","undefined","undefined","undefined"
"https://www.facebook.com/klgpolice/posts/3336362203070505","1571186016","失蹤13年宣告死亡，子女思念立衣冠塚，警重啟調查，比中身分助其返家！

 
我母親失蹤13年了，我們怎麼找都找不到，因為不捨母親成無主孤魂，我們才幫母親立衣冠塚祭拜，盡一點為人子女的孝心，真的謝謝您幫我們找回母親！緣本分局第三組組長許耀彬，檢視警政署身分不明(無名屍)系統，發現新北市政府警察局汐止分局95年11月24日，曾受理一件漂浮於基隆河岸的無名女屍案，該具女屍因長期浸泡河水，毛髮及五官均腐爛無法辨識，又身上無遺留證件、飾物及其他可識別之物，採集指紋、調閱監視器亦無所獲，遂以無名屍公告協尋，13年來資料一直掛在無名屍系統等待比對指認，大體並以「編號7587無名女屍」埋葬於新北市汐止第一公墓無主墓區長達近13年之久。

 
案經許組長依該無名屍的體型、外觀輪廓及陳屍區域等特徵，搜尋交叉比對分析上千筆資料，於108年9月5日比對出一名居住於基隆市，95年即失蹤的75歲郭姓老婦人，特徵與該無名女屍相近，遂重啟調查，為本案露出一線曙光。

 
再經許組長查找老婦人的子女，子女告知母親早在95年11月就失蹤了，剛開始他們家屬用盡一切方法四處尋找，父親還因為思念母親，每天騎機車都刻意多帶一頂安全帽，稱要順便把母親載回家，也多次無助的求神問卜，可惜都沒有消息，在遍尋不著絕望之際，因怕母親成無主孤魂，遂於106年父親過世時，以母親的衣物幫母親立一衣冠塚並且與父親的骨灰罈放在一起，讓二老相伴，盡一點為人子女的孝心，並於107年辦理法院宣告死亡，至今雖過了13年，但他們仍然十分思念母親，尤其是逢年過節時，總覺得家中少了1人，一直未能尋獲失蹤的母親，是他們家人心中永遠的痛。

 
家屬還說，剛開始接到許組長電話時，全家驚訝的不敢置信，因為母親失蹤13年已宣告死亡且戶籍資料早已除口註記查無資料，竟有警察還在調查母親失蹤案，讓他們感動萬分。他們相信真的是奇蹟出現了，是母親失蹤13年後想回家了，拜託許組長帶祂回家，也弭平了他們13年來找不到媽媽心中永遠的痛。

 
復經許組長採集失蹤人郭婦子女唾液檢體送法務部法醫研究所與該具無名屍做DNA親緣關係比對，比對結果吻合，確認該無名屍即為已失蹤長達13年的郭〇〇。後許組長再聯繫士林地檢署原相驗股檢察官，調卷並依法醫研究所的親緣鑑定書開具郭女相驗屍體證明書，於108年10月15日順利為該具「編號7587無名女屍」，正名為郭〇〇，後再帶同家屬持郭女之相驗屍體證明書至新北市汐止區公所辦理領回「編號7587無名女屍」，當一行人到達「無主墓區」找到編號7587的無名墓碑時，家屬等人淚流滿面，再三的向許組長鞠躬感謝，直說真是功德一件，讓離家13年的母親終於有名有姓，不再是無主孤魂，可以落葉歸根找到回家的路。","1571403503","/klgpolice/photos/pcb.3336362203070505/3336361963070529/?type=3&__tn__=HH-R&eid=ARClesc_M4aCGFq4PcEL3wwC6WjbpePwL_3y4O-rovf-nr08z-zpLCvFwOjJp5k6e_tZPlolPkIckVu0&__xts__%5B0%5D=68.ARDi6bOqlufUwoCwUzyv859RqeXxKC3F2pXWOFxMbJqn6fOnKr-WvpAIqE2jREQE3R88GVPuKWSYZ4BC_U8q-XkhBJ5N20q4Tx8Rcsll-xqkWCDMPyyG3dzxXhYi9vEjR7-3wUatZV70LHuV_-CEtb7STwjGkdoVCsSmRANbKj2UKUWSwJZOJpZg9Ql_uUqWEgagq6ftQQwff97vz-BQTvFtT1b-whupFeJfWK-5IyH9aiNv4GPQVeF2R_kTMdH4W8JRqtLLYw-4qPbjtEyvMqTQzrprW8i5DtEvCiBSyjeJw_sC8oxLIzWCz2xIxB8dy7S4LBrjK8cRcowrpcdBFdbuvw","https://scontent-cdt1-1.xx.fbcdn.net/v/t1.0-0/p526x296/72556185_3336361966403862_9154835392581599232_n.jpg?_nc_cat=105&_nc_oc=AQkhu-ugdsUI_v_8cC6v3SluZ1DaIhLTNeQ9qvWU91Tip6EXOdqlqOIgqsrRNrfzv1o&_nc_ht=scontent-cdt1-1.xx&oh=6c1286a7f16c20ed82f20a1dc892e71c&oe=5E2E396D","undefined","2",""
"https://www.facebook.com/klgpolice/posts/3342979689075423","1571370118","警四分局新(卸)任所長聯合交接，承先啟後護治安

 
基隆市警察局第四分局108年10月18日11時辦理中華路分駐所暨安定派出所新、卸任所長聯合交接布達典禮，由警察局黃副局長勝智監交、分局長李俊德主持，並邀集地方民意代表、里長、仕紳及協勤民力幹部到場觀禮，現場隆重熱絡。
第四分局原任安定派出所所長陳俊霖榮陞基隆市警察局政風室警務員，由第一分局忠二路派出所副所長王政硯接棒；中華路分駐所所長陳俋宏榮陞基隆市警察局交通警察隊警務員，由基隆市警察局刑警大隊警務員劉威成接續擔負起安樂區、中山區治安的重責大任。
基隆市警察局黃副局長勝智及第四分局分局長李俊德，對於新、卸任所長從警工作歷練以及豐富經驗予以肯定，期許其在新的工作崗位上，更加戮力於治安、交通及為民服務等項工作，充分發揮所學知識與經驗，全方面的推動各項勤(業)務，發揮整體力量，以民眾福祉為依歸，營造民眾優質安全的生活環境。","1571403503","/klgpolice/photos/pcb.3342979689075423/3342979272408798/?type=3&__tn__=HH-R&eid=ARA9BzmGk94VPUIY3wKPPo_DqfnnEm_bDzMIOv6DbY7i9ebpUwY-Od4z_iCpnc0NmdTmjxZL1r3q6bQf&__xts__%5B0%5D=68.ARAZ4_v7XCEeaiG_ROX_wbS988MBlQqlMQaoj9hdNfIHDdd_CEsJtr6MFh9a-Bv1eV6GgjMuI3TBcMJbYnJwpIxlrW9W3Wdt5vBc1CLGR7gxABlx3kxOVTwRhkc2MvGDJfHNIqySJiige2QlUUJI1kxzM7X6VitolAWBmb4YDqRtnojBz0YrP-naXoj3AT6Zu83NDGQP0QwmSRXBs0uccREV_PjFHdrjFX1HBPXNaSkbl8IWiYCwdChNdQ2fIDoi1OVesme9hkUh87D6jVYBfPLgj8ClM_PwWc4ZHglMskGUO6-wdslDIIy6NFIb61UzZCQZ0I64CnijWorckxsQoGOvmA","https://scontent-lga3-1.xx.fbcdn.net/v/t1.0-0/p526x296/72948423_3342979275742131_1303009514722689024_n.jpg?_nc_cat=106&_nc_oc=AQl_MPxyoOSAY_GdbcqVZ-q2ZMIiF8Ap1AIiURfvPzXE8qjiu4Oy0om_zjdbmr1OyAM&_nc_ht=scontent-lga3-1.xx&oh=4f4217a4d757d14e57ceed7666959623&oe=5E601604","undefined","4",""
"https://www.facebook.com/klgpolice/posts/3292621534111239","1569897122","中颱米塔強風吹襲員警不畏風雨保護市民排除傾倒路樹

 
昨（30）日中度颱風米塔來襲，基隆市區明顯感受到風雨漸強，讓市區各地零星狀況不斷，包括多處路樹傾倒影響道路通行。昨（30）日23時許，基隆市信義區月眉路290號前發生路樹傾倒阻礙交通狀況，基隆市警察局第二分局信義派出所警員林奕杰、警員許暐昕接獲通報後，不畏風雨立即趕赴現場擺設交通錐、設立封鎖線確保用路人安全，同時通報市政府工務處人員前往清理傾倒路樹，迅速排除道路障礙。
第二分局呼籲民眾，颱風期間隨時有強風或豪雨發生，駕車外出應減速慢行，注意交通安全，行駛中如發現有路樹傾倒或淹水導致交通受阻情形，切勿強行通過，發生危險，並請撥打110通報警察單位轉知市政府災害應變中心派員前往處理。","1571403504","/klgpolice/photos/pcb.3292621534111239/3292621357444590/?type=3&__tn__=HH-R&eid=ARDgemEFB86EHfGvAIQyb3eSyJ5wT-glT4D2jaZwP_SKzwTcgShkEKO3iNFc0KsQVcGMJ7tX8ITF8Oas&__xts__%5B0%5D=68.ARAiGsngilfeZb0VQMtxrmbcNZkh8LoRmVKz22pYmStOM9VyALTD-IWRwOOzo1tSRGB2LcPUwm0yRQk3TLtAns2Iu3ssRw3ecCAn78ogjEI0ikhwv53MBQLz6iEn1hW9ATKNAcComnS-2iQ5ovbrTHYLTHdtZx8s3jUZJ1TUjMlVzCwMeI1-R0DpVm18xgSB0GWSpFPg3xU4GHEq9VUYnAksd9SbHDwe4aJyW112ssK5DHYpagBG8U2S6wS30DBd7t5mNQXkP4_9exP7girf1UPO07IWb7xWEcWQNBYATkuNxDOruai9x3OK_HGyCiTCktfprypw4FUTArw9t6lm2Wk4oQ","https://scontent.fhan2-1.fna.fbcdn.net/v/t1.0-0/p526x296/71877437_3292621360777923_2835892821657911296_n.jpg?_nc_cat=101&_nc_oc=AQkYX9gE_ExRY9IKLUfydOK4yyLVigza4uiTwp8SyhISAaPeMb2iFwOL0hC8ZVDVIU4&_nc_ht=scontent.fhan2-1.fna&oh=0f94c63a262d35949f498d0d2385b805&oe=5E28810D","undefined","3",""
"https://www.facebook.com/klgpolice/posts/3270424099664316","1569218838","","1571403504","/kcpb110/photos/pcb.1431671863650709/1431670823650813/?type=3&__tn__=HH-R&eid=ARDa0MkYlpnriuXkd8m_qtZukiSVbYUcf2cvO_UNv0otQrftrzy2H3RaxJPZUyznddxkHgQMgU9u6oRt&__xts__%5B0%5D=68.ARCrG7-VXl9EsMl9Ez4y80-4EimVJLNhgUUQa-lwoJUrChk6Ei-JGO1hqLE1kPcc4rmv4f0_DTsqt5Lnn-A40B7Z4r16AGuVeFfoNxHM_2-wk_7BBaqXzWYJAH8Oaz2yEG7VR3WPI637Ue0LAKWYZivroOi4csyPnJD4tc7RezuvzYICSpp0D2tkeyLCRVQmoxjdgvXADQ4PwrJgZNF0kFUuQin8OGWXYobm5cFZxdeVguHB6cCV743I4ZfhCkcAMx76Ap9GB7HFDi2hAO5dOpsokegRiXs32wlX-R-dO24Ec9j-cxCQD9oYdmdnqqCDSHVR9oHvZolzsHOIdRLcld9MAWmxI8n0YVA70HK1A6u0JZtnvJOL4CuBGy-bM6OAcDdnQwmMfbIV96lkTR_JXWgC7VGSqx2C1iTytOE_DmeSHUmcKtpk5rbtlqvxjR4zdj7ugKGLVmPcaczQro1ixK_MyFhKnaERop40BeXenXmHWam-ThErIk64","https://scontent-sin6-1.xx.fbcdn.net/v/t1.0-0/p296x100/70492059_1431670830317479_8005775304092024832_n.jpg?_nc_cat=104&_nc_oc=AQmMJmHzy5kkVKMSdK5OjqAl-Y3-NHmWWTHa-AlmJ8LRh6Kvl3TqRTlRpRJDMVaHCSk&_nc_ht=scontent-sin6-1.xx&oh=3831e28876e9ad670265602671246ad3&oe=5E6277E0","undefined","KCPB局長室",""
"https://www.facebook.com/klgpolice/posts/3334372443269481","1571132146","https://youtu.be/sr8TWeIjzwQ

 【Anti-Drugs Cafe-反毒大使來奉茶】
為了提升社會大眾的反毒意識
這次我們邀請了幾位反毒大使來警察局「泡茶」聊反毒
第一位蒞臨我們的Anti-Drugs Cafe的就是
#鄉土劇知名演員「張鐵齒」

 鐵齒兄將江湖兄弟的角色演得既傳神又有趣
其實他本人的人生也是經過大風大浪
看盡人生百態的他
有甚麼事情要來跟大家說說呢?
讓我們來看看影片吧！","1571403504","https://l.facebook.com/l.php?u=https%3A%2F%2Fyoutu.be%2Fsr8TWeIjzwQ&h=AT1N9hxGa4-H84QcO7nZywwYiw553T1jiBULyjaEUOyPfIy9f-Hq-K7Qx3MVOj_F3PBEzhRHHzUUFUtr3So-SvmmMSU5BPlYRCsirVt4JqJZoF7qb0GjQ-o7klIDmYn4C2C9p-cmJgoG05jx2VEsUDXRqT9PpGnBL6bzWYj6gf19-ir8eiEy_DUDlc64PgRK0JDMVjvqLQvVYPNFWPtKjOCKBK9cnM7syoMtOQfcapxiCw26ZiUlYitfHqgk_ksfvQsbrCxHfwiBInzMuyuG3BzeaN7nm05TGFwnJnT_x4f9QXBJ35cWmXS-hVkIItPAxtkeoa8Zcgck9zHwpNuIqbqKu0nu2kH2KjvDWDHRoRM851Pdl6ajVH7Nfc0ZO6-YdmzYuTjj8jjfKSv_gnTs1sJ8_X-MgBeNQg43RQuk4uT_eKLloLj9_jbeyhcIFQV7WQAQJsud_wgxaBsArieFojgm-dR_-ljDpLz_TlSF_zTICtMveCqY63r97lBsqtdJGS_RY_0wvJ-zw26U710IN4JPVh5DXGTrBIrtoKdsH2IgDajLa34mSkYq03IJiX8MgjbP2PuePv-hxRkCgOH1-dwPNrtfyrt95liPSzgsR71aOYIaks9CHCQXAZ8L2gJrgo0aKgJTs2m7RoB5","https://external.fbkk6-2.fna.fbcdn.net/safe_image.php?d=AQA_i7UYITLFpZ_g&w=540&h=282&url=https%3A%2F%2Fi.ytimg.com%2Fvi%2Fsr8TWeIjzwQ%2Fhqdefault.jpg&cfs=1&upscale=1&fallback=news_d_placeholder_publisher&_nc_hash=AQASAnbjOEzUATlY","ในภาพอาจจะมี หนึ่งคนขึ้นไป และผู้คนกำลังนั่ง","【Anti-Drugs Cafe-反毒大使來奉茶】- 張鐵齒","【Anti-Drugs Cafe-反毒大使來奉茶】 為了提升社會大眾的反毒意識 這次我們邀請了幾位反毒大使來警察局「泡茶」聊反毒 第一位蒞臨我們的Anti-Drugs Cafe的就是 #鄉土劇知名演員「張鐵齒」 鐵齒兄將江湖兄弟的角色演得既傳神又有....."
"https://www.facebook.com/klgpolice/posts/3334058239967568","1571121608","警友辦事處捐贈防暴盾、強化執勤安全

 
為因應社會變遷員警面臨各項危險勤務，充實同仁應勤裝備尤為重要，基隆市警察之友會第二辦事處主任周昇德捐贈防暴臂盾予第二分局，該臂盾輕巧便於攜行，可攻可守，可有效提升員警維護治安、保護自身及民眾的能力。
高分局長感念警友會第二辦事處周主任長期以來支持警察工作，強化員警裝備十分重要，臂盾可給予員警及時之保護，在處理民眾酒醉鬧事或聚眾攻擊等狀況時，可以有效阻擋嫌犯突如其來之攻擊，大大降低員警受傷之憾事，本分局由第二組教官，利用時間訓練第一線員警使用，讓同仁熟悉臂盾使用方式，能夠有效應對各種突發狀況。對於員警安全，有一定的保障，在此，感謝周主任對員警的關心。","1571403504","/klgpolice/photos/pcb.3334058239967568/3334057869967605/?type=3&__tn__=HH-R&eid=ARDdgoHEJ4h9kx-Rx9U6cE6enlTxpTIzwIvvr5roy7ggAr2QDgdDjBxJHvSmLP96onphcNZDD6b8hgE_&__xts__%5B0%5D=68.ARCALvrx2YvsEkPhU3a6E2NgifVMW4PYMsIlvNXzcwJBaMtuJ0OMw30ONrVVwkjDVZ85XKq0TuUibI6zpTyG0lahjpYEv5yIedYmQE4zpA-jSKkCpdVg7T4A4S3nxZ8n0yYReQiLVpXpvcNh53hUxGxXRofsekjVoLH1P8wPsRCgKmH0c2X5esTo3QPEQ_suI8qUf1nnzPfjfDGYXccpWY3rq4jpLEIh0gY8JStmqgWO9p3ZqmAgEeBHdRDiBriXlrP19vBCkRyokogzvTlzN9_V_1BXKW8lOPX9Ydd2KlhdM1CeMlgexnznkL9wJbrN2ikW_kbt6RmQwt2H1njCNZ5RgQ","https://scontent.fvno4-1.fna.fbcdn.net/v/t1.0-0/p526x296/72473320_3334057873300938_1225865940671922176_n.jpg?_nc_cat=106&_nc_oc=AQnHpRnG7bpia9FLUq9LT3LIbHgiHi9oD0hX-_FLpn11qvHapBZf0aRSWMyiU4u1Mic&_nc_ht=scontent.fvno4-1.fna&oh=feb797c1b8a3f0ff54c18af0c68aff5d&oe=5E5BABE5","undefined","4",""
"https://www.facebook.com/klgpolice/posts/3334112233295502","1571123502","七堵國小參訪基警三分局 學童立志以後當警察 

 
基隆市警察局第三分局於108年10月15日接待到訪之七堵國小二年級學生，讓學童更了解警察工作內容及辛勞，由員警進行犯罪預防、交通安全宣導，更進一步認識維護治安、保護人民的警察工作，與對犯罪預防有正確認識。
為讓小朋友們體驗及了解警察維護社會秩序、治安的日常執勤狀況，由偵查隊為其解說警察工作內容，包含如何抓壞人、介紹偵詢室與拘留所；七堵派出所介紹警察所使用之裝備，防彈背心、反光背心、警帽、警棍、頭盔、指揮棒等應勤裝備，讓小朋友體驗一番；第五組交通宣導解說，提醒小朋友一些基本交通規則：如過馬路要走斑馬線或走天橋、注意紅綠燈、乘車要戴安全帽或繫上安全帶；勤務指揮中心教導報案撥打110、火災、受傷撥打119、反詐騙撥打165、受家暴撥打113。許多學童們第一次來到分局，猶如劉姥姥進大觀園般，好奇心大開，興奮地舉手搶答，過程中驚呼及歡笑聲讓分局洋溢著輕鬆的氛圍。最後並安排騎坐警用大型重機車及巡邏車，體驗坐上警車的感覺並拍照合影。為表達對員警的感謝之意，製作多張感謝小卡片給第三分局，使第三分局備感窩心，讓此次參訪劃下一個完美又歡樂的句點。
基隆市警察局第三分局藉由此次參訪以寓教於樂、淺顯易懂的方式，使學生在短時間內充分了解警察工作內容，灌輸正確之法律觀念，讓法治教育向下紮根，期許這些未來的主人翁從小養成守法觀念，健康快樂的成長。","1571403504","/klgpolice/photos/pcb.3334112233295502/3334111546628904/?type=3&__tn__=HH-R&eid=ARACXKi7il0bannf9wvIs3M8t0uW0FOVoMDT26AODveNoEjQvhVzgGtTT9x-y0GMbrtlgRTXImJoPRYi&__xts__%5B0%5D=68.ARD9eD-7w03iD173N1Rp_jtcwvHDXx_gnX_1kpWXuQCUEvqauocI8GkdHaRGVlvs-FTR9fFAi4E1RW-CuQYI-yvlRfD3draaZf5WqU099cQLMiRlNAOKiZ3jb38A-lN5SCWRBWN2cIEd3FmPuNm1OiISJib-AqswMaSr_d8Suw7zLUPWEIn8D4TlQ0AqDxCixcJ5xxQd3IRqqfpfDd8t-ahiUKkWIHN3T5RxxdkFOMtfytFCicoQNhdXP0Pe3AxiZrs_JgmfTsHduMDL0unvTlQQzTpToXaGqcu6Fw9R8RE22At4rng0dElMPF08utmMmzgCbA8de4gp1e8hMvfLk0Eh_A","https://scontent-frx5-1.xx.fbcdn.net/v/t1.0-0/s600x600/72460817_3334111549962237_4762152775939260416_n.jpg?_nc_cat=103&_nc_oc=AQmF3u8_Md41GAXVX3K_gU4togmKKYWBiHgcYIgpXKys3sE21W8_HvLCMclWdxflLgs&_nc_ht=scontent-frx5-1.xx&oh=e5f724c650f78387b0dec2bbe273beaf&oe=5E2A39DE","undefined","+‏٨‏",""
"https://www.facebook.com/klgpolice/posts/3300966503276742","1570153532","基警熱情參與重陽敬老活動，宣導交通安全護老

 
108年10月03日下午16時許，‪基隆市七堵區永平里‬舉辦重陽敬老活動，邀請銀髮族共襄盛舉，基隆市警察局第三分局長率同仁熱情參與敬老活動，由於近來年長者發生交通事故頻傳，警方借由此機會向銀髮族宣導交通安全注意事項，提醒高齡者清晨外出應穿著亮色、明顯的衣物或飾品，穿越馬路依規定走人行道，切勿貪近而任意穿越馬路，行經路口更應隨時注意四周來車，鐵馬族可透過配戴色彩鮮明的腳踏自行車專用安全帽來保護頭部安全，因腳踏自行車不具有輔助照明設備，所以夜間騎乘時，應開啟燈光、穿著顏色鮮豔或具反光性的衣著，在車架或擋泥板上貼上反光片，並靠道路右邊騎乘以維護自身安全，在場銀髮族紛紛豎起拇指深感受益良多，感謝警方熱心參與活動倡導道路安全觀念。
基隆市警察局第三分局分局長表示，車輛不暫停禮讓行人先行通過，依照道路交通管理處罰條例第44條第2項及第48條第2項，可處以新台幣1200-3600元罰鍰，另行人違規亦可處以新台幣300元罰鍰，請民眾切勿以身試法，希望透過道路安全宣導有效預防憾事發生，經過路口停、看、聽，禮讓行人過馬路，人人遵守道路交通規則，共同維護行的安全，交通一定行！","1571403504","/klgpolice/photos/pcb.3300966503276742/3300966246610101/?type=3&__tn__=HH-R&eid=ARBOLN3hhMB-pqDj70A_k5ujxuOSZ5Ii6AKR9rMPkpAnPzqjQs8w_UnbHCigI893W3_5TK9iv3K8jIMP&__xts__%5B0%5D=68.ARDUVsv6J6QnJ8qdGTUY3rqO9BTrot5xlIkCto5iWkXAq8JJnRZnYADJLowAwFWxDYyzsHpVi_fkElCSF3AxhdtGOo7g7-pgr65CaOXCPNwXIO-SdxFv1awHmElmVLNt_g2fYZZjvBh7pU95E6A64xmHirhzoyYPQ8NDspI0GyCyMp2oHOLDCfDFu3ldlSnXUogQvtnGX4_m2i1g1MFBjkO1hOC8AHcKnx17rQxCHjMBpNIZi4Uh7ooQNahCNFn5dAC3UhQcOdoz-sssuxn_0nAlq9UY4B2EdtEqgrDON_IOT89D18Ko6_yOAQQtSV_ztwpe9J-AAtWzbQGnMp9GcW1KwA","https://scontent-iad3-1.xx.fbcdn.net/v/t1.0-0/p403x403/72368294_3300966256610100_2998550530306867200_n.jpg?_nc_cat=107&_nc_oc=AQle4tRaEKd97un3s59pC5Hpg8bSPawnvHqSnVsWJ8QWKfPv7dZGPa_aqUAnhJK6lQ8&_nc_ht=scontent-iad3-1.xx&oh=51610e14d75406844949f2273037d023&oe=5E2461BA","undefined","3",""
"https://www.facebook.com/klgpolice/posts/3284313111608748","1569639432","市警局前進校園 宣導人身安全

 
市警局婦幼隊為有效深根宣導成效與婦幼安全相關之警政訊息，及鑑於近年來國內發生多起隨機殺人事件，爰透過前進校園及社區，教導民眾及學生人身安全的概念，提升自我保護意識，強化防衛能力。婦幼隊本(108)年度至本市社區、校園已辦理111場次婦幼安全暨相關宣導活動，提升警察服務效能。
9月27日在本成功國中，婦幼隊透過與師生互動討論方式，以生活案例為主題，讓學生瞭解遇到歹徒攻擊時，如何自保、脫困，並以犯罪學的概念，教導學生如何避免危害，如：日常活動理論提出三個引致犯罪的要素，分別是有犯罪動機的人、合適的目標及缺乏有能力的監察人，當這三項要素出現時，犯罪的機會便會上升。婦幼隊在宣導活動中與全體師生互動熱烈，獲得熱烈迴響。
婦幼警察隊前進社區、校園舉辦人身安全宣導活動，相關活動資訊都將公布於該隊官方網站及FACEBOOK臉書粉絲專業，歡迎各位市民朋友至「基隆市警察局婦幼隊網站」及「婦幼隊臉書粉絲專頁」瀏覽。","1571403504","/klgpolice/photos/pcb.3284313111608748/3284312971608762/?type=3&__tn__=HH-R&eid=ARCDtw94Q4PvPj9aliX3mxaD5tx_zkMnJryCW1qn3BeP_cK1pfMKymYJlD28tD0kzQIZz5pMlByKslPg&__xts__%5B0%5D=68.ARDVFfbBiKOWlX1gxrQafTnmYY2vI7uMd-Xkx82nV5c9wgHlkrcrjirScr-Zjhnbnj5kK6Mn2TT_XFtJV20Q3HhEu5FkAVyoHlfNuQZoziu4toH0WF8CUsW754fsJnNDur2LI-pgsZyCUx6qwJKZLRVW9fAcChgYAbvGMXeyHpRXD1Ym6rP4d_I4QTmIbfg7auaik9wsUUoUFQx7FT5tuRxngJ-fPm25PSNzIHV0qj3C54Wzm_DNOKZABGzbT69kgKKAG5s4jUCx0t40hni0Z_D7MuzC6dwuFx_2ucrdAsEWH-yombwJ4l5kNp3mXc2azRm7ay5WgPYR7y9Lnd9Y8FUY8g","https://scontent-atl3-1.xx.fbcdn.net/v/t1.0-0/p526x296/72145222_3284312974942095_3061358353927110656_n.jpg?_nc_cat=110&_nc_oc=AQlj8YklvrOJUsKHU0_TU_8a6ivIb96gVyzvXYg2KjeZFz5lQsFndNOf7LeUFAsvLFs&_nc_ht=scontent-atl3-1.xx&oh=c515aa1c20ace203131be039b3503c93&oe=5E2A8A43","undefined","",""
