url,posttime,text,crawled_time,attachment_link,attachment_img,attachment_img_alt,attachment_title,attachment_brief
"https://www.facebook.com/nicepongpong/posts/1775458422747935","1513762643","【民航法退場機制，交通委員會審查通過】

 這次行政院提出民用航空法修正案，在交通委員會由我擔任召集人主審。這次修法有兩個重點，一是增訂遙控無人機之專章管理規定，另一是建立民用航空運輸業退場機制。

 
對於遙控無人機之專章管理規定共識度高，沒有爭議，委員會討論主要集中在民用航空運輸業退場機制。其爭點有二：第一，考量民用航空運輸業無預警停業或結束營業，侵害大眾搭乘定期航班權益，是否增訂勞工董事或公益監察人，強化行政監督。第二，民用航空運輸業沒有遵守二個月的預告時程，對負責人是否科以刑責。

 
我的修法原則「落實日常監理，確保妥善停飛」，經過大家充分討論，認為強化行政監督部分增設公益性獨立董事較為適當，文字修正「民用航空運輸業實收資本額達新臺幣二十億元者設應置具公益性之獨立董事，人數至少一人。公益性獨立董事應報請交通部備查，必要時得要求更換之。其資格、條件、職權及其他相關事項之辦法，由交通部定之。」

 
而未遵守停業或結束營業之程序之民用航空運輸業負責人處罰，若沒有刑事責任，抓去關，大老闆根本不會怕，與會委員也都認同此一原則，條文文字修正為「執行業務未依第四十八條第三項規定申請停業或結束營業，或未依核准之停業或結束營業計畫執行者，致生損害公眾或他人情節重大，處三年以下有期徒刑、拘役或科或併科新臺幣二千萬元以上二億元以下罰金。」

 民航法將來若完成三讀，對於惡意停飛的惡質老闆，不只要罰錢，也可能被抓去關。","1570903836","undefined","undefined","undefined","undefined","undefined"
"https://www.facebook.com/nicepongpong/posts/1821125684847875","1524028769","今天經濟委員會審查「商標法」、「專利法」、「著作權法」等三修正案，這是因應台灣加入CPTPP《跨太平洋夥伴全面進展協定》的配合修法，爭議不大。就三個問題就教經濟部長沈榮津。

 ★一、 反守為攻，讓開放日本部分區域食品進口，成為加入CPTPP的助力。

 
CPTPP是由日本主導，在昨天日本交流協會副代表即到各委員研究室發送日本食品並非輻射污染食品的說帖，容易讓外界聯想，在第二波擴大會員國的協商，台灣要加入CPTPP的條件。
我主張，如果日本能夠保證讓台灣加入CPTPP，政府應該有所承擔，把開放日本這些地區的食品，成為政府的籌碼，而不是負擔。
因為安全把關得宜，台灣的付出代價少，獲得利益高。當然，對於反對者開放的政治壓力，政府必須承擔及負責說明。

 ★二、 建議刪除第100條，著作權刑罰全部納入非告訴乃論

 
修正草案將著作權損害以一百萬為門檻，一百萬以下為告訴乃論，一百萬以上才納入非告訴乃論。一般觀念認為非告訴乃論的保護強度大，著作權團體主張，低價位與高價位著作於法律上保護強度應相同，不應有門檻之差別待遇，應一律納入非告訴乃論範圍。
同時，依據太平洋夥伴全面進步協定第18.77條之規定【
其主管機關得依職權發動相關法律程序，無須經第三人或權利人正式提起告訴。】著作權之刑事程序規定也是以非告訴乃論為原則。

 
現實上，不管是告訴乃論或是非告訴乃論，若無著作權人不提出告訴，檢察官無從知悉有人被侵權，當然無法主動偵辦。而檢察官有緩起訴的工具，全部改為非告訴乃論，不至於過度浪費司法資源。

 ★三、 境外侵權網站與侵權盒子如何處理?

 
不管是告訴乃論或是非告訴乃論，目前OTT視訊服務業，受到侵權都屬於境外網頁，就算修法通過，檢察官也沒有偵辦的工具。若是由著作權人自力救濟提起民事訴訟，也因無法取得境外侵權網站之所有人資料，以致無法進行保全及訴訟程序。

 1，僅知網站之IP位置或網域名稱，缺乏所有人資料無法提出告訴。
2，法院之裁定及執行命令無法以紙本送達。
3，以司法管轄問題，境外網站對侵權訴訟置之不理。

 這是目前著作權人被侵權時，所面臨的三個現實窘況，主管機關NCC及文化部都放著不管，經濟部更要思考協助業者，如何突破困境。","1570903836","/watch/?ref=external&v=1821125608181216&__xts__%5B0%5D=68.ARDybNCa5DEq1HWyGtNb9DaWw-ThteIcRo2jl58DNTF5vBZ_mx3MuwgsDz212iGxDZ9yaD82rhIUqhZ09yv2_Bd7G5j_ld027g4Djn2qigLLcwZLUfjOqobqIkBvIXlom3WTY_eBO_AgZQJtKhGyE2GgGzNAq6dTyAoP00FSao9vkjc-SrUjPmENIEpVMr5OQ6r7aBDmx1enB29_wUzszAFNEVYP3QiOpq1LbXvPozll23r809p51rFTDlGNuuzqXrW8tzmzXWdpCJWjUFp_-xZSDjAsJSBSflrZdq-ri3MLC0WlL6L_7AkkInXafCRquaQljKKzrX1T4anuPJ9ctMo5P3l3T_P3pYEu-Flt&__tn__=kFFHHH-R","https://scontent.fbkk6-2.fna.fbcdn.net/v/t15.5256-10/28757102_1821126351514475_7201804125460234240_n.jpg?_nc_cat=109&_nc_oc=AQmr59zSG3aqQ63WcV0zJNc-Dp7h8vvtfhH9Y7W9-JC7zU8XeSFNvi5X6roPyKzdZ-o&_nc_ht=scontent.fbkk6-2.fna&oh=d987d644d8e67c4194d0e00eba5e6240&oe=5E64A3B7","undefined","20180418經濟委員會","โพสต์โดย 鄭運鵬專頁"
"https://www.facebook.com/nicepongpong/posts/1821527528141024","1524113822","【把台灣公司改造成「優質國民運動中心」】

 這次行政院版的公司法修正案，大幅度翻修，改革的八大方向是：
一、友善創新創業環；境二、強化公司治理；三、增加企業經營彈性；四、保障股東權益；五、數位電子化及無紙化；六、建立國際化之環境；七、閉鎖性股份有限公司更具經營彈性；八、遵守國際洗錢防制規範。

 引進許多創新制度，整體評價還算不錯，這次修法用個比喻來說，有點像把「私人健身俱樂部」變成優質的「國民運動中心」。

 希望能讓公司經營增加公益、彈性、透明，這都是好事，但是這些帶有試驗性的規範，也一定要避免形式主義及無效立法。

 我們提出四個問題，希望沈榮津部長在逐條審查時，能夠適度修正。

 ☆問題一：「中石化」及「大同」條款(第一百九十二條之一)

 取消董事會實質審查董事候選人名單權利，避免公司派剔除市場派董事名單，也防止董事會濫權。但也可能發生剛被解任的董事，又馬上被提名。

 ★建議方案一：
有無第30條不得充任經理人之消極資格，上市櫃公司應由主管機關負責審查。

 ☆問題二：一人董事，一人掏空(第一百二十八條之一)
政府或法人股東一人所組織之股份有限公司得不設董事會，僅置董事一人或二人。一人董事，一人獨斷，可能一掏空，尤其是政府控股之公司。

 ★建議方案二：
避免官股公司被掏空，政府控股之股東一人公司應排除，例如台灣世曦公司。

 ☆問題三：公司治理人員(第二百十五條之一)
公司得依章程規定，設置公司治理人員，協助董事、監察人忠實執行業務及善良管理人之注意義務。一定規模上市櫃公司應設置。

 ★建議方案三：
由於，草案條文說明中允許「治理人員得兼為經理人，增設等於只是多一頭銜而已。我建議方案，先不要增設，經濟部可先從官股公司如中鋼公司，實驗性設置治理人員，如何成效良好，將來修法更具有說服力。

 ☆問題四：「台紙」條款(第二百零三條之一)
未來只要過半的董事或股東可自行召集董事會或股東會，不一定要由董事長召集，避免公司董事長拒不開會致公司停擺，以強化公司治理。

 ★建議方案四：
要連署召集必須要有股東名冊，在目前的第二百十條之一拒絕提供股東名冊，一般只罰鍰1-5萬元，上市櫃則是罰鍰24-240萬。對於台紙公司資本額高達40.2億，市值80億，根本不成立比例，若是公司派與市場派殺紅眼，不怕罰，根本沒有嚇阻力。
我建議，應改連續罰或對惡意阻饒者科以刑責。","1570903836","/watch/?ref=external&v=1821527394807704&__xts__%5B0%5D=68.ARBOV0OS-BeMohkA2vD1fHCLAZ762Xc0tGWbN0Hsz9zqukRSrIxITaHX8rPh3fkZB2H5xKp6ppyp9YmUV0hCMLjfrZ7GCOeH4In1CkzhwMjJtfJ0Swwkn2esYqXPB68_ugpdYML3bXBFtcm8bi8FCek68_TbriT6PsOGXSTqy25pQHh6P48aNieHmhpC07jqQatCdBS-E15aPJBwFtZ3G-V_Gv8sX2sAIFZLC7_oUKZGbDIdVQaeqSw42iKuWnbw7jQM-31sqB1DGptLiKnrw_KWNjABAKsmbbFegZuMN1nx9k-Iqt7atDquJEsERj51idcIzrbOvf8-LKaRxFkNwQ6Edf5oGVzhUxjJA6YS&__tn__=kFFHHH-R","https://scontent.fbkk7-2.fna.fbcdn.net/v/t15.5256-10/27865560_1821528164807627_7472435770037370880_n.jpg?_nc_cat=110&_nc_oc=AQnFnmwKo5hc8OipzL1wbremvQHJ4jv1yLAKN-B1s4KNojS1t79GlvG9h2YC0iSSG6Y&_nc_ht=scontent.fbkk7-2.fna&oh=10a1bc13f1d4a7708ed85310dadf4144&oe=5E643D39","undefined","20180419經濟委員會","โพสต์โดย 鄭運鵬專頁"
"https://www.facebook.com/nicepongpong/posts/1808023289491448","1521091637","【放空股份，球員變裁判】專職裁判，監控菜價抓菜蟲

 台北農產運銷公司近日因休市爭議尚未止息，代理董事長台北市副市長陳景峻請辭董事長一職，二年來的人事爭議恐怕再起波瀾。

 
台北農產運銷公司前身為臺灣區果菜運銷股份有限公司，於民國63年10月10日成立，同年12月1日開業，73年5月更名為臺北農產運銷股份有限公司，因此，農委會持有約四分之一股分，北農有價格制定者的特殊地位，都有其歷史因素。

 台北農產公司股權比例，台北市政府、農委會、民股及農會系統各占四分之一，台北市政府與農委會股份合計只有45％並未過半，過去農委會都沒有影響北農的人事權。

 
陳水扁擔任台北市長時，國民黨中央執政，人事由市府派任；民進黨首次執政，市長是馬英九，農委會也沒介入。這次是因為民進黨重新執政後，可能是認為台北市長柯文哲可以溝通，才派任總經理，避免地方系統把持。

 不過，我們調查全國各地共44個農產公司，除了北農以外，農委會都沒股權，所以北農人事權純屬特例。

 
對於農委會而言，有這個股權的好處，每年股利收入才數百萬元，給予的補助遠大於此，所以人事、收入都不應該是農委會的重點。維持出農產的供需穩定、價格穩定，才是農委會的職責。

 因此，農委會應該放空股份，球員變裁判，建議：
1，股權全數贈予給北市府。
2，不再介入農產公司的人事。
3，專職裁判，監控菜價抓菜蟲。","1570903836","/watch/?ref=external&v=1808023112824799&__xts__%5B0%5D=68.ARCEgVN4k15_jF8UKxk37JPlGudHzSQcZAcGnCO9Eh067qqxd0Fle5kM8xsLwEks5tpNk8kw0vWfHf9xsG2Ql616hVkGRmGnDL0HinBqRHf9VCeYaRGCOmMSKKmCX7kP25QWL5FTgDm6BAaNLYjGMCtNHPlBpJ4bUAB_b_jYRWhjeb5JzhVrYX6pI8UEyZ49sNikVN-bZxIQGstyJqYIckqLpWG59oJN6P1PkB_prz2Q6-kieRpFz78wTWl9-EUNHv0l5B5tTJ0eCqbKRTFNDe4isNAMf3genG4UJO7EvmVKCLwUUWR-Qydhldgl1sbNVLygsiIs0MElaPVnQxsWLYTJ3vck1KF22XrY7sYb&__tn__=kFFHHH-R","https://scontent.faep12-1.fna.fbcdn.net/v/t15.13418-10/27863649_1869724513047438_5863157750959177728_n.jpg?_nc_cat=101&_nc_oc=AQlnNBr1Wh9i-wdLXHfKCslcAEOW1pvccvrVxollES1nZISretWhqxp6niFMKmCl6wM&_nc_ht=scontent.faep12-1.fna&oh=8390ed1f367fab95ecb5757af3822209&oe=5E63A51A","undefined","20180315農委會","Posted by 鄭運鵬專頁"
"https://www.facebook.com/nicepongpong/posts/1810451965915247","1521613242","【蝦米洗「乾淨的煤」--Clean Coal潔淨煤】

 
今天經濟委員會，各界最好奇的是昨天環保署詹順貴副署長受媒體訪問時，表示在深澳電廠的議題上「經濟部躲在後面」！其實，我在上個星期天，才陪同賴清德院長、環保署李應元署長、經濟部龔明鑫次長等人，前往使用相同超超臨界機組的林口電廠，「眼見為憑」看看是否空污經不起檢驗。

 賴院長在現場把整個clean coal technology的數據都背起來了，整個行政部門哪有可以躲在後面？

 這樣說法，不知是媒體斷章取義，還是兩個部會有意見的差異，今天我乾脆來把詹副署長的疑惑，質詢個清楚。

 首先，最簡單的疑問，到底有沒有「clean coal， 乾淨的煤」？其實，一般講clean
coal，都會加上technology這個名詞，表達是一系列的發電過程，查英文當然沒問題，至少847萬條次，中文翻譯則多是沿用中國翻譯「潔淨煤」，台灣也有研究論文，並不是台電掰出來的。

 另外，就深澳電廠，環保署其實是有四個層面，認為經濟部必須站出來提供更細緻的內容：
1，深澳電廠設置的必要性？
2，深澳電廠若須設置，為什一定要燃煤，不能使用其他能源？
3，深澳電廠使用「超超臨界發電機組｣，是否能經得起環保法令及科學的檢驗？
4，深澳電廠的燃煤發電機組，是否涵蓋在2025年30%燃煤發電量中？

 若是對深澳電廠有疑慮的朋友，請你一定要把今天詢答的影片看完。","1570903837","/watch/?ref=external&v=1810446179249159&__xts__%5B0%5D=68.ARAPo2a2p6RGn0o5nS0W_R4wCU7KQQL8ZbUYXeZlXT6H1gceRGgk8CB7sjgUexEGDZQZUzjaeSgaM9r2X1dcyqE_DJpjAF7yYsi6lcq4wtpOFMQVVRdV4IWKTqPzoWyVR6nJ6mVUKBBJLW5dedtPliZX_u0BTk-xVZdJw8Ms_olyacHgjOE_rL3ulrzIiA3oX0T4JtjdOWOScjkjktvEjtbRwWefwZ5tiMKsRoEkmLDFjBeCniQOyUJUhAK_JrKh5er4rND9qaox1osvvshIjYFniOuhEuClcNe-MF0rzmhNnN9jUHGl94zgJ06YcyTn0aIYZA-TcJcEvI29B_NebiTpWsOb3AlcVu_fTdno&__tn__=kFFHHH-R","https://scontent.fbkk5-7.fna.fbcdn.net/v/t15.13418-10/27853593_415352402242259_2821139493032034304_n.jpg?_nc_cat=108&_nc_oc=AQnO-LtBlPH835CKNec2aWOqawlzQI1GZMc-Df2Ytx1yEHZsk-MaDkyALlLxTkIc2EE&_nc_ht=scontent.fbkk5-7.fna&oh=3ad99bb5754b70bb06d1e43456b712ed&oe=5E3AE282","undefined","20180321經濟委員會專案報告","โพสต์โดย 鄭運鵬專頁"
"https://www.facebook.com/nicepongpong/posts/1932009413759501","1539853974","今天經濟委員會議程是「農業保險試辦情形專案報告」，陳吉仲副主委代表農委會備詢。

 
首先，延續上次業務報告的質詢議題，對於中國非洲豬瘟疫情的威脅，從主管機關防疫作為統計，貨運及快遞方式已經有兩個星期的違規數是0，顯見網購貨運的防堵具有成效。但是旅客違規數未見趨緩，最近一星期還是高達3、40件。農委會也知道，防疫宣傳不足，陳副主委說，本周起除了罰則將一律改為1萬5千元外，也將修正罰則，希望透過修法的宣傳，加強嚇阻力道。

 
另外，今天報告主題，農業保險試辦項目，從網站所公布的保單內容來看，以為芒果為例，保費2萬9955元，最高理賠金額違6萬，賠率有2.0，即使政府補助二分之一，在農民自己負擔保費1萬4977元的情況，理賠6萬元，賠率也只有4.0。而其他的項目，如高接梨的實損實賠型保單，保費4萬5400元，最高理賠金額35萬，賠率為7.7，保費高、賠率低，實在不具誘因。

 
最近十年，農委會的農業天然災害救助費用預算總計有83億，平均一年8億多，在農民沒有保費負擔的情況下，高額農損補助，也讓試辦的覆蓋率無法大幅成長。雖然行政院草擬農業保險法草案已經成形，但是台灣農業特殊生態，農委會應該思考，農業保險採公辦公營由政府負擔盈虧及高額保費補貼，農業保險才有成功機會。","1570903837","/watch/?ref=external&v=740902419577643&__xts__%5B0%5D=68.ARB3HIU_F0KYdBptAYo-XZlFYBtDy8lFvJeY2WE43EPYXCLrWYTJ3s3Ro-jK796b-LUiH7oYwo3Lly-7M4UbpWoJNmODoSLwbwQZBKnnMu-VQ5_I9H3plaJ1BGh2bVIPcwSqThDGIF1wPn6L-6Nk_VbRcs7UE4BvmTkoYRt9UUDsN0yrZMSyc7J6nIy8XjIv-uGh0ARo3R70oPxUJsjjwADkVC_3nU9Ka_HmwzYVMo44aWdvjNiOAz9Sqqu2Gq4-sKOPjEkqimfVZHOj5WUmnx-CFVf7sfdi_lBevIs5pNY1d6jwXJrClP4H6WAHqse5h-0HvahHkLr40PAurxCIZ54Q4KvjCTk1bxL0rS9o&__tn__=kFFHHH-R","https://scontent-dfw5-1.xx.fbcdn.net/v/t15.13418-10/43557703_575584006231059_8716389690598490112_n.jpg?_nc_cat=100&_nc_oc=AQm9JeIYSo3ZFTVOOzb3qXrlSO96LsflA0Lh9tKcOg7d09z5ZVqsVrJ68dbcXy7xZcY&_nc_ht=scontent-dfw5-1.xx&oh=a817831b3a32a47f21091f1e0f274895&oe=5E28AEA8","undefined","20181018經濟委員會","Posted by 鄭運鵬專頁"
"https://www.facebook.com/nicepongpong/posts/1834197743540669","1526961170","【小改革，大方便】

 民事訴訟法等七法律的規定只可刊登在[新聞紙]之規定，今天終於立法院三讀修正，改革為[以法院網站公告]為主，這套修法我已經堅持了十年、跨二屆立委。

 
這是小改革，這個時代看起來也是理所當然，但對數以萬計被舊法限制到的國人來說，卻是大方便。以網站電子公告來取代新聞紙公告，不必讓民眾為刊登新聞紙而奔波，更可以減少刊登費用之浪費。

 
相關法律規定多是在中華民國來台以前。當時，新聞紙是最主要的傳播媒體，廣播媒體剛起步，也沒有無電視，更不用說是電腦及網路媒體。然而，經過幾十年，大眾傳播媒體不斷演進，但是刊登新聞紙之規定，始終沒有改變。

 
目前法律中出現「新聞紙」用語共有41個，其中屬於新聞紙公告刊登者有34個，分析其規定使用之方法可分為七類。部分法律已經將網路納入公告周知方式之一，但均屬於新修訂法令，但是仍有19種老舊法律之公告刊登尚排除「網路媒體」，顯然不合時宜。

 對於刊登新聞紙公告並無發行量之要求，以致讓刊登新聞紙流於形式，毫無公告周知之意義。
事實上，有發行量報紙之分類廣告中，屬於法院公告已經是微乎其微，反而是沒有發行量的報紙，因價格便宜，成為機關及法律規定之關係人刊登之首選，刊登無發行量之新聞紙，無公告之意義，只是浪費當事人的金錢和時間。

 個人認為這類新聞紙的刊登，應該列為司法改革的一環，十年前的修法主張，不合時宜的新聞紙刊登規定，今天終於做了變更。","1570903837","undefined","undefined","undefined","undefined","undefined"
"https://www.facebook.com/nicepongpong/posts/1879098252383951","[Error]: TypeError: Cannot read property 'attribs' of undefined","","1570903837","undefined","undefined","undefined","undefined","undefined"
"https://www.facebook.com/nicepongpong/posts/1810169219276855","1521555984","20180320龜山區台灣好政座談會照片集錦1","1570903837","/nicepongpong/photos/pcb.1810169219276855/1810168929276884/?type=3&__tn__=HH-R&eid=ARB5xtaGaQ-4pzgkkIeryko0fXjWT869XSOelhv_V6Re5Xii6ARnKLIWXPfmSvQ05qElAXLIf-JgLuxr&__xts__%5B0%5D=68.ARBTRO8H1a0RgGzZWJg9stKQPpzB93uykfPR90we7etjOdYWaCjrFKPTiNhpqe7SVMoS2uTgQIwjuZmuRpQ4t477kKuA-dRKeyoSCDx8Een9_EKdBq7LqTCnhKvvgc0-Sc5IKLfdvsm8KctbcVQB6FE8S_Kr7dZ88Lk9glj9WPHLAIUTdPKVsQdTxQlvwJGZxrS5UD8guY6SjsayFJMNF6AlR5oF2MpAYwwbf8uLtrmMPEWHQJ-1b7ZGT-ksaULNeX_HSat_wDq8iF1hCF_KhENMGufYOXzN35E3qhyx_LNMqN3Pj0Uf4zvxvD_bMEpFhYzMQhOWvW8qouDicfjM7CxA0icn","https://scontent-arn2-2.xx.fbcdn.net/v/t1.0-0/p235x350/29386473_1810168932610217_4007409417237561344_n.jpg?_nc_cat=111&_nc_oc=AQlcExK8Rlcwr0Ltj1hKLT_5CgDOgkvx3nRGGJA8daHibv_oX6pP6IcUsC1Uri0lYhE&_nc_ht=scontent-arn2-2.xx&oh=3b513632f63db9c18c0fb955638b7e37&oe=5E32F82C","undefined","",""
"https://www.facebook.com/nicepongpong/posts/1738248093135635","1504753986","【顧立雄儼然是國家級的黑臉】

 從顧立雄到金管會，一些怪人未任先罵的反應來看，這一帖藥下得剛剛好。

 
金管會的主要功能，有協助發展金融產業和管理金融秩序，某種程度就是球員兼裁判，到底要當球員還是裁判？就看當下的國家需要，其實，我國國情是要求政府球員兼裁判，大家只要耐心看一整天金管會的答詢就知道了，有些委員來要求放寬，有些委員來要求監理，都有道理。

 
不過，以我對目前台灣對金融業務的理解，社會是偏向求保守不求積極的，從台灣人喜歡存款的理財觀念可以觀察，也就是求保本，所以台灣遇到全球金融系統危機時，受傷都不算重。

 那，這個時代我們需要的金融改革是什麼？我的觀察和顧主委差不多，就是去家族化和去樁腳化，壞帳問題應該還不算嚴重。

 家族問題有金融業起家時的背景，樁腳問題有體制內的近親繁殖和地方農漁會金融機構的體質問題。

 
這兩個議題，有政府可控制任命的，也有需要制度規範的，後者就需要顧立雄的法律專業，在不違反憲法保障的架構下，先建立制度、後抽絲剝繭，把結構性的問題慢慢消化，顧立雄的任務就達成了。

 看起來，那些未任先罵的人，都心知肚明自己有點問題，就讓他們拭目以待吧！

 顧立雄儼然是國家級的黑臉，以後遇到這種殺豬拔毛的鳥事，就請他當萬能工具人好了。

 剩下來的部分，就看看顧立雄如何應付媒體對個案的爆料，和面對立法院的政治攻防了。","1570903838","undefined","undefined","undefined","undefined","undefined"
"https://www.facebook.com/nicepongpong/posts/1954043244889451","1543807999","【電力禁藥，國民黨自己吃自己負責】

 這次通過7個公投案，4個與經濟部有關，府、院、部發言立場，應該以2020年作為期限，因為2020後有新公投新民意。

 第8案「停建燃煤發電廠」，第9案「持禁止開放日本核災區食品｣，第16案「廢除電業法第95條第1項2025非核條文｣，這三案沒差，不影響政策現狀。

 
影響最大是是第7案「火力發電每年降低1%」，先走二年看看，但七十後年台灣沒有火力發電，相信沒有哪一個政黨能做到，連主張以核養綠的馬英九，其能源配比綠能10%、核能
20%、天然氣30%、燃煤40%，火力發電有高達70%。政黨為選舉，亂提公投案，亂吃禁藥。說要以核養綠，連國民黨執政黨的新北市，連乾貯場也不同意，如果沒有乾貯場，核電廠就不可延役，所有的招都綁死。唯一的手段，就只剩以價制量，但相信沒有政府敢做。

 
另外，風力發電躉購電價經濟部預告108年為每度5.1060元，減幅12.7%，引起開發商強力反彈，但經濟部為人民看緊荷包是本職，不過，扶植國內產業需要成本，經濟部應該加強溝通，將相關成本公開，讓大家能心服口服。

 #這是我第一次覺得詹嫂的標題不錯","1570903838","/watch/?ref=external&v=2263238543895559&__xts__%5B0%5D=68.ARDQXxl9fbB43Uj1pNkjsl3kil1DSf8mPZ9rk96A6aO-3WN5bxWGW0iANu21CTV-25pjn69tC-KdPb7dsUOyTGsuv6AN8c2bW_iDf3w2YrZfi9bxXxRhUTmzsd9uDjdQ3PffYxH9-VaUq3_9pODW1Lw7nk7ToK7uoTzpW7YuJiKNDX3dqvKzp9RVLiH56nbTxONjgPAdZB9GGiXk9iyfwyQqeUyHBrMiT2aZyY-E7K5iFmQJ7yn_q2b33xfNYFbBzfjV9Atg1AcIWrGRp1Pkzti3ajfQIiQNqhk6Smsx1iuNkL1wyIuZvvaO7CIaGfRhkcCCyQd6OtKq4qpluQ_mhU45RIvGH102FHD6cudi&__tn__=kFFHHH-R","https://scontent.fnak1-1.fna.fbcdn.net/v/t15.13418-10/45877830_202671737281461_3622402965366636544_n.jpg?_nc_cat=110&_nc_oc=AQmYv3m2i_uqxAyLkkcjiC-LQ_A8LweuaZhE-qcUr8_vz6mfl8W0UnhBc98phtnPty4&_nc_ht=scontent.fnak1-1.fna&oh=2226374eb836f418f4b2082778587719&oe=5E1F3A78","undefined","20181203經濟委員會","โพสต์โดย 鄭運鵬專頁"
"https://www.facebook.com/nicepongpong/posts/1808631776097266","1521209691","過去的座談會，現場都會有阿公阿嬤帶孫子一起來，現場常常有小朋友跑來跑去，今晚最少，只有三位，營養都不錯。","1570903838","/nicepongpong/photos/pcb.1808631776097266/1808630896097354/?type=3&__tn__=HH-R&eid=ARD_BlgtGuB2vAAm1vpWs0E1WOUECYmXDAFPxXuwjt5rUCaTEaiYn0CW4hqAt1YBNzrA1bLcd4I8UAqq&__xts__%5B0%5D=68.ARCHWBD7ayqTXvwO28hkpklbsiLaDqpJ4aUCcxWTNceWmLduglHO-SwB0Zi3hH-LHRmfGloocYsZC4ToDF9c2FXmexBBAVSy6DPGLLmjos_W2A3Z_oU9li2oH9VeW8XnrHHB9-0KWltgNqqER8vRiS20xrd9gGO22h8ezDtCtUoxWLrwQrXuJJIN4nFHnozW5k1gR0xtsFLTRHaqrqGuab-sYUTr4VeM_frPJyE85tm_5IbidjtOyi7zfk7ahbyqq7a7oPvbbbFzqg1ncWyzcrt0-NWq42_F0HJ2xszZxcKI3Q2g1wS7OqCiCK2m7qmJwIgiHAQgq-cR2U4O3JxTd8U4ElxO","https://scontent-yyz1-1.xx.fbcdn.net/v/t1.0-0/p235x350/29217046_1808630899430687_6182756489476702208_n.jpg?_nc_cat=108&_nc_oc=AQkI6p6ngNLGHmF4wEOPvieqd_CKyJ-vEgexBo34Rc5MLZ-cSOIMxBUBGY1skkSNE3Q&_nc_ht=scontent-yyz1-1.xx&oh=6af89669f732b1b954d67926cbf49b4f&oe=5E37DE97","undefined","",""
