url,posttime,text,crawled_time,attachment_link,attachment_img,attachment_img_alt,attachment_title,attachment_brief
"https://www.facebook.com/NoHighTuition/posts/905776349589271","1520435866","【2018學店排行榜籌備工作，即將登場!】

 
去年7月22日反教育商品化聯盟在「2017大學博覽會(台北場)」公佈「學店經營大學排行」，呼籲即將入學的大學新鮮人慎選學校，以免繳了四年高額的學雜費卻在大學成本考量的經營模式下受教權受損。

 
反教盟也將繼續推動「2018學店經營大學排行」，並且擴大舉辦。反教盟將發起數場座談會，向各校學生說明目前台灣高教現況，並且廣邀各界參與後續的「排行榜工作坊」、「學生自辦校園訪視評鑑」，以及後續的排行榜發布記者會。

 除了發布排行榜之外，反教盟將會與各校學生，一起凝聚推動高教公共化的具體訴求與學生力量。

 #2018學店排行榜
#敬請期待","1571677453","/NoHighTuition/photos/a.159802727519974/905768276256745/?type=3&eid=ARAvG-GhQBUxE0h5uYqs1FXrwzghT3Yvadb1-fVTh6PZ6hHBlDxex-KyV0-xxAkJ4_-mpcfcEYjHLDpP&__xts__%5B0%5D=68.ARD3pRCGTrMAd2QKwPMyraXsHbVCXPG9qJUDjTybnv-_T9UC2oVz0cJIHqkKO6fo4TfXqG4xecku1mZQP12k8aEx1Smba9le3LXMAXIkDzfNQiIfdmrtRpZq08xzmU_yAPsF8f-4x0TONQjblmG4E7JT53EPFvZLojOc9YdZl-38VE0dYCe1ymKxk2Rf5V5iDs0s4796q8A0e4fl7U1NdCU7Dspoin2VB_b8LTJZkq81jrdYVOfG7mk0Zt6QnHvUUABd30mM94z0-EoY8iPlwx2NMY56c8Vltrj4K8gakRVRX2SnwCMZ5p5GSEDdCfWVLY-0NtpvP-gm32XpQE9RlLw&__tn__=EHH-R","https://scontent.fbkk18-1.fna.fbcdn.net/v/t1.0-0/p526x296/28685416_905768279590078_8648152963891593216_n.png?_nc_cat=108&_nc_oc=AQlUCXQG1WWwxrIfS_ZrRFd0V8uf96m_9v6Fivh3H2ZDxC9CR-kvPvL6HVfZ9Ci0KhE&_nc_ht=scontent.fbkk18-1.fna&oh=d5e70132062e71e9366049ebef7c0628&oe=5E1E92AE","undefined","",""
"https://www.facebook.com/NoHighTuition/posts/964054597094779","1529703541","#違法違規還是一樣可以漲學費
#下輩子人家也要投胎當私校校董

 教育部將在今天上午9點召開「大專校院學雜費調整審議小組會議」，針對 107 學年度 16 所大專校院所提出的學雜費調整申請案進行審議。

 反教育商品化聯盟發現，教育部在今年調漲學雜費時，至少就有四項行政作為違反《專科以上學校學雜費收取辦法》：
一、 未依法公告學雜費調整基本調幅
二、 學雜費基本調幅計算錯誤，而未進行補正程序
三、 護航世新、中原、仁德、樹人，近三年曾違反漲學費指標、程序之學校繼續漲學費

 以及最嚴重的。

 四、生師比值計算放水，讓降低生師比值淪為口號-----

 反教育商品化聯盟檢視今年申請調漲學雜費 16
所大學公開於校務資訊公開平台的「學雜費調整送審表件」之後，發現教育部在調漲學雜費的過程中存在著嚴重的違法事項——生師比值公式嚴重放水，可能使得原本許多日間學制生師比值高於法定標準
23
的學校不只不用依法受到懲處，更還可以通過學雜費調整程序。教育部明目張膽放水生師比值計算方式，不只讓近年教育部強調「降低生師比值」政策淪為空談，更使得大學生長期處於教師缺乏的教學環境中得不到具體改善。放水生師比值計算的教育部，就是學生受教權益受損的罪魁禍首！

 
教育部到底會不會繼續放水護航大學漲學費，漠視大學師資不足的現況呢？請大家一起關注明日「大專校院學雜費調整審議小組會議」，以及反教盟、教育/勞工團體在教育部前的抗爭行動！

 ●記者會時間：2018/06/23，上午 10:00
●記者會地點：教育部正門，臺北市中正區中山南路 5 號

 學費若調漲，學生絕對不放過！","1571677453","/NoHighTuition/photos/a.159802727519974/964049950428577/?type=3&eid=ARB35dq-SaoFg_gLAVfdEOGWIq2iFvGB7pgSqZZYV18OO9B4pk1ipYkHKkGmbOKonsAXy8_0ZcjQyQwo&__xts__%5B0%5D=68.ARAtC6HzSir1cQqFakJxyvz-5BvBZTldwIkdiBeKd6tmOUl5LJX3XIIOdK2dEOtozdXiKJ3tZM_HhkINfIzdhJb6FX4Vl26t5pZvamRfR3KSeVDdvenTIWP4GcJWkv4crqx_t_NIkOvA5d5atNeNmGld6PNYCCie1j2S6-Ag_oiP-hQInZNKGRgMC2dFIjBab9M4H89P-Im8GlwfC0YpeJTA8631-iOFDPytG_OONGKYWkkRND9wsfPktw7o--7Qmk791NyZ_kYVOIUXvN0VIVGkiwOMAJjyZmz1dqyDf1l8qqLMuazqBS3dgtH_KT4yXx2xZoaJASgQ9g3Hh0cnZOw&__tn__=EEHH-R","https://scontent-amt2-1.xx.fbcdn.net/v/t1.0-9/s720x720/35882541_964049957095243_4401702859712757760_o.jpg?_nc_cat=108&_nc_oc=AQlKChmXhVRR5MbnM77CrKs_SSfYmcG8J4BbpVdlrdpmfJw3amNI-rN1rw873CarMLc&_nc_ht=scontent-amt2-1.xx&oh=a1a2fe883310e96f4a19e8724183e1a4&oe=5E64F8D0","undefined","",""
"https://www.facebook.com/NoHighTuition/posts/975450782621827","1530676934","","1571677453","https://www.facebook.com/20120218theunion/?ref=nf&hc_ref=ARStNhQ438EWe7RBOgHjejelfIig2IrL2RCbfpvI5sMBg5jqzhXD4DY--z6WupAi9Xg&__xts__%5B0%5D=68.ARAS6YRbAAOpKGVHaARKcS6VXp3_5Y-ND-605CecYOZoWh_CvVnOmzuuBOTlJCa76SH286G-HizZB2VIJMMXSCXi976Uh524QU2irCvIkSjw3kJY4y3C-PXONlyC1A4hs-iUt8Dq-mhlWnqYMwGbwLiu_ouL-8nuoczHKb6yMghy0ofsiyrneAGi7WKjpcUcTX1Z_JoavGWIMN01uaxjlisdt5_aM-zZKKCsOlC4z6VgrQsur1D6Dntz9JBYo0qOvv2u-taDQjBEvPChTwqiBMgYaMmpQB7DQg4O8WMHZBG99MZXFIb9eJu8FtXli61EKA85FdcUKSu7X7rMRocmb3VzeqsKMKKOiQw6rHnBd6vJsMxyX1xRgfbRzjCf3PQ4byQb_C0iPMP4N_qatT-hI31VBJlqEAzzQ5HJUKmFEXAsZPeRYzLc50FYdGS6IYehMydLs5HXE7iD7gdc7dcF4htOPcQaJWGLUTQpIR9xudmhatBnIpcXng&__tn__=%3CH-R","https://scontent.fhph1-1.fna.fbcdn.net/v/t1.0-1/c4.0.32.32a/p32x32/1620494_544920272273319_441237106_n.jpg?_nc_cat=111&_nc_oc=AQnlprZ3nz6mxlATVmtxaT0WwVxnKmbvj8mK-kPmsvAg1J_O2aga-EHS2zEGtRQiMuQ&_nc_ht=scontent.fhph1-1.fna&oh=abcc96e9c1543f0e4c914155e20d2215&oe=5E2B774A","台灣高等教育產業工會","台灣高等教育產業工會","liên kết"
"https://www.facebook.com/NoHighTuition/posts/935212146645691","1525418714","明天下午在後驛冊店！

 學校在漲學費？選不到課？抽不到宿舍嗎？

 一起來與我們探討目前教育公共資源缺乏的問題。","1571677453","/events/2139319429633256/?acontext=%7B%22ref%22%3A%22108%22%2C%22action_history%22%3A%22null%22%7D&__xts__%5B0%5D=68.ARChEpmzdjR6leJkj15VvyixCHUfjVI2qlJHUW1XLa9RqBexfv8JYfer1CZpFh6Mf8K3VBis3-2AHSnnMTfCge3-CWZHcs5bcPnBp9374a0tIZHXJqAyrjtAX5kYkNOM6_Xn_l-ET3HfxLVpGKJHo6R4PCYX3vzW5iArThXt-2t5Frns4U7_LLRxCxraYs4ytIdL9mla-fHbDJgwmG1pTB4upTH-2jvYJW8wLkhhTk0SVtPBp_SLdPmeRT-9ZQTNBHz9khzv8xMGx3uJHzC7WLW1TQnkSJuHs2jS63MM48BAbzJZYYNtgKblPGCUoBb24RDhImrOgwmS1s_fONTnj74&__tn__=HH-R","https://scontent.fuln2-1.fna.fbcdn.net/v/t1.0-0/c0.18.960.505a/s526x296/31100568_928779733955599_2341885442753822720_n.jpg?_nc_cat=101&_nc_oc=AQnRy8eLeaVna0ianNskXhIrfCxWMNXNpt-z_Xxb7oUxreaJIfDFy97cn6DfvTa4pxg&_nc_ht=scontent.fuln2-1.fna&oh=baef3ec4d77c98dd6ae92499ec67744f&oe=5E577C6E","Cover photo of event 搖搖欲墜的公共教育-大學學店排行榜前導座談中部場","搖搖欲墜的公共教育-大學學店排行榜前導座談中部場","後驛冊店 / Statio Verso · Taichung, Taiwan"
"https://www.facebook.com/NoHighTuition/posts/1172758322891071","[Error]: TypeError: Cannot read property 'attribs' of undefined","",1579421585,undefined,undefined,undefined,undefined,undefined
"https://www.facebook.com/NoHighTuition/posts/1173407512826152","1555418022","反教師惡法闖關，4/15赴立法院（青島東路）抗議！

 反對《教師法》修法納入大專教師限年升等與教師評鑑資遣懲罰條款！
【連署網頁： https://ppt.cc/fovUqx 】

 行政院打著「汰除不適任教師」的名義，在新的教師法修法草案中大幅放寬開除教師的條件。

 汰除不適任教師是所有人的共識，但是如果汰除的條件並不符合比例原則，甚至可能讓校方過度擴權到侵犯教師學術自由與工作權利時，不分教師學生家長就都應該集體反對。

 歡迎一起加入聯署！",1579421584,"/NoHighTuition/photos/a.379920955508149/1173407482826155/?type=3&eid=ARDYc2ClSQPSmev40aejQsNbFOXFEMUAC_HoWz1sQyG25ChBqso8uawy8oCfFpL8ybgVRMiH3gKac0MC&__xts__%5B0%5D=68.ARCEYPVWEc0QbgtFCfDEkpT4reTscFKI69nNV28bXAX__uCVak3PqfpGPB-DXtWJ4VZYjWssluUHbQnxV2cHiahvUzpetCLPmcRf3JFIMnJ2a-hTxNzEP7t-MYXktnNDbLQDYdmGVzWH2_FHapTeHzlODZSe_Cu8cZckxnZFKfbYCvRgNkLYoO464fzF9-5EBZRZuwQKEkeI7ZatMoxcXahW7xJtA9uAMoMwPQ5PwOagmrBrUT6bYHDCm7wX32IvMXY6yw0mSDM3IHNUlT8bd7tCP1j6nOzfh4o5B1lSumPK4TlvGKbABBmk2ODXpuS2oMC5UVvt074cYqt0NrmSEJ3quQ&__tn__=EHH-R","https://scontent-sin2-2.xx.fbcdn.net/v/t1.0-0/p526x296/57090189_1173407486159488_8777832075395858432_o.jpg?_nc_cat=108&_nc_ohc=4dURf8FBB6cAX_hwQWQ&_nc_ht=scontent-sin2-2.xx&_nc_tp=1002&oh=23058276a0b9b7c93ca67806874c7001&oe=5EA03A9B",undefined,"",""
"https://www.facebook.com/NoHighTuition/posts/830048810495359","1506866667","政府逐年縮減實質教育經費，又透過各種政策誘導大學將校內資源商品化、出租，使大多數學生受教權益受損。

 面對這樣的高教環境，大學生每學期支付的學雜費是否「值得」?所接受到的教育品質足夠在畢業後有尊嚴的生活下去嗎?

 明天晚上，歡迎一起來聊聊目前高等教育所遭遇的困境，並且一起尋找解決問題的方法。","1571677453","/ntusoc/photos/a.227628580750728/831783357001911/?type=3&eid=ARDRcsnzOwTbKpAP1NbQ7oOoTz-t8OVJycgCHSlWXA4n70yLhtJEO0NBmwXIBoNy5PuVcNLuYJ6gjM0B&__xts__%5B0%5D=68.ARD2Aq_BQhgYEmwJQwANEJyAygVC9KxbCRFJyRJeHFLJYKal0LAqEOOicq-_R203oLDq3I1V950uWdpbNdeIfSfx9aS39Zn1ChMaLETQN5vJiPiwCT3IaVXxoYI1RdzEQ8UUxVxZkCX3mvtKviva9Q_9EbYy7ZnrRrWQ9wuHQryENw_p8N8ntk7UQ5tym1PhpBtT-L25hCZuv05XrvOohWJwbpgtIsICBiVuXm8w-IyVPpEXuQuufPYVLAjo7br2CK5Elnx2JhvrTW0P4unA6Q5DNRytEtmI289BXwpx3kgTkpCEihHpIGEIhpR6421M676W138QS50hFOi6pA7fHgFgcM67dx-xGQvNM3ZYF1EKFGB9dTqze1bcOm2XM_H84byxt62U3MX_SU0kl5ouyJQwEp2SMLuYUdx5gf2f76R7f7HVQuuW1qUq12D31u66vIIiPfPHhmLkJcYH4SDiUhv2YhGxl3hjRkqVtAoLtjTdh56OAWo&__tn__=EHH-R","https://scontent.fbkk23-1.fna.fbcdn.net/v/t1.0-0/p526x296/21767994_831783357001911_5695955336730833637_n.png?_nc_cat=104&_nc_oc=AQkYJwDbSMT-8rtw1h4NJToVq_v_QAPu2_i2lx08G6HcjjeWnbGXbYVCw377cxZukVY&_nc_ht=scontent.fbkk23-1.fna&oh=229cfa1bc1c0e8b906483942cd31138b&oe=5E1F8193","undefined","國立臺灣大學社會學系學會",""
"https://www.facebook.com/NoHighTuition/posts/756218084545099:0","1493713402","【0502反教育商品化聯盟聲援境外生權益小組，反對調漲全體境外生健保保費發言稿】

 
各位媒體記者朋友以及在場的夥伴大家好，我是反教育商品化聯盟的成員。我想先請大家看一下我們現場的手舉牌。我們並非單一群體，我們這邊有港澳生、中國學生、馬來西亞學生、菲律賓學生、緬甸學生、日本學生等等從世界各地跨越邊界而來的不同面孔。

在這次民進黨的修法中，我們都會受到不同程度的影響，但卻沒有給予任何讓我們發出聲音的管道，於是我們今天才會集結在這裡。
這幾次的抗議，我們遇到很多的不友善的、仇恨性的言論。其實我們今天站出來，所希望的也是能夠讓這些不同的聲音能夠被聽見，讓我們一起坐下來好好思考，怎樣做才是對我們的健保體質有所改善，同時也能保障來台灣就學的這群人。

那我想我們必須先認知到，現況就是教育部廣招陸生來台以及接下來以南向政策為導向大量招募外籍學生來台就學。可是這些以國際交流為名義的超收，並沒有相對應的配套措施，我們只看到高教系統貪婪的從境外生身上拿取兩倍的學雜費、強制收取高額住宿費！然而，當私校財團收取了這些錢，他們有試圖改善高等教育的環境嗎？他們有試圖提升教育品質嗎？沒有！
在這樣的情況下，校方收了錢卻並沒有相對應的回饋提升在我們的學習、促進我們的學術交流上。我和我的外籍同學們、中國同學們，距離是很遙遠的，因為受到限制，我無法和他們交流實作上面的經驗。更不用說他們的人數根本不被納入生師比的計算中，徹撤底底的被當成搖錢樹。

這些從異地來台灣求學的學生，所受到的待遇是這樣！所以我們能否更認真的去看待他們的處境，我們能否試著去改善這樣的現況？因為剝削他們並不能使我們自己的情況有所改善。事實上，我們可以從這次健保修法的事件看到政府逐漸抽離他原先應該要挹注的公共資金。從教育經費到健保的預算，我們不禁要問，政府和校方到底省下這筆錢去哪裏了？我們的健保體質絲毫不見改善，高教漏洞也越補越大洞。

我必須在這裡重申一次，境外學生，他們來台灣就讀的這幾年，並沒有真的排擠掉多少資源。以目前的數據，他們真正會使用到的健保才只佔他們自付額的一半！他們不是來台灣故意生病、他們也不是別有目的的來台灣求學！我希望當我們更認識這群面孔，我們可以少一點無謂的質疑，多一點對話的空間。
健保的問題不應該被在這個時候才被放大，然後就全部推到境外生的身上。事實上，我們認為這恰巧是一個很好的時機，我們可以來檢視健保的根本上面的問題，不分本外團結起來，向政府訴求，落實更平等的健康保險制度。

不分本外，團結起來！不分本外，團結起來！","1571677454","/NoHighTuition/photos/a.159802727519974/756218084545099/?type=3&eid=ARCk6lQA1IZAX59Jy4WWH3-f1dGwFpvw_asd7Lc368Ujdzf7sRWr7lRLZMCJ4KQ9ePOHx5CH5odCs4gQ&__xts__%5B0%5D=68.ARAEKpK1-2FwY2qxI6zp8f9jnXf56bNatBncPvp4HHS42fEbbc8AvhVyC90sYQ4BQ_zHL254b7y3Suld_xs_DaA62MiPSWOiormo1QOao94KOilqNQXGTtbwa2Gk7Lh59eqUiULYdHFkN-igUbnzQANwj48Ilnimi058_DQAacJWfsK9gWqcCvg8Nh4HUP-sJiVPD6xSZTXB0_n8GLjMRQ0QrpvDpbOdlDz4YPwsqJ4jkd2_a0oyZB3bg8vXxyfPdMnyeqtoBH2m93JEt0eHCFMJOtTlyMkCofQsAm76lGETF3AWkOd0tClGM9u6sQkRukOCJ7B5Lb5j5a5dp490bm8&__tn__=EHH-R","https://scontent-sin2-1.xx.fbcdn.net/v/t1.0-0/p526x296/18275089_756218084545099_3942176066381884551_n.jpg?_nc_cat=103&_nc_oc=AQkXWGC5yTeL6mSbqZUWRrg2_1eptgBU4pkoCBgyVU96vVfZ00TIzo5LNygzfD2OfnM&_nc_ht=scontent-sin2-1.xx&oh=86972f925580c5fcd5a03970f8b6fb43&oe=5E26EC8E","undefined","",""
"https://www.facebook.com/NoHighTuition/posts/772447162922191","1496634923","2017.06.05 反教育商品化聯盟 
【生師比值超標，教育部別包庇】記者會後新聞稿

 
今天(6/5)是大專院校向教育部申請調漲下學年度學雜費的截止日期，反教育商品化聯盟偕同其他團體到場聲明反對學雜費調漲的立場。今年受雇者薪資年增率倒退，物價持續上漲，調漲學雜費只會持續加重學生與勞工家庭求學負擔。
另外，反教盟質疑調漲學雜費並無助於改善高教現況。因此今天來到教育部前，呼籲教育部正視目前公共資源投入不足，造成全台灣生師比超標、師資不足的慘況，立即處理這些高教危機，停止過往的漲學費政策。

■ 學費高居不下，數所大學生師比超標，教育部還要繼續包庇縱容 ?
生師比是衡量一所學校教學資源是否充足的標準，依照教育部制定的《專科以上學校學雜費收取辦法》第12條、《專科以上學校總量發展規模與資源條件標準》第8條規定，生師比值超標的大學須以降學費、調降招生名額總量的方式來處理。
然而反教盟計算了104、105學年度部分大專校院生師比，發現在上個學年度至少有國立雲林科技大學、國立高雄第一科技大學、台北城市科技大學共 3
所學校生師比超標，而本學年度也有東吳、淡江、文化……等 18 所學校生師比超標，但教育部卻遲遲未處理，也未對這樣的情形有所表態。
生師比值越高，就代表學校的教師人力越不充足，也同時代表著大班制、併班上課的情形會越來越普遍。
文化大學自治改革陣線的陳邦安即表示，他們學校竟然用「自主體育課」來減少學校的教師數量，也不斷裁減兼任教師。
世新勞動權益行動小組的黃康偉也說，在學校總看到老師很忙碌，事後才了解原來是生師比超標惹得禍。
在這樣的教學環境之下，學生依然每年要繳納高額學費給學校，卻不見學校把獲利拿來增聘師資。而身為高教主管機關的教育部，卻也跟著長期包庇這些生師比超標、未聘足教師的私校。教育部這樣行政怠惰、姑息的結果，等於連續在104、105兩個學年中，將本應調降的18所學校、24萬6000多名學生一共超過1億多元的學雜費，白白奉送給了這些生師比超標、辦學出現重大違法缺失的學校。
高教工會青年行動委員會的蘇子軒說，這不僅僅是這18所大學的問題，而是所有大學都應該調降，因為高生師比和高學費的高教慘況指向的是高教資源挹注不足的事實。

■ 境外生遲遲不納入生師比計算，同時也會影響全部大學生的受教權益
今年3月底教育部才宣布要「把境外生等計入生師比，促使學校增聘老師、改善生師比」，看似好像要修正過往不將境外生納入生師比計算，讓大學招收境外生獲利卻不用相對的增聘教師的錯誤政策。(連結:《預告「專科以上學校總量發展規模與資源條件標準」部分條文及第4條附表1、附表3、附表4、第5條附表5、第6條附表6修正草案》
http://gazette.nat.gov.tw/egFront/detail.do?metaid=89588)
然而「專科以上學校總量發展規模與資源條件標準」修正草案，卻從2月底開始就被擱置，一直到現在都沒有施行。主管機關教育部應該立即將境外生納入生師比計算，合理反映大學應該聘足的教學人力。同時對於境外生納入生師比計算後，日間學制生師比超過23的學校，立即依照《專科以上學校學雜費收取辦法》第12條調降該校學雜費。
目前在台灣就讀公立大學的外國學生、陸生必須負擔2倍於本地生的學雜費，就讀私立大學的陸生學雜費則由學校自主規定。由於可以從外國學生、陸生身上得到更多收入，使得公、私立學校都無所不用其極地招收外國學生、陸生來台念書。於是就造就現在公立私大學，在想要收取學費獲利的時候就拚命招收境外生，等到要計算大學應該負擔的教學資源時卻把境外生當成空氣的荒謬狀況。
境外生權益小組的成員張郁聲明，境外生應該全數納入生師比計算公式，合理反映目前教師資源狀態，境外生也同樣是學生，不應被排除在外！ 

反教盟與學生團體最後向教育部官員遞交生師比超標學校的名單，除了請他們給予答覆外，也要求教育部公布各校完整的原始數據。同時也敬告教育部不要再繼續怠忽職守，立即依法調降今年18所生師比超標大學的學雜費，並且正視目前高教教師不足、學生受教權益受害的情形，應該投入公共資源增加大學專任教師數量，降低所有大學生師比、提高教學品質。

我們的訴求：
一、立即依法調降今年18所生師比超標大學的學雜費。
二、境外生應全數納入生師比計算公式。
三、投入公共資源增加大學專任教師數量。

新聞聯絡人:
賴沛蓮 0952-325-688 謝毅弘 0988-273-955","1571677454","/NoHighTuition/photos/pcb.772447162922191/772446622922245/?type=3&__tn__=HH-R&eid=ARBMeXsj0t6pg9rFQVPKT2rm7ezPp2s430upSNE5ljfBmWNs1jYmk1sT28jxG-02zEvq60TR5V-IXO4Y&__xts__%5B0%5D=68.ARDPCMHrRBYTO3Xea7kPkMgcNYAjPjeNGf272ilgnEQ_kNLED4snkrUvSpc7VTOak9gWKNWgcDBNifAsWJN4X0BWS9R8zRozvnzGuh7Ek7cey8UO8xMDiWysOPpbGHr-CuIxQKnXDc6NQOVigxHS-5mcr8EmzaSm405Gn7i5WomaM0LuUK7ayyjZYHC9yF_gzkpvr_-x9ZXIda65GnVY93KJvAXdCwUSOorQtw-JDzXJK_p_0tQ5F0UXdITAmsarPGzpoBiYAkZWmUUs_dtrQ4axMTXkeB_CyyHDLyIM_bb_ExowgLnx0a6w9eucDH7Hv5crNx8USDJSnGYfW_MWN30","https://scontent-arn2-1.xx.fbcdn.net/v/t1.0-0/s526x296/18835818_772446622922245_4589102086959861640_n.jpg?_nc_cat=109&_nc_oc=AQnnqdiDbbTrb4ZkOOJK9tFBhVI_vV2GUkEC43DSb5vZAQ5sJ4ypYPyzrCc91J4ujBU&_nc_ht=scontent-arn2-1.xx&oh=7c3f8a1a194b372c0f35346f4354cd1f&oe=5E614C1C","undefined","",""
"https://www.facebook.com/NoHighTuition/posts/812308068936100","1503141026","https://m.facebook.com/story.php?story_fbid=1958319487790928&id=1826729077616637","1571677454","/watch/rafflesianotes/?__xts__%5B0%5D=68.ARDE1Xylx-0_T2vr_NALo-UhLZZm1gfF7heSBZSOWo3_ww5xLA9KKrQy2oKsuIm50WpTfmYLn5PV-oSAF__3PcyQ22YG55uXrMqlhMWUjm63oaNHGASDu24cYfYt7sWmFdV-dpJkVej5cTZ3Z-zRAe--eMmZ6lIDz4xzF6HJzcTUAOMbCCspIzqo_ERNIS76P274MFwPRxCOcZWkN5oJq9bI_7zoIrzKsD-sLHDhYcNBY0rh3hmzl7rO8a_No_UPCxi3h3fKSlrVgrMPeI_LnjdXcws6FdjxpG1mDQ38z5BLPBFEQ_y1ZkYZBmPGvAHv2b8Bw6dKSO21qdS8J3e7hvxM63khgWWRS4mxswwLrt6rL7uGf_ytfKjU6jGX6ls8P_R5uPY2fKGb2MYshdVfwWs2iHHrxvTfGeLi70SCYKlvWBfTwC4AS0GKPLvXMFyP2JbVireB1iq2se7yTR3sia3pogk8kVKYNGJW7W8nRi7wFrpuN-ox3RpP7SVvu9KS3Ww&__tn__=kFFHHH-R","https://scontent.fldb5-1.fna.fbcdn.net/v/t15.5256-10/20995966_1958669294422614_2424152521946693632_n.jpg?_nc_cat=107&_nc_oc=AQkLDnRi6w9u--XQjcEn-X2tMjKOtjtL87eSvAMLwlywNMzCNqh_KKPc9mAN5nsbFJE&_nc_ht=scontent.fldb5-1.fna&oh=c7ef7f1b62f9fe06eea544915bbe9f51&oe=5E6275B7","undefined","萊佛士花讀書筆記 RafflesiaNotes","817 Views"
"https://www.facebook.com/NoHighTuition/posts/806602312840009","1502000738","https://m.facebook.com/story.php?story_fbid=1598321333573469&id=877860948952848","1571677454","/watch/youth.theunion/?__xts__%5B0%5D=68.ARAJEA0UdYulYkw3XtxRoYKZns3I3ShTP-vfPoIBwYnzGckLRnCiyhGWBVqZWrdPOx2OnglWcTgCarwueqaBMz4PZ6I2vms_ROkc6cIHmTJWs6aS7h2QC2sYo6MQLuQZd7RELfxI7YUn3Q6DUvHZ1riiCf1vUCPRMCIY4ZRbsE_ueETPn1NKcNbZk7pxWWIZSuWAreU6bIsvs3_SsmPZN5eqdjBEZsBZmhK3hBbqFbiEeffzYP13FzYZbOtFiekkS_qSWPtOr1rR374WynSYVDFChcofMyPKID7Gf5fC3fVJSP0B99vfEml05VO3I3ttOVbGeKC1EaD50-D0XNhkfw_C3lolyuHnBDA2uP4Y5SQZlC7X1sJdSIXz2p6js-WaaBnAVmzN4FcZHL2JwQ7TiQnyp8Hk-7I8Qa41Zbp1Plzfo4_bV2IMJ4-O5Kui887X9t9tPTIEqbb63aUf5vRkxkJ8mgD9kMTFN14kG01ALZmrzoCHUEcd6AmUiMgjz8kfMA&__tn__=kFFHHH-R","https://scontent.fbkk7-2.fna.fbcdn.net/v/t15.5256-10/20690720_1599529233452679_4321363284532920320_n.jpg?_nc_cat=104&_nc_oc=AQnsVVBeQR2feO0DcFNNSM1gCUErvH3G0bM5nFcDOAXi1zlXu7nVNPJGWdxMgxjkRKA&_nc_ht=scontent.fbkk7-2.fna&oh=bdf712c9f7eea44888b98061ba897bbe&oe=5E21E22D","undefined","高教工會青年行動委員會","รับชม 669 ครั้ง"
