url,posttime,text,crawled_time,attachment_link,attachment_img,attachment_img_alt,attachment_title,attachment_brief
"https://www.facebook.com/observertaiwan/posts/1162949327244757","[Error]: TypeError: Cannot read property 'attribs' of undefined","",1579307304,undefined,undefined,undefined,undefined,undefined
"https://www.facebook.com/observertaiwan/posts/1152417141631309","1569463200","9月號-大理市的前世今生
文/古蒙仁

 
大理市於1982年被中國政府列為第一批24個國家歷史文化名城之一，名列中國首批十大魅力城市之首。主要是自古代以來，它即是雲南地區的政治、經濟和文化中心，擁有長達500餘年的歷史和獨特的白族文化。

 http://www.observer-taipei.com/article.php?id=2603","1571398548","/observertaiwan/photos/a.239751572897875/1152416964964660/?type=3&eid=ARA8SazK6FcVVZEKjTkmfIpMSUaMEHEzAVP0rlORQh8IbvTvbWpDy8xFvhUJF54S8ZeqQNx3sacnlPAM&__xts__%5B0%5D=68.ARBhwxO1G7OaeQMP7ExcwUmFBXNXyd2S6ka5HpgzoVZ5rPNR3JJKxdsfzvOppfSRCTl2U3iyjqP7GXMwEa8Oh5ztCfGkccwmhTlTBmDdQPMV_WfGtLtiz6_rNZTWgucFcZwfJMabpN8zZNxUVM4o7TmJ-PwARz2ccp36Z0nxWCyJ4Qi4W8PCBP5cbiEz0B9SUyTf5FmUNzTpyi5B1TNSFAX4D08B3Kbce3--eskLIXltDNnx-wI36f6tPp_Roc_r3BetsKowYWrgSwjATVKjJrD2hmc1b8PZ19l5iTNFDG3dKScEBN1Vm5whbHJkpG473B7PmTqZ9nZNTkP2bi-lGeC_gQ&__tn__=EHH-R","https://scontent-nrt1-1.xx.fbcdn.net/v/t1.0-0/p261x260/70762095_1152416968297993_649990575231074304_n.jpg?_nc_cat=106&_nc_oc=AQlIS3nChRXa28rpQNIQEmF0XMevqOZb3Bcnm3k-Kyc_-ZnAqJCdE3-gLfJa7crv5f4&_nc_ht=scontent-nrt1-1.xx&oh=71ed7413e091deda3d0cbdd0180381a6&oe=5E6036F8","undefined","",""
"https://www.facebook.com/observertaiwan/posts/1172641996275490","[Error]: TypeError: Cannot read property 'attribs' of undefined","","1571398548","undefined","undefined","undefined","undefined","undefined"
"https://www.facebook.com/observertaiwan/posts/1132939056912451","1566982800","[今日短評]
抓屎上身也成了選戰妙招？
文/朱駿

 
【高雄市長韓國瑜妻子李佳芬在雲林古坑農舍違章改善期限截止，雲林縣政府今天表示，未見李佳芬回覆，卻收到李佳芬向內政部所提訴願書，農地登載內容待釐清，請求撤銷原處分。

 內政部官員表示，23日收到李佳芬提出的訴願，後續將依照法定程序，請雲林縣政府提出答辯，並召開訴願委員會，依訴願法規定，原則上3個月內作出裁定。

 
李佳芬位在雲林縣古坑鄉田心村的農舍遭媒體披露涉及違建，原發給使用執照的古坑鄉公所進行違章查報後，將結果提報雲林縣政府建設處，依違章查報結果認定農舍主建物一樓及二樓迴廊與後側建築有增建，與原發給使用執照竣工圖不符合，限期一個月改善（申訴、補照或復原）。】

 
一般人走在路上，若見垃圾糞堆，腦子若是正常，會避開，甚至會閉氣幾秒，以避臭氣侵肺。若是碰到在垃圾堆翻揀物品，八成是專業撿破爛的，搞資源回收，應被寄予同情與尊敬。若是見到抓屎上身的舉動，那就超乎正常智力的理解範圍了。

 
韓國瑜要競選總統，總統是憲法之前的一品帶刀侍衛，憲法彰顯的基本精神就是法治，這個帶刀侍衛就是要衛護法治，否則就是失職或瀆職。要衛護法治，自己與親人就要比別人更有守法的行為與精神，不是嗎？

 
韓的枕邊人李佳芬在雲林古坑的所謂「農舍」，已被自己同黨的地方政府依法確認為違章建築，還能有誤判嗎？在選舉的關頭，這種事就是一攤屎，特別是選總統之當事人的配偶，對此類事本應避之唯恐不及，巴不得趕快收尾結案。

 
不料，卻逆勢操盤，竟然提出訴願，讓事情拖得更久，令競爭對手黨的中央政府撿到槍，可以根據選戰步調需求的時機，對自己開槍，玩弄此案，使得自己違法之事更被擴大宣揚，可以依法徹底羞辱自己參選總統的丈夫。真聰明到不行？可能以為是逆增上緣，不惜抓屎上身，真勇，天下第一勇婦。

 
大家想想，如果我們選出的總統的枕邊人就是一個公然藐視法律，勇敢地和法律對著幹的人，這個憲法之前的一品帶刀侍衛的刀將是砍向違法者，還是砍向不遂其權欲的守法者？一旦當選，能不大貪嗎？

 這很容易令人想到了阿扁與吳淑珍，但印象中吳淑珍裝死賴活、鑽法律漏洞則有，好像還不至於囂張到明刀明槍和法律對著幹的地步吧？

 看起來，2020大選這一仗，國民黨真沒有絲毫樂觀的本錢。

 https://udn.com/news/story/120536/4012807…","1571398548","https://l.facebook.com/l.php?u=https%3A%2F%2Fudn.com%2Fnews%2Fstory%2F120536%2F4012807%3Ffrom%3Dudn-catelistnews_ch2&h=AT0A22PxiqN8vq6jlki9qk73jTMoM5rtifS_tG4mweDQxNvnuMWzRsJ7lNOTB9ZqJR1aU2Xg3FdwYGXZ_o5vP_kOCvYpxDTJXbN-Ulcr1faQ9yJcT5wOaP6eobMs7xLXq980O2pn4WyRo6ZY0KnTGGyo02XwQFJknQYKStQMAp98R3yirPgBjM5C8Xrg3I4ara0jVZSsoVcTXthBjL1OG_9exAEKinWIoMP-KO7rfTLkJWY_jmNENd4E-C0E3ZdYI02xUOOKssDBOCYYyeKZ721CncTCbTOrc0Ve8N7kaXMGhG_HlAUbT6MPK6wF0zUdiS04emofiOqVW_GNvjZKpdsnsC_I2-YG2HjD3VJMe18wnCyElztyt87Q2uEwGp-cYdhUyfzaZ-KJ2xqXvbbVFWxaph9m6A79xQm_2lNd0iXj8DoK-OzAOx58nydCWECSSbo_7cBGYABtJs3wdppetkUbyCyeMG3rKmzJtxvpj7-0stq7AdzjUhM9QQiuDcsSWHbgrDlQiSgmMG3kV-E5xaoEBUJ1-SHS1F50XixYoM_Y7an6ysVK2hK-UasxRVle88vPOQlCztiwJbx4-8la2kcknfQTYSTWcojq5zVGA0h2y9MTPr70jMi0hghrOxmQnkJ-HBp4o9813Isj","https://external-hkg3-1.xx.fbcdn.net/safe_image.php?d=AQDKaIIAk8ii6B33&w=540&h=282&url=https%3A%2F%2Fpgw.udn.com.tw%2Fgw%2Fphoto.php%3Fu%3Dhttps%3A%2F%2Fuc.udn.com.tw%2Fphoto%2F2019%2F08%2F25%2Frealtime%2F6734587.jpg%26s%3DY%26x%3D180%26y%3D104%26sw%3D784%26sh%3D523%26exp%3D3600&cfs=1&upscale=1&fallback=news_d_placeholder_publisher&_nc_hash=AQATfxRac_VMN_2B","Trong hình ảnh có thể có: một hoặc nhiều người và cận cảnh","李佳芬提訴願撤農舍處分 雲縣府尊重訴願裁處 | 聯合新聞網","高雄市長韓國瑜妻子李佳芬在雲林古坑農舍違章改善期限截止，雲林縣政府今天表示，未見李佳芬回覆，卻收到李佳芬向內政部所提訴願..."
"https://www.facebook.com/observertaiwan/posts/1146979082175115","1568617200","[今日短評]
民調問題大，反映一些可能情況
文/朱駿

 
【國民黨總統參選人韓國瑜的民調數字這2個月下降，但從三重造勢盛況及拜廟時的人潮簇擁來看，前行政院發言人、傳播學者胡幼偉以自身民調量化專業指出，太多人不願接受民調電話訪問，也是使民調失準的最關鍵原因。

 
胡幼偉在臉書分析說，先假設有些民調機構並未捏造數字，而是照一定程序做民調。從民調的技術面來看，不管是只市話民調，或是市話民調、手機民調都做。一開始確實是經由隨機抽樣，選出訪員要撥打的市話或手機號碼。問題是完成率經常只有4成，甚至更低，也就是說，打10通，只有4通願意回答。但這樣就不能交差了，因為要湊滿一定的完成份數，那就只好繼續再打電話，直到湊滿一定的完成份數。】

 
台灣的民調在最近一年，自2018選戰在去年九月炒熱起，就出現很多奇怪的狀況，一樣的百姓群體，各家結果差異卻很大。很多民調結果一看就知道是為人量身訂做，有些原本還講信譽的民調機構，也開始隨俗造假，想引導風向，影響選情，跡象明顯。

 因此，現在的民調只能參考，解讀特費勁。不過，不同立場者共同說謊時，也會不小心說出一些真相。

 如果「太多人不願接受民調電話訪問」，以致「完成率經常只有4成，甚至更低」為實，這應該是目前挺韓一方做民調時所碰到的真實問題。

 若胡幼偉所說為實，合於實情的民調應該是拒答者占大多數，但目前大多數民調的拒答者或不知道者大都在十幾個百分點，極少數超過20%的情況來，這些民調結果都大有問題。

 
受訪率太低不只是破壞民調賴以公正的抽象的隨機性，而是令民調機構為了產出民調，極可能會人為調整數字，積久成習，民調就有可能出自幾個人坐下來商量的結果。各家「要湊滿一定的完成份數」的情況下，公布的受訪人數是不是也經過調整了？民調就成了調酒。所以，「先假設有些民調機構並未捏造數字」根本就是天上掉下的假設，自我矛盾。

 
在這種情況下，縱使不加以人為調整，所反映的民意盲點極大，也就是說，目前看起來的贏家未必真是贏家，而且極有可能同時討厭藍綠者為數不少，第三勢力真有發展空間與可勝出的機率。

 https://www.chinatimes.com/realtimen…/20190916000797-260407…","1571398548","https://l.facebook.com/l.php?u=https%3A%2F%2Fwww.chinatimes.com%2Frealtimenews%2F20190916000797-260407%3Fchdtv&h=AT11N1xiQ32CzMmYeo2Fe6CGNZ9A7YXFCz1JqlJv8A_n8QnxSe-9rCuFW8Z1wvhHPOS3ZU-HV6WpA-kwcH24wWJhgLONDSlNQOijpPHLkqIHNSH91U-WKJJqRDGqqqD0PpqVViWsT1btZ9LC2vZHpPvA3pai9HTGMTf_HUMcZWEkClJuTGU-R0k6PNJTJIweilPBOV1KyzuV1q7P-lksBvaimsGeKYSjYcrp8MjygThAFw2Qz0z4-ZGq8wWxD3wzvpljq0SK_Sf384hH3t3-IDuPzI9TFMNEQlljpPjJ-_gZwzSByilCyKMzE-Aq1rQZnRLzg11RI8MxdSCyaZmA-dg_gK5j3NMgDlAbr4iiTMvS86laWiSz_fiQeyBq6_hL7am1XwnUH5rynVSbBireMoBEkj-38Z79qGvje1bV6OY5g2HC89SM2FJl3Uh0szQkXGgVdAX9Gdy9EnroSrzSBO5NferSCN5Q_FQGsDzYBxKQnqs1OcQXulY3gItwJ4WJ8R3qpWP0cr1bMvNMXSJnSD_4aFGK5DMztK_9Yq1u8VgVhDoKaoj-mdUj9cMor9vCrBck6pdMW9JZg0sksu0EPDVkj0SjfsUBUzfpz3F0LtrQmPYSre7tpZKMAqaAe6-6arTc3Tyh9RLRspTk","https://external.fpnh10-1.fna.fbcdn.net/safe_image.php?d=AQBVu16u5xt9mufR&w=540&h=282&url=https%3A%2F%2Fimages.chinatimes.com%2Fnewsphoto%2F2019-09-16%2F900%2F20190916000806.jpg&cfs=1&upscale=1&fallback=news_d_placeholder_publisher&_nc_hash=AQA_QgKemioulh7r","國民黨總統參選人韓國瑜14日展開鐵人行程，狂掃台中21座宮廟，韓粉擠爆。（資料照片，黃國峰攝）","韓聲勢旺支持度為何反而下降 民調專家分析原因 - 政治","國民黨總統參選人韓國瑜的民調數字這2個月下降，但從三重造勢盛況及拜廟時的人潮簇擁來看，前行政院發言人、傳播學者胡幼偉以自身民調量化專業指出，太多人不願接受民調電話訪問，也是使民調失準的最關鍵原因。胡幼....."
"https://www.facebook.com/observertaiwan/posts/1147747635431593","1568703600","[今日短評]
郭台銘棄選，國民黨依舊難整合
文/朱駿

 
不論什麼原因，郭台銘已經正式發布聲明，不參加2020的總統大選。若是柯文哲也不選，縱使親民黨宋楚瑜、時代力量黃國昌或王金平參與競逐，影響的範圍太小，基本的盤面還是回歸藍綠對決，就是蔡英文與韓國瑜對決。

 
一般認為，郭若棄選，有利於藍軍整合，這是就表面形式而言，就實質而言，不能說一點效用都沒有，但可能只在於消極地排除了郭的吸引力罷了。是否會得到郭的鼎力相助，達到真正的整合，恐怕還要再多觀察。而且，看不上韓國瑜低俗江湖作風的藍軍是否會因此被迫投韓，是個值得推敲的好問題。

 郭在棄選聲明中有一段話值得推敲：

 【一肩挑起是承擔？又或者，放下才是真正的承擔？

 
我參選總統的初衷，是希望能夠帶領台灣社會齊心拼經濟，但投身選戰以來，我看到的卻是一些政治人物為了私利，挑起階級、仇恨、對立等民粹，那麼，這些會因為我義無反顧的挑起責任而終結嗎？抑或是需要我放下才可能拉回走偏的旋律呢？】

 他這裡提到的「為了私利，挑起階級、仇恨、對立等民粹」，就現象表現而言，蔡韓兩營都有，那就要看看，誰的程度明顯偏大。

 
郭接著又說，【當我聽到一些支持者即使遭到言語霸凌也仍然堅定支持我時，更是讓我感到心疼與感謝。】此處指的「遭到言語霸凌」，處今之勢，鑒諸事實，當不作第二人想，除了韓粉，沒有其他。何況，幾天前，公然在眾目睽睽之下故意羞辱馬英九，難道郭心裏不清楚？

 以這樣的心情，要郭在吞下屈辱，又看不順眼的情況下，已經公布退出國民黨，無黨一身輕之後，重新蹚入國民黨這盆渾水，恐怕機率不高。

 
登記參選總統只剩一天，就看柯文哲如何動作，如果沒登記，縱使將來由親民黨提名，戰力必定大打折扣，不具備三腳督的基本形勢。這次大選就在折騰許久之後，還是回到老戲碼，藍綠對決。如果柯毅然決然登記，那還有得瞧。

 
若回歸藍綠對決，以一段時間的各家民調來看，蔡英文已遙遙領先韓國瑜，韓依然不斷犯下低級錯誤的情況來看，民調要掉頭反轉，實在不易。縱使有所羅門斷交事件，可能恰恰為民進黨炒作的「亡國感」添加柴火，助其力道。

 因此，若是情勢發展趨勢不變的話，蔡勝出的機率非常高。

 https://udn.com/news/story/12702/4051096…","1571398549","https://l.facebook.com/l.php?u=https%3A%2F%2Fudn.com%2Fnews%2Fstory%2F12702%2F4051096%3Ffrom%3Dudn-catelistnews_ch2&h=AT3zee0vhBPxo-Kk57tjXASHYAaA3bBLoZmxphT3B39MAIxFTaiio59A02OhLfRGA-8f7sAUKBgnbjMPzMrRBJ9PQjkBGBuGI4DOp5zHlqwT_okos_qxMApcJJhnuI-buI-3f4bMYM8FWRjdr7eSQPI78TtQBhNcDbvs_H5tAjrrjzrTUeNgDhjIXJXF2C1HWIGg_sN6_guIt_bTt1k6ixug5IFmC_E2jh_IjYbGkN8qD-qgAdye-GblLRXJFDBjyFHMYeR6pkwn1UPzzrNXYk8V2pb7s0Hp_ueALkq-Q3ZEOEeFQnIK0fY8ldwHEWnXTAAYrWNIJgMtlwgUKlwCaFiomNwLSjAFd5n18A2KhGverEwoTTLlqWa95k5PDDtS8tRIpndy2DsPN8D4KoyZDfBBmxlhYCfii3-yygJpGFXzltxyAhy5qhybu7ESIj0H9yrvSnVCDScae7dbJSKRjNzwDKhon-RbkYEVABi2TtSKKurpNBNO-fTqiVBt46hZdeSlN6pbVOvq4XIbbw_AcErde-aYU-LqbGmBiZfuPi8VNO485dp-JSmAXYx0j7NDOmbOoO-WvwanQ8y5Eawx1V5dDhUq21024LF6fR1YTLkHJkvs2KGmn39UJ8aWYJur3fr54hOBdu1Q_mU2","https://external-sin6-1.xx.fbcdn.net/safe_image.php?d=AQAwcUsbs2bR3o45&w=540&h=282&url=https%3A%2F%2Fpgw.udn.com.tw%2Fgw%2Fphoto.php%3Fu%3Dhttps%3A%2F%2Fuc.udn.com.tw%2Fphoto%2F2019%2F09%2F16%2F1%2F6827526.jpg%26s%3DY%26x%3D4%26y%3D12%26sw%3D1014%26sh%3D676%26exp%3D3600&cfs=1&upscale=1&fallback=news_d_placeholder_publisher&_nc_hash=AQAFW9vryqg_vNLp","郭董發表重大聲明 決定不參選2020","號外！ 郭台銘不參選總統 「對不起，讓你們失望了」 | 聯合新聞網","鴻海創辦人郭台銘終於做出最後決定。明天是獨立參選總統的申請最後期限，郭台銘今晚通知幕僚群，明天不會去登記參選。 根據中..."
"https://www.facebook.com/observertaiwan/posts/1161345710738452","1570172401","[今日短評]
為何柯文哲批不動陳菊
文/朱駿

 
【陳菊9月19日接受中央社專訪表示，柯文哲每次說到她都怒氣沖天，「我的生命跟他沒有交集、也沒有往來，就是尊重」。也提醒柯文哲，不要忘記台灣人民的厚愛，「不然柯文哲在踏進台北市之前，跟台灣民主發展沒有任何關係」。

 柯文哲3日接受《新頭殼》專訪時表示，他對陳菊的回答感到不齒，「以前坐牢時候，我們在哪裡？我在台大醫院當醫生啊，怎樣？」

 柯文哲也說，民進黨在高雄縣執政30年、高雄市執政20年，「最後結局是天怒人怨，誰要負責？陳菊啊，就是陳菊啊！」「小英旁邊站陳菊，我就瞧不起妳！」

 柯文哲更重批陳菊，「不是妳上半生坐過牢，下半生就可以為非作歹」、「當年坐牢不是只有妳一個！」】

 柯文哲與民進黨的糾葛似乎有纏繞得越來越深的趨勢，近一了年，對民進黨批判的火力旺盛，有增無減，國民黨全黨對民進黨攻擊力道的總和恐怕尚不及其半。

 
這可能是柯出身綠營，第一次當選市長是民進黨把屎把尿扶捧上去的，與民進黨有過深度交往與合作的經驗，因此對該黨的伎倆知之甚深。民進黨當然希望柯能感恩圖報，成為該黨聽話的側翼，但柯個性上決非願因此扶捧上位，成為受制於人的魁儡或玩偶，遲早衝突，勢在必然。

 柯文哲近兩年將批判矛頭指向民進黨中的新潮流系，先是有段宜康，自2108民進黨大敗後，漸漸轉移目標到批判陳菊，外帶蔡英文，這是攻勢升級，而且力道更大。

 
陳菊把高雄搞得千瘡百孔，一場雨竟然現出了5000多個道路坑洞，這麼明顯的事實，要說這其中沒有嚴重的貪腐，植物人都會憤怒，何況還有氣爆與慶富兩案，若真好好再查，肯定還有其它。若要攻擊民進黨，柯挑上陳菊應該是合理的選擇。

 不過，近兩個月來，柯的火力固然可觀，但效果似乎沒有同比例增加，這固然有大環境因素，客觀形勢對民進黨有利，可能有一部分還在於柯文哲自己身上。

 
自2020總統大選成為熱門話題以來，柯文哲自始就有意讓自己成為話題焦點，來勢洶洶，多次表達既不能選菜包又不能選草包的明確主張，這自然給人民一種敢於擔當、且真有要改變台灣政治文化的期待。

 
但是，成立民眾黨，基本上已是戰略退卻，過了9月17日之後，讓人感受到，柯所說的大話都是空話，不可期待，在這個台灣政界最嚴肅的議題上，都可以輕率玩弄，最後竟然好意思說出「我從來沒有說我要選總統」這樣的話，以為如此就能卸責交代，這與自己所批判之擅於玩弄話術的草包有多少差別？加之，柯近來發言隨便，事後又多狡辯，也會衰減自己發言內容的正當性。

 
柯文哲說，政治不難，莫忘初衷，但是與民進勾結在一起的初衷為何？自己可曾深切省思過？如今又與民進黨翻臉到這種程度，給人今是昨非之感。既然今是昨非，那麼初衷是不是有問題？還能莫忘初衷嗎？

 https://www.chinatimes.com/realtimen…/20191004000014-260407…","1571398549","https://l.facebook.com/l.php?u=https%3A%2F%2Fwww.chinatimes.com%2Frealtimenews%2F20191004000014-260407%3Fchdtv&h=AT11w36N1tn7LuIr03BTvpwP57KpfzS0FnUKHAJoD8zJLqkIrzXK6suZchVS-tuDsRmsZ7kmIak_NP0uQQAoj80TQtMc3HwNuo2YKfowMPyUpT02WsQMgHSFnMbljPb2nzIMFFJL9ccp_NJoV6zyMnNp15-ycZ_KitFjtNsT0LBw52p6xJtHx9dSW3raRvCnvsgdpZdqWhrWCyRUbXc3JhOPlF-a4Y9oXpmBSNOb8R2Bm-47hfNmFlekpOBhQBEulI73zVgBVxAyI12Rfehw8voAU0z602EJBITS3bBiXkkgzVQZJoEZRxqaVlZtgyOl-5OQldMwFy2pW15MH2oxTWSyOG5JJGDjVdHpyB7KAKrLM4ySEt9duOx9aF0MbSrJidRb_s4pHMY5i1E8nbCkM4pGULLrG4i9Kkdr_ZIU8LGlgSe5J_UswRNSUGhAaZDmJUvbWfMUBSchHUUOvX0u1KQC1dyjxnyappDHLW0yWT5wywPyxJkJUXEPzGXNr-1udLOiz9lveXH9tFtKozQaeLJfmUsMjiFIYnCvySaSWL23m6RT0u7WGc4kmIBTqb9ykr0BZDxt96v7x58u8GL5i4_TW1S-_y7whOGnQQ25rOAZUD0Kq3sP8TTbdPkFJZbNu6JE0QUzNVoO2XbS","https://external-sin2-2.xx.fbcdn.net/safe_image.php?d=AQDRMA1p3B-7rzIg&w=540&h=282&url=https%3A%2F%2Fimages.chinatimes.com%2Fnewsphoto%2F2019-10-03%2F900%2F20191003005261.jpg&cfs=1&upscale=1&fallback=news_d_placeholder_publisher&_nc_hash=AQAHBoBOYaW6t8-k"," 台北市長柯文哲。（郭吉銓攝)","柯文哲重批陳菊 不是坐過牢就可以為非作歹 - 政治","台北市長柯文哲接受專訪時痛批陳菊，「不是妳上半生坐過牢，下半生就可以為非作歹」、「當年坐牢不是只有妳一個！」柯也說，他們以前坐牢時候，「我在台大醫院當醫生啊，怎樣？」民進黨主席卓榮泰為陳菊抱不平，呼籲..."
"https://www.facebook.com/observertaiwan/posts/1165624776977212","1570604400","[今日短評]
民進黨的外交好像已經可以自己製造
文/朱駿

 
我駐日本大阪辦事處福岡分處四日在當地舉行的國慶酒會中，公布日本首相安倍晉三賀電，電文出乎一般常情與規格，經媒體詢問日本官方，遭首相官邸否認發出該賀電。因此，引發電文造假與來路不正的質疑，駐日代表謝長廷自然也被問及此事。

 
【謝長廷表示，福岡分處沒有向他報告的義務，體制就是如此，但此事最重要在於是否為真，如果是假的當然很嚴重，「如果是真的，就是外交有一些…我們都能體諒大家的立場嘛。」謝長廷說，台灣有所突破，中國大陸就會抗議，是必然的，但不能好大喜功為了突破造假，這很重要。

 
往年收到賀電時是否都會公開？謝長廷回答，「慶典收到賀電就是要展示，不然要收在抽屜嗎？」至於駐日代表處昨天有沒有收到安倍賀電？謝長廷沒有正面回應，只說「有展示就承認、沒展示就沒承認。」】

 日本政府若有這份電文發出，顯然沒有飄洋過海到台灣來，若是發給我們的駐單位，會發給我們的哪個單位？是謝長廷所在的駐日代表處，還是大阪處或福岡分處？

 福岡分處究竟從哪拿來的這份電文？謝長廷竟然說不清楚，這與「福岡分處沒有向他報告的義務，體制就是如此」，似乎是兩碼事吧？

 日本政府向來看不起台灣方面，不會低三下四、自我降格到把總理的文書直接發給層級如此低的代表台灣方面的單位吧？出了這麼大的事，謝長廷可以就此一句話推得一乾二淨？

 
至於究竟「駐日代表處昨天（10月8日）有沒有收到安倍賀電？」一個簡單的是非題，謝的答話簡直複雜得像申論題。說「慶典收到賀電就是要展示，不然要收在抽屜嗎？」又說「有展示就承認、沒展示就沒承認。」顯然，10月8日沒收到賀電。

 
謝的這些發言意思就是有這麼份賀電才是，因為4日在福岡已經展示了，應是承認收到。謝還表示，「日本政府沒有說賀電是假的。」此處答的「賀電」應指4日那份才符合說話的脈絡。那麼，此電文確實是他經手交辦，下發給大阪處或福岡分處的，應為合理的推斷。問題是，記者問的是10月8日之事，福岡展示的電文在4日已經出現，謝竟然模糊兩者，故意混淆不清，試圖糊弄外界。

 
如今日本官方否認有此4日電文，「日本政府沒有說賀電是假的」是一句公然欺騙的大謊言，應無可爭議，謝已無逃遁的空間。而此電文確實為謝長廷所知，依其昔日「合理懷疑」的老說法，此賀電是不是出自謝氏公司自製，或委由日本當地人製造，再假冒安倍晉三之名發給駐日代表處？嫌疑頗重。

 出了這種事，是給所代表的國家臉上抹了難以清洗的黑漆，這種駐日代表還能不立即撤換嗎？

 https://udn.com/news/story/120765/4094160…","1571398549","https://l.facebook.com/l.php?u=https%3A%2F%2Fudn.com%2Fnews%2Fstory%2F120765%2F4094160%3Ffrom%3Dudn-catelistnews_ch2&h=AT1VVtQLCsm5aw62mjSnyHocMe8ywbGXveNanmJC37RAMWs00YLU6g4I_INGW_4EpxKuHWUHTFEewi2Ar3CEKAffd3009cJFa9WFu7ZKHQmikEjhtOrE-Zh1Tpy4DXDiwjwxKAjwckBlDbU-pvz0BMbJjaWEuQEhCMXP2gVIwDF0mpCgfFFBgaSp41p2lY4dhZmzpG_J6wYxAU6iutofBhTIWUuV6IVAPVjKV_450WDpGZlXthaDqU0me03qghk70QgU4QgtfEkJyRGjU6KG6TtSAcAOF1ukkeHVjuTcFA2BpKtombyGOKAZKi66Zb8Z1fUNNys8MyeVf4FKqw2-HRu6FJGAriEr7tN22GCQjsToNkfxOPpJZ5jgAuAFmclfZCvSYLsARlsMLF_NVOJXxKseWN9U_uwrr5VyYg3AobCie2vMY0QECwI2icd6rRhgtAq-8ba2TPxghERRjfDme80OJo5Lr8DmV-S0pELoqijdH2dtl65xKSi-KL-S11XigdVEnovvN8kGjz_CLgDCSqdwFfvkb7rHoo6v_csj7JkUrsH1l5PB2K5NwTKamHHxu953-RIFtMvWBaFrNSHl837rEwGNGiw3IPcGOAKyxj91jdflfHPLQvJ5fe87YiQZLv4pSpL_3pgK8n3T","https://external-sin2-2.xx.fbcdn.net/safe_image.php?d=AQBVlGHBhdoHCMmz&w=540&h=282&url=https%3A%2F%2Fpgw.udn.com.tw%2Fgw%2Fphoto.php%3Fu%3Dhttps%3A%2F%2Fuc.udn.com.tw%2Fphoto%2F2019%2F10%2F09%2F1%2F6918943.jpg%26s%3DY%26x%3D122%26y%3D4%26sw%3D1074%26sh%3D716%26exp%3D3600&cfs=1&upscale=1&fallback=news_d_placeholder_publisher&_nc_hash=AQAyrf7yqBshM7vp","Image may contain: one or more people, people sitting, table and indoor","謝長廷：日政府沒說賀電是假 | 聯合新聞網","我駐日本大阪辦事處福岡分處四日在當地舉行的國慶酒會中公布日本首相安倍晉三賀電，事後卻遭首相官邸否認發出該賀電。但駐日代表謝長廷昨晚主持駐日經濟文化代表處國慶酒會，被問到日本首相官邸否認發出該爭議賀電，..."
