url,posttime,text,crawled_time,attachment_link,attachment_img,attachment_img_alt,attachment_title,attachment_brief
"https://www.facebook.com/opinion.cw/posts/1439249009575374","1579060802","【當你們想要的是權位，我們在乎的是我們的城市】

 高雄市長韓國瑜競選總統失利，如今又面對高雄市民發起的「罷韓」活動。

 
在藍綠雙方眼中，這樣的行動可能有種種政治權力的操作考量，但身為高雄市民的作者卻反駁，即便早期的罷韓行動真的是起因於政治惡鬥，之後的罷韓，卻更反映市民對這位市長的疑慮：
http://bit.ly/3afznAH",1579392914,"https://l.facebook.com/l.php?u=https%3A%2F%2Fbit.ly%2F3afznAH&h=AT3SCfYXFvL6NAuywrqZstsIJoWPM4C0eBqTqI8q2LwcREh0Y7Wm41O1E0YpnEjs0mVzg1L57cZJfoQTP9XGvYURc9SkRo5JXpMNR81KrUbEEF2nP7bUfm8Z0WpjnSh-7mJJ7sHFDs5E3YaC9lUZB37MDd6NTRaZNpDqiKSotFG2iIQaFxk_TtTwlEXIoYzcohLrxsAph0-vEhFBwmQosCzSXbA4MPZli7D-qjfTQRQOoVz8LN-0nAvVAf_Qrqq_KFk07_X34m_kp9qvNG69v1RBFhKOEU63SxBh6OXEJQR0SMxBormxwU-urrC7TdQGQR7mMWOR_dY9VWRppKT6nSOgVVe-MoPnt42WnZ3_ehzMKMBNTZ4BeXLPm0Kqzu4S_3R7JPkuI2LAHjrpvUISOtiKABX4UxEruAA1gr_DroFKEoYO8cM89UZEt9khnGZdgFAGZAZjYL3-Zv3TnGC6QaTh4y-8g0Hm7xapTvBs1ychBRS7WbAWvM3a_bDDWjYFQuuDm8IjQi-ywLzEuGk7k-dLJbYjlWrVDWMXAhbQILgrMZzTwMMVHQjE6KGmjjcdl-m1YZYd_9-tSOdU7FRsh-fM8BnpF8_oBZIcJdLBgjxmjTTc9C1XP-QYcquUKyMl3zxe5YF6ArLRlVVO","https://external-cdt1-1.xx.fbcdn.net/safe_image.php?d=AQCEI6lVv8UiXylU&w=540&h=282&url=https%3A%2F%2Fstorage.googleapis.com%2Fopinion-cms-cwg-tw%2Farticle%2F202001%2Farticle-5e1e75720cccf.jpg&cfs=1&upscale=1&fallback=news_d_placeholder_publisher&_nc_hash=AQC-RI0Y7p5k9wRW","Image may contain: one or more people, sunglasses and closeup","大選結束，隨著選舉結果塵埃落定，社會運作也逐漸回歸日常。但在高雄，罷免市長韓國瑜與否成為新一輪的大議題。 該不該罷韓，每個人各有主張；而無論支持罷韓與否，都需要好好解讀罷韓。本文從個人做為高雄市民的...","opinion.cw.com.tw罷韓嗎？為什麼？──來自高雄市民的思考｜辛翠玲／探索天下｜獨立評論大選結束，隨著選舉結果塵埃落定，社會運作也逐漸回歸日常。但在高雄，罷免市長韓國瑜與否成為新一輪的大議題。 該不該罷韓，每個人各有主張；而無論支持罷韓與否，都需要好好解讀罷韓。本文從個人做為高雄市民的...大選結束，隨著選舉結果塵埃落定，社會運作也逐漸回歸日常。但在高雄，罷免市長韓國瑜與否成為新一輪的大議題。 該不該罷韓，每個人各有主張；而無論支持罷韓與否，都需要好好解讀罷韓。本文從個人做為高雄市民的..."
"https://www.facebook.com/opinion.cw/posts/1440620236104918","1579348800","在中國，記者的工作就是兩個字──「宣傳」。剛聽到這個概念的時候，震驚的不是我從來不知道或沒聽說過這裡的環境，而是世界上真的能有一個所在，是對新聞自由置若罔聞、明目張膽地扼殺它──而且沒有人會說不，包括新聞工作者自己。

 無論是新聞還是電視節目，在做之前首要考慮的絕對是「不和政策牴觸」、「政策限制問題的考量永遠優先」。我在中國碰到的老師甚至直接吐槽：
http://bit.ly/3acUljq",1579392914,"https://l.facebook.com/l.php?u=https%3A%2F%2Fbit.ly%2F3acUljq&h=AT3yYESMYc5YQs8MJ8r2YPvHwx_7AnYVtBotdt2MhK0O5A8aJiJsOf3vlJ3Y3aPk2jPT7yN7NOkzWjVRbBny-MyzmQIFPmHBTfb6Z0URxU39twjeJ93fR79gKiLHVH2O1UoH8wNjJoEbx0zd5_BoqRoF5BQ8tjfGG-0zqA2TAivDmmYdc3AJY-fcD9SWzcNuXtVwwGYj0TSjJSKvYHUPwenVZjQLyNp1YaEvg6ePEPldWVx-M-MAA4vzbK-Oo1DQAFoTYl7zfN35rCyxqE2oFTTb6_X6PqqGepeW8HiuulvopWZ9nkXpyMW8kbb4BF7BhBISNcAAtAFRQe7-LJUyPUGWgUOIvnKcnsDTE_xN6kuQiq5Ok6yK3RNlVwm8wZmQXbn77r7ZjkFWkBAzirmCYPDfEpIt54aTtsV5n1OCInOWLw7sIobY2YJFOssJA480hwPCUYG2ocDb-XfSvDV4r4gdEcsDG80dwsqrTTJnZkgHr6V8FXHmVTb71FfNMBorfKJxtXq4p8xfZl_EGk0nlFHDMHyAKllJbmed1JLX4SzpJrX5dLRfOag2cQUle8aApgNolQZa6Fag23qRbvydT0XXN4_JScsgqibtBspHhKID3qBgWLvehH_TCTN1TFAjDl4uBWfV_OxQ_MUx","https://external-sin6-1.xx.fbcdn.net/safe_image.php?d=AQCalDm9GDasgUj5&w=540&h=282&url=https%3A%2F%2Fstorage.googleapis.com%2Fopinion-cms-cwg-tw%2Farticle%2F202001%2Farticle-5e200caed8a1f.jpg&cfs=1&upscale=1&fallback=news_d_placeholder_publisher&_nc_hash=AQAQmGU2IP3K-9sl","Image may contain: one or more people, people standing, sky and outdoor","2019年赴中國大陸交換，我在北京的中國傳媒大學修了一堂名為「電視節目創意與策劃」的課程，老師是一名從小跳級、很早就上大學的博士，世人眼中的高知識份子。她曾說她很驚訝外國人對中國的傳播環境的想像：封閉、停.....","opinion.cw.com.tw【投書】赴中交換學生手札：當記者等於宣傳公器，還有誰在意新聞真相？｜翁如儀／多元發聲．讀者投書｜獨立評論2019年赴中國大陸交換，我在北京的中國傳媒大學修了一堂名為「電視節目創意與策劃」的課程，老師是一名從小跳級、很早就上大學的博士，世人眼中的高知識份子。她曾說她很驚訝外國人對中國的傳播環境的想像：封閉、停.....2019年赴中國大陸交換，我在北京的中國傳媒大學修了一堂名為「電視節目創意與策劃」的課程，老師是一名從小跳級、很早就上大學的博士，世人眼中的高知識份子。她曾說她很驚訝外國人對中國的傳播環境的想像：封閉、停....."
"https://www.facebook.com/opinion.cw/posts/1440621332771475","1579312800","你吃過蒲燒鰻，那是否吃過「蒲燒虱目魚」？

 鰻魚如今越來越稀少了，甚至有饅飯業者因無法承擔高成本的鰻魚而宣告歇業，於是有人開始尋找其他魚種代替。其中，台灣南部盛行養殖的虱目魚，就成了其中一種選項：
http://bit.ly/2uUKoHh",1579392914,"https://l.facebook.com/l.php?u=https%3A%2F%2Fbit.ly%2F2uUKoHh&h=AT0IGTCxq59JghA_L8kDRfU5Svws-70s_SgISbfJ4ijIoGBosc4s3jFHTfb3F0fLOgRq88ESHCvMwejKjV2dev2mai4UVQfmD_SBtyECwf0PtVN6c0fxWNzNxwh8KID5Vfy0p6hU69HMeljbFikQAT-SYzs2yV7UzdVbFGzyRPvGkK7x33KTUhcjIDPmKhtRh8Mo5qcIkN3ODBdEXeXTwm_D7NjBzXEPJCA8voSvu_xHpk2HOcWu8yRm7DpQE_9YC0HJNyRbAwhFEORig8Zci3WD1ra_0GG5oDsGCkjoYpk7BM2GONrDsrEtyi48cX_q6jcqRnkwRrh3VyYuzsgfiYgF2ECidIcS2c3wlLjfSfuD9qY_Qjcr_NGqscj_UTX-HwBf5wVxjnL9eOE9_q0chMKlPIgE6KKCzGoijf0zbCvq5FF-IcQvfElfd5FH7uN0Ku6BqUIOhP5aq4plicuhsO5zAzJYRsYIqjiMY8nc-J8GgZdvWuSC6MtHY63X58mgfpvu9BNjCeh2Kmn31giiW0ml9VQ9q6pkNHOogsZJDX-P-nhY2LT0IsuPYe3qG4ouQKf-ZMqL3KM3-Kao8o3GHtQVpYdfG8F1MUeslkPs28xs0r3RekMIBqefmh0kkmXwLQqYKb94K8DfxiST","https://external-sin6-1.xx.fbcdn.net/safe_image.php?d=AQBDMSQq3TAq_28D&w=540&h=282&url=https%3A%2F%2Fstorage.googleapis.com%2Fopinion-cms-cwg-tw%2Farticle%2F202001%2Farticle-5e200a994b128.jpg&cfs=1&upscale=1&fallback=news_d_placeholder_publisher&_nc_hash=AQBup9ZRjUEkLNXj","Image may contain: food","蒲燒二字原是漢字，現早已成為日本專有名詞，發音為Kabayaki（かばやき），常見的料理是蒲燒鰻，但有一回，我吃到一道大廚的創作，端出「蒲燒虱目魚肚飯」來，竟是如此甘甜可口。 關於蒲燒的詞源，在日本有許多不...","opinion.cw.com.tw蒲燒虱目魚肚飯，有創意！｜魚夫／魚腸劍譜｜獨立評論蒲燒二字原是漢字，現早已成為日本專有名詞，發音為Kabayaki（かばやき），常見的料理是蒲燒鰻，但有一回，我吃到一道大廚的創作，端出「蒲燒虱目魚肚飯」來，竟是如此甘甜可口。 關於蒲燒的詞源，在日本有許多不...蒲燒二字原是漢字，現早已成為日本專有名詞，發音為Kabayaki（かばやき），常見的料理是蒲燒鰻，但有一回，我吃到一道大廚的創作，端出「蒲燒虱目魚肚飯」來，竟是如此甘甜可口。 關於蒲燒的詞源，在日本有許多不..."
"https://www.facebook.com/opinion.cw/posts/1437391559761119","1579003200","2019年行政院推動的「地方創生元年」，正式宣告：台灣人口失衡的危機，需透過國安層級的「地方創生國家戰略計畫」才可能妥善解決。如今，一整年過去了，台灣的地方創生還好嗎？

 從不少鄉鎮區域推行地方創生計畫的經驗看來，不乏這幾個問題：http://bit.ly/37ZQ6WA",1579392914,"https://l.facebook.com/l.php?u=https%3A%2F%2Fbit.ly%2F37ZQ6WA&h=AT33JiXMBLOFFRvwgkhoX_J_FuvcLhvCR0mcXn2PQfoAtWyttwx6ZtZU_VHJ2YKb3Z9MGQIeavybtuvH07dJqDnTz0Y4mwKFL-LgaFcHvlfwARxIokdBCV32vmGqDMBAp9nkLrUpmPjhvTXTK1xUiiGiXjeiW6j8WWNDrHTkOpYPPJKrTwm_EbjRO5xHQjdh5nlJKwaXZZWNhaDs-GnDDQ5L1d5iT1h50PDE6gCalQ_teaN_6wXcnkmxOv4Zwtzm97F8Itib7QB9ivNdLT8rWxD0wSVbCKxpOJQY4dAxNNRksoGEIJGYTNt7VvnldrPHWpx56K-Tw5bEQwIt62si7Ej-9y2f-n135SDr8TXlT5FLUK1JPj7WQoTDS_OPZ5ydMLCXq8fItCpqJPZ61xMQaa0QS7B9a08hR00LoEC5JDNDZYMg5afTELS2fHjGz6VXC1eJ3CKslVx0HBfC2uPctlALldKrkYFuZBnWNVisURYMvm7lzWvrv79Pkz-c63_M5NGxrl-u8zh2T-mS6L1tyl36EeyXnbkNrxVibUgSwZufnI6EgVljfjvLO6NLnA5luewgPxVpSVrAqgD5Q49zyrFce6v8rRV-gdOXFS1pUgAoMCmZLHuPk91G3NkgYJWi1V8NVdWUW1RfoRFV","https://external-cdt1-1.xx.fbcdn.net/safe_image.php?d=AQCMB4ESMKiU1MPh&w=540&h=282&url=https%3A%2F%2Fstorage.googleapis.com%2Fopinion-cms-cwg-tw%2Farticle%2F202001%2Farticle-5e1c0d9326fe0.JPG&cfs=1&upscale=1&fallback=news_d_placeholder_publisher&_nc_hash=AQD_xSW810GsvLqe","Image may contain: people standing and outdoor","2019年行政院推動的「地方創生元年」，正式宣告：台灣人口失衡的危機，需透過國安層級的「地方創生國家戰略計畫」才可能妥善解決。國家戰略計畫目標希望在2022年達到地方人口移入移出相等、2030年達到地方人口回流。...","opinion.cw.com.tw地方創生元年回顧：從縣市到鄉鎮，地方政府如何扮演「創生」角色？｜李永展／擲地回聲｜獨立評論2019年行政院推動的「地方創生元年」，正式宣告：台灣人口失衡的危機，需透過國安層級的「地方創生國家戰略計畫」才可能妥善解決。國家戰略計畫目標希望在2022年達到地方人口移入移出相等、2030年達到地方人口回流。...2019年行政院推動的「地方創生元年」，正式宣告：台灣人口失衡的危機，需透過國安層級的「地方創生國家戰略計畫」才可能妥善解決。國家戰略計畫目標希望在2022年達到地方人口移入移出相等、2030年達到地方人口回流。..."
"https://www.facebook.com/opinion.cw/posts/1440539732779635","1579226400","沒有人不知道皮克斯動畫。然而很少人知道，每個精彩故事的背後，其實都經過無數失敗：《料理鼠王》最終版本只有一句對白跟原始劇本一樣；《飛天奇蹟》最後唯一保留的是那隻鳥和故事名稱；至於《怪獸電力公司》？很抱歉，一開始的劇本設定裡，那個有一雙萌萌大眼的小女孩「阿布」完全不存在。

 那麼，這些好故事是如何經過千錘百鍊創造出來的？《怪獸電力公司》的導演回憶：http://bit.ly/372wAIU",1579392914,"https://l.facebook.com/l.php?u=https%3A%2F%2Fbit.ly%2F372wAIU&h=AT1MjOxWSQfQsyJ-Ko23KAftKXpqURbPBYbp_T6F9qTUHoLbX_73EKmoUmNoNkegmU1OimHWIj2SMeQ2knkTnenddPqUQVEKE7IZouGUqfOsHrVV8Qf1e_TpLu2NNFqUDQX1Rzayhj8qsNsBh7EuNJ9CpRgbGUDYCh6PYUrSFloPekjEUeq3TRHHvPAAig1aoUSjmjxFNxSeR7tTAttK8C8QN8DaCnI-XRiXeqrR-Tx7fdZBIqaKLaNLbPcFwHkE73cY2H4nMqh_I1xYlwy3XmHySUUR0L_oV0lWjsoqp5OCDBY073rc7cwzqQxlu0XUCNFc20TvF6Qk0kmXgvQzw0TzkE09jqRGzBkwCPL481t5gniYwEKjFnJbKA3YLMJUvPWrsJpkXUlmMDh5mbpqytKKu4vi3RaxI8cB6aZNsX4Pdkdbue-jZ2cYwaCh3yOmw6PqyMxi6u1c3xjXxOLt94O1-04_JwGJMifv0t5r0lJd-sTi4Sma79disYaX8ZxJJmLImlJ52GX5MxfbM0-xvL4KAch-l7KudCgO7K7t3DJkNlIR5gYHqFRiy1sUc2gITNyfncv3tmn_7b-Eo1mToq2Tg5ROzNOzuBv4OCI48laWLrPf9TkRIwTwvd45J198FZ8hPRwJlC-D7uUo","https://external-sin2-2.xx.fbcdn.net/safe_image.php?d=AQCvrLBDfZUX64Ei&w=540&h=282&url=https%3A%2F%2Fstorage.googleapis.com%2Fopinion-cms-cwg-tw%2Farticle%2F202001%2Farticle-5e1fd638d6d6b.jpg&cfs=1&upscale=1&fallback=news_d_placeholder_publisher&_nc_hash=AQCib_GDrEU9wTEM","Image may contain: one or more people","在我的當日訪客證上，有個綠膚外星人對著我瞧。他有三隻眼，手掌有三根手指頭，橢圓型的頭兩側長著尖尖的耳朵，頭頂還有一支圓頭短棍似的天線。訪客證上印有我的名字，旁邊寫了一句警語：「外來陌生人！」 那是20...","opinion.cw.com.tw如何說好一個故事？讓《怪獸電力公司》與《玩具總動員》的創造者告訴你｜法蘭西絲卡．吉諾（Francesca Gino）／獨評讀好書｜獨立評論在我的當日訪客證上，有個綠膚外星人對著我瞧。他有三隻眼，手掌有三根手指頭，橢圓型的頭兩側長著尖尖的耳朵，頭頂還有一支圓頭短棍似的天線。訪客證上印有我的名字，旁邊寫了一句警語：「外來陌生人！」 那是20...在我的當日訪客證上，有個綠膚外星人對著我瞧。他有三隻眼，手掌有三根手指頭，橢圓型的頭兩側長著尖尖的耳朵，頭頂還有一支圓頭短棍似的天線。訪客證上印有我的名字，旁邊寫了一句警語：「外來陌生人！」 那是20..."
"https://www.facebook.com/opinion.cw/posts/1437320923101516","1578996000","開票日當天晚上，你也守在電視機前面密切關注開票訊息嗎？是否發現螢幕上滿滿的資訊和跑馬燈，令人眼花撩亂？如果你是美編，會怎麼設計最清楚好懂的開票畫面呢？

 其中一招就是：先把畫面變成黑白來看看。http://bit.ly/2TeGT8N",1579392914,"https://l.facebook.com/l.php?u=https%3A%2F%2Fbit.ly%2F2TeGT8N&h=AT0Tg8EYxwwdau2TJ5vt4SWowp3qKIX1_aAY7zE5Ay-w362ql2kBUZYbNDgI1itBqRHTFKzhom2lzxeblwyeAvBVmK65r79_Nzodn20Aal6MWdMdGgI4LBdIF5XSi_lCm7EXRr7OHbXYyC_cyTyUtmRMIW0UBaBf_baub5xpGE4q8tczPjbTH8E266moV917vQEy697JpXSqikDtNAr0odpp65ZQ3Io4fHCchi4kZ8y6LxZLICl_R9DKvM-UvWw-lLXQQ47I5jRJnXhgBUO63s-XAi5yYwA6e2Ppmo_C6B5eT6Q0MiVWJVG76HT1kIhjxL0jrXKVd_jASEtdo7Rw2Vt59re2ZBJw_JEoqLcx_vKm7Mlomth-TTkDO2E4Sv1y9gmtTZzma0MftwhiYzDnRKWXB6taDowU1fP0lzA6m5foC6SLegrHlXLYqbHXNZg1xBfNoC0nUnP2haPCpnGIZhFsX0JQbceO8vPYdZg9nHkjn36iA1Q8897q0L1gN2NMHUwLfhwMB9Zs1DfNHv4O1ebSCNUDo_yduyv0-P7eb63xrJUGY6aFo4v2zshQL79VBb_i-UU1aXRyc-gxD0ZgWeOtP01f6BNmDBVrypmSM7jfO21L521ExH8azyeecvtK87GhRuHXwe-RlHvK","https://external-cdt1-1.xx.fbcdn.net/safe_image.php?d=AQCd8UpMy-xeU81r&w=540&h=282&url=https%3A%2F%2Fstorage.googleapis.com%2Fopinion-cms-cwg-tw%2Farticle%2F202001%2Farticle-5e1c09f06762f.png&cfs=1&upscale=1&fallback=news_d_placeholder_publisher&_nc_hash=AQAgd_qrbMVeb1xr","Image may contain: one or more people","每當投票結束，總有許多選民會守在電視機前等待開票。以前，我通常會先瀏覽各家電視台的開票畫面，再選擇重要資訊看起來最清楚的一台來觀看，不過2020總統大選開票前，我發現公視將多家電視台的畫面整合在一個「開票.....","opinion.cw.com.tw「不看色彩、只看本質」──拿掉顏色以後的開票畫面長怎樣？｜余虹儀／通用設計，友善社會｜獨立評論每當投票結束，總有許多選民會守在電視機前等待開票。以前，我通常會先瀏覽各家電視台的開票畫面，再選擇重要資訊看起來最清楚的一台來觀看，不過2020總統大選開票前，我發現公視將多家電視台的畫面整合在一個「開票.....每當投票結束，總有許多選民會守在電視機前等待開票。以前，我通常會先瀏覽各家電視台的開票畫面，再選擇重要資訊看起來最清楚的一台來觀看，不過2020總統大選開票前，我發現公視將多家電視台的畫面整合在一個「開票....."
"https://www.facebook.com/opinion.cw/posts/1433021886864753","1578650400","「我覺得台灣人都被選舉新聞綁架了，最近世界上明明發生這麼多大事，澳洲大火、美伊關係......，為什麼媒體都不報？」一個朋友滑著手機抱怨。

 然而，真的是媒體不關心這些消息嗎？抑或是同為閱聽者的我們，導致了這樣的媒體生態？http://bit.ly/2R3MU5g",1579392914,"https://l.facebook.com/l.php?u=https%3A%2F%2Fbit.ly%2F2R3MU5g&h=AT0wzFRQo0dTaajMuf_GjwgwXizJud48Sqju2j631aZb4OuG5YPwMBuBI_CIAkZ-8p81r7m1FoVEtEZO7UviAfpY7c9eC8CbwfPdL6J70aNLH9lX99m4iYNdRXTFXDC99zhiwcWiYlaRhurAWniq43y9IBU55A_0iaglZKr6HPefsCVNF5-ylDNmYXgNRcUu1AxxgGmNLmgKqR1U48IhJq7b_ZPy42G0WzOjzsNZ-hOZwoRNITQVjXUORhaTRoqzi2jOBB6lfjSdJKW1hTQ7bQ-X-6Lz9cbE5OrudUbl0uh5njr4bWVEGy1HP7Wn492697BSrXVwn174N8yXZFLeVv6j2e7mOHFt-eCXL3gsXJO2mqcsiuD0zskiyLSyIWL1q-u1jmDnCXmqhdkBQ2aEUlsdCSpeNNzV_wbGQEqNp5zciks_COT8PA8Ek6X-uNvUxF2xExXqS7-IbpH8TieSFFts4RxEnOyo_hYNkwJD8Iendtkjyv4eud8Nj0q2ED1ijVjpeYQVIJYL0IEy7ZH-62myovo_0JpT_L77RIdS_iIU1N488vYlMua_fL1v5DpeIMveWHUJj4m36USPo4YYqDSnAfZnu1VN6naVErJ8l4Z_plE8wQ_mS_d0YBTz9oQtBCS-idtt64g6QbRF","https://external.fpnh4-1.fna.fbcdn.net/safe_image.php?d=AQB61PUuQH6L7at2&w=540&h=282&url=https%3A%2F%2Fstorage.googleapis.com%2Fopinion-cms-cwg-tw%2Farticle%2F202001%2Farticle-5e16cab9ebacc.jpg&cfs=1&upscale=1&fallback=news_d_placeholder_publisher&_nc_hash=AQB7jLery7vBPnvm","Image may contain: one or more people and eyeglasses","一個關心外國情勢的朋友拿著手機對我抱怨：「世界都已經快要大戰了，還有最近澳洲的森林大火也是很讓人心痛，台灣卻都在報選舉新聞……」 我們身旁其他的朋友也紛紛表示贊同。她接著說：「我覺得台灣...","opinion.cw.com.tw【投書】全民點閱的時代，我們被媒體綁架了嗎？｜王允庭／多元發聲．讀者投書｜獨立評論一個關心外國情勢的朋友拿著手機對我抱怨：「世界都已經快要大戰了，還有最近澳洲的森林大火也是很讓人心痛，台灣卻都在報選舉新聞……」 我們身旁其他的朋友也紛紛表示贊同。她接著說：「我覺得台灣...一個關心外國情勢的朋友拿著手機對我抱怨：「世界都已經快要大戰了，還有最近澳洲的森林大火也是很讓人心痛，台灣卻都在報選舉新聞……」 我們身旁其他的朋友也紛紛表示贊同。她接著說：「我覺得台灣..."
"https://www.facebook.com/opinion.cw/posts/1441587049341570","1579341600","你常常因為想要滿足別人期待而壓抑了自己真實的想法？或者因為害怕孤單，跟明知不適合的人在一起？還是總覺得老天爺對自己不公平，覺得就是自己最倒楣？

 從這些向外追求的焦慮中停下來吧！回到自己的內心看看：你有多久不曾好好陪伴過身邊這個最親愛的自己？http://bit.ly/3alWpWj",1579392914,"https://l.facebook.com/l.php?u=https%3A%2F%2Fbit.ly%2F3alWpWj&h=AT2Syz4kmCjLUdQ6LO2hknBsWNvB8kf3iVeHPtBGutnG2BlSPiOack6UD26Z_topwLBcFMWCniAQKueBp4NYwungOiuPd7ezYy60hmL_u1J01tyP-rVocBlISrYIevxGuhxTrFIkq6FPbEFSxNPE0ZxhGyuExwCmEaSWf4sd9AiYn-YNkbhR7jkc81lWTmzgAeeSVC0fJZ8DONwr-bGroJhNdR2udWos9fPzSudwn_dne-vObdQQuFGhvK7v6eQaM5hQ4xCOiixkDDnhxAogAsCtRQLb3a26LUglMDIHGUa7pLR-RGvwbdyurg-XIKO56df1Vknlffe9v67BIpuKexrn8mw_AKKmcPsZ70dRCN1SM4BpVTnPM0L9WfcuxXDRAirkzehASxMjfmOFjnym9u3rmXfjK0rvmCrYPcT540VUr6qPKt6SMQDIf1RwUeMHRCzz-svA2bPSE8hkXs5ZwnwgSzfHBIpgL2egpxsVOZAAjzJxkOcqJD2ewf9BJcQ5CpbCm8C4mX14qy1OOqXMA122u1EnQ3jFxa8GZ74EgeyrmdyJnDolpX_R_oes0So-OYgwoGDbMP_s0tCdqb4IUSncqM_AKDrRbeXugw7itD22UaNxPFcOa-5hOUZnaiPq0Nf9kYO2pL336MQf","https://external-sin6-2.xx.fbcdn.net/safe_image.php?d=AQCAqC70NTo7BOQ3&w=540&h=282&url=https%3A%2F%2Fstorage.googleapis.com%2Fopinion-cms-cwg-tw%2Farticle%2F202001%2Farticle-5e2167ef95d0e.jpg&cfs=1&upscale=1&fallback=news_d_placeholder_publisher&_nc_hash=AQAzs5eAm_ZOxQEU","Image may contain: one or more people, sky, grass, ocean, outdoor and nature","每一個人都希望生活順遂，日子過得平安快樂。可是人生難免有風雨，當波折來臨時，有的人深陷其中難以自拔，有的人度過了坎坷，開啟全新人生。相同困境發生在不同人身上，會有截然不同的結果，關鍵就在於你怎麼面對，...","opinion.cw.com.tw有多久，你不曾回頭看看那個「親愛的自己」？｜徐曉晰主講、葉嘉雯整理／大愛電視《人文講堂》｜獨立評論每一個人都希望生活順遂，日子過得平安快樂。可是人生難免有風雨，當波折來臨時，有的人深陷其中難以自拔，有的人度過了坎坷，開啟全新人生。相同困境發生在不同人身上，會有截然不同的結果，關鍵就在於你怎麼面對，...每一個人都希望生活順遂，日子過得平安快樂。可是人生難免有風雨，當波折來臨時，有的人深陷其中難以自拔，有的人度過了坎坷，開啟全新人生。相同困境發生在不同人身上，會有截然不同的結果，關鍵就在於你怎麼面對，..."
"https://www.facebook.com/opinion.cw/posts/1433958106771131","1578708055","他才剛在病房宣告病人的死亡時間，走出醫院，坐上藥廠招待的餐桌，扮演乖巧安靜的聽眾，聽著四面八方的訊息，哪裡缺醫師，哪位醫師去開業，從事個管工作的學姐告訴他：「OO科不好，不賺錢；XX科好，薪水還夠用。居家醫療很少人想做，別人都在想自費項目，我在山上也有個案，以後山地醫療就拜託你了……」

 
前輩告訴他，常有藥廠資助研究醫療進展，由藥廠贊助餐費讓醫事人員下班後進修新知，似乎是醫藥產業糾纏下的現實，他不禁思考：藥廠有沒有機會贊助醫事人員練習接住病家的悲傷呢？

 http://bit.ly/39ZCsom",1579392915,"https://l.facebook.com/l.php?u=https%3A%2F%2Fbit.ly%2F39ZCsom&h=AT0PJMVSIXwDNn_CNTF9PlW_a6q7Oi5NJEH1ghegmFTFawx8Kxbayi57w76tY2CXjcC8R73IjIiEDd2sJD9VVpE13M-XoeuIasL7uS8UJbbRh6Je45AzgobtPafkI5ipGvlX6CZw7z3bBY6G5c7ACrXeEAyXuuULz4h8E6-X6UASJBRv5QPNBSmedWRmvoxtJXOmcM3MkeslYapiQa_zjkiiBxkHkMAYJvgW-1lssZDf44sM2YAzYJhkXnFi7y8GZeO_1XdsUtCTslZy1hVJ08pg7bh5MJW9zxtZGldFB2I_kmfe7HDZ2cc-NBDw1lCiTGoFnACwvoHSQNSn8-qbw9mPOjZ7zIQhygbRUN6CXt_hyB4o6h8Zg8LhwU0RcNQOjffDiRuf7Bz8XlXM1grQX_ppUD0ipMKrvQX8XEs_jngdZcVE7wzr-2FZLkYTJrXHXiw1Y_WcWWpz7oY-GrLhzLdFnnJA_O3PolQ72OtK3NHsubZMBRQ9ALcC9K2vVXJvLQ5pNUTvdsAaHcu7Iw5CYjAQ34TVK0WiKLzqbY23pUHj-Uq_MIgpQ1ySnxi2neQER5MqqlI-9fjx2hrCzRC1HeosX8K4YzMnWDgTPfYcaHMjS7HsmHF-D8gmdHhmLSSYzz4yOdjg5eb0TA2I","https://external.fsub8-1.fna.fbcdn.net/safe_image.php?d=AQBdm7MqvLfIIo_t&w=540&h=282&url=https%3A%2F%2Fstorage.googleapis.com%2Fopinion-cms-cwg-tw%2Farticle%2F202001%2Farticle-5e16f9f406e3d.jpg&cfs=1&upscale=1&fallback=news_d_placeholder_publisher&_nc_hash=AQCms6Uri5hJ1hq0","Keterangan foto tidak tersedia.","記得一般醫學訓練（PGY）時，某日我在內科病房下班前，照顧一位因為泌尿道嚴重感染合併敗血症住院兩天的阿嬤。阿嬤年事已高，在家屬的共識下，於一早撤除升壓劑，原本看似還過得去的血壓急轉直下。 平時，主治醫...","opinion.cw.com.tw【投書】臨床照護與研討會餐桌的距離｜盧敬文／多元發聲．讀者投書｜獨立評論記得一般醫學訓練（PGY）時，某日我在內科病房下班前，照顧一位因為泌尿道嚴重感染合併敗血症住院兩天的阿嬤。阿嬤年事已高，在家屬的共識下，於一早撤除升壓劑，原本看似還過得去的血壓急轉直下。 平時，主治醫...記得一般醫學訓練（PGY）時，某日我在內科病房下班前，照顧一位因為泌尿道嚴重感染合併敗血症住院兩天的阿嬤。阿嬤年事已高，在家屬的共識下，於一早撤除升壓劑，原本看似還過得去的血壓急轉直下。 平時，主治醫..."
