url,posttime,text,crawled_time,attachment_link,attachment_img,attachment_img_alt,attachment_title,attachment_brief
"https://www.facebook.com/otsukaka/posts/1239486686233599","1568359221","之前我分享了一支
可以享受飯店級沖澡樂趣兼顧健康、美容
而且還能省水的Takagi舒適Shower蓮蓬頭
也是我們家一直在使用的節水低水壓蓮蓬頭

 Takagi「舒適Shower」蓮蓬頭有三大特色：
增加水流強度，同時省下最大31%的水量
極細0.3mm水流，超細緻沐浴觸感
獨特省水開關，一指關閉水流，超省水超方便

 更貼心的是：
它還能夠在裡面另外加裝淨水除氯濾心
因此非常適合～
嬰幼兒或敏感性肌膚的人
特別注重肌膚保養、秀髮保養的人
在意因沖澡而使肌膚產生刺激感和消毒石灰臭味的人
以及追求飯店級沖澡享受的人......

 最近他們商品型號有做更新的動作
所以我之前寫的文章也跟著更新囉

 詳細介紹與使用心得請看這裡～
https://otsukaka.pixnet.net/blog/post/403485242

 Takagi官網～
https://www.takagi.com.tw/

 今晚我們家也要烤肉
現在準備中
祝大家中秋佳節愉快......","1571690820","/otsukaka/photos/pcb.1239486686233599/1238926202956314/?type=3&__tn__=HH-R&eid=ARDMBPRUtpyY3MOVqEcIoEWeGTLl_lNolaMmcGfjyfobVJdYEexU5mBIocD90trF4fjU_5a8ELw-uE97&__xts__%5B0%5D=68.ARCxSffdV8KBEtMpNjoOC38cLKE7Oet31Cm2SG3R9vGhbARb2voRbot-YglohtVODcY3BYYtRJgVOGcZLegFjepwUbDq_Eoite9hGBMcoNJg7ajL2cCc4FyUAbnvoFjY6Uu4TV4niidpYjgrPCJiROFLkLL2R4femtgvUUMfi7BKf4_QqCl_3bYAlh_KpsICOLgZes8b8LRyNpW1erKEwkEuw7wF4w7BqFf5fOLRYGCjoJQ1kS63pUfLj0YW1m56L8O-g91fOMbU2R7Z3ua9b04zjbtizFo_cjKCtyqow90MTxdEGHveS222kY4siBSq5oOERtGfdyFoLlHCGvT9jPMTag","https://scontent-lga3-1.xx.fbcdn.net/v/t1.0-0/p235x350/69907988_1238926206289647_7540533391343484928_n.jpg?_nc_cat=104&_nc_oc=AQmMlydaFdxrQwqLf99xXjkOrfGK4BwUuS2DARoqbwq_ajeuGLbOEoRdBpFFDXgG26A&_nc_ht=scontent-lga3-1.xx&oh=4685905112eb807c593c9803f042fed8&oe=5E5C212D","undefined","4",""
"https://www.facebook.com/otsukaka/posts/1213171418865126","1565252857","大塚姊姊說想要在八月生日之前將頭髮捐出去
是給今年自己的生日禮物
所以我們找了一天帶她去剪頭髮了

 當天她帶著忐忑不安的心情去美容院
不安是因為不知道剪完後的自己是什麼模樣
一開始知道要一口氣剪掉31公分其實是有點不捨
但就像女兒在信中寫到的一樣
這個不捨很快就被幫助人的喜悅給取代了
想到自己的頭髮可以給需要的人用
尤其是能夠變成那些抗癌小朋友們的笑容＆勇氣
就覺得自己的頭髮捐得很有意義

 那一天幫她剪頭髮的大姊姊一直讚美
女兒的頭髮又濃又密很滑順色澤也很美
所以剪頭髮的過程非常愉快順利

 剪完回家後
大塚姊姊的臉上是充滿愉悅的笑容
她小心翼翼地將自己的頭髮裝好
放進事先準備好的小盒子裡
再寫了一封信給將要寄去的ＮＰＯ
接著跟我們大家說：
「我還要再留一次長頭髮捐出去喔
這種幫助人的感覺讓我感到暖暖的
想繼續溫暖下去
再花另一個三年也沒關係....,,,」

 所以媽媽我也要繼續幫女兒把頭髮保養好
希望她可以再度捐出優秀的好髮質.....","1571690820","/otsukaka/photos/pcb.1213171418865126/1212635892252012/?type=3&__tn__=HH-R&eid=ARDromWuue03abSQ2EldAbdcYNH-8fuPRn7i0M0Yk4scz2Af2uNMMlnNQhNy2dyp0QW791m-AHg2uk3V&__xts__%5B0%5D=68.ARAo_eT_b-Yc7RmXfoksmvVSY2y3ppVn2h4PC_mbqgbHmBJdgNEFgUM-O0LswEPd_pXVQUdzsAz_u5eYWO7qAGSDhgG_AwmQnbkTHmUnSYvsGEvuS61o4qbmw6UVJX5kk9qOwCaK0goEsriHOY_rzAiqsP7lnCJnjupITVBOBv06tccsTd1DeoyhzsK1B71NMUHan5Py54n6N8ihHHywWrxSWnxk6Ts2jrlimvOwWHsdPLPyxhPGfuqjNc9mJM7sCgWdrBf97iMAmTYH03fatgHGMesqxMWJC0kd2PmKi4cVTH52V2kumahC5iMcyotON_rmVoEEyDGUuPg1XV9GcDE3Ww","https://scontent-lga3-1.xx.fbcdn.net/v/t1.0-0/p403x403/67758004_1212635898918678_2362563614340022272_n.jpg?_nc_cat=106&_nc_oc=AQkoYtDg7ZrlVf3-9R6jy-8ZnAVOTqfmxXfGQgaFMHmKC1vX84AvBtgzdCv0O8DzHno&_nc_ht=scontent-lga3-1.xx&oh=0a6524025a4fa7f475ef7aa47fe402d5&oe=5E609DA8","undefined","5",""
"https://www.facebook.com/otsukaka/posts/1164557087059893","1559458808","之前已做了兩次蛋糕捲
第一次放了整顆蜜柑但不好整形歪掉了
第二次我再挑戰放一整顆蜜柑和大塊的西瓜
但這次海綿蛋糕不夠長包不起來
雖然小鬼們都說好吃可是我覺得不太美麗
所以就沒有留下來給其他人吃了

 正打算就此放棄也放過自己的時候
昨天小姑跟我說：
「有一天お父さん（就是大塚爺爺）
在外面吃午餐時拒絕點甜點來吃
因為他看到妳做了蛋糕捲放在冰箱裡
所以期待著回家品嘗一番呢
妳說父さん好不好笑．．．」

 天啊！大塚爺爺根本沒吃到嘛！！
聽到這件事趕快卯起來再挑戰一次

 我的作法是：
１．先將三顆蛋白打成蛋白霜
２．中間分兩次加入共３０ｇ的砂糖打勻
３．再拿另一個料理容器把２小匙沙拉油、３小匙牛奶攪拌均勻
４．加入５０ｇ過篩後的麵粉拌勻
５．接著把蛋白霜分三次加進來輕輕拌勻
６．將蛋糕糊倒入四方形的烤盤中（２５X２５ｃｍ）
７．放進預熱好１６０度的烤箱烤１５分鐘
８．準備各種水果切塊
９．將２００毫升的鮮奶油打成濃稠狀如照片（中間加入一大匙砂糖）
１０．烤好的海綿蛋糕拿出來放涼後在上面鋪一層鮮奶油和各種水果
１１．再用手慢慢把蛋糕捲起來
１２．放進冰箱中約２個小時冰鎮後即可享用

 我覺得最難的地方是捲蛋糕的時候
但憑著一種想要讓家人吃到的心意與動力
竟然就被我做成功了

 看著大塚爺爺吃得很開心的樣子
還有大家稱讚我做得比外面好吃的時候
深深覺得沒有放棄真好
其實我們家許多料理就是這樣做出來的
心意＞手藝......","1571690820","/otsukaka/photos/pcb.1164557087059893/1165154573666811/?type=3&__tn__=HH-R&eid=ARAgWV96tt_3zcNWyssVb4M6s8ahY0N3Wj8Gycghwh9qy4ikC_v3Qit3dANkqvKlS2_q8OQGOjpDvIke&__xts__%5B0%5D=68.ARCn3kZIO0RtKG-UqkCmddj8S7Nd5PvXmuRuy5TefY7HReh8lPIg9TLd4LjnEDnaK_0EaV9HkFV1VC5ou2ndYPSCpCMeWOsg1oztBS1NSbPKT2HDPBO058EPM4vrjO4inwIcumSZpO945Sqn9m7w2S-y_ePTLCKUeVB3Aoj-WDfLA8oPAiRluKCw9VrRvbyFosGhFsvZEnG69OrIK116TtNvu7SfgEt1TbXyMsre2nTkZosFUknmugKcUJrulA7KbTjIRpgH1OUjYeXNnIlIvF3FaaFmaRVn-Jux-dOz1Gqkz6hB-t8sYYHUhrQs6Ao333uCqiDj3wxZqZYe6bH3L5TZDg","https://scontent.ffor8-1.fna.fbcdn.net/v/t1.0-0/p350x350/62186127_1165154580333477_5869315248002957312_n.jpg?_nc_cat=109&_nc_oc=AQkhFnsmkFlkVPzvtT3QfRtqMXoSRqzK-HzUebIBWbn94mGFaLNgSlA-uBCZyl9HMac&_nc_ht=scontent.ffor8-1.fna&oh=1ffb9040624dead0d1f2743586920440&oe=5E1F04F6","undefined","9",""
"https://www.facebook.com/otsukaka/posts/1195343280647940","1563005893","#假日早午餐

 一早起來準備這些餐點放在桌上
給自然醒來的人當早午餐不錯吧
今天沒有發生甚麼事
也沒有人過生日
只是經過昨天的休息＋充電後
今日一早煮婦魂大爆發隨便煮煮就變成這樣了

 其中的馬芬是我家小姑昨天晚上烤好的
要讓大塚姊姊帶去朋友家玩當點心吃
多的就被我拿來擺漂亮照相一下
水餃皮比薩、蒜味海鮮炒烏龍麵
酪梨堅果抹醬、小松菜鮪魚沙拉
果凍奶茶、南非博士茶奶昔才是我做的

 大家看到也很驚訝紛紛問我今天是甚麼日子
我心裡想著：
這還是小CASE
如果送我去夏威夷度假一個星期
回來煮滿漢全席給你們吃囉（笑）......

 #讓媽媽好好休息會有好事發生的","1571690820","/otsukaka/photos/pcb.1195343280647940/1195174367331498/?type=3&__tn__=HH-R&eid=ARCMIQixLSu0gjdE-2MZEruZU_se7aVsPACMrR555mx5nubkrvT021cJ_b6t8zvO1Nkgl5qulX6XzPVN&__xts__%5B0%5D=68.ARDdlk3ng9kSwHSnfWq97mWMwnC5NNxTSuZpyVnl21tJ39puLjD3-Ii5WArzRP27N1bUIm3vujXtrD3x-YBH9iMUX_l09e0F_UUnx427YalHOaX_WLm3K_3LANdI5CIBI1PhMEqEbsRaAaearhaGUN9ydEisped0Cty-8iVIXFMP5-osu6d1ROvvOL--MZY32G3i-7p4NWhmHnKbF75k5It2yC8vsShsCyDYVK97fJ6YWYV1gelOlUIj26kG6HdMm_yYYPkJwqVp4pXZvBT26A3NwQ6DIzm7Jz02S6M4Fuyh1ZNAilyBPH_asNZWehfuV5PNbYzw6oRBxW4jsL3HbDZ_8g","https://scontent.ftip3-2.fna.fbcdn.net/v/t1.0-0/p235x350/67320684_1195174373998164_2547776154765361152_n.jpg?_nc_cat=107&_nc_oc=AQk-dmkkLzjOeYBDSssI1o_QC6fSj-yXiz0aNTJpxUVZYR3ooBfX3bZlC0kf8cd4M6E&_nc_ht=scontent.ftip3-2.fna&oh=46ad58a8de6c5f0422022abae20e7414&oe=5E2C2532","undefined","7",""
"https://www.facebook.com/otsukaka/posts/1258430377672563","1570364428","這次來到福島二本松的主要目的
是為了看十月5～7日開催的點灯祭
但昨天卻發生了一個插曲差點心臟停止
本來和當地案內人約好9:30在郡山車站集合
所以我事先買了9:16分到的車票
沒想到後來他們改了集合時間到9:15
但大家說一點也沒關係會等我的

 結果昨天早上大塚爺爺載我去東京車站太早到了
直覺可以坐前一班的自由席
那麼就可以早一點到郡山換我等大家
就這樣我坐上了前一班新幹線
正陶醉在自己的冰雪聰明時
突然心裡有一個小聲音跟我說
如果這一班每一站都停的話有可能會更晚到喔
此時讓我瞥見了前方有一位服務人員
我神速追去問他這班車到郡山幾點幾分
只見他慢慢拿出時刻表告訴我：9:23
天啊！果然更晚！！
我火速找到車門衝下車
這全程就發生在這台新幹線出發的前一分鐘
我想當時車上的人一定在想～
這個人竟然前一分鐘才發現自己坐錯車！

 殊不知我當時正在心裡罵自己：
在日本住久了怎麼也快變成了日本人
寧願早到也不願讓人等的這毛病
真。是。夭。壽！

 還好昨天全程參觀了日本熱血澎派的祭典
讓我覺得當初決定來參與是對的
同時早上的驚魂記也馬上忘光光

 拍了二本松點灯祭的七台太鼓台集合在一起
從二本松神社處迎接而來的燭火
競相點燃車上三百多盞提灯比賽誰最快
後來還有巡迴街道的遊行
看到當地從大人到小孩全家都非常投入的神情
自己也感到日本傳統祭典的熱力四射
就讓我把這一年一度的現場盛況跟大家分享囉......","1571690820","/watch/otsukaka/?__xts__%5B0%5D=68.ARCrzD2i7logA5D695jq-IX3c19R5Oa9sg84q_wzfmICLiySAE3h38-S-PXZIdXch39tlkEZlUckxkokIKt-Too0ahx8by-Qc8jkJtUqDsNa3KHlO9vGHJBbGbUFtF0h3Yuf-CwuCpM95B3OMrFzvzcq2B0GXVHaLTP_leK-stOmMt72mvZKezda8YiUmCKCczN6hAkzDrowC-P0ib6uHJAx9emb8Ck3EndMu500g641cZFxyXfTZ8oXfprzRGLFbv22Xxmuv2FnCmnSDZAp53psP6FSvBJKmajkPWC8Ixvl0b0bZ9Lu4lYhBoa_RizBMwGP_RaGNqRC5uvIKSskl6mY6OlOCHGOtiTGBYEW40a1L_4&__tn__=kFFHHH-R","https://scontent-sin6-1.xx.fbcdn.net/v/t15.5256-10/70334927_404942530201538_5636639191493246976_n.jpg?_nc_cat=111&_nc_oc=AQku9d9UPy5pxDOmaeYDT6BYavL5nEItN52ql0Pi_XLQqCqKK90PeHUTVz9Dfow86M8&_nc_ht=scontent-sin6-1.xx&oh=b04992141b067f92e1c9f9b153b9351b&oe=5E1DD375","undefined","大塚太太東京在住中","5,203 Views"
"https://www.facebook.com/otsukaka/posts/1213870645461870","1565339450","在炎熱的夏日裡吃一碗熱騰騰的拉麵
可能會揮汗如雨而無法盡情地享受
但如果是吃沾麵的話也許就沒有那麼酷熱
因此沾麵在夏天往往人氣攀升

 我知道很多台灣人很喜歡這間
東京排隊名店六厘舍沾麵
但大塚先生和我更傾心的是它的姊妹店「舍鈴」

 主要的原因通通寫在這篇文章裡囉
給大家一個來東京吃沾麵的另一個選擇
https://www.japaholic.com/tw/article/729161/

 哎呀 !
又不小心抖出了大塚先生的愛店......","1571690821","https://l.facebook.com/l.php?u=https%3A%2F%2Fwww.japaholic.com%2Ftw%2Farticle%2F729161%2F&h=AT0v7aNEFvBY2WnYDU562CKJIV75kpNICSeBytKq7wjoaeiSsK7kzohcQ75n6b10zTvljvBJgAcO-TiM0NU9ayHS2W_Ff98QtjjoIGkRnmdYufPNgfowKRvti0pallWa-JoO8TLYfbng6-uYFpqzLYcvhPIi_3nV_KoXSL9XURFeE0EgnAczyA9ESMjwvJDhMfwbSATJCGPMOqgvtbRFbB5eAYXo_ntvbHcePE9R8R1YnLbEkwD02t5s7byj7yRQ3CrPQ1OBUzs9TGnB3CBvBd6X5CgTC1j3irr4AsegKax6qqtH2hw9NlGA8pSlcIfxjY-dief8zBAG0-tq8yRRIVlHPtlOj-5iEOrm-nACtQ-eP7NjXTHY6o5pxmLErAfyE7RzoOEiCdnbwNLZaRz9AODXsvuSGCtCy-jhAP0ICjk6ZGjD7z-k-egxMKM3ZOZl-grmMAgH5aPhO3t5kKriX-xNn3M4XJOEb3uctO8MTk0t47FzXnEYgDWs3DK8Ij2ztODYlqh3TjRAOw9jz0upFm_akS6rXKKDIxzHkF_X4fwaMHXlc_Wbmoyo5osO1tvugCU9jPVgCng__hWUQYio_3tix-mVogwFWU_vINUNZOWtYV3kBOX9rKW2YuIdfPn3zfZN65HBhLD6cZaN","https://external-hkg3-1.xx.fbcdn.net/safe_image.php?d=AQA6_4S6h0yLe8fN&w=540&h=282&url=https%3A%2F%2Fimage.japaholic.com%2Farticle%2Fimages%2F2019%2F06%2F1.42.jpg&cfs=1&upscale=1&fallback=news_d_placeholder_publisher&_nc_hash=AQCGOWxrIXR6ni6C","Image may contain: food","東京排隊名店六厘舍沾麵姊妹店「舍鈴」更美味 | Japaholic","在炎熱的夏日裡吃一碗拉麵可能會揮汗如雨而無法盡情地享受，但如果是吃沾麵的話也許就沒有那麼酷熱了，因此沾麵在夏天往往人氣攀升，吸引了不少人去光顧。濃厚的湯頭配上彈性十足的粗麵，再加上大塊的叉燒肉、筍乾、..."
"https://www.facebook.com/otsukaka/posts/1196024640579804","1563091207","《WONDER最新款翻譯機附照相翻譯功能》

 我們家公公婆婆每年都會自己跑去台灣玩
然後跟我爸媽相約吃飯逛街
一邊只會說日文
一邊只會說台語和中文
每一次比手畫腳+紙上筆談竟也相安無事
過程雖然有點混亂但也趣味橫生

 幾年過去了該聊的應該聊得差不多
我想他們也會想多聊一些更深入的事吧
再加上比手畫腳和筆談有點費事
時間長了一定會疲累的
於是今年我替他們準備了一台即時翻譯機
來幫助他們聊天聊得更輕鬆愉快
搞不好還能夠談心互相更深入了解對方呢
但不要說我的壞話就好（抖）

 在真正上場之前我們自己在家先試用了一陣子
發現這台翻譯機準確性和機動性都很不錯
而且最新款的還有照相翻譯功能
看不懂的標誌或商品介紹等等
只要拍下照片馬上就可以進行翻譯
簡直就是旅遊的隨身翻譯秘書

 主要功能：
45種語言自由互譯
拍照翻譯：中文、英、法、德、日、俄、西班牙
語音記事本（先錄起來再翻譯）
即時多國互譯，遠距離無阻礙(多機搭配使用)
可查看瀏覽歷史翻譯紀錄,精選語句收藏
多國口音細分,讓翻譯更精準
螢幕顯示可「見」可｢聽」可「重複播放」
2.8吋彩色觸控超大螢幕顯示
內置雙麥克風抗噪,適應複雜收音環境
168小時超長待機,隨時隨地溝通無障礙
支持藍牙耳機模式,語言學習及溝通更便利
線上更新升級時時進化中
更多詳細介紹請點閱連結裡的圖片進入閱讀～
https://meim.ai/b560a3

 有了這一台除了可以當隨身翻譯外
還可以在家裡練習會話聽力等學習各國語言

 拍了一個我們家使用的影片給大家參考
操作非常簡單很快就可以上手
我故意用我最不會的破法文來測試其準確度
大塚先生則用中文證明自己可以橫行華語界無阻
大塚爺爺也跑來客串一下
說了一句他在台灣最有可能會用到的話（笑）

 如果有需要的朋友們這裡有一個優惠團購
推薦給出國擔心語言不通的朋友們囉～

 請注意：
連結裡面有兩台選擇
粉紅色的是有附拍照翻譯功能的
黑色則沒有拍照翻譯功能
＊兩台都是需要用到Wi-Fi

 出國必備旺德翻譯機
https://meim.ai/b560a3

 開團時間2019/07/14 
結團時間2019/07/20 
此團免運
付款完成後，三日內會依訂單順序，依序出貨(不含例假日)，最晚出貨日為7/31，請耐心等候，謝謝。
【客服聯繫方式】
客服時間: 週一至週五09:30-18:30(例假日休息)
美賣官方粉絲專頁: http://bit.ly/2Qpj4HA 
Line ID：@meimaii（或按此加好友：http://bit.ly/2PnUsgH ）","1571690821","/watch/otsukaka/?__xts__%5B0%5D=68.ARBsiPAJJqRpjW2Uf0O7nzubu40xOiAO0xG7wIBAiMpZ2iqOeEAn2yBdsS0vwQVvzJWFqbSYSDYCpFcxfRY-v__BcPcNsQ5l2bbY3jNFKPWWEVxMdOUS-cuXpwMz8d1kAM67Pn6RlM0BzCiMQhdSVHYvkvvrKpVa0LLasHTVxL8siyTcu3WkCE_HqwaUU6zg_yKOf7zqnpb7054XCAD1lugZRKNz_Nv993Xav2RK8cnd9pkDUjPHwzi9fahfutBka_DzZc2tVsWxiaM2P_vfDIA-tR5nd1HeeG9P6C7eEcBpWY02MkUU2Ct7QMMhLp1IKKp1Nf6CD4Z2B9iIdEau23eb2AUiarU9l4FZfA&__tn__=kFFHHH-R","https://scontent-sin6-2.xx.fbcdn.net/v/t15.5256-10/66125225_694624184319832_68174269292478464_n.jpg?_nc_cat=103&_nc_oc=AQk9sn7YVufYKJuV9XuBeWoO16tWYgYMaw4uz8VnXIj51wt-7RmwvSt9ueqUF3uyuaQ&_nc_ht=scontent-sin6-2.xx&oh=fca5cd46a7961100e8fd5ca96a933eb8&oe=5E1CC3A5","undefined","大塚太太東京在住中","4.766 tayangan"
"https://www.facebook.com/otsukaka/posts/1183371305178471","1561539049","#日本雜誌太有戲了

 奉勸大家來日本千萬不要去逛書局
就算去了書局也要想辦法避開雜誌區
不然會像我這樣為了贈品而去買雜誌
結果雜誌買了都沒看放在家裡當標本

 前幾天分享兩本新書時
有位朋友眼尖看到這個帆布袋說有興趣
它是WEDGWOOD260周年慶的商品
容量夠大設計和花樣都是經典的品牌風格
重點是1080￥買雜誌送的
當我經過時二話不說就買回家了
現在的日本雜誌好可怕啊
會讓你心甘情錢掏出來還感謝它耶（抖）

 另外一本我個人很喜歡的Hanako
經常介紹台灣的情報給日本讀者們
用的都是很有質感的照片與文句
深深打動我這個台灣人的心
常常跟著日本人一起在書局尖叫：
「行きたい～～～」（好想去～～～）

 最近我在超市裡發現Hanako
和甜點公司聯名合作的珍珠奶茶冰棒
包裝就是Hanako設計的台灣風格
而且珍珠不會因為冷凍過後變硬
還是ＱＱ嫩嫩的口感
奶茶是烏龍茶風味的
咬一口瞬間將我帶回了台灣！

 讓人不得不佩服
日本的雜誌真的好有心機
大家千萬要小心啊......","1571690821","/otsukaka/photos/pcb.1183371305178471/1183365231845745/?type=3&__tn__=HH-R&eid=ARBtz7Ff95_6KyD_iMmM5RjTfvngn9ML7ffv93tzQ3e-VDnP2hAQjg2FTSUkkRf934d3AvOBr7B7YiGo&__xts__%5B0%5D=68.ARDSuZb-cIwhUzTFtUkLwsXReU7TwY56vLe3-t5U6EyzXlqPcAr7CpT9W2rQx7ch8ZykCKsFOP2f4KKYSzGU3xdixLsvaxhxl3rlbL5W4ULce_B3KN6-SmRfXuIgUi8UjMHrAYZvJZhvz8nUYAfF54W7R-EsUKe5Fpm58WF3iSx4njpPoj2ISApgS96BVEMtp18MKM8EOMZB-0PnHScFmwxlRy1mVp1J2kbWIQPlSxJ4KjQqvSX48FbhVg20SAxO2q1DBAsN3m2zk9mB9SgdMblVL5Q_gVzDtrFu5c9vMDvHQw0rvVz7kC03jigQPzg6Y7osxEWAmwBIavsn0zlr8gE6ZA","https://scontent-hkg3-1.xx.fbcdn.net/v/t1.0-0/p403x403/65689662_1183365235179078_7678638167825580032_n.jpg?_nc_cat=102&_nc_oc=AQmIwZvAF8VvkD2ya1II78Zgc_csJQlCYfl86P8Ysv7KtAw0t0N3SSU0onW7yhutaZA&_nc_ht=scontent-hkg3-1.xx&oh=43519cd45666210ceca9668eb14e88df&oe=5E189751","undefined","7",""
"https://www.facebook.com/otsukaka/posts/1178723648976570","1561018611","大塚家還伴手禮人情第二彈

 之前為了還小姑好友替我們帶來台灣味的人情
跑去淺草排隊日本第一的絕品銅鑼燒「龜十」外
我們家小姑還準備了「黑船」的最新商品喔

 「黑船」之所以如此有名氣的確有其獨特之處
寫了一篇文章介紹日本「黑船」的必買伴手禮
還有最新商品牛乳布丁「白々」亮眼登場

 「黑船」和「龜十」的銅鑼燒完全不一樣
有興趣的朋友請看這裡囉～
https://www.japaholic.com/tw/article/722470/","1571690821","https://l.facebook.com/l.php?u=https%3A%2F%2Fwww.japaholic.com%2Ftw%2Farticle%2F722470%2F&h=AT3l7FbJx4thIT9xuETyypvCG_4gz7zlo3PgoIUiJbzhDpv_sQjWNO_RdTdPxErITjOUWN3IM1ZylYKXQAFXs6eBsp_eUhcxbUTgsv-cL1dv0sWgH06jEiehmDh75sgh2V4URpyjynIh0lc7B4efYw4KZpQpVd-z_yhlfmuQLKETAT1cfxIM1X-5FRIfaffrz1d4PLbKPomurF8-zmiYnnIWPUst0t0ZDhsGAxjye5bpghkdyBJ8gupw4l8DoNnYCneKmF8w_zZjkja8NjJIOb0nibhSO1Ktm_H9XvGdjTWG6micpqUSNux9b4NiXelBLlpyay8WjS44gG0cN2QIh6es4hpxCfeq6vcpKEj58xBSujldDtW-a2V6rFqvtGSVpTPQh0824TiLKZjQvDp7q_c9VHLUASnfm74byagqwkr4HLQLgmX1AKHB42WUqSXSLsuqVcspaJGoOQ7dp1wpIHEok_qg4reNkEtMOsoAmLeYtusu1qttyhQ7hTC_uJA9x9lSOeZP2jBOSTKOxUJHzS4zBZu-2AJsRbmREgQlNMc3kWLQyAiekQ2q68sysHcOP3SX5ML9F0VI_onkcGcJp5qZ9yp4wG1SnG4BAseZPMQV_ZgNaKGCmS9YJnPKpHLEmrQI7e5gARgQvP54","https://external-sin2-2.xx.fbcdn.net/safe_image.php?d=AQB5I0_kXmmbQh9S&w=540&h=282&url=https%3A%2F%2Fimage.japaholic.com%2Farticle%2Fimages%2F2019%2F05%2F1.15.jpg&cfs=1&upscale=1&fallback=news_d_placeholder_publisher&_nc_hash=AQDGktKGmuod46kE","Image may contain: food","日本必買伴手禮 和菓子名店「黑船」最新商品牛奶布丁「白々」亮眼登場！ | Japaholic","說到日本知名和菓子名店「黑船」，大家一定會想到他們的長崎蛋糕、銅鑼燒和年輪蛋糕等等，「黑船」之所以如此有名氣絕對有其獨特之處，連台灣都引進了他們的商品，竟然還有限定版的珍珠銅鑼燒，且經常大排長龍。這篇..."
"https://www.facebook.com/otsukaka/posts/1158035644378704","1558599905","終於煮出令人滿意的大腸麵線了！
大腸麵線一定要有大腸和香菜
雖然在日本買到的大腸和台灣不太一樣
雖然我們家陽台上的香菜還沒長得很豐盛
但還是不會阻礙我們想吃大腸麵線的慾望

 我把肉絲先用醬油醃一下
和香菇絲、紅蘿蔔絲、鴻喜菇和大腸一起爆香
（大腸是用鹽和黑糊椒醃好的成品）
再加入水和大腸麵線的調味料包
因為覺得柴魚風味不太夠
我自己再加入兩包柴魚片提味
最後用太白粉水勾芡
當然撒上一堆香菜是一定要的

 煮完後整個廚房香噴噴
散布在上下樓層的日本家人們通通跑出來
端了一碗給大塚爺爺
爺爺一看竟說：
「這碗太小！我要換個大一點的！」
接著和大塚先生兩個人忙著自己加
辣油、烏醋、沙茶醬等等

 看著他們的背影不禁覺得
就算把他們和台灣人放在一起
一定會沒有違和感的（笑）......","1571690821","/otsukaka/photos/pcb.1158035644378704/1158016221047313/?type=3&__tn__=HH-R&eid=ARCk-e5G5bBqpGa10jvRXSdf4P2YTAJcVM7qP3XHLKKHFQo5Z_J6aXnc2R8XuBQC89Ma26REKXfw2sV4&__xts__%5B0%5D=68.ARD_jFZ9vNF7vjyo7jttFc0tWYUxpyVOG3XLrclkhO3wRvpkZdkzHosvL-AIWYKzvbMzRj4V9bHEQt_mX9rl3LFtHvDjajHsyj7E23Dv7MywFGPi5-p01Unvx9UkDQsInVClghMl2Vh-WQz3AbzYKoBzO3O5kyQbc3JeDwuy4ksKkugrymOMB4KHClsl3_FtvCEV7fAoe0hBo1JxQeTzX-iz-6v9j5Wa682DUSHMkk4H_NQSqwWmwuDjikltUjowwzMl90SAIhV2TIWo_p5GsEx5wdFr93Rwrn_Ny6TAphESDxUybnfR-Z2bXVmBM8KHMMiczVP8gW0ynwyaGyqB8jvR6w","https://scontent.fhdy3-1.fna.fbcdn.net/v/t1.0-0/p235x350/61110145_1158016227713979_264964899086532608_n.jpg?_nc_cat=102&_nc_oc=AQlyjThD9PKbZZpp47MOEvSxzPVUOxZRA0ii0NAx3XD99oq0h_r3KlbxR3KGKzvcukY&_nc_ht=scontent.fhdy3-1.fna&oh=5e44343b4e6e4b5d2210d50557ae114d&oe=5E20F7BF","undefined","6",""
"https://www.facebook.com/otsukaka/posts/1189337374581864","1562314873","#時間銀行

 上上個星期參加了大塚姊姊學校的家長座談會
聽了他們導師一席話後感觸良深
老師說了一個「時間銀行」的觀念
他說～
有一種銀行在一天開始的時候
會給每一個人86400元
但在每天結束的時候
無論你領出多少錢用掉
剩下的都會全部消失
因此理所當然大家一定會想辦法全部用光
就算存下來最後也會消失的話
不如全部用掉才聰明對吧！

 這些錢其實就是所謂的時間
每天有86400秒可以用夜晚過後就歸零
但真正好好利用的人不多
只是在不知不覺中虛度光陰、辜負了歲月

 如果用錢來比喻的話大家都懂這個道理
但是時間卻少了這種讓人想全部運用的慾望
然而事實上時間是比金錢重要的
因為用錢絕對買不回已經逝去的時光
就算世界上最富有的人也無法重返過去的

 於是我們最應該做的是
好好計畫如何利用這86400秒
就猶如想辦法用完86400元一樣
在一天內投資什麼才可以發揮最大的功用

 聽了這席話後我釋懷了許多
這一學期我常常怨嘆太早起床做便當
如果還可以多睡幾個小時該有多好
殊不知因為每天早起的關係
我也早一點把家中的雜事做好了
還多了下午的一些時間來寫文章
甚至可以拿更多時間來研究如何煮家鄉味等等

 老師啊～
聽君一席話勝讀萬卷書
來之前本來在想這個家長會一定很無聊
沒想到我就像懵懂的國中生一樣上了一堂課
一堂久違的人生啟發課

 照片是躺在相機裡還沒分享的便當與小菜
現在我做便當少了幾分怨嘆與疲累感
因為我知道我在狠狠地花錢中
一早開始就在花那86400元
希望每天都把全部花光光......

 ＃善用時間的人最富有","1571690821","/otsukaka/photos/pcb.1189337374581864/1189700294545572/?type=3&__tn__=HH-R&eid=ARB3jJfi-h33QKs5NGvFR-dWIZbcZ-p0L3RRZfCOnsP6GwFwX2n9rNBuhUEL0Hp2qUU5zhw7cemPg3hB&__xts__%5B0%5D=68.ARC28IWEGyvTRKjPa5FaPe1f5vCYknKGwMG9yxAUnVmp2igEK_mpnh_MlrVxKpi1gpWoizIvlSPBCwPrHpaj7GG3KjOP8gQAQ0JGjW9f0z4XZy9gWK_vRIX-Q4jFFJ5-ZxcCvyHQR_F8nZppAGIsRAvUwuS2pwYCqFJazqAr_r2bIGDHjbFEp7rxRlYbo_SShkBpKl1zPILnxQElY_a0N3mGoTv4aXJluPzEJXPY6BSl9TqZtEEN_EdwkeGr7Z8QVS2-s7AMVfy4s-WUY0_ry4N5ul9o2MiYocQ_P0DhNmXOT4eB5pAghV58PYLg-KRiTNAICkG3sGPjSNVoEsPHOKm0qA","https://scontent-sin6-2.xx.fbcdn.net/v/t1.0-0/p235x350/65821575_1189700301212238_7547814249968435200_n.jpg?_nc_cat=111&_nc_oc=AQl2DEJiwpzDWbKnAUjzCb_pV3290A2Ov1BU2kyTaobSVYMFn0pFB0Sa-cnEElqU164&_nc_ht=scontent-sin6-2.xx&oh=3d0301373f649873ed6f1ce52ca40eb1&oe=5E59A948","undefined","8",""
