url,posttime,text,crawled_time,attachment_link,attachment_img,attachment_img_alt,attachment_title,attachment_brief
"https://www.facebook.com/otsukaka/posts/1176458219203113","1560759448","星期一上班辛苦了！
上次帶大家去中目黑喝咖啡
這次要來逛一逛清澄白河的商店街
這條不是太長的深川資料館通道商店街裡
有好多有趣精彩的各種商店
充滿新舊交融的老時光＆現代風情

 茶葉專賣店「TEA POND」
優雅食器「青葉堂」
江戶土産屋高橋「江戶みやげ屋たかはし」
「美好」傳統關東煮
完熟屋 Bee Friendship
蛋糕店~藤堂planing（藤堂プランニング）
深川江戶資料館
在地人氣料理深川飯等等

 以上通通寫在這篇文章裡囉～
https://www.tsunagujapan.com/zh-hant/kiyosumishirakawa/","1571690814","https://l.facebook.com/l.php?u=https%3A%2F%2Fwww.tsunagujapan.com%2Fzh-hant%2Fkiyosumishirakawa%2F&h=AT1W_OXyQjwyFYCvjGHaNamfPHsHV0ORyd-wLRXI6T6mBMVuN5f_jUzuO8IFkHHj_5DlCLELdRulSpDiv6t8uIn4Ux0Nr8vgfGMwhzD4Q1-gXcmEsXjMVzvG4c1cyEeELClfMaCfV6OqhHpLRdQDR3NAY3I5F5stTJkEMedclGEdNQZ0YotsVoJ1zI90bh8-yJMXeKzN0Ri-qbPdj4LcdlPPfQLYCX_MRuRMJfxxsJ8iA1KHA-S4QM44IiQqVVK0s0uI4rmqfJwKr9Gcq52rf348d96-XHOQitW-u34DBzvlSbXq7GRw_QkI-a3QaBQyfexJYDo_oHnB3NvyEm3TqWdvYwFsL1mXOE9XduynGYcBoYBL2X8f4782nh9tE7FXstoooQz7XJIyjyphUmMp1gMOFCoSLT42whWwZsdZbKFLU9fkyxVdFD8AclhauKa7AuZn_VNd-0hwUt5ZWijEPAfGrao5mIgVl8VpL7HxdPQyQkhFizhgJ6YI4mQXwhkMBipbhTDwzESl884TbG8fSn6zRxLVWbvIWDk6co9Skm9-QFLy3irJcDnOL9DLfxJ7Aso0-3rn5hzU8dlYVWHJX9dq1HN6SbqOW8RyeSaVMWszHFi-gN6Z32HDsG_kB3QTPnw0hWYmfaHp19xE","https://external.fbkk10-1.fna.fbcdn.net/safe_image.php?d=AQDNA_5S87FUZxez&w=540&h=282&url=http%3A%2F%2Fd20aeo683mqd6t.cloudfront.net%2Fzh-hant%2Farticles%2Ftitle_images%2F000%2F039%2F007%2Fmedium%2F1.28.jpg%3F2019&cfs=1&upscale=1&fallback=news_d_placeholder_publisher&_nc_hash=AQDd-bxFschR1Mhd","ในภาพอาจจะมี อาหาร และสถานที่กลางแจ้ง","【東京自由行】跟著在地人一起逛清澄白河 探訪懷舊與現代交錯的下町風情","東京的「清澄白河」一帶是處值得慢慢探訪的街道，融合下町人情味、話題咖啡風潮、文青優雅氣息、古典與現代交錯等的特色。帶上悠閒慢活的態度與擁抱新舊事物的心情，相信您一定會滿載而歸！這次就由在地的筆者帶您一..."
"https://www.facebook.com/otsukaka/posts/1130965207085748","1555061253","小鬼們已經開學將近一個星期了
大塚姊姊現在的學校真的很好
好到讓身為家長的我們都很心甘情願配合

 只是～
每天早上要六點起床做便當
從星期一到星期六都不可鬆懈
是的！星期六也要上課
而且要在學校吃完午餐才能回家
有時候星期日還有社團活動
媽媽我幾乎天天要做便當啊！（哭）

 做便當之外還要準備早餐
一邊準備一邊超怕女兒會趕不上電車
整個人的精神都在備戰狀態中

 從台灣回來後馬上進入這樣的打仗模式
整個星期害我的靈魂都不知道跑到哪裡去了
只能怪自己在台灣日子過得太好

 現在每天十點過後已進入昏迷狀態卻一直硬撐著
好不容易一切雜事做完吃過午飯後立刻昏倒
才昏倒沒多久大塚小弟就已先放學回來
接著又要準備晚餐和吼小鬼們做功課

 雖然有昏睡一下下但腦袋瓜還是很沉重
大部分的時間停留在當機狀態
更別說坐下來好好寫文章了
也不知道腦袋何時才能使喚

 但我確定的是～
世界上最幸福的是在自己的家裡當女兒
好想念在台灣一醒來就有的美味早餐
還有隨手可得的小吃美食
然而最想念的其實是阿嬤！
如果問我下次要帶什麼伴手禮回來
我一定會大聲說：
把阿嬤～綁。架。回。來。。。

 ＰＳ～
照片是阿嬤的菜
之前沒分享到的漏網之魚","1571690814","/otsukaka/photos/pcb.1130965207085748/1130963627085906/?type=3&__tn__=HH-R&eid=ARCHildmjJ51IDawDoLV1qUAsQviK-a6EcNShXamCS1sP4-zZ1I6OwxS6I5iM77kbN44Ut0aX7CJ_b00&__xts__%5B0%5D=68.ARCHQOZ86_g0KgaP44KaMbbPzStMVu2Vx5TxBroDxQEvs7AeBujeeDZLeKOnNjXiAgUhSiNstHgGUd1kZ2tGxtDBgAX_xmFLMNkPCdN35mH19c5nrtwiA6IQhTe0igtfyoYTQlxu4xWWJe39wJDrQV6mbegEUl2JMUTfZaaa4tywvNZwuCMP5JT1NjcR9xYdx7DtU9L3djj0bbZRgq9tpW4g9TeBl4k-8TGg2E7JFJ9A3SXcKddEKUgcuLlC4-Xc-UjThvI12oNLMrNzOaMEBENhPS7HGNdTp7g7qCNlCWU9dOK6T1ydOtN1fpYJ2-BpSF73UV4NVGxw0Ye6De2MaL9FPg","https://scontent.forf1-2.fna.fbcdn.net/v/t1.0-0/p235x350/56770531_1130963630419239_5970008643133767680_n.jpg?_nc_cat=101&_nc_oc=AQmNw2WFEglEWortONypGrAZhwD5IOyL_dCYLGbz9_v3L_B4WLpyGrYjlXrJDm_biLw&_nc_ht=scontent.forf1-2.fna&oh=87abe59007f98cf7eb50809ccde8a362&oe=5E16E4ED","undefined","7",""
"https://www.facebook.com/otsukaka/posts/1202156639966604","1563870032","今天大塚姊姊終於要去爬富士山了
這是姊姊的學校每一年
為一年級全體新生準備的重頭大戲
用這三天兩夜的合宿旅行
來告訴菜鳥們從今以後中學的六年生活
大家要一起同心協力面對困難往前邁進
身邊的同學們將會是人生中的重要旅伴與資源
希望藉此機會培養同舟共濟的情感之外
更要以禮相待珍惜對方
同時體現自律自主的重要性

 雖然要準備這次的富士山之旅
中間開過了無數次會議
有的是學生們自己開有的是家長必須參加
讓我很納悶老師不放假搞這些麻煩事幹嘛

 接著我家小姑用她以前參加過多次合宿的經驗
幫大塚姊姊準備了一些必用品
而且更細心地寫上備註提供參考
看著這些東西和可愛的文字
不禁佩服日本女孩子心思細膩之處
要是我的話
會直接叫女兒把所有的東西全部塞進包包裡就好
因為媽媽我以前的畢業旅行就是這樣（羞）

 自從女兒從國際學校換跑道到日本中學後
我自己也感受到日本學校的一些震撼教育
其中令人印象深刻的就是日本人對各種行事的規劃
每一件例行公事的背後似乎有它的意義與道理
而且為了體現這些道理不惜大費周章、鉅細靡遺
就算是在暑假當中也願意全體動員起來
為的就是讓學生可以獲得難得的實作經驗

 有時我們會懷疑日本人是不是太龜毛
有時我們也會笑他們是不是太小題大作
但是從他們重視小細節的程度上
又不得不承認：
魔鬼藏在細節裡
一件事情的成功靠的就是所有細節的鋪陳架構
所以要做大事之前先去把小事做好吧！

 這次的富士山合宿雖然是女兒去的
但也讓媽媽我從中學到了一些東西......","1571690814","/otsukaka/photos/pcb.1202156639966604/1201999436648991/?type=3&__tn__=HH-R&eid=ARA8WTN0uwnm8r1K1DDP2NhsfJ19u8FdYMYw4gHd6bbTs4lmnESkYLA-fNp15AR6lmUMyATKgcjFaGmG&__xts__%5B0%5D=68.ARCF7hrabMmNCr7YaQ5xs__bLhqq53hgopgMG9ZhNasYTEMrRcWVnHMZzSM0PEV09hIMpIlu2lTMZGYvBkjKT-2PUbg2hx0Oro16TgqM1omSq7POhGIAcMEnRMaBXlL3J2ZSz2U8lnpYqtF0tAYR_m2xdrYgX7FYseWdB9rUngWVfxbvxa8DVahHf_mpQ4cLN1nmu96KTpXWaze724zQvuw5o5AdaY7dlZAZiQthUr_HQy7yS3rbwp2_L7OcJwkgh--YUB03juKkXy4IK_brEUlaR2IEe6PFuMsFn7VJtSMPwa8Q6xIsxhrQAWFpfNi-_-3xp2GkKSZcpSTsUf1MutVoYA","https://scontent.fbfh3-2.fna.fbcdn.net/v/t1.0-0/p235x350/67399196_1201999443315657_6959936873296822272_n.jpg?_nc_cat=107&_nc_oc=AQlKPqLN8qZHdmlfviZglhttRairyNhig8MCcgpuy6nNocuGRJcZfhNXL0KuHkpWil4&_nc_ht=scontent.fbfh3-2.fna&oh=6c3be510a5406af63070a07a0ec0e442&oe=5E219AD7","undefined","4",""
"https://www.facebook.com/otsukaka/posts/1267524820096452","1571300593","颱風過後東京的天氣一下子變涼了很多
這兩天白天都只有17度左右
趕快再來跟大家介紹一些賞楓和銀杏的好去處

 這次要分享的是東京近郊神奈川縣的賞楓景點
來東京旅遊的朋友們也可以安排1~2天的輕旅行
感受一下和東京市中心不同風味的秋日風情

 前幾年台灣阿公阿嬤來的時候
我們帶他們去的是大家熟悉的熱門景點
橫濱市日本大道＆三溪園（照片１～３張）

 後來發現了一些遺憾～
其實神奈川還有其他地方也很值得列入行程中：
＊湯河原町的萬葉公園（照片４）
曾是日本最古老詩集「萬葉集」創作舞台的公園
鮮紅的楓葉倒映在河流和瀑布之上，美不勝收！
最佳觀賞時期：11月中旬
交通方式：JR「湯河原站」→搭乘往「不動淹・奧湯河原」方向的箱根登山巴士→於「落合橋站」下車→步行3分鐘

 ＊伊勢原市的大山寺（照片５＆６）
參道階梯兩旁開得艷紅的紅葉排排站好
在紅葉盛開時期的夜晚還會打上燈光
可以欣賞到不同於白天的夢幻之美！
最佳觀賞時期：11月中旬
交通方式：小田急小田原線「伊勢原站」北口→搭乘往「大山纜車」方向的神奈川中央巴士→於終點站下車→於「大山纜車站」搭乘纜車→於「大山寺站」下車後步行5分鐘

 ＊伊勢原市的大山阿夫利神社（照片７～９）
能夠欣賞到被評選進米其林綠色指南
日本版的美麗視野與紅葉共同打造出的絕美景色！
最佳觀賞時期：11月中旬
交通方式：同上，只是最後搭乘纜車後請於「阿夫利神社站」下車

 ＊足柄上郡的丹澤湖（照片１０～１２）
火紅的楓葉映照在丹澤湖湖面上
交幟出幾乎讓人屏息的美豔風光
幸運的話還能同時欣賞到富士山之姿！
最佳觀賞時期：11月中旬
交通方式：小田急小田原線「新松田站」→搭乘往「西丹澤旅客中心」方向的富士急湘南巴士→於「丹澤湖站」下車後立即抵達

 阿公阿嬤啊～～～
這是我和大塚先生為你們設計的下一次賞楓之旅
這些地方多了一份清幽你們會喜歡的
請笑納～～～
也歡迎大家拿去用喔......","1571690814","/otsukaka/photos/pcb.1267524820096452/1267503310098603/?type=3&__tn__=HH-R&eid=ARAPiWoA1mn6uOA3jX5VfrUjWrXvqU7w1b6G4Cgjdtj8duCK9o8UxuVtB8UQYvwko3jDa8phrMtOSfmv&__xts__%5B0%5D=68.ARCWsHhC74IJ4c6zYqxS2pzYu3GOgiGjyZEtQUL5IHnicmR3XWM1MQ5xzTJdqSWaCT13fCbFwToZ0dcgyqqcl-PtVm4X8o3yi8rqFnKo_8LdIuB0rPEi-x2jzIaxIJxKg3qUUVq3T851KvUMG9x4b7ly7FAxHEhku6WLeP5TR_DHiSCVHrMhR0w6TsICrEzRxnKfoJ2AD_vHI3rIEviv4o84stUpIkC1vrY2PPFjZitmhL-qsCx590ah2O1Cprp-cJWkieJBnEORDnQL_77FZx6l-StV1vZr73fP6rETCk3BiGaa6Pbh4Nyac32ebPoUYdyVCGhPjomtQhbvDYzPKA1hug","https://scontent-ort2-2.xx.fbcdn.net/v/t1.0-0/p235x350/72867466_1267503316765269_3420855968529907712_n.jpg?_nc_cat=109&_nc_oc=AQkVeFKeDQQimmDuWEg0uQ4nLZRMoiaND_d5-6NidDHWN2cbU-YZ_Vd4w_HoGM91_cM&_nc_ht=scontent-ort2-2.xx&oh=27bb71ea926c83e9d57c4a29ca0fac06&oe=5E62FA55","undefined","9","大塚太太東京在住中AuthorSend Message"
"https://www.facebook.com/otsukaka/posts/1170952773086991","1560155812","#我們家的台灣小吃攤

 既然小姑的台灣好友幫我們帶來好多包麵線料理包
那我也要努力來煮出最接近台灣味的大腸麵線
才不會辜負了這般好意

 於是這次我家大塚先生買了各種大腸回來
看上去應該有三種
洗乾淨後再用薑和蔥來煮滾一下去腥
然後爆香了香菇絲、紅蘿蔔絲、肉絲、大腸等等
也多加了兩包柴魚片增加風味
最後再加一點蒜泥和辣椒醬
烏醋和辣油就隨意了
當然還有一大把香菜
沒想到三種大腸的結合太美味了
好險這次沒有加蚵仔進去
不然應該會爭奇鬥艷而打架（笑）

 順便再做一個嘉義雞肉飯
這樣應該可以把台灣小吃攤風情展露無疑吧

 這段時間竟然漸漸地讓我做到～
不用回台也可以吃到台灣小吃
實在是太開心了！！

 正當陶醉在自己台灣小吃攤的幸福中
大塚爺爺在一旁提醒我：
「我記得妳好像說過要煮牛肉湯餃耶」
馬上驚醒！大塚太太又要去忙了......","1571690815","/otsukaka/photos/pcb.1170952773086991/1170934213088847/?type=3&__tn__=HH-R&eid=ARCl2X0rjOtTAzZqMkYTLCHxt2qIfLqAZSxRluTiHmsxBP6V2hwjTepgnjV589B3czTlvyYx7eCF-VNs&__xts__%5B0%5D=68.ARByC4kF7MJ45X6XWP2qMQ0GzPjQ795n-dx3uZKrKr7NQeiAJMQCDypN83geGdF_Z0bbuPotzyuquMqGKLdg0PdIF7BkrTqXe5OyqY_-eLrs6fLID3j38GiqASGK45cwPdcefwucwB6RMJoNGiplgr6NtpDcdyPDOjyky48HP7ZAQh3cRI3YWzFFnFyOF9Yn3DwzQeMUMBvHNsbxnzf64n7bvchEb5XLN-dqz8XD8twggbqJl3F_OVVfn4zHK5YeFDqVJKHjcaDnvK4CZOeMePrpapcyZ8HuUKGYLfqTe_DLWPMrzt1amlAvAzvTTPHfYZXgX_VCEGe4oBrqD2_eSReGcw","https://scontent.fbkk15-1.fna.fbcdn.net/v/t1.0-0/p235x350/64220298_1170934219755513_3790107187573948416_n.jpg?_nc_cat=104&_nc_oc=AQmmRw75zo0IzdRwdOrpDSsFb1Bm5nDQehJGctYeGCaDkddNoDoAsQczaTd1svBghbg&_nc_ht=scontent.fbkk15-1.fna&oh=1ab895acba433510095e6e5811cf91e4&oe=5E2A7893","undefined","6",""
"https://www.facebook.com/otsukaka/posts/1225338367648431","1566721825","自從阿公阿嬤準備的台灣家鄉味來了後
我們已經喝了兩次香菇雞湯了
我們家的香菇雞湯一定要很多香菇＆蔥花
裡面還要放一些冬粉和薑片
台灣香菇肥厚香醇搭配日本彈力極佳的冬粉
簡直就是天作之合！

 早上也常常煮一大鍋粥來配花生、皮蛋和嫩筍
本來應該是主角的烤鮭魚已經被踢到一邊去了
為何會有一根西式香腸呢？
那是媽媽我用來安撫一下小鬼們
因為他們說：
「如果有在阿嬤家吃到的台灣香腸就好了！」
我只好拿出冰箱裡僅有的香腸來偽裝
（哈哈．．．一眼就會被揭穿．．．）

 大塚先生再度驚嘆：
「去台灣前都沒想過花生和稀飯會如此對味
一直以為花生是拿來配啤酒的！」

 另外～
南瓜炒米粉裡面也需要台灣香菇來助陣
就算是被切得細細薄薄的也檔不住香氣

 在這裡要提醒一下阿嬤～
記得下次寄香菇來的時候
順便把蝦米也一起寄來喔
那個很重的仙草蜜就不用了（笑）......","1571690815","/otsukaka/photos/pcb.1225338367648431/1225277920987809/?type=3&__tn__=HH-R&eid=ARDpdIKF9Fd5phBIuxmihLhvwUkJSFsd0EmreVnwke2UgyZgr9hp7kiXJXGU-CyU6F2QIQieb2pNkvpL&__xts__%5B0%5D=68.ARCzc6JSbPPxmxjtrNjZG9FGaPJycwLlzj_HRZSlhH07hZO-6pRBWqMyRhsIFfY9lVydt2cebksCQRV3_k2FUdcrao7opys32rN4SrGaLcl-HGAn2SDZkC3UJr4X5BehVgnQzbh5QLl0QaOFB4t-LzHqfF9rcGorAuFMjQJkNVPowyGswgFMNJ9AScm0dxrYruL6RKJr1egNhoP25Z2qk50OrMco6dOU51xhZHwNdgQ5j3RL-0TM7HbFos7m3iI4YUDZudQKZ_cxmWlITLmWfegutOi_BB7WbpegvFj4YzREGBN_nXnrFMLCKn7aNZIP59mPabVfjazSt_HQ1zOCWeGrLA","https://scontent.fsub8-1.fna.fbcdn.net/v/t1.0-0/p235x350/69474251_1225277927654475_800021973382987776_n.jpg?_nc_cat=106&_nc_oc=AQmnEZ2BwXRz_k8NiPEfwzz_xyq17LDOhtGs6pD2XS2txdNzpx4dsJC5YF3HBMbeeqs&_nc_ht=scontent.fsub8-1.fna&oh=cd9e1ae9e69848d4cfaf159a5e0dd46c&oe=5E17C351","undefined","7",""
"https://www.facebook.com/otsukaka/posts/1143170019198600","1556710518","今天是新年號「令和」的第一天
早晨就用最高級的gold soft吐司來迎接新的開始
中午再去吃一頓美味的壽司大餐

 晚上拿出老菜脯來燉一鍋雞湯
先將老菜脯和薑片煮開15分鐘
放入雞腿肉和泡好的台灣乾燥香菇慢慢燉煮
再加一點鹽調味就好
有了老菜脯的加持湯頭變得很有深度

 另外再拿出一般的菜脯來煎菜脯蛋
突然想到還可以來做菜脯蒸蛋
蛋與高湯的比例是１：２
高湯是烹大師台灣限定干貝口味做成的
這樣做出來的蒸蛋又美味又充滿台灣味

 在這個歷史性的一刻
日本新舊交替帶來的全國歡騰氣象中
新年號對日本人來說有一種驅動程式的力量
驅動人們揮別平成舊時光&迎接新希望的開始

 是說我在這個充滿正能量的驅動程式裡
加入一些濃厚的台灣菜脯元素
結果我們家令和的第一天也充滿了台灣味......","1571690815","/otsukaka/photos/pcb.1143170019198600/1143160232532912/?type=3&__tn__=HH-R&eid=ARB0o_RxYVhkcTEPLqvlGWjLZvp13c3X9FvCPWDNpxB2YR_ccmQlWJBcEA4SOcK1nNc2qk3Wkef6drum&__xts__%5B0%5D=68.ARBouWvBDl4OIDHeutzgbp7RHb5NlYS2pwUwMdqf969hDKK4P9JQli4Wbn1O_MR7NhqyQG7088mG6BA_FHgJk8VKFe3ZyTzEUF7OxRTIihSxColK-xhLU23WArb5VvokeAmQyP4U92mstWPHeCjgciZMl71VQ6SP5TPjfQLtrbH5R3y0FLazGMokoCIVDBaGf3U2iBY96t9b7rtroGWAWHtHAa0QtlqpHqLlLbOnfnSPDntUq7CldLI-6qL0mb_sOPWxdEPc6YKkpUzZxTXha6x28CzZKmscuyqT3t9t-szx1SdRg18ZspU36Ob3BWSm8UofbjZwqAXu9bQP-b3eIeTfPA","https://scontent.fpnh12-1.fna.fbcdn.net/v/t1.0-0/p235x350/59465563_1143160235866245_5214303997736779776_n.jpg?_nc_cat=106&_nc_oc=AQmyaLK_n7iqsnWzllDmbG8De4QhKtweWpFtkVozVtIMihFUoFrNQoN8w1KRYScGz8w&_nc_ht=scontent.fpnh12-1.fna&oh=fa95ec954dee07b3b43aee525cd58fa5&oe=5E5D11F9","undefined","7",""
"https://www.facebook.com/otsukaka/posts/1201472486701686","1563782730","星期一上班辛苦了
今天要帶大家來俺のBakery＆Café
享用法國菜主廚監修的厚玉子燒三明治
並認識一下他們的主力商品：
「俺の生食パン」（我的生吐司）

 雖然俺のBakery＆Café在網路上的評價有好有壞
但我覺得在銀座和惠比壽這樣的地段
可以用合理的價位吃到各式各樣的吐司料理
已經是我這個麵包控會想再去的一大吸引力了

 他們的高級生吐司
冠上了「銀座の食パン」（銀座吐司）的名號
有「香」和「夢」兩種類型
是每次我去會順手帶回家的伴手禮
為早餐添加不少美味的幸福感

 詳細的介紹和體驗寫在這裡囉～
https://www.tsunagujapan.com/zh-hant/bakery-cafe/","1571690815","https://l.facebook.com/l.php?u=https%3A%2F%2Fwww.tsunagujapan.com%2Fzh-hant%2Fbakery-cafe%2F&h=AT2w6hztXbI4jA4xrEzJHCC5iAbsuwVCSczbi9jYSr6iwo73Thw_xuwfOlhS5pDJrd-JBZj5VrkpI9xEwACKBiWuhwkG77gV1nRX0QlOLaLP6nVgiAXn1O_e8TRlwsnuxMXIUJW_Ry9Zs4Jd6qKYsZtDQrNTQeP_47m01UdezEjUyxvF6E74yrKKimn-q09ZKTgs3SBpM5cs_jrWnNYPkKZid9yYDjrqu64JrlZx8MnVKcfo82F6KQFa10iVu7yPe0xEeGSQ5-3BlyAGzebFnztfDz8qaSo2wh7-4cAeEIJ267hHPtuQ923Yx3wYRRwXttMICFoKcpk7M2tTedmncGF5AdRs3-W8-4aQRCLUW2iuECs09xdl3rpux5Nm0dVhnxjfsd_SCIvs0qEQkKvX1ecrcWOki5aRCJZF12vKngzOSqd5nXy5JyavgIIHWMSLEaOrsUobqiqG8V3eq8_V4sZKSCpYr7UDJkcmLbw5TzI30C1AbAlTNuTMNHebyen52s4vwVeVRqKXij2Kh-6Ud9YM_ULMA7F5ztV6ERHPVkskYEH2Pg5BwVQpgrJP6kP2gl6jIiEGZftukRsJ8osfF60j91aUJlfN2gamtTAGz-VMUb-pe_NjT2xhlYZARXW91jFynuekTZ23wRh-","https://external.fstv5-1.fna.fbcdn.net/safe_image.php?d=AQD3CBhoB9Fy-F6Y&w=540&h=282&url=http%3A%2F%2Fd20aeo683mqd6t.cloudfront.net%2Fzh-hant%2Farticles%2Ftitle_images%2F000%2F039%2F154%2Fmedium%2F1.5.jpg%3F2019&cfs=1&upscale=1&fallback=news_d_placeholder_publisher&_nc_hash=AQBpOi2MT4hECiVE","Image may contain: food","【東京美食】在烘焙咖啡廳「俺のBakery & Cafe」品嚐絕品生吐司和玉子燒三明治","傳說中東京的話題人氣餐廳俺の系列，是日本「俺の株式会社」經營的一連串連鎖餐廳，以便宜的價格提供昂貴的食材再做出自己獨特的創意料理為其主要特色。自2012年的第一間法國菜「俺のフレンチ」開始打響名號，接著陸....."
"https://www.facebook.com/otsukaka/posts/1143721249143477","1556873982","#母親節禮物準備好了嗎
#Zaniin廚房美學的實踐者TPU無毒環保砧板

 回顧我這些日子在日本的大塚太太加工廠
做了好多手工點心類料理
有各種形狀的餃子、也有鹹湯圓和鍋貼
還有和大塚姊姊聯手合作的造型湯圓等

 我體會到工欲善其事必先利其器
之所以願意待在廚房裡做這些費工的東西
是需要有方便好用的器具來幫忙才會輕鬆的
除了之前分享過的食物處理機外
我發現自己也很愛這款TPU無毒砧板

 它柔軟具彈性的環保無毒材質非常好用
兼具耐熱耐冷又美觀的夢幻顏色
有時還會直接被我拿來當餐盤使用
包好的餃子湯圓等放在上方就可以直接進冰箱
做好的熱食切好後也可直接端上桌

 建議大家分開處理生食和熟食
讓蔬菜、肉類、海鮮、水果等有自己專用的砧板

 另外Zaniin無毒砧板還有下列特色：
大幅減少刀痕產生
有效改善砧板表面異味殘留及食材色素附著問題
質地柔軟、不傷刀具
特殊止滑設計、容易清理與晾乾
富彈性可折彎方便將食材直接倒入烹飪器具裡
無毒、耐熱１５０度Ｃ，可使用熱水消毒
可使用洗碗機清洗不會產生毒素和變形
砧板上已經幫你做好記號徹底實施分類管理
（切菜切肉切海鮮都可以分的清清楚楚）

 母親節的禮物準備好了嗎？
推薦給自己和母親的廚房貼心用品～

 團購日期：5/3(五)~5/7(二) (5/10前 出貨完畢）
團購表單
https://gbf.tw/pn6dg

 【贈品】前10名，購買A組送寶貝砧板(顏色隨機)

 贈品規則：
＊前10名購買「A組 橢圓砧板組」，贈寶貝砧板１片(顏色隨機)
＊須於開團當日晚間23:59完成付款。
（當天未完成付款，將取消贈品資格。從已付款之「A組」訂購人中依訂單成功順序補上贈品）

 購滿$2000 免運費

 更多使用心得＆產品介紹寫在這裡
裡面還有一些實用的食譜分享喔～
http://otsukaka.pixnet.net/blog/post/401370407","1571690815","/otsukaka/photos/pcb.1143721249143477/1143705079145094/?type=3&__tn__=HH-R&eid=ARDdBB4haB9yO8NUBOlilA8Uu-_Ll_OLvaqvkcp0OLyB3NeQEBruwtY7102QOfkcIxv6XuaxzXA6OQTf&__xts__%5B0%5D=68.ARBg-DLSxMVMN1g4gYSMiZ54DBrCTsPwBPfEejyyJjdilnN_dsIwILHYHfAHeo3L85t4DEW7l773nkQ8xcjN9OWieYHQVf6k6Y1z36VaHqvmXaROUlJVFza5KgtZH3lq9luEl7enkrjRqFBCY4vqKwfwf3SFwPWs9iAmdEmS537qZFQP8pk5wpSSEFdEHM50Jy9-SDpJptmpSlXqDcjN9nf1X7p-SwwlNPV0XHa2o85aN6QaMDqg-cM9g_rFbQDajUToU8f1mGHkd6KVtZs4kHL9C5q_gT5WzbatoeLkJwkt_KGD20hEj2n30Mc9_vUgjOehTABEPp8BPNuTmlu3jTaUjA","https://scontent.faep9-1.fna.fbcdn.net/v/t1.0-0/p235x350/59687860_1143705085811760_4652443527194607616_n.jpg?_nc_cat=100&_nc_oc=AQmSOewXg3tlQHvVmQ5toUDkzdc02QiM7nfwEcPS97-lVzLegEtsIGaQ3pVUSV4lVPs&_nc_ht=scontent.faep9-1.fna&oh=c6b2ccbe3e724fdb355134ad5f43bea1&oe=5E2EAE47","undefined","7",""
"https://www.facebook.com/otsukaka/posts/1167238743458394","1559722501","最近很喜歡蕪菁（大頭菜）這個食材
用蕪菁做出來的濃湯清爽溫和
再把它的菜葉切碎撒在上面多了一分清脆感
早晨配一片烤奶油吐司精神都來了

 還有以前跟大家分享過
運用把牛奶和麵粉拌勻的小撇步可以做出專業級的白醬
再利用這個白醬做出來的焗烤白菜美味又方便
這次用同樣的方式做蕪菁奶油雞肉焗烤
滋味不輸大白菜外還多了一種新鮮感

 通常我會多做一份放起來
第二天再加入一些造型義大利麵
給小鬼們帶便當他們都很喜歡

 是說～
前幾天兒子跟我說他要去校外教學
請我做一個方便在外面吃的便當
依稀記得他說的是星期三這一天
於是我今天一大早起來準備好了
方便用手拿來吃的火腿蛋不捏飯糰
配菜就是蕪菁奶油雞肉焗烤蝴蝶麵
正得意地覺得這個便當做得真不錯
等一下一定要來現給大塚小弟看

 兒子起床後看一眼說話了：
「校外教學是下個星期三啦！」......

 焗烤白菜小撇步的做法分享在這裡～
https://www.facebook.com/otsukaka/posts/1070492466466356","1571690815","/otsukaka/photos/pcb.1167238743458394/1167244673457801/?type=3&__tn__=HH-R&eid=ARBuJ67r4OmGUpJNiDlW25Xp7qzi839ZE1ht8Dbx1BeB1wAyNeBDjAjIapRzozfqBr6uqfI2HcwMpcgE&__xts__%5B0%5D=68.ARC8lrOL22MjRNWaDmewPDa17-UCs8hm3H0NEMtHG5AEQfnj3VHAwEkfeqdwYn6X4-5jQ7X32qQs3O49Wi4LvCqLAtSEgzJE8t_8kx4WJQbcDYZRlnDgHYbJ6qDWD7rvjLn4lG86u3HoAMgBEo78SLTpjN-BILqMNBpxgMVloD-RZV_e6eQedtHweE1-cieWGfDZi6fEVvdZ81T6YTSyI5at9hJ7s0kFy3aj5zsO5NNkX-Ymt7vNUMs7mMYJvA64_wUvAm6FITQ9y_OBOxZCLU2WjrtMeGercqre8ztvN422S3bYTnNMnW2kKp2TuNppbIdcVIzLzZDof9Ukx0iJayPkWA","https://scontent.faep9-2.fna.fbcdn.net/v/t1.0-0/p350x350/62153556_1167244676791134_426734876650110976_n.jpg?_nc_cat=105&_nc_oc=AQm-T_7L5HYzJYtJUkiRH0YtqPMLdpVSdhFPrYJgX4ZAprC0ggZtwEk9KG8h0NOCnHo&_nc_ht=scontent.faep9-2.fna&oh=3d05032b588d51936eba50de7a8b44a1&oe=5E5F98E4","undefined","7",""
