url,posttime,text,crawled_time,attachment_link,attachment_img,attachment_img_alt,attachment_title,attachment_brief
"https://www.facebook.com/otsukaka/posts/1217374965111438","1565771771","上個星期的某一天
我帶著雀躍的心情踩著六本木hills的階梯
要去赴一個讓人期待已久的午餐約會
見一位已經交往十年以上的媽媽朋友
以及一位即將要成為朋友的傳奇人物

 本來以為這個午餐約會會跟平常一樣
是一個一起罵先生和小孩的壓力宣洩大會
結果．．．我錯了！
從見面的第一秒開始到最後
都是圍繞著各自有趣的工作內容
以及未來想做的事情
好久沒有這麼熱血澎湃了

 我們都是當了近二十年的家庭主婦
不想永遠就這樣下去
想在人生最後還有力氣的二十年
看看自己還能做出什麼事情來
無論成功與否、無關內容是否偉大
只是想在有一天當自己走到盡頭的時候
還有一些東西可以讓人覺得沒有白走一趟
這就夠了、足矣．．．

 其中這位交往十年以上的媽媽朋友
她的女兒是大塚姊姊在幼稚園時的同學
永遠記得我們第一次見面的時候
看著她遠遠地像仙女下凡般走向我
一雙美麗閃閃發亮的眼睛望著我
彷彿當時的空間裡她只看到我
然後笑咪咪地對我說：
「我好愛台灣！熱愛與台灣相關的東西
喜歡和台灣人做朋友，最喜歡F4
妳知道ＸＸＯＯ．．．嗎？
（一堆台灣偶像劇明星及歌手的名字出現）」
最驚奇的是
她居然還會說一些中文
她說自己努力學了好幾年
我壓根不知道她說的那些偶像明星是誰
因為很久沒看台灣的電視節目
當時的腦中只想到一件事：
哎呀！以後在學校不能用中文大聲罵小孩啦！
（這段內容也被我寫在書中喔）

 這位媽媽還是一個餐飲界的女強人
她和先生經營了好幾間餐廳
在我想法中她應該可以過貴婦的生活
每天逛街喝下午茶度日就好
沒想到她最近跑去學臉部的按摩調整技術
在惠比壽開了一間沙龍
享受著被她調整過的顧客們臉型變小的成就感
還進一步繼續學習身體方面的調整技巧
一種永遠學不夠的精神挑戰著自己的極限

 另一位雖然是第一次見面的新朋友
但聽著她訴說自己跑到鄉間
幫助農民們收割開設料理教室等等
為的就是想將各地農產的美味與美好
讓更多住在都市裡的人認識與接觸
現在更是帶著相機和無人機深入日本各地
希望藉著自己的眼睛與五官的體感
把鄉村里山間最純真樸實的風土人情
散播於全世界

 雖然罵先生＆小孩的媽媽午餐也很需要
但偶爾也渴望這種能量滿滿的夢想談話
這一天我從她們身上得到了許多能量
激發了我當媽媽後也可以追求自我的想法
不要輕易放棄自己無限的可能性
也不要有隨便給自己畫地自限的想法

 最後一張照片就是有十年以上交情的媽媽好友
有興趣的朋友也可以去沙龍找她玩
看看她可不可以幫你的臉變小（笑）
Salon Gato～
https://smart.reservestock.jp/…/…/ZDNjNjU2MjZkMjQ5ZTRjYmMyY…

 如果對日本里山小城有興趣的可以參觀一下
マッキーさん剛剛成立的網站～
https://satoyamajapan.com/

 我們雖然都已是歐巴桑了
但無論年紀有多大仍有追求夢想的悸動
也可以繼續在人生中發光的......","1571690826","/otsukaka/photos/pcb.1217374965111438/1217373908444877/?type=3&__tn__=HH-R&eid=ARCVZ8wrdsSqglZoPC2WBpIACFQPuhLwpi2jv27xW1GisyHj6Td7_wqAoY-i5AJmj1AbTRdXSyV8Iyl2&__xts__%5B0%5D=68.ARDkmVpt3BUKluoQF8QK3s3h_Q-QHGTLAN5vFLcFbD_IgqV3PO_EnipsdQosuvVrknV2EIIKiHYSOV6ejf6oXE_vGFdA2eBDeWTp-_kBZyw2SFlnxytnw7XAovxxpRxeBpBoLgYg3blcffS2qwb_U7PFEo8iIprcorQPVKBks8HFxDPILNessA0KfmFSQbkLrxhyG1u0-NxMyr8rbEyjwH9xsSQvbRkCfjKrzJT9Cmcyzr9EQXUSjl-mPBAewQUyv5JyOFaTIqORU5TcwF5j21TEp83EJdjZgQAxTHK35eT_7NY7H2wrxI4728VTUHq1iBWUZYYn8gnwSyxYuY79Lf0tDA","https://scontent-lhr3-1.xx.fbcdn.net/v/t1.0-0/p403x403/68734347_1217373915111543_7970692065598111744_n.jpg?_nc_cat=103&_nc_oc=AQmiEm6RFqq5MniiyvNS691NPGZBPjvOdsrb_LkBb05P_guvNvF3l_KZmkQyrJEzJaM&_nc_ht=scontent-lhr3-1.xx&oh=90bf86be49b2ddc117c46c4628f4f0c9&oe=5E638A68","undefined","6",""
"https://www.facebook.com/otsukaka/posts/1218091735039761","1565857555","昨天是大塚先生的生日
前一天我問他有甚麼菜想吃嗎？
正當他想得很認真很慎重
好像終於輪到可以好好點一餐滿漢全席似的
這時大塚小弟說：
「媽媽～
我喜歡吃焗烤馬鈴薯
還有上次你做的奶油烤玉米也很讚
我想爸爸也跟我一樣很愛吃的喔」
大塚先生：「．．．．．．」

 大塚小姑再繼續問：
「我很願意做一個手工生日蛋糕
想吃哪一種類型的呢我盡量配合囉」
在一旁的兩個小鬼搶著回答：
「我們想吃抹茶戚風蛋糕
最好上面還有ONE PIECE的圖案更酷！」
大塚先生：「．．．．．．」

 結果這個生日大餐就變成這樣了
酸奶油培根焗烤馬鈴薯
醬油香奶油烤玉米
還有最後的重頭戲～
ONE PIECE抹茶戚風蛋糕
上面淋上的是水果馬斯卡朋起司鮮奶油
水果用上奢華的麝香綠葡萄＆水蜜桃
大家眼睛一亮的是
我們家小姑親手畫的ONE PIECE
那塊巧克力版到現在都還沒有人捨得吃
一直放在冰箱裡保存
天啊！我們家小姑實在是太酷了！！！

 這位愛小孩的爸爸過這樣的生日也很開心的
還好他有替自己準備了厚片牛舌＆牛排
事後才發現牛排忘了照相
因為光彩被牛舌搶走了
這牛舌鮮嫩美味我們家常買來吃
灑點鹽和黑胡椒烤熟或淋上蔥花鹽都是絕品！

 大塚先生最後終於說話了：
「好加在俺の生日不是和小孩同一天
不然大家會徹底忘記我原來是有生日的......」","1571690826","/otsukaka/photos/pcb.1218091735039761/1218010828381185/?type=3&__tn__=HH-R&eid=ARDKV5h9yzSEdGazLMyy_mek2LdGWz3tT7TFilzSSbmyeK7ouHHD1r-CVoRM_SZXOSwKm4UwIXjD6DBh&__xts__%5B0%5D=68.ARABuBAO5BAtcAad53WSTD_lbxCCEEMBPRWhxhIWylCgjNJm17OgAsWGMBa_wJOJpMFEcTK2EyvUYGclHXZ0rwNCNqsnfUB9UsmdaOPLYW-w_MlQphC5zEHj61YBSU0IPHDtr-bhe7N27V-bHrsHGGAZog5UX6D1gZsYyLMFZ75qNu52aPAHrUSq0YfIqQToJ-143YxG5U6hf4o-5Lej1bxdOvEo0XN1-ZW4so24KG5mXBf_3v59HI71NZZEEgcZTiDngrH-ZFngyOZJ6DIohWwPA44rloIDPzo4KDOIJuDB6eC0QG9AcqBsksr52nVuxXj2OSCKRxiSVnHObdmWOokAAg","https://scontent-lga3-1.xx.fbcdn.net/v/t1.0-0/p235x350/67951345_1218010835047851_4214246490933035008_n.jpg?_nc_cat=109&_nc_oc=AQmJg3_Yf9TqSlcuuAM9MbqdLzePq9r6aqqH0gSs9kxteKwv7lLU9-L0UMx30_gQEGg&_nc_ht=scontent-lga3-1.xx&oh=45d12989d9cec72578b17d48f0995ea5&oe=5E2F8F40","undefined","9",""
"https://www.facebook.com/otsukaka/posts/1215210895327845","1565506953","昨天是大塚姊姊的生日
本來幾乎每年夏天都是在台灣慶生的
今年在日本慶祝了

 這次暑假真的很難找到一個完整的時間回台灣
只能怪大塚姊姊的日本中學太認真了
一星期有四天要去學校上社團活動
七月份有三天兩夜的富士山合宿
八月份又有體操社的新潟合宿
想到女兒是今年的新生
尤其又是從國際學校換跑道考進日本中學的
為了讓她能早點跟上學校的腳步
融入日本中學的生活
只要是學校的活動全部都參加
犧牲一次不能回台灣的暑假了（擦淚）

 大塚婆婆說：
「每次都是台灣的阿嬤煮好料慶祝
這次換我來準備今年孫女的慶生料理吧！」
所以婆婆做了拿手的漢堡排套餐
只有那根奶油燒烤玉米是我做的
話說這個奶油燒烤玉米真的很簡單又美味
只要在玉蜀黍上面塗上一層醬油再放一塊奶油
包上鋁箔紙後入烤箱１８０度烤１５分鐘
保證香噴噴大家搶光光

 飯後的蛋糕是綜合水果鮮奶油口味
當季的水蜜桃、哈密瓜等水果放得滿滿的
女兒還得到了一登場就完賣的限定商品
天氣の子戒指項鍊和紅包
（日本的紅包不是紅色的）

 大塚姊姊開心地說：
「謝謝大家為我準備的生日晚餐＆禮物
但這次暑假沒回台灣有一點寂寞
所以媽媽妳要多煮一點台灣菜來吃喔！」

 是說我多煮一點台灣菜可以安慰妳
但誰來安慰我啊......","1571690826","/otsukaka/photos/pcb.1215210895327845/1214677882047813/?type=3&__tn__=HH-R&eid=ARB1qBfGbx2w5q5bzrYuCbmpvJiciTnxU3yAxc553U1JHO-askT5YLquz1pqtnaJFwTxENQnBgLcyhps&__xts__%5B0%5D=68.ARCi2gebZxsv5uVr989qfgySAFw542xejYcqSsVRBza3GpIH30oMFcSCWkSn1kvpVEefrIPRaPgWMBH5f4qT2TgJ9JF60xFBq8ywJosd2A4BSf1g1qmeTlK8IRNxoaApLpid9Qn0KSTZFqAQrWUQ8nXxOhLke5bnK5acdseA6EAI_9Q51ri22PHzV1frv98srKJ6jbto8bbs5Y6L45lis6jJ35Q2xQeJuZ2XEJ4RI1nYhuAHwPBliv6CdgWTl-ObG11yau5UbbmA8nNFlfZ86qoht3fpma0WsL8jO2jGNACjuR7ECJlME1hvOaH46kux03PpyawVK5WWokucQ45pyi-1rQ","https://scontent-cdg2-1.xx.fbcdn.net/v/t1.0-0/p350x350/68809567_1214677888714479_1511220196268834816_n.jpg?_nc_cat=109&_nc_oc=AQkNEVY0hCp-6nwNCEmy4GMoSfn0Iqa9K2ogCTwUMCAF1FfQgVg4pJjVCxW4GOSZx_I&_nc_ht=scontent-cdg2-1.xx&oh=d95be4e49b9d38cc3b16d85d86af296f&oe=5E224E25","undefined","6",""
"https://www.facebook.com/otsukaka/posts/1232594080256193","1567585456","昨天分享了帶去台灣的伴手禮
今天馬上就來整理從台灣帶回來的
有沒有一種～
想把整個台灣搬回日本的感覺（笑）

 在阿嬤家吃到妹妹朋友買的芋頭蛋糕後
覺得也該帶一個回去給留在日本的家人吃
沒想到一到台北火車站一樓與地下街
各種芋頭蛋糕都好吸引人
我們完全忽視賞味期限只有兩三天
一口氣買了三條不同口味的帶走
想說回東京的當天晚上吃一條
第二天和第三天再各吃一條剛剛好
結果～
我們家在第二天的下午就已把三條都吃光了

 其實以前我就說過
賞味期限這種東西在我們家從來都不是問題
我們只怕東西帶得不夠多
絕對不會有太多的煩惱（笑）

 還好有帶這些伴手禮回來
不然回到東京可能會沒人來迎接
進了門還會看到三張有怨念的臉
那才真正的可怕啊......","1571690826","/otsukaka/photos/pcb.1232594080256193/1232393143609620/?type=3&__tn__=HH-R&eid=ARDfr0JCxI5DYXGDgrgP0zygAjtugzuykVmfyTDUrAeXNR9iyQuxQ93Xh6RsA5dkG-erKUsvxZI9habX&__xts__%5B0%5D=68.ARDh01lanw-3IF9s936UUuLmbaVfFZv7lBY9wBzx2bmvi-bWARFf02ATaNDCKKLk-C44Jew00UEFKb2T3lv8G3JJRjSaVq3toVuoMAy9IXBIept7qL1nOANbMo5REsn0lyTcexED7sc9SD4aqyofrGCTscYMzQoEKzSgMbNbRhXtYXPvYTQ70C8EqWweq1IgGN5ElyHZ06RV_FRO9V7PpgMDuyvaezMsJrRc52_eel08i97oRU_y9UIsJXs3cEb9ZykAfKLnJ_ijmfdSOo8rqh5UdfquQeTgCUeSVBrZkUCnFPx4cJA6YHuE-JF7iBvc7nESAbvE2yTNLLwY6UNUbfH65w","https://scontent-ams4-1.xx.fbcdn.net/v/t1.0-0/p235x350/70119658_1232393153609619_9023031921533255680_n.jpg?_nc_cat=105&_nc_oc=AQmOLZtTA0Aq6w3WLpWUbLBfXaEtAw2NQP7IHQ5Jk8dzsOmLQ349nnYLCtS512x3TMg&_nc_ht=scontent-ams4-1.xx&oh=2d1eab160731e59c29e4ffa70f81d171&oe=5E5C9893","undefined","4",""
"https://www.facebook.com/otsukaka/posts/1136763426505926","1555831284","昨天清晨六點起來幫大塚姊姊做便當
接著就開始非常非常忙碌
好像打了一場世界大戰差點陣亡
但在打仗的過程中撿到了大甲的積木
是一件令人開心的事
只不過為了去撿這個大甲積木
我竟然在自家附近迷路讓人等了很久
事後大塚先生說話了：
「沒關係啦
反正妳也常常在自己的國家迷路
所以在日本迷路沒人會笑妳的
我們已經很習慣了......」
（這算是安慰嗎？）

 其實在迷路的過程中
讓我遇到一個在寧靜住宅區中的咖啡廳
這是一個小小的自家烘培手沖咖啡廳＋工廠
以前不經意經過時總是被它可愛的外觀吸引
但都沒有時間進去喝咖啡坐一坐
後來想要再去時就是想不起它在哪裏

 沒想到這次一邊迷路一邊讓我又找到了
所以我撿完大甲的積木再以原路迷路回來
終於喝到了這個一直想喝的咖啡
它的特色是香醇中帶著柔和的溫潤感
剛好在忙碌的假日中可以獲得一絲喘息的機會
請不要問我如何迷路回來的
如果我答得出來我就不是路痴了

 話說我是天生的路痴
從小就一直在迷路中求生存
光是這次回台灣和朋友在百貨公司餐廳吃飯
出去外面上個廁所都會迷路
然後在樓層中找了很久才回到原來的地方
朋友都還以為我跑去購物了

 請不要斥責一個路痴怎麼這麼白癡
因為我也解釋不出為什麼自己會這樣
不過後來看到我家老媽也這樣
我想應該是遺傳

 結果最可怕的是～
最近我發現大塚姊姊也是這樣
天啊！路痴真的很可怕
它。會。遺。傳。的。。。","1571690826","/otsukaka/photos/pcb.1136763426505926/1136750086507260/?type=3&__tn__=HH-R&eid=ARCB3BDQL6IISKjfdLSOTxA9vEVtCamul_4UKl910zAJV-ZZEshdbp25P1FFhFkihi8M-XRSm8VBJQ47&__xts__%5B0%5D=68.ARC97ApIF_BGH_chYE59zqfgxuJy6AQKC01II3m0VAudIDJ-RNv4DnVhkbLt9jHMFpXhKx-lN69TPb1ccSIk41KnbvoURE9p8EQPelmWoHCJrRE-YmGH0s7z8Mu5jS7e7Ch5il1VgNva1cdD39rOGBd_qLgcgGbd1jZjM0eneeo1pcSvGmr4askGx6lg4i2uHGxIywmI_BcGkkjLUrB3qTTZGSoVs9VCRNmf7tWEASSpUuTpowNZRpAWSCChezds3Hn6pAMrHbs19_wLz1NXuOEB4G7yr_14NLX4I7Oe-_MUTPAI69JSnzvNKmKQ0ku_FD3OD7t1O_Wt2cpAe92l4VztBg","https://scontent.fbjx1-1.fna.fbcdn.net/v/t1.0-0/p235x350/57543572_1136750093173926_7404828350528618496_n.jpg?_nc_cat=107&_nc_oc=AQmhQEdSSZ_agrOPOqWfcW2hde9cUMMTUNMjVr2o1rIOJK_yAeNHys0Vwz1vR4am5nc&_nc_ht=scontent.fbjx1-1.fna&oh=4501cb2d224164e58518824a2b3af374&oe=5E2C29AB","undefined","9",""
"https://www.facebook.com/otsukaka/posts/1182606488588286","1561454621","山藥泥麥飯是我來日本後愛上的食物之一
記得剛開始我常常叫大塚先生帶我去
門前仲町的一間老舖享用山藥泥定食
後來我們發現在淺草有一間傳統日式餐廳
他們竟然提供山藥泥麥飯+日式小菜吃到飽
從此我們就經常光顧這裡了

 藏了十幾年的私房餐廳
今天就把它介紹出來給大家吧
除了山藥泥特別濃厚綿密外
他們的玉子燒也很柔軟美味喔
詳細介紹文寫在這裏囉～
日本饕客才知道的淺草老舖「浅草むぎとろ」
https://nippon.hodaiweb.com/news/1499?lang=zh

 這篇是我的新專欄文章在
日本放題 Nippon Hodai

 以一個月一次的連載刊登
專門挖掘在地人才知道的私房餐廳＆穴場
請大家多多指教囉......","1571690827","/otsukaka/photos/pcb.1182606488588286/1182603625255239/?type=3&__tn__=HH-R&eid=ARChPrJCx1ehJDGyfwthNkUot5e2tQ8hEWOJj6cGy59ZNiiifQNFvnhXvJQRDqj99YoAfB0J0OZU22Jw&__xts__%5B0%5D=68.ARAVcMW1G33xRhVtur03HdQEGWnfgmw6ASGFPzfRcfBlIoltkKa4sr0DXZ4Qe4xuTdSPUh6OJ3Ds4AJeZ9FsFMPfg8ULvZpJzgGtVHEU3zp_xSxIIE72nJYwoG9s4Z0RIl7_8RQMFTJjWcjsK3rciMwdkHz392ctFcZN0coZacFaKdACwPoT8Rv10qgvIdAHAi3L5lYwcXQgL3ZpCOT9R07E_4vqTv-McBw-4CpRxa8SrnB9IKCInUpsAIFigBQN3E70n5nxqzZggH0zcejoZ4Y1h-c2g4b9xZfnjI_eQ51kaD9-LfX3Tp1dFScLOs4LZo0r8pz3aYzXJ7-GRWC3gGMZ5w","https://scontent.fiev4-1.fna.fbcdn.net/v/t1.0-0/p235x350/65433872_1182603628588572_1193009213224255488_n.jpg?_nc_cat=104&_nc_oc=AQlJrGGiTtGXENRumKAQtX7-Eahi9agRLK3rLiSW53QJ85TF6kXywx2YVSHz9rz9g9g&_nc_ht=scontent.fiev4-1.fna&oh=df98f69c0c41c50a9de559eb76822a36&oe=5E2A84EB","undefined","7",""
"https://www.facebook.com/otsukaka/posts/1138604522988483","1556095578","就在從台灣帶回來的伴手禮已經吃得差不多
大家覺得有點落寞空虛的時候

 這時讓放在冷凍庫裡的芋圓登場
再煮一鍋熱騰騰的燒仙草
最後撒上從台灣帶回來的堅果花生
大家又生氣勃勃了（笑）

 連不怎麼喜歡甜食的大塚先生也說：
「想起炎熱的夏天在九份吃到的芋圓
真令人懷念好想再次直奔九份看夕陽啊．．．」
大塚爺爺接著說：
「這句話才是我要說的
被你搶去了！！」

 這時大塚小姑從外面帶回來了草莓大福
於是一邊喝燒仙草一邊吃草莓大福
完全沒有違和感

 常常聽人們說現代人要有國際觀
昨天晚餐的主菜是台式炸排骨＆日式炸雞塊
這就是我們家的國際飲食觀（笑）......

 ＰＳ～
台式炸排骨用地瓜粉
日式炸雞塊用麵粉
醃料也不太一樣喔","1571690827","/otsukaka/photos/pcb.1138604522988483/1138598082989127/?type=3&__tn__=HH-R&eid=ARBHp8hSFjvbV4chn49JRDsczb7VAj3M8L42p_nSRICCiX8BEjrnvhRptgiS_3vlHua9FmOXyiaRXFst&__xts__%5B0%5D=68.ARD07VuceYq7NuKgiMck0WwNGl34aHua54a-8N2p1wOhZT7MRbJQwVbjsxo3B1pjiLCdQuNSkOhX2tAsf0n_TfxJ-24MdmVOBMvc0dRNAi8I57SLnZjewV8Ac_vQFJsYFb7HkuHPI8wIym_1ZzG9mBSjTmE4jr4CZIioH0OBIh5wyDu2IRrMRQ3Z0OYiGkMWWUor-uH7QxiUTviaXB1yjYK94ElJy_T70R3zsmfM8dpXtM9KAmAZJwIXolh9SmQkiMSJ58Faiw4MbGogHpF9QPQ2OarSTCNbS8wSG7aBMp1nbpL42pfIN61tbHSp3ONQ_JHLyQ8Wq-5h71SSk8mNwwbSjA","https://scontent.ffor8-1.fna.fbcdn.net/v/t1.0-0/p235x350/58379118_1138598086322460_8915481752848302080_n.jpg?_nc_cat=110&_nc_oc=AQnPQ2FHD4lDxrFW6T1sBnhWaW7LbqHI3pyoo-MzHMQa2mTYOPYW-8_UopeS8nROZyg&_nc_ht=scontent.ffor8-1.fna&oh=0462d0842a1436800a401cc992326444&oe=5E2CE910","undefined","7",""
"https://www.facebook.com/otsukaka/posts/1132317950283807","1555923600","上次在日本吃到肉圓一顆是680￥
一碗大腸麵線（大碗的）是1000￥
這次回台灣這兩樣絕對不會超過100NT
這就是異鄉解鄉愁的代價

 台灣美食實在太多了
就算我們回去盡量吃也吃不完
家裡附近的米粉湯、黑白切、酸辣湯餃
老妹幫我們買回來的各種台式小吃
網友們大力推薦的珍珠奶茶
還有朋友送我的行天宮排隊麻糬
都是我們回台灣的美好回憶

 不要問我已經回東京這麼久了
怎麼還在ＰＯ台灣的美食（笑）

 我想人們總說：
演員就怕入戲太深
曲終人散後久久不能脫身下戲
我覺得跟我現在的心境好貼切耶
已經回來東京兩個多星期了
滿腦子還是這些台灣的小吃美食
我怕我也入戲太深出不來了......","1571690827","/otsukaka/photos/pcb.1132317950283807/1132302020285400/?type=3&__tn__=HH-R&eid=ARBgP8Xv6S5shXpn5i6_f1Q1anewMuGDiL3-PNb2kFJTRHFf368nAhD9NObVWL_hZsCpCwOVc1BOXBgY&__xts__%5B0%5D=68.ARCpVwAwjIyJkQZ9i_z29SoOlBFp7VdohbTsaAQsaV5-iEd0d9o2DwcHa0cHplTjswxc2LqZDWODB2otuhaVMuAaD8P-ZdpPLebs36MWbyuVTm_sIcPRdTBrXkPjliRF-WWFO8rX3OyF0adeahl0SPBRnbQevjGrYslSpIC01XPP1Fa1B551yRaG2iRLj753FRawjc-pEVLw2JeFD39_LMla8l9g6mx_lZ_RgIfySIFt_aHmb16I0EtjSY__LiXK629xIYdOTL2iAlZXn8-rksxO-oigsn8Et1Uq5BL14jPbSaEL3I64CzQpEI_EeslNfdLB8Hj778lBmb_ZFISEonvIrg","https://scontent-lga3-1.xx.fbcdn.net/v/t1.0-0/p235x350/56938137_1132302026952066_2420696104065564672_n.jpg?_nc_cat=110&_nc_oc=AQmQWoyCAW4H3ibcELRhfgwicWHO7KAfvSl4iRhV5Ki2QtefQTmxfGh5S3vki7XOSyY&_nc_ht=scontent-lga3-1.xx&oh=a65d76fa8702e54ecda5859adcad0f36&oe=5E1D534D","undefined","8",""
"https://www.facebook.com/otsukaka/posts/1165950463587222","1559550085","喜歡野餐和日本水果的人
不妨來認識一下這個非常特別的咖啡廳
利用每個季節不同水果精心製作的夢幻下午茶
以席地而坐的野餐方式進行
我們去的時候是草莓季節
除了各種奢華豐盛的草莓甜點和點心外
竟然還有新鮮草莓吃到飽
每一顆鮮嫩飽滿的草莓任你拿
愛吃草莓的人來這裡一定賺到

 雖然現在草莓季節已過
咖啡廳提供的是以芒果為主角的下午茶
未來接著登場的水果會是什麼呢？
水蜜桃、葡萄、哈密瓜都好讓人期待

 建議有興趣的朋友們先放入口袋名單中
想要野餐和享用日本水果時就來這裡吧！

 寫了一篇體驗文在這裡囉～
https://www.tsunagujapan.com/zh-hant/fruit-picnic/

 PS~
目前不知道什麼原因休業中
有可能是伴隨著草莓季節結束的關係
希望能盡快恢復營業🙏
但既然上個月我們才去又寫了文章
大家就抱著餐廳也可以有這樣的野餐吃法看看吧😆","1571690828","https://l.facebook.com/l.php?u=https%3A%2F%2Fwww.tsunagujapan.com%2Fzh-hant%2Ffruit-picnic%2F&h=AT1iiaZxcJ7KN815rAcIz9xtOtj0MZmw56aNksghxaERmjnNy_Joxak0n9o29QKnY81fav7au1Sw0dbDH4EfTpNC9ApnmU7bjJ2THMbIPvLdLQ--eBUGjtwT2grTw4us72Vl3ehIS7czlIGMjsuSAh043t8QTKQv__mWggUAGKF79ERibdHYyq-CyFTBWmapmUUmxnM_2QzV0t6MUslwWXDXaKNBB39EPVmXK164kq-V_xnWmtcLfRHspsfA_lj3WHcdqysrnI7TfDbDpCeWr30WF4HcAJcsWlvg9Hj9rpfcolwS9MEymsaLtKfK69O1MH53ikfMlkh7sGs1CCSQYuxLUKqHpi-dAl0NC7OWDpWutDg33Zpc7hNUqFHbgPv2GRHron-Gx0QHu4n4DaILERPT4s8v-5coqQ950fbYWQ5J6qc50Svoxrd2m2K4ilmRmGccQIoP9EFHl14hQgDu86_skHV9mGb7w6ZkaXqFhcqHKZOVklQ72lLYlm7eSug3tMrJhP-7V4_KtKsbKNHNNlAwQQLCntH3_xBRjh-1E-X9eFTWZHx9n6hLJkIizkZMflbruQ6r_EJzqOzUS4KgV7KPuYRhA0k148F8ENzDm0FzPfjOm1-DCHa_lsDDL0sry1JWzyR8cfSGP7d2","https://external-sin6-1.xx.fbcdn.net/safe_image.php?d=AQBOHSXxOLHfZa0r&w=540&h=282&url=http%3A%2F%2Fd20aeo683mqd6t.cloudfront.net%2Fzh-hant%2Farticles%2Ftitle_images%2F000%2F038%2F999%2Fmedium%2FIMG_4897.JPG%3F2019&cfs=1&upscale=1&fallback=news_d_placeholder_publisher&_nc_hash=AQAnEDc3lpkECowI","Image may contain: food","【東京美食】都市中的夢幻野餐！草莓吃到飽＆英式三層下午茶＆精緻飲料！少女心爆發的Fruit Picnic！","在繁忙喧擾的城市裡，竟然有一個餐廳可以讓人席地而坐就地野餐，但野餐的內容卻是奢華豐盛的三層英式下午茶！除了有多種採用當季水果製作而成的美味可口甜點輕食外，還附上新鮮草莓吃到飽，連無限續杯的飲料都別有用..."
"https://www.facebook.com/otsukaka/posts/1127383474110588","1554541246","我們已經回到東京了
最後以鼎泰豐、夜市和阿嬤的菜
為這次回台之旅畫下句點

 走在機場裡面又是一個淚水在眼眶打轉
但心中已準備好該回去面對一切的時刻
雖然這樣的情節已經上演過無數次了
然而每次的惆悵與落寞卻從沒減少過

 當飛機降落後走入東京街頭
吹在臉上的是預期中的涼意
映入眼簾的也是預期中的冷面孔
但在心裡深處我知道
永遠會有一個熱情的地方等著我
他的名字叫台灣......","1571690828","/otsukaka/photos/pcb.1127383474110588/1127373247444944/?type=3&__tn__=HH-R&eid=ARCEBUf4flCo9IExNKXKt6hMmvbW1o90NcWROBCBqaOb7u3iBmR7rifFNl5NWrplo56ktw2H98ZSZINS&__xts__%5B0%5D=68.ARBEEwgxOxXl6oTDpYCenOlDGvCMc8e2JJgldJhTnoOGYYQ7K2kjA-Xa-IJZiyTrTB0NScegJzkOVNhLSAiah3LOsHqSYntSxulBK2PHcZZyMzt9NyERfTPd6c0bP9RiofMdnzncfREbK6YV_I1suPQ_7xRcYrIGaEnS2LgIyi7G-tDDhze4o0VjQRcfDV2HNwEKUMccpYqE199m5Rfdtj46WNmiOVkMkRp_5cMP9BFMFPfkLUFFQcJXIhC2gAfi0gZVcWrMI8ErwNRqRyReBp3AZYDYiteLoQ5U27fqbxpxd0Y6yV6CCYN0ZctwVwEv75K7zWr4y3rYLjy7XA2Q98d3rw","https://scontent-lga3-1.xx.fbcdn.net/v/t1.0-0/p526x296/56474551_1127373250778277_9197364098617049088_n.jpg?_nc_cat=111&_nc_oc=AQm7HLCw4mChBcBrxS7VDKUhXiSBccffvAW83tMuIYjVmqdP9Ulhh0KPTPSM8lHKWic&_nc_ht=scontent-lga3-1.xx&oh=244c375f0532b88e3bcfb14c649146f0&oe=5E588CFF","undefined","8",""
"https://www.facebook.com/otsukaka/posts/1207097759472492","1559271600","「神奈川必吃話題甜點」part 3

 ＊觀音coffee（鐮倉市）
鎌倉大佛是來鎌倉必訪的代表性景點
參觀完大佛後不妨來觀音coffee休憩一下
這裡也有大佛！
是美味又可愛的大佛餅乾
不論是讓大佛在可麗餅上「坐鎮」
或是搭配咖啡一起品嘗皆是不錯的選擇
除了咖啡之外店裡也提供許多其他的飲品
另外他們的司康＆各式甜點都很有魅力喔
https://kannon-coffee-kamakura.business.site/

 ＰＳ～
最後三張照片是我家阿公多年前照的
最近幾年他照相進步神速
我放了一些他的近作在我的ＩＧ裡
https://www.instagram.com/otsukatokyo/
相信看了會佩服阿公的學習精神

 「神奈川必吃話題甜點」ＰＡＲＴ１請看這裡～
https://www.facebook.com/otsukaka/posts/1202302746618660
「神奈川必吃話題甜點」ＰＡＲＴ２請看這裡～
https://www.facebook.com/otsukaka/posts/1204948833020718

 適合親子一起同樂的景點介紹寫在這裡：
「神奈川一~二日輕旅行」Part 1～
https://www.facebook.com/otsukaka/posts/1199317436917191
「神奈川一~二日輕旅行」Part 2～
https://www.facebook.com/otsukaka/posts/1200747666774168

 以上推薦給在旅途中想要收集美好回憶的旅人們......","1571690828","/otsukaka/photos/pcb.1207097759472492/1206968379485430/?type=3&__tn__=HH-R&eid=ARDg83sQCXS8XOQH14jVBfN4mkk2jpMvfZJlM8ONechkU-ffwrRCw4wZfeOIfWXqqXRWiyq5CSGghNBL&__xts__%5B0%5D=68.ARA6CzqHLC3ZiI-LCC0pzvlm_IImDpqTRw_8jU7TwzrMhGRUUYsIUhfhvJltyvKHyCA81bZZM-b1iU2H1JnmxzyTBzbRz8taUlO1VfKb76m3Tmg_17QNnfMSQ6HEI2vg8Dtb7jZRhcmqudo1L-TUyx0nEacEZpb1JpT118i4LVVzb_L_18zWIJoxuQ9flyYYxA0Lb4O4XYL0MzyD9NmdIBpZnDSC9XNFSU0ckOXMFHXeNPwSZ4mv15wojEUFsonU9Nhdh3kgjaZKInW35JkchQVmv0RKZO7_kX-iH85Rea4XplIY76ac6p6tjEqQig1NPBIdid4KN6hsAB7xIUiYKaPrKQ","https://scontent-hkg3-1.xx.fbcdn.net/v/t1.0-0/s261x260/67431535_1206968386152096_7620144698983710720_n.jpg?_nc_cat=104&_nc_oc=AQlaLgx_jCWmj4K7c_tmMVO9m6x89pARS72ktohMIJ03G4QPha5LyDgOPNn5ssNbcU8&_nc_ht=scontent-hkg3-1.xx&oh=79a8d1609d59b41a524ffe90165e7b2b&oe=5E2BC23F","undefined","4",""
