url,posttime,text,crawled_time,attachment_link,attachment_img,attachment_img_alt,attachment_title,attachment_brief
"https://www.facebook.com/otsukaka/posts/1266598320189102","1571214859","媽媽不是三頭六臂
媽媽也不用當超人
但如果每一天可以花一點時間
做一樣便當菜色冷凍起來
那麼累積起來也是可以很出色驚人的
到時大家就自然會覺得我們是超人
或是有三頭六臂了！

 我們所需要的只是一本書
『日本常備菜教主「日日速配。冷便當」191道』
來教我們如何做出～日日速配。冷便當
由日本常備菜教主松本有美著作
她也是瘋迷日本ＴＶ的冷凍達人

 這本書最吸引我的地方是：
不需要每天早起做便當
而是將“小份量的冷凍常備菜”裝進便當，
早上只需要短短的時間就能完成

 其實當這本書在日本書局出現的時候
我就已經開始注意它了
當我看到這本書的第一眼腦海裡所想的是：
每天可以再多睡半小時真好！！

 所以我覺得應該也有很多人會需要
而且裡面不只只有食譜和做法而已
還有很多有關冷凍的知識和小技巧
另外也教導我們日本便當的裝飾和配置方式喔

 本書六大特色：
＊小份量冷凍法，裝進便當超輕鬆！
＊10分鐘完成！
＊便當不變質
＊顏色豐富的蔬菜搭配
＊可以捏起來的菜色！
＊ 冷凍保存期達3週

 更多書訊請看～
https://reurl.cc/xD9l9z 

 很開心這裡有兩本書要送給大家
參加辦法：
１．本文按讚並公開分享
２．留言書名或想說的話
３．請至出版社的粉絲專按讚：
大境文化&出版菊文化(生活美食地圖)
https://www.facebook.com/tkbook/
４．抽出兩位得獎人，一人一本
５．寄書住址僅限台灣地區
６．活動至１０月２３日晚上１２：００截止

 歡迎大家踴躍參加......

 大境文化&出版菊文化(生活美食地圖)","1571690806","/otsukaka/photos/pcb.1266598320189102/1266572823524985/?type=3&__tn__=HH-R&eid=ARBzuHGnOXSHBTufLozFfwBwV6CSh1OLtZCdE5aZTMLI5K5ryXeRtvYtFMmhB945MNXRHNMyVGWK6afh&__xts__%5B0%5D=68.ARCLLVbSifxJhRNrq1-V2aRbV5rfz3xEiuVHcm939g7vy1fyH4PI3PbdcQJ69WdTcp0sgvWBQRR4OpGnFN0kZ_sjurK0fG0SJbSiGJnnNlY632df3qcGLYWEBtKAr3d6zKatGGuymvoNucPZ_7-2q5oDCKlV0EeBKRYKNf2jq0yNUgW0kS-dASuPbzI4fdzdudm0t0MIiQJkXamxRO8oyvIO2WPgkzdLPc5ceq1qRisQrebkJVGJgSbx6wdHNZUVXL8zRBvQT1LZhj9tjkEJre_jLJpvmUGzQVpzfAcULWj-I6yvV-s0V-QXnT_MYCXo1sn4TptM2uSBUXmHNsoG6zU9WA","https://scontent-sin2-2.xx.fbcdn.net/v/t1.0-0/p350x350/72805339_1266572830191651_5056475863848058880_n.jpg?_nc_cat=109&_nc_oc=AQn0j-b-F6K1OjFdK1drnlEXrEevrJBIT5wOgh8PLexqvKoHJPCeo_gBrY_8bylZwD0&_nc_ht=scontent-sin2-2.xx&oh=f6354278cb5dd30cd2ee157724c450e3&oe=5E1AAB1C","undefined","3","大塚太太東京在住中AuthorSend Message"
"https://www.facebook.com/otsukaka/posts/1271570396358561","1571645396","#一人旅
#DESIGN_LINK 
#daimarushinsaibashi

 這是我首次挑戰東京大阪當日來回一人旅
為的是去親眼看一看機會難得的
OSAKAｘMILANO DESIGN LINK２０１９

 每年四月吸引世界各地無數人前往米蘭參觀的藝術祭
第一次於今年10.12～11.4在大阪心齋橋也登場了
並與日本企業和各地藝術家合作增加更多精采度
讓本來與米蘭締結為姊妹市的大阪
也染上了一股濃厚的義大利人文藝術風情
與當地日本文化擦出意想不到的華麗火花

 以前大學時代接觸世界藝術史時
就已經深深受到義大利文藝復興的吸引
那種在古典中復甦再創新的動力與初心
可說是藝術最純粹與原始的熱情&生命力
所以當我知道我的任務是～
去感受與收集這次展覽的藝術品時
就算是一大早坐新幹線去大阪當天來回
我也甘之如飴、興奮不已！！

 位於心齋橋的大丸百貨本館是主場
今年９月２０日重新整修開幕的本館非常不一樣
在一樓可以拿到和這次展覽相關的詳細資料
全部共23個藝術品當中有11個分散在各個樓層裡
其中有六個是今年4月在米蘭獲得極高評價的作品

 我最喜歡的是掛在牆上會動的影音畫作
名字叫做「Anotherview」
在一成不變的生活中為我們開了一個視窗
可以看到某個沙灘上樹蔭搖曳與悠哉玩水的景象
或是歐洲某個城市的一角人們走動的模樣
不禁有一種自己也在裡面的錯覺
可以從平凡的生活中抽離一下
（拍了一個影片放在留言裡喔）

 一樓的櫥窗裡有四個作品
是由兩位世界知名的義大利藝術家
特別為這次展覽創作出來的
可以看到他們受到大阪的激盪而融合許多日本元素

 五樓有一個今年四月在米蘭展裡的日本代表作品
竟然是用mt膠帶設計成的餐桌
讓我重新認識這個由日本出發再傳到世界各地
如今廣受大家歡迎的mt膠帶

 欣賞完大丸百貨裡的藝術作品後
可以到地下街去享用美食和購買伴手禮
新開幕的本館裡有許多話題人氣甜點非常吸引人
再喝一杯義大利的定番酒精飲料Aperol就更完美了！

 另外在心齋橋周圍還有12個藝術品等著大家去尋找
其中最令我印象深刻的是在附近三津寺裡的作品
沒想到藝術與廟宇的結合也沒有什麼違和感
這些藝術品好像住進了寺廟裡一樣
給了我一種全新的感受

 這個非常特別的活動會一直持續到11月4日
如果這段時間你也在大阪的話
不妨跟我一樣也來與OSAKAｘMILANO相遇吧

 尋訪完藝術展我慢慢走在本町、心齋橋和道頓崛一帶
吃了淡路島和牛漢堡排
還去排了一個小時吃到我最想吃的人氣絕品拉麵
買了大塚一家指定的各種伴手禮
此時身體有點疲累但心中是超級滿足的
（美食照片還在整理中）

 以上是我花了五個小時來回收集到的
OSAKAｘMILANO DESIGN LINK２０１９
在這裡跟大家分享囉～～～
感覺我再多花１～２個小時的話
可以挑戰東京台北當天來回耶（笑）......

 ＊在留言區有放來自米蘭展中的高評價作品喔～

 大丸心斎橋店 Daimaru Shinsaibashi
https://www.instagram.com/daimarushinsaibashi/

 Fuorisalone
https://www.instagram.com/fuorisalone/","1571690806","/otsukaka/photos/pcb.1271570396358561/1271523613029906/?type=3&__tn__=HH-R&eid=ARCDLxbNjc0T1SanxUCK2vw-nO19Bq5c-Zp2d71RpFV7rJC5kRvA773GoSS4GJvFF-TMf1iMylmxxTH5&__xts__%5B0%5D=68.ARDRoaQ45gxEYr5OAAYYI0CmsLmQFQ5dpT20xJWCJKz7d9siPwhMIDxCUAAvHXsg-5KzCiybya-fj8ceCYESOBcNmZ_9bFMGVCXa0rE8fy5zxr4Y0_0WsBKQm0RXYcyvb97XoQAJ7TGc_n9IE7M9F5do1sKTDH5UBDgMYVy_jS19YzH5IacKIlg5U-D8R8v0iPdDyOA8IMyTP-D2PuxWtZvPXrpNKG72RRSUK2B7ISa8LocSkNwp9yvNsMpFFWraG6mIDYdQb9cVjlwqlT_D44mScnnutps8Z3AftR4Zbgyd6ZEe4fJfGGnvqFS7c0lY4BKR3ZtpLWnAT1XjzP-ItmEjyA","https://scontent-sin6-2.xx.fbcdn.net/v/t1.0-0/p235x350/74397284_1271523616363239_3771478574381400064_n.jpg?_nc_cat=105&_nc_oc=AQnHr_U83xPNyVbXWn7FyLyQArUTtqEj0b35yalxDC1Zwz0TWy_J9_SoxwwnMPdbKRU&_nc_ht=scontent-sin6-2.xx&oh=c192428f95b4515ce51e65ad74a7dde7&oe=5E2483F3","undefined","13","大塚太太東京在住中AuthorSend Message"
"https://www.facebook.com/otsukaka/posts/748660738649532","[Error]: TypeError: Cannot read property 'attribs' of undefined","",1579428002,undefined,undefined,undefined,undefined,undefined
"https://www.facebook.com/otsukaka/posts/1265143540334580","1571042662","今天是日本的體育節我們又放假了
已經連放了三天（其中有一天半在躲颱風）

 在假日的早晨最適合做一份美美的高顏值吐司
讓自己與家人在美味的幸福中起床

 寫了一篇文章把我們家最近做的高顏值吐司
通通收集起來跟大家分享
文章中還出現了一款我們愛吃的人氣高級吐司
吐司控的朋友們請趕快看過來囉～
https://www.japaholic.com/tw/article/748525/","1571690806","https://l.facebook.com/l.php?u=https%3A%2F%2Fwww.japaholic.com%2Ftw%2Farticle%2F748525%2F&h=AT34b5qhV4zkYSz5DpKFgwQCh32SNXo69FuuyHt_DDFGBABweyYxa8wHUKwWKzlvdFJbclqX-i_t1jvGh5EHGt42fUd4CKzl7nd4xguym1IcC6KrHpfPNy9esSEXM65o2BxNdeNeyDbW-wcOjPzCZh3Yjtbw_lHfw5P-OOQAip7QvUQLvxRM5XxVWVa00OKQenvb6cE-rVwUumFEI5gpIj5qGNFnrnYCuf6XDOwhSKP8rBJR2Hz0p8YmnmGoXj7LI-rXiNMUXOThfX5HNTXsXvTQtqQD5-LqWhziiep9tN-sjbj7iXWs_8tv-u1ui2m66s06JVnJlEhydOLcoE4qQ6jXCvlLCZJ9lx-61p9ybnYgQRlJCYI-pVqJEDu1R2GZ3vjGJOfl54tQFWRc2LzEiXpVqV1nnbXhQRoh1T1bEwUNF0g-iw3AAEo_sqajA_-Pl7nE23nm28W5g45bN3rx2eJSzzmAU3NVw4bWpUjPIb_Xlgz50DHhRmevkMcVrqEnW9WO0Dj_02ueHJt-gIt7QpwtVeZRZAnoiZUYMZpf1mR7erBNxFsvjSRG1ADKpR7BiiXrdKrRG-c9aqbGX3spngST5gVgYClna0FHSRC6JYIkfbvYTWPiGEynrs3oWLKTEF0a4XTgGheY7XuC","https://external-hkg3-1.xx.fbcdn.net/safe_image.php?d=AQBIFvUtiYLyhrI2&w=540&h=282&url=https%3A%2F%2Fimage.japaholic.com%2Farticle%2Fimages%2F2019%2F09%2F1-13-1.jpg&cfs=1&upscale=1&fallback=news_d_placeholder_publisher&_nc_hash=AQC3J4met9YgxyQt","Image may contain: table, dessert and food","日本人氣食譜分享 讓你每天在幸福中起床的高顏值吐司！ | Japaholic","對於日本家庭主婦來說，一天中最喜歡的時間就是把先生和小孩送去上班上學後，可以享受片刻寧靜的早餐時光。無論簡單也好繁雜也好，都做自己喜歡吃的，把自己餵得飽飽的，元氣十足後就可以開始一天的奮鬥。近來在日本..."
"https://www.facebook.com/otsukaka/posts/1261693814012886","1570696328","台灣連續四天放假來日本旅行的人應該不少吧
剛好寫了一篇日本必買伴手禮介紹
一直以為我們家愛吃的長崎蛋糕福砂屋
已經是最好吃了！！
沒想到對於長崎當地人來說只是第三名而已
那前兩名到底是何方神聖呢？

 請看我寫的這篇：
必買伴手禮！最受當地人歡迎的長崎蛋糕TOP3～
https://www.tsunagujapan.com/zh-hant/japan-castella-top-3/

 一聽說強大颱風要來
這幾天我們家忙著準備採購食物以防萬一
但大塚爺爺帶回來的大多都是零食
這位會長可能是要藉此機會招開零食會的高峰會議
參加的人雖然只有三人（會長、副會長和秘書）

 提醒這個周末在日本旅遊的朋友們千萬要小心啊......","1571690807","https://l.facebook.com/l.php?u=https%3A%2F%2Fwww.tsunagujapan.com%2Fzh-hant%2Fjapan-castella-top-3%2F&h=AT094CRFQn0ZDxQGFkmp2SHgWUKTFRhKWsACA0bkQjdrNB-dehxt6bXvD423nvvPW9ePPhhaTZ3oq95Mf6YXx1WXgUxR6xdysCh5SB9Wxiv_Mu9pjpMiJMdL9g_G4qquqQR65KPMM8t4rwYRxnkPpqruSV6R3xJD59t0ipI6kI5WDk6tiRHHep_G8l-oQpW09qCct1EKJISUuX7EUP9QRJIO_ubzMTr5RtFbj8prSOyOphd2PfbJU6llaMUf6qhXyLZ9eftzCUTlpQdR5i_kHg1DCGcvAn5fsXN-SZ-1DJgWjaMZdJAcRX_XiGYn52kfSXXGhHw9GW-YhSK9E8RPLKyoQjb8KdRrn4Jln74eI3pqPcZlYxhK_JXeeur5WSCfM-yjS5lUfuR24IovXNNJ34YN6YSnKlC1utGGd22XrO2zHVNlo1xpSnD4_h_H-33TM6A-onJubF1g_sl8GOIO9tCN_cI1k5ZoFIseWg8XxMXvTsRgNte52s6ISRTh2sdla5o2rRpEoN6KbPvQK1f15xJC8b2toqu9GUWblENwa21Nri6irIIfvhlbKSOTgrauPCcvud2IV5k6CYaagSWLdUuSwiw9m_-8n22wtIOWiXHMNJFUocagDG4Foi8sn_9n4ijFrzWdipP7e4wY","https://external-sin2-2.xx.fbcdn.net/safe_image.php?d=AQA4gmXi0xEZBkxa&w=540&h=282&url=http%3A%2F%2Fd20aeo683mqd6t.cloudfront.net%2Fzh-hant%2Farticles%2Ftitle_images%2F000%2F039%2F380%2Fmedium%2F1.1.jpg%3F2019&cfs=1&upscale=1&fallback=news_d_placeholder_publisher&_nc_hash=AQAzPzChTdMw5lql","No photo description available.","【長崎購物】必買伴手禮！最受當地人歡迎的長崎蛋糕TOP3","長崎蛋糕是伊比利半島的一種傳統糕點，十六世紀正當大航海時代葡萄牙和西班牙等強國、貿易商、傳教士紛紛到東方叩關時而傳進了日本長崎一帶，後來成為當地的代表甜點。經過五百多年的烘焙改良與演進，漸漸由皇室貢品..."
"https://www.facebook.com/otsukaka/posts/1253053258210275","1570092006","日系質感家電之富士山手沖快煮壺
這是一款很多人詢問的高顏值快煮壺
這次為了捷足先登搶貨源
所以用限定數量+預購的方式來進行
現貨售完後則會轉入預購

 有一次想說該為台灣的爸媽買一個新的快煮壺時
我第一個就想到它
老爸老媽節儉成性捨不得為自己花錢
也從不會跟我們要什麼
能替他們做主買一些有質感的好東西
只有身為兒女的我們了

 當初會被這款快煮壺吸引是因為它美麗的外觀
由ONE amadana邀請日本多位設計師跨界合作
打造出都會簡約品味生活美學風格
卻有著極美體貼的高質感設計
它的名字叫做「富士山手沖快煮壺」

 外型設計以日本富士山為主要概念
柔順時尚的壺身曲線
山巔倒影的壺蓋把手
舒適安穩的柔軟握把
洗鍊乾淨的純白烤漆
各個細節都顧得好好的
完美體現日本傳統美學工藝
擺在家裡的各個角落都很優雅美麗

 很喜歡它的流線型的鶴嘴壺口設計
穩定的注水量和速度讓沖泡咖啡或茶更加專業
不僅提升了美味度也營造出不少生活品味度
讓每天沖泡時間增添了不少文青風雅

 另外 ~
溫潤手感的止滑把手可以穩穩地拿住
800毫升的容量非常適合單身或小家庭
加熱速度快不到4分鐘就能煮沸
如果只沖一杯咖啡的水量更快
單鍵操作輕輕一按非常方便
英國製自動控溫系統可自動斷電防止空燒
壺身鐵製材質與一般耐熱塑膠非常不一樣

 後來連我家婆婆看到我買給自家爸媽時
驚呼：這麼美這麼有質感而且還是鐵製的
「我 也 要 一 個 ！ 」

 在這裡也一併推薦給～
喜歡 職人 X 質感、追求生活美學的人......

 團購連結：
https://bit.ly/2keqhPq

 團購時間：10/3-10/9
預計出貨：團購結束後陸續出貨
台灣本島免運費
本團與ama亞馬遜環球行銷合作
客服專線：04-35063939","1571690807","/otsukaka/photos/pcb.1253053258210275/1253028421546092/?type=3&__tn__=HH-R&eid=ARC-2p1taTOyLZGfiBrOGUtGiZZZk5FxAj7DP-GHCNbyC5OL-5SSrq5lkaI1T0C5ODxpU-AMTMqb3gpX&__xts__%5B0%5D=68.ARCHf4UNHyYBT5-b7gf5jbScaFZ_wbACy-f7h9dR6YUnhJrYw95dC5e4moL3bIfkSh9hPL4FGGcoc2jsNAd7q215kKdP8MyJ75u5GdfFd97YDbMZ88dcE3Kz0LoE3hcdac5qHYBxn0Yf5pYTbvd-3a7m12dxy_5L4_BKwcqI3DQkiTowuuZH_3O3ptOJIjWyDgh9uSXjvnHDI6O6n4RQojyXJANLQEhj4wGGcgGG2gUcnRRLOb671DzPS3m3u4Se2uiedsfHNbgezmdXIo9sMxjaAqe2rERy2ug9fA5-V-jQc3lR445D3k_XLrBhp--er_VJafWouXqSZPwHPaohePSJkw","https://scontent.fcgk4-3.fna.fbcdn.net/v/t1.0-0/p235x350/69710442_1253028428212758_4018302102840279040_n.jpg?_nc_cat=108&_nc_oc=AQmgtj78yI1c9A2qdYs2yJgSszYkQ_BCp2aSs-_9ubGR4ZXMHUEuNinAUmyr6CyT1ak&_nc_ht=scontent.fcgk4-3.fna&oh=c0304618dc116f04a77eab13dbd6a217&oe=5E1B7CEE","undefined","7","大塚太太東京在住中PengarangKirim Pesan"
"https://www.facebook.com/otsukaka/posts/1233336406848627","1567672350","從讀大學的時候我就很喜歡逛家具店
不知為何每次看到各種和居家生活相關的東西
就會有一種被療癒的幸福感
可能是這樣所以現在很甘願在家做家事（笑）

 另外我也喜歡看介紹生活雜貨的雜誌和電視節目
有一次在一個外國節目裡看到一種暖燭燈
它靜謐微黃的燈光不僅將四周的氛圍溫暖起來
最令我驚豔的是放在下面的蠟燭竟然不用點火
就能夠慢慢融化而散發出它擁有的香氣

 於是我也入手了一個暖燭燈
好幾個讀書的夜晚
想獨自一個人享受放鬆心情的片刻
傷心時想轉換氣氛、歡樂時想點綴愉悅
睡不著時想舒緩心靈
慌張時想鎮定心情等等都有它的陪伴
在這種敏感又感性的時刻真實地感受到有它真好
所以也想建議給大家試試看

 我相信日常生活中除了基本的柴米油鹽醬醋茶之外
還有一些提升生活品質的療癒聖品
也是現在人所熱衷用來滿足安慰我們的五感
其中香氣與嗅覺也是重要的一環
就像看一場電影、觀賞一幅畫
聽一場美妙的音樂一樣
聞到自己喜愛的味道也會感到療癒
會直接觸動我們的情緒與心靈的

 在這裡跟大家分享洛杉磯的P.F. Candle
以及加州來的D.L.& Co Candle
這兩家手工香氛蠟燭都有很美好的香氣
能夠自然溫和飄散在空氣中增加愉悅的生活樂趣
既然要用就要用天然無害的才不會本末倒置

 這次在機場免稅店有看到我正在用的這款暖燭燈
當場就很想飛奔回家被香氣治癒舒緩一下

 很高興現在有一個限時優惠團購
推薦給想被各種療癒香氣包圍
接觸天然材質、安心享受香氛世界的朋友們～
P.F. Candle、D.L.& Co Candle香氛蠟燭、暖燭燈
開團網址： https://gbf.tw/avqal

 開團時間：９月５日～９月１２日
商品統一於2019/09/17(二) 依照訂單付款順序出貨
如有任何訂購或產品疑問
(1)請於週一到週五 上班時間09:30~18:00撥打(02)2351-5020 或 
(2)來信至客服信箱service@cityspace.com.tw

 我的使用心得和詳細產品介紹寫在這裡～
http://otsukaka.pixnet.net/blog/post/404134757","1571690807","/otsukaka/photos/pcb.1233336406848627/1233168973532037/?type=3&__tn__=HH-R&eid=ARAA6GD8FOy3Jr5m3HJva7PLYBYT9n0Saa1c47jgW8i8iluPZOJftdbm3zN45t8qBU4O1bNKidVBPbpg&__xts__%5B0%5D=68.ARDYpRfuTMg-XqmOpfg6B0VUiWDlzRSoiwvpQrSxbvKXYXHkuvsP34b5mYItt_u9d18Ecd-FV0mn_BVIl5AzL73RYn4c0M1YaMf-IBD020UKi6G8eNxugSmALK3v2XybHhXkILTfp7BYh1G5VoDZ77DVyqW6I8ZxieTqApQTzUYK4G0KwTy7g1w_uv9HLWOA4jU4fcWVMJmcOG_hauvUvjiQw0em-gJ9FNeyuTLeG1C3UR035BLzzbuUJdKjPgvfUTcPot7o6gorcsDtTjzzWFoPxwbGTdkJZiYTVnhLvoYDIsSoXu3-mRL1iy2h9J9LTympqpDZR5cJBoif_K2_mHe_TQ","https://scontent.fcgk13-1.fna.fbcdn.net/v/t1.0-0/p235x350/69690062_1233168980198703_530960598914039808_n.jpg?_nc_cat=111&_nc_oc=AQlLY3kkbn41P5FtWrE0cl0HiMWx4Gk-Zi4Z9KZQe27XvTAp8v31W8G9UuSnZ5HLaI8&_nc_ht=scontent.fcgk13-1.fna&oh=5ea83c46cdb265f8ae7b24f8c82c5e13&oe=5E26819B","undefined","7",""
"https://www.facebook.com/otsukaka/posts/1204290436419891","1564133732","我問：
「這條蜈蚣要做多久啊？」

 谷口職人回答至少要三個月
因為身體的每一個部分都是用銅片慢慢打造的
為了營造出栩栩如生的模樣
每一節身體和腳都跟真的一樣結構重現

 我又繼續問：
「每天做不會厭倦嗎？」

 谷口職人說：
「和極限挑戰是我們的天命
如果中間放棄的話就什麼都沒有了
當感到疲累的時候我會轉移注意力去做別的
但最後還是克制不住自己想回來把它完成
我想這就是所謂職人的情熱吧
一旦沸騰起來誰也阻擋不了的！」
聽到這裡我的心也跟著沸騰起來了

 谷口職人的作品大多是以昆蟲為主
當他每完成一件樣本時會找昆蟲專家來指正一番
在經過無數次的批評與冷嘲熱諷後
他才敢把最後的作品拿出來
所以他做的銅片昆蟲們連腳上的毛都不會馬虎的

 明天是日本傳統工藝活動的最後一天了
藉著這個難得的機會來參觀各種工藝技術
或是和現場職人們學習體驗活動都很不錯的

 回來整理照片時發現有好多都還沒分享
用獨家日式高湯煎玉子燒來吃
只要200日幣就可以試穿和服照相留念
用高野豆腐竟可以雕刻惠比壽大黑神
最後兩張照片是為了２０２０年東京奧運
所設計出來的宴會料理真讓人大開眼界

 以上是我為這次活動所做的最後一篇報導
如果能引起大家對日本傳統工藝一點興趣的話
我就非常開心了
感謝大家這幾天的陪伴
還沒看之前報導的朋友們可以往前爬文補看喔

 我想這些傳統工藝和默默努力的職人們
是需要大家支持才能繼續綻放美麗的花朵
而世界有他們的點綴也才會更精彩有趣......

 ものづくり・匠の技の祭典2019","1571690807","/otsukaka/photos/pcb.1204290436419891/1203718039810464/?type=3&__tn__=HH-R&eid=ARAD4wvpi9yddqtrZuEgHj8MDGL1XyLfmLRfnrEMIRxg1sUXYXCMxm1_rRDjj4Ic9n7Uk_A3o9FUMnjp&__xts__%5B0%5D=68.ARCrYsu5Kfk5aTQc8fhpE36S4sc7CHfuP4HY16KR9MAPWEH6fh634BUmNp7axVcebXwYd6kdQbp9F57N8sIqmz_hQyRVMiO68wUJZTINZjbR00wgSxNb43iGHBZlk2Z4wnV65ErTF_m-WirBduyrRamNjxgvOHS25uN1gHFk5JXy88VN1E9vUiHYZu-MPB18If2lFkv-y0ReaBQUKuS6EMcnCf4ic3uylbZq1YTLgyDNhz1Dsd2WmF9RY3Xe8w3BZlIbN1-EcUfnQe19joI8edAlN1J7q6XQ61ssBtcVYyQF4ATqlIlks-2q5kCB4d405izCZdFN1vr1MBx1KuEOTGRstA","https://scontent.fcgk18-1.fna.fbcdn.net/v/t1.0-0/p350x350/67281182_1203718046477130_8414048706201911296_n.jpg?_nc_cat=105&_nc_oc=AQlkp2kQ98BTJhnEfjrk3nueA1Kxc1jaIoBU7HZlF1JgR5vctVpgrjrpOykrNN0VN6A&_nc_ht=scontent.fcgk18-1.fna&oh=29707481b1c73e22ad58cd7b8154af3d&oe=5E1D6B3A","undefined","11",""
"https://www.facebook.com/otsukaka/posts/1264034667112134","1570938141","颱風過了我們一家都沒事喔～～～
昨天意外地一夜好眠沒有太大的風雨
本來看到新聞報導和收到避難指示心情亂糟糟
但在美食的療癒下吃貨一家的我們
就算是關在家裡也不會委屈自己的胃的

 昨天下午因為不能出門全家待在家裡
吃過泡麵鍋後小姑提議不如來手做一些
平日想做卻沒有時間做的麵包和義大利麵
於是從零開始和麵粉、擀麵糰、製作醬料
竟然做成了麵包店裡的人氣鹽味奶油麵包捲
還有連麵皮都自己擀成的包餡義大利麵
這種Ravioli包餡義大利麵還要做兩種餡料
一個是內餡的番茄肉醬
一個是淋在外面的奶油白醬
一整個下午都在料理烘培中度過

 為了搭配小姑的美味手做麵包
我也做了一鍋香噴噴的AHIJO
用麵包沾蒜味起司番茄章魚橄欖油非常過癮

 廚房裡一直飄出撩人的味道
讓關在家裡的我們減輕了許多不安的情緒

 結果我們家颱風天的晚餐
弄得好像出去外面餐廳吃的一樣
第二天早餐用剩下來的麵包做火腿蛋夾心
再喝一杯咖啡迎接颱風過後的大晴天真不錯
連午餐也可以是一個豐盛的洋食定食
吃過午餐後就要帶小鬼們出去放風了

 這就是我們吃貨一家過颱風天的方式
千萬別問我麵包和義大利麵的做法
因為我大部分的時間在寫文章
就是昨天那篇便祕的文章（笑）......","1571690807","/otsukaka/photos/pcb.1264034667112134/1264017610447173/?type=3&__tn__=HH-R&eid=ARDFor1IozF3jcoHPEatEo9X5u6StsxfmbTgDvHvArmYhUXHjwtkUGRjOL2aX70uRH83hd1dFBnDiYWb&__xts__%5B0%5D=68.ARB0tR7oRnMb5d8pHvKCJVjMb9-DauRe9WEaZG-_mHKQmzSeudQU4z9f7X4tkSqzhjEI5NdSADPaSV91OWWGic4QmL4ENIx9Us31FFvQwsMfyumUNmZlvBDYuoDDsL8sHDa9E834NhAMeJwsVCaQBkNW1nYQrqZbjwWgHbrmcj0sE9cXTdUdBwRP8WO-FOc9UHSD40-A2vjMKfkyBQKCA3C3qs3p93z3JRl_sxWWpMq2ykJgJVAiOl9j8d-f7YlCRoPjIYlm32fZiTw2GS-vWTbRy6pWwGsIBq7J5Qsya9HU-jy8MNimjF-X1fI-hJXD56Li95dcXcPK2W8edfv-NDRu8w","https://scontent-icn1-1.xx.fbcdn.net/v/t1.0-0/p235x350/72691889_1264017613780506_3895949063081689088_n.jpg?_nc_cat=102&_nc_oc=AQnkIr9204PjpxC3FAQsYMnD8K0V15VXY9BTTMKN69FNiBxUCXZTywmqUAFNj2X1PXQ&_nc_ht=scontent-icn1-1.xx&oh=c0e6fbe441af19ba90e5c38cd454aa7d&oe=5E1C3E59","undefined","7장+","大塚太太東京在住中작가메시지 보내기"
