url,posttime,text,crawled_time,attachment_link,attachment_img,attachment_img_alt,attachment_title,attachment_brief
"https://www.facebook.com/poppyohoh/posts/2482786021744657","1568209079","昨天跟其邁一起看電影🤓（誤）

 沒啦，昨天「返校」特映會
剛好跟其邁腹院長看同一場
散場後有幸有高人指點
讓我得到與其邁腹院長的合照一張
（開薰🤘🤘🤘）

 先講返校的觀影後心得
再繼續講這張照片的故事
所以大家要把這個動態看完喔
保證有笑點，有點耐心幫我看完啦😂

 然後我先講結論
---帶你那個覺得往中國靠攏不會怎樣的朋友去看。
---帶你那個被黨國教育洗得徹底的朋友去看。
---帶你那個覺得政治很髒不要管他就好了那個朋友去看。

 ⚠️9/20正式上映，記得要去看喔！

 返校原本在遊戲界爆紅的時候
我就已經看身邊很多朋友轉貼各種消息
雖然對於國產遊戲可以觸及白色恐怖議題
又能做出好的劇情線、好的效果覺得相當厲害
但我本身玩遊戲的時候真的是只能玩很廢的那種
不能有太複雜的劇情跟關卡
如果方塊跟數字可以玩到底最好

 總之，遊戲我沒玩啦！
我會去叫71玩給我看的
不過一聽說返校要翻拍成電影
我就覺得很有興趣了！
（至少自己不用動腦劇情也會繼續下去）

 故事的背景設定在白色恐怖時期
但必須說有鑒於我們課本總是輕描淡寫
大概很多人甚至分不出二二八與白色恐怖的差別

 我們現在會覺得言論自由、集黨結社自由是理所當然的
在那個時代卻不是這樣
也許只是一本書，也會讓一堆人丟掉性命
也許連一本書也不需要，就能讓一堆人丟掉性命

 大家常說今日香港、明日台灣
某些程度而言，其實是昨日台灣、今日香港

 在台灣過去那麼多人爭取過了、努力過了
我們享有今天這樣自由的空氣
卻有許多人不知道自由有多可貴、有多得來不易
依照香港所對抗的對象
不知道他們能不能有這樣的機會

 台灣卻還有很多人看不清
在讚頌著過去的「美好年代」

 好，講回來電影
我個人覺得「返校」不管是選角還是畫面呈現都非常不錯
在場景塑造方面也非常成功
整個劇情線的流暢度也很不錯

 我跟71看完覺得其中最優秀的
其實是電影的運鏡跟轉場。

 許多改編作品最常出現的就是轉場不順
就是劇情與劇情之間要銜接的時候會卡卡的
或是會覺得「啊怎麼突然這樣」
但「返校」在這一塊做得非常成功

 非常推薦大家去看一下這樣優秀的作品
也支持一下台灣的電影

 再講一次9/20正式上映啊
記得帶你那些有理說不清的朋友一起去www
（到底有多不清這我不好說）

 最後最後再講回來其邁的合照
反正離開今日秀泰電影院後
71在那邊端詳著他幫我跟其邁拍的照片
突然大喊了一聲：

 「欸陳其邁的手指頭也太修長了吧！！」
「我還以為妳摟著他的手臂」
「結果那是他自己的手！」

 仔細看了一下照片
嗯，我的手在腹院長的肩膀上
雖然你老婆覺得其邁很優
但還是不會隨便摟其他男人的手臂好嗎

 然後我就回71說：
「你難道不知道，其邁的手指美到他的手指本身有一個粉絲團嗎？」

 貓與邪佞的手指 
陳其邁 Chen Chi-Mai 
返校 Detention 電影版
#返校 #返校觀影心得
也見到了發露已久的 蠢羊與奇怪生物 但沒拍照","1571064721","/poppyohoh/photos/a.607488849274393/2482782381745021/?type=3&eid=ARBYexszd9sBJIlhbet8UdALKj-GgebtsMTzlY8kFRt6yG81XVeOkTA2BixXPaZh_oLO24nLb8decsyC&__xts__%5B0%5D=68.ARAHqR-xQrLPR5IyNHG0PMBPXpeCubyeEq3IZEjdRUOyxXA84vIUea2BxlBXH54aR8q1C6rosvhTmuIaD_160gvcDP9FkU3Eq-DubygY-2D2CvfGZUqNNT2OqTlmUzo3J49CaGM5Hpa_XXBJBbvfQiQNMu3x6Z-AjFzBK6ib9d5A8Dz1OfXOTwIBMP6d_YcPcoUBWZBB4BHI7dU-FO7Y8QEoH418JAzauVva5UAzuFsJQyYhjVcJNEWPa9mxjvLqwRuO-gyJEmNmVCrecEivGN3r2V8cbwFMS8XeevvM592guh_xKBsbO3Wv2wWiL54bWoXCDize8RhUyxRPdiUQmBix4A&__tn__=EEHH-R","https://scontent.faep9-2.fna.fbcdn.net/v/t1.0-0/p526x296/70488957_2482782385078354_8743758033957421056_n.jpg?_nc_cat=106&_nc_oc=AQlh3-sHMp4MZxpGK0tYp5MNNPsc6PzaLfDxHDxClR7haNmnzhvymbXU_JujnigJ1wE&_nc_ht=scontent.faep9-2.fna&oh=372b2a653486375413ba6738c373efa8&oe=5E3046D5","undefined","",""
"https://www.facebook.com/poppyohoh/posts/2377308918959035","[Error]: TypeError: Cannot read property 'attribs' of undefined","","1571064721","undefined","undefined","undefined","undefined","undefined"
"https://www.facebook.com/poppyohoh/posts/2293828690640392","[Error]: TypeError: Cannot read property 'attribs' of undefined","","1571064721","undefined","undefined","undefined","undefined","undefined"
"https://www.facebook.com/poppyohoh/posts/2328071620549432","1560685250","看香港人為自由不畏懼強權
100多萬人站出來對抗
台灣卻還有各種錯亂自助餐扯後腿
真的讓人心灰意冷

 看到有跟我一樣身份的人
願意在發穿搭文的時候站出來公開討論政治
卻要被平行時空的人嗆說：

 「228被屠殺的人是親日的既得利益者」

 幹他老冬瓜湯的我都快吐了🤮
平行時空留言請看這篇的底下：
https://m.facebook.com/story.php?story_fbid=2179180218847738&id=100483830050731","1571064721","/poppyohoh/photos/a.607488849274393/2328071567216104/?type=3&eid=ARAx9WufSZC85adY-0XLbAlcWFgGAvFzT4sM_O-Qu98vtBXsFTTUlQW98VNUIZthvThfU5GeM3erx8uk&__xts__%5B0%5D=68.ARCrk8H9_zfRk-2XsWzUAYYsi-0q0nbyslZWHimRDeZu6xngpvQuYA0WAxVE0snzAR8l-Ipcb5aZfdvNS2nqqlpqiWV6LMP7nc2dN3u7zvnVF-F2TSS-ZhJ1WcgufVzJ0riaRIVsA4jxAXB_Ubdl1OKN7UkMxp9HR7PQl7VOIo1SKysM9ItzGZeZDgF7vnt485IfmegGXLTSM_-xgkXGKnU_WyIjEdiccxdgcaFr_9nnM9RYSHKfixKFsJvpQnG8NfGRPRS541sTf46HCnDWBuDkcJuZ4f55gLrRM81GyROvdDFqep8M25qifegNXdrvB4Zd7HEH3k1LSIWRLx2Kf9-VOA&__tn__=EEHH-R","https://scontent-sin2-2.xx.fbcdn.net/v/t1.0-0/p526x296/64653558_2328071570549437_9208819845842337792_n.jpg?_nc_cat=108&_nc_oc=AQnoRDlWeguaDbGwIKGrLNeTI10-ymKsdxLDN4cbIu8wp6KQmaWZ818mZNju8V-0yDw&_nc_ht=scontent-sin2-2.xx&oh=9cb008ec367b43b8d5c59069b4957f62&oe=5E2E7AB5","undefined","",""
"https://www.facebook.com/poppyohoh/posts/2259265360763392","1557318720","＊點連結看完整版：https://youtu.be/hB9P6pF0mbw
之前在週六直播時引起暴動
大家還沒看完化妝教學就紛紛衝去買的
眉筆優惠組詳細介紹來啦XD

 基本上是買眉筆送刷具的概念
雖然原價280元已經超便宜
但有網友回報搭配藥妝店折扣
最低可以到大概216元
（看得我都想再買一組了）

 除了眉筆+刷具組之外
還有另外兩個限量優惠組也很不錯
還有INTEGRATE去年賣到爆的粉底凍介紹

 趕快看這集，不要錯過～
#INTEGRATE #櫻特芮 #透潤柔光粉底凍 #果凍粉底 #夏日底妝 #限量彩妝","1571064722","/watch/?ref=external&v=347183459336080&__xts__%5B0%5D=68.ARC7IY4V4Nniz6dMTqgL6xkGIvCTNoOK5MnIcWiFlDBp-fKmtzVh6lWyZLEDZbE3v3n_X1tVkBx7pUle8IoR8ScFN4lopdHA5fUEnWdA9Ie0jIGYImGjHWiusmejmuoh0-NSIRIx3EWCp_p5MnddefvVq---C_r1TwdgXcPQV64FAmLosziTDAPUKTKSLIT8xL9xOk2lMGRYEM2bGP0fVWem2jqQFP4w1jQEHEVvGsJ2vioFdgBuvYTTJ8fM9lX8gfw-roXg3DT6TZclCJDmPa2Bzd3A1HtcjaEDluYGkbvLtSScBdudytLXZTqpFp6QwoHfZwprCE6aHhRRdmdcNruY4F_w5zOOrkeu-g&__tn__=kFFHHH-R","https://scontent.fcgk6-1.fna.fbcdn.net/v/t15.5256-10/58452154_347183889336037_2292599103894323200_n.jpg?_nc_cat=108&_nc_oc=AQn-_Y7dCw-S88RypKErH-iPWj8BEd-del8KWSEJRt4MoR2dkVVn14xTDIyXkIqUnpI&_nc_ht=scontent.fcgk6-1.fna&oh=a014eaeaaf478fde3e8f28e310edd1a6&oe=5E1DACA9","undefined","買眉筆送刷具？","Diposting oleh 波痞到底是在幹嘛？"
"https://www.facebook.com/poppyohoh/posts/2283564681666793","1558530285","下午走在延吉街附近
迎面走來一個至少70歲滿頭白髮但很有型的阿北
裡面穿的潮T竟然寫著：

 「媽祖叫我出來選」

 而且是那種裂開的字體
可見得不是支持者推出（？）的T-shirt
我一邊思考著這個問題
一邊想著台灣的長輩還有救

 然後...
就錯過了幫阿北拍照的時機點了。

 #阿北腳程有點快
#現在後悔莫及
#而且阿北你那件在哪買的我也想要","1571064722","undefined","undefined","undefined","undefined","undefined"
"https://www.facebook.com/poppyohoh/posts/2479070372116222","1568032231","＊點連結看完整教學：https://youtu.be/mnEcRwP73eM
被客家朋友敲碗敲到爆的客語教學來啦～
（對...但除了客家朋友之外，我想應該沒人要敲碗）
跟上一集相隔了好久才上傳這一集
真的是覺得非常抱歉，讓大家久等了！

 按照慣例，這集還是有地方阿婆上身集錦

 這週要教學的是相當重要的副詞
如果不教下去的話，我們接下來的課程會卡關
而且還一次教兩個，簡直划算到不行

 這個單元教的都是可以超快融入客家人的日常生活必備客家話
想偶爾烙幾句客家話的話，看這個教學就對了～
也歡迎客家朋友們幫我多多分享出去
救救我們失落的母語啊！！","1571064722","/watch/?ref=external&v=951158161943833&__xts__%5B0%5D=68.ARAmziEvIxVBkXP3ppl2b4vqTGVSLf_YRQbZGzEJWQQQfjgAC3I0F_n1UImp-fnH5g86ILTzqIAwKhaVNGVrbOQU4-TxPbqm3ioE1QooHMVEZE5JXaIOvBdRRU03YbXgGnbtw584BZxXIIqpbQjxClfNdb0VD8M8NBlHB5QC5_AvRKDF7PUNsOjVAgw89S0BROFHqpPBn8RjHVhp22wm88jTIDQs1wW6u6Wml5krvS3EMHkpaKX4vlj0FvAyoGiX10JEIU41LHtkWkOrVmwUbcCA92L78tSFQO6h-tMEWWWeNuavKnSdAktUg8iaGoPmarHqls-Btp8XZCzuPU-GaddBH9ejv6x4jP0&__tn__=kFFHHH-R","https://scontent.faep9-1.fna.fbcdn.net/v/t15.5256-10/67953142_951167525276230_3399913772419121152_n.jpg?_nc_cat=102&_nc_oc=AQnSiArim9JFzQJx-Zvv1_yBJ68r-U0QsKyAda50cqCEDwEcKOyPHP1mIBU9A30iKIc&_nc_ht=scontent.faep9-1.fna&oh=dbb1044625cac5e56c92d6c87adff142&oe=5E384C13","undefined","客家話「很」、「非常」怎麼講？","Posted by 波痞到底是在幹嘛？"
"https://www.facebook.com/poppyohoh/posts/2311582065531721","1559916000","我啊，很幸運，從小在一個沒什麼性別歧視的家庭長大。

 
阿公阿婆生了6個女兒、1個兒子，最受寵的，卻不是唯一的那個兒子，而是成績好的二阿姨跟最小的小阿姨。甚至在我阿太那一代（閩南人說阿祖我們客家人說阿太），我們這不怎麼富裕的家庭，我那位在1917年出生的阿公與他的兄弟姐妹不分男女全部都有讀10年的書，才需要出社會工作。

 
阿公阿婆一直非常疼我，小時候唯一一次被阿公比較嚴厲地對待，是因為阿公發現我阿拉伯數字寫得不好看，特別花了一個下午陪我一起，板著臉，教我好好地寫數字，一筆一劃好好寫。

 總之，在我們家身為女生並不是什麼大問題，我並不會因此而受到限制，並不會因此就不能擁有表現的機會。

 所以「重男輕女」這件事對我來說是非常不可思議的，但在漸漸長大以後，發現原來「重男輕女」存在於我們生活各個角落，而且比我所想像的更嚴重許多。

 
高三升學考試前為了減少通勤時間，我曾短暫住在高中宿舍半年，但因為宿舍年久失修、環境不是很好、設備也不是非常齊全，住在那邊的時候我每天都很想回家。當時遇到一個普通班的室友，她卻很享受待在宿舍的時光，一問之下才知道他們家極度重男輕女，她在家裡不管什麼都要讓弟弟，要做所有家事，幫弟弟處理許多事情，卻還是常常挨罵。但弟弟什麼都不用做，就能得到父母所有的疼愛。

 對她來說，這小小爛爛、設備不良的高中宿舍，卻是她生活的避風港。

 
出社會以後，因為工作性質的關係（美妝部落客畢竟是個女性獨大的職業啊），也很少遇到性別歧視的案例，偶爾遇到這種狀況的時候，我都氣到不能自己，雖然身為一個睡一覺甚麼仇恨都可以忘記的射手座，但這種事情大概可以讓我記恨一輩子。

 
最誇張的一次，是我老公71接了一個中小企業的聯名案件（他是畫家），但因為行銷面、案件包裝方面我比較熟悉，所以整個合作期間每次開會我都跟他一起去，並一起提出關於設計、文案的意見。

 老實說，那個中小企業是賺到了，要不是他請我老公做聯名，他們這輩子都不可能請到我做行銷、文案的顧問。

 
但在每一次開會的期間，我都明顯感覺到，只要是我說出來的話，那個老闆都會不斷地提出質疑﹔而一模一樣的話，只要是從71的口中說出來，那個老闆就無比贊同、點頭如搗蒜，好像71說了什麼至理名言一樣。而且在這邊我要強調的是，只要有跟我正式開過會的人都知道，我開會時講話是很沉穩很有說服力那種，不是平常直播、拍影片跟大家說說笑笑那種，我以我想應該不是態度問題。

 更糟的是這個中小企業老闆不僅有性別歧視，甚至還有年齡歧視（這是題外話了）。有一天開會開到一半，他突然問我：「妳幾年次啊？」

 當我回答完77年次後，他murmur了一句：「跟我兒子一樣。」

 
從那一秒開始，我明顯感覺到那個老闆對我的態度變得更糟、更不客氣，那次開完會出去我真的當場在路邊氣哭，憑什麼我要因為自己是個女性、年紀比較輕（當時才25歲），就要被一個無知的中小企業老闆當成白痴？

 養出一個77年次只能跟父母拿錢去國外逍遙的廢物的人可是那個老闆本身，而他卻要檢討我們這個世代中憑自己的努力與能力獲得應得生活的人？

 
最後一次跟他們開會時，我們現場在跟那個老闆討論我寫的文案（還是要強調他賺到了，如果直接跟我買文案不可能那麼便宜好嗎），那個老闆以一種：「好，這是妳寫的是嗎，那我就來考考妳。」的態度在向我詢問「我寫的文案內容裡面有什麼」。

 
但他不知道的是，我當初在寫這些文案的時候，在網路上查到太多錯誤的資訊（是跟台灣的地理文化有關的內容），於是我追根究底找了各式各樣的資料，只為了撰寫8個大約250字的文案。所以當他「考」我的時候，關於所有地區的地理、歷史文化我都能夠將由來、前因後果、細節倒背如流講得一清二楚，講得那個老闆啞口無言。

 接下來的會議之中，他再也沒有對我說的話表現出不屑、看不起，再也沒有因為「妳是個說話沒份量的女生」而忽略我所提出的意見。

 
在這個故事之後有點小離題順便提到了年齡歧視，但相較於生為男性的71而言，我要得到這個目光短淺的中小企業老闆的認同，相對來說要付出多少努力。只因為我是個女性，在專業領域上，就是有許多人無法信任我們。

 
現在已經是2019年了，還是時不時會遇到、聽到一些性別歧視的事情，我是真的很希望每個家庭都能跟我們家一樣，不分男女，每個孩子都一樣重要、每個孩子都有公平競爭的機會。

 
從小到大，我之所以能夠自信地去面對這個社會、成為一個不畏懼他人眼光的人，我想我那毫無性別歧視的家庭，賦予了我極大的勇氣。如果不是我阿公阿婆、我媽那樣帶我長大，我不可能成為一個這樣敢為自己、敢對社會發聲的人。

 OK，以上說了那麼多，就是要提醒大家...

 6/10-6/14期間，晚上18:00-22:00
電話民調，記得接電話！

 就算我這種有電話恐懼症的人都已經準備好要接電話了（電話恐懼症的故事我們之後再說）
以上說了那麼多，我想我的立場也相當清楚了
只是不管最後勝出的是哪一位候選人

 我也都還是「不可能會投給親中的那一方」
或是「放棄自己抵抗中國的權利」

 我想不管是誰，只要你愛台灣，都應該有這樣的自覺。

 發這一篇是
陳其邁 Chen Chi-Mai副院長有請人私訊給我
想請我呼籲一下
但其實不特別請我發我也是會發啦
只是釣到其邁副院長請人私訊給我我也是滿榮幸的XD

 再說一次！
6/10-6/14期間，晚上18:00-22:00，電話民調，記得接電話
跟我一起，讓有能力的女性繼續為我們發聲。","1571064722","/poppyohoh/photos/a.169702919719657/2311926915497236/?type=3&eid=ARCD5DS7V-kjpE3HES8Z9RIl4Eck58k3aOd3SRKnkZznFBZsdfD1dUbphk_MhUSiIzD2tM6n0jVS5aAX&__xts__%5B0%5D=68.ARDC-du6itdB4YnNSaH5m9T3ljLJ0pSUm95PoOxVLcn1ut0J5HI4IqOajfs3VdEki5kPWnKsHUpw6GrKO-J0fH_T0parvXfSpnU-_nCH51k-29_TpzjGP_uxDrBCmHM3q_KLseBz7Hfi4i55a4ID4b7AsmUYgT-S1f3yBYe_p7gX_t4pYg5llUtKw23AS8qI0N8SWO0GMFyjfkVH9AsgswxNwghD0VwAyIsS5iqSxk3pUksElJLqotaP0br7JlCY3UZ9ToCrpYXq20wI54EIQ2RWGBkMgBQyh864JBPAJsxbA_fmidUDok8h32mm59CaVhZVJt70w8TR5GOMLejzVQeyEQ&__tn__=EEHH-R","https://scontent.forf1-1.fna.fbcdn.net/v/t1.0-0/p526x296/62470048_2311926922163902_7842894390287663104_o.jpg?_nc_cat=105&_nc_oc=AQlHN2yGHuSipdcYmEcA-vVxeHzpXtPXNXLGjAo41mYf9XIvfmPMLjygFZdi_BI72Ys&_nc_ht=scontent.forf1-1.fna&oh=11b5a76898864e8037dff374e89a6df5&oe=5E286099","undefined","",""
"https://www.facebook.com/poppyohoh/posts/2459082270781699","1567084841","明天有電視台要來拍我家
所以我臨時抱佛腳
在整理我那有如核彈炸過的房間
今天試色直播暫停一次

 先獻上這組「你是風兒我是沙」的照片
以下開放跟我一樣的老人歌詞接龍

 ＊發漏IG的確會得到這組照片：poppyoh17
＊身高/體重：168cm/74kg？
（拍的時候是那個體重，但手臂真的有修啦）","1571064723","/poppyohoh/photos/pcb.2459082270781699/2459069057449687/?type=3&__tn__=HH-R&eid=ARDJaSh1TLdQFuqJzeWwjD1BsOUhS91jQ_l4l79sj9m9HFhLGoghaR3lIs3J8VuihOe5GP6JAVKnKppS&__xts__%5B0%5D=68.ARAHS7i3U07cgL5tVNbFej2RxVOT4kVICjlpuvFJeNR7Ir6E1RuW2GFk3M2iYCPezPyNwbrBZ6RdTqdhIU1n7_nb-qc-ez4Xw6lp6-rVMJbgl40KYCEcKAeSROGiXKQskBg_glCcYnKZSQHF7-VpsZE1kh8nisBmH2So_D6DOqvoErYov42iM7twc6G2oqsPR2qEwEqL_CP5MASlEqeadvAB0TQilnnY3ygqX4omLiTmrqq2vj-lNmWvppCoC4I8q6Hyo3G_RBmqo0k0bEsOQNQyQxxtbsiSxlg9SFy5CgeQN_jBHVrERx2sKtUxKkougcepWZvVJdzRo3vjTcc4MdmolQ","https://scontent.fgyn1-1.fna.fbcdn.net/v/t1.0-0/p235x350/69444074_2459069064116353_5486306969536954368_n.jpg?_nc_cat=110&_nc_oc=AQkvj_W-8yqvKCCsb8eJ71dN4w1xFycqozM96KszNr8Cm8xvUaUIH0iQlor38WLwhaU&_nc_ht=scontent.fgyn1-1.fna&oh=4d45037094fcb9058ea4ddab41d2a652&oe=5E19B013","undefined","8",""
"https://www.facebook.com/poppyohoh/posts/2295660737123854","1559133276","今天要來推一波好行李箱
超高C/P值、質感好又輕
去年我換了一個德國納莎登NaSaDen的行李箱
必須說一試成主顧，馬上幫我媽也敗了一咖

 實用好看、價格實惠只要3XXX

 但因為我原本用的系列空箱比較重
就幫媽媽買了比較輕巧的無憂系列
用了之後覺得也是方便容量又大

 輪子好拉、拉桿堅固耐用
又有美國交通運輸安全局認證的TSA海關鎖
重點是連內裝都質感好設計又貼心
用過就回不去了，真的超讚！","1571064723","https://l.facebook.com/l.php?u=http%3A%2F%2Fwww.poppyoh.com%2F%3Fp%3D9073&h=AT2osHpWtV2TL3Iw4AuVy-WHxHYQ-bwNDdZxmdflH44sZQUT-w5ho7212OGf36Dr__Shywdz2dzq50nuYdwaUnYiKTIdDpJpoVawa-kzFZ9Gwafzablt4e16CASuRbIgEo4zOlX2Z_nIqnDpcT1VOE4A204NZSkj4F7Ha3uO3MlRBoPdkfFzi_WscVN49ZZWMrZuvMNUa9KaIqgaqa4jGjaitCmfnEWOTkMzdXdlCKDkCucIsFscJMcTjeUuKXXOWcBHT5_tja_vTa-07qsJ0ePAzNMnr2KUFaggRaWjUlamLGhXedwLC5hfPsXBcClOw9yR1V6bLvWxGVOIp_4qyiAijFYmqcvpkGmb8DUETgg4lz-mVJ9mgRW6B9ODqSIOzffFAf-OGHYx35MUYdOG2L60P2PaYGVl-Ysj_B5mYoKmseoOG1zFyFwQTnitcPMsE-hWqCUdsor2if7bogLn7gQwZ6fN9-A_Gm5foWfriNEHIjH6puZy0uqqbYJhsFelelhn0N68dOVMvKdPxpCsqUScMqXFSLExX93nGhy8H3RiLaDgvV3YDA5X4XorVK21bVRZKifldrctwa9vgIqe7YNsPRk47lsSVrsNceA6_5O6Y9O6ThYTvE0rJNQ_EjA6RprlBsrCIVIq4hp_","https://scontent-sin6-2.xx.fbcdn.net/v/t45.1600-4/cp0/q90/spS444/c1.0.1198.628a/s526x296/61969352_6136830430025_2885032405779873792_n.png.jpg?_nc_cat=104&_nc_oc=AQlQ8fnBf3jkR2oYmtITLDaT4qhqY3NI5seE78J56aGfRdXoRhmugLKgYW7hvZxlef8&_nc_ht=scontent-sin6-2.xx&oh=07b0673a244db7162057e970d6d39a82&oe=5E2E3C61","Image may contain: one or more people and people standing","好用行李箱推薦｜質感好輕量輪子好推，C/P值超高德國納莎登NaSaDen新無憂系列玫瑰金開箱+行李箱不超重尺寸挑選小訣竅","今天要來推一波好行李箱 超高C/P值、質感好又輕 去年我換了一個德國納莎登NaSaDen的行李箱 必須說一試成…"
"https://www.facebook.com/poppyohoh/posts/2486195871403672","1568374110","＊點連結看完整版：https://youtu.be/K9gNt7-j9is
今天要帶大家跟我一起去染頭髮啦～
因為長期漂髮的關係
每次染髮我都一定會搭配護髮
結果最近得知有染髮或燙髮送護髮的優惠
簡直太划算，一定要帶大家去看看

 優惠預約這裡去：http://bit.ly/pccpoppy

 然後優惠都是從StyleMap美配這個App上預約的喔！
除了每個月有獨家優惠以外
上面還有實際的店家、設計師評價
染髮、燙髮、剪頭髮都不怕踩雷

 因為是送的護髮療程
我本來以為應該也不會太厲害
結果送的是法國品牌髮妝之鑰的PCC護髮課程
總共有3步驟，整個護好護滿沒在馬虎啊
課程原價NT2000~NT4500
完全就是有護到有賺到！

 Youtube完整版有抽獎喔
抽價值NT1700的星星油
詳細資訊在Youtube完整版的描述欄
記得移駕Youtube完整版抽獎去：https://youtu.be/K9gNt7-j9is","1571064723","/poppyohoh/videos/368739440739876/?__xts__%5B0%5D=68.ARD-nmGRHjh8xHoOjAsucuwrWcOY3cBXP9cHDoUdSaMa413wyKYpdEMxzL0phTiOkZZrHNCsacqX1s1q4OxWn4Jyz9RLT0yrhmhoBaUc2vdmgYAPsbo5DKTupaSIL9bGTLJRut6xELodx6yKTX9nRJY8jwyDtAgvn0bcB-aJf57B9mnhzMjjcd0P01hE4wD-NtC2ZLieiO_zNC62mIHWDKkXmZKb63k81azp_5sO4Woq_gbGDLq8u44XvAJBLy7U1c0r5qQYXhUY4LyDAZgE8jm0D1xZee8GQvm6kdfAo80v-o0rNs-1eDVxcPXH3K8trjf1KTP9TLZCB9WguBW4g_PqHfZLB5cFt2JN4MIPlLpSAo8dSq3O&__tn__=HH-R","https://scontent-sin2-2.xx.fbcdn.net/v/t39.10505-6/70684765_424466484857752_1593569197667909632_n.jpg?_nc_cat=107&_nc_oc=AQkK90PiqI5dQNhrGoartm9ZnqI3lV9nOx9vHOOTIOc1HHsa7OMTC1M0V__IYZXjKSo&_nc_ht=scontent-sin2-2.xx&oh=7ac4669c9d7ca81fc5940f2c44d78f0d&oe=5E215B42","undefined","Watch Now",""
"https://www.facebook.com/poppyohoh/posts/2452378151452111","1566781200","大家最愛的老屋改造系列又來了～
這次的改造是一般租屋族也能參考的浴室改造
沒有超花俏、超fancy的裝潢
但相對於我們其他的改造
這個改造算幅度比較小
而且也不需要一些專業技能

 但今天這篇某個程度可以說是老屋的奇幻旅程
沒想到我可以用一支蓮蓬頭拯救髒水老浴室

 說到老浴室最令人困擾的大概就是以下幾點
1.充滿坑洞的爛磁磚
2.超雞肋的磁磚款式
3.管線超舊水超髒
4.格局不佳很難改造
5.租屋沒預算不想砍掉重練

 如果有以上困擾
這篇真的可以看一下啦！

 超神過濾蓮蓬頭限時團購中：https://gbf.tw/qnhuj","1571064723","https://l.facebook.com/l.php?u=https%3A%2F%2Fpoppyoh17.pse.is%2FKR8W7&h=AT15H1n3HhWNJXR0vmMu05GsAU92G-GVzO2gwBPPuJPWMRFNkg3bjx03ZVSR-FyTFnDPEH8hf4Fzkc0qiNBGhJYNNCCAry8Kewlsew_CROQy2tTwwCFbaD1wpiStDDqH93r1BwMsAr-jC6pwrNejWQBoNusNw5rRlMiKgVE-079dJugXSICxLM9gOiIIVLQTM5eq1kN9bE-Z2Saa7zVtUzcMg3CXW01IUm1F15p5pOOj16-bIVS4QS1SA40FmrWAm0GFQpdZHGmgbGVU5CqGpEeurzkDxyj0jytW_WxTK2w8U2gj-QGTJAbcfh2_u02fd5eu8YnbaKjM7wlkvBFQcsOMNb39VYl-L6V_UK63taAReeelmSdebDpQirWTUsV2S_8tRvDIIoN1_Dc6MWms33MsjMMLZ7abjcdzmDtR9Al4O2YpMRlTKw34hVOo8Inf2sSUiApxFBKVx1diyJMzig_-mnoG1kgSL42OMEmE2aO4p5P0lazEx_tDqjziTTZC98V30mpn0SlY0VgfII8qp8lYfAf1N_XTkdRsuG7VtFWsIZ97rTzOqnAK4vrWlI1ycWrefu1bbqmBDWlwXPEs5mRVN-1wG7Ftz4N5s5uKxhA5CBejCwdEz6vHkUrvsOucHbSggbb5aSQfRYWs","https://scontent.flhe10-1.fna.fbcdn.net/v/t45.1600-4/cp0/q90/spS444/c0.0.719.377a/s526x296/70294005_6125688757421_6709501689658867712_n.png.jpg?_nc_cat=104&_nc_oc=AQlU2czp6o6faf5LlDoBSVJE6S8-RcFBQQDr_PtPqg6d5InT2UAmauqzVnamhVaK6wU&_nc_ht=scontent.flhe10-1.fna&oh=a450ab7499939e1a84327305d1416570&oe=5E390A16","老屋改造｜租屋族必看簡單低預算浴室改造，一支蓮蓬頭拯救水質差髒水老浴室ft.超好用韓國Aroma Sense過濾花灑蓮蓬頭 | 波痞到底是在幹嘛？","老屋改造｜租屋族必看簡單低預算浴室改造，一支蓮蓬頭拯救水質差髒水老浴室ft.超好用韓國Aroma Sense過濾花灑蓮蓬頭 | 波痞到底是在幹嘛？","大家最愛的老屋改造系列又來了～ 這次的改造是一般租屋族也能參考的浴室改造 相對於我們其他的改造，這個改造算幅度比較小 而且也不需要一些專業技能 （畢竟我家71不知為何具備專業木工師傅的技能啊這我也不懂） 也會....."
