url,posttime,text,crawled_time,attachment_link,attachment_img,attachment_img_alt,attachment_title,attachment_brief
"https://www.facebook.com/poppyohoh/posts/2490359470987312","1568564396","Sorry，圖片有點血腥，但這就是現實。

 本來這幾週想說不要那麼頻繁一直發跟政治有關的事情發到大家疲乏，但事實是即使我們沒有時時刻刻關注，這些天理不容的事情仍持續在發生，甚至變本加厲。

 照片上這位年輕男性，為救三位手足而被黑警私刑爆打。

 獨裁暴政離我們有多近？
我只希望2020後台灣還是台灣。

 希望有朝一日香港可以脫離這場惡夢。","1571064717","/poppyohoh/photos/a.169702919719657/2490354640987795/?type=3&eid=ARCAvEYRCfDwtmkIbvh8EldFLvbwKE_n058SI7daMoccLRfhIJE_jPXlWtaYR42DZr02EM-naUbkTy4m&__xts__%5B0%5D=68.ARC7RCQvr_SCkYyz95gtU1I4UjPF-z4LCEBAoWyL7oyAZn8LrhpRkoKDpMzebIb73WBDdvshd7UgKT91ueJx6W3zgVy8zqo7W59gmx8vBGyXS1uisUsyRVs0nVFW6CUX7oNMP2-BNeEpJFa0wEsk0FK7JPIEmnyO93AvCSLpWQ1D6bUF0m0lKUq-d12PDr9AtsDL4CCklfTWXCS5fqe2rdYgOznZa9JPWGMovhcTafxjT5EHNsyRHhTw0GaJkO1n70QSRmpUNOXFq49l_gliJDHn0kRUI1Hu-ciAbIlGiRRzwBECqNR7VTU6z-wMM5sY-EnNQXIfYAR1pTykYMitTVPsNQ&__tn__=EHH-R","https://scontent-ort2-1.xx.fbcdn.net/v/t1.0-0/s526x296/70538226_2490354644321128_3716804594186059776_n.jpg?_nc_cat=108&_nc_oc=AQmZfzE4pe2vx6Ug0jn2dhGFFi37JBy5jQr784VvxziqVWUGsJHW5w5jdaqcUdtcRi0&_nc_ht=scontent-ort2-1.xx&oh=ef16be55a6ee68a0ff3101da3a1b1b84&oe=5E1E4658","undefined","",""
"https://www.facebook.com/poppyohoh/posts/2248097791880149","1556683208","今天應該不少人放假，來個知識型的文章
好書閱讀清單分享又來啦～
上次跟大家聊了書以後，沒想到得到不錯的迴響
基本上這個書呆書單這個單元應該會固定更新了

 而且得知要更新以後好像也有認真看書
不然寫文出片太慢就被大家遺忘怎麼辦？

 只是我書看得太快但影片剪太慢
這篇裡面的書2月就看完，文章3月初就寫完
為了配合影片文章只好5月才發是怎樣？

 書都已經看到可以再寫兩篇了…
（已再看完5本還6本還7本我也忘了）

 歡迎喜歡看書的朋友跟我聊聊書啊！！
每日一冷
故事：寫給所有人的歷史","1571064717","https://l.facebook.com/l.php?u=http%3A%2F%2Fwww.poppyoh.com%2F%3Fp%3D8993&h=AT2axrDz5Wqkkvr-BdY9y1-uWfVBo5GljpZAOw8Pv5jJrIIOhSuiclJ4K3NUgrTKG94S2wedTBonpihCVeqFLl69tbEVXegb4EIltKvklBLP__jtlBI4rmJrh3hjn2_rVoFy467DF1t0szBWTFa2tIk7GVTQ_B5TqdNvXalhXFpeRJDCbL5FBesqMvhpWGAJov7UCFvgeZhKRWb61eIo-Fe2N8g4ltuWXNSO694bSXH2_ldA8JxTAz1XL32a8WEaKt6q9pcs3bI0sevpBgP5xtayUOXgb5pjtVSBmty4INY5uLM9FQ-bcmW5JKIudgodej6aNg6023QsjxMYdpQjgddIShT1I1tiRAPpZbSr3l-C93DiV51M0JQRutDWSkHaUW-TsZ2MH0nUfaIKppvsNvUPkbhzW5UqEl0EEVRROKe5T1JntuYA-jxT5_dWT6Hp_lulEmR-BR74SW6fPVNODdqEhQlPDXnkl39j1FVIImtRRfYumE2sBWwsn-YlTaSbRC2L5vh3KuVcLaqVx9BX4ILoKSzIB4sOj6YYV48vy_hTHcwEnmq53_lR6XlQnFKLmBfPUVAqIgZUbQnfmz6XbtIkD-ldwank_zmXtR9q9S18xDq3T40p1zF2vpdih104jQKwNOGdOD58CZWIQbl0q0k","https://external.fsdv2-1.fna.fbcdn.net/safe_image.php?d=AQBTtUPBibO3I39-&w=540&h=282&url=http%3A%2F%2Fwww.poppyoh.com%2Fwp-content%2Fuploads%2F2019%2F05%2F00.jpg&cfs=1&upscale=1&fallback=news_d_placeholder_publisher&_nc_hash=AQAdzRk27VqBQgxq","Image may contain: one or more people","好書閱讀清單推薦&讀書心得：罪與罰/知識的不正義/臺灣沒說你不知道｜書呆書單201905 - 波痞到底是在幹嘛？","好書閱讀清單分享又來啦～ 上次跟大家聊了書以後，沒想到得到不錯的迴響 基本上這個書呆書單這個單元應該會固定更新 …"
"https://www.facebook.com/poppyohoh/posts/2311645952191999","1559910660","＊點連結看完整版：https://youtu.be/TtdIgu6m2h8
好久沒有更新客語教學啦！！
因為近期真的很忙碌，沒辦法達成週更的成就
雖然相較於其他影片這個單元沒什麼人看
但為了推廣客家話，我還是會繼續做下去的

 今天要教大家的一樣是超實用的內容
要教大家客家話的「這裡」「那裡」「這個」「那個」怎麼說
詢問事情、陳述事情實用度百分百

 這句學起來，讓你在客家村莊穿梭自如沒在怕！

 然後記得要點連結去看完整版啊
真正精彩的都是在例句
一堆人傻傻的不會點去看
真的是少了很多生活的樂趣內","1571064717","/watch/?ref=external&v=348415055834313&__xts__%5B0%5D=68.ARC9ba-m19Zmb_4l38NRt3ael34DE8s_pR9KQXAnE6pQfD4ghrG136EfN2P9YoBUt-RFjVic17R26qIR6hb4btdImWZT5PC1xmw_SYwtoaPIsx-qYYOC3BDLwU6bl_ZzaA5cLA7JG56FjwaJNf8LU9uxYWNfMRK5tH67ybRifbWidDpQo543hUL5blRTsHsufhKHHvBtYx_WYPe0bk6VcVoXMnBwT2P1aYERseIzHS7StnWsucY-amXaZROOSHXvi8MsFhHrvSsunqkOH32IlQtUa7v7DiGsu-EgVXus3HXmitEZwHSlIc-1H3E4-WT_azKTiqX4mcrzCtoYrFZCKa2JSV7_imDTwo9ebg&__tn__=kFFHHH-R","https://scontent.fbaq4-1.fna.fbcdn.net/v/t15.5256-10/60849686_348435292498956_7812080224731922432_n.jpg?_nc_cat=109&_nc_oc=AQm8Pd57weY_GKEfXoS5yVTKUFAlpwsL0OyBqyAdTxhFHleFUK2JDBXoIxPRk-DifH4&_nc_ht=scontent.fbaq4-1.fna&oh=9dfcf7b0c097aaa720608026c9104075&oe=5E1A9324","undefined","客家話的「這裡」「那裡」「這個」「那個」怎麼說？","Posted by 波痞到底是在幹嘛？"
"https://www.facebook.com/poppyohoh/posts/2306551756034752","1559649797","正因為是台灣人，更不能忘掉30年前這一天

 在有言論自由時不站出來捍衛
難道要等到失去了，才來後悔莫及嗎？

 *BBC 64相關報導：https://youtu.be/ExqqdUXXdgA
*歡迎各界網友補充64相關資訊在留言處

 對了，照片末有彩蛋，看有沒有人能找到","1571064718","/poppyohoh/photos/pcb.2306551756034752/2306546719368589/?type=3&__tn__=HH-R&eid=ARBVRECHqsrOQHzw5piyBJvnth4jEKh4gyVG5tOCndImF9YQKJaa88QVIObGj95uIQIx2jMlvXpmVJj2&__xts__%5B0%5D=68.ARD4ccRDW4jhE5yVZMUpG9qjGguzCOET2_nmY7KnVgUixPxlE4qDx0djQszaX6j5JWACrCzVik0pJ_8CdfF7uWpOjKhSSNS5vcjLKCDdsAZLB9cUXPZg2JWBg9fWeQSGcuiHY_1DTzUaDRQwCOEoof9i0YysJ6SnC5_XLgt_i4cxRoWkyKpefWW_DM5W0A2B9vHdBOSq--E1fHhr6IVWNNfSxQUUe389RQgR73_xAbtTsi-C5vgrbPpe41qGJPIuIya8U7eRDBzDaM8fA9oQ6j1nIpfBqfzdl_c7Qy1SOQhRtKEampqWqQXU4G0_MTii0m7uXT334lyF-8mKUkifD9oVsw","https://scontent.fbkk7-2.fna.fbcdn.net/v/t1.0-0/p180x540/62040296_2306546722701922_2586563776782270464_n.jpg?_nc_cat=110&_nc_oc=AQmgbsmIAh_dm4xvChia1i0PUJRbSOdgooljCZ8AJ3jbMdORaj9aMXhoesHpsuKyDwg&_nc_ht=scontent.fbkk7-2.fna&oh=f103ca8668d10c5e15d3f30abe87be83&oe=5E60FACE","undefined","4",""
"https://www.facebook.com/poppyohoh/posts/2447926195230640","1566564100","超值行李箱優惠終於又來啦！
❌原價一咖NT4600
⭕️限時特價一咖NT3499
❗️兩咖NT6400

 他們家行李箱真的是優點多多
☑️質感好
☑️超高C/P值
☑️重量輕
☑️輪子好推
☑️拉桿堅固

 之前已經開團過兩次
結果還是一直被敲碗跪求再開
就是因為價格優惠，行李箱又好用！
限時優惠只到8/31🤘

 哪裡買？
https://liteshop.tw/p/62qKE5er/u/gcFm3G","1571064718","https://l.facebook.com/l.php?u=https%3A%2F%2Fpoppyoh17.pse.is%2FKGGK4&h=AT3ngUl8aNrFsAuIGNamoA5au7pRDcIDUk2dBtssuuedjZ7hTrX5o2oSCT5bbEUD13BQCJv29dQeQ_5xXSpyNWPodSuUMcGG91-mVFFerOzalmwkKOxvvP9qAkJOfhfhl1W1RnUOw1jmubELchWH3iCL_lG83fvbb_l3_nIZfed-kVnzz6H5DmsE5K5hw6DhB2jKMk5pT-5s1Exd4Ohyo6cZ13XaJzBzUQ1jwHqxCpPhRqsGmcpvVjHdO3wJXH5KnyvhJZCymqdTk3Hbktz3PUHg5hmvpuMZToYm-qSNJA0X0Z8siL7ilFuwJ-AAfLLxGMRYCQU-OHiksx3lGjtTyuw2e9IYeuG422-xkSCKhCtOC36gtI4zi3nFZwGkptFJC5mnN53inkpeU0p2lEW8VaWNEWd0XXfYInuYh01tI6_KI8E6T6bNyMH7y7JLlNw1jZgSlHiu6adjrfa8NU84kcNRIUDH3wpkQ3ov4uNLasznCr35jNHreDn-vg24Y6ItQxncMoKY5SRM1I2GKFQf2mYmCIROzoCSu-kXY9poKhCqWGT7Jrhf10vF-OjCKUWARo1YfMai0EfvG7BsFK6-NbPMzxLoRL3jHlPt5TnDYfA2VpuyLuI4OUW2wapXY_PA_CIBjHI8wcMKDvSD","https://scontent.fdac5-1.fna.fbcdn.net/v/t45.1600-4/cp0/q90/spS444/c0.0.719.377a/s526x296/68935066_6144184157825_3689063370356424704_n.png.jpg?_nc_cat=105&_nc_oc=AQlH_DF9d93bPjPuy8CwaNWAHnw7kUbb31O2MTwTJGHnt4FIaLZCrcvLc4R2WgCVLEc&_nc_ht=scontent.fdac5-1.fna&oh=20d1a7d165c39f90c70d778ca6cdce94&oe=5E234CF5","好用行李箱推薦｜質感好輕量輪子好推，C/P值超高德國納莎登NaSaDen新無憂系列玫瑰金開箱+行李箱不超重尺寸挑選小訣竅 | 波痞到底是在幹嘛？","好用行李箱推薦｜質感好輕量輪子好推，C/P值超高德國納莎登NaSaDen新無憂系列玫瑰金開箱+行李箱不超重尺寸挑選小訣竅 | 波痞到底是在幹嘛？","今天又要來推一波好行李箱了 超高C/P值、質感好又輕！ ▶限時優惠在這邊點這去 原價一咖NT4600 限時特價一咖NT3499 兩咖NT6400 去年我換了一個德國納莎登NaSaDen的行李箱 必須說一試成主顧 也速速幫我媽敗了一咖 實用好看、價格....."
"https://www.facebook.com/poppyohoh/posts/2303468353009759","1559565060","＊點連結看完整版：https://youtu.be/lB4hun5zMmg
來跟我們一起殘酷底妝實測吧！！
我跟品君度過了逼自己流汗極為崩潰的8小時
除了吃麻辣、狂走三小時、在夜市人擠人之外
還做了腳底按摩....................（崩潰）

 究竟我們一個大油肌（品君）一個乾肌（我）
是否能爆汗之中持妝8小時

 然後今天測試的是我們之前做控油底妝討論串時
遙遙領先榮獲第一名的Sofina Ange漾緁的隔離乳、粉底液跟粉餅
而且是成分改良的「進化版」

 必須說影片超級精彩，結果也很精彩
大家一定要看到最後！！！
#SOFINAAnge #SOFINAPrimavistaAnge #粉紅控油霸主 #8小時不脫妝","1571064718","/watch/?ref=external&v=297124877858983&__xts__%5B0%5D=68.ARAObziQC6oP65hkxFEwhtZ1ToyAq8bGb2a83UOPKqcwjWS1UaYsPRWtlSecoWIDJ3yQKQxTJTeABWR6hhsxcBfIbIGqegtzksNNfJHFKGm03sPiXG0bJrDaBVGZO2y8_8Ruorqp2aB1l5H_cuoasqx-iAo6PG-I-9nzFh0GDu0StM36EEmnm-Lqq0HjhYUwAnQEpy6r3OJh1t7O99suNhOJzScN1Rim1PNf93zpxyd_cYB4y1u29khJVqbSavcTM4j6KYjXSvJAKlZRF2uKgjjJ96a-a8guDN4cphNAZhI8r2DQJtuiygEqTSn8dOQvlcbmwQnsp0x0zBaOXwUJHERZUtNwFi6hbmjRHA&__tn__=kFFHHH-R","https://scontent.fbga1-3.fna.fbcdn.net/v/t15.5256-10/61239696_297126637858807_1465223544660033536_n.jpg?_nc_cat=110&_nc_oc=AQnH87OLYk24VCaR7Y7e7zwGKiVsIg8NVO67ML7agZVaXpxZzkB4axh00kzPtCAoEFQ&_nc_ht=scontent.fbga1-3.fna&oh=13e9980003890357bb06112142c69c64&oe=5E1C6883","undefined","漾緁好用嗎？8小時地獄殘酷底妝實測！","Posted by 波痞到底是在幹嘛？"
"https://www.facebook.com/poppyohoh/posts/2426461360710457","1565529390","這幾天手搖風波
看到有些人會說：「人家也只是做生意不得已」這類的話
我個人是覺得啦
大家從來都沒有說不能賺中國的錢啊

 問題是沒人叫你跪著賺啊！

 這世界上有哪個地方賺錢要跪著賺的
我還真的是沒看過啦！","1571064718","undefined","undefined","undefined","undefined","undefined"
"https://www.facebook.com/poppyohoh/posts/2358466797509914","1562155804","絕對不是要出來選！！！
我知道這張照片很容易讓人誤會
但其實原圖只是染髮劑業配拍的形象照啊XDDD

 時代力量這週六辦了一個還滿有意義的講座
所以我就這樣接受講座邀約了

 最近還有很多有意義的活動在進行中
我也呈現一個分身乏術硬幹到底的狀態
明天還要拍攝一個比較大的全新企劃
也是有全新的合作
而且從4月多次開會討論進行到現在
雖然我胃不會痛，但總覺得好像可以感覺到白髮在生長

 好，離題了。
這次與談的話題是「女孩們的30大關」

 雖然比起其他亞洲國家
我是覺得台灣已經算是相對性別比較平等的
但還是有許多狀況是「只因為是女生」才會遇到的
不管是在職場、家庭還是社交圈之中

 就像前陣子林志玲結婚
「黃金剩女」這四個字又被拿出來講
相關報導真的是看得我氣噗噗啊！

 那週六就讓我們四個不同階段、不同感情狀況的女孩兒來跟大家聊一聊

 詳細活動資訊如下，有興趣的可以報名參加喔：）
與談來賓：波痞
時代台北：立委參選人 陳雨凡 高鈺婷 市議員 林亮君
日期 07.06星期六
時間 14:00-16:00
地點 PJ Wine 台北市大安區信義路四段400巷3號
交通資訊 捷運信義安和站 4號出口 步行5分鐘
報名網址：https://reurl.cc/AvOXY

 陳雨凡 信義南松山 高鈺婷 新竹市立委參選人 林亮君","1571064718","/npptaipei/photos/a.1645757599083416/2388650114794157/?type=3&eid=ARCwQh_gPr02CPTcB-mY72s6TuKx6jabjyvge8sl3O3YQuDDQBzeVvCtnmByzqq5-EXdv_G3loQ4iXMs&__xts__%5B0%5D=68.ARBC_xe-w812EvOX06hF86ndIUmTyaeVaUjMlcTO5-sCy66ULZOJhu--oQSAc9Bthg3QPmeyhcu5jf2-guyDvo9pZYOT0wi899OeHm61oIHPJpI4vgxdjnwGAT-GR9RIZAgKs9KTa9BnI-3DOg8gAn4_v3KA2dBkXlJZX73D3l7Mwy1CUQCyqK4XIhjT1o-T5xIs9pTjW0n9BHv9RGp04Cah6teEM8fnMdt61c2aFwKPGj3xJoD9d64jOVNIWDrU9Fhrf1Wq0NqctglHITCdPtiqppOmZFOiYy4R1oSb-0os0ecGjJbZub8I7hh66ZCi7NuTg6Yim6wl75kszpfVapL5PA2IDSx0KZMC6SnGaHyhgErLkGkfuDw9H1lsN2UtJh_3TPNdY6TYpmlcfhZ_wi07H8M8PzDRFYL0fopEhiEZLDAifAp3SvrmgNctqKhOzmeJcy18Mbt9F4gazGWlZHB9FmWm9DDyB1K4j38CFSg7IXp06I_MV8bhXA&__tn__=EEHH-R","https://scontent.faep9-1.fna.fbcdn.net/v/t1.0-0/p526x296/65476468_2388650118127490_6606495261365633024_o.jpg?_nc_cat=100&_nc_oc=AQkKhwxgD7T1cmccFrgcmGdZYHnmWYclRD3QzN-XXjINvS7n_4CgFsNurPBcaL6TVkg&_nc_ht=scontent.faep9-1.fna&oh=b14b0488faafb9bc64c1bea8c35e4549&oe=5E33393C","undefined","時代力量 台北市黨部",""
"https://www.facebook.com/poppyohoh/posts/2257894930900435","1557232200","＊點連結看完整版：https://youtu.be/i1f5rRZiLu0
這支影片真的不用我多說
你用看的就知道有多驚人！！

 大家要知道長痘痘、長粉刺
有時候跟粉底液或是保養品沒那麼大關係
常常都是因為洗臉、清潔不夠徹底引起的
髒污堆積在毛孔上，就長痘痘粉刺啦～

 所以今天就要跟大家聊聊
「應該怎麼正確洗臉」

 然後實測「手洗跟洗臉機洗的差別」給大家看
必須說我真的被那幾顆檸檬嚇得不要不要的
媽媽我以後都不敢亂洗臉了

 點進連結看完整版：https://youtu.be/i1f5rRZiLu0
裡面有折扣碼
前30組可以再折100元喔～","1571064719","/watch/?ref=external&v=429354157847624&__xts__%5B0%5D=68.ARDrzkN2jONWk1T2vOToOKsHX8DD0uQHGB4U6yZFUEKunEXi129w_6zr_ekZj526bGa6v5I4-LoR29bw_5QM2s7Q2UCo6k5bCvU40SKln3e99jYeiB0DS3uZl7NULyNVmCU1QDcQu5HVNbrrEkwD7cjO9elwIdjZGToLPMioeRkpQ8v2_QmOziWUPVV_KPcitylR3f2NBxKy7-xjupVJaVp84kYQwQYKUJO2Ffo_-_b4n8HZim1BBY_EltcOeEvfrEved7ohYMb46MOv3duBJiLF6wofIXVTWVjQ4ABOKqtkySJPZhOMUrEhvQG0xdlwm4H7Aqo-QGoHonudmwUGcsKT0NrqhaG7f-1NwQ&__tn__=kFFHHH-R","https://scontent.fcgk13-1.fna.fbcdn.net/v/t15.5256-10/58716057_429354924514214_5422873360591749120_n.jpg?_nc_cat=104&_nc_oc=AQmntUC-ajaXI4sewSL5dOukg8bVybZLPq3x60EkNhZak7-_wv1LGOb3vjZWgKs_pvY&_nc_ht=scontent.fcgk13-1.fna&oh=ff2ff5be8082cc935505fc6b1c00af56&oe=5E1949E9","undefined","手洗跟洗臉機哪個乾淨？嚇得你不要不要的實測！","Diposting oleh 波痞到底是在幹嘛？"
"https://www.facebook.com/poppyohoh/posts/2269863579703570","1557842529","我覺得有些人把事情想得太複雜
「國與國」之間的正常交流我是可以接受的
唯一原則就是⋯

 誰舔中我就反誰。

 #不難理解吧
#偏偏很多人不能理解","1571064719","undefined","undefined","undefined","undefined","undefined"
"https://www.facebook.com/poppyohoh/posts/2444341325589127","1566396801","不是故意要洗版你們不聊彩妝只聊政治啊
但會給你們彩妝新品資訊的人很多
會給你們在媒體被消失資訊的
可能在彩妝界只有我跟其他幾個人
（新聞整天只會報柯郭王是哪裡有問題？）

 為什麼要反中？
為什麼明年不能投給親中候選人？

 因為身為一個普通小市民
我不想沒事被冠上莫須有的罪名
有一天就消失在這世界上","1571064719","https://l.facebook.com/l.php?u=https%3A%2F%2Fbit.ly%2F2Z9qsyI&h=AT2sQsn3WaznP7RnSE4w5-z500sRFa4I3fmvf2I-FDnmntuORq9zpORuReX6geDdGUj14choWR8ivvTRrWe6h9rHZ8qHGO5zRCQS2XWP7axUcjgjaqZNZOMxOZ5KTF0j7m-13I3kaZzijzxLpcb8Jp9mhcTGuQXXIThYvYVx2gyFqMeAgMAW4bpE-Wo8nvjwsEId_ctTDZ4yylKufI_vFvxw3fHLrOXGVrfHv92pV21A18CTV8f2ZgpWsh7_SVBJLiL2uIKRnYcEZWbO06bGEkfiVj7uP_FzYYB0Apk8J3uuOSghKY2LMhy9mLwGVg6gNI6jFH7J027x7fVqRYVCC7Fd_hgyXI2Tg_trfHZmB76BT9BPnlvEJJM0oSBoA2gCgYga5BArx3n1N6D0RuL-d4xx9mjsvpH2npsD6HOWl1tMITtTDS09tG2riphSsCoO6yj-u1oN3YErValhRNzF1KdcBF_JAzEoc178QDeIgl0DHldEP65P9cAWZ5WgbJsTT6srUqPgzgC5ILEvGSg-fymEbJXxZo-MvUpEabZFVRYSNQj2hD1X-PDjkndN1pCsIygx0aOsFh8OqB_cFIhWO3QLWQrv-4_LG4ZnCpUIXm53voHQHxwNYHV53F2qJR-ubvXcBPdPTg0Vx4Wv","https://external-yyz1-1.xx.fbcdn.net/safe_image.php?d=AQAUMrxC-3emBIU8&w=540&h=282&url=https%3A%2F%2Fimg5.cna.com.tw%2Fwww%2Fwebphotos%2FWebOg%2F600%2F20190821%2F797x419_612459075207.jpg&cfs=1&upscale=1&fallback=news_d_placeholder_publisher&_nc_hash=AQAQfyBfYmr2HMCl","Image may contain: one or more people","中央社新聞粉絲團",""
"https://www.facebook.com/poppyohoh/posts/2395561597133767","1564016402","今天要跟大家分享三款花色很不錯的隱形眼鏡
顯色的、自然的、顯色又算自然的都有
而且是方便的日拋！！

 老粉們應該也都知道
隱形眼鏡文章都會被衛生局審核過
審完之後有些地方都會有些地方非常微妙
但謝天謝地
這次沒有整篇文只是描述外觀就被刪光光

 不過還是準備一下翻譯機（？）給大家
文章裡的「很好看」「最好看」⇨原本是「百搭」
「瞳孔」⇨原本寫了眼珠，但我是想講「虹膜」沒錯

 總之翻譯機先準備給大家
以免造成誤會或是覺得我是個智障（挖鼻孔）

 萬一廠商有想要下廣告我再把貼文改過來
廠商也是無辜的
他們不過想要文章能合法刊登不被檢舉
結果連購買連結都被刪掉啊","1571064719","https://l.facebook.com/l.php?u=http%3A%2F%2Fwww.poppyoh.com%2F%3Fp%3D9069&h=AT3fOk4QfETj2pN4Z-IcT4dweGkqLpYj2FLXRWVLcgcW-p5yYnYfllAqJelM-np4aw_XXjMbtnMSWB5plAUgLI9MGwaE_QhHsnIkhWhXIk4AguPeYpQXgHtDdSBkJ-9x4CjXXKFxPZrL-Gy8QAaJE7RGksFBDp6_RfWA_6XFRX6qEnnN8QQbng0CwPVKRaCKNKHCRY_FpsN6qiqlZaKR9YnNe0CbOTP2IPcjCX9EeMiSibFMF0HX7c3CnguLKgh4AxLT-xo-SvfQkIMFmUoRvbrUQMY1PfIH_qvHFDEgcmVDrzbPGtbXSBYHZ445HsHWfvGI85Ibl7XjIK1D5pcPljHqlPxXF2FN-kxYDsPc63cTUT7Iz03YDpjj_1cCmjpwW5hzOznrS_FWjxigf5fj3HrgqyuCo7pfmvN5-52NnCPL0Mau0pGZLGP42jwphi3ryCIcLqj7OUEzvWltfSI7LyZTLo60E6QMZz42byiHv9NwYcF8A6bvdqRJTQVchdw19LrUUXP-ldN8Mq1NxoonCDXGl6meOwoyYpLNTzYuFKfRxsQykyK4sM_cXzNJ8H1fReNI5LdxqMYH0iFkpx5krbC7oFNdYsr3VKcFs4qV9iZfk1AkSOaV64ULSn6WgEfuW-U6kh3S9VW3FO91","https://external.fkhi11-1.fna.fbcdn.net/safe_image.php?d=AQCC-MI-adzekbic&w=540&h=282&url=http%3A%2F%2Fwww.poppyoh.com%2Fwp-content%2Fuploads%2F2009%2F05%2Fc01.jpg&cfs=1&upscale=1&fallback=news_d_placeholder_publisher&_nc_hash=AQA-mFU3HSeoqOBL","Image may contain: one or more people and close-up","彩色隱形眼鏡推薦｜韓國少女時代太妍代言的Déesse女神隱形眼鏡，台灣也買得到啦！","又來跟大家分享、推薦隱形眼鏡啦！！ 各種彩色隱形眼鏡在生活中已經算是一種不可或缺的存在了 你們怎麼樣我是不知道…"
"https://www.facebook.com/poppyohoh/posts/2471601546196438","1567684901","出道（？）以來最大尺度
還請大家多多包涵🤭

 身為一個上半身穿S~M
😱下半身卻永遠要穿XL起跳
臀圍直達110幾公分的大屁人

 夠大件不噴肉又好看的內褲認真很難找！！

 我知道大家關心價格
（我也很關心，沒在穿貴鬆鬆專櫃內褲的啊）
所以先跟大家講價格再講關於內褲的小故事（？）
總之這組價格不貴

 3件大約NT349~NT419而已
👉平均一件大約NT116~NT139左右
❤️優惠網址： https://fanshopping.cc/MJT51

 雖然已是人妻
但整天穿著阿嬤大內褲在家裡走來走去
就算71對我是真愛
久了大概也是會倒胃口

 前陣子F.A.A.D問我願不願意體驗看看他們家內褲
我光看這種性感蕾絲款就有種被羞辱的感覺

 直接他們說：「沒出到XL的話我穿不下😐」

 沒想到他們很帶種的回我說：
「喔，我們有出到XL，」
「你可以放心挑沒問題。」

 就衝著他們這句話
我立馬開始挑款挑內褲

 而且因為近期都流行比較簡約的衣服跟配色
像是白色、杏色、裸色之類的
要是穿深色內褲都會透出來
從今年春天我就採購了很多膚色內褲

 但大家也知道
膚色內褲變成大災難的機率非常高
看網路上纖瘦的Model穿很美
到我們身上就是變成阿嬤大內褲
毫無美感可言啊～

 不過F.A.A.D出了非常多美型膚色內褲🤘
而且它的蕾絲不刮屁屁不粗糙
所以我這次挑了一堆全是膚色、大地色的
穿裸色、土色衣服不怕透內褲

 褲子脫掉洋裝脫掉也不怕老公看了倒胃口🙃

 總之現在限時優惠價
✨3件大約NT349~NT419而已
⭐️平均一件大約NT116~NT139左右

 以這個品質來說我覺得價格很OK
尺寸從M~XL任選，更多實穿大家可以點進購買頁研究

 我自己都很想趁現在有優惠再買幾條
總之有缺內褲的、想換一波內褲的
個人覺得這組很不錯
趁有優惠可以買起來啦！

 ❤️優惠網址： https://fanshopping.cc/MJT51
團購時間：2019-09-05 20:00到2019-09-10 20:00
預計出貨日期:2019-09-30
本團可刷卡、實體ATM轉帳，選擇刷卡成功會有付款完成頁面，選擇實體ATM完成會取得一組匯款帳號，請看仔細喔～

 本團與Fanshopping開團樂合作，若有下單或匯款等問題可同步詢問客服～官方line客服：請搜尋ID:@fanshopping(要打@喔）

 📸Photo by 品君 ：pinchun7@gmail.com","1571064719","/poppyohoh/photos/pcb.2471601546196438/2471593122863947/?type=3&__tn__=HH-R&eid=ARBhmULDgsmXB1jQsm5SwmlncJtYtGMef67lt1wAdXiKwlpjzZKJ8h9fWz8Npsy1kxSwRagMScdg3cVL&__xts__%5B0%5D=68.ARAIGmQXw2IzqUthUWnden_e5ectZhY85M8pGvNoIgnjp3ZAmsy8v0RNAM1g84aKgXeXmKMWk6qeqfzsTdHEJUQQtD9viEQJd-05y5kUDCYrChDhnEJG_KP7lJIclEHhICpHUSJRKzvaTHf-y2Fpt7hpuwsshcWr_D1_gqLgByqpMks2cORBFQWFUtGiakKHv-5tgv-G9lJaklYfPwvfUyMpT3dFGkTU6kdnnRmlrkQVLbYsmWoN2haojJtrW5CsX_kpFqknRzRzVinoWSeiS6lsJ01YtrvbwSs5W1sGmz4eoeN3KXFzf2rDwpXzfKtdnajl8HR3z-VIFyT8FnFufqZkQQ","https://scontent.frix7-1.fna.fbcdn.net/v/t1.0-0/p350x350/69478384_2471593126197280_7952272677442420736_n.jpg?_nc_cat=101&_nc_oc=AQnZIIZpHvHqOJuKhwJ4cGn1FyAQG6kqptXH-TUe2sySKpZcWdiLHLbjjVustrrLbPs&_nc_ht=scontent.frix7-1.fna&oh=6bb606042f19e69bba6dd17ef73cfe59&oe=5E1D2842","undefined","7",""
"https://www.facebook.com/poppyohoh/posts/2398552900167970","1564148806","＊點連結看完整版：https://youtu.be/qQnnn9sPujI
今天這支影片「色彩控」、「香味控」必看！！
不僅要來跟大家聊香水
還要跟大家聊香水跟香水之間怎麼混搭
總之是個讓我超心花怒放的主題啊～

 長大以後真的對香水這個東西非常愛
但秉持一個客家人的精神
對於昂貴香水我真的自動略過
可是香味噁心的香水我又不能接受

 簡單說就是不想花太多錢
但又想要擁有高級香味XDD

 這次試到的香水我都很滿意
算是噁率非常低
而且瓶身不大攜帶又方便（但是是實在的30ml喔）
出門也可以補噴

 算是情人節、聖誕節、生日的禮物好選擇啊！
（重點是價格不貴預算也不會破錶）

 雖然說這邊的短版已經很長
但還是請大家點連結移駕去Youtube看完整版啊！
這樣做是因為臉書又改演算法
要我們上傳長一點的影片不然它又要降觸及率啦
人生已經很難，大家行行好幫忙點閱一下（？）

 大家喜歡什麼樣的香味、或對什麼樣的香味有興趣呢？
也可以跟我聊聊啊～","1571064719","/watch/?ref=external&v=2494660514096211&__xts__%5B0%5D=68.ARCraFz1ZV_CjISrzd1XKNPmMdsGtBoXA2nBOZzcee0lF8kQndfFFJlH_oUf6hQWCRfxi3kuKqpz7Xwkoq9wHho5jd6Ane-fvQ8A1ElqhdYLqKIAnXbc2Ph-KYfBMDN_QnAvka1wugHrxOR3jtMEQ70nvtq_FdrDD7Fc2Vn1jLWaFTdP1AYpdOyE7GIo_3EFAwWJeKpruFHoy4QZOPj3O8lbEXw0bGuGylRHoQPAs7ONvM4lW_gL9-sMrT_R11H727p4KuquxodDFCJlhgLvjN8s3TIWb0T6c9NBERC9fIqo_KQgQgE2Nya0ktSNatreHdCbu3yigAnYOWbFTvId2pwT7GR4lmftTCsgWg&__tn__=kFFHHH-R","https://scontent.fuln2-1.fna.fbcdn.net/v/t15.5256-10/66334882_2494680104094252_7292548877389922304_n.jpg?_nc_cat=109&_nc_oc=AQnbrC-x5_F_Gr-kHlyWOUp4wfHO1f-nnlFdX7eN0zeFU43ayHWEkXHwiTLCosOiNLE&_nc_ht=scontent.fuln2-1.fna&oh=ff9a79509dcbf3bfb2d060a312134749&oe=5E201127","undefined","1+1>2可以混搭的超強香水ft.adopt","Posted by 波痞到底是在幹嘛？"
