url,posttime,text,crawled_time,attachment_link,attachment_img,attachment_img_alt,attachment_title,attachment_brief
"https://www.facebook.com/poppyohoh/posts/2433349233355003","1565866733","解放軍就在邊界待命了
我們到底能為香港人做些什麼？

 而身在台灣的人
為什麼有那麼多還是看不見真相？
當你的言論、人身自由甚至生命都受到威脅的時候
還會覺得自己能夠拚經濟、發大財嗎？","1571064733","/poppyohoh/photos/a.607488849274393/2433349203355006/?type=3&eid=ARA8A-XeS_BoPqBXOB1bFOg8wr-GzAs_7YsMgtl_eg0oc-4TZoaDx55SBchCHWXng45RO-MqnR5Ysu52&__xts__%5B0%5D=68.ARCIJdeB3mUR4uR45Z4jvu-HKRbke9XpiWbJ-y2QKskN5vWlfe5dfXb_xmQcQv161UIpGIXISwKvJEuYJ3asPvrxSBpa2TAorRAq8ErhrrubKK_0DeLHZlsHQUWnHifXsuBA6N1YKJiQF1HqW4ucLjSzy4LSBuPK5a4MHZSe2Nm50WBLCAOJH0bO1yMlw6AIsQnzuURN4aNXiRL66r52QzTd-vrMgI-d3pYVOCsWwcAzTQz2wFc2RFTdtl2JGYhiIGRZnTypORXoeY4zAi74Wum8fSMxrBJxcrK6VDyQOSeyGlCV6t7BkAzpWE8uXRTMiBtTGylG1IP_qgAqo4-KzY6tmg&__tn__=EHH-R","https://scontent-sof1-1.xx.fbcdn.net/v/t1.0-0/s526x296/67939768_2433349206688339_4019082000181755904_n.jpg?_nc_cat=102&_nc_oc=AQlCg1Qn1D_d_oZ8x_DZj4YTinY5kZxJYUAvCqbWcFzZN7l-2yKkqxJZvTLENTrrBco&_nc_ht=scontent-sof1-1.xx&oh=748a566850288e8f10be3b881e62328b&oe=5E253DC7","undefined","",""
"https://www.facebook.com/poppyohoh/posts/2524447357578523","1570095521","還有人不知道九二共識就是一國兩制嗎？

 然後，這就是一國兩制下的香港喔。","1571064737","https://l.facebook.com/l.php?u=https%3A%2F%2Ftaronews.tw%2F2019%2F10%2F03%2F484264%2F%3Ffbclid%3DIwAR1S6QJORZr1uOE_2Nte7iBZZxb64gaSjPlElSNJvQzW0w6EvL94GEXPVoM&h=AT1e2Dx_l_tCsg2fJ2hl8AGIO77U1zsC9kP6sCCcMK2XBpF3lpHke7Nr-Q6PBTos1lVsfr7vacJrGE3VeOJVvTwspJ20zCf4Q3cSOjWS63hm588lXnD0BNic3ROsFz5RteFrKpk0S-U4vmiZhAKykm4b1Sp9y7eBOxvLHTLWbKCBoRXMM779SEY2db8udiQH0sAR8hhS59Rg8r6Q5f9FhZjrHXYAmmvRRElo1nP7bvax0OxKPgKKOe5MZZvFuvew36b2NaJ2aUThIplJ3oUdd7DM7W5-U0z-ND-s4V0MJ0Kzr-SVPsJZMbO-8pq4rfRHy5NpUTmEvE3yuNVpJHgntMc55zcxpjfeeY7dn3QE9vyVRyUVp3bZyvMwTJJTjFC1gW_fvNwN_hp6SOPdFEFcmkd0EJueJ2bbFxhDjbxzBNZ81NjWiIGF7gsN3bFpdV3_ccDarN9AtAb3M-P_H7hmu7GC9WxRkQTJKwoExqrAOUofD3sI7iAwrIr8iS5qg9XDA_oAjMhK45JvwK4rwpCEowC_cpIT5VzNw8GCMXUjOKaAUROFyHMyuz9BBJGZG1uhnp5U4eAepk-HnTQhcUwzCrdt1g4b5l8Pm9XR9SNgg_Oxg3Dbtv7ZoqjpsTYu2yEOc0xVc6ctEm_8MSzS","https://external-sin2-2.xx.fbcdn.net/safe_image.php?d=AQAJ_DvjAQ4PQN6a&w=540&h=282&url=https%3A%2F%2Fcdn.taronews.tw%2Ffiles%2F2019%2F09%2F20190929PHO0112l.jpg&cfs=1&upscale=1&fallback=news_d_placeholder_publisher&_nc_hash=AQA12T1u823-vDqB","Image may contain: one or more people, people sitting, people sleeping, shoes and outdoor","港警修訂武力使用手冊 可用槍械範圍擴大 | 芋傳媒 TaroNews","港媒報導，港警武力使用程序手冊有新修訂版，可使用槍械的「致命武力攻擊」定義，從「意圖引致他人死亡或身體嚴重受傷」，修訂為「引致或『相當可能引致』他人死亡或身體嚴重受傷」。"
"https://www.facebook.com/poppyohoh/posts/2746137912076132","1578730778","緊沾😨😨😨
等下回家我要看公視開票",1579161983,undefined,undefined,undefined,undefined,undefined
"https://www.facebook.com/poppyohoh/posts/2752728608083729","1578977235","今天來店裡喝珍奶了❤",1579161983,"https://www.facebook.com/photo.php?fbid=2439415642975345&set=p.2439415642975345&type=3&eid=ARBeyGlP0Bn8AlW8I8dVUQgBb2KavHumIbQfsL9as7VochQQkizmLGHUvS9KtNfH7rcR6vf7_w7zqZI6","https://scontent-sin2-1.xx.fbcdn.net/v/t1.0-0/p526x296/82802465_2439415646308678_2357364311615078400_o.jpg?_nc_cat=106&_nc_ohc=WJM1pEQxxLEAX9J_vt9&_nc_ht=scontent-sin2-1.xx&_nc_tp=1002&oh=02bca4c413caad8953820a944716c2f0&oe=5EAA2DCB",undefined,"",""
"https://www.facebook.com/poppyohoh/posts/2698236570199600","1576846834","底下文長，哪裡買先放這以免你們找不到： http://w.unt.tw/b4e

 
吸引力法則真的很奇妙，我已經時隔多年懶得擦指甲油，因為擦了指甲油後，一旦落漆我只能卸掉重擦，不然各種保養品、化妝品廠商會單純因為我的指甲不好看叫我把照片或影片重拍，在經歷過這種痛苦之後我已經保持素甲超多年。

 
但近兩三個月又突然覺得「好想擦指甲油啊」、「又怕卸指甲太傷讓指甲斷光光」、「可不可以讓我不要用去光水」、「也不要花時間給人做指甲」總之就是各種想要指甲美美的卻又各種任性。

 結果就在這時候收到了水指彩的合作邀約，你說是不是踢公北聽到了我的呼喚XD

 而且收到的竟然是全台限量1000組的UNT X
貓小姐聯名限量組的水指彩，因為這組真的包裝可愛指彩顏色又實用，我只希望我文章發出去這組還有貨，不要說一發出去已經被搶光。

 
雖然說我本身是狗派的，但各種軟爛的貓咪插畫就是可愛啊！因為它外盒四面都有巧思，所以我照片每一面都有拍攝下來喔，請大家耐著性子把照片看到最後，就能清楚看到外盒各個角度的插畫。如果是貓奴的話，是可以不用仔細看直接買下去了（嗯？）

 在這邊我會花比較多時間分析顏色跟質地，因為外盒大家肉眼就可以看出插畫上面描繪的內容，但這世界上抓不到顏色微妙變化的人比較多，所以讓我娓娓道來。

 （廠商過稿看到這裡應該在想...等等，現在到底要寫幾千字？但抱歉，講到顏色的事情我是不會放過你們的。）

 這組精選了MG145、MG155兩個煙燻粉紅色調，跟有點抹茶感的MG170還有灰可可色MG175四個顏色，都是非常實搭而且有質感的色彩！

 
MG145、MG155的色調比較接近，應該會有些人一時之間無法分辨，如果要概略地講：MG145比較少女感、MG155比較成熟感。深入講的話，MG145的顏色比較淺，而且稍暖一些，真的就是煙燻「粉紅」色調；MG155則是顏色較深、色調稍冷帶一點點紫，要細分的話，比較接近煙燻「莓果」色調。

 如果不是甜美派的人，應該會喜歡另兩個顏色MG170跟MG175，兩款都是有個性但不浮誇的顏色。

 
MG170我剛剛是說抹茶色，但說真的它也不是那麼抹茶，而是有點抹茶色、有點灰綠色、有點草綠色，最後調出了一個不噁還很討人喜歡的中間灰調綠色；MG175則是非常有質感的灰可可色，不是純粹的咖啡色、不是純粹的灰色，正因為一冷一暖兩個基礎灰調混合在一起，才會變成一個怎麼搭都好看的顏色。進可攻退可守，可以很有個性、也可以很優雅。

 
顏色講完可以講質地了，它的質地配上扁平的刷頭算非常好上色，一層就已經滿顯色，而且也沒有什麼刷痕、乾燥的速度也算快。如果要卸除的話，稍微摳一下就可以整片撕起來，也不會撕到甲面。不用拿去光水的感覺真的太好了，不然我好幾次都是出門後發現指甲油太不完整要卸，為了這樣又買一瓶新的去光水。

 當然水指彩缺點是比較容易剝落，如果擔心剝落的話，可以搭配二合一魔幻護甲油（也就是加一層雨衣的意思），這樣會更持久、更容易附著。

 最後還是要再提醒一下，可愛的貓小姐Ms.Cat聯名外盒照大家記得點進去看，浮世貓的小細節真的很可愛。指甲油拿出來後，外盒也還可以收納其他小東西，算是實用小物！

 貓派買起來、文青手繪風愛好者也能買起來！

 #UNT國際美妝 #魔幻水指彩貓小姐聯名 #一撕即卸 #unt_global",1579161984,"/poppyohoh/photos/pcb.2698236570199600/2698235306866393/?type=3&__tn__=HH-R&eid=ARAa9gDQQPVS-HTdp5UlQy_xLhsfOonurbxGPJp872-3eYqne_OmXSuKJo_Fyve4UAlDcsRmi4Pqu9ze&__xts__%5B0%5D=68.ARCROLYPFEWo6eYUOgoEKW-xPsVCKPQIO0sJQYjxWZCkqEPPAD6uW1c7xs2Th0a4stTasthF5YSzW_IzdShOQYK3C9pnCbxj2N_fgen7_c3VzDDdvr9R5SXoluNUNoeuj2ejfPzTAHbAIvTF-w8u1H_Omk3xR5OFivNdPs_iFM7tBPu1jQ0ymJv-vzc4SLdEeM4X4JjhFwO7n1A2mJwDo5UfogGVC1DtM1A-VPkISovdABwBwcNnadaArUi09p-bbJlQbzuayYaPw-UBg_rXdPOTk_hG_zlbbL7KGnv7i9km_dJTj_gPzy2cgLSfQpmWGpCXCrsxSOEP5wx35CplwQ5T_g","https://scontent-sin2-1.xx.fbcdn.net/v/t1.0-0/p350x350/79542298_2698235310199726_506555727154774016_n.jpg?_nc_cat=103&_nc_ohc=7jvsuDScKesAX_rt8W5&_nc_ht=scontent-sin2-1.xx&_nc_tp=1002&oh=40d5c7d6b7f16c7acdafe04f0f229461&oe=5E9D1F60",undefined,"+12",""
"https://www.facebook.com/poppyohoh/posts/2655782911111633","1575278877","＊點連結看完整版：https://youtu.be/XCQxT5wlAMg
啊啊出國回來累到忘記上影片
今天才來補FB版本的影片
YouTube版本昨天在沒有編輯完的情況下首播完XD
所以完整版連結現在點過去是直接可以看的

 沒效率的我終於把4月份出國帶的化妝包影片發出來啦！

 主要是因為我帶的化妝品保養品非～常～多～
影片拍得就是一個落落長
剪完主架構之後連要給工讀生上字幕都有點懶
工讀生上完字幕後我影片還分很多次才看完
就這麼拖到都再次出國回來才發
（嗯，還好今年出國出得少，不然應該更慘）

 反正這集就是一個我東西帶很多
你們可以當廣播聽的狀態
不囉唆，你們慢慢看",1579161984,"/poppyohoh/videos/523586268484890/?__xts__%5B0%5D=68.ARBQN8RaFdiL1A_OeK99yehpdqehyqF7IWyJCjvYumDeZhnoyGpgK13AYp-s8u38wmyBaEZoZK_rPQwoEOvuctdTxwiDNTiKCRCawLsFvgs6iZYIyu419kjWUWa9j230v7gCVoqdKK-9ldfkS-_bdOjne0oFc6gN_p7Ddd0l6Hm91m9X5sM_pnxQo97K06QFRjflFOytJMUwwdLvEIq97vwf1jk8yuKYzmgZh57tEjhv1lIh54E-eSoFsEHJ9U4XnlHwEU8DgOa3EfGNFV0ibZQ4G9-by3n6Ty8Wwa1g_GV9F1rGF-VkTRzBtr4-y9kYIqNgAzc1-b5cnyGrLwXZKEQLftiWV1KPvcvtAuT8DQxzp_OYkrTD&__tn__=HH-R","https://scontent.fbkk6-2.fna.fbcdn.net/v/t39.10505-6/79681133_2335325723446143_3861975283359809536_n.jpg?_nc_cat=106&_nc_ohc=RopvQpbz3GYAX-zJ9DU&_nc_ht=scontent.fbkk6-2.fna&oh=10a2e7cd4eec086a1da580d7f531d997&oe=5E8F3746",undefined,"Watch Now",""
"https://www.facebook.com/poppyohoh/posts/2744079015615355","[Error]: TypeError: Cannot read property 'attribs' of undefined","",1579161984,undefined,undefined,undefined,undefined,undefined
"https://www.facebook.com/poppyohoh/posts/2745781408778449","1578715286","任務完成✅
投完喊個聲🤟

 非導盲犬不得進入
所以我跟我媽輪流進去投
然後我今天怎麼長得那麼奇怪？",1579161984,"/poppyohoh/photos/a.607488849274393/2745777268778863/?type=3&eid=ARBZgVJk4If7lEXK6MjkjvJdVXLCJBZIXEhlYZRCbjYyUI7khGhpv5_YaiqyiOboZO32J1BcE-V05LS6&__xts__%5B0%5D=68.ARCBHOoUFnfaU4wYiflUWRnllT4bmJMUouXuhPITRrnO3twpFLgZC5tVazzcUBFnqakW8DDJT9ZoPZU2eIL5Yi2VP7iAMZZOJVpClAupkD-yn2suK3K3cn7Z6yJH5EYuuf2n1Yg_9d2tw4XQOBxzno7WCM3-EUb_0FqqKdfMFRAvbrQZGtG3UFEIMs02hrL9hxEQEwxLJ7YUXBkNxRj1xfFPY6-13ttYw8Wjhqh5R2LkYRQuQra--GDFEsoNzdcwjEyDOVHX9Ys-oId8v_CkEoGh75_Vqry-Rn5QJrTrN2uJIKtXQh98oNYSyDynksqq5LAu5Ekjvi9y5UwTTUst-XMIWQ&__tn__=EEHH-R","https://scontent-sin6-2.xx.fbcdn.net/v/t1.0-0/p526x296/81813349_2745777272112196_4690174183529775104_n.jpg?_nc_cat=102&_nc_oc=AQkO8iGJGhKmTwgLZxXTq_LZEAsPZTiyRN9wus7ZzJnoN3N00iHERnZ60pgu5IDA21c&_nc_ht=scontent-sin6-2.xx&_nc_tp=1002&oh=f226ae8d41feebd62f2157ed81132455&oe=5EDB06DF",undefined,"",""
"https://www.facebook.com/poppyohoh/posts/2637677392922185","1574600175","超強卸妝巾年度最優惠團購
只到12/4，這個價格錯過等明年真心不騙

 🔺哪裡買：https://pse.is/FQMR5
最優惠的組合比市價便宜1078元
點進去購買網址、申請加入才看得到價錢喔～

 有沒有收到貨的網友
趕快來曬一下好評

 直接快速整理一下它的優點
✔️使用方法超簡單
✔️沾水就能卸
✔️沾溫熱的水更好卸
✔️不需要瓶瓶罐罐
✔️手濕臉濕也能卸
✔️一邊洗澡也能一邊卸
✔️超輕便、外宿攜帶方便
✔️敏感肌也能用
✔️不致粉刺、深層清潔毛囊
✔️拿來卸身體防曬超省錢
✔️一塊可用3~6個月

 🔺沾了溫熱的水以後，稍微把它擰乾
全臉輕輕擦拭，就能把妝卸下來

 不管是持妝款粉底液、遮瑕、蜜粉、腮紅、唇膏
還是眉筆、眉粉、防水眉膠、染眉膏
都能非常輕鬆就卸掉！

 詳細使用方法可以參考影片：https://bit.ly/37HVxu2
完整直播：https://bit.ly/33bdpd3

 艾美肌的卸妝巾我用了一個多月
完全不會造成任何過敏的狀況👍👍👍
倒不如說膚況反而變得比之前更穩定
超級敏感肌在這邊認證
敏感肌使用也是OK的（落淚）
當然也不會有殘妝
卸完皮膚超清爽無殘留感
所以也不會致粉刺、致痘痘

 這麼優惠的價格，錯過等明年
我自己也是趁這檔囤貨囤起來",1579161984,"/watch/?ref=external&v=2659290167427202&__xts__%5B0%5D=68.ARBujtKO-DTJ6uD1-I89nmbphy7PjpLO3Se9OMs7kv79Ce4eiLhqbaRwU-OeFF1zpswizYBdIHqFe88e2RZkVEMpWpzM9OFmqNwSoxRb-g3Z0nHkTdyCityFRHzk6f1AIk4banAVUJ7RANiYvBu1RIdVSICs5W_njwchHdSM66BoEH1IpZpo8v8dwv_uTIo1kDGImkkxB6bP8V4PLORYsuqLlNQ3McZuhTZ3jNUdnx-WRSWHOvHk9bLT25S4Ybl4quxtZ9IalzMYSQqgG09L3fdUPTkSfo4vNzPjcNUhvm5fU2cBP1SuU__Rjwx_h2sjexWtxNgybAniLr30kVYnlJzBKvJzo1IBoN2EfQ&__tn__=kFFHHH-R","https://scontent-cdg2-1.xx.fbcdn.net/v/t15.5256-10/72163195_2659296047426614_8725869559594090496_n.jpg?_nc_cat=100&_nc_ohc=s0Dq0f-gaS4AX9ZUkEK&_nc_ht=scontent-cdg2-1.xx&oh=da2a9bb6778054944c6465ad58784bfa&oe=5EA15DE6",undefined,"超強卸妝神器，快來一起曬好評","Posted by 波痞到底是在幹嘛？"
"https://www.facebook.com/poppyohoh/posts/2638377366185521","1574672453","我人生中沒看過這麼扯的組合啊！！！

 都說了11月就是個廠商會自動把折扣送上來的月份
但這次醫美品牌霓淨思的優惠太扯了
明星商品玻尿酸保濕原液買就送洗臉機
另一組竟然還送法國特福不沾鍋！！

 優惠先來，大家可以看完有多划算再慢慢看心得
性子急的人就可以直接衝下去了

 💙組合一：#玻尿酸保濕原液155ml重裝限定組
https://bit.ly/35s8kyu
內含玻尿酸保濕原液115ml大瓶裝+20ml小瓶裝兩瓶
再下殺NT$1,111
平時30ml的玻尿酸保濕原液就要NT$1,650囉
（整組原價要價NT$9,880，現在下殺12折，現省$8,769！）
再加贈音波雙效潔膚儀（粉色/藍色自己任選）
廠商賣這組真的是在做功德吧

 💙組合二：#玻尿酸深度潤澤三步驟組
https://bit.ly/35mZzpy
內含玻尿酸保濕原液30ml
玻尿酸深度潤澤化妝水200ml+
玻尿酸深度潤澤霜50ml
加贈Made in France法國特福28cm不沾鍋（粉/藍隨機出貨）
下殺29折只要NT$1,511（別的我不說28cm特福不沾鍋市價最便宜也要千元上下啦）

 好，大家看完價格可以來冷靜看一下分析了
（還是說大家已燃起熊熊大火，沒人要理我？）

 前幾天剛好有朋友問我說霓淨思的產品強項是什麼
我就總結了一下給她：
「保濕度夠，但不會油膩，很適合台灣的氣候」

 而且今天分享的這兩個超值優惠組合裡面
都有霓淨思的明星商品「玻尿酸保濕原液」
在醫美品牌的保濕精華裡面
網路上大家最推 真的就是霓淨思這款！
（不相信可以去google看看，沒跟你們亂說）
他們家保濕原液的保濕力度非常適合現在乾燥的秋冬
這十年來各種保養品用了這麼多
總歸一句就是保濕做得好，肌膚沒煩惱
更何況它又保濕又不油，不就更加分？

 💙加上它用法也很多種
可當作精華液使用
也可以混搭乳液乳霜
大家可以點照片看我的用法教學
所以現在有超殺優惠價
真的沒有不買的理由啊！

 而且因為它的濃度真的很高
所以用量其實不用太多
💙大概1~2滴就可以輕鬆塗抹全臉
雖然一開始感覺有點稠稠的
但一下子就整個吸收進去了

 這邊也提醒大家
使用前一定要先擦化妝水
因為玻尿酸需要水來引導哦

 聊完玻尿酸保濕原液可以來聊別的了

 玻尿酸深度潤澤化妝水
我覺得優點是吸收非常快
皮膚表面完全不黏
算質地清爽、但效果偏滋潤

 玻尿酸深度潤澤霜真的就比較滋潤
適合天生乾肌或是比較熟齡的皮膚
以我超乾肌來說會覺得吸收速度算快
長時間的保水力算很不錯
幾個小時後也不會覺得皮膚變得乾燥

 三款產品都沒有明顯香味，這點我很愛
現在進入11月尾聲，天氣明顯變涼
用「玻尿酸深度潤澤三步驟組」真的剛剛好
開始有脫皮起屑困擾的人，這組推薦給你們

 以上保養品講完了
可以來聊超有誠意的贈禮了
潔膚儀算是升級版的洗臉機
💙因為是洗臉、保養品導入兩用
所以兩面的刷毛、顆粒稍有不同
溫和不刮皮膚的橡膠材質用起來很舒服
還有不同波段可以選擇
重點是買就送
完全是以非常划算的價格
獲贈一隻雙效洗臉機

 最後...
法國特福Tefal 28cm的鍋子有夠輕啊！！
超讚的欸拿起來完全不吃力
💙大小剛好就是大約2~3人份
身為廢婦的我非常喜荒

 總之你們趕快去搶啦
這種優惠，搶不到不要跟我哭

 #玻尿酸保濕原液155ml重裝限定組
贈潔膚儀>> https://bit.ly/35s8kyu
#玻尿酸深度潤澤三步驟組
贈鍋子>> https://bit.ly/35mZzpy",1579161985,"/poppyohoh/photos/pcb.2638377366185521/2638373332852591/?type=3&__tn__=HH-R&eid=ARDQfz7DbIkcoMCd4eTnLeXuBW5LRo2y5ir0FdzbQILTpbe5Rp6nnBJFUfZSlJkWNgxpk6NoHdtrlSxb&__xts__%5B0%5D=68.ARDFozb8QwkpCG1j107OcGkU3IHAla72eA3R_Gqom3bMv8X5sn0kC4aZAxU_ua12p7Sb0jXiJm-Xkdh7YlEaC_Sx0HhXzCxuQqKBnd8CNH3jMX79iYWOOlvqHEi3TMMFQgm1xb2qGtFBzgjx3-5cnHxmLWvnx1pnpauiPCTe-h8kRoXU2sYsTE-pbFhTeiKm1hyEX8xG5FQ8Lfp0F8U6_5LqqtB50yBBrflPEJAxrO2UsNVTJVS8bRuiyVxvHXrusVMRRlU81Kgpt8G7WP6ZwThgdyRodw4IGht5JiZbSA-1LkDryDTmJFyf--GqW_uoLROOA-iEDP0dgdUQJLHDdKFRxA","https://scontent-cdg2-1.xx.fbcdn.net/v/t1.0-0/p403x403/78268390_2638373336185924_2738556308541145088_n.jpg?_nc_cat=105&_nc_ohc=PJtopvRcT8kAX8wJgWO&_nc_ht=scontent-cdg2-1.xx&_nc_tp=1002&oh=bcbd1e7ec849836a647a057ad1fcb374&oe=5E99D2EA",undefined,"+8",""
"https://www.facebook.com/poppyohoh/posts/2735892016434055","1578328650","嗨，我是波痞，今天又來深夜長談了！要來聊一個因為沒去投票，結果後悔莫及的故事。

 🔺1/11，回戶籍地投票，記得攜帶身分證、印章跟投票通知單。

 
2012年的我，雖然已經大學畢業、剛出社會，但因為是年底出生的關係，別人20歲就可以投總統票了，我硬生生錯過前一次，要再等三年，等到23歲才能投，所以當年的我還是首投族。

 但我後來非常欣慰我因為年底生，2008年的時候我沒有投票權，這個故事我們後面再說。

 
2012那次總統大選是馬英九與蔡英文的雙英對決，馬英九是要爭取連任，蔡英文則是第一次參選總統。經過了4年的任期，其實我也知道馬英九做得並不是那麼好，雖然畢業於現在被稱為綠色網軍大學之一的學校，但深藍家庭出身自認為中立理性選民的我就是覺得民進黨我投不下去、蔡英文我投不下去！

 
看到這裡應該很多人會覺得我是外省家庭，不是，我只是客家人（但也請大家不要因此針對客家人去罵，這個就留給客家人自己去罵客家人吧，其他族群你們插嘴是不會有好事的），而且我家其實有千千萬萬個理由不應該支持國民黨，但大家就是死忠的要命，現在的我也很想知道是為什麼。

 
總之，因為我覺得馬英九其實沒有什麼讓我支持的點，但蔡英文我又投不下去。說真的我不想背負這個責任，我不想要負起那個「我選了這個人作為中華民國總統」「萬一他做得不好我該怎麼辦」的責任。

 2012年總統大選，我沒有回去投票。

 
身為一個從小莫名對「國家」有狂熱的人，其實我心裡是覺得怪怪的、覺得自己好像沒去參加學測的學生、覺得自己好像隱隱約約會需要負一些社會責任。但同時又覺得，同年齡的人裡面大家也都不關心這些事，這些候選人到底有什麼政策、到底做了什麼其實我也不了解，不去投票應該也不會怎樣吧？

 2013年苗栗大埔張藥房被強拆，我所知道的民主好像不停在倒退。

 2014年爆發了黑箱服貿的事件（服貿完整名稱是《海峽兩岸服務貿易協議》），只要通過了，美髮、餐飲、印刷、旅遊等等產業都可能會中國的人員以及企業攻佔。

 
太陽花運動324衝行政院那天，我在家裡看著電視轉播，親眼看到認識的學姊因為靜坐抗議的被警察拉在地上拖行，當下我的眼淚真的無法克制一直掉下來。更恐怖的是，隔天的新聞畫面，完全沒有這些靜坐民眾被拉在地上的畫面、沒有被打到頭破血流的畫面。

 這時候我才突然驚覺：「欸欸欸欸欸？不對欸？台灣好像立刻就要賣掉了！！！！！」

 我才突然驚覺，雖然我覺得是個愛國好青年，但我根本就沒有在關心它。

 我才突然驚覺，原來我沒去投票、放棄了自己的權利，卻也還是要承擔責任的。

 
自此之後，我真的認真關心我在意的議題、真的去深入了解台灣這塊土地上的事情，才發現原來很多事情跟我認識的不一樣、跟我知道的不一樣，跟課本上的、跟電視上的都不一樣；原來是「中國」不是「大陸」也不是「內地」、原來「中華台北」是這個意思、原來我們的憲法內容是那樣。

 我1988年出生，自我出生台灣就已經是解嚴狀態。有記憶以來，選舉的造勢活動、宣傳拜票就是理所當然的事。

 但長大了以後我才知道，其實我們的長輩認識這些事情的時間，可能不會比我們多多少。

 
他們爭取了很久才有這樣的選票，所以他們對選票非常珍惜（但會不會用自己的選票把自己送入火坑又是另一回事了...），而我們因為出生就知道享有這樣的權利，反而不那麼重視這件事。

 從2014年開始發政治相關貼文以來，每一次都會有人跳出來嗆我、酸我、威脅要退讚等等（而且要退讚還都一定會先講，我都說要退直接退，不要讓讚數在那邊跳恰恰了。）

 🔺但你們知道嗎？我比你們任何人還希望我說的都是假的。

 
我寧願我說的是假的，某個政黨不會賣台；我寧願我說的是假的，中國對我們只有友善沒有侵略；我寧願我說的是假的，香港的事情只是一些暴民在搗亂、海上的浮屍也都是自殺的；我寧願我說的是假的，幾年過後台灣還會是台灣。

 但如果是真的，我知道是真的卻沒有為此發聲，我會恨自己一輩子。

 德國人1932年投票時，納粹是最大黨，他們下一次選舉是17年後；捷克人1946年投票時，選了共產黨，他們下一次自由選舉，是44年後。

 國共內戰於1949年結束後，在共產黨的統治下，中國人到現在還沒有投票權。

 1/11，回戶籍地投票，記得攜帶身分證、印章跟投票通知單；我們一起捍衛台灣，在此之前我也捍衛中華民國。",1579161985,"/poppyohoh/photos/a.607488849274393/2735890436434213/?type=3&eid=ARD34nyA5T5S_71rI_G2KorXmfC0uOvqtny0j3XtfhSDXlnr3OwrUWlgd1L6RB-O_OkUZVlt0zDCNJ4d&__xts__%5B0%5D=68.ARCOBanEHdZ8JwsP8t96slKZBvcvq0_bgsvg9o7Yym_i3tznlJhlVzOe-fslzzVKTdDp5NkSc_86N-SR_J7_5q4hXDbOjUSfeSxBtL0r-ZuVCrJ2axZRhoDnFoyYam9x7m7PIP-8q0F6OpoWTlzdkZaSEfMX1DwEPClCWXsnndxZodgUQiUQWtPHi7iCu-EFtY4FEqTLrtDG40PEzx9A1KY2XNOX9qJnugG7J_9H0BfQFiVRcEir9sIarHeUnn397lNDOBMiQ0oPpCKciQTP2SqDlA8L0EM7Ft52dtnpoK7cLBybyRIWZXsNEST_DVgDhGxZxn_iDUlJSQBmDF85RLo6pw&__tn__=EEHH-R","https://scontent-cdg2-1.xx.fbcdn.net/v/t1.0-9/82436802_2735890439767546_8974112536089591808_n.jpg?_nc_cat=103&_nc_ohc=GxhgeRpUhOEAX-fDQ0C&_nc_ht=scontent-cdg2-1.xx&oh=a7c83d06de41029e1a7dc015deca04a1&oe=5ED84085",undefined,"",""
"https://www.facebook.com/poppyohoh/posts/2742818652408058","1578599401","夜深了，這幾天能拉的票拉，能催的催，只是希望週六過後，台灣還是台灣。",1579161985,"https://www.facebook.com/karma.dawa.7?__xts__%5B0%5D=68.ARCa0WR9FWGM2bodvyl3J1wCT6dtaTbfyat07zn_kZX3CHhZtBhtaQPZfAA5LsoF2_FKPEQR1Xsc_1vq2UmpD5HRZUgmgpKpp3VbINrQZBknozzs7lRX9OP_Y39KkLY5Q33ApUO8u22yf_jPguOXiuRkDsBdViLX_gBMHG686Ag8fyHxxoi37JfbTRk2CvBq3N63GRGsC6bq-ms9ifiQ1WGnzqyIrq3U1Jv8_yDDM-z9fwi9CG2tcy-aeBqoi9d0YIAXvU3_SBa26yf9m98bOjTuouTbCvtw1cInofRqkGKDVC5ECuz0dxBoF-FZeHHpIPv4ckSttRNM-D_zn5v-WjZh_VeHQdOiGvU&__tn__=kFFHHH-R","https://scontent-sin6-2.xx.fbcdn.net/v/t15.5256-10/72356615_1769620806505159_2186601385498247168_n.jpg?_nc_cat=109&_nc_ohc=VW2a9pVimwEAX-2NU22&_nc_ht=scontent-sin6-2.xx&oh=1af1404b075b0ffdedd13d7446910ed1&oe=5ED91506",undefined,"杜汶澤","1,344,246 Views"
