url,posttime,text,crawled_time,attachment_link,attachment_img,attachment_img_alt,attachment_title,attachment_brief
"https://www.facebook.com/udnip/posts/2683356225064195","1570834801","#社論
長照大撒幣，選票大勒贖

 
最近蔡政府與韓國瑜國政顧問團展開了一輪長照政策的攻防，雖不免政治口水噴濺，但總算是二○二○總統大選比較像樣的政策攻防。諷刺的是，稍早衛福部誇稱長照基金收支無虞，為政策背書；但近日重新評估報告出爐，卻稱基金八年後將破產。這不啻是對蔡英文的長照政策打了一耳光。

 
長照二．○是蔡政府重要政策，蔡總統藉著選舉行程拜廟跑攤，也不斷宣稱未來將啟動長照三．○。但一回頭，蔡英文卻驚覺長照二．○其實還有大洞待補，急急由衛福部端出長照二．○「升級版」應景。九天連釋三利多，大撒五十億元，宣稱要讓近廿五萬人受惠。

 
韓陣營批評長照二．○有多項缺失，包括：財源不穩、投入不足、涵蓋不足，且常有中壯年為照顧親人而離職的問題。韓營主張，由勞資與政府各出一部分錢，民眾每月多繳一個便當錢，推動長照保險。對此，衛福部長陳時中跳上火線回擊，指韓國瑜的長照保險要「一個便當五百元」才可能做到。

 
對民眾而言，什麼長照二．○、二．○升級、三．○，甚至長照二．○裡的ＡＢＣ三級照顧，聽來都霧煞煞，也難以比較蔡營「長照稅收制」和韓營「長照保險制」的優劣。但是，韓國瑜的一個便當錢，大家都聽得懂；唯陳時中為他倒油撒鹽加肉炒成五百元的便當後，不免也讓人心生疑惑了。

 
蔡英文自顧自大談長照二．○或三．○，但民眾最在乎的，不外要看得到也吃得到。蔡政府急著在選前撒錢補破網，正是因為長照二．○涵蓋不足，甚至還有「長照棄民」。即使大肆撒錢補網，也難掩配套不足、人力不足及財源不繼的問題。

 
事實上，長照二．○一開始就被意識形態化的社福思維綁架。蔡政府除在政治立場上不願承襲馬政府的政策規畫方向外，在意識形態上，也擔心長照保險可能流於商業化，於是推動在稅收制基礎上的社福化長照二．○。同時，又堅持「在地老化」，於是被汙名的「機構長照」注定遭排擠。亦即，長照機構的住民形同被長照二．○遺棄的二等公民；他們哀號三年後，終於成為蔡政府長照二．○「升級版」補破網的對象。

 
從長照公共化和反機構化，到補助機構住民和外籍看護工家庭，名為長照二．○升級，其實就是長照髪夾彎。原因是，被神化的在地老化，被錯置的長照經費，被擠壓的照護人力，讓有些長照家庭被壓垮，讓機構住民被遺棄，也讓許多長照需求家庭看得到、吃不到。如今大選近了，這些長照的「棄民」總算被想起。於是，在蔡英文四處嚷嚷的長照三．○之前，先搪塞一個二．○升級版。但此案未經協調，也缺乏配套，地方政府跳腳，經費與人力從哪來？機構住民也儍眼，原來四年就斷炊，除非讓民進黨繼續執政！這擺明要民眾拿選票來贖長照，才保證繼續撒幣。

 
蔡政府大撒幣補破網搶選票，卻不敢面對長照二．○背負的偽善面具與道德包袱。長照二．○的主要財源中，遺產稅被譏為「靠死人養老人」，菸稅則陷入「希望民眾多抽菸」的錯亂邏輯。尤其菸稅的直接效應，是菸價上漲激怒選民，迫使蔡英文要求菸酒公司生產低價菸。間接後果，則是免稅價差誘發犯罪，甚至釀出國安私菸醜聞。

 
更大的問題是，蔡政府不敢承認長照二．○的財務隱憂。但衛福部不否認長照二．○升級版可能在四年後斷炊，長照基金則可能在八年後破產。財政部更打臉衛福部，指出財政紀律法限縮長照財源調整彈性，甚至甘冒大不韙，建議研擬改採「長照保險制」。

 
韓營主張的長照保險制，能否以一個便當的錢，把長照辦得像全民健保那樣受到民眾肯定與國際推崇，還有待論證精算。但蔡英文的長照政策仍然在意識形態與選票利益之間擺盪，那麼不管叫二．○、二．○升級或三．○，民眾恐怕只能隨它任意喊價，並接受選票勒贖。","1571643254","/udnip/photos/a.216583458408163/2683354311731053/?type=3&eid=ARARoY843S9EGfx499ypd6KH5noP5SW6-rh2FI5112bz3FrCbC8Xk2nPKx28lP0LViqO6wmqD1oAE1FE&__xts__%5B0%5D=68.ARCGXH4dJZll0qHBhkbTEdtv3jx-k4yaTIjaIkB-W7C22-s0K6PPtqe2Rbx5hRUKRCIj86xqKvv8VJZV4hnBRkTLAc4EDjobBsD-1_I2fdJdWJ1RLBZYJppPeH4h89kdLlG_FG5_FJIiF19jQYSxNnUyosYw3cdYRow6sDtBSDOlzA-2OyhK7xfyS5j14MFIxbwt_N7Ux1bNsw9c19j-31Ck-duhaSsXwqMQUrD1BNOZJ9H-1P1uVZ-oaOGF1tJiHO6vSmcQEYN4R3HBOX6f7On7TaTbjwGJLyDXdrIjRoKLr0noqlIm8Aa7JGcc_sMuV0Ms6XmElHH8fIxCwdye63dr1w&__tn__=EHH-R","https://scontent-jnb1-1.xx.fbcdn.net/v/t1.0-0/p526x296/72087944_2683354318397719_649471992289820672_n.jpg?_nc_cat=104&_nc_oc=AQleRjWg3-6G_4tRSApfhq75bLCQ3zU5By4QOJcZ12Wd_-ryvWjDHxmF-y6AbkEqhYM&_nc_ht=scontent-jnb1-1.xx&oh=c5e6627bcda914692c8d163c03089e32&oe=5E2A31E9","undefined","",""
"https://www.facebook.com/udnip/posts/2677381648994986","1570586400","誰捍衛民主價值 誰操弄民主價格
汪志雄／芝加哥大學教授（美國芝加哥）

 香港歌手何韻詩持加拿大護照來台，参加聲援反送中的活動，遭反對者潑紅漆。一時之間，台灣應該如何看待香港的民主運動，又成了朝野熱門話題。

 香港Ｍ型社會的經濟發展，造成世代價值觀的衝突與轉變，孕育了港人對民主的強烈渴求。目前持續進行的民主運動，必會影響香港未來的政治及社會發展。

 
我們百分百支持香港的民主自由，但是也百分百鄙視企圖利用這場運動獲取任何政治利益的人。我們支持香港人堅定和平的表達他們捍衛民主自由的決心，但是不鼓噪少數年輕人暴力抗爭的行爲。因爲除非我們自己能夠站在第一線吃子彈吸瓦斯，不然買防彈衣送防毒面罩，叫這些年輕人去衝撞抗爭，那是最無良的政客。

 
六四天安門死在坦克車機關槍底下的青年學生，至今沒有人知道他們的名字，但是那些學運領袖，到今天仍然在吃香喝辣。太陽花鬧得轟轟烈烈，最後也只讓一些帶頭的坐收了高官爵位。民主的價值跟價格是截然不同的，有人捍衛民主是因為它的價值，有人操弄民主是因為它的價格。凡是利用年輕人獲取任何的政治利益，都是最廉價的政客行徑。

 
對於香港，我們哀矜勿喜，但倘若有人巴不得香港越亂越好，那都是為了特定的政治利益，絕非為了香港的民主與自由。兩岸關係為重中之重，要深思謀慮而後動。反中不等同於護主權，和平不等同於賣台灣。與統一最遠的距離就是堅持「中華民國」，反之模糊曖昧的「這個國家」只會升高對抗，置台灣於險地。兩岸和則兩利，亂則兩害。從台灣看香港，一個睿智的領導人應該要讓人民體認，繁榮的經濟，成熟的民主，善良的文明，才是保護台灣最有效的武器。","1571643254","/udnip/photos/a.216583458408163/2677381195661698/?type=3&eid=ARD_9zHqXKAVLI9h44mxtmTj_N1wt0Yux2Jo5OhjLXNyT0OgEPXgUmIsfPKQ42M5oGnxreGYLBjwvW79&__xts__%5B0%5D=68.ARDG4MrryAkwDngYWCMEURCwnn5zEpia2oNoTk5wKtd1tuYj3uUKsCVWODjz2VUZIfRN3sg6a4S2CL00Mw4l0vDdREq8dv29M47Ld5iw6jg52gFvMm4MFlthvFpjJ-mGVWlz0tUtj_HJWO5fByNSN5IIHOLd96KN6OHHploxXw-VowYIWkPiQgHjNMC3Mt8cs7PF_AcZ_0wLUxVDtyjipLiOe_wWCzLnRxGZdQNUPqDystCEXz5hg_uKM2XiGYCGsNyuDgLO0hBTNySfkJWLMkYJ3zZ39s0dIe_-rUW-Q-Hm3cjOFnXkVr8nZ3qBKHFjjUpNJtHspqXXUIsNmMnk5_l23A&__tn__=EHH-R","https://scontent.fguw1-1.fna.fbcdn.net/v/t1.0-0/p235x350/71961818_2677381202328364_1869979445863907328_n.jpg?_nc_cat=105&_nc_oc=AQmkH-Rt9-GUJPkqxpi5CHjbPSXAxEkuV9E6ooED1N4Bz1AocFaoiIQuAqREa5R-O8k&_nc_ht=scontent.fguw1-1.fna&oh=78a5574b02e1156322b04bd3592db633&oe=5E2ADD2E","undefined","",""
"https://www.facebook.com/udnip/posts/2693889460677538","1571196948","https://udn.com/news/story/11091/4106849…","1571643254","https://l.facebook.com/l.php?u=https%3A%2F%2Fudn.com%2Fnews%2Fstory%2F11091%2F4106849%3Ffrom%3Dudn-catelistnews_ch2&h=AT3mx7ReSUphS8kFIUykV0EGqplKlt_2lzYc1xDY9ZSAbWqtbclLcjj0jk1PnKarPYLw1MLAjqjf2fh5Xi42YnMfqGyw6wMcNX5BqjwTq8IjJDYWiI37b8qZDHLw4y32gNqhylpgNGzwjCpqWc4EH1jlKME26G0lrJ-DA-XwLXaNLy6BtraThqTYo51wk0H3DccxEaxDEk3UMFaMhx60MnEuzSNyB2pUab1PvNGG-PNWwvjwGcS2s7fbbSfF1_KxSqKGBt70YnzYp7Y2cWgpcOpqBuMbW7YcqsyjqGjzLo9Bq56OhFPt-aefDSxWJEqMSnm8TIKb6I_levHMgBM4EKOmqU81UbABfMzLVCvYz14_wlm089P_5MrFdkaNANEVs8KgA5FClBJkGHuWaiAgNGE1ZfGmbNP-pfIoUkxTQvZ7H2_WhEVexh3N3Rj9AjLzbQMfuL3SEJRYREEAGXG7uGAmRNcnczpp_ALeOa-CWPw51jorU3bwNJwqIOBLtV5my5ypbfLmxLeyR0MNg9at3sqj1sD35uGGgL-l4_GZ1u_Lbre6TTf4tsjyEh4nnX9OhQaJlctnSvyeOOtmhbxsk-zjkWBm8FYFQHcq209Jpe7m0xozEdNMDG9lIovkkfjq8r_HXwwDCEZTD4RP","https://external.fssa17-1.fna.fbcdn.net/safe_image.php?d=AQATTihwnp1facSI&w=540&h=282&url=https%3A%2F%2Fpgw.udn.com.tw%2Fgw%2Fphoto.php%3Fu%3Dhttps%3A%2F%2Fuc.udn.com.tw%2Fphoto%2F2019%2F10%2F16%2Frealtime%2F6946377.jpg%26s%3DY%26x%3D0%26y%3D8%26sw%3D1049%26sh%3D698%26exp%3D3600&cfs=1&upscale=1&fallback=news_d_placeholder_publisher&_nc_hash=AQDCYj6gnU58wnBs","Image may contain: one or more people and closeup","【重磅快評】桃機新航廈難產 看蔡總統自誇四小龍之首 | 聯合新聞網","蔡英文總統昨天在地方跑選舉行程時說，台灣今年經濟成長率領先新加坡、南韓與香港，這是靠她三年多努力改變經濟結構讓產業轉型，..."
"https://www.facebook.com/udnip/posts/2689691621097322","1571119200","小英路線不足
藍營應堅持「自主中華民國」

 吳展良／台大歷史教授（台北市）

 總統蔡英文10日的國慶談話中表示，「中華民國台灣」六個字，既不是藍色、也不是綠色，這就是整個社會最大的共識。 圖／聯合報系資料照

 
蔡英文總統的國慶講話，多次強調「中華民國台灣」，也多次肯定並使用中華民國四字，這對綠營而言，是很重要的往中間走的一大步。這固然能爭取到許多中間選民，卻加深了原教旨獨派對於蔡英文的憤怒。領導綠營的蔡總統能夠走出這一步，相當的不容易。

 
蔡總統往中間走了一大步，但藍營卻未見重要人物有適當的反應。長期以來，尤其是這一段時日，人民對於藍營的最大批評就是未曾堅守自主的立場，仰中共之鼻息，容易將台灣送給中國大陸。是以藍營今天最應該做的，就是堅定「自主的中華民國」路線，並指出小英路線的不足。

 
小英路線的不足，在於他的中華民國只有台灣，不接受一個中國的原則，將台灣與中國對立，從而將兩千三百萬人置入險境。既然中華民國只有台灣，那何不改稱台灣共和國？既叫中華民國，又叫台灣，請問其領土與疆域為何？如何處理與面對中華民國的憲法與歷史？

 
「自主的中華民國」路線主張中華民國的領土主權及於全中國，但如今治權限於台澎金馬；與中華人民共和國有重疊的領土主權訴求，但彼此承認對方的治權。任何侵犯威脅中華民國治權的行為，皆為中華民國所不能容許。任何侵犯威脅中華民國治權範圍內的中國領土主權之行為，將直接排除，此外則暫由中華人民共和國處理。如此兩岸同屬一國，但有分別獨立的治權。可以確保雙方較穩定的基本關係與情感，以及各自的安全與發展。

 
藍營一向的問題，在於或者沉迷於過去，或者不敢挺起脊梁，堅持中華民國不受中共操控影響的自主路線。如今香港問題已充分證明中共的「一國兩制」在台灣絕無市場，台灣必須更自主。長期倡導獨立或盡量分離的綠營既已經向中間靠攏，可見中華民國四字的必要性。面對內外局勢的巨變，藍營豈能無所作為，不堅持「自主的中華民國」路線，任中華民國繼續沉淪？","1571643254","/udnip/photos/a.216583458408163/2689691127764038/?type=3&eid=ARD3TLNTOkrdgo0ET9ps7rHHa59E968-EVMftPte9oyQ6r3gDR0164KOZdVJeOc5XMOgXd_obC7IK-Is&__xts__%5B0%5D=68.ARB3S7ywt8mIiAYL9SuVCZAgwuU6MugvXSDh17hFV3DGr87vPbFDhs_s2H_sUlHsQiXcGi6zvyN2BkS6FJLW6C53YiRc9_2CxlxDMs2c64xRkLEtWaOBNnyaf_YGxfOSrBZq5eDdadfPa9U_ZnAS0rkac-kE_K2ff2-uzY5ZwZ7Hj48GgbSsC2owpEnv48Lis5vlfdbwC3cQVsx4X7AAqw-Kl4fe9RB-AArkP5cp9311NVD43s6MRFwNzjc7NLmtAZak98FSMG-qSXt03hyWhwvaPShQk8L1Ev0DwNUi2gGFZG2IoCNi_gIUsLcMNZiPjXV1uC8yXNGKmtZ9YZvYQQ8Scw&__tn__=EHH-R","https://scontent-sin2-1.xx.fbcdn.net/v/t1.0-0/p526x296/72942490_2689691134430704_9212484410723532800_n.jpg?_nc_cat=102&_nc_oc=AQm3BDte5ZxMYIoW8n2cKM-2b_Dge9z_Icg3mNqzqEeYyfSDL_UUIeytfMDM_WGSd1E&_nc_ht=scontent-sin2-1.xx&oh=36fa79e8f0140b211c63172a95ebe578&oe=5E5EB3B7","undefined","",""
"https://www.facebook.com/udnip/posts/2677405852325899","1570590001","橋梁檢驗左手轉右手 可靠嗎？
陳立業／大學教授（台北市）

 南方澳跨港大橋斷裂事件，情節猶如電影般驚悚，更造成橋下多名漁工傷亡。南方澳大橋事件實足以徹底檢討現今工程界之問題與迷思！

 
首先，以管理概念而言，南方澳大橋之管理權責單位竟為一個與工程完全無關之主事者，且對工程專業度及關注度近趨於零的台灣港務公司。不但如此，交通部橋梁相關檢測亦屬與土木工程關聯性極低的交通部運輸研究所業管，在管理邏輯上產生極大的問號，不諳專業該如何管呢？

 
當我們責怪港務公司的同時，試問我們國家對於公共建設使用執照管理，甚至堪用度揭示管理全無，工程監管單位恐亦責無旁貸！建議所有工程比照我國電梯管理模式，每年進行檢查、核發並張貼使用執照，並清楚設定中央與地方的管理權責單位。

 
光有前述管理尚嫌不足，公部門經常便宜行事，工程驗收點交，以所謂「第三方」檢測機構辦理，且為數不少由承包商自行付款繳驗。在這個生態鏈下，承包商自行成立檢測實驗機構，或是長期與固定業者配合已不足為奇！尤其在這樣的環境前提下，檢驗制度左手轉右手、工程品質堪慮，且檢驗公正性備受挑戰！

 
基此，建議將工程或更專業的橋梁檢測，成立國家級的驗測與技術研發中心，與其花大把鈔票救災，不如將經費轉至研析如何「預防」災變之用！同時藉由成立國家級橋梁或工程中心，吸納並培養高端工程人才，持續發展提升我國橋梁工程技術，相信定有效益！

 
我國的橋梁工程檢測，過於仰賴迷信於「目視」檢測，猶如將人工目視檢測視為檢核萬靈丹。事實證明，目前已可透過非破壞檢測探查目視檢測所不可得的結構缺陷及性質，並有許多新式的橋梁檢測與診斷分析技術在發展中。因此強烈建議政府研擬推動「橋梁檢測評估技術與維護管理體系」的精進策略，並設立具體標準，降低意外事件發生機率與傷亡數。

 
我國在工程設施之非破壞檢測技術已有不錯之進展，早已可透過儀器檢測，了解橋梁構件的材料性質、構件缺陷、變形及河道沖刷等影響橋梁行為的參數，可補人工目測檢視之不足！若檢測出有問題，再行要求作更進一步的分析與改正措施！

 
最後回到工程專業，橋梁工程的三道防止失敗防線，第一、設計防止連鎖反應；第二、工程韌性；第三、接頭與介面管理。一個災難的發生，通常也是防線部分或全面失守下之結果。以橋梁工程管理言，均可檢討在未來案例中是否有強化的空間，並引以為戒！

 
台灣的工程技術不容質疑，南方澳大橋事件的教訓，政府與工程界應從工程管理面、技術面研究如何有效防範方能避免慘劇重演！除了期待政府帶領著手籌設國家級橋梁檢驗與技術中心，並全面啟動橋梁結構監、檢測外，讓我們一起努力，攜手提升台灣整體的工程建設與維護！","1571643254","/udnip/photos/a.216583458408163/2677405488992602/?type=3&eid=ARCe0ndWL-Gp576Ql2rEnNxc7QkO--RAatLP8QRZSAHHLJhDcBelifV-KQP9jB-1dyWv-NjfAljq8vhR&__xts__%5B0%5D=68.ARCcBkrah7__ZJQZT71onp5dvr8EZVXQoADH0e35277GOKvTPCcDTFWQuQQd_CEHTKII_-LjD5V16XhEVr4zV8nZYFYSp0_aNvtTYoBpH3y34RP_BEYrcscxmuc-j9qu3YIBZWr0Lu3Txsdcob2SrA1Q1oY4Y4ZMjf6espVZARrxVTHbvKBXlNwvuJHfWHtWEpKMS-EE6g3LFD3e8LJUaQovxW_4wSlmHATqMQOIPNxKgEw5hxji43gAthNcBC_RroN_RdNetJZgGboQLaf9MGds3QK1PN3APLy9oDzyLoHRtTPRq6a6S3FmMUU5kBYrREzP5JsZXj_fc32TE1RCjShaaA&__tn__=EHH-R","https://scontent-lga3-1.xx.fbcdn.net/v/t1.0-0/p280x280/71564743_2677405492325935_7954026815100551168_n.jpg?_nc_cat=101&_nc_oc=AQnQ3R744qFXwx2BTJNolRuyy0rZbUJMOj6wsaRyYyAOA5BE1XG3A4ZDA9J5ezvJ4A8&_nc_ht=scontent-lga3-1.xx&oh=90b29a7a2948c4e5120904366a181503&oe=5E1A0887","undefined","",""
"https://www.facebook.com/udnip/posts/2689694271097057","1571122802","從日本水災反思台防洪

 張炎銘／退休人員（台中市）

 在JR長野新幹線車輛中心的北陸新幹線10個編組（列）成泡水車，損失慘重。美聯社

 哈吉貝颱風橫掃日本，造成慘重災情；神奈川縣箱根町廿四小時雨量接近一千毫米，多個縣市一、二天雨量是全年雨量三、四成，已創其觀測史紀錄。

 
近年來各地雨量迭創新高。前年尼莎颱風造成屏南大淹水；颶風哈維打破美國近四十年最大降雨紀錄，造成德州嚴重水患；去年八二三水災，嘉義、台南、高雄地區受災嚴重；氣候變異造成強降雨的證據令人悚然而驚。

 
服務水利機關數十年，印象中過去時雨量很少破百，十年前的莫拉克颱風雨量雖讓人震驚，但多數水文專家認為那僅是數百年難得一見的特例。惟近年來台灣、美國、日本及其他國家的實況，已讓人不能等閒視之。

 
防洪規畫最基本的水文分析，是假設未來降雨情況與過去類似。莫拉克風災的降雨機率依據歷史資料約是千分之一，但若強降雨如此頻繁，顯然過去防洪設計的基礎已動搖，原先設定的標準已無法達成。例如，十年保護標準恐只剩六、七年，百年只剩七十年，淹水風險已大大提高。但若將近年資料納入分析，則堤防是否要加高？其他排水設施、抽水站能量是否也要跟著提升？則所需經費可能是天文數字，我們財力負擔得起、也願意付？

 
颱風造成日本廿一條河川潰堤，住宅區成水鄉澤國，應也是高傷亡主因。過去考慮經費，現在另斟酌自然生態，近年堤防多為土堤，遇洪流衝擊、溢流、淘刷，較易潰堤。一些生態學者呼籲不要與水爭地，但台灣河川擺盪，不羈如野馬，哪有如此多土地？若強要在住宅區周邊堤防採用生態工法，河寬又不足，豈不更提高洪災威脅？

 
近年颱風豪雨一來，警戒範圍內相關首長一定「剉著等」。都市排水系統防禦不足，稍有積淹水則人民不能忍受、媒體痛罵。政治立場不同者更是大作文章、追究責任。但在氣候變遷影響又無法完全根絕水患條件下，如何對環境有正確認知，取得共識後採用經濟有效方法，提升防災能力，避免人命傷亡、減低財損，才是真正挑戰。","1571643254","/udnip/photos/a.216583458408163/2689693841097100/?type=3&eid=ARB_MWDj9ZF7lwiR2dTUMzrrdcbVXM7AeVk4Ki0-kfEsPrHfzNKKeikzVZp6rhX0ATTgL1FkuoO-10cF&__xts__%5B0%5D=68.ARBpKuzEfQ0vsTw8jDoI8TnM9cXpPxbHtApjP6Y2KBoWUspD5UEDvEL51zy6RNCUkeJr3Wr-ddPg196tVvO5fDLRXxCo7IetbvPgtepNzcWf1-n_ST7iOLM141T5r5VYCP-xHDAhJmoSsk0VB90gURexKDmkqujjYU7tV9Dr0sdIfijFZNB2MK4TQ8JBR8oB70GS3haOjIW5S7bm0gNWRNwpPRyosZ-5cBGuEoKGJQOwNrgclY4SFF3iBpJP1UG_xvKF0gFRt04boKGESe_UobMg9A918pqa4pJHUJzhpj3BKJ5z0z1h7a2v3EeuS9aLhXBtwV8I5vXUNOC8nQsTOqlm0w&__tn__=EHH-R","https://scontent-los2-1.xx.fbcdn.net/v/t1.0-0/p320x320/72791744_2689693854430432_6273709289622208512_n.jpg?_nc_cat=110&_nc_oc=AQk9oZgvWw3lHpL5OP1C6OiTARrX_E1AOjlShOOSxg7UpRF31KTy9kH0izLKSSuWCps&_nc_ht=scontent-los2-1.xx&oh=ed7d64fffbfc76b6247ddd7181949640&oe=5E5E945D","undefined","",""
"https://www.facebook.com/udnip/posts/2683476321718852","1570863600","科技與善惡的距離
許素菲／大學兼任助理教授（台北市）

 
今年諾貝爾化學獎由由三位研發鋰離子電池的專家學者獲得，身為幾乎天天手不離鋰電池的現代人，對他們充滿敬意與感恩。另外，日昨高醫大林姓學生涉嫌為了練舞場地，狠潑「化骨水」致老翁死亡。不禁令人想起，廿多年前清大研究生「王水」溶屍案。兩位資優生如此行徑，令人扼腕。

 科學本無善惡，人心不可量，善用之對人類造福無限；因一己之惡念，用以害人，實令人唏噓。","1571643254","/udnip/photos/a.216583458408163/2683475765052241/?type=3&eid=ARApG0IZVHOAyexJ4cu0HRiokMDJXPdWSJR3CHmji6PVvG8pGyis1VpbOPm0wInGqltCjAac2ZX3-r-p&__xts__%5B0%5D=68.ARD-ZO7aCtz9OzXPbPjMuDZmJk1n3azu3L90BiQIuQ7dxVD0eVbEBePSYyV-kYc5ZGcMbjSIPESLJlgDtMBhUxhIg64FyMSJyMvnyNikVQT-a9z4lSFTkCu-emBbdHB401ikY1wIKjeSpWo0hg4xwHvNBsBEKpRKv3nL8xP7QlqpyGdA8-IqBcKHY4u46jRcDFnI_etriD0qHuQkUb-UKmjVdxMvbjA5oreSjaqnoR0KkW8hvLazUpGZlu_zhTGjeCmC0kePMcs3GHZrmyqdziiJDsaLtVN8jDiTJewOfEJezAxUxKI19LMRbtkNzsLJ_Pd8TewjEAWBhS7XdpGQEBNwxg&__tn__=EHH-R","https://scontent.fmid2-1.fna.fbcdn.net/v/t1.0-0/p526x296/71919400_2683475771718907_2860203844086792192_n.jpg?_nc_cat=107&_nc_oc=AQmXeV7YVe-8YsrMX3vP8w3xl7d8p7UqroEGSOrUipTX-511jGeSBGQRtRe8vmYawIo&_nc_ht=scontent.fmid2-1.fna&oh=a805b7f06f14b18335e5c951bd9f12d7&oe=5E276937","undefined","",""
"https://www.facebook.com/udnip/posts/2681422231924261","1570777201","國旗海帶來安全感
張博智／退役上校（高雄市）

 今年的十月慶典不同往常，到處可見國旗，升旗典禮也出現人潮，高雄市更是旗海飄揚，萬人參加升旗典禮。

 
國旗、國歌，代表國家的顏面與身影，只是每在政黨輪替後，總有妾身不明之感，國旗掛而不彰、國歌唱而不揚。今年之所以不一樣，應歸因於人心思變。韓國瑜說﹕執政者不能為了塑造個人形象與自身政治利益，以全民福祉為犧牲祭品；台灣最需要的不是亡國感而是安全感；年輕人首要是進入職場，而非走上戰場；台灣的顏色從來不是藍綠橘白，而是青天白日滿地紅；不管政黨如何輪替與競爭，都不能超越國家認同的底線。一連串大哉問，尤其值得政治人物惕勵自省。

 
曾經，罕聞中華民國國號；曾經，難得青天白日滿地紅國旗飄揚。如今，欣聞歡呼中華民國，欣見旗海翻騰。但願這景象是國人一致共識與共見，而非借殼上市，貍貓換太子的把戲！

 國慶看問題，問題在兩岸，關鍵也在兩岸，無論誰執政，請掌舵的人把握分際，以天下蒼生為念，我們所寄望的是安全與繁榮，不是口水與紛爭！
----------------------------------------------------------------------------
百姓選的是中華民國總統
劉錦得／教（彰縣和美）

 
蔡英文在國慶演說中談到：「中華民國台灣這六個字，既不是藍色，也不是綠色，已經是整個社會的共識！」這對於一向稱「中華民國」是「那個國家」的民選「中華民國總統」而言，實是一大諷刺！

 
眾所皆知，中華民國是台灣的國號，但對於總統小英來說，無法認同「中華民國」這個國號，硬要加上「台灣」，還說是社會共識，難怪有人質疑「中華民國台灣」是國號？還是新國家？

 國家是兩千三百萬人的，當然非藍非綠，在中華民國國慶日這天，說這六個字，是在製造團結？還是分裂？

 身為百姓，也是選民的我，誠摯希望小英記得自己選的是「中華民國總統」","1571643255","/udnip/photos/a.216583458408163/2681420981924386/?type=3&eid=ARBijkDZKIwvRKlJUohQ1WeWOL9dAUyUMsUekBVHP-sT5AKhJkLbyNDAIeITW0aMi3qi-GAupSAzFOGY&__xts__%5B0%5D=68.ARCCRgD2eu0BQaDYTwoDeqMT5aGkNhbFyEBywZprZt4AlvWIj_OgaOoxEclIcrxUwAVHnhekHpPl_6D5zauEkTO3_jBd2lnqC0a3MhD-34f5lkLV6c27EHKRk-DOuJ9HUXkrH28NxZHeLQMPuG-KYbsumZTT33qa8blQvoyYdkejC_sGW6YtxGqFAtW0UChOfwS20RknLV-mWDr-plJ0RNyBQMe4bdM2tNbWD0GQlg4vS0Uqb4V_ccpHXKles_pmD8IDPmBJ3AMOYSj8y_j7pjT6X9ngpmBtSu3chqQAiEm_sYosCEdsdtsuhnG3BNwAb64OTx7U2JBW5Lr1wDnwtmzUnA&__tn__=EHH-R","https://scontent.fsjo8-1.fna.fbcdn.net/v/t1.0-9/s851x315/71807483_2681420988591052_493898402698887168_n.jpg?_nc_cat=106&_nc_oc=AQlIlMQzKqyCIQb9s3Ss4MfTbU_K9lTTx3bWXtKECYziJGI2P0IN3yIFgSJcpDItnM4&_nc_ht=scontent.fsjo8-1.fna&oh=dc9d1f990d0c33fb904c33c2315fc441&oe=5E626086","undefined","",""
