url,posttime,text,crawled_time,attachment_link,attachment_img,attachment_img_alt,attachment_title,attachment_brief
"https://www.facebook.com/udnip/posts/2679456985454119","1570687200","缺東協丟友邦...這不是被鎖住？
蔡金晏／市議員（高雄市）

 黑韓，已經加工提升到「黑韓國際化」？

 
韓國瑜八日參加工商建研會後援會成立大會時表示，東協邀請澳洲、紐西蘭、中國大陸、南韓加入，總共十六個國家加入關稅同盟，台灣沒辦法加進去，再往下一步，台灣就跟北韓一樣，整個被鎖住了！

 針對韓國瑜這番談話，一個「北韓─朝鮮經貿文化情報」臉書粉專，連夜趕出一篇「嚴正聲明」，直指韓國瑜發表對於朝鮮不友善的言論，該粉專聲明還直嗆，朝鮮怎麼了？

 
台灣無法加入東協，主因是蔡英文所領導的民進黨政府，不斷倡導仇中的兩岸對立政策，激怒了老共，因而刻意阻撓台灣加入東協，甚至在外交上，還讓蔡政府一連被斷了七國，所以，台灣被鎖國了，這是個事實的陳述。但這個中文非常流暢的粉專，可能滿腦子只想黑韓，所以搞不清楚台灣和北韓被鎖國的共通性，才會搞出一場烏龍戲碼。

 該臉書粉專說，朝鮮是因為發展核武與長程彈道飛彈而受到聯合國與美國制裁，在制裁禁令下，各國不得不暫停與朝鮮部分的經貿往來，並非是朝鮮主動鎖國。

 
台灣被老共卡，無法參加東協；北韓被美國和聯合國卡，各國不得不暫停與朝鮮部分的經貿往來。不就是韓國瑜所言，台灣就跟北韓一樣，都被鎖住了！這樣的事實陳述，哪裡對朝鮮不友善了？

 
香港「反送中」讓民進黨撿到槍，成功的把台灣民意從「討厭民進黨」的失政失能，轉移到「痛恨共產黨」的恐中氛圍。但我們無法忘記，也一定要問的是，民進黨主政這幾年，我們的外交和兩岸處境為何？

 
友邦斷了七個，外長數次請辭被慰留；駐台的沼田幹夫，是吳大部長口中的「大哥哥」；遲了一個月才發表「遲刻魔」的日本刊物，被指與民進黨交情匪淺；更不用說什麼「由友人轉交」的安倍晉三賀電，有多麼丟人現眼、貽笑國際了。

 台灣駐日的代表是民進黨派系頭頭；駐德的始終同一個，酬謝他在民進黨在野時主持政論節目有功；口譯哥可以當駐美的政治組長；捍衛綠能政策有功的，也可以奉派駐外。

 韓國瑜是總統候選人，將來可能是國家領導人，他不能問、不能關切嗎？還是，一切只能民進黨說了算？","1571643249","/udnip/photos/a.216583458408163/2679456118787539/?type=3&eid=ARDGYHWqy790XCp-ve1K2Gq-UnNEh4HzI7ZI5mgPbziI8RyqfUx_px76hxRlZvgWcustfR_2b2bOGXNl&__xts__%5B0%5D=68.ARDYYgF7Ere7pqd9ycgfiE20bNWqbbOHrjjXOMJCeBkaRA2heVKDrHpyDP7DbAkTczSaMWGO5iyTfG__1cagnW6hl5gJRJPE1qx9AqvYmPLXfCln5gzp2ESr8mL4j3iHW9GT6vPQnS_KlNRz9RMeJ_xkSIha390_P1c4tWau91LiB7NYgFkSmgZzI50skZSPX7JpkjUE89RLnHr1DOod7DjN3FePxnXNIJJBhfuSG3LhK5CRlOH6KrkW0mMO1WVzEdsKqilTGi4SZs23nqOUyK_So8SQnggGcir-vCxZCtvNjUQq0g5Jc2VlosYbcQtIfYkYfjck1HUeVXMoE-xkh0CBgg&__tn__=EHH-R","https://scontent-sin2-2.xx.fbcdn.net/v/t1.0-0/s526x395/73051447_2679456125454205_7168861627515666432_n.jpg?_nc_cat=111&_nc_oc=AQnF0HxhSwhP9XRsoXYVTiU8bf3LUdBS9aFT3RgoNtfqSB7h_sIF_9arIU76bjsAAFE&_nc_ht=scontent-sin2-2.xx&oh=1ecf46fe270374b4a0baa0076490ada2&oe=5E22AECB","undefined","",""
"https://www.facebook.com/udnip/posts/2679389528794198","1570672800","數據的天才 政治的白痴
常中天／退休體育主播（台北市）

 
（圖：NBA聯盟休士頓火箭隊總經理莫雷「撐港」言論引發龍捲風，NBA主席席佛抵上海溝通，仍未熄火，上海市體育總會原定的「2019NBA球迷之夜」球迷互動活動取消。歐新社）

 
ＮＢＡ休士頓火箭隊總經理莫瑞，日前推文「與香港站在一起」，引發的後續效應愈燒愈烈，不但ＮＢＡ總裁席佛天天出面澄清，中國大陸方面更是採取鐵腕，不但取消轉播火箭隊比賽，甚至有抵制整個ＮＢＡ之勢。而這一切，就像歷史上所有因政治因素導致受影響的體育賽事一般，最終受害者，還是球迷。

 
莫瑞二○○七年出任火箭隊總經理後，以顛覆傳統的統計分析研發出一套走在業界最前端的球隊經營系統。他以數學理論為基礎的「多射三分，少投兩分」進攻模式，為近代籃球帶來革命性的轉變。他每年舉辦的「史隆運動數據分析論壇」，可說是集世界級數學與體育菁英於一堂的學術最高講堂。

 
而這樣一個專業的天才，在他所完全不懂的領域上，表現得竟然如同白痴。香港今日的問題，怕不是數百年來文化政治糾葛下產生的恩怨情仇，豈是一句莫瑞推文所寫的「為自由而戰」這麼簡單？當多位ＮＢＡ其他隊伍的管理者，因為不懂繁複的數據分析，而使他在業界得享執牛耳領導地位時，他竟然犯了所擊敗的競爭對手的錯誤，意圖在他不懂的領域占一席之地。

 
筆者從十幾歲時隨家人移居休士頓起，就是火箭隊忠實支持者，如今已快四十個年頭。筆者想對莫瑞說的是，因你一言，讓火箭在中國大陸多年來累積的廣大支持度毀於一旦，成了「黑隊」，但錯誤已然鑄成，就像任何一個球隊總經理在球員交易上都會犯的過錯一般，不要再回首過去，專心聚焦於眼前球季吧！

 
筆者想對中國籃協說的是，「一人做事一人當」。莫瑞個人言行，觸犯了一個外國人不宜對他國文化或政治妄加評論的基本法則，中國大陸方面若對他作出任何形式的懲罰，將他列為不受歡迎人物，終身不許入境，我都認為無可厚非，甚至理所當然。但如要整個球隊陪葬，讓球迷承擔惡果，卻是所謂何來？當今中國籃協主席姚明之所以被任命，不就是希望能排除以往過多的政治掛帥，以外行領導內行的不當現象嗎？","1571643249","/udnip/photos/a.216583458408163/2679376315462186/?type=3&eid=ARBfkaKmPc0MYa0C7-3U0C42wvUDOYBht3_wbgBlEt6ElF2ZoIL7t15Ut0FjGhtccEDdlXqRYfdU6NBy&__xts__%5B0%5D=68.ARDX9qQBfQ0rAlmoiFOxgbC_xH7liyzbILpNGCjbA8pUAJAJlfeSzVo5AlwXLqYGUW_Vr2vC4xV01NmqaXynihy7q2ocKrOCWuqNb163D0hia7nI_aIV83TdpfswihJs6_uXHh9NAoXar0ym_1p9kS7-IGHgiPBdSiudGYdHb6wq76vnepD5abOHXgbp1EzCOdbCLZunltf2zceroO13rq2oLLuLxtgVvlzjue97EZmWz3g5qqg0PwVMg7iZ-K9BDXhiIKLYCpWCqBmMVOgvJ93-BFAWuBINBEigX-dJzYXhupgbL-I-Up0KOYGh4S8oe__6TziBCk_I-C4gbYb-0PVsTA&__tn__=EHH-R","https://scontent.fcgk22-1.fna.fbcdn.net/v/t1.0-0/p235x350/72133505_2679376318795519_2154137321140649984_n.jpg?_nc_cat=109&_nc_oc=AQm2x4ctI4VjFnnjtgKNPZDZO-JLek4VkJZhJz8aK7DEQFXaYrKtJmbC89Unv6udyLk&_nc_ht=scontent.fcgk22-1.fna&oh=1f06abb895688b5ca38aca082e0ed062&oe=5E233CF5","undefined","",""
"https://www.facebook.com/udnip/posts/2697402783659539","1571364087","https://udn.com/news/story/7339/4111112…","1571643249","https://l.facebook.com/l.php?u=https%3A%2F%2Fudn.com%2Fnews%2Fstory%2F7339%2F4111112%3Ffrom%3Dudn-catelistnews_ch2&h=AT2suzxEh1fY2cW3nTSD-35YcGpXjQgms7kiNoekJr3rXGY28Gj7S8LeWf6HEshcMHvZ6-wCgvB96mxVa2LjefrDKLSHc_15zDpXjUqRWpAAPc9bHqHuNEqGFwOkuOICj-wYtBrCKW3w7lNjb1xa-PPw6XTovzuvdfaYXTztV3HxOOghajSQojYZfLGTPTyLwkhiPmJHJNgW1urfsa2-0FK5sFeBkOdLEC-GgxnGn7WeTUJ28N7fRMDdh5qlfI30I12ckM733xWf-JoZsP0DfnV0SavbaL0P3k2kqVwYkpHAvzTQOO8HN08sxgMB87a5aXjQrGd1vblGe8GLb_oP8Iln9kUem4il71jqgBYPaaTGaly7bpBolhSh3-VyAdcr42PO-Rpji1g3oQvUlh-tIk-fjZYgYWBfMsr4DvEEoEyvyabIeoXbvsv2QOOZaMSqvODtskNRDgrYdK9LUoQ5fpF-fT1ECi77I9O4phx_BHigakIO-_0QFZcVIF81cpgiesFtrwvmu80YjMI4pGAVU_Zh5QhvoYz6o7-0yYv3lHxBPwnVcd1peYcQcGmEAo12DIV8EBeMK7WBxHNR-bRabD5-GzC59N44_e4VKRRi53mHC-aEB9Ilh4HJsszB0a2DL4lOQ2mmN0KSmr9m","https://external.frgn3-1.fna.fbcdn.net/safe_image.php?d=AQDZ7SCWPrrr40mF&w=540&h=282&url=https%3A%2F%2Fpgw.udn.com.tw%2Fgw%2Fphoto.php%3Fu%3Dhttps%3A%2F%2Fuc.udn.com.tw%2Fphoto%2F2019%2F10%2F18%2F1%2F6954315.jpg%26s%3DY%26x%3D10%26y%3D10%26sw%3D1262%26sh%3D841%26exp%3D3600&cfs=1&upscale=1&fallback=news_d_placeholder_publisher&_nc_hash=AQCAZzfwrE7m4yUl","ဓာတ်ပုံရှင်းလင်းဖော်ပြချက်ကို ကြည့်၍မရနိုင်ပါ။","分級給付 偏鄉醫療才有解 | 聯合新聞網","總統大選近，醫療政策、長照成為熱門議題。人口老化加上少子化衝擊，長照當然是不可忽視的，但同樣因素衍生的「偏鄉醫療」議題，卻被忽略了！"
"https://www.facebook.com/udnip/posts/2699121966820954","1571464801","外送悲歌 人民賺太少 政府管太多
鄭文炫／無業（新竹市）

 
外送員接連車禍造成傷亡，引起議論。有些問題值得談，首先談「拿命賺錢」問題，這是弱勢者掙錢的無奈。在「客廳即工廠」年代，日做逾十二小時者比比皆是。已故的溫世仁先生說過一個故事，合作廠商老闆長期趕工，太過疲累不慎手指給機器打掉。到醫院包紮後，即回工廠用另隻手繼續操作，就怕耽誤交貨。當時不少人拿命掙錢。

 
次談「剝削」問題，平台業者聲稱和外送員是承攬關係，不適用《勞基法》。這是剝削嗎？不盡然。若評定僱傭關係，外送員雖享有勞健保、特休等福利，但業者經營成本提高，怕要刪減外送員接單費，並限縮加班時數因應。外送員收入減少，也許有人願意多辛苦多賺錢。

 
外送員拚命賺錢，易低估健康傷害和意外風險，況且意外發生會損及他人。政府有照顧人民的責任，可制定規定防範未然。但若管太多，當心欲益反損。「一例一休」為人詬病，便是管太多，不准人少休假多加班賺錢。

 
現今經濟型態，強調「顧客是衣食父母」、「顧客永遠是對的」。送餐要搶快，不容延遲半分，否則要挨抱怨。雖行有行規，有其理由。但也須反思，商業化的運作方式，是否制約了我們的觀念和思想。頗有人以為花錢就是大爺，連看病也當做消費買賣，不懂感謝別人的服務，也不懂體諒人。

 
宅經濟興起，多少歸功眾多「生活白痴」的造就。外送平台雖能幫人解決三餐問題，可金錢不是萬能，有些事不是花錢能解決的。過於依賴花錢解決問題，人生及生活更要受商業經濟制約。","1571643249","/udnip/photos/a.216583458408163/2699121463487671/?type=3&eid=ARD_U22-WnZxeUvUaKsIHd5n_lL-HXaR4Mfzvnl9RFpJb9ukDMXcNnf63OXVjLKMw0NCUJwhPE_9W2Db&__xts__%5B0%5D=68.ARAXzjPegyXBFRAFMfjotnfVTcBE4XnH1JCP6F98aSQ-1kuvgcH0c2gpgg9FPSIpNa9kZv31SwC50AL9l0Wsr1E-JGlEnaVnXE9qZhLYDa-W9_8sTLlNZVaZZM3_l6zONNLCrZ1Z8I3PQ1yZbhJJakQMLj3_uQqrZUjv9pYPj8d4tq9WGYAzYaQGTosUj-BJG931mhP8PxJB-UYonIxkAKglxvHuFtVPG0qst1InkyBS79_IXjncN_De5RS00v0Ju8EgctMjebxnKo277czk_NwHkW8oe0IDPJHpPDduGGdfjmmvOKwB0bnUFZSTv-EEEbpz_rvbVLOZTDgtCMgfCruKaA&__tn__=EHH-R","https://scontent.fvlg2-1.fna.fbcdn.net/v/t1.0-0/p235x350/75204398_2699121470154337_5139547420480241664_n.jpg?_nc_cat=106&_nc_oc=AQmYz8aqMssp7wTsm_oBYEHzUQPHEa8UBu5xOFynlWUrwo9kRl1TJfabihg9czEYo2U&_nc_ht=scontent.fvlg2-1.fna&oh=3e90cc28d13cdd1463360d83a0d5b190&oe=5E2AE7D0","undefined","",""
"https://www.facebook.com/udnip/posts/2687576534642164","1571011200","#聯合筆記 

 習近平強化個人權威？ 

 陳言喬

 中共總書記習近平出席慶祝「建政七十年」招待會，並發表談話。美聯社

 中共十九屆四中全會即將召開，依會議主題，被認為中共是在「加速社會主義回歸」，習近平是要帶領全黨走進新時代的康莊大道，還是強化個人權威，各界都在關注。

 
這次四中全會的主題是「研究堅持和完善中國特色社會主義制度、推進國家治理體系和治理能力現代化若干重大問題」，為什麼要回歸以及如何回歸社會主義？改革開放的大路是否依舊？一連串的問號正等著四中全會揭曉。

 
依慣例，每屆的第一次全會是黨的換屆，第二次將進行政府換屆，第三次是布局未來五年的工作，第四次以往多具體針對某一事務，如五年前十八屆四中的「依法治國」、十年前十七屆四中的「黨建」。但這屆的四中上升到「堅持與完善中國特色社會主義制度」的高度，背後涉及的是黨和國家的路線。

 
「具有中國特色社會主義」在大陸喊了很多年（鄧小平在一九八二年提出），簡單說就是一手緊抓社會主義教條，一手推動改革開放搞活經濟。近四十年來，大陸會有舉世矚目的經濟奇蹟，大家只記得得益於「改革開放」。

 
但隨著改革開放的紅利逐漸不再、經濟發展來到一定的瓶頸（經濟增速下滑），加上世界大環境的複雜（中美貿易戰），大陸走到了一個關鍵點，如何因應這場大變局，成為當前最棘手的問題。

 
不論這次四中是否如外界所言延宕了一年，從四中主題可知，習近平已擺平黨內雜音，並確定了他的路線，也就是他一再強調的「舉什麼旗、走什麼路」—社會主義道路是永遠不能偏離的路線（不要幻想西方那套普世價值，具體到細節就是網路不會開放、言論控管依舊嚴格，更別提自由民主）。

 
中共剛慶祝建政七十年，一黨專政超越了六十九歲的蘇聯。此前習近平赴多個紅色基地，明白告誡黨員幹部要傳承好紅色基因，確保紅色江山永不變色。具體作法就是黨員幹部要有良好的「精氣神」與「歷史使命」，勇敢地與「各種矛盾」鬥爭。

 
中共謹記當年蘇共垮台的歷史教訓（認定蘇共否定自我、方向不對），因此這次四中全會的重要性已呼之欲出，統一內部思想與黨員的社會價值觀，面對未來的各種困難必須堅持跟著黨走（不能有雜音）、貫徹習近平新時代中國特色社會主義思想（不容挑戰習核心）。

 
至於「推進國家治理體系和治理能力現代化」，是運用現代政府治理觀念，推動政府施政更有效率，以多樣的靈活手段，化解不便、減少民怨，希望贏得民心、爭取對中共執政的認同，與路線無關。

 
依中共嚴密的組織制度與過去的歷史經驗，中共在政治和社會上的管控完全可以做到；如果四中後的大陸局勢、尤其經濟（六穩）能夠獲得突破與進展，中共或可跨越這道「坎坷」，進入另一個境界。

 但若經濟困境無法改善，甚至因政治環境緊縮持續走下坡，人們的反應恐不僅只是對過去「胡溫十年」（經濟高增長、言論稍寬鬆）的懷念而已！","1571643249","/udnip/photos/a.216583458408163/2687576017975549/?type=3&eid=ARA4Bxh4mpq3yxM7TLsjI39t-zH0PRoxE9mrO-s56RyUJ4erx2QtVBRnaoE87HH_fId7SxLUw_-fzilT&__xts__%5B0%5D=68.ARBgSKgS-lvDdAapRHRd6LKnILbas0V0vq3x4mUn2RrZtVLE_js4Y8eO8QcAcqXpEKPGxtMrilp00uJPEgkHtrG3FsX_HznIdovsxEeBs7gCWpXLRObOMIbK_Gty54ELkAdmmc_GilNdC9tYF51ILQeWwXG40fj0gOOeJBUFDfdfysBqFmn_gveSY7lliEo09wNVoTTEh_03Lahg_jgcOGbyZ2OM1ytZPO7FhExu02evgVizwFVkiDi4J4J0nJsFIPUix3_qWFsM6v9HACYOwtlCviYAmxUPPVC8YZJpyzoRJpw5ClgDinfX1kMo5RQO4MwzI00rnXpWt7BHlk3GtneC4Q&__tn__=EHH-R","https://scontent-lht6-1.xx.fbcdn.net/v/t1.0-0/p235x350/72214040_2687576024642215_7317013857216495616_n.jpg?_nc_cat=102&_nc_oc=AQmWll2xFcrps5GCbXVRW_qJ4ml0bLPYL7_c85z_E81T4Q5eOn_RbnC7Zy2edHCEs0w&_nc_ht=scontent-lht6-1.xx&oh=7cedfd96b6e25f4a7a2950c01b7de030&oe=5E1A6221","undefined","",""
"https://www.facebook.com/udnip/posts/2673362736063544","1570406400","#聯合筆記

 中東鐵三角瀕臨瓦解

 郭崇倫

 圖為沙國王儲穆罕默德2018年3月訪美檔案照。路透

 
沙烏地王儲穆罕默德．本．薩爾曼上任兩年，在一萬名的沙烏地皇族中惹得天怒人怨。皇族的不滿，既有新仇，也有舊恨。舊恨是兩年前王儲擴張權力，換掉不肯臣服的堂兄弟們，更軟禁數百名皇族，指控他們貪汙，強迫繳款才能獲釋；新仇則是最近的無人機攻擊兩處煉油設施，皇族們質疑他保護王國不力。

 
尤其王儲長期擔任國防部長，主導介入葉門的內戰，每年七百億美元的軍事預算，這麼多歐美先進裝備，竟然打不過烏合之眾的胡塞青年軍；打不贏又不願意謀和，對背後支持的伊朗採取敵對態度，現在首都、煉油設施時時都在飛彈與無人機的威脅下，置王國於險境。

 
王儲上任時，希望打造沙烏地成為更為世俗化的現代化國家，並且推出雄心勃勃的二○三○年遠景規畫；他主導開放沙國觀光，但要以旅遊來擺脫對石油的依賴，談何容易？他要給予女人平等地位，也引起教長們私下的不滿。

 
一年前批評他的專欄作家卡紹吉在伊斯坦堡被殺，土耳其政府與ＣＩＡ直指是他下令剷除異己，美國國會決議限制美國向沙烏地的軍售，並且要求美國結束參與沙烏地為首的葉門軍事行動。

 
現在私下已有呼聲要撤換王儲，有些人擁戴老王的弟弟，七十七歲的阿密德親王取而代之，老王體弱多病，幾乎已經完全授權給王儲，不過在他有生之年，不可能撤換王儲，部分皇族正在等待老王駕崩的那一刻發動政變。

 
王儲內憂外患，最近經由西方媒體的訪問，替自己喊冤，稱殺卡紹吉是個錯誤，強調他沒有下命令，但作為沙烏地實際領導人，他對此負有全部責任；對煉油設施被炸，則是因為王國幅員太大，不可能防備得了。

 
他指責罪魁禍首是伊朗，呼籲全球應該堅定有力的回應，他並強調，沙烏地和伊朗若開戰，「石油價格可能會飆升至難以想像的高位，將導致全球經濟全面崩潰」，不過他不希望使用軍事手段，希望透過政治手段達成和解。

 王儲講不出的苦衷是，他想軍事報復，但最大靠山美國川普政府不想對伊朗開戰，美軍雖增援沙烏地，但只有幾百人，只是象徵性地協助防禦，不是要大舉進攻的態勢。

 
不能戰只有和，這就是最近傳出沙烏地與伊朗秘密談判的原因，許多國家願意居中聯絡，包括安曼、巴基斯坦、法國；公開承認的是伊拉克總理馬帝，上周他已飛到吉達與王儲會商。

 現在雙方差距仍大，美國對此樂見其成，但王儲心知，真正的決定權不在他，他公開建議川普與伊朗總統魯哈尼會面，就伊朗核協議與其在中東的影響達成新協議。

 
過去兩年，中東形成鐵三角：沙烏地王儲薩爾曼、以色列總理內唐亞胡、美國總統川普，鐵三角以反伊朗為綱，沙以新聯盟為領，儼然是中東超穩定結構，但現在內唐亞胡選舉失利，恐難繼續執政，川普面臨彈劾，連任之路艱辛，如今再加上王儲地位不穩，鐵三角聯盟恐將瀕臨瓦解。","1571643249","/udnip/photos/a.216583458408163/2673362112730273/?type=3&eid=ARB2VHsSt-KOGHI-okNGdY7oJOgH4LOKaJOlhMhLDwpNj7tuMTbTs2uoNTmCeO6dW3awiAfcr_7oirpm&__xts__%5B0%5D=68.ARDiU7Z2wczX7Fmdrqe_1xQdX77Q-FjI4RNc9zj34yJja8Aj6gXxdTIuqaPXooTI7saGVOwGIzzCl5680D-y7GHV4rMH8i3jlqG79M6FllUIr--LV9b04LmX0pqH6FTKkt9WGTwtiGWai08Mhht66cMz948ChwFiFbAG2kPF6LfO_LZCFtxiT-Q-dE4o8Tkv0PMGoDeJbTY7f6xW8O7ZGyaWys2xrAUf0otdBPZLwdg7dhucq222mN2V-AlVu5JtfKPDQrO0g9QcDDeoxIvCoio-6cpktGW2gQW7XAGABl9BX0xGd2y17rDXKtbcSIjMRfMYd2ntxBwXsDM9I-ITdiANUQ&__tn__=EHH-R","https://scontent.faep12-1.fna.fbcdn.net/v/t1.0-0/p235x350/72562264_2673362119396939_1906816555727978496_n.jpg?_nc_cat=100&_nc_oc=AQmh3mEohL76ot3bZGyOdnCG2PCL9Udp5kbtUjEdSp_GEd9SCMXyG9_AQMZCK_h8u-A&_nc_ht=scontent.faep12-1.fna&oh=1b27bace5faf4f0f150d714280c990f2&oe=5E2205A6","undefined","",""
"https://www.facebook.com/udnip/posts/2694875153912302","1571301022","蔡總統博士論文讀後感想：我真的對不起很多碩博士生
#名人堂 嚴震生 (圖／取自台灣碩博士論文加值系統網頁)

 
上個月我在名人堂發表一篇《我對不起很多碩博士生》的文章，那是根據林環牆教授及徐永泰博士看過蔡英文總統博士論文所做出的報告而抒發的感想。當時蔡總統的論文還未公開，因此我僅能在論文格式上表達意見，如今可以上網「聞香」，我花了一個星期讀完整本論文後最大的感想就是：「我真的對不起很多碩博士生」。

 
除了研讀美國憲法的判例而必須接觸美國大學的法律期刊外，我對國際貿易法並不熟悉，不過蔡總統的博士論文很像是我們國際政治經濟的專著。只是，與一般博士論文不太一樣的地方是，這本論文比較像一本有關傾銷及反傾銷的教科書，而不是具有原創性的論文。整本論文都在介紹相關的法規，直到最後幾頁，才將她個人的論述提出，表示其他存在的觀點皆有其不足之處。此外，通常到了博士論文的層級，至少應該對論文的主題提出一些假設，然後在論文中驗證這些假設是否成立。無論是上述哪一項選擇，通常會在論文一開始就有較為清楚的說明。最後，誠如林教授及徐博士所言，一本論文竟然沒有一篇單獨的結論，確實有些不尋常。

 
不過，以上這些看法仍有不同領域可能存在的盲點，同時美國和英國的訓練有所差異，也是學術界熟知的事實，因此我還是認為或許我的觀察未必客觀。在《我對不起很多碩博士生》一文中，我將重點放在論文的格式，儘管當時我還沒有機會閱讀這本論文。如今在看完論文後，我發現當初的批判可能還嫌保守，以下是部分格式方面的觀察。

 
這本論文的英文書目，顯然是後來加上去的，不僅字型不一樣，且沒有頁數。無論是期刊或書，都有部分未按照英文字母的順序排列。此外在引用期刊論文時，為何部分期刊給予全名（Cornell
Law Review），部分則是用縮寫（Harvard L. R.）？同一個引述作者（蔡總統一度誤以為已經過世的恩師John J.
Barcelo）的三篇不同文獻，為何沒有分別列出？蔡博士在英文書目中，僅採用作者的姓，名的部分是英文縮寫，但也有作者沒有名，或是名字被拼出而非縮寫。部分的期刊卷數在刊名前面，部分則是在其後並以Vol.的方式呈現；部分有完整頁數，部分僅列出引用的頁數，部分則完全沒有頁數。書章併入期刊文獻，或許可行，但一些期刊論文沒有出版日期則不能接受。簡言之，文獻可以用任何一個方式呈現，但基本上內部應當有一致性，而不是引用這篇論文就採出現的格式，另一篇就換另一個出現的格式。

 
事實上，我最難接受的部分，是整本論文雖然在英文寫作的能力方面非常有水準，但卻有相當多拼錯的字。通常博士論文有拼錯的字很平常，我指導教授就告訴我，無論再仔細也會有遺漏之處，多年後回頭來看總還是會發現一些錯誤。不過，四百頁的博士論文有二、三十個錯字，大概還可以接受，但如果一百五十個就有些超過了。它所顯示的，就是論文是在時間相當緊迫的情況下交出，才會有如此多的問題。

 
一些年輕人對《我對不起很多碩博士生》的反應是，嚴教授過分在乎格式，而忽略了內容。請問超過一百五十個拼錯字的博士論文，難道沒有可受公評之處嗎？如果這是蔡總統當時的態度，我當然也會懷疑她治理國家是否認真，是否在乎一些基本的規範，還是恣意而為？

 （作者為政治大學國際關係研究中心研究員）","1571643249","/udnip/photos/a.216583458408163/2694874217245729/?type=3&eid=ARDznl9sLc5C1UwOsSow-1hvfBZhs4wLhwK7fwn9vXtKcUpLuwpAKKooezm_eTwxJ_DSbhiYPfo1v9YR&__xts__%5B0%5D=68.ARCFiPXE6sTvvZ8zs9wI1gTpI73euw2YLbKHunjZo5Eluo-cUcJtrB3NR7vKz_uGtEbQvYiSq3aMk6NwKfcQ3oPILyt2-kHgAfk5I5IYJz65WeH6faD6zEjf1PfD_Jm_OKCPMyXLZ0SKuPgwdCs1pODCsHLT5UGpOQOZN3c-fr7n9kFpgPIFuaX9gJVVpTlgeZxEW2B1kRmy7unMUJNbiqb4RCGWXDBdt8ieHym8Q9rdUsG6NTHbUgZpU6syWtz77SoI2pWEenAl68TffhIu7cQshrESIGViKIoMtF5NF-AuQpt0bY2k9GP3p0KHbgEZQS5Fxg_2f6qeHF0nK0rLmL5wxQ&__tn__=EHH-R","https://scontent-yyz1-1.xx.fbcdn.net/v/t1.0-0/p526x296/72560375_2694874220579062_5944540157083385856_n.png?_nc_cat=106&_nc_oc=AQlZEY296vBCXs61eRp3HzkywAwJDPuLK_rhs2LgLidcmn1-gItuJTbr6d4D9KXAGOA&_nc_ht=scontent-yyz1-1.xx&oh=0128b2f2797b95ded7b67f1aa9cf3166&oe=5E2DA773","undefined","",""
