url,posttime,text,crawled_time,attachment_link,attachment_img,attachment_img_alt,attachment_title,attachment_brief
"https://www.facebook.com/udnip/posts/2901088373290978","1579305643","#黑白集
海妖要走，總統要留

 
在司法院長許宗力要求陳師孟停止對法官「政治獵巫」後，傳出陳師孟已向蔡總統請辭，法界聞訊一片叫好。未料，隨即傳出蔡英文批示慰留陳師孟的消息，希望他留到任期結束。法官們立即轉喜為怒，痛批政府「虛晃一招」。

 
許宗力在演說中引荷馬史詩《奧德賽》之寓言，將陳師孟以監察權威脅不合己意的司法判決，形容為如同「海妖」的歌聲般魅惑而致命，呼籲法官們不要屈服。而今，陳師孟自知理屈而決定離去，蔡英文卻出手慰留，這是在公開肯定海妖干擾司法的價值？或者覺得法官們受到的侵犯和考驗都還不夠，所以要借重他作更嚴苛的侵擾？

 
首先，提名陳師孟出任監委，是蔡英文犯下的大錯，不僅貶損了監察權，也使其他監委的努力同遭抹煞。其次，陳師孟上任後為所欲為，打擊認真辦案的法官，蔡英文從未提醒或制止。第三，當社會各界對陳師孟忍無可忍，他自己終於主動掛冠，蔡英文卻還出手慰留；這是總統認為陳師孟「功在黨國」貢獻良多，或者必須留住他才能證明自己並未太昏庸？

 
這次陳師孟提出辭職，是透過府祕書長陳菊轉告蔡英文，也是很離奇的程序。如此一來，更說明陳師孟就是「總統府直屬監委」，聽總統之命行事，他來來去去，完全與監院無關。陳師孟任職監委期間，人民連監察院長是誰都忘得一乾二淨；這樣的政治樣貌，不正是蔡英文的超憲政執政所造成的？",1579392969,"/udnip/photos/a.216583458408163/2901088003291015/?type=3&eid=ARC2G-soxwQAmtfS2MiVxBOwXLZ2ci_3kVti4VkUq21WuQEc2HBMZLa4MlcdvjLGbbFZPAoosRPUe6uv&__xts__%5B0%5D=68.ARDIp3InRrpNY7PHDV6sxAR7ekTx0fqFg1rW6VwEonL31qMdoJflxX_6YlHFO6kg35ib7BcjY5fufOrpekjRahv9zP2xW8t3Xz5kaTmmqO0qsfY9jaAkqbttC4p4v2GwHx6nvSLQ9I6Ik71j9wVsIaFx-XLyMZPgHWZ2JyqTHEZZq291iU_kEcs9mCUKydJA8ISuWioUgKN81RcE723gI5PTDqEXErViXfHGlZfBPleiBsvopMepxJvqmFPUEZ6gRr0m3SIaOvOca5IVnPjisv3K5ZuxbOJ7Pd0L3UO5-SxgpKvbyBY8bxQDtrcTopzf5xF7fkZZWBb0bq3aYBZTtcj8Zw&__tn__=EHH-R","https://scontent.fhan5-1.fna.fbcdn.net/v/t1.0-0/p235x350/82238186_2901088009957681_5924312033645297664_o.jpg?_nc_cat=109&_nc_ohc=3OLAGXM43yAAX85K0pO&_nc_ht=scontent.fhan5-1.fna&_nc_tp=1002&oh=ccfa4f6e12a4ad31721fed5cac11932c&oe=5EA50957",undefined,"",""
"https://www.facebook.com/udnip/posts/2901166816616467","1579334445","背後訕笑長輩 選贏輸氣度
謝英彥／高中教師（新北市）

 昨天有年輕人投稿，對選舉結果要年輕人負責之言，不以為然；想起陪我娘看開票時，看到她的失落、灰心、憤怒，有些話就權當長輩發洩的氣話、出口吧！

 投票結果的確需要全民負責，只是台灣未來要年輕人帶頭扛起來；四年內，若有負面影響，沒投給小英的一大群人也得承受。

 
當下的負面影響，連任執政黨要主動消弭，如慘敗的韓市長已收斂寡言不少，韓粉社團如鬥敗公雞；酸民網軍、媒體名嘴仍一路進剿追擊，驕態百出，監督反對黨力道不減；成王敗寇，但勝選一方似乎更該有氣度，不是只剩片言隻字喊口號。

 
阿扁總統當年首次勝選後，拜訪許多在野黨人物尋求共識，如今只看到于美人找各陣營發言人喝和解咖啡，遠遠不夠。世代對立亦然，君不見韓粉父母無助會社團裡，充斥多少奚落訕笑長輩，炫耀反中勝利的言論！

 一個台灣變成楚河漢界的兩個世界，相信沒人喜歡這樣。希望輸的一方開始監督政府，贏的一方開始綰合國民，畢竟選舉撕裂一時有，建設國家無盡期啊！",1579392970,"/udnip/photos/a.216583458408163/2901166413283174/?type=3&eid=ARBeH8iHq7Kn7qQap9nhplprB_iDq3wbrLHkKC0Lt_zxA7-mQ_-TZtPLlW0ILA4ohJ_78dybMu1SbEcS&__xts__%5B0%5D=68.ARCdwSvPp9kEcUp5syr10KRqbOZAgkc6E-t0A1NN_WX-26fx-HJtQ1x4aFn6k6PkqFFd3ZnyvrWbqDR1l4Yy_JAXzK5Jf4O59_zQ-Tm6Fp9R-O2z6Klty5TWQDC3oFJMgw_jkikPqN7zEb8CzE4EX4tRBZvNcwfVPgIyvY1RM1hDl3AqEnwK28nF2FeAm-49WgjzQmPeWYJzElZGWkhziziBjSSdPXlngLWbPjUfQRcAyw0zqb_o58CmrUmPEt34xIql3ca6EKX0aXgc31JjVeG0BABZ0ssIRkBRBzkF7Uej3idxxitqpnNMftW6_5AD3_shoojMgTn3HsDSxOExruHRHg&__tn__=EHH-R","https://scontent-sin2-2.xx.fbcdn.net/v/t1.0-0/p526x296/83077051_2901166419949840_133265971837140992_o.jpg?_nc_cat=105&_nc_ohc=tlGXaZIB5zUAX-GKGpa&_nc_ht=scontent-sin2-2.xx&_nc_tp=1002&oh=6c0b271c70a6d17741d3a64056599ccb&oe=5E918149",undefined,"",""
"https://www.facebook.com/udnip/posts/2901170173282798","1579334419","入年界掃塵 來年避邪神
何石松／教（桃園市）

 明天農曆十二月廿四日晚，正式進入年關地界，客語稱為入年界（也就是「小年夜」，俗稱除夕前一天）；但「入年界掃塵，來年避邪神」，仍具現代意義。

 
入年界要掃地除塵，有一段邪神在玉帝前造謠生事，認為人間是罪惡骯髒淵藪，想要懲罰降罪；幸虧灶神獲知。要大家從廿四日晚上起，開始打掃，使得全家乾淨的傳說。雖是傳說，確是最好的衛生教育。

 尤其是入冬以來，常因禽流感發生，撲殺數千甚至上萬家禽。近日大陸武漢也因肺炎疫情，專家認為不宜輕忽。看來，未病防疫，注重環境衛生，極為重要。

 入年界掃屋除塵灰，是見微知著，是對邪神瘟神的預防。所謂「天垂象，見吉凶」，對鄉野智慧經驗之語，實宜以戒慎警惕之心看待。

 
例如日前北台上空，傳來幾陣雷聲，即所謂冬雷。一般言，冬雷是不吉利的。諺云：「雷打冬，十個牛欄九個空」「十二月（農曆）打雷，豬仔母使捶」，是指十二月冬雷，可能造成豬仔無端死去。其實冬雷引豬瘟，殷鑑不遠。民國八十五年連續三年冬天打雷，這三年發生口蹄疫，豈非「冬裡雷，屍成堆」？

 面對過去的禽流感，大陸的武漢肺炎疫情，不宜等閒視之。如何避免邪神帶來瘟疫蔓延，小年夜掃屋除塵，是最基礎工程。",1579392970,"/udnip/photos/a.216583458408163/2901169696616179/?type=3&eid=ARCRA0E3LPkCjiMfjzpy5m0rAg08E4fxYoNI68nqyctu-mbQceSWs9DcLiOgOoHEH9FBUJoJEOZmgT7v&__xts__%5B0%5D=68.ARD4hd12L1Wh6RXco-8x9lpXPBzzPZbDqFlSpBRWchBL033C4rEEWzWlL5w713wWu-oReQWb2fJTlGpw2VasaYAXnk-bbNAflguk4qqRedV-sbxY_IMzt8YjJIVV6BInfkBdKSDVphTiJKVFW8XhWU5pZJe8mBSe34kTaThu_a6lXxUswAL1kTRJINgUjKhAoHerOmy7O_H5uJVTGYbRi-gK0WTsaVhe51awvgQxJL79ngyrVNu2SrO_yQDz3hhKOvlu55-RxsCb8JgqV0i9AzZm54BYXMwI3UQVxE4APFmg4umDFB_SxMVfef08ufKz8QcpbZ4W0EkNbej8RBrGLYd3zg&__tn__=EHH-R","https://scontent-sin6-2.xx.fbcdn.net/v/t1.0-0/p235x350/82704785_2901169699949512_853581117507239936_o.jpg?_nc_cat=109&_nc_ohc=SJk798IgitsAX-ESzlZ&_nc_ht=scontent-sin6-2.xx&_nc_tp=1002&oh=507c940ddaede2225dcfea3b09c6cc1a&oe=5E9E0BC8",undefined,"",""
"https://www.facebook.com/udnip/posts/2899049683494847","1579240822","義和團式混鬧…藍營難團結
楊均承／退休人士（台南市）

 交戰雙方都以俘獲或刺殺敵方重要將領，達到戰略目的，且在心理作戰層面上可獲得震懾效果，美軍以無人機擊殺伊朗革命衛隊指揮官蘇萊曼尼，就是最新的例子。

 三國演義中「蔣幹盜書」故事，周瑜利用假造書信誘使曹操殺了曹軍中最擅長水戰的兩個將領蔡瑁張允，這是赤壁之戰曹操大敗重要原因。

 選戰也是如此，攻擊對方的弱點，否定對方的強項，是必然戰術。總統立委選戰，國民黨打的荒腔走板，一直隨著綠營製造的議題踉蹌接戰，以致最後一敗塗地。

 
吳斯懷領導八百壯士櫛風沐雨抗爭兩年多，有能衝能辯戰力，在退軍中有一定人望，當然深受綠政府忌恨，「下架吳斯懷」，凸顯綠營對他甚是忌憚。藍軍部分人士竟然也隨綠營起舞，說吳斯懷有爭議。若吳斯懷有叛國事實，政府當然可依證據法辦。若沒有，只能接續抹紅鬥垮，是選戰技倆；藍軍人墮入彀中不自知，難道藍營提名要先由蔡英文同意才算沒有爭議？

 選戰打完，綠營下架吳斯懷不成；現在卻由藍軍承蔡英文的未竟之功，繼續追殺。莫非這種義和團式的混鬧，就是黨的改造？團結是由先順著蔡英文的心意開始？

 藍營現在亂成一鍋粥，還嗅不出有一絲絲的中興氣氛。",1579392970,"/udnip/photos/a.216583458408163/2899049176828231/?type=3&eid=ARBmbVCfMk8XruM7x1vI0J1PccvwDnHYZOHRI2cz-4edcjHO_7A2Yv4SfDDUYe2Qqo2JpwU1EY96lO7u&__xts__%5B0%5D=68.ARBO5Ny0SSz6bX19AlNVxnwVPtdwklGppIJ4piJh7mHqajC3WZsLdKZlrQvcMiaOeIc2ianfwYEkSyH-nby0G8lqlAbOVRau4xr8Zd2ndUMFTdGOLUTTfuorIr8BiJoko_NnPuj2Qr5uN3EKEwy-s2xmNbtSEcrsXszAa8A9_822tcQNziXIZWdk_yQueOTzxaU5BaaNvtsGPTblJar_LayFusSZeiaIQ8NHOKfxjv15rSzTFf5otj-sbFMI-oWlugjBvmlyLzJXGZE8z5qehSiUg08a3ECLbSIMN74PaWZm6ZKJttpFmg94fSOiDAiLH0jYW9KBU0TDp-irPJxrAVFqow&__tn__=EHH-R","https://scontent-cdg2-1.xx.fbcdn.net/v/t1.0-0/p235x350/82146163_2899049180161564_410087325712777216_o.jpg?_nc_cat=104&_nc_ohc=OIi7X7roNmcAX8X67Ly&_nc_ht=scontent-cdg2-1.xx&_nc_tp=1002&oh=35407a3e2257c90797e635b6c672c43b&oe=5E9D998F",undefined,"",""
"https://www.facebook.com/udnip/posts/2898475916885557","1579165693","https://udn.com/news/story/11091/4290802…",1579392971,"https://l.facebook.com/l.php?u=https%3A%2F%2Fudn.com%2Fnews%2Fstory%2F11091%2F4290802%3Ffrom%3Dudn_ch2cate6643sub11091_pulldownmenu&h=AT3VOdAO2dshS5Wn9MObdgrS599Ssx6IfnxyGP1t0lrHmbImGscVdSJcv9cqcNgrS9WhcKNB_08EpPb5eZV66zRuhHSioZYZ3AzPBuxbBdVvNppDfWOdPYJip8YnilTsUinkS4Nnjb3MkngMNolf28lAP4csvv0wPqymU3avqOA06iZGvUb0ciLC7QGcn1R0bTiw5QdMOVDHeRAIIUAgfGdbZiadL94cC-Fqu3g2HSwQ5c7xTztJP9pMfy3Tm-uzfMDTruKkuGQH7XTBMsLNmn4KObK7SFoL40dvO62EGD9NyyEHtIFM6wJXFXBOPx9d6eFEOeACJsGDAuSUq-EsPFMoM15aJzigUyGksLyKUaJuDuFY9ukhxf5Coc3k-_t2-TgBd0ISqny8qy6TA1DcryhyIMWAmrjP9LqIma49nc-Qhqtwtcq6a6XyaO6O1_XCwPA1seS1SP5-k-Kf_K6WKsBBjLSzTjBRQ0gynWr5UdlwRpZMtwuXDcX_WrR9VbIOCMliPgnKodR-6V45BQ-vFlYJuFHZ0aoDi94Fotx4FcD_6viEjQL2hpd69FmEZmLoHzNWK5VsItzOK8CVy7pc-_7YauXgqBqlpMXNJyyEuObAuui1loKxfhRa2tBiFynQRyCFIX4atrZwVixk","https://external-cdt1-1.xx.fbcdn.net/safe_image.php?d=AQCTr-gTvj2gTNUX&w=540&h=282&url=https%3A%2F%2Fpgw.udn.com.tw%2Fgw%2Fphoto.php%3Fu%3Dhttps%3A%2F%2Fuc.udn.com.tw%2Fphoto%2F2020%2F01%2F16%2Frealtime%2F7342790.jpg%26s%3DY%26x%3D0%26y%3D0%26sw%3D899%26sh%3D599%26exp%3D3600&cfs=1&upscale=1&fallback=news_d_placeholder_publisher&_nc_hash=AQBlBuxUhAMm05AC","No photo description available.","在過去幾回合的美中貿易談判中，美國加諸大陸進口商品的懲罰性關稅，一直是爭執的焦點，中方堅持既然貿易戰已經停火，美國就應該...","udn.com【重磅快評】為何大陸會吞下懲罰性關稅？ | 聯合新聞網在過去幾回合的美中貿易談判中，美國加諸大陸進口商品的懲罰性關稅，一直是爭執的焦點，中方堅持既然貿易戰已經停火，美國就應該...在過去幾回合的美中貿易談判中，美國加諸大陸進口商品的懲罰性關稅，一直是爭執的焦點，中方堅持既然貿易戰已經停火，美國就應該..."
"https://www.facebook.com/udnip/posts/2898962893503526","1579215635","#黑白集
許宗力抗海妖

 
沉默了一個月，司法院長許宗力終於藉著司法節演說，對陳師孟約詢法官一事提出批評，認為這有害法治。自命「死豬不怕滾水燙」的陳師孟，則仍維持不怕燙的姿態，說許宗力是「自欺欺人」。

 
監察權意圖侵犯司法權，司法院長卻默不作聲，許宗力當然自知不妥。於是，選在民進黨大勝後的司法節，發表了語重心長的談話；這是他對司法官情緒的安撫，也是對自己院長尊嚴與聲譽的維護。這番演說，雖稍嫌來晚了，但總比迴避得一乾二淨好。

 
許宗力在演說中引述了荷馬史詩《奧德賽》的寓言，稱海妖利用歌聲魅惑航海者，使他們忘情而觸礁葬身。他形容，外界對敏感案件的政治激情，就像海妖迷人而致命的歌聲，卻潛藏翻覆法治的暗流。他期許，司法官要能抵禦政治獵巫，也期勉民眾要像希臘英雄抵抗誘惑。

 
不可否認，海妖賽倫的歌聲是難以抗拒的；連許宗力自己都掙扎了一個月，才通過那道險惡海峽。我們不知道，許宗力是不是像奧德賽一樣把自己綁在船桅上，以抗拒海妖歌聲的誘惑。但如果連許院長都花了這麼長的時間才勉力渡過，那麼，他隨行的水手們在這段時間的驚心動魄或意志動搖，將可想而知。

 
無論如何，許宗力重申司法獨立的意義，並呼籲司法官獨立超然，仍是意味深長的。尤其，面對一個仗恃總統任命特權恣意而為的「海妖」，司法官都不免動搖，又教民眾如何扮演希臘英雄？",1579392971,"/udnip/photos/a.216583458408163/2898962286836920/?type=3&eid=ARAR5VuEdcxsgI6LUj_IzC9-Prcd0wc6B4vjAVziX20_5P5qpPzu0j1OBvr8Tl5dfD2phGN5uuNyQ6bU&__xts__%5B0%5D=68.ARC_KYfwyinQE8tiupLV252TCEF52UZ1Y4uJ2lbznxP-AgvsGxOqCRYvsZFbYg1hK5kvk8vYm9LvrRIG-iBgKsRI1vfoVY6tQxVxhKQGUCPKwg0ego78F9DgscPj1r50Tsig4dW4uF25-FVsXxOHVj7cZuyt7KttlSvhZ_sG_eF_Ax6ax9NiQNa0nd82i32t6cZRMf8dQT2p7LhDgN-n2nvUJJO-f0jFuG1f-mJUZF_4F-8qOwRz3LkZ995pAZhoy0JDsVjGjcMpBoGumtvMahikEhUTUnEaj4S078zRnoEE3waT4aC1fmGwMkZ7mz-0Shz_VtS9_c2jtNyt40kllTXl8w&__tn__=EHH-R","https://scontent-sin6-1.xx.fbcdn.net/v/t1.0-0/s526x395/82522757_2898962293503586_7857039186472206336_o.jpg?_nc_cat=100&_nc_ohc=ln9kaG3dtYEAX_Ql-HS&_nc_ht=scontent-sin6-1.xx&_nc_tp=1002&oh=60dff4598dff2c2b501c284b4b544b78&oe=5EDAC579",undefined,"",""
"https://www.facebook.com/udnip/posts/2898973620169120","1579219218","#酷經濟
ＡＩ仿真人令人驚豔
林建甫

 
日前在拉斯維加斯舉行的年度消費性電子展（ＣＥＳ），再次帶來應用科技新趨勢。今年有超過四千五百家廠商參展，展出主題涵蓋５Ｇ與物聯網、數位娛樂、自動駕駛、區塊鏈、工業製造等等。

 
最令人印象深刻的，恐怕是ＡＩ新技術下的各式機器人。例如，因應老人化社會，三星的機器人Ballie標榜就是生活伴侶。這個外觀是球狀的機器人不僅是電子寵物，更是一位電子管家，它支援IoT設備連接、語音控制、配備攝像頭，幫助老人家庭管理。接受人類口頭命令，做居家的各項幫忙，「看到」家中老人摔倒時，還會提供幫助，預計在未來兩三年內就會上市。而最新SONY的寵物式機器狗Aibo，更是反應靈敏，能與家人聰明互動，並給予老人家安慰及歡樂的陪伴。

 
另外，三星首次公開的「人工智人」Neon，展示「仿真人」技術。這不是生物「複製人」，而是電腦生成的影像虛擬人。栩栩如生的眉眼、自然律動的嘴唇、舉止逼真的動作；這些人物看上去就像真人拍攝的畫面，但其實是虛擬的。

 這是三星旗下創新實驗室STAR Labs獨立開發出來的。使用Core R3、SPECTRA兩大技術。Core
R3代表了Reality、Realtime、Responsive核心處理，負責各項立即的反應；SPECTRA負責智慧、學習、情感和記憶。兩項技術互補下，賦予Neon真人一樣的音容、笑貌和言談舉止，也有表達情感和智慧的能力，讓對話者體驗達到「沉浸式」的效果。

 
之前也有類似數位人，比如數位王國製作的數位鄧麗君，以及搜狗和新華社聯合製作的ＡＩ合成主播。但它們是用過去影像聲音來剪接合成，而Neon的新技術對人物原始面部、聲音等資料進行捕捉並學習後，可自主創建未錄過的新表情、新動作、新對話，甚至能說其他語言。

 預計未來Neon角色不是全知全能的，每個
Neon有自己的特長，能扮演一些職場中的專業工作，幫助人類完成一些需要接觸人的任務。例如，擅長瑜伽的Neon教你練瑜伽。有些Neon做導遊、財務顧問、接待、主持人，甚至電影演員。

 Neon沒有實體，而是以真人尺寸存活在螢幕中。極其逼真的效果，足以超過遊樂區的恐怖谷，這新技術已經成功的讓Neon成為二○二○年ＣＥＳ的重要話題。",1579392971,"/udnip/photos/a.216583458408163/2898971776835971/?type=3&eid=ARDj2F8abitgoNQaehDxKrXYjT20vCjp_99r777L_dj21jWtezPwb4B5hZLur2mgzJc07txqsNenN3Nj&__xts__%5B0%5D=68.ARBSDa67Le3aLmLNxmfPb99hqVhERHWgLTgNUs9FH90tAQHXln54eP6BIpk2S5MzmFLhZs6YajpZhvAQtiCP5_b9Y80mMEec-u4bJRFMlVIFvlEV6pX_TBOk4eB-rv2laNW_tvcSae1L4FU-wauY_LJ2II_4BIcJW54DNWfVhUDePfb6IERKfOVKlZ--NiNKXEDC668Qd6BtK-3NI5DT__PWr-yq2HYjHqRFVEyE4PkGOHSBRQVMHzwbFOg1BFkEeUy6ZtGhUQEyJt4LsWAn5dNtPWhywOQ8HxIA4aM03quRTtc-vY8baFdASQXw92j-gkeJLm1TL5mf5cQO0DdilXiXBg&__tn__=EEHH-R","https://scontent-frx5-1.xx.fbcdn.net/v/t1.0-9/82427116_2898971780169304_2732702976786300928_n.jpg?_nc_cat=105&_nc_ohc=bsTjmuVEQlsAX_RQCSP&_nc_ht=scontent-frx5-1.xx&oh=f84cf6858b935d723ee284b4c6839521&oe=5E98AA06",undefined,"",""
"https://www.facebook.com/udnip/posts/2901121243287691","1579330805","九二共識的世代斷層
成靜傑／國中導師（台南市）圖／取自李明賢臉書

 
甫結束選舉中，在「亡國感」氛圍中，大部分成長於兩岸和平紅利的年輕世代，對「抗中保台」投下贊成票。至於「九二共識」這個爭議名詞，也成被檢討對象。但有意思的是，在這片批判聲浪中，究竟有多少年輕世代有機會認識九二共識內容、脈絡及影響呢？

 
九二共識，確實是台灣於一九九一年終止動員戡亂時期、不再視中共為叛亂團體後，九二年由海基會與海協會完成香港會談及其後書函往返，所創造出對「一個中國」各自解釋表述的詞彙。兩會接著又在九三年藉著辜汪會談簽訂的多項協議。

 
在這樣的平和基礎上，過去將近卅年、一個世代時間裡，兩岸間經貿往來已成為如呼吸般自然。而這份在兩岸對峙四十年後才發展出的和平紅利，對小老百姓而言，也早如呼吸般身在其中而認為理所當然。

 
年輕世代都曾在歷史課本中見過，解除戒嚴、終止動員戡亂時期、辜汪會談等發生在上一代的事。在目前對歷史偏食環境中，卻難以與自己的生命經歷進行連結。目前世代間因對於選舉立場不同而撕裂狀況下，長輩們是否願意與下一代好好地述說自己在兩岸劍拔弩張、隨時面對戰爭危機的生命經驗？而年輕人是否願意耐住性子、想像長輩珍惜眼前所擁有一切的心情？

 世代間暫停批評、攻擊，社會自然能有和解的機會與進一步發展的動力。",1579392971,"/udnip/photos/a.216583458408163/2901120713287744/?type=3&eid=ARBJk0dQGmqAmjaEz1UQ9pL1aImDq4-Ay6NiEx-0FDhjENOX6ZNICVfiGk7PeW0xWieNbX_hdmxyw2_y&__xts__%5B0%5D=68.ARD4R4RDcsFUT4Djj7TkLONVg7h33E8HDnvpGov0pBzK6By4eaqsO-YhnNw_rhQM-vpas-GsR4kafmXJk6jbSy6rjWahJBCyRF7AG7tjiaKV5u0Ljb9Pz841C9eZIJJqphmVqYpPfaWPjFStlygZa7AY4q-cNtIf6fUpVfDgWxaneOYLCz8_H9_pOImXLWLsjS1CeZjBAgrF7y2i8NbiTNaDdf15T-teLMl7Z52irElosu7ntP-qPickkm3DN7cS1bZPpXepfqDkNpQJhj3xHWOcwEBIBtqYkZXXugoIkvzzkavyjxGbuB2h76z3iuzKgAXDdh46dVBX6LlQk--1ap_F5g&__tn__=EHH-R","https://scontent-sin6-1.xx.fbcdn.net/v/t1.0-0/p526x296/84041594_2901120719954410_6353632703945900032_o.png?_nc_cat=111&_nc_ohc=gyg-AMIoncoAX-xI5P1&_nc_ht=scontent-sin6-1.xx&oh=56b664dc7efeaf8db54d70f38e5d01a4&oe=5EDA96FF",undefined,"",""
"https://www.facebook.com/udnip/posts/2896254960440986","1579077562","https://udn.com/news/story/11091/4288890…",1579392971,"https://l.facebook.com/l.php?u=https%3A%2F%2Fudn.com%2Fnews%2Fstory%2F11091%2F4288890%3Ffrom%3Dudn-catelistnews_ch2&h=AT2S_Gi1Y9hsOg8ED6g6Kj1foN-VulHB7n2xq0OftqeCGRovYd-XOST6Cujkz1Dlz6yMeEVPvD5YVoUELKUHMQl61rCttIfq8pdNtNdBxLn__yGiKIC3ET703_4Z-Ogi2f76KVwrLM4EacwZ59uWQgrP9IoQQ-gituLLJgCKxtUQ6yNvkjoZ_AfvySkiW_PQN1L5V-zZgenpUswGY9mP0q40dU3ZdKwRMB-Ol8DNCdh5j3CEctoZgyUc_qmDXc8nJ03rn0nsOeE7UNsqpiWa6e15hLj4rXWyFzF-6mp4fFtXyYOX6vVxOOyoex4dWjBrICBl-uzLtl3c5w62hIXNHfgW35iktQ3YteCu1PprZoNIIBZERXp9s-pqXYxNhMRLd6prCtyEoRnPL4-kNjpuk3x8imXM8rquds03W-UPlVH_lGSmbjU3UsqseQfR_0v9Yg88TJ1NVspKDq2ib9dbljG-8KJo0nklI0td-hJzZRIzgnmuWYwmiymiA__YI3Ars4W3jg8mmHrXnCu6FRQipulyomdvL_Owvs38pyqLW7hopiM-mBH6xH_JIzHzVwGBYOk4RJhVP7JaMOnGVUPX8Y43OxtZ_AFEq1_-RchM3BqcqziDwzQvByIwPvJrWS27e8fOjjKRc_KiIMUM","https://external.fbkk7-3.fna.fbcdn.net/safe_image.php?d=AQDFvkk0qeMdlVXy&w=540&h=282&url=https%3A%2F%2Fpgw.udn.com.tw%2Fgw%2Fphoto.php%3Fu%3Dhttps%3A%2F%2Fuc.udn.com.tw%2Fphoto%2F2020%2F01%2F15%2Frealtime%2F7338683.jpg%26s%3DY%26x%3D0%26y%3D0%26sw%3D1280%26sh%3D853%26exp%3D3600&cfs=1&upscale=1&fallback=news_d_placeholder_publisher&_nc_hash=AQD_FEf7Zg4kx7_t","ไม่มีคำอธิบายรูปภาพ","蔡英文總統贏得連任，她在勝選當天呼籲支持者放下對立，在選舉結束後要擁抱家人。這段美好的談話究竟能不能實現，我們不妨從台北...","udn.com【重磅快評】被消失的柯市長是不是蔡總統的家人？ | 聯合新聞網蔡英文總統贏得連任，她在勝選當天呼籲支持者放下對立，在選舉結束後要擁抱家人。這段美好的談話究竟能不能實現，我們不妨從台北...蔡英文總統贏得連任，她在勝選當天呼籲支持者放下對立，在選舉結束後要擁抱家人。這段美好的談話究竟能不能實現，我們不妨從台北..."
"https://www.facebook.com/udnip/posts/2901091969957285","1579309238","#聯合筆記（蔡佩芳）
選政治家還是綜藝咖？（歐新社）

 年輕選票走向，影響選舉成敗的關鍵。甫落幕選舉中，政治人物為爭取年輕選票的各種努力，已到讓人眼花撩亂程度。

 
蔡英文總統找網紅合作，拍了一系列影片，包括本土味濃厚蔡阿嘎、「國際美人」鍾明軒，還有以「撩妹」系列影片走紅的「波特王」，蔡英文總統開心被「撩」，波特王的影片也標榜全世界第一個撩總統的Youtuber；國民黨總統候選人韓國瑜上博恩夜夜秀，表演盤腿用膝蓋走路高難度瑜珈。

 
還有人把民代當藝人經營。立委林昶佐重新頂著閃靈樂團主唱身分，把演唱會當造勢大會操作；新科立委高嘉瑜也要辦謝票演唱會。第一位當選立委的八年級生賴品妤則cosplay扮裝秀，在林昶佐演唱會扮成動漫「新世紀福音戰士」女主角明日香，緊身衣造型登台、在蔡英文新北市競選總部成立大會浴衣登場、臉書宣布當選的謝票文則是扮成美少女戰士火星仙子。藍營也有立委許淑華神力女超人，超短熱褲秀長腿。

 
想要吸引年輕人眼球，不是只在台灣。日本首相安倍晉三過去一年也頻和藝人同台互動，招待藝人大泉洋、高畑充希共進晚餐，與傑尼斯事務所旗下團體「TOKIO」、「關八」對談，在東京巨蛋觀賞「嵐」的演唱會，還在推特、ＩＧ貼出演唱會後在後台與「嵐」成員談笑照片，安倍還參加吉本新喜劇演出。首相與藝人頻繁互動在過去十分罕見。安倍經濟學受到年輕族群支持，成為政權穩定基礎之一，安倍此舉被解讀是在擴大年輕族群支持基礎。

 
政治綜藝化做法，日本人並不買帳，安倍反而招致批評，安倍與藝人互動集中在五、六月，被認為意在參院選舉，把藝人當成政治商業廣告。民眾留言希望安倍不要利用藝人，甚至認為國會應該要求安倍進行報告。安倍用政府賞櫻會廣邀藝人出席，差點釀成政治危機。

 
日本也有藝人從政，網路聲量強大的政治團體「令和新選組」創辦人山本太郎就是藝人出身，但當選參議員後，便脫離演藝圈；早安少女組前成員市井紗耶香去年代表立憲民主黨參選參議員，或者套裝或者輕裝在街頭演說，卻不會載歌載舞。

 或許正因為政治是嚴肅事情，所以需要輕鬆面對。選政治家不是選偶像，年輕化不應該等於綜藝化，中間的分際需要慎思。",1579392971,"/udnip/photos/a.216583458408163/2901091586623990/?type=3&eid=ARCFUhsnrtv2KdlsSO0vGKbkYOCb5o4wqDLiZDgRIKjjtlgcDnmlTS1zdSxqvgpHygD4pRJ_xQ-IMcgf&__xts__%5B0%5D=68.ARAmLgjEgJg-N45rgBn7Fof46X_GkvfOt_5VYUCrMmIufq8GwnESEyH9e6lC3GDVHyhNsSrURnCyo3CwwOEN2hzVM9kNjU0gzffDWSNeB-8naYoxMolayeb--OAHTnFd0vlxe_s0JegWwZAIPftldEg7DFyKX9CET1KP5JQlGg4ilNgpTHu0yDo1sFhg7wkXCV4lNwjKR5HfjARU7ERTT0CqpSXSK4hbcO58lac8_0eP5L1SVnQMVbaiuIDCF5-p4fL3wVt9H254I05wcbaLx4UB93DXgIYRHyYq0bgVOkZ5Lgr2OgvuOCCc68rFfnrMLzYlUa8XJQN3V7qcwOAYsUyEJw&__tn__=EHH-R","https://scontent-sin2-2.xx.fbcdn.net/v/t1.0-0/p526x296/82803940_2901091593290656_2408958740129644544_o.jpg?_nc_cat=103&_nc_ohc=ksr6zfkEnc4AX_TcTP0&_nc_ht=scontent-sin2-2.xx&_nc_tp=1002&oh=e791da1828400e2d3a85b4872e7163c3&oe=5E8D6D9D",undefined,"",""
