url,posttime,text,crawled_time,attachment_link,attachment_img,attachment_img_alt,attachment_title,attachment_brief
"https://www.facebook.com/yaboo.lalala/posts/2263096143709162","1545112135","help",1579301875,undefined,undefined,undefined,undefined,undefined
"https://www.facebook.com/yaboo.lalala/posts/2763469077005197","1569805863","早安，我們今天正常營業喔！

 歡迎大家來喝咖啡，但也請注意路上安全，出入平安喔！❤️",1579301880,undefined,undefined,undefined,undefined,undefined
"https://www.facebook.com/yaboo.lalala/posts/2528361143849326","[Error]: TypeError: Cannot read property 'attribs' of undefined","",1579301879,undefined,undefined,undefined,undefined,undefined
"https://www.facebook.com/yaboo.lalala/posts/2662313860454053","1565315600","今天正常營業喔！歡迎大家來喝咖啡。

 但還是要注意路上風雨，希望大家都平平安安出門，平平安安回家。❤️",1579301874,undefined,undefined,undefined,undefined,undefined
"https://www.facebook.com/yaboo.lalala/posts/2512889165396524","[Error]: TypeError: Cannot read property 'attribs' of undefined","",1579301878,undefined,undefined,undefined,undefined,undefined
"https://www.facebook.com/yaboo.lalala/posts/2489834461035328","[Error]: TypeError: Cannot read property 'attribs' of undefined","",1579301881,undefined,undefined,undefined,undefined,undefined
"https://www.facebook.com/yaboo.lalala/posts/2523135424371898","1558928001","很多瑣碎的日常，構成了生活的樣貌，構成了一間店的模樣，而這樣不經意累積起來的日常模樣，或許也安穩的撫慰了一些人的心，比如我。

 早上來吃 老漢推堡
，店裡兩位帥哥一起合作，一個是身兼藝術家、刺青師、塔羅師於一身，另一個是樂團剛獲得本屆金曲獎入圍的厭世少年主唱，兩個年輕人早上在YABOO借場地賣起了漢堡，有時候早上我也會來吃，感受一下在自己的店當「客人」的感覺。

 
就像現在，還沒踏進大門口，路邊就放了一個他們自製的招牌，走入庭院，桌子上擺設了一下，他們佈置出了自己的感覺，很棒。當然，最可愛的是虎面（咦），睡到歪斜真的很療癒。

 
但就是這樣的一切，讓我感到很安心。就算生活中煩擾不斷，雜碎待處理的事從來沒有停歇，但還好有這些日常，讓我感到無論如何都有支撐的力量，也希望這樣的安全感能帶給客人，就算萍水相逢，也希望你在這裡有感受到一絲溫暖。

 然後，嗯！漢堡很好吃，週一到週六早上8:30-11:30，歡迎早上來吃好吃的漢堡。

 文/Tina",1579301874,"/yaboo.lalala/photos/a.655320131153446/2523120307706743/?type=3&eid=ARBc4Y4aWyBZim1MneNpbgsLS8pVls-JSc3YGBNkVKpKYjvppWLxe0YjFh2mcuS2vmmRtHccQG7SCtau&__xts__%5B0%5D=68.ARAaePsFP59uWT3LM2u2IQlaNlhx7Z0LoYsYWO4oIKEhOJmxjr5MIUD380T-xWxiNCq8nx9gywJYuhHi5Ivc-SGBauoMJHl9RBLdHYbhbQoMYtrfK4PKubFNeOqY_TxxZPK2F00ZDpTuer2KF4yALQgBXEYRXCYwhWbu7B2a-CvMS7Vn7UYFdy0z8u3-A7KTNbUIY7zgVGCd45GX37MsvIaKByzZrgu_G7xCXZbLkd4I-KocrM9Hn5pssoG-leDdYkfVXSZvnVLptNswPq3o1jlOmx0dljKmaCLK73DyCOPhA-CNUIO1Zj1_Fu14Koh3twJy4tPY8goytafX3iJQAb5-uw&__tn__=EEHH-R","https://scontent-cgk1-1.xx.fbcdn.net/v/t1.0-0/p526x296/61559978_2523120311040076_8841682317643612160_n.jpg?_nc_cat=100&_nc_ohc=KTrK02YEg3YAX8PCPDj&_nc_ht=scontent-cgk1-1.xx&_nc_tp=1002&oh=405e124fff5d0e8915beaefa97d1ccd3&oe=5E943D0D",undefined,"",""
"https://www.facebook.com/yaboo.lalala/posts/2464795393539235","[Error]: TypeError: Cannot read property 'attribs' of undefined","",1579301885,undefined,undefined,undefined,undefined,undefined
"https://www.facebook.com/yaboo.lalala/posts/2398180126867429","1552471826","剛剛有個戴安全帽的男子，居然敢在光天化日之下想抱走虎面！！！

 還好店裡的熟客剛好路過喝止了他，我們也出動現在正在電競的同事朋友們通通衝出去找虎面。

 還好虎面安然無恙！阿彌陀佛！🙏

 
不過，我真的不知道戴安全帽的男子想幹嘛，但我真心希望你不要這樣做。如果你心情不好，或是厭世，可以找一個咖啡館坐下，喝杯咖啡，看個書，冷靜一下，透過閱讀感受一下生命還是有其他美好，但拜託，千萬不要做殘害生命的事，你的生活不會因為這樣變得比較好。",1579301879,"/yaboo.lalala/photos/a.655320131153446/2398175470201228/?type=3&eid=ARDkOKTQ5oUlX2v4m32BM4kbqmwPwd8ZavSe-3_4CA8rAdHWeMb1P2nwgZYbQoS8GzSb-NUR8E5KZHME&__xts__%5B0%5D=68.ARDj-6bGXvM_cxapg1TfKVEbmPHN_Tur_2G51aMNfTcJHlDLIu3CsAvvTZ6V9PqTUunRUf9wfMbphweAR9P6TF_osu90ZJBhx6tIBGg-ybdr2Oaz17dhaRwjDvO3arbSLflqE-HV2QRVoc1JTP87uobx1Qve-bhtRHMHZUyTgM2h7hKgt6I0uzT3s_2JeBwexJMgODDICWPlAzaaaqhoRbqygpnldoDJPcmlPs8gf9JcQhxJ15jZX_x6G7m5d6Zni8TE-LwABRO1IUw0QU3ERWVNiIJE_rUGH_dn0YzM8atMGr4b3zjFzm0rg6HFikhCAUqBGeBwuCwYFiSnqESa0hFs8A&__tn__=EEHH-R","https://scontent-sin6-1.xx.fbcdn.net/v/t1.0-0/p526x296/54225903_2398175473534561_2409932022668591104_n.jpg?_nc_cat=108&_nc_ohc=2pFd5tqg224AX-nif1g&_nc_ht=scontent-sin6-1.xx&_nc_tp=1002&oh=4668d35b36ba0d630999810070907443&oe=5EA862AC",undefined,"",""
"https://www.facebook.com/yaboo.lalala/posts/2245535698798540","1544147847","博客來正好推出大人書系，買兩本打75折喔！

 
書系中蠻多「有鹿文化」出版的書籍，有理財、文學、老子、易經、飲食......等類型的書籍，蔣勳老師、對我們很好的陳念萱（我們都叫她念萱姐）、王溢嘉、王浩一......等作家的書目都在其中，當然，也有我們兩姐妹的書啦！（對啦！我就是來打書的）

 庫存還剩四本，要買要快。當聖誕禮物、新年禮物、生日禮物都很適合呢！
（咦！真的嗎？）

 #想不到書籍真的有在動
#只是動的比較慢
#賣完當然會再補貨啦",1579301881,"https://l.facebook.com/l.php?u=https%3A%2F%2Fwww.books.com.tw%2Fproducts%2F0010782864&h=AT3-aing4oIeA90RYIZ8fLhy87jNCxY0NUxJsTkJCm74fsgwvvRTElXG7pq-da0vDTTJlvcytdtGesTEzX3qjIekK9NbpadM51gEh22XTAZ6xS4tujrDZCH0Bz5WdQ4l2SKVxDK1RnIZp9c-dWuxw4QJfVTYK72Ytedi-PrbJo2zZV_6MWfhIZlXLtx4ID-_vE6V1x7KMS1Wk2FYAshzWl-LrUzf-kasycJXusWd5A2lOIf7yPbfRW0Z2zm3KnPw61-Rj607L2pmQ__GpdmXSbxq-zthwcuOSTkIpGgP5avPhtPD-aEpCJ30irdhLOl3gLuOddSQeNVaWAL__P73cyA_fOgAGQkSX-oi3rrjqx5n_xjMDostFzOMI-1wzgUvZ_ZaVNWx81v-Pk_n6ATmX3fAb9FpiiuAQrtPPLVRRiOQIfimJ4THiH8pbzKCQdOVzJh7RPmF8DUAOXeQ3cbsEmpWaraTzyiqx2sa107HT_hEAEcZIUmE8TTHyE61h9nACjyOhE0-7jUuL8ejK-1mV_TH5aqbcxy2zh2m-bMuLOhZxVYNo6EIG3bVPDfMtyPi6tIRc9Qj_fHz1RmEvHslxDv_7hwsZwv3Lq9HDjRXr24TkvWdlLXfcsA-ZibhE_6KoYwY1Z0bHzoduoZM","https://external-ams4-1.xx.fbcdn.net/safe_image.php?d=AQB6SEEm7eaJ9Uvn&w=160&h=160&url=https%3A%2F%2Fim1.book.com.tw%2Fimage%2FgetImage%3Fi%3Dhttps%3A%2F%2Fwww.books.com.tw%2Fimg%2F001%2F078%2F28%2F0010782864.jpg%26v%3D5ab2423a%26w%3D348%26h%3D348&cfs=1&upscale=1&fallback=news_d_placeholder_publisher_square&_nc_hash=AQBMClN_rRtFbSWS","No photo description available.","書名：我們都在咖啡店：YABOO姊妹交換日記，語言：繁體中文，ISBN：9789869596039，頁數：224，出版社：有鹿文化，作者：蔡婷如Tina,蔡詩敏Emily，出版日期：2018/04/02，類別：文學小說",""
"https://www.facebook.com/yaboo.lalala/posts/2364369316915177","1550596900","鄭重申告。

 
或許有時候我們的服務態度無法讓你全然滿意，那麼我們會虛心檢討，適度改善，這是我們該做的。但如果希望我們露出制式化的笑容，說出制式化的客套招呼語，那麼很抱歉，我們不走虛偽這一套。

 然後！即使對我們不滿，也請不要在公開的評論中罵我的同事有「躁鬱症」，說出這種情緒化的非事實言論。

 這種話，很過分，非常過份。

 
你們一整桌的人不滿意我們，當然儘可以上網評論我們的服務不好，餐點不佳，環境不好......之類的理性陳述，我們從來沒因為客人這些不喜歡我們的評論而口語惡言或惡言相向，反而會努力檢討，努力改善，因為我很清楚，我們必須盡量去做好每一件事，雖然無論怎麼努力，也無法討得每一個人的歡心，但我一直心懷感恩，因為人生路很長，但求懂我們的人一路相伴，所以每一個愛護我們的，我們都心懷感激。

 但是，如果你不喜歡我們，我當然也完全接受，你可以不用再來，但請不要侮辱我們。

 彼此尊重，是最好的距離。",1579301875,undefined,undefined,undefined,undefined,undefined
"https://www.facebook.com/yaboo.lalala/posts/2333013173384125","1548987804","報告！報告！

 春節期間，我們休2/3-2/7，一共五天。

 但在初一2/5會開下午一點到七點，只供飲料，不供應餐食。

 如果有在台北過年的客倌們，想要到東門站永康街走春逛逛，走累了可以來喝杯咖啡歇歇腳，陪過年都待在店裡好無聊的虎面玩玩。

 2/8初四開始正常營業！只不過菜商還沒開工，餐食要到初五2/10收到菜之後才會開始供應喔

 這期間大家就乖乖在家裡把豐盛年菜慢慢消滅吧！

 附上虎面傲嬌照，恭祝大家「新春如意，新年快樂，恭喜發財」（幫虎面加一句：「紅包拿來。」可以丟在小費罐，這整個都是他的🤣）",1579301878,"/yaboo.lalala/photos/pcb.2333013173384125/2333010990051010/?type=3&__tn__=HH-R&eid=ARD_C0jeZ9gvzGgLUZk-zNd6kVix1t8dhhwSrOU3BlgzyfBnNMlMimR_eVw7yPuO2yYM2PQ8szY6etgO&__xts__%5B0%5D=68.ARB1dooi8mBZWN3D49WOdWr7ImNRrzr0AR5ft909QbcpV1yabAvwA71iaT-_IzFHWe2gkuMbQkmLyFQvDAFFn2zY7y71KyL9Fjy8dbOfCvDJ54XC4ckKn6lyidnDgqAhFCu_ITYAXG3kFaTLxYTuGNLpFWj9jUTYAJZkmh17avVZ6h5LdWWM8n2phkiDoC4vyC9VBc5aRWf_CsOZ5hrByHs8kqt02jVLmnkOJGlsAQk91pg4Qd7PAJMmtdMu8Ggb7NifCGe7Xj11c7sTZmFaOpwQcXxKUxL4IgtDOf2YNotLeqCT5fPDoUfCVZAl70QaiBhCpSenRCmNIPeFKWtLuwW8nQ","https://scontent.fjog3-1.fna.fbcdn.net/v/t1.0-0/p168x128/51665044_2333010993384343_993518835707412480_n.jpg?_nc_cat=106&_nc_ohc=U6lejnh0dWgAX-8mqQC&_nc_ht=scontent.fjog3-1.fna&_nc_tp=1002&oh=fadd91535d0b1ed3e76771c4332f2747&oe=5E8F5F5A",undefined,"",""
"https://www.facebook.com/yaboo.lalala/posts/2216940451658065","1542506881","豹頭5.1公斤了。

 天啊！為了讓他恢復到五公斤以上，真是卯足全力了我。

 
豹頭來到我家後，真的過上了養老的生活。比較安靜的居家空間，除了讓豹頭神經比較鎮定，不再時常大吼大叫，便秘的問題也解決了，不需要再靠補充益生菌，唯一的困擾就是每次回家，大門後固定一坨大便迎接我（開門都要超小心），如果超過兩個晚上沒回家，沙發下方一定還有另一坨，還有豹頭很愛固定在某幾處尿尿，每天回家除了要小心門後的大便，還得先把家裡地板巡一次。

 不過這些都不是問題，豹頭只要健健康康的，開開心心的，要我做什麼都可以。❤️

 文/廚娘Tina",1579301886,"/yaboo.lalala/photos/pcb.2216940451658065/2216940108324766/?type=3&__tn__=HH-R&eid=ARB1cvdAU2bd_kEOD2-Xkd4tcK0vS6uxCIzhDEm_1Tkn36qEHY7R77pLrsQsdeuZVZ2iTy3z0h9T5KhT&__xts__%5B0%5D=68.ARCQhvikpcxazM84I51VOHKrhNZmAlVD-o2R-SrEYia0XGVWsEMhXmmi8a43T7L_2myWiigdYZHlMKEP65CwQE2ZWs5ocyhCQTZEArMdHm_1m__y8oBIIt2d7DwKxjS6CadduaP1npm1i3Rq9y0YkN_yg18DT2pHn6aAjUK8rIuJPRw3S55AHjT09dhdq6fVTXEnUhGDVq8Z6m2G8LmOHjzg0geQzzwLTV0rqV-pwmNcFbwvZOflewZJyegE7gjrkYuHZG6DDOUdbXTxed4C4nRIfGGGKoZyMsYwKuU-q5FFQyERgDb4OI3SRXgdi6NPMJe9p4QXedApJZixuPl0BuBTTg","https://scontent-sin2-1.xx.fbcdn.net/v/t1.0-0/s261x260/46508325_2216940111658099_5894710427551531008_n.jpg?_nc_cat=104&_nc_ohc=i8Gk6iyjepAAX-jC0gG&_nc_ht=scontent-sin2-1.xx&_nc_tp=1002&oh=4ec688b76aacedd46926ef41cf46de02&oe=5ED49823",undefined,"",""
"https://www.facebook.com/yaboo.lalala/posts/2291414844210625","1546668380","親愛的大家。

 我們已經很順利的徵到人，感謝許多應徵者的來信，因為咖啡館的業務繁忙，很多無法一一回覆，跟大家致上歉意。

 
另外，因為咖啡館的事務真的有些繁忙，在應徵人的過程中，所以常常無法短時間內回覆，有時候甚至要等上一兩週才會收到我們的回信，實在是因為平常瑣事已經很多，都是百忙中抽出時間看大家的履歷，而且我們也不會草率地看，每一封來信我們都細細觀看。

 
尤其有些面試的朋友的來信，看得出來是針對我們這家小店而書寫自己的自傳和資歷，文中甚至不時提到一些樂團和經典電影穿插引述想法，讓我們著實感動，也加深我們覺得要慎重看待每一封履歷的心意。

 面試像是談一場戀愛，雙方都要釋出誠意才能有機會走在一起。

 
所以有些朋友因為等不及，在假日我們最繁忙的時候打來詢問「為什麼還不回覆我？」，也讓我們感到非常的抱歉，千言萬語無法完整述說我們的苦衷，唯一能為自己辯解的，大概就是像上面所寫，因為我們很慎重看待，但為了維持咖啡館的正常運作，勢必必須先處理現場事務為主，才會造成時間差。

 總而言之，面試已經到一個段落，再次感謝曾經來信的每一個你，因為到了年底事務真的較多，無法一一回信，再次鞠躬抱歉。

 對於曾經來信，但沒有收到回信的你們，我們也祝福你們可以找到比我們更好的工作場所。

 新年快樂！",1579301873,undefined,undefined,undefined,undefined,undefined
"https://www.facebook.com/yaboo.lalala/posts/2263482497003860","1545136947","嗨嗨！親愛的各位客倌。

 明天晚上咱們兩間店要去吃尾牙和唱歌，兼提前聖誕節交換禮物（咦！我交待的會不會太詳細🤣）

 所以，明天只營業到下午五點哦！

 歡迎明天一開店就來轟炸我們，然後大家一起快樂的離去。（明天所有同事會回來協助打烊，因為訂位時間是五點半，我們要挑戰15分鐘打烊完畢💪）

 #吃個尾牙也要發揮團隊合作精神
#這就是YABOO",1579301882,undefined,undefined,undefined,undefined,undefined
"https://www.facebook.com/yaboo.lalala/posts/2106462039372574","1536111623","昨晚同事赫然發現，居然還有一枚。🤣

 「Janco」，你也太屁孩了吧？！桌面跟側邊各留一個，你的同學們或朋友們居然也包庇你.......姐姐我也是無言了。

 你的一時興起的好玩，可是讓我們得多花費時間精力清除，真的有點煩........

 以後千萬不要再這樣了。",1579301884,"/yaboo.lalala/photos/a.655320131153446/2106459312706180/?type=3&eid=ARBS0_X_DL8OVaLzaDwygPuKp5gGGFFOSDjlNW_n464533q3dWK-rcJvrfu0NL9tUjymKkhh1KX5cRog&__xts__%5B0%5D=68.ARA3d9kbgFN1FHAqhPt47k-4N-NyoM5NwSley7161qe8VTwXTvAdiZX3M9UhNzY88mQ3HqaBbciCb13iSVcMBV9L5XF-jvGnydf-O9vSeVx_c9IEvpsPoS9htFyQwgLaPocLqG6qxE688YNqQHL0AD8TQbXTiuhcw2wGS2yOXQY3skfeqkYtTiWIFODBQX0TGltIq43_fLvVE5GuS7mrK6br8omvarJ6v08MeDa41xOIySafiOVRl4v29XsqjyE3Pz4plbWX9ECslvF2EldVV72bIhYZbHysz1sgoQaUmXOL9myuv9T6M0nkKz-5FQLJi5jOd4SHbU-NstCGfp1akjjGcw&__tn__=EEHH-R","https://scontent.fcpt7-1.fna.fbcdn.net/v/t1.0-0/p526x296/40940634_2106459319372846_6528813506437840896_n.jpg?_nc_cat=100&_nc_ohc=qupGGUpX24YAX-twOVa&_nc_ht=scontent.fcpt7-1.fna&_nc_tp=1002&oh=ba0f38128b1624c1f36db5e0da98c74c&oe=5ED9AA14",undefined,"",""
"https://www.facebook.com/yaboo.lalala/posts/2099397273412384","1535647486","當年，我們很閒，閒到每次名片沒了，新出來的每一款名片居然可以都不一樣，同事之間還發起競賽，每個人都卯起來包辦名片設計。

 
尤其是點痣名片，根本經典，而且是同事因為一直被我們否決提議，居然膽大包天背著我們偷印，而且算準我們會心疼花出去的印製名片的費用，硬著頭皮一定會用，害我們那一陣子.........拿名片給客人都好害羞。
🤣

 現在的忙碌當然很好，忙碌才活的下去，忙碌還會被客人抱怨總是進不來（我跪），但有時候看到過往的照片，真的好氣又好笑，同時好懷念。

 
如今在店裡，也常常看到老客人。有的很熟，有的點頭之交，有的彼此知道但保留空間互不干擾。我覺得都很好，不管是以哪一種形式，在YABOO的交會，我都很感謝你們的陪伴。

 陪伴有時候，不需要言語，不需要激情或熱烈，但我心裡一直都感謝著每一個客人，感謝著八年多了還是會一直到來的你們。

 人生最難得的從來不是賺大錢，而是這些細水長流。

 #看到老照片就感性啟動
#我還是一樣浮誇

 文/廚娘Tina",1579301880,"/yaboo.lalala/photos/pcb.2099397273412384/2099397253412386/?type=3&__tn__=HH-R&eid=ARB3C4zd3v12BEy4YcRce4MGbkAWiYJjCzIgDa7pSSfwF-6LKeTq-BOYA9BnbbItLYgNrTe7WkICURCP&__xts__%5B0%5D=68.ARDzBNhKeK8IfaOb-b139ZZ_sjxIR0LkgY3k_--yDUQwY3WGJH-1EYy-XCBpzYBgUXCd9rUUqkvomUJpuG-XFsFwJBG_0OgTJ97kx31lSqU-BOwYnPXRSbK6GdAubJaKFY3zhZeknLEqqNDn0Jbn7tWZ2iOaoGh2a19Z3E6hVDubKkPxwg_1Ya9jH5wtMkf3VMV0PeIqNdvi5JQDhqav2LprScCr9Eqv1n8lUbf7ZeDcwZQEC0kv5S1s8tP5bzgoUUbbv_kdRQTSZFnXKNvL7TmQ4KOyw8qVIJKXn4rxD6-rfOWDioQRsTLd_vLbvrGFPQoPIa1hHngEFXFApgCZ_itg-w","https://scontent-sin6-2.xx.fbcdn.net/v/t1.0-0/s261x260/40463375_2099397256745719_1248973715127926784_n.jpg?_nc_cat=111&_nc_oc=AQkTa7JABVlYNBrH4dkvkooP4lA1ex9O0l_wgqwDFKoE-QZRSfIeiyNVjr2zB1Ax2qc&_nc_ht=scontent-sin6-2.xx&_nc_tp=1002&oh=c1815aaa15e9ea1e511e9e651e71b3f2&oe=5E952918",undefined,"",""
"https://www.facebook.com/yaboo.lalala/posts/2425984327420342","1553993234","其實，這兩個小夥子是要在YABOO門口擺攤！（還是巷口？）我跟Emily9年前也是賣過早餐耶！只是沒有像他們這樣走出去.....

 好像在10點前也可以在店內食用，甚至是現點現做！？

 反正，從明天開始，在我們12點營業前，多了一個同事的小事業在裡頭。東西我試吃過了，居然還真的不錯吃（我不想說很好吃，怕他們會太得意，呵呵）

 總之！就是這樣。歡迎來試試看在鴉埠咖啡裏頭吃漢堡（或潛艇堡）。

 P.S最開心的應該是虎面，因為每天可以很早就出去玩了",1579301883,"/burgerundian/posts/394673751328789?__xts__%5B0%5D=68.ARDHRLyZLwtMsljImpl08eKEDNZtJUprcuSD8uVQU2N5oFc-_8V0V67S1pe4bDqSJP3nJYslwzVrnVo0Hs6LNbdbvL-IqZy50mMZ5RBW6BzypXy6xFpK1mE7rH48QcBd93G-4YM_Y7Kj56hYuJZ_3QwxmqpZVm4qV-4hzUZjYXTAYB3H3bYH53pVXGD8MSCnCtFyGdnpfj4pT1kvi6EjLTJGZuXMOFxu89xI1eM8wQnk4m8usTGa43HpQ_HMHo2xAkeZ7AUs7-RRqU-mCNDwREd4rxt1K-baNGc5Zoc9Nbmt5JJ_7-MQDGKNDYOo9gpzZPnCOXMYXDCyasVbrbhzAusky1sr33o_mXQKPbLr1worB9KPs7TjcAvhE6CxNE8YjqohUpDHkuvX70fk2eWqbqNJuGft06CUyYkHBwENdBaRtgN9d832tQHVUMIZyw97csfenq-p7O2C4XHyfkRSGU9Po686wXT0t5v2t1eio7jIEILrLg&__tn__=H-R","https://scontent.fbkk5-3.fna.fbcdn.net/v/t1.0-1/cp0/p32x32/53934049_397968050999359_6973577388781207552_n.jpg?_nc_cat=105&_nc_ohc=TX2EmwGw6TQAX8ftrT7&_nc_ht=scontent.fbkk5-3.fna&oh=da5930fdba2508e1036da9e98b96c3c6&oe=5ED35AC9","老漢推","老漢推",""
"https://www.facebook.com/yaboo.lalala/posts/2234897479862362","1543556781","直擊豹頭尿尿（後面那塊地板已經都黑了）

 還有跟千尋對峙。

 豹頭的養老生活過的真爽。",1579301884,"/yaboo.lalala/photos/pcb.2234897479862362/2234895769862533/?type=3&__tn__=HH-R&eid=ARA3hiFAqlD4Za10_kPKUQlEAqMv48Fzc0ej5mrSOovUogfU0ytdSSN4zz8JwMJ8VnfR5M9091GlzqMT&__xts__%5B0%5D=68.ARCNFF_ii1m1JnpnUIC3cLVB17TDZVNA7QFrYj8S924jdxfGgb2P0uQwqRgKytODcBXL7pzU4VVNJ3ChK9AZwp4u-pwB-LyZsDx-K4oIy_rgQyBcmFBMzWKZ7mOENmUawCZPTrwhba-hfPfhXmUp46-erjeAWOLfMtxTfBsTf77pjiCOjFtPWG6mdGm2zlM1jwWlOaGLTYS5KW2-E1qc4dRyHac8CCKBkm20prbfmq6NE9UCU8rv2ITqfQhUIkn5iSHuPFkbwdBeKrz_IV6ZX_Qefsoaekp1VX6_CSFUGE4xpqmCKSy7J-DXkWEUjRO-6gcpTK7bOCOCPy6QcFsHN2cAcg","https://scontent-maa2-1.xx.fbcdn.net/v/t1.0-0/p526x296/47104231_2234895776529199_32290478959362048_n.jpg?_nc_cat=102&_nc_ohc=q6pL7_QZsZAAX_EzVdP&_nc_ht=scontent-maa2-1.xx&_nc_tp=1002&oh=33da702c5501d6885f382da4f8b71703&oe=5EA6C0ED",undefined,"",""
"https://www.facebook.com/yaboo.lalala/posts/2319799881372121","[Error]: TypeError: Cannot read property 'attribs' of undefined","",1579301879,undefined,undefined,undefined,undefined,undefined
"https://www.facebook.com/yaboo.lalala/posts/2283963881622388","1546270763","2018的最後一天，跟大家鞠躬說謝謝。

 謝謝這一年來的照顧，謝謝喜歡我們的每一個你，希望你們每一個人在即將到來的2019，都能夠邁向自己想要的生活。

 我們一起努力。明年見。

 新年快樂。❤️",1579301876,"/yaboo.lalala/photos/pcb.2283963881622388/2283963751622401/?type=3&__tn__=HH-R&eid=ARDEJV7HJ5iZacFo8JiPnxF236y6pJM5D9xungXWkg5GT51K742Dfr663B3rolJ0laEiCKaB5djz2bbP&__xts__%5B0%5D=68.ARCCtSqssBeHA4OiI5_U2b2sb4m3Eqvc7rL0O-ckJnP3pdhjDHRaT2C_rjcL-UcgjSbmolXl6Wc01PbqKf4pUydr_TS1RdWJcTGiuoxGxc657vnK9BUo8MqJXHa3vs9PP-CfFsiH8EiZRuFKiKMIP9qPpSe6bMUmeDnYI23xUWWuLJInkh7Tjrp916x7N406mdyY--9HKr0rz-SEiuAAosTtU-4q-CvlUt9kjBH0S8I0fngdn9Se9leDszwVO1xQJqkNSj-MFlPZvhkx8LXUL3NR54ay1ACmzk6VhhKsxcve_vSKi7G0EHJq-18tezGWjIZcTeWrINM6CWZrdPso4XIVTw","https://scontent.fosm4-1.fna.fbcdn.net/v/t1.0-0/s261x260/49033034_2283963754955734_7297769646361411584_n.jpg?_nc_cat=111&_nc_ohc=x58eM3c9RR4AX_HRLlx&_nc_ht=scontent.fosm4-1.fna&_nc_tp=1002&oh=5237c560ee1a01e2fb15058e1135c304&oe=5E9A6707",undefined,"",""
"https://www.facebook.com/yaboo.lalala/posts/2010011412350971","1531206737","不好意思，今天只營業到下午五點喔！
強颱來臨，希望大家出入都平安。
颱風過後再來找我們玩喔！😍","1571390179","undefined","undefined","undefined","undefined","undefined"
"https://www.facebook.com/yaboo.lalala/posts/2403767386308703","[Error]: TypeError: Cannot read property 'attribs' of undefined","",1579301880,undefined,undefined,undefined,undefined,undefined
"https://www.facebook.com/yaboo.lalala/posts/2239718746046902","1543826493","很快的，明年4月，YABOO就9歲，貳號店也2歲了。

 
我常常跟朋友說，一店是青春版YABOO，就像駱哥形容我們是一間廢柴咖啡館，平均年齡24-25的店員，的確就是擁有年輕人會有的個性，酷酷的（但他們的內心都是溫柔的），對未來可能會帶著期待和焦慮，他們還想知道自己的未來到底做什麼？可以做到哪？

 所以他們除了是店員，還有很多身份，可能是樂團主唱，可能是刺青師、畫家或是攝影師......

 他們當然對咖啡也有一定熱情，也很努力符合我們的期待（對客人要親切友善），所以我知道他們很努力的在做這件事，但偶爾就是會酷酷的，一時改不過來。

 
但他們就像當年的我們，有時候和客人之間會變朋友。有的時候他們會在各地的音樂聚會碰到，因為太常碰到，所以不知不覺變成了朋友，如果在店內遇到，他們偶爾會坐在一起聊天。所以一店總是很喧鬧，很活潑，很青春，很有活力，對我來說，那是個迷人的氛圍，一種人與人之間的友善互動。

 
只是有時候我們必須要承擔同事不慎的態度惹怒客人，可能沒有笑，可能不夠通融（比如客人壓在底線時間點餐，同事不願意讓步打死不出），當客訴發生，我們當然會生氣，但我也知道，他們真的不是故意的，內心也有很柔軟的一面，尤其我不得不說，每次虎面罐頭快沒了，他們一定會通知我，而且虎面的罐頭一來，也是馬上拆箱裝收納盒內。（這種事就動作超快超甘願做）

 
而貳店，完全是是成熟版YABOO，平均年齡28-29歲的店員，雖然和一店只差個幾歲，但性格穩定度就高出許多。他們也不像一店的年輕人有很多雙重身份，即便偶爾有兼差，但真的是以咖啡為專職。

 
但他們一樣保有著對生活的熱情，有的同事喜歡爬山，一年會有一到兩次回到雪山山上，住上個幾天來遠離塵囂，有的同事真的很喜歡咖啡，所以休假日可能會去跑個店，然後再回來店裡坐坐聊個天。

 所以貳店的Line群組名稱裡有「進階班咖啡師」這幾個字，代表著貳店和一店的區隔，在咖啡上是更專業和慎重的。

 所以，有些客人很可愛，要認真工作就來貳店，氣氛比較沉靜，但偶爾想感受青春的活力，就會去一店。

 不要說客人，我自己也是如此，每次到一店都有種變年輕了的感覺，在一店整個人忍不住都活潑了起來。

 但就是因爲太熱鬧，回到貳店後又會有一種清靜的感覺，這樣的感覺讓我很安心，有種可以好好安靜一下的舒服感。

 
兩間店我當然都很愛，雖然因為風格和氣氛上不同，一店像是「出好咖啡的獨立咖啡館」，貳店則像是「略帶獨立咖啡館風格的精品咖啡店」，但我覺得都很好，空間擁有自己的靈魂最重要。

 #最任性最臭臉的明明是虎面
#叫他不要進吧台完全沒有在管我們

 文/廚娘Tina",1579301883,"/yaboo.lalala/photos/pcb.2239718746046902/2239718106046966/?type=3&__tn__=HH-R&eid=ARDj9a9D4_Vx5cEBfd59k7StH6fyYRuIC0LChT7jYZjLxH8q-Iltu1FGCU5zgFybMOhVQax12uI1vz7k&__xts__%5B0%5D=68.ARD4r8Phy3oNUsNoKsJ-P5sinMA8mmOJJt45wvcjGLiMm_cHmx2H_jbILFpXiq-TSeTe-LIeW_X4fWm8joJMyPlnMYcLSMH1bWE5su3x3j9SJYGXPbg_tBI-VuG-ErewONO44nKiNfCiirEyYhtL6qYahWb2kyqyYO0YI7FZsdb9Igoeff5LCI5sbOsHvC-PDzTFnbIrvNlYLkHDCeVZS5m0BJA_Rmp6D8AwNiRNh6qHBKUFWI2Yt-wrHJe0U2gv_EBOA-Ogm554NthOxZ-cFBHW5yWugSRVJ8IRhuA3-yl6YUH11cRx4kBBI5UkdfwsMEcUy5ZqUYVeflvbmcJN7TKVQw","https://scontent-ort2-1.xx.fbcdn.net/v/t1.0-0/s261x260/47389878_2239718109380299_4837204945730011136_n.jpg?_nc_cat=102&_nc_ohc=otuMfyMU6CQAX9eRTw2&_nc_ht=scontent-ort2-1.xx&_nc_tp=1002&oh=eb4d139208f506174c15103308691de3&oe=5EA284EC",undefined,"",""
