url,posttime,text,crawled_time,attachment_link,attachment_img,attachment_img_alt,attachment_title,attachment_brief
"https://www.facebook.com/Young.Love.Yunlin/posts/2324060067838486","[Error]: TypeError: Cannot read property 'attribs' of undefined","","1571748167","undefined","undefined","undefined","undefined","undefined"
"https://www.facebook.com/Young.Love.Yunlin/posts/2242404152670745","1538408372","張麗善的質疑
麗善出生於雲林縣社會最底層的家庭，父母親「子承父業」，繼承阿公為服務往生者的殯葬業。麗善的父母為了拉拔五個小孩長大，除了殯葬業本業之外，也種植蘆筍希望增加一點收入。所以，我們張家的每個孩子都要在大清早下田，從小學習分擔家計。後來，除了耕作之外，也開始兼做蘆筍批發，以服務更多和我們一樣務農的鄉親。
 

 麗善一家人雖然沒有優渥的家庭背景，但讓我們永遠引以為榮的，是在我們家的兄弟姊妹身上，永遠都流著雲林人堅忍剛毅、永不低頭的血液。
我們沒有因為出身底層而自暴自棄，反而像每一個雲林鄉親，力爭上游，期盼靠著自己的雙手拼出屬於自己的一片天空。在努力打拚的同時，麗善更謹記長輩們的諄諄教誨，因為深刻體會了基層民眾的生老病死，所以，麗善選擇了護理工作，以服務弱勢為志業。
 

因為有著以往在社會底層打拚的生活經驗，讓麗善在政治這道路上，一路走來，更能「 苦民之苦、急民之急」，熱誠的為基層的雲林鄉親服務，毫無所求，更毫無倦怠。 

今天，蘇治芬前縣長利用職權質詢，一再濫用言論免責權，以達到抹黑麗善雙親的卑劣目的，但這樣的舉動，也等同於抹黑了大部分雲林人的過去。蘇治芬前縣長這種令人神共憤的卑劣行徑，不僅毫無任何做為人所必須具備的基本道德，也令鄉親對雲林出現這樣的政治人物而大感失望！

 民進黨的選舉手段，難道就只剩下抹黑？民進黨為了選舉，難道就可以拋棄良知？
民進黨對今日臺灣好不容易爭取來的民主，難道就「非置之死地而後快」？
抹黑麗善，並不會墊高蘇治芬；抹黑麗善，並不會讓全國人民、讓全雲林的鄉親就此忘記，忘記蘇治芬前縣長在任內，和台塑六輕回饋金之間的疑雲重重；抹黑麗善，更不能漂白蘇治芬前縣長和台塑六輕回饋金之間的黑箱作業！
蘇治芬前縣長，全國人民、全雲林的鄉親都在等，都在等妳將自己在台塑六輕回饋金一事上的角色「講清楚、說明白！」",1579456488,undefined,undefined,undefined,undefined,undefined
"https://www.facebook.com/Young.Love.Yunlin/posts/2133312333579928","1527315372","感謝鎔麒來參加。","1571748167","undefined","undefined","undefined","undefined","undefined"
"https://www.facebook.com/Young.Love.Yunlin/posts/2482213638689794","1569346682","韓粉們： 中油公司曾經探勘太平島石油。

 
不論有沒有，我們有一個領導人願意做長遠的思考，想盡辦法為地方開源，應該是值得鼓勵的。當然，在做努力的過程，不一定事事如意，但是一件事情不成功，難道就不該繼續努力嗎？真正的百姓在生活工作創業中，大家一定都曾經歷過不斷努力的過程吧！

 
反而是現在的執政黨，不思進取，沒有用心在思考台灣未來，反而是自以為抓到政敵弱點，事實上正是暴露了民x黨的惡性，也就是一切為選舉考量，而不是站在為台灣社經努力規劃嘗試的本位主義。

 當然，如果要說花大家的錢，他們是不會手軟的。眾多的黑機關，遠高國際行情的離岸風電，國艦不國造，國鐵不國造，亂開支票，事實上都發包海外的錢沾建設。

 孰優孰劣，相信大家心裡都有底了吧！","1571748167","https://www.facebook.com/christianchean?__xts__%5B0%5D=68.ARBZ24j5q36xRAaTsTPd5uTtGFT4gGW9Vf-EuwxRTCDGgIFjEiRgKZqzYeCI-7gYJLof-gviHlImkDeeBRaVEUbeWouZUEvMVKs0LxdA3nfcfIJAhLcx5AYBYZB6IAG3q0lx1gvl0yWuLJwqGiqmVQCaxGM-V4yzsvTEnPUxxjKbdU6ctNaQ1rOCu70hSDAV1tPJqv1THENQWpJUVXjCtZaFQ-ladY1YI-fWUbnwh2wOzpmnd1GL3ebrltLlxF9oMwCK0hk3WfyGt3atxmkP0rO7bEfhPRvMuZnKSbgz9Zp63d6O6e_tDOdJvabJQZwL0DPHCBH9IoRFOzFdmI2Szk-SRwqoIt_4cDi4vGnp&__tn__=kFFHHH-R","https://scontent-sin2-2.xx.fbcdn.net/v/t15.5256-10/70173584_2668699266483369_8651782112472465408_n.jpg?_nc_cat=107&_nc_oc=AQm3Cf_CtnF24ClyE1Rs3skS0cNld7I_Jsu52TZY5CdeI_6SULLA_TyQ3zv10y2_Sme9lQHH45PtK5SHdHZWlzGQ&_nc_ht=scontent-sin2-2.xx&oh=3604014595605a2bc46ad49536b8326c&oe=5E1C8455","undefined","任螢螢",""
"https://www.facebook.com/Young.Love.Yunlin/posts/2424833677761124","1562294991","治水疏濬的工程是裡子工程，很高興因為高雄，因為韓國瑜，讓全台灣知道重要性。

 
記得很久以前也曾分享過，張嘉郡過去擔任立委，最積極也最在意的就是雲林沿海防水治理，以及農業灌溉水路及排水路的建設維護。雖然當時縣府往往不能積極配合，但是嘉郡也會想辦法從中央找尋資源回來配合鄉鎮公所執行。

 下週就要開始總統候選人初選民調了。
回文中分享兩張流程，雲林人支持雲林的女兒女婿。","1571748167","https://www.facebook.com/CTfans/?ref=nf&hc_ref=ARSKNfgnIWqpwLntrl05jWHBlZERVF2O9JXrcPnVoT0XBsLMs_vb2Vcw-Wzr-u3a6AQ&__xts__%5B0%5D=68.ARAmzG86T5bT6a2LV4YK9x5gL7jJla4KpQCjlVoCNxA3HAPz1lt9Jr6_3BoA4jLvIQxSIQx9yGS5pVK0VfKLbknLnRzfUUQIxWL4YrRZI5Ak0QdQzkcogeMRmEYwq1H58DtNjr4zK9AJNL9tyavzz4rqDST63Gmihv5TWNCMyjd30G4p5Q_-ldI3irUv73PZqX_q6eo8zPPNgMayiimdni59IU7WMpqM_0E5AH1z4Grc4TkecmE8RvQic5AxfRDpBH4nXDMRyIcAvb1jdq_1HCobU5MGU5xBhGpcjJSJBt3YOCgETWrZFtKrVTD0jIf0X8tbdXD0eqWPV2RVTkKmcnnn19_WnXvbvPD9IGJBN2O2_Qw1fuz5F5Rkr2Nw6CXvWGz2ZLTl2nbIA9ZxVZFu07Vgk39I_7fKr5m3dhEa9Fwn4LEbW8ZIlcyYjs6WFb3L5zMO22awoElN_dFpdw80NxaCShKc7mxAa8YvTj08ZHaJudWnkuWNnaWVt_w&__tn__=%3CH-R","https://scontent-sin2-2.xx.fbcdn.net/v/t1.0-1/p32x32/31648312_10155912323707479_5840573014070295212_n.png?_nc_cat=1&_nc_oc=AQmRTdnIB1fFzX4JDBlZVPO7nvo3Q4aiuSfg4IcfqOTQbEOLPKLLMo97pmqe5M30h2w&_nc_ht=scontent-sin2-2.xx&oh=14efa95bb6c65a64561c7845080725fe&oe=5E5EB87C","China Times","China Times",""
"https://www.facebook.com/Young.Love.Yunlin/posts/2399972626913896","1559380021","","1571748168","/watch/Ctfansctvnews/?__xts__%5B0%5D=68.ARA6aq801Oo4yVfHFzjHVqfVWmAmHlDpMGK7xriROVAXlmbgvYEsaigjUw0J3E6ChQpLubwuLvx29PhCb14QszJ9rmc93ayfhLRPIBL-5pQSFjCyIWX66kNgai6A8z5SlX5-e7Yg-IYaGDmNxJN8HlWxZYHGJM5y2pmrd41d4MzMydxr-7CScVgXDQeazzA-NGYPwuoZNqzwz31C0-FC-bJQLeda8QKMOZ5oZ7nf97gxWVSKlEJ9mGh-GA78DaCgpaz97GJT0942PMtf5ZBtAEEUL_ET1sDTKyAjdZprnHng_wN690FrLcHVbacjWNcfgis4y_JZ9cTQAB-SbSPbPOevRDhLx7uR0xBVbLGvRypuHBU8gOIwoLvXy-PbTy_g9ULFSCFTZfgnZBGMw-bmBvgf6lzENtFomSYCtIRHawGd91DNiaBrycBW6qASt1tT-VUKlx5uQJeVrcpvb7H1W6FIg1Nxq1jJKZVeJQz9daftpwc80q3hlGNm9cut2bH1CuaR-Q&__tn__=kFFHHH-R","https://scontent-sin2-2.xx.fbcdn.net/v/t15.5256-10/60344375_489411705132459_982115319579410432_n.jpg?_nc_cat=105&_nc_oc=AQlSpkUiz89X-JHxZ86D9SPjXcKN3sxBya21o1vXxoP_3674PNGcEeDccZG5zSJ_UILejUy195P_VKn44Dydlel4&_nc_ht=scontent-sin2-2.xx&oh=4a90d5164366072dc5d3c0eca7556548&oe=5E1C8663","undefined","中視新聞","102,938 Views"
"https://www.facebook.com/Young.Love.Yunlin/posts/2458742957703529","1566633901","在講這個議題時，別把我當什麼地方派系。 派系的高度不會超乎地方需求。

 我轉貼「以核養綠」，完全來自於我身為中華民國的人民，我擔心我們國家未來能源政策的走向，會衝擊產業與民生。

 四年前參選，有熱心的環團希望來幫我，但是條件是反核。我婉拒他們。因為這個社會除了政治權利以外，還有更重要的東西。

 我今年結婚，或許明年打算生小孩。我可以教養保護孩子到或許22-23歲大學畢業。但是請問各位年輕父母，你們有勇氣想像未來中華民國的小孩要面對什麼樣的世界嗎？

 
十多年的時間，中華民國政府沒有辦法提出明確，受百姓信任，共同奮鬥的經濟展望。而教育打從2000年初教改，實質競爭力一落千丈。現在我們的執政黨更把「未來」借貸來，做著百姓都質疑的國家建設。被執政黨搞殘的兩岸更是一個中華民國要生存發展跨不過去的坎。

 意識形態的時代已經過去了。無謂的恐慌只會斷了國家的路。執政黨執政不力，運用民粹恐慌的手段，要嘛把他們的執政權力輸掉，要嘛把中華民國輸掉。

 
我是個尊重歷史的人，我為黨國在大時代的付出而感動。我為曾經的領袖解放台灣社會而欽服。但是現在的國民黨高層，至今，都沒辦法解決國民黨最核心的問題，那就是找到他們繼續存在台灣社會的價值。

 好不容易「台灣安全，人民有錢」成為了一個共識，用最庶民的語言說出了國民黨在經濟，外交，治理上的優勢。但黨高層卻不懂得去突顯，加深，加強。

 
所以說回來，我相信，在這個時間點，我們有更重要的事要做。從不同的角度，我們要為未來做打算。政治權力也不過是一時的，我們要的是能夠凝聚，共同找出我們生存的空間跟機會。黨要能夠提出具體的核心價值，候選人提出政策的概念，人民理性選擇。而我希望如果以上都能達成，年輕的爸媽能夠告訴自己未來的小孩，好好讀書學習，國家未來朝向某個方向主力發展，所以學好學識跟技術，未來你們發揮的空間一定比我們更多。","1571748168","https://www.facebook.com/photo.php?fbid=10218092905090128&set=a.4694751602737&type=3&eid=ARDHtVckEXrZyFL2HcR0w6JxcWKZPexuFrHwdOmuXAmADDfUQTX2mmH07Uq6SY5RzcwBv-SeaOH66H8n&__xts__%5B0%5D=68.ARD0d6sq8hUXFkFMpmTo-CTkGSQS_w7dQ3MjbehNowWOUf8pi1d2dZcV8mpF6CjU4isZX2Da9CJXI567DmmQzVD5zTsnZi_qKc3YceiPZnRIAsoDZNq-s38KC_cTys7J1lqkL6itzgNYbBtY_ZJmEl2Q2BY3LjNnEeHzo9kmIp0B4A-UgZd5J8qZQwW7ovG3guUbH3y2kMoAkNP2bn9NcAnXfUOvIze07mEv-ZKmWed4abx-8hIjB4WfXfiOS1dqajTe4S26Oy4i_MfIlZ3MFi3MWkXPVMZFbl-z2mX02uICWsBRKJsT-mWBsb4siayrVTt1Q1CIdsPVuw1D5N3EY-6MZJ2t&__tn__=EHH-R","https://scontent-sin6-1.xx.fbcdn.net/v/t1.0-0/p526x296/69058924_10218092905130129_1796707789125451776_n.jpg?_nc_cat=109&_nc_oc=AQnPdW7jJzI-tKSLo-2bKu8iF_5y0ELfpifHQrzK62Bly2NgqYIV2_mywLs_xVbSRps&_nc_ht=scontent-sin6-1.xx&oh=39a472894455c9a2974a2c5be0df61cd&oe=5E608421","undefined","37125",""
"https://www.facebook.com/Young.Love.Yunlin/posts/2453744474870044","1566013904","「厚德載物」

 這或許才是現在台灣社會最需要的東西。

 謝謝兩位市長夫人。

 嘉郡加油！","1571748168","/Sweet.Yunlin/photos/pcb.10156603937417333/10156603936332333/?type=3&__tn__=HH-R&eid=ARC6Z8VKcCAoljkMP9gfg2nPPC0dsj1sYVyUWampYTuPsWTbVXUX1qei-KzGd9dWoOWNlYP4HRFxJ_EF&__xts__%5B0%5D=68.ARA3sZT0uzxy577lhNjtNsDDGEOtV5GwHV0L97yq3QEucOP-Cchf9ZCpCXPFJP3jvy3LBPM4MFnw4XubPW35nqPIgpwBXDLbJZiIzRom5GO5b1P1Yz-M5rdRB3eq6P9zvDvGy311U-Uqv0FS_u0VfkCfM43h3H31Sd4re8_3Jw80Bg0FknIuPMuY6mbTbvhA0aHS0H5hQJgZItPsKaXMWs33uz4VDL_XiuilNTmhFdgPTDZqwBo0ASkzCgQhb8WJvdDIkekAtXW14J53Nwi_xxyIMs3Th4XYj834r7RKk2zF3dhQB7aNo8zioe_ivImUINUXAjfbBcnCMBszCMPUnEL4u0D_6PMtDT9mj_NNJbZ5SxztKtmzUmmx3MpS2mkPMW_QLZCmAvXxg0LDpIbk59B7kQcuBR0PARIZ5anrAuaTYzkLK41cpS27gVZnx--MF_qBybt7KdFdQgMWrnYB2ZY_JFoO3_epztCpnCLEfUhl3cE_vXBICGIQEgc","https://scontent-hkg3-1.xx.fbcdn.net/v/t1.0-0/p403x403/69368374_10156603936342333_9168366390694903808_n.jpg?_nc_cat=105&_nc_oc=AQnd44Ne1NrpwKG53leWEXD4TVGNB457ganYh-0IbGtmfyvlAWQ-fZzDD4QeKoifLL8&_nc_ht=scontent-hkg3-1.xx&oh=0e47a58f46dd2e3c2c39cc76d18b2294&oe=5E28A328","undefined","張嘉郡",""
"https://www.facebook.com/Young.Love.Yunlin/posts/2445244599053365","1564921161","社會常態？","1571748168","#","https://scontent-sin2-2.xx.fbcdn.net/v/t1.0-1/p32x32/22489870_1676746175732316_7119586085429205659_n.jpg?_nc_cat=110&_nc_oc=AQlzpZKbxfiGLbmHkpQdm65CbxR9ujPcYNXtWGF8iPKhlk6P91KbwOC0Gyvh3A83frk&_nc_ht=scontent-sin2-2.xx&oh=b69b7fbeb566254ee1c140b39b41197f&oe=5E2AF44D","Hsieh Chih Chieh","37106",""
"https://www.facebook.com/Young.Love.Yunlin/posts/2432071433704015","1563254029","台灣的前途絕對需要我們心胸打開。

 前兩週聽到一位尊敬的大哥提起，台灣一直在講國際觀，但是卻對國際一點都不了解。

 事實上在今年的貿易戰，大家也看到美國保護主義的雄起。冷戰之後的世界局勢，以美國政經軍領導全球。也因此帶來了台灣現在主流的世界觀等同美國觀的結果。

 而當台灣認真的相信了美國自由貿易後，才發現，奇怪，美國面對大陸的挑戰，怎麼反而開始談保護主義。

 事實上，真正的國際觀，應該是對自己國家的情況充分了解後，才可以推論我們在國際上應該扮演的角色。

 而民進黨在台灣國際觀的問題上，沒有逃離他們一貫的政治風格，也就是愚民抹黑。以抹紅為例，只要有利它們的政治利益，它們不介意台灣對大陸的完全屏蔽與敵視。

 
但是這究竟符不符合台灣發展現況？以地緣政治上來講，台灣親美反中，會讓我們喪失全球最大經濟體跟政治體，反過來說，如果走到最後，等同於我們面對美國也沒有任何的政治籌碼。

 我們需要的是既非親美，也非親中，而是務實的找到我們在國際政治，經濟，文化上，能夠起承轉合的功能。

 放開心胸，了解國際真實的情況，從我們這一代，務實的調整台灣對國際的關係，只有這樣，我們才不會愧對子孫。不會把下一代發展的機會跟籌碼完全敗掉。","1571748168","https://www.facebook.com/people/程新甄/100006881987004?fref=nf&__xts__%5B0%5D=68.ARBgKrQGj4v6grCxgLPFyWcai4U3Nlz4yNYNhHngIYuaBeedi_0bGiC3z5awIjP_s71cFv7K8lZk9tyLQV9qx9JFY0KsqrgByFaD-qgginUmyCQe3YEgp8D1Y0a78nEhWKLl0eGi6GDqCNnCF288Fjb2YZlowGJJfYwtq7yKpgTtzVsTL0DLlT0WpvYN1wyL4Ark6F5p4yiSmVE5U2zbtcFNhEnol35pMiKrEUn10Os5STgcBdWgE-k0C6bj3LTeGEZHOq3j-80vy68660vrsSKQIgEBVO7SWSN3KbJ85Bl6Mx_6R2C0KmnmkKdK3Kocr6RGjOLJRVpuqArHWc9JuuCrobB-&__tn__=mH-R","https://scontent-sin2-2.xx.fbcdn.net/v/t1.0-1/c0.0.32.32a/p32x32/10433861_1528442807395104_7182812920365978467_n.jpg?_nc_cat=104&_nc_oc=AQmJm0YdFwRXsT8a_hgzy7MVMm89W03GcE_gB12RQCOn4wUh5eaUDcR8qSV-SBXAjXU&_nc_ht=scontent-sin2-2.xx&oh=18907af58a2337a56254752686302e9d&oe=5E585F96","程新甄","程新甄","link"
"https://www.facebook.com/Young.Love.Yunlin/posts/2454793638098461","1566145315","中華民國，智力上線！

 這是最海納百川，最接地氣的團隊。

 將近4年的時間，執政政府完全活在國際局勢以外，甚至對民意也視而不見。
是時候讓我們重新審視自身內外。

 台灣安全，人民有錢！","1571748168","/twherohan/photos/pcb.2517248518512297/2517246511845831/?type=3&__tn__=HH-R&eid=ARAYzKq1b4WWZ4-KTMv625Y9iIRSqSOC3xUjbieiL1MdYreHTGSxbe0DYNNH7TAaSKRvEseF3flF7KHn&__xts__%5B0%5D=68.ARAezynrRrGKR001sRKq8Q2nSX_ykM-IF4-KnHvDog_zINP9NRCa9OB4FXa4VgoL30-dRAPVXPPL1Ou0nXQWXtBukF5Hu88PidujQ_WRtXmay-uuEcQ7xw8JuYal6zIE5YFMzmbSGctfK2QPr4sxSMSkyfsWhT3-Uqg_s7WIOTrNS7Xy9VOb-WpWo_KYekyuvHUwwyBW8x8_sIFT7ysGkyieyL6NWgxDOtmgb4d95cLPAaqSw8CCbrJ2XYTCuZ44YcPRz7ILFIqMs0B713ayve4zMf5-WxI8pJFC09PXCV285JtFIiy_JyEac9vobzTnoB13xfwKnYvQrRJbPtgXDjMF9Df6mOy0Rmngo6KUzJceXufqFsJGiJ9TXu-RPM_UAeE2jbNM5kOGFipqPr7okDyAY8wOXgdVxksdZMlMzSl1JwD5I2w2WCaDLbICLAZ9wwYwPkJOawIh0NtdshnwSp0_irnkYuQCWMNxXDI4a8C4FOes4o42_tzEF-aJKw","https://scontent-hkg3-1.xx.fbcdn.net/v/t1.0-0/p526x296/68748320_2517246515179164_1796504542683070464_n.jpg?_nc_cat=111&_nc_oc=AQm-EWfNPMrYcO6tfSODDNDjuij9E8jlZsrH_PasQwNDyDS8vE8mI9Kmb2rRuEdU9zY&_nc_ht=scontent-hkg3-1.xx&oh=ec19e10d5824c52721f2b7ee2eeae37b&oe=5E28C5FF","undefined","韓國瑜",""
"https://www.facebook.com/Young.Love.Yunlin/posts/2402676336643525","1559693109","看不懂這兩天攻防重點的可以參考：

 總統帶頭放假消息，不用去蹲3天？

 用這種方式攻擊政敵，只是再次證明妳一點都不把受年改影響的族群放在眼裡。

 且，沒說就是沒說，年改不等於18%：

 1. 18%本身設有落日條款，能夠領18%的退休公務員人數不多。

 2. 18%有問題的是政務高官年資淺淺卻有資格領。以蔡英文為例，她就是曾經說過，不願放棄自己的18%，不然不能做公益的那位。

 3.
年改真正出問題的是政府單方面修改契約，失信於百姓。當時已退休者與屆齡退休者，突然發現自己當初與政府簽訂的條件，所得替代率等，一夕之間都面目全非。如果今天是民營企業，早就告上法庭，奈何現在這個執政黨很厲害。

 4.
年改影響最大的其實是天花板的限制，相信有聽過這個故事，一位老公務員爸爸退休後，為了彌補家計，另外兼職門衛，結果才發現自己的薪資還得跟退休年金相抵。根本是叫他家裡躺著。

 5.
最骯髒的是，當初為了政治目的，學一些歷史的骯髒手段，抓一個族群起來抹黑，然後轉頭跟勞工農民說他們「是妳心中最軟的一塊。」可憐軍公教剛好傳統上不是民進黨的最大支持者。話說，很多教職本來是，被弄個後悔莫及。

 所以說，本來已經很久沒提的話題，被提出來。軍公教自身比妳更清楚，18%根本不是重點，可憐大總統跟大立委根本搞不清楚狀況。小心玩這塊，傷敵100自損1000。

 而且用這種方式攻擊政敵，只是再次證明妳一點都不把受年改影響的族群放在眼裡。","1571748168","/groups/2034858436836458/permalink/2380493408939624/?__xts__%5B0%5D=68.ARBsAMMR6n_Njc_tuUo9d0pySSIkvtpmq25Y5FTPejfehIYzRKTPqUxEBPdn-hdGcmzBzOO6sQ3aNJIwKCpSR_ntwnrciRMEEXxU7-wbwahRffuE2c10zUW0uMphjLurraLCxORpHqMFbaa3lZlfIpRzvD_K3QH14aYktiSZ9TxIuV8ErcXU0i0XX9m_ZIBp6J_d0I86ENXaPc-M1nRteRrXJ9VeVNiVmrgD1et3O65shFiec_EbvWS4D82Ji-i0V3PP3bk8iIpIRmHP6tN8Xeu9aXfw5uNPiXnIroeY0WIImYIo36C0fRfSzz2SVdsBZnuYOldHixP9DT2LyouRfIhd&__tn__=H-R","https://scontent-sin2-2.xx.fbcdn.net/v/t1.0-1/p32x32/29176955_452142715203542_1479191273856732031_n.jpg?_nc_cat=108&_nc_oc=AQl4IjNsnpZTXP7WWTiVYKvwl95Q5WhNfG1w3RnSyM7u4hRSWscugwz6uYXpQ8MSVIE&_nc_ht=scontent-sin2-2.xx&oh=ce6dc16219df4eb5d3e5c8d0009db4c5&oe=5E279842","Jim Mc","Jim Mc","post"
"https://www.facebook.com/Young.Love.Yunlin/posts/2260128087565018","1541059949","魂飄啊... 大概是選舉使人瘋狂吧...","1571748169","https://www.facebook.com/王大師-191122434245686/?ref=nf&hc_ref=ARRo5zk2oJWNXlbABiRFLfOtskhVx96tsqI3voZtyfg1stGd__qyG5eaYxtk33vsW4g&__xts__%5B0%5D=68.ARB9X-BpK6UeUzzj18_FU11hSu2TR85Jxk-YgBg0yCXpp4F0GZNROP4PtJQyHcdlytDykA4Er_5ehJ1ZTneGwqVUDduROAFCtv3ehn8HxXVSiuxH-EBIqL2X6dLlmImxDI17AQ6aKIcdsMo7dBGw3f-RTAUJgEc0Eh4lmpmQ6xUhnzpA_zjkxROMihbIdXomiJROitjW2qcbgBT1amS0dKDRu6Z8QCkvdSWRzx-iIQR6jaGK0ljUFegHQmxAWFpz2G8OvulrRKiIjuLAPFXJcWE96Q-1vxMV8IGTUt3z5xOBaBhgEW97q1pt0nslZYOxX_6B13mRhtLyAdRP9ckAJKh7hM3Lmmcj6TACuuvj5m7k7uxgVPoTLdcgWe1-1WsDnzdh6eIKTrn0_uco2ReTgMvoOpB4EMPQgsEY7rMIm2vbQQ-nm9tvptwA901pQMTjG7zSsYeOzUI4RUYSRSOByXz31JrjK8JaDdODtvZK2LM8bAL_AoK4XDR6v8PpblKdgX72cjgMBpWhwt_x&__tn__=%3CH-R","https://scontent-sin6-2.xx.fbcdn.net/v/t1.0-1/p32x32/21369328_1628677387156843_6025757539528581051_n.jpg?_nc_cat=110&_nc_oc=AQk0Ko70H5EwatZGFrhUAdI-nxL6-UIgUcqjt5QxKWk-gX74QQ91HVzN-QGufEAgSu4&_nc_ht=scontent-sin6-2.xx&oh=a41099ff025985f71b14554ac0b58c56&oe=5E576FF8","王大師","王大師",""
"https://www.facebook.com/Young.Love.Yunlin/posts/2502509539993537","1571427859","「ㄧ九八四」這本形容極權主義的書中有句名言：誰控制過去就控制未來，誰控制現在就控制過去。

 所有追求自由的思想，不論政治上或者經濟上，都在強調如何賦予人民自由選擇的「能力」與「權力」。

 但是我們可以看到，民進黨並沒有打算放棄他們控制現在，控制媒體，控制學校教育的打算。所以它們全力打擊抹黑競爭對手，而不是告訴百姓它們執政有多行。

 更甚者，因為它們執政不力，跟不上世界局勢的變化，加上鋪張浪費的政策，還有各種黑機關的設立。它們也漸漸使中華民國人民自主的經濟實力消失。

 「能力」與「權力」，全面的敗退。

 各位年輕的朋友，或許你們聽過黨國時代的國民黨控制言論，但那是歷史共業，那是一個戰亂的大時代，是一個主義間戰鬥的大時代。
但是結果是，曾經我們的蔣經國總統，作為領導人，很清楚那個時代已經過去，所以解除戒嚴，開放多元的社會發展，建設台灣經濟，創造台灣的亞洲經濟奇蹟。

 但是在我們當下這個時代，反而是民進黨幹起了燒書的事情，搞起了控制言論的事情。",1579456489,"https://www.facebook.com/王大師-191122434245686/?ref=nf&hc_ref=ARTo1_kFme5qRP4yHKfUMKilVaqyfLEgFHGgqiOA8mqDdWE5-APxQa8m-s6yiw4YF7k&__xts__%5B0%5D=68.ARBUpYVuKDNcl94OfIaBZOON3VLFGZwqWjy9GY3Qc5Sb2uLeF_RbB903XpPct2YqRYmS9AF0VxfJYzKjKebs2TxoBv2-Qz2VpAK5WWGCZAq3srspRWzknmqijQnpfw8zB5Ul1y1MQWKjXQK1xwP5bDPbARfoRRQItllanAa2OG9Ct0pELkVlqooe1qTn9Fmz353TekgtgzpH1XEWKyd40lhqPbZiehPSHv1GGtOVvZ1N6930oeJ_FdhC9qk7h0gjy--tcqMaS902SOcy2rHL1Fche3ttue0Z4PpIvEfNsgUoyRC1Kkwp11zUucCZNSW2Z6bLlLUbCHKo3ZSe0CWhreOKbSisJWAl43RvvdWo_O3PwXpKqoZKtzUAifSQDPYlS6xPFRrjBzaUkqNiUKTJ0UW-evWgHUvxLZXw6vDM-q01bCeSPgtfNyysjsH48xpUkf6W2HolU1u-jYkrwL179DhkMNT1xaXR0FSRhlv_Jlek4Lfh-SuMA_Cz_U6x&__tn__=%3CH-R","https://scontent-cdg2-1.xx.fbcdn.net/v/t1.0-1/cp0/p32x32/21369328_1628677387156843_6025757539528581051_n.jpg?_nc_cat=110&_nc_ohc=fV2cTCGNaR0AX8aD4CW&_nc_ht=scontent-cdg2-1.xx&oh=218ae1fc42a1c9b88e066afa57206fd4&oe=5ED62B59","王大師","王大師",""
"https://www.facebook.com/Young.Love.Yunlin/posts/2500200606891097","1571211483","所以當初是為了反國民黨而反的吧？

 也就是民進黨拿著台灣人的生計在搞政治吧？

 台灣人的生計不重要，民進黨執政才重要？","1571748169","#","https://scontent-hkg3-1.xx.fbcdn.net/v/t1.0-1/p32x32/59897654_2340584369297588_6235318964965081088_n.jpg?_nc_cat=110&_nc_oc=AQkXrMqxT1yqQXk5KecSJPb01CF3ZmkhVuSSWTSGqjQ4fgIrTlZ4j_1jSvY0OXqK3do&_nc_ht=scontent-hkg3-1.xx&oh=3679894aabb4fa977e5cde0b0517f518&oe=5E5F3304","Jones Chung","link",""
"https://www.facebook.com/Young.Love.Yunlin/posts/2426243464286812","1562484021","","1571748169","https://www.facebook.com/Sweet.Yunlin/?__xts__%5B0%5D=68.ARAJ-Vf46u0_qVzk0SgysWGKGXyHfzADi5Z_wHhIX9P1RcyI3rcxe6WK0Ma_0d6Xvhnp1mqF8eiMvdoJ-_8n4pNtdsdFDG7HIF3DBKDFFYT6PPnlagaFsGtS-_gKyZoBJuDKs9H9JLoH4h5qHmx2ZBFYEzIEDWZIO1Z1cT4ZQVEPBPi4aODHhHs-2lL4XvhVB-_sQrLmJMQXFy4VuQAZJ-ya_U4CQVYgv7Hn16haE3AaGYfZm2s5oLNAhIH7Og2VY6AexIk9mp8NWMugTIwnEX8HZUpo5fUcsC-zYaoo73_7_kVxjff3atV1Hpj0GTU02CZNj5cVDAKLMRf7iTF99QKjBF0tNOyox0ICH_nDuNx7wJE24aiUNccHdkw8VQ0s-Dd_s5kxGJwnt4FN_I0TJZBO1vBcELtRKzimN1AU6GgmgtzGus_l6Ce6UoSNrIJ9Yj44mZBkvIeaM_cgAGZyWOzLuBDNrZRNU2aIhYAJWT9mlncPCOTJHeGgsJbMoCvvtA&__tn__=kFFHHH-R","https://scontent-sin2-1.xx.fbcdn.net/v/t15.5256-10/65661322_1129968867213437_2766911768528683008_n.jpg?_nc_cat=103&_nc_oc=AQn9Dr4kaA1vaQ0D93RkFEVgLIGS_ww5nkUr9c7S9DQNFhFu_ub-yZdkEuy7WhFO05E&_nc_ht=scontent-sin2-1.xx&oh=59598fd0c719c4414085ec27a032fe2f&oe=5E2CDBFD","undefined","張嘉郡","3,959 Views"
"https://www.facebook.com/Young.Love.Yunlin/posts/2491557261088765","[Error]: TypeError: Cannot read property 'attribs' of undefined","",1579456492,undefined,undefined,undefined,undefined,undefined
"https://www.facebook.com/Young.Love.Yunlin/posts/2400740693503756","1559470329","高雄的人民，你們因為選了韓國瑜，現在被民進黨與中央政府列為不予補助對象了。

 蘇院長真的很敢說，也很敢做。這種完全為民進黨政治權謀，而不為百姓生計的想法也能完整敘述，真他媽佩服。","1571748169","/watch/?ref=external&v=455311705217480&__xts__%5B0%5D=68.ARCAGzAtDn9hkxMjBnNIWaULnppKXLGKdVTgENGM7BuQduTeSKUgFpztY3FXoAsipD3zxNJh-_EKQXmRfjURN_jUsf5rtr8YgT26e9kkqNOU3RjOKuboGxUO8WHrLy2BpmZIQ7Sm5QFO9oezn27Q4F8Syufns9SNJwg3WGlxfM_bIDUs4tYTuh1pC-obUb_ok5Ejj45B9qob6V6NTj9PhOwaKM3J1cst5mZmWgx4xpY80wq44j7V2jfwZdQZp8CIF_WlkWnHi3GkAPfjcDKZKbYoMR4rCd4peKrcmwvvBvQxhOP76pYqb0aYUu4JyTeN-JfBD3KgKSYkfUc2_yT7vRT7FV5IAb0C8LmXBpCmIrG3zWk6xJqhu7K9TB1BXYcxNpudVSgP5dJAmKV-JzP8PBUlgWI6Su9GZUGDaIXlFFuKZUlgzfqX68Kn_LvGbXvbgAzBteJELnJ0p4Aqdv35PmSI2BKwxdGpkqBYQ5DpnuSIcfWqCh6KumFlLJ4toVzrOj2x270&__tn__=kFFHHH-R","https://scontent-sin2-2.xx.fbcdn.net/v/t15.5256-10/60352060_455312325217418_7280721628378431488_n.jpg?_nc_cat=101&_nc_oc=AQksSrV0pq2xpVRebeQEwy3VBrRHYKNGekFkcUXPclIBd5gokcWBIGmUWjuVeBJ3Gjm2hVZpLbDU3wRHsG0AFsMJ&_nc_ht=scontent-sin2-2.xx&oh=f0d072de9b02ca32cfa8189ad5f3d73d&oe=5E28C995","undefined","韓國瑜喊發財外交 蘇貞昌酸：以為已發財要分給別縣市","Posted by udn.com 聯合新聞網"
