url,posttime,text,crawled_time,attachment_link,attachment_img,attachment_img_alt,attachment_title,attachment_brief
"https://www.facebook.com/Young.Love.Yunlin/posts/2118542575056904","1524810978","「我只在乎，台灣是否可以持續累積籌碼，去面對未來內政外交上的挑戰與變化。」

 而歷史總是不斷重演。

 善謀者懂得以弱攻強，消耗力量，製造悲情。
反年改則被塑造成以強抗暴，社會反應兩極。

 所以過去有李登輝利用軍權制衡當權者，後用學生制衡軍權。
318則有民進黨利用學生制衡國民黨政府，後用獨大政府壓制社會反彈力量。

 有言論說，這些軍人領太多，但別忘了，這就是當時政府與該族群的契約。契約代表著信用，也是國家法治的基石。

 國家財政有難，需要該族群分擔，應該積極溝通，緩步調整。
而在民進黨治下，卻是把社會帶到衝突暴力的情境中。看久了不免感覺，國民黨是真的太軟，難道對抗暴政，真的要以暴制暴？ 沒有更好的做法，更好的溝通方式嗎？ 
所以質疑反年改族群前，先想想為何政府不得民心，為何抗亂四起。

 台灣未來不論內政，兩岸，國際，挑戰太多太重。
為了台灣，是不是可以更好的處理現在的這個事件？ 

 諷刺的是，不論走向如何，社會族群分裂已經造成。彌補這個分裂是否才是最重要的事。

 我只在乎，台灣是否可以持續累積籌碼，去面對未來內政外交上的挑戰與變化。

 行行好，民進黨不要只為2018，2020選舉官腔做派，能還給反年改族群尊嚴，緩緩溝通。
而反年改的前輩們，也能為國憂愁，恢復理性訴求。","1571748180","/Young.Love.Yunlin/photos/a.1686845171559982/2118542548390240/?type=3&eid=ARA7H0fy3Eg2ya5EB8BBMbXXoeonBFKoyrgDsg4Zkif709Nd-E_Bf8Xjkb3zFiJfm6E3YvYL5ZN0GLUi&__xts__%5B0%5D=68.ARDk2U9kvN1aY-MxCcDHCTItDYT5GchsDufXNCeox42-4OxqiFyqCkFI8eR8rOGEEIx5yP733TNIzAK_jNPWtTUkO8f3R0yMGCNixcq2vPJDg_wFbE-6Tt0eWuPY0Bpy4VcUKZoGgGCTKabvbDWC2k-0hnHpzjw7QjHOZrvOUBJOWzslazMYEu7FwOvpHhPb_n_RTkvbmgmpS6IO_ZRPds6THx3yQcz0XnyUbMbB6Jc-J4Sq-0HAs4gzs4UAIPy_qUlyZSyKLoi0U9jZq2jWFJkEhtFuAz2UGdf7-uS6Wn4rDplJ0Cl9ZYCZas-A8pSXFdQWqqPlU0Rjm39_hagbtMVfOSAd&__tn__=EEHH-R","https://scontent-yyz1-1.xx.fbcdn.net/v/t1.0-0/p526x296/31318236_2118542548390240_253208923015365250_n.jpg?_nc_cat=111&_nc_oc=AQlNoBEGpuX0ETaA3AmibtHj8EAdyWqn565vemDy7oAkcxCXE4PPMnkISsDCD9bPbBk&_nc_ht=scontent-yyz1-1.xx&oh=1925e98621e39117e66c4d8f3199df72&oe=5E29FE19","undefined","",""
"https://www.facebook.com/Young.Love.Yunlin/posts/1938313323079831","1493371044","今天得到的消息，讓我們一起為努力的同志打氣。 

 
我想國民黨黨員對郝龍斌的肯定來自於對台灣未來的期待，一個好的領導者，能夠帶領國民黨蛻變飛翔，他能夠真正符合基層民意，反應出人民的需求，也能扮演一個有效的監督政黨，幫人民在政治與民生等議題上把關。

 
事實上，我所期待的是一個更多友善、專業與更多用心的政治環境。郝龍斌是一位做實事、有承擔的人。希望我們留給年輕一代是種充滿希望的感覺，而不是像現在連國小的小朋友都只觀察到政治帶給社會的負面氛圍、台灣在複雜的國際環境中舉步為艱。

 讓好人出頭，讓郝龍斌當黨主席，一定可以改變這種氛圍。

 #520郝龍斌
#國民黨更郝
郝最被看好 吳柱緊追在後 - 中時電子報
http://www.chinatimes.com/newspapers/20170428000403-260118","1571748180","https://l.facebook.com/l.php?u=http%3A%2F%2Fwww.chinatimes.com%2Fnewspapers%2F20170428000403-260118&h=AT1tAeK3h556hVrjN-BpbyvsFp1t6HeYXuV4dzL4ak8ZWcOpIx_3DCdRKb-u3SEeDNhuwKyZo1DoANREB_o-uBccxECr_yO3NoHuDB5KvMsb08htJAHetKcidRB8IDgEl3rU1Ux-r2NhBlHZqX_RPy2hj7CJz3egoMPoNzdRAF6c14kuIXLvCg_SqKGaiCTFhLf8Og4jEKkWL9NXnUyCDquG0jWc-IUG24-Yf1xYbivnNSff65rppy8BV8yg39gn1iP9w6J04hI3F-z0HHWtghnpKlhk89nEXL8CXyP9QcgxaNrVaIofJ7LrNaYvUBG5rWsbY1ATo8jkYJXjDEzl_moCp1C_bjD2BXYxyYiz3GIfL_4CaIqNebduGGSVxr_6xoCGf5RSxuMVYucQQjofd02sWW0llr-tVYDHligFwpEYhMyPltDxqIZcy0l4jiJNdkgaeyd3T3EWFYyEIbkIn_auvrj5Qz_pEmk7BDrsPwO1LBp13HNj8Cc34VRDhPrmNsdHEew13cqLWDCmoSkIQ5eaOOw6hrbsQSQbw6BUs28lLWNe6MZIXRwfR40c98YDcSERzvhvKdHgxR87kaTFcVf6vB9CtzztUoSitXIVCjkuqI_aDrGNytelGpz7My_4i47mJk9jI5YF6mnRRYA","https://scontent-lga3-1.xx.fbcdn.net/v/t45.1600-4/cp0/q90/spS444/c0.320.656.344a/s526x296/19118054_6072525883837_6980258884720001024_n.png.jpg?_nc_cat=108&_nc_oc=AQkatpIKKHb6zn2DYeFiC0ZUXgGdbfSjvooUOQ98K_WTDCjTpV0bwrxeE5vkHyVFrdU&_nc_ht=scontent-lga3-1.xx&oh=a646eef3c371e803c8f881d76d3ab117&oe=5E577670","郝最被看好 吳柱緊追在後","郝最被看好 吳柱緊追在後","國民黨主席520改選，根據艾普羅民調顯示，6位候選人中，以郝龍斌、吳敦義被認為最具黨主席能力，洪秀柱緊追在後；泛藍支持者中也以郝龍斌支持度最高，其次是吳敦義，而國民黨員則有31.8％會投給郝龍斌，其次是洪秀柱27.4％，吳敦義22.9％居第三。　這項民調是由時報周刊委託艾普羅民調公司進行，受訪者中有45.5％知道國民黨主席在520改選，54.5％的民眾表示「不知道」。　在不分受訪者政治色彩情況下，以隨機輪換方式詢問「誰最…"
"https://www.facebook.com/Young.Love.Yunlin/posts/2306882366222923","1547097499","國家經濟好棒棒之有錢分你花：

 感謝宅神幫我們整理出來的重點，可以看看。

 另外補充上一點，地價稅請中央考慮農業縣有大量農業不可分離設施，過去免稅，現在也被課的昏天暗地。能夠提出優惠農民的準則。

 反正都已經是落幕的鬧劇了，奉勸財部整理戰場，不要戀戰。","1571748180","/watch/?ref=external&v=535708466908827&__xts__%5B0%5D=68.ARCfuXP8i7niwFrijZDMbeMlgVxwZ4w7NNreA0TQU_ECDF24Dc4LU_cae529hVNGSgqvWsnxE0uQ_V1mH0NLhLqW3ne_VfgKBTXexMne5iJOGsWItQltTPuG7R0Dvf3S5jWNf6WgGYdkFd82KQ4rZCdDGpIRxZI-7Tq9WZlkUU9CJ2iQvsfkjJHGGACwA2Vz0GjrfpoDeXDt6WSb7pO4RfKCumedZrSBLzR4q3AB2yFU8QPn4KmoNgLDBhXN4JTJdfmx3WD7kvRZsdRv39ggD-sGrramTHHqedIhmvHK55t4Q2MoWRXP2T5Qu5QwzIz5dPOklydZ5Y8Xn5YZV629jYXawnECbO_KqxWCLAPeo4lCMiIjEEKgVLHnE947JelFlBe7nvKFbpypkymkPteAyRVHxITY6Qaq3SmQwf5yIb2zecn0ibMRJc8tMlkzbnT-1c2pjEGWj7kiZXmrslljwRY675tCFaI41BX0JQCf7BiIfPzLU15Y6GBciY-yupx-Cg&__tn__=kFFHHH-R","https://scontent-ams4-1.xx.fbcdn.net/v/t15.5256-10/49472342_421664285058419_876693328664461312_n.jpg?_nc_cat=110&_nc_oc=AQlntKirfJ4BejgVg6rSvyH7uDUaEIGoY_-_WSqw-PRQf0-Tqdh8Fvd2VBCyzO_KrBY&_nc_ht=scontent-ams4-1.xx&oh=709c2911fd2a345c8d793d5cd9d68792&oe=5E2612E8","undefined","坐等中華民國財政部長撿到槍出來回應","Posted by 朱學恒的阿宅萬事通事務所"
"https://www.facebook.com/Young.Love.Yunlin/posts/1981722782072218","1500434923","","1571748180","https://www.facebook.com/jungchiyunlin?fref=nf&__xts__%5B0%5D=68.ARAeV-U9eh0bJQeoI4bI4ooU5qx5KM2Gew1MpeGQdKWgIuS1TFqK46caPPCzcdaBhwW2Ar3lcPHjHq8skuxj-xDwrbKT8KiEKtvA8JJ1pYUFIHa-oIFL80msr0xZcMALTDX73NVsj8CKf895kx02TAgrCaf_JmZ4AHwfdOhi4jlsTVEU1kZj8xXfb6UoOQt6uj2IxRW3Xg2VF4b8I_mBFrb-nbJsXQUs8s_M1CQuKn59oZ7skdtFj0RuOb6LnGMZPS05v2bphwLelL0bfV7hkMX4XZ6Narj_MlVyx-qkxL7vLBDDFw5uxokriu7cx2a64vvcLYyMrn5GMS8KfW-xsZPsLNAL&__tn__=mH-R","https://scontent-cdt1-1.xx.fbcdn.net/v/t1.0-1/p32x32/45355423_2035195406502332_8162189895524155392_n.jpg?_nc_cat=105&_nc_oc=AQkWfEffnEELW2rjWBTL9S9tqO2HcWIs8Nl719UFK7TqAEXQBLFG-FLr_IrvtX_S2qQ&_nc_ht=scontent-cdt1-1.xx&oh=1b7163e2c7759e8f49b5dddd143935b4&oe=5E609F7B","張鎔麒","張鎔麒",""
"https://www.facebook.com/Young.Love.Yunlin/posts/2267375620173598","1541983627","「反對民進黨」已成為全台最大黨。

 三，四個月前，大家還在講無色覺醒，現在已經更具體的成為「討厭民進黨」。

 尤其像關鍵的高雄韓總，更是象徵著擊倒鴨霸執政黨的希望。","1571748180","https://www.facebook.com/myudn/?ref=nf&hc_ref=ARRdHFYmsnxQPY3R4PucTvHC_7wtp0uLWP8Iyltlsj55ooDr5zSrBbCtwbO0M6XGffE&__xts__%5B0%5D=68.ARCxc-ilGVeSFE3_jp3DSbZgXxvRLtLjWtVs9OZBmd2xVzB9pZ8a5scWIa4bJVfct4JdpJGnywYhJSahchdnzChZ4T82RgvmnP653Xp6TqjZAs0bIil423TNlAE6HNskkECyNj-GwbWb42S32SvqWx7WWGG_lVaxR7xJeGoZ2-yn82r6u1jXT8qaKJE9sCLlsOlW_a6iWSVMERxkWo-752A9xiFPaqovvbKbpxE2jkC9G5cKzizDI5dJIFIJAweruClommXlH-n-gXax8XrfLNNEiJrTqtPQCNksPBqdJp2EIcaeuUxIO3Z6_GLF1iM2HFIKg49vFQPeb8C7bDky-84UrxBQ80CQxwcwMWFJ-0GxPB-YlrU2krcBlE0CZaI0SKtYceXYIVsi0ZfzdIdujGjw6lKHXEAocHIcK5INFZOQxIV0MwjC_KGC0-lZjFrthHM_rYj-kYM8ZgiCr2OsqUp4GYI5yAvkhjb3fl0RRbwj50Sb9Uqmvl3CUgY&__tn__=%3CH-R","https://scontent.feoh3-1.fna.fbcdn.net/v/t1.0-1/p32x32/14606316_10155018227091030_1877634654950041988_n.jpg?_nc_cat=1&_nc_oc=AQkXyLlL1Ovqz7m9_pZ2fFi2AGZWwWdj4qqNyjz4f_BSoVbH2kcDVp1soVpObnwaYnI&_nc_ht=scontent.feoh3-1.fna&oh=df9b53268095a2b7c75bf2096d5f43eb&oe=5E221755","udn.com 聯合新聞網","udn.com 聯合新聞網",""
"https://www.facebook.com/Young.Love.Yunlin/posts/2327983577446135","1549950550","真的很遺憾看到這些原本值得尊敬的長輩們，到現在還在黨內互打。

 講個實在的觀念：

 政黨的定位高於國家機器低於百姓，
如此受命於百姓代為管理國家。

 四年前，百姓因為看不見國民黨對國家社會的功能，而投不下票。

 但現今，因為執政黨無能又驕傲，百姓急於聽到，看到，感受到國民黨的功能與定位，可是卻遲遲看不到。

 現在真的不是瞎鬧的時候。
有目標的候選人，應該積極成立類似影子政府一般的委員會，任命召集人，就各個議題，上至（中華民國）下到（年金），包含能源政策，士農工商，廣納各界賢才參與，甚至從中挖掘未來做事管理國家的人才。

 只有這樣，才會讓人民看到，了解到黨對國家的意義跟功能，並且讓百姓看到國民黨不再是一個封閉政黨。","1571748180","#","https://scontent.fqbx2-1.fna.fbcdn.net/v/t1.0-1/p32x32/52835811_1903265983136067_8665420867020259328_n.jpg?_nc_cat=105&_nc_oc=AQmGlVgY-myvJvq8a8mOJwXFeXn-NcoThgi9sGUTGFJ4BMKkCZaejMyKw4NC14cKqT4&_nc_ht=scontent.fqbx2-1.fna&oh=0fc101a90f8fa63fca7e62f2589679d1&oe=5E1CBB9B","Jime Shou","link",""
"https://www.facebook.com/Young.Love.Yunlin/posts/2216322295278931","1534833772","核能可能是現代文明的墊腳石。
「打太長沒人看，但可以當自我抒發」

 社會學上說，現代已經進入消費性社會，我說，現代社會就是能源社會，誰的能源充足，誰就有更好的發展基礎。
你所生活的環境，你所工作的場所，你所享受的娛樂，都建立在能源消耗上。

 幾年前台灣一窩蜂的恐核，反核，卻沒有人願意認真去了解核電。
核安是每個人都期待的，但我們不能因為恐懼就放棄核能這個相對經濟的能源。
在替代能源發展成足夠效率的穩定能源前，我想我們很難放棄核能。

 記得幾年前我選舉時，遇到一群人，邀請我支持反核，只要我表達立場，他們會不計代價出人出力幫助我選舉。他們很用心，但是理念我無法接受，我婉拒了。

 放到一般人的生活中，大家都可以了解，我們不可能在獲得時不付出代價，不可能又要馬兒跑，又要他不吃草。
但是當上升到政治議題時，又常常有一種，我只要權利跟福利，不要代價跟責任的想法。
舉例投票，不管你支持誰，投票就是參與民主政治的義務，當你不投票，不只放棄了你的權利，相對也是未善盡義務。
只是這種觀念在台灣並不成熟，政治這條路，任重道遠。

 
前幾天我媽傳了一篇李艷秋的視頻給我，講述洪蘭教授在天下雜誌上的專欄「教育少了品格，書念再好也沒用」。裡頭講述未來機器，人工智能發展，各國反而更重視人品的教育，因為AI沒有善惡觀，更需要未來的操作者有更好的價值觀跟人品。
很巧，我大學畢業論文寫的也是相關的議題，我寫教育分為三類「學術教育」「技術教育」「家庭教育」。而其中的家庭教育統合家庭身教環境，社會化，以及品德發展。
越是消費型的社會，因為生活負擔，父母雙薪比例增加，給小朋友的時間越少，台灣也因此發展出大量補教。
但是當學校不再重視公民道德，家庭沒有時間，補教只重學術時，誰來關心孩子的身心發展？

 
台灣的社福也是一樣，只具型態，沒有內涵，被一桿政治人物跟百姓當成是政策牛肉，卻不了解核心內涵。不論是重新分配也好，還是起跑線理論，還是刺激動力。有多少人真正了解如何透過社福工具，由政府盡可能的分配有限的社會資源。

 
真正的目標族群也是常被忽略，不論是長照，各式育兒補助，各種津貼，都是為了幫助家庭中堅份子「社會最有生產力的族群」減輕負擔，鼓勵他們更有效率的把時間跟體力用於有生產價值的人事物上面。這些並非是選舉時拿來政策買票的工具，而是應該有完整的理論，長期執行規劃，才能達到促進社會經濟發展的效果。

 但不論是核能也好，教育也好，社福也好，有多少人了解了？發揮了類似大前研一所提出「質問力」的態度？

 回到核能。
疑惑，所以恐懼；了解，終結恐懼。
希望一個期許自我進步的台灣社會，不要一直停留在疑惑，恐懼的階段。
該結束政治人物唬弄百姓的狀況了。
只有透過選民知識的提升，政治才能真正落實「菁英代議」的現實，才能像委託CEO一樣，要求各領域賢達，就地方發展，國家發展，技術發展，資源分配，人才培育，外交關係等等，發揮出有效管理人的職能。

 愚民政策終將結束，台灣作為一個主權政府，作為一個完整的社會，是否可以等到民智的突破？還是會像歷史中千百個國家政府社會一樣，消失於洪流中。
你我可能只是個體，但是作為一個社會集體，可能我們也正背負著我們自己沒有意識到的責任。

 
我幸與不幸生長在一個政治家庭，我父親書讀的不高，但是他很重道義，重視做人，重誠信。也因為不輕易妥協，所以從過去跟國民黨既合作又對抗，到後來被國民兩黨夾殺，而後又被民進黨修理。

 
自成一格的作風，被不知是褒還是貶的稱為雲林王，可是誰又記得一個連大學都沒讀的人，在短短的五年縣長期間，做了多少雲林的重大建設、醫院、高鐵、水庫、幾個工業區、虎尾星巴克，誠品的建築保留、斗六的圓環棒球場、斗南的田徑場、北港的媽祖大橋、與他照顧雲林長者的三節獎金（被當時農委會要求停辦）、農民遇到災損時堅決的補助保護（被監察後，因一句「我身為縣長，不保護縣農民要保護誰」由監察委員親自恭送出監察院）等等。更多我都不知道，但偶爾會有民眾跟我說，你知道為什麼我家支持你們嗎？
因為過去你爸爸做了什麼建設，又或幫助了我什麼東西，等等，這樣的故事。

 雖然他現在委屈了，但是他對我說，委屈也要面對，他問心無愧。而且告訴我：「要賺錢好好去學專業做生意，當政不能與縣民奪利」。
而政敵長期罵他黑道，他又能挖苦自己：（又沒欺負過百姓，無代無志被罵的越來越「慶」）。
還對初出社會的我提醒：（做事前，先學會做人。政治就是「作郎代」）。

 
還有很多很多的故事，無法一口氣說完。但，我想各位都是父母，或許我不久也會成為父親。這樣的言傳身教，您是可以認同的。而這就是張榮味的本質。年輕時他幫家裡務過農，學過縫西裝，做給板模砌過磚。也曾因為幫朋友，與人「拼堵」受傷。有了孫子後，又變成一個慈祥可愛，又愛逗孫子生氣，卻又擔心小朋友上學做功課，有沒有好好交朋友的爺爺。但這不就是一個真實的人生嗎？

 回歸到原本的話題，核能，畢竟不是現在的技術可以輕易放棄的選項，我們只能更理智的要求專家就技術與安全做出相對應的品質。
當我們認真的面對未知，努力的去了解，或許，群眾的恐懼會化為社會進步改變的動力。但是當我們人云亦云，就會給壞人可趁之機，而我們沒辦法假設每個人都是好人，因為人很特別，是從無數個單一決定形成，而每個決定都會受觀念，品格影響。我們只能盡可能的在做選擇時不違背自己的良心。
或許，這也就是父親叮囑的「作郎代」的涵義吧。","1571748180","https://l.facebook.com/l.php?u=http%3A%2F%2Fwww.storm.mg%2Farticle%2F477100&h=AT0_Q04JY9dSstUXBDGh5c-HSzApyRz53p0Q1x4HUuIUQ-dAfeLuzmflXLi7ydX1nbVc0uJJIRKo3MgWL-hot_P6zaMK8-hSS4x91Q8VNlT9sPMtPBUJ0_1fzNIPv3rL1SQBzSwIPpy3WbTTAooU10tataN-v5GZ0ZqGL6S87iyAM2osddLLszGBbe88J6vyQcaRPqiuKxrkVPs5iP1DzQBbEs5vIYvh68lB1zJmRVzRBdePFc_PjioeU-yd_3C1ltaRdMs87y0ibSw7ZNrrRsEEaukjkHVImatYlJ6tlBfSGEoCEw6fq6zxdAv37PqjCI32g-Gm5-YnsT7XCeeq7OEJpV1O_4Bk8ZzESjQRFwVyop_46VPZI_16KplK5G7gxe3BKGzmUYiWv4KfDZFbR_hb9KdOuc-8U7ov1er5mo9zND1qNpTQIo-yHjl3wPMQXInQKXAyNG5bst7m8Q0OHeDdUblSy0nFebUnmrF_nZlpXA5FewIQEjUIsb-6TWV706Bt5_NwwkW9-7w1Q1UbTXOTRZLXTVbMX-6GfP5fyTUhyxWApmVZ4luBH-D71bQQRc2AlliQPUQUj1teS3xxcB7BPltwsze6VXvTpVPFgIMhS7UwdckxVdw94sKc4A-99R-Z5yDfhCS47Iic4qE","https://external-sin2-2.xx.fbcdn.net/safe_image.php?d=AQC8H6hgl9fxAuM2&w=540&h=282&url=http%3A%2F%2Fimage.cache.storm.mg%2Fstyles%2Fsmg-800x533-fp%2Fs3%2Fmedia%2Fimage%2F2017%2F12%2F23%2F20171223-102433_U1004_M362026_fc31.jpg%3Fitok%3DhPb2-yQf&cfs=1&upscale=1&fallback=news_d_placeholder_publisher&_nc_hash=AQA4HWQp7QzmHuzl","核四廠前1、2號機各約800多束燃料棒分別以乾式、濕式貯存。（圖片來源：台電公司）","風傳媒",""
"https://www.facebook.com/Young.Love.Yunlin/posts/2024308264480336","1508590061","連發兩篇，只是想說個想法。
記得曾經聽我敬愛的學長說過：
創新是把現有的東西整合，不是無中生有的發明。舉Uber為例，就是移動裝置，網路，軟體，跟計程車的結合。
但是在台灣，每每遇到創新，第一個難題就是法令限制。理由很多，有人為，有官僚。
但是在台灣，常常聽到民主自由，但實質作為卻是希望大政府介入管控，市場都不市場。
大政府小政府各有利弊，也有不同需求的時代背景，但是台灣對政治邏輯的認知與實踐卻急需要得到提升。
才不會一直發生行政立法鬼打牆的戲碼。
也就是不會口嫌體正直的兩套標準。
有得必有失，只有理性務實專業的審視，平衡得失，福利再分配。才是現代國家最重要的核心功能。","1571748180","/agritruth/photos/a.1540213819523372/2013886982156051/?type=3&eid=ARD7DigAYt9LNxNxoCyi_Z9_Te9m8DTAA4708-CuoLPnEyvQQ92_Y_ScUeAIhmkNIPegZaByO1K6Xx-R&__xts__%5B0%5D=68.ARCzp3mnX-sEDO3Jy7lUuX2XNBspNPP1tUJU1AksIkje7drOt9sNj4twRxwu_CKc50Jljlv6taUS2XpTBm29WYGd05zBZea01cLWZi5b_3BmwXl62hEo6UfuMBkyf80AwN9TlZRLxFLYciwihvq4KdgB0l9gjV5gE49TwKYPs-CeOQLyLEbzurOrNqwHDU-_sABgbTUbBH_Bhk_ZOBhkZ35SncOJyIpyyyRhDjurfdzBloFcl0joNw-mPHyjQzQlz55fDb4euFZpUwbooZe3nAl78KEb3wRfeRD3i3u8FiCz4HrzqO1w7MREbOLWbrBGqP-jiXkns6s1D9NMp4pNsmRfcndJkMgKmgQEPvJwJFOk0Ktw5CGonoiKOk8xg_CfouusZ__QkOXsvXbiIuYVrB07NqlZclo8lLtsCXFtI9yB9DdjcywO6ENfV33Dt69ulL80POKYv0F1N1DgiPR7vTGWDPmG4sGEn93IIrTelV6psWFAJpI06bDk_IaKpA&__tn__=EEHH-R","https://scontent-sin6-2.xx.fbcdn.net/v/t31.0-0/p526x296/22550136_2013886982156051_1698458125946025903_o.jpg?_nc_cat=107&_nc_oc=AQkSFavbFGHdLMKJTXS-5pFG-yfjj6N-zrw5dkgi2Tvq7l34KS2b8zvurveVLOsZFKg&_nc_ht=scontent-sin6-2.xx&oh=0a34dc8fef0ba008fbda32cafaa6e39f&oe=5E173988","undefined","文青別鬼扯",""
"https://www.facebook.com/Young.Love.Yunlin/posts/2136666596577835","1527840372","以核養綠，真愛台灣。

 綠能實為替代能源。

 只有以核養綠，才能平衡電價，穩定發電，減少空染，免於缺電。","1571748180","/permalink.php?story_fbid=1927069907623803&id=1918986055098855&__xts__%5B0%5D=68.ARDZfK35uHQobejgVTDIRpu07_-4yGdkXzdqSwmFnRWVwwvkK7KVOGXUNQALxufKSOTaqqIi0TFk7BzHX5-lmHM6Cb1AKs6fsjD5gBzHiDwFCh0nkDExZKV0rfofDy4L_aHvs225XDPDaSHU1dt2TNPCNQQvfStskbq2R3roVbkSIdmWs1fjHZ5-g84ILbhCWIjjR4VcmFvg8shwXLJm23XYrL6I1VNb89r7FpYKvjxAb8R-d3GYF9UggPCu-fZfRVZ-idEE8G4lMTQEvHrYZS5axx36I5kKso36f66g0R_jciH0lMlR6TYvnUQjE-_TtxAFuSXOfHgHVOVCihVfPptdIIwWZxNexfw9Qt6Y6XGkk2jyJVbRTlroRgchuoQ4HDBh92d1IGnIfVmbj5eJMl8ian1hR63Zso8yANgmApk2iIGhprOBlh8iYTSdL3pj9qgzL__Iv2ItM0ZEIsaaojum4euvNNHkWba3Epu-1MS4H4xf0seHpV-i-g&__tn__=H-R","https://scontent-hkg3-1.xx.fbcdn.net/v/t1.0-1/p32x32/34342297_1944497809214346_333780192247939072_n.jpg?_nc_cat=107&_nc_oc=AQn6WTmf1r_x3R3h876i-pcS8bMuiGX6M4e3gI7DdAHsUpFwAOZ3_uohG-pKodCSu_k&_nc_ht=scontent-hkg3-1.xx&oh=e53fb013ac678e0d6e6f8b76cc905a8d&oe=5E1CA951","核四商轉公投","核四商轉公投",""
"https://www.facebook.com/Young.Love.Yunlin/posts/2013231542254675","1506407535","小地方或許發不出大聲音，但我們的風格是做實實在在的事情。

 保護最弱勢是社福保護網的概念。
「艱苦人條款」的通過是很多無名英雄的共同志業。

 或許就是在雲林這個地方，這個北部人口中的鄉下，才更有那種互相關心互相幫助的心情跟機會。鄉土情，人親土親。

 鄉下的親切感。","1571748181","https://l.facebook.com/l.php?u=http%3A%2F%2Fwww.chinatimes.com%2Frealtimenews%2F20170527002088-260402&h=AT1Nu_uzXLLNc6opgaFHvLfocvzHeBqWCp77qbKXWle8iCtfgLfcKtOGu25YlHiBcyaZIEJVDnxdqGbPiI1xhG3ADYdjcMWlAZmpemjxMxzPjt0eQhDyEZxFeoCVBGKoOYFMcr_RShoARthxgQhCTGYQC3uMElNyQs9Wp_HePhJMR5VL6ha7g5YcC9tX_vawe3NzAGxCsy-wxlprIYDLVcRYVClMWfAJVNM7QTipOqmj_N1PdQDoRUWdCHEDdpcCaJGPgOqmZi6IsbL6c1tCd_x-ifLZlhEoZdT2V7ug0q_HqKOnnMoqHNlcN3YewPn1Y1T_FdMhfQaYKXNaG6y9CMlhaz8_hzxPxzaGCNtBztjBVtATAJLBEmmP643fgrKel74yudorUAF8-lpIYlHjZsQE2-UHMp-3b-mMQALf8D25FJjyvDwPbN4iIBTtbJYBxK5NuMxPKC-j-rLMEUF1X1eKTMykxPilr0Q0tN4IPYZtl-yd_EAugAg0w-W4FM9OSYJ3HWzUXfdEvaC4fEjkcrG9D6ApZ5t5PZa1hiIdpTfL42dRCIK2sy8nmFctr-jxYAO8cWuRclWeSp-XDsddeuysj1iUO_IwoLIzNT5yb4GCHUscmqnMgi_-_5pTsJOXKhk99o02Qz6GGRwP6nw","https://external.fmaa1-2.fna.fbcdn.net/safe_image.php?d=AQDys869fD7W0Jfq&w=540&h=282&url=http%3A%2F%2Fimg.chinatimes.com%2Fnewsphoto%2F2017-05-27%2F656%2F20170527002089.jpg&cfs=1&upscale=1&fallback=news_d_placeholder_publisher&_nc_hash=AQDU2X4HprUuPnQv","小人物大英雄  夜市小贩催生「艰苦人条款」三读通过","雲林夜市小販催生「艱苦人條款」 三讀通過","小人物大英雄，雲林縣一群夜市小販組成的「夜市慈愛會」從捐款幫助無錢下葬的窮苦人，繼而推動修法使全國各縣市低收入戶的塔位及火化費用都全免，歷經4年奔走，26日立院三讀通過，這群夜市小販聽到好消息激動到差點哭。簡稱「艱苦人條款」的「殯葬管理條例增訂第21條之一」26日修正通過，低收入戶使用公立殯葬設施如火葬場、靈骨塔等，免收使用管理相關費用，將使全國16萬戶低收入戶，尊嚴走人生最後一程。雲林夜市慈愛會的召集…"
"https://www.facebook.com/Young.Love.Yunlin/posts/2410576232520202","1560594003","韓家軍辛苦了！ 韓國瑜加油！

 我雖然出身政治家庭，但是我一直由衷的希望民眾可以關心政治，為中華民國，為台灣的發展未來盡一份心力。因為參與是民主政治的核心精神。

 
這四年來，民進黨執政，他們用實際的行動表示，他們真正在意的不是台灣人民的福祉，而是他們的權與利。所以我們看到了各式各樣與民心向背的政策，從勞動基準法的ㄧ例一休，到能源政策的離岸風力發電，到兩性的同婚等，罄竹難書。

 這一次，我們有了一個敢於直言，有足夠能力與執政黨的雙重標準以及無所不用其極的選舉奧步抗衡的候選人，為民眾這幾年的委屈發出了聲音。

 這是一次抗戰，台灣天空瀰漫的不是共產主義的威脅，而是越來越極端的極權執政黨，有人說這是台灣的法西斯主義罪惡。

 真正的民主絕對不是被單一族群掌握話語權就叫做民主，不是執政黨用盡手段掌握媒體就叫做民主。

 只有行動，民主才會真正意義的存在人民手中。只有行動，網路上1450的壓迫才會崩潰。

 韓家軍的遠征今天回到雲林，祝福你們一切順利。維持熱情，維持理性，襄助韓國瑜，讓他可以為中華民國台灣奮鬥。","1571748181","/watch/?ref=external&v=480304639451129&__xts__%5B0%5D=68.ARCMQnPJ1gfK6QcSI63Mp8mwTYzF7_xL4BwzcHuMMJiVTqL2_S531v6NgonyEljxyKfn_yQ1HHfJyd52RxZbXZKS10ObF8iBKXb7J6dq9bC6R54rTDT949bT7o3wdjYjhszfr56pYaEAZ9Vl4MXX0XD93K6erhyJFv6nEITFL-V5QFZNGmKMfTzGNlgLwO--2qmAm7oi1sjlViYs06XWKDrBupTnF-PyeBU4aE_rHE-kAXkYXc1XqDZ40FlZoq3fOQdXnxMOxVE3lT069-xqu2IGqYeMDv7C0ypyZEEKCRut6iIfJLWSrA9MOPTV2mn_0Z-ML5QjK_Sy6vbRdAlBsbLs7y1qD7fCc8ljxgPmv9kRVwW5Br3hx0QD1KS3oQLWsGi8VpQHn_7_TLfoTqWsEkyypzSIbElPxR78Qb7sY24cRMADdU1ZUDP1QiBI6wtrsoe5WbhEW6KPNrt5eQBI6iVgouwjPauCpxDKxhUnC47oCenKmICGmSJW8d_AxFSMEgc&__tn__=kFFHHH-R","https://scontent-cdg2-1.xx.fbcdn.net/v/t15.5256-10/61674668_480335669448026_5939459331031302144_n.jpg?_nc_cat=110&_nc_oc=AQmS98fP7MXTnnParIlUZX3KVgcj6WNJS-pUENRXZOwTwY45kdMC-sQuTvHVADLH3JM&_nc_ht=scontent-cdg2-1.xx&oh=be33a9cdbb0cebdf6f3aa840e4d32fc6&oe=5E6297A4","undefined","LIVE／雲林女婿後頭厝來相挺　韓國瑜斗六造勢大會","Posted by ETtoday新聞雲"
